"0712.2545","Thomas Watson","Dieter van Melkebeek and Thomas Watson","A Quantum Time-Space Lower Bound for the Counting Hierarchy","25 pages",,,,"quant-ph",,"  We obtain the first nontrivial time-space lower bound for quantum algorithms
solving problems related to satisfiability. Our bound applies to MajSAT and
MajMajSAT, which are complete problems for the first and second levels of the
counting hierarchy, respectively. We prove that for every real d and every
positive real epsilon there exists a real c>1 such that either: MajMajSAT does
not have a quantum algorithm with bounded two-sided error that runs in time
n^c, or MajSAT does not have a quantum algorithm with bounded two-sided error
that runs in time n^d and space n^{1-\epsilon}. In particular, MajMajSAT cannot
be solved by a quantum algorithm with bounded two-sided error running in time
n^{1+o(1)} and space n^{1-\epsilon} for any epsilon>0. The key technical
novelty is a time- and space-efficient simulation of quantum computations with
intermediate measurements by probabilistic machines with unbounded error. We
also develop a model that is particularly suitable for the study of general
quantum computations with simultaneous time and space bounds. However, our
arguments hold for any reasonable uniform model of quantum computation.
","[{""version"":""v1"",""created"":""Sat, 15 Dec 2007 23:58:17 GMT""}]","2007-12-18"
"0712.2546","Louis H. Kauffman","Louis H. Kauffman","An Extended Bracket Polynomial for Virtual Knots and Links","60 pages, 55 figures, LaTeX document",,,,"math.GT","http://arxiv.org/licenses/nonexclusive-distrib/1.0/","  This paper defines a new invariant of virtual knots and links that we call
the extended bracket polynomial, and denote by <<K>> for a virtual knot or link
K. This invariant is a state summation over bracket states of the oriented
diagram for K. Each state is reduced to a virtual 4-regular graph in the plane
and the polynomial takes values in the module generated by these reduced graphs
over the ring Q[A,A^{-1}]. The paper is relatively self-contained, with
background information about virtual knots and long virtual knots. We give
numerous examples applying the extended bracket, including a new proof of the
non-triviality of the Kishino diagram and the flat Kishino diagram and
non-classicality of single crossing virtualizations. The paper has a section on
the estimation of virtual crossing number using the extended bracket state sum.
Examples are given of virtual knots with arbitrary minimal embedding genus and
arbitrarily high positive difference between the virtual crossing number and
the minimal embedding genus. A simplification of <<K>> is introduced and
denoted by A[K]. This simplified extended bracket, the arrow polynomial, is a
polynomial in an infinite set of variables. It is quite strong (detecting the
flat Kishino diagram for example) and easily computable. The paper contains a
description of a computer algorithm for A[K] and uses the arrow polynomial, in
conjunction with the extended bracket polynomial to determine the minimum genus
surfaces on which some virtual knots can be represented.
","[{""version"":""v1"",""created"":""Sat, 15 Dec 2007 23:59:28 GMT""},{""version"":""v2"",""created"":""Sat, 29 Dec 2007 08:56:37 GMT""},{""version"":""v3"",""created"":""Tue, 22 Apr 2008 06:07:20 GMT""},{""version"":""v4"",""created"":""Sun, 5 Oct 2008 06:20:26 GMT""},{""version"":""v5"",""created"":""Thu, 23 Apr 2009 05:42:50 GMT""}]","2009-04-23"
"0712.2547","Tijmen Euser","T. G. Euser, J. S. Y. Chen, N. J. Farrer, M. Scharrer, P. J. Sadler,
  P. St.J. Russell","Quantitative broadband chemical sensing in air-suspended solid-core
  fibers",,"J. Appl. Phys. 103, 103108 (2008)","10.1063/1.2924408",,"physics.optics",,"  We demonstrate a quantitative broadband fiber sensor, based on evanescent
field sensing in the cladding holes of an air-suspended solid-core photonic
crystal fiber. We discuss the fabrication process, together with the
structural- and optical characterization of a range of different fibers.
Measured mode profiles are in good agreement with finite element method
calculations made without free parameters. The fraction of the light in the
hollow cladding can be tuned via the core diameter of the fiber. Dispersion
measurements are in excellent agreement with theory and demonstrate tuning of
the zero dispersion wavelength via the core diameter. Optimum design parameters
for absorption sensors are discussed using a general parameter diagram. From
our analysis, we estimate that a sensitivity increase of three orders of
magnitude is feasible compared to standard cuvette measurements. Our study
applies to both liquid and gas fiber sensors. We demonstrate the applicability
of our results to liquid chemical sensing by measuring the broad absorption
peak of an aqueous nickel chloride solution. We find striking agreement with
the reference spectrum measured in a standard cuvette, even though the sample
volume has decreased by three orders of magnitude. Our results demonstrate that
air-suspended solid-core PCFs can be used in quantitative broadband chemical
sensing measurements.
","[{""version"":""v1"",""created"":""Sun, 16 Dec 2007 00:07:19 GMT""}]","2008-07-24"
"0712.2548","Juan Manuel Borrero","J.M. Borrero, B.W. Lites, S.K. Solanki","Evidence of magnetic field wrapping around penumbral filaments","4 pages, 3 figures (2 color); accepted for publication in A&A
  Letters. Special number of Hinode",,"10.1051/0004-6361:20079002",,"astro-ph",,"  We employ high-spatial resolution spectropolarimetric observations from the
Solar Optical Telescope on-board the Hinode spacecraft to investigate the fine
structure of the penumbral magnetic fields. The Stokes vector of two neutral
iron lines at 630 nm is inverted at every spatial pixel to retrieve the
depth-dependence of the magnetic field vector, line-of-sight velocity and
thermodynamic parameters. We show that the azimuthal angle of the magnetic
field vector has opposite sign on both sides above the penumbral filaments.
This is consistent with the wrapping of an inclined field around the horizontal
filaments. The wrapping effect is stronger for filaments with larger horizontal
extensions. In addition, we find that the external magnetic field can penetrate
into the intraspines, leading to non-radial magnetic fields inside them. These
findings shed some light on the controversial small-scale structure of the
sunspot penumbra.
","[{""version"":""v1"",""created"":""Sun, 16 Dec 2007 00:14:09 GMT""}]","2009-11-13"
"0712.2549","Jun Zhang","James J. Zhang, Jun Zhang","Double Ore Extensions",,,,,"math.RA",,"  A double Ore extension is a natural generalization of the Ore extension. We
prove that a connected graded double Ore extension of an Artin-Schelter regular
algebra is Artin-Schelter regular. Some other basic properties such as the
determinant of the DE-data are studied. Using the double Ore extension, we
construct 26 families of Artin-Schelter regular algebras of global dimension
four in a sequel paper.
","[{""version"":""v1"",""created"":""Sun, 16 Dec 2007 00:32:31 GMT""}]","2007-12-18"
"0712.2550","Jun Zhang","James J. Zhang, Jun Zhang","Double Extension Regular Algebras of Type (14641)",,,,,"math.RA",,"  We construct several families of Artin-Schelter regular algebras of global
dimension four using double Ore extension and then prove that all these
algebras are strongly noetherian, Auslander regular, Koszul and Cohen-Macaulay
domains. Many regular algebras constructed in the paper are new and are not
isomorphic to either a normal extension or an Ore extension of an
Artin-Schelter regular algebra of global dimension three.
","[{""version"":""v1"",""created"":""Sun, 16 Dec 2007 00:37:08 GMT""}]","2007-12-18"
"0712.2551","Jun Zhang","Jun Zhang","Artin-Schelter Regular Algebras, Subalgebras, and Pushouts",,,,,"math.RA","http://arxiv.org/licenses/nonexclusive-distrib/1.0/","  Take $A$ to be a regular quadratic algebra of global dimension three. We
observe that there are examples of $A$ containing a dimension three regular
cubic algebra $C$. If $B$ is another dimension three regular quadratic algebra,
also containing $C$ as a subalgebra, then we can form the pushout algebra $D$
of the inclusions $i_1:C\hookrightarrow A$ and $i_2:C\hookrightarrow B$. We
show that for a certain class of regular algebras $C\hookrightarrow A,B$, their
pushouts $D$ are regular quadratic algebras of global dimension four.
Furthermore, some of the point module structures of the dimension three
algebras get passed on to the pushout algebra $D$.
","[{""version"":""v1"",""created"":""Sun, 16 Dec 2007 00:42:05 GMT""},{""version"":""v2"",""created"":""Thu, 2 Sep 2010 18:22:49 GMT""}]","2010-09-03"
"0712.2552","Yeow Meng Chee","Yeow Meng Chee, Alan C. H. Ling, San Ling, and Hao Shen","The PBD-Closure of Constant-Composition Codes","8 pages","IEEE Transactions on Information Theory, vol. 53, No. 8, August
  2007, pp. 2685-2692","10.1109/TIT.2007.901175",,"cs.IT cs.DM math.CO math.IT",,"  We show an interesting PBD-closure result for the set of lengths of
constant-composition codes whose distance and size meet certain conditions. A
consequence of this PBD-closure result is that the size of optimal
constant-composition codes can be determined for infinite families of parameter
sets from just a single example of an optimal code. As an application, the size
of several infinite families of optimal constant-composition codes are derived.
In particular, the problem of determining the size of optimal
constant-composition codes having distance four and weight three is solved for
all lengths sufficiently large. This problem was previously unresolved for odd
lengths, except for lengths seven and eleven.
","[{""version"":""v1"",""created"":""Sun, 16 Dec 2007 01:02:12 GMT""}]","2007-12-18"
"0712.2553","Yeow Meng Chee","Yeow Meng Chee and Charles J. Colbourn","Constructions for Difference Triangle Sets","4 pages","IEEE Transactions on Information Theory, vol. 43, No. 4, July
  1997, pp. 1346-1349",,,"cs.IT cs.DM math.CO math.IT",,"  Difference triangle sets are useful in many practical problems of information
transmission. This correspondence studies combinatorial and computational
constructions for difference triangle sets having small scopes. Our algorithms
have been used to produce difference triangle sets whose scopes are the best
currently known.
","[{""version"":""v1"",""created"":""Sun, 16 Dec 2007 01:17:35 GMT""}]","2007-12-18"
"0712.2554","K. R. Goodearl","K. R. Goodearl","Leavitt path algebras and direct limits","23 pages; amstex; 3 xypic figures",,,,"math.RA",,"  An introduction to Leavitt path algebras of arbitrary directed graphs is
presented, and direct limit techniques are developed, with which many results
that had previously been proved for countable graphs can be extended to
uncountable ones. Such results include characterizations of simplicity,
characterizations of the exchange property, and cancellation conditions for the
K-theoretic monoid of equivalence classes of idempotent matrices.
","[{""version"":""v1"",""created"":""Sun, 16 Dec 2007 01:17:57 GMT""}]","2007-12-18"
"0712.2555","Ujjal Debnath","Subenoy Chakraborty and Ujjal Debnath","Shell Crossing Singularities in Quasi-Spherical Szekeres Models","10 latex pages, RevTex style, no figures","Grav.Cosmol.14:184-189,2008","10.1134/S0202289308020102",,"gr-qc",,"  We investigate the occurrence of shell crossing singularities in
quasi-spherical Szekeres dust models with or without a cosmological constant.
We study the conditions for shell crossing singularity both from physical and
geometrical point of view and they are in agreement.
","[{""version"":""v1"",""created"":""Sun, 16 Dec 2007 02:45:15 GMT""}]","2009-11-13"
"0712.2556","Christian Buth","Robin Santra, Christian Buth, Emily R. Peterson, Robert W. Dunford,
  Elliot P. Kanter, Bertold Kr\""assig, Stephen H. Southworth, Linda Young","Strong-field control of x-ray absorption","8 pages, 5 figures, 1 table, LaTeX","J. Phys.: Conf. Ser. 88, 012052 (2007) (8 pages)","10.1088/1742-6596/88/1/012052",,"physics.atom-ph physics.chem-ph physics.optics",,"  Strong optical laser fields modify the way x rays interact with matter. This
allows us to use x rays to gain deeper insight into strong-field processes.
Alternatively, optical lasers may be utilized to control the propagation of x
rays through a medium. Gas-phase systems are particularly suitable for
illustrating the basic principles underlying combined x-ray and laser
interactions. Topics addressed include the impact of spin-orbit interaction on
the alignment of atomic ions produced in a strong laser field,
electromagnetically induced transparency in the x-ray regime, and laser-induced
alignment of molecules.
","[{""version"":""v1"",""created"":""Sun, 16 Dec 2007 05:23:22 GMT""}]","2013-03-25"
"0712.2557","Wenfeng Chen WFC","W.F. Chen","A Note on the Radiatively Induced Lorentz and CPT Violated
  Chern-Simons-like Term in the Extended Quantum Electrodynamics","9 pages, RevTex 4, no figure, some misprints are corrected",,,,"hep-th","http://arxiv.org/licenses/nonexclusive-distrib/1.0/","  We show that the ambiguity for the Chern-Simons-like term induced from
quantum correction in the extended QED should have nothing to do with the
approximation on the exact fermionic propagator, contradictory to the claim in
Ref.[19]. Further, we investigate the induced Chern-Simons-like term using the
original 't Hooft-Veltman dimensional regularization and reproduce the result
obtained by gauge symmetry analysis. This fact demonstrates that the origin of
the ambiguity should lie in different choices on regularization schemes.
","[{""version"":""v1"",""created"":""Sun, 16 Dec 2007 06:13:00 GMT""},{""version"":""v2"",""created"":""Thu, 9 Jul 2009 23:42:34 GMT""}]","2009-07-10"
"0712.2558","Rochus Klesse","Rochus Klesse","A random-coding based proof for the quantum coding theorem","25 pages, to appear in Open Systems and Information Dynamics",,,,"quant-ph",,"  We present a proof for the quantum channel coding theorem which relies on the
fact that a randomly chosen code space typically is highly suitable for quantum
error correction. In this sense, the proof is close to Shannon's original
treatment of information transmission via a noisy classical channel.
","[{""version"":""v1"",""created"":""Sun, 16 Dec 2007 07:35:44 GMT""}]","2007-12-18"
"0712.2559","Glenn Merlet","Glenn Merlet (LIAFA)","Cycle time of stochastic max-plus linear systems","This article has been published by IMS in Electronic Journal of
  Probability at http://www.math.washington.edu/~ejpecp/viewarticle.php?id=1781","Electronic Journal of Probability 13 (2008) (2008) Paper 12,
  322-340",,,"math.PR cs.DM",,"  We analyze the asymptotic behavior of sequences of random variables defined
by an initial condition, a stationary and ergodic sequence of random matrices,
and an induction formula involving multiplication is the so-called max-plus
algebra. This type of recursive sequences are frequently used in applied
probability as they model many systems as some queueing networks, train and
computer networks, and production systems. We give a necessary condition for
the recursive sequences to satisfy a strong law of large numbers, which proves
to be sufficient when the matrices are i.i.d. Moreover, we construct a new
example, in which the sequence of matrices is strongly mixing, that condition
is satisfied, but the recursive sequence do not converges almost surely.
","[{""version"":""v1"",""created"":""Sun, 16 Dec 2007 07:54:35 GMT""},{""version"":""v2"",""created"":""Tue, 11 Mar 2008 20:04:21 GMT""}]","2008-03-12"
"0712.2560","Yigal Shamir","Claude Bernard, Maarten Golterman, Yigal Shamir","Effective field theories for QCD with rooted staggered fermions","Minor changes, few references added; RevTeX, 35 pages","Phys.Rev.D77:074505,2008","10.1103/PhysRevD.77.074505",,"hep-lat",,"  Even highly improved variants of lattice QCD with staggered fermions show
significant violations of taste symmetry at currently accessible lattice
spacings. In addition, the ""rooting trick"" is used in order to simulate with
the correct number of light sea quarks, and this makes the lattice theory
nonlocal, even though there is good reason to believe that the continuum limit
is in the correct universality class. In order to understand scaling
violations, it is thus necessary to extend the construction of the Symanzik
effective theory to include rooted staggered fermions. We show how this can be
done, starting from a generalization of the renormalization-group approach to
rooted staggered fermions recently developed by one of us. We then explain how
the chiral effective theory follows from the Symanzik action, and show that it
leads to ""rooted"" staggered chiral perturbation theory as the correct chiral
theory for QCD with rooted staggered fermions. We thus establish a direct link
between the renormalization-group based arguments for the correctness of the
continuum limit and the success of rooted staggered chiral perturbation theory
in fitting numerical results obtained with the rooting trick. In order to
develop our argument, we need to assume the existence of a standard
partially-quenched chiral effective theory for any local partially-quenched
theory. Other technical, but standard, assumptions are also required.
","[{""version"":""v1"",""created"":""Sun, 16 Dec 2007 08:09:03 GMT""},{""version"":""v2"",""created"":""Fri, 7 Mar 2008 01:31:00 GMT""}]","2008-11-26"
"0712.2561","Andre\u{i} Sobolevski\u{i}","Roya Mohayaee and Andrei Sobolevskii","The Monge-Amp\`ere-Kantorovich approach to reconstruction in cosmology","6 pages, 2 figures; based on an invited lecture at the conference
  ""Euler's Equations: 250 Years On"" (see http://www.obs-nice.fr/etc7/EE250/);
  to be published in a special issue of Physica D containing the proceedings of
  that conference","PhysicaD237:2145-2150,2008","10.1016/j.physd.2008.01.007",,"astro-ph",,"  Motion of a continuous fluid can be decomposed into an ""incompressible""
rearrangement, which preserves the volume of each infinitesimal fluid element,
and a gradient map that transfers fluid elements in a way unaffected by any
pressure or elasticity (the polar decomposition of Y. Brenier). The Euler
equation describes a system whose kinematics is dominated by the incompressible
rearrangement. The opposite limit, in which the incompressible component is
negligible, corresponds to the Zel'dovich approximation, a model of motion of
self-gravitating fluid in cosmology.
  We present a method of approximate reconstruction of the large-scale proper
motions of matter in the Universe from the present-day mass density field. The
method is based on recovering the corresponding gradient transfer map. We
discuss its algorithmics, tests of the method against mock cosmological
catalogues, and its application to observational data, which result in tight
constraints on the mean mass density Omega_m and age of the Universe.
","[{""version"":""v1"",""created"":""Sun, 16 Dec 2007 13:22:35 GMT""}]","2008-11-26"
"0712.2562","Tian De Cao","Tian De Cao","A new model and its physics","5pages",,,,"physics.gen-ph","http://arxiv.org/licenses/nonexclusive-distrib/1.0/","  The high temperature superconductivity in cuprate materials1 has puzzled
scientists over twenty years. We must find a new way to understand
superconductivity. It is found the spin-charge correlation may dominate the
superconductivity2, and we base our judgment upon the features of various
superconductors. Thus we presented the idea that superconductivity could be
described by correlations. To develop this idea into a quantitative theory, the
first work is to give a model and show that various superconductivities can be
included in this model. Moreover, superconductivity can originate from the
spin-singlet pairing3 or from the spin-triplet pairing4. The spin-singlet
pairing favors to appear at the border of antiferromagnetism5, while the
spin-triplet pairing favors to appear at the border of ferromagnetism6. The
coexistence between superconductivity and magnetism is also possible7,8.
Therefore, the second work is to reveal the relation between superconductivity
and magnetism.
","[{""version"":""v1"",""created"":""Sun, 16 Dec 2007 09:50:40 GMT""},{""version"":""v2"",""created"":""Sat, 26 Jul 2008 06:33:08 GMT""},{""version"":""v3"",""created"":""Sat, 11 Apr 2009 10:25:37 GMT""}]","2009-04-11"
"0712.2563","Rui Guo","Rui Guo and Hong Guo","Atom--photon momentum entanglement with quantum interference","4 pages, 4 figures",,,,"quant-ph",,"  With quantum interference of two-path spontaneous emissions, we propose a
novel scheme to coherently control the atom--photon momentum entanglement
through atomic internal coherence. A novel phenomenon called ``momentum phase
entanglement'' is reported, and we found, under certain conditions, that more
controllable entangled state can be produced with super--high degree of
entanglement.
","[{""version"":""v1"",""created"":""Sun, 16 Dec 2007 10:17:47 GMT""}]","2007-12-18"
"0712.2564","Mark Perel'man","Mark E. Perel'man, Galina M. Rubinstein and Vitali A. Tatartchenko","Mechanisms of Dendrites Occurrence during Crystallization: Features of
  the Ice Crystals Formation","6 pages",,"10.1016/j.physleta.2008.03.009",,"physics.ao-ph physics.gen-ph",,"  Dendrites formation in the course of crystallization presents very general
phenomenon, which is analyzed in details via the example of ice crystals growth
in deionized water. Neutral molecules of water on the surface are combined into
the double electric layer (DEL) of oriented dipoles; its field reorients
approaching dipoles with observable radio-emission in the range of 150 kHz. The
predominant attraction of oriented dipoles to points of gradients of this field
induces dendrites growth from them, e.g. formation of characteristic form of
snowflakes at free movement of clusters through saturated vapor in atmosphere.
The constant electric field strengthens DELs' field and the growth of
dendrites. Described phenomena should appear at crystallization of various
substances with dipole molecules, features of radio-emission can allow the
monitoring of certain processes in atmosphere and in technological processes.
Crystallization of particles without constant moments can be stimulated by DELs
of another nature with attraction of virtual moments of particles to gradients
of fields and corresponding dendrites formation.
","[{""version"":""v1"",""created"":""Sun, 16 Dec 2007 10:29:06 GMT""},{""version"":""v2"",""created"":""Fri, 29 Feb 2008 18:27:29 GMT""}]","2009-11-13"
"0712.2565","Hans De Raedt","Hans De Raedt, Koen De Raedt, Kristel Michielsen, Koenraad Keimpema,
  and Seiji Miyashita","Event-based computer simulation model of Aspect-type experiments
  strictly satisfying Einstein's locality conditions",,"J. Phys. Soc. Jpn. 76, 104005 (2007)","10.1143/JPSJ.76.104005",,"quant-ph",,"  Inspired by Einstein-Podolsky-Rosen-Bohm experiments with photons, we
construct an event-based simulation model in which every essential element in
the ideal experiment has a counterpart. The model satisfies Einstein's criteria
of local causality and does not rely on concepts of quantum and probability
theory. We consider experiments in which the averages correspond to those of a
singlet and product state of a system of two $S=1/2$ particles. The data is
analyzed according to the experimental procedure, employing a time window to
identify pairs. We study how the time window and the passage time of the
photons, which depends on the relative angle between their polarization and the
polarizer's direction, influences the correlations, demonstrating that the
properties of the optical elements in the observation stations affect the
correlations although the stations are separated spatially and temporarily. We
show that the model can reproduce results which are considered to be
intrinsically quantum mechanical.
","[{""version"":""v1"",""created"":""Sun, 16 Dec 2007 11:06:47 GMT""}]","2007-12-18"
"0712.2566","Frederic Brechenmacher FB","Frederic Brechenmacher","Algebraic generality vs arithmetic generality in the controversy between
  C. Jordan and L. Kronecker (1874)","To be inserted in a collective volume",,,,"math.HO",,"  Throughout the whole year of 1874, C. Jordan and L. Kronecker were
quarrelling over two theorems. On the one hand, Jordan had stated in 1870 a
canonical form theorem for substitutions of linear groups; on the other hand,
Karl Weierstrass had introduced in 1868 the elementary divisors of non singular
pairs of bilinear forms (P,Q) in stating a key theorem of the theory of
bilinear and quadratic forms. Although they would be considered equivalent as
regard to modern mathematics, not only had these two theorems been stated
independently and for different purposes, they had also been lying within the
distinct frameworks of two theories until some connections came to light in
1872-1873, breeding the 1874 quarrel and hence revealing an opposition over two
practices relating to distinctive cultural features. As we will be looking into
the 1874 quarrel, our purpose will be to show how the complex identities of
practices such as Jordan s canonical reduction and Kronecker s invariant
computation highlight some cultural issues such as tacit knowledge and
perceptions of history peculiar to individuals or communities as well as some
local ways of thinking such as disciplinary ideals and internal philosophies of
generality and simplicity.
","[{""version"":""v1"",""created"":""Sun, 16 Dec 2007 11:11:44 GMT""}]","2007-12-18"
