"0712.2568","Ian G. Moss","Ian G. Moss","Superfluidity in Super-Yang-Mills Theory","6 pages, 5 figures",,,,"hep-th",,"  The AdS/CFT correspondence suggests that there is a point in the phase
diagram of strongly interacting gauge-theory matter where the viscosity
approaches zero. This paper analyses the possibility that this point represents
a superfluid and that the the system near this point in the phase diagram can
be described by a Landau fluid. Superfluid vortices are constructed and the AdS
analogue of vorticity quantisation is described. The production of vortices in
the quark-gluon plasma during heavy ion collisions is discussed.
","[{""version"":""v1"",""created"":""Sun, 16 Dec 2007 11:48:13 GMT""}]","2007-12-18"
"0712.2569","Norio Narita","Norio Narita, Bun'ei Sato, Osamu Ohshima, Joshua N. Winn","A Possible Spin-Orbit Misalignment in the Transiting Eccentric Planet HD
  17156b","5 pages, 2 figures, 3 tables. Accepted for publication in PASJ
  Letters (Vol. 60, No. 2)","PASJ Letters, 2008, Vol.60, No.2, pp.L1-L5","10.1093/pasj/60.2.L1",,"astro-ph",,"  We present simultaneous photometric and spectroscopic observations of HD
17156b spanning a transit on UT 2007 November 12. This system is of special
interest because of its 21-day period (unusually long for a transiting planet)
and its high orbital eccentricity of 0.67. By modeling the Rossiter-McLaughlin
effect, we find the angle between the sky projections of the orbital axis and
the stellar rotation axis to be $62^{\circ} \pm 25^{\circ}$. Such a large
spin-orbit misalignment, as well as the large eccentricity, could be explained
as the relic of a previous gravitational interaction with other planets.
","[{""version"":""v1"",""created"":""Sun, 16 Dec 2007 12:28:23 GMT""},{""version"":""v2"",""created"":""Fri, 1 Feb 2008 06:02:35 GMT""}]","2015-05-13"
"0712.2570","Jun-Qing Xia","Jun-Qing Xia, Xinmin Zhang","Constraining Slow-Roll Inflation in the Presence of Dynamical Dark
  Energy","5 pages, 2 figures, 1 table, Accepted for publication in Phys.Lett.B","Phys.Lett.B660:287-292,2008","10.1016/j.physletb.2008.01.010",,"astro-ph",,"  In this paper we perform a global analysis of the constraints on the
inflationary parameters in the presence of dynamical dark energy models from
the current observations, including the three-year Wilkinson Microwave
Anisotropy Probe (WMAP3) data, Boomerang-2K2, CBI, VSA, ACBAR, SDSS LRG, 2dFGRS
and ESSENCE (192 sample). We use the analytic description of the inflationary
power spectra in terms of the Horizon-flow parameters $\{\epsilon_i\}$. With
the first order approximation in the slow-roll expansion, we find that the
constraints on the Horizon-flow parameters are $\epsilon_1<0.014 (95% C.L.)$
and $\epsilon_2=0.034\pm0.024 (1\sigma)$ in the $\Lambda$CDM model. In the
framework of dynamical dark energy models, the constraints become obviously
weak, $\epsilon_1<0.022 (95% C.L.)$ and $\epsilon_2=-0.006\pm0.039 (1\sigma)$,
and the inflation models with a ""blue"" tilt, which are excluded about $2\sigma$
in the $\Lambda$CDM model, are allowed now. With the second order
approximation, the constraints on the Horizon-flow parameters are significantly
relaxed further. If considering the non-zero $\epsilon_3$, the large running of
the scalar spectral index is found for the $\Lambda$CDM model, as well as the
dynamical dark energy models.
","[{""version"":""v1"",""created"":""Sun, 16 Dec 2007 13:08:12 GMT""},{""version"":""v2"",""created"":""Wed, 16 Jan 2008 06:49:05 GMT""}]","2008-11-26"
"0712.2571","Nathan Goldman","N. Goldman, A. Kubasiak, P. Gaspard and M. Lewenstein","Ultracold atomic gas in non-Abelian ""magnetic"" fields: the quantum Hall
  effect supremacy","6 pages, 5 figures","Phys. Rev. A. 79, 023624 (2009)","10.1103/PhysRevA.79.023624",,"cond-mat.mes-hall","http://arxiv.org/licenses/nonexclusive-distrib/1.0/","  Nowadays it is experimentally feasible to create artificial, and in
particular, non-Abelian gauge potentials for ultracold atoms trapped in optical
lattices. Motivated by this fact, we investigate the fundamental properties of
an ultracold Fermi gas in a non-Abelian U(2) gauge potential characterized by a
\emph{constant} Wilson loop. Under this specific condition, the energy spectrum
exhibits a robust band structure with large gaps and reveals a new fractal
figure. The transverse conductivity is related to topological invariants and is
shown to be quantized when the Fermi energy lies inside a gap of the spectrum.
We demonstrate that the analogue of the integer quantum Hall effect for neutral
atoms survives the non-Abelian coupling and leads to a striking fractal phase
diagram. Moreover, this coupling induces an anomalous Hall effect as observed
in graphene.
","[{""version"":""v1"",""created"":""Sun, 16 Dec 2007 13:56:41 GMT""},{""version"":""v2"",""created"":""Fri, 21 Dec 2007 13:38:32 GMT""},{""version"":""v3"",""created"":""Wed, 14 May 2008 11:35:18 GMT""},{""version"":""v4"",""created"":""Tue, 24 Jun 2008 10:24:37 GMT""},{""version"":""v5"",""created"":""Tue, 9 Sep 2008 13:34:31 GMT""}]","2009-05-29"
"0712.2572","Alexander Shatskiy Dr.","Alexander Shatskiy","Influence of Rotation on the Amount of Phantom Matter around wormholes","6 pages, 3 tables","Astron.Rep.51:81,2007; Astron.Zh.84:99,2007","10.1134/S1063772907020011",,"astro-ph","http://arxiv.org/licenses/nonexclusive-distrib/1.0/","  Static (spherically symmetrical) and stationary solutions for wormholes are
considered. The visibility horizon, which characterizes the differences between
black holes and passing wormholes, is determined in an invariant way. It is
shown that the rotation of wormholes does not affect the amount of phantom
matter that surrounds them.
","[{""version"":""v1"",""created"":""Sun, 16 Dec 2007 13:45:59 GMT""},{""version"":""v2"",""created"":""Sun, 22 Feb 2009 19:49:34 GMT""}]","2009-11-13"
"0712.2574","Hans De Raedt","H. De Raedt","Event-by-event simulation of quantum phenomena","V Brazilian Meeting on Simulational Physics, Ouro Preto, 2007",,,,"quant-ph",,"  In this talk, I discuss recent progress in the development of simulation
algorithms that do not rely on any concept of quantum theory but are
nevertheless capable of reproducing the averages computed from quantum theory
through an event-by-event simulation. The simulation approach is illustrated by
applications to single-photon Mach-Zehnder interferometer experiments and
Einstein-Podolsky-Rosen-Bohm experiments with photons.
","[{""version"":""v1"",""created"":""Sun, 16 Dec 2007 14:21:50 GMT""}]","2007-12-18"
"0712.2575","Jonathan Tennenbaum","Danil Doubochinski and Jonathan Tennenbaum","On the Fundamental Properties of Coupled Oscillating Systems","12 pages, 9 figures. Paper presented to First Russian Workshop on the
  Nuclear Science of Condensed Matter, Dubna, May 19-20, 2007",,,,"physics.gen-ph",,"  The present paper presents a new general conception of interaction between
physical systems, differing significantly from that of both classical physics
and quantum physics as generally understood. We believe this conception could
provide the basis for a coherent understanding of several classes of natural
phenomena that until now have been studied only in a piece-meal fashion. These
include 1) the universal tendency for physical systems to associate together
into stable dynamic formations; 2) the seemingly unlimited capacity for
generation of physical objects in Nature, including the emergence of coherent,
quantized states in physical systems of the most varied nature; 3) the
existence of close couplings between processes whose characteristic
length-scales, frequency- and energy-ranges differ by many orders of magnitude.
The proposed conception first emerged in connection with experimental studies
of the nonlinear behavior of coupled electromagnetic oscillators, and the
discovery of two fundamental phenomena that had been overlooked in the
classical theory of oscillations. The essential features of these phenomena are
summarized in the first two sections of the paper, after which we indicate how
the underlying physical principles can be combined under a single notion of
interaction, providing a mechanism by which a practically unlimited wealth of
physical objects could be generated by the interaction of just a few. The final
section puts forward some preliminary ideas about the electromagneto-mechanical
dual nature of physical objects as oscillatory processes, suggesting a
universal scope for the proposed conceptions.
","[{""version"":""v1"",""created"":""Sun, 16 Dec 2007 14:53:53 GMT""}]","2007-12-18"
"0712.2577","Maurice Margenstern","Margenstern Maurice","Is the injectivity of the global function of a cellular automaton in the
  hyperbolic plane undecidable?","16 pages, 8 figures. A few words were missing in the initial version",,,,"cs.DM cs.LO",,"  In this paper, we look at the following question. We consider cellular
automata in the hyperbolic plane and we consider the global function defined on
all possible configurations. Is the injectivity of this function undecidable?
The problem was answered positively in the case of the Euclidean plane by
Jarkko Kari, in 1994. In the present paper, we give a partial answer: when the
configurations are restricted to a certain condition, the problem is
undecidable.
","[{""version"":""v1"",""created"":""Sun, 16 Dec 2007 15:12:45 GMT""},{""version"":""v2"",""created"":""Thu, 20 Dec 2007 08:33:17 GMT""}]","2007-12-20"
"0712.2578","Paolo Dai Pra","Pietro Caputo, Paolo Dai Pra, Gustavo Posta","Convex Entropy Decay via the Bochner-Bakry-Emery approach",,,,,"math.PR",,"  We develop a method, based on a Bochner-type identity, to obtain estimates on
the exponential rate of decay of the relative entropy from equilibrium of
Markov processes in discrete settings. When this method applies the relative
entropy decays in a convex way. The method is shown to be rather powerful when
applied to a class of birth and death processes. We then consider other
examples, including inhomogeneous zero-range processes and Bernoulli-Laplace
models. For these two models, known results were limited to the homogeneous
case, and obtained via the martingale approach, whose applicability to
inhomogeneous models is still unclear.
","[{""version"":""v1"",""created"":""Sun, 16 Dec 2007 15:40:05 GMT""}]","2007-12-18"
"0712.2579","Hongyi Yao","Hongyi Yao","On the Information of the Second Moments Between Random Variables Using
  Mutually Unbiased Bases","20pages, no figures. The paper has been submitted to IEEE
  Transanction on Information Theory",,,,"cs.IT math.IT",,"  The notation of mutually unbiased bases(MUB) was first introduced by Ivanovic
to reconstruct density matrixes\cite{Ivanovic}. The subject about how to use
MUB to analyze, process, and utilize the information of the second moments
between random variables is studied in this paper. In the first part, the
mathematical foundation will be built. It will be shown that the spectra of MUB
have complete information for the correlation matrixes of finite discrete
signals, and the nice properties of them. Roughly speaking, it will be shown
that each spectrum from MUB plays an equal role for finite discrete signals,
and the effect between any two spectra can be treated as a global constant
shift. These properties will be used to find some important and natural
characterizations of random vectors and random discrete operators/filters. For
a technical reason, it will be shown that any MUB spectra can be found as fast
as Fourier spectrum when the length of the signal is a prime number.
  In the second part, some applications will be presented. First of all, a
protocol about how to increase the number of users in a basic digital
communication model will be studied, which has bring some deep insights about
how to encode the information into the second moments between random variables.
Secondly, the application of signal analysis will be studied. It is suggested
that complete ""MUB"" spectra analysis works well in any case, and people can
just choose the spectra they are interested in to do analysis. For instance,
single Fourier spectra analysis can be also applied in nonstationary case.
Finally, the application of MUB in dimensionality reduction will be considered,
when the prior knowledge of the data isn't reliable.
","[{""version"":""v1"",""created"":""Sun, 16 Dec 2007 15:54:37 GMT""},{""version"":""v2"",""created"":""Wed, 19 Dec 2007 14:53:09 GMT""}]","2007-12-19"
