"cond-mat/0702407","Thomas Miller III","Thomas F. Miller III, Eric Vanden-Eijnden, and David Chandler","Solvent coarse-graining and the string method applied to the hydrophobic
  collapse of a hydrated chain","11 pages, 7 figures, including supporting information","Proc. Natl. Acad. USA, 104, 14559 (2007)","10.1073/pnas.0705830104",,"cond-mat.stat-mech",,"  Using computer simulations of over 100,000 atoms, the mechanism for the
hydrophobic collapse of an idealized hydrated chain is obtained. This is done
by coarse-graining the atomistic water molecule positions over 129,000
collective variables that represent the water density field and then using the
string method in these variables to compute the minimum free energy pathway
(MFEP) for the collapsing chain. The dynamical relevance of the MFEP (i.e. its
coincidence with the mechanism of collapse) is validated a posteriori using
conventional molecular dynamics trajectories. Analysis of the MFEP provides
atomistic confirmation for the mechanism of hydrophobic collapse proposed by
ten Wolde and Chandler. In particular, it is shown that lengthscale-dependent
hydrophobic dewetting is the rate-limiting step in the hydrophobic collapse of
the considered chain.
","[{""version"":""v1"",""created"":""Sat, 17 Feb 2007 10:05:52 GMT""}]","2011-07-27"
"cond-mat/0702408","Andre Geim K","K. S. Novoselov, Z. Jiang, Y. Zhang, S. V. Morozov, H. L. Stormer, U.
  Zeitler, J. C. Maan, G. S. Boebinger, P. Kim and A. K. Geim","Room-Temperature Quantum Hall Effect in Graphene","Published in Science online 15 February 2007","Science 315, 1379 (2007).","10.1126/science.1137201",,"cond-mat.mes-hall cond-mat.mtrl-sci",,"  The quantum Hall effect (QHE), one example of a quantum phenomenon that occur
on a truly macroscopic scale, has been attracting intense interest since its
discovery in 1980 and has helped elucidate many important aspects of quantum
physics. It has also led to the establishment of a new metrological standard,
the resistance quantum. Disappointingly, however, the QHE could only have been
observed at liquid-helium temperatures. Here, we show that in graphene - a
single atomic layer of carbon - the QHE can reliably be measured even at room
temperature, which is not only surprising and inspirational but also promises
QHE resistance standards becoming available to a broader community, outside a
few national institutions.
","[{""version"":""v1"",""created"":""Sat, 17 Feb 2007 11:28:10 GMT""}]","2007-05-23"
"cond-mat/0702410","A Stepanov","P. Sati, R. Hayn, R. Kuzian, S. Regnier, S. Schafer, A. Stepanov, C.
  Morhain, C. Deparis, M. Laugt, M. Goiran, and Z. Golacki","Magnetic Anisotropy of Co2+ as Signature of Intrinsic Ferromagnetism in
  ZnO:Co","4 pages, 4 figures","Phys. Rev. Lett. 96, 017203 (2006)",,,"cond-mat.mtrl-sci",,"  We report on the magnetic properties of thoroughly characterized Zn1-xCoxO
epitaxial thin films, with low Co concentration, x=0.003-0.005. Magnetic and
EPR measurements, combined with crystal field theory, reveal that isolated Co2+
ions in ZnO possess a strong single ion anisotropy which leads to an ""easy
plane"" ferromagnetic state when the ferromagnetic Co-Co interaction is
considered. We suggest that the peculiarities of the magnetization process of
this state can be viewed as a signature of intrinsic ferromagnetism in ZnO:Co
materials.
","[{""version"":""v1"",""created"":""Sat, 17 Feb 2007 13:39:28 GMT""}]","2007-05-23"
"cond-mat/0702411","Ayako Yamamoto","Ayako Yamamoto, Peter A. Sharma, Yoshihiko Okamoto, Aiko Nakao, Hiroko
  Aruga Katori, Seiji Niitaka, Daisuke Hashizume, and Hidenori Takagi","Metal-insulator Transition in a Pyrochlore-type Ruthenium oxide,
  Hg2Ru2O7","8 pages(text), 3 figures, and 1 page (references)",,"10.1143/JPSJ.76.043703",,"cond-mat.str-el",,"  A new pyrochlore ruthenium oxide, Hg2Ru2O7 was synthesized under a high
pressure of 6 GPa. In contrast to the extensively studied Ru4+ oxides, this
compound possesses a novel Ru5+ valence state, corresponding to a half-filled
t_2g_3 electron configuration. Hg2Ru2O7 exhibits a first order metal-insulator
transition at 107 K, accompanied by a structural transition from cubic to lower
symmetry. The behavior of the magnetic susceptibility suggests the possible
formation of a spin singlet in the insulating low temperature state.
","[{""version"":""v1"",""created"":""Sat, 17 Feb 2007 14:33:36 GMT""}]","2009-11-13"
"cond-mat/0702412","Michael Stone","Michael Stone, Inaki Anduaga","Mass flows and angular momentum density for $p_x+ip_y$ paired fermions
  in a harmonic trap","ReVTeX, 20 pages, 10figures",,"10.1016/j.aop.2007.04.020",,"cond-mat.supr-con",,"  We present a simple two-dimensional model of a $p_x+ip_y$ superfluid in which
the mass flow that gives rise to the intrinsic angular momentum is easily
calculated by numerical diagonalization of the Bogoliubov-de Gennes operator.
We find that, at zero temperature and for constant director $\bf l$, the mass
flow closely follows the Ishikawa-Mermin-Muzikar formula ${\bf j}_{\rm mass}=
\frac 12 {\rm curl} (\rho \hbar {\bf l}/2)$.
","[{""version"":""v1"",""created"":""Sat, 17 Feb 2007 14:33:24 GMT""}]","2009-11-13"
"cs/0702091","raphael M. Jungers","Raphael M. Jungers and Vincent D. Blondel","Observable Graphs","15 pages, 8 figures",,,,"cs.MA",,"  An edge-colored directed graph is \emph{observable} if an agent that moves
along its edges is able to determine his position in the graph after a
sufficiently long observation of the edge colors. When the agent is able to
determine his position only from time to time, the graph is said to be
\emph{partly observable}. Observability in graphs is desirable in situations
where autonomous agents are moving on a network and one wants to localize them
(or the agent wants to localize himself) with limited information. In this
paper, we completely characterize observable and partly observable graphs and
show how these concepts relate to observable discrete event systems and to
local automata. Based on these characterizations, we provide polynomial time
algorithms to decide observability, to decide partial observability, and to
compute the minimal number of observations necessary for finding the position
of an agent. In particular we prove that in the worst case this minimal number
of observations increases quadratically with the number of nodes in the graph.
  From this it follows that it may be necessary for an agent to pass through
the same node several times before he is finally able to determine his position
in the graph. We then consider the more difficult question of assigning colors
to a graph so as to make it observable and we prove that two different versions
of this problem are NP-complete.
","[{""version"":""v1"",""created"":""Fri, 16 Feb 2007 16:16:49 GMT""}]","2007-05-23"
"cs/0702092","M. Kivanc Mihcak","Yucel Altug, N. Polat Ayerden, M. Kivanc Mihcak, Emin Anarim","A Note on the Periodicity and the Output Rate of Bit Search Type
  Generators","20 pages, 2 figures and submitted to IEEE Transactions on Information
  Theory",,"10.1109/TIT.2007.913503",,"cs.CR",,"  We investigate the bit-search type irregular decimation algorithms that are
used within LFSR-based stream ciphers. In particular, we concentrate on BSG and
ABSG, and consider two different setups for the analysis. In the first case,
the input is assumed to be a m-sequence; we show that all possible output
sequences can be classified into two sets, each of which is characterized by
the equivalence of their elements up to shifts. Furthermore, we prove that the
cardinality of each of these sets is equal to the period of one of its elements
and subsequently derive the first known bounds on the expected output period
(assuming that no subperiods exist). In the second setup, we work in a
probabilistic framework and assume that the input sequence is evenly
distributed (i.e., independent identically distributed Bernoulli process with
probability 1/2). Under these assumptions, we derive closed-form expressions
for the distribution of the output length and the output rate, which is shown
to be asymptotically Gaussian-distributed and concentrated around the mean with
exponential tightness.
","[{""version"":""v1"",""created"":""Fri, 16 Feb 2007 16:20:59 GMT""}]","2016-11-15"
"cs/0702093","Ashish Khisti","Ashish Khisti, Aslan Tchamkerten, Gregory Wornell","Secure Broadcasting","Submitted to IEEE Transactions on Information Theory, Special issue
  on Information Theoretic Security",,,,"cs.IT math.IT",,"  Wyner's wiretap channel is extended to parallel broadcast channels and fading
channels with multiple receivers. In the first part of the paper, we consider
the setup of parallel broadcast channels with one sender, multiple intended
receivers, and one eavesdropper. We study the situations where the sender
broadcasts either a common message or independent messages to the intended
receivers. We derive upper and lower bounds on the common-message-secrecy
capacity, which coincide when the users are reversely degraded. For the case of
independent messages we establish the secrecy sum-capacity when the users are
reversely degraded.
  In the second part of the paper we apply our results to fading channels:
perfect channel state information of all intended receivers is known globally,
whereas the eavesdropper channel is known only to her. For the common message
case, a somewhat surprising result is proven: a positive rate can be achieved
independently of the number of intended receivers. For independent messages, an
opportunistic transmission scheme is presented that achieves the secrecy
sum-capacity in the limit of large number of receivers. Our results are stated
for a fast fading channel model. Extensions to the block fading model are also
discussed.
","[{""version"":""v1"",""created"":""Fri, 16 Feb 2007 16:41:17 GMT""}]","2007-07-13"
"cs/0702094","Marko Horvat B.Sc.CS-Dipl.Ing.","Darko Fuduric, Marko Horvat and Mario Zagar","Authentication via wireless networks","5 pages, 6 figures, 1 table, MIPRO Conference in Opatija, Croatia,
  2006","MIPRO, 2006",,,"cs.OH",,"  Personal authentication is an important process we encounter almost every
day; when we are logging on a computer, entering a company where we work, or a
restricted area, when we are using our plastic credit cards to pay for a
service or to complete some other financial transaction, etc. In each of these
processes of personal authentication some kind of magnetic or optical token is
required. But by using novel technologies like mobile computing and wireless
networking, it is possible to avoid carrying multitude of ID cards or
remembering a number of PIN codes. Article shows how to efficiently
authenticate users via Personal Area Networks (PAN) like Bluetooth or IrDA
using commonplace AES (Rijndel) or MD5 encryption. This method can be
implemented on many types of mobile devices like Pocket PC PDA with Windows CE
(Windows Mobile 2003) real-time operating system, or any other customized OS,
so we will explain all components and key features of such basic system.
","[{""version"":""v1"",""created"":""Fri, 16 Feb 2007 16:46:59 GMT""}]","2007-05-23"
"cs/0702095","Ayan Mahalanobis","Ayan Mahalanobis","A note on using finite non-abelian $p$-groups in the MOR cryptosystem",,,,,"cs.CR math.GR",,"  The MOR cryptosystem is a natural generalization of the El-Gamal cryptosystem
to non-abelian groups. Using a $p$-group, a cryptosystem was built by this
author in 'A simple generalization of El-Gamal cryptosystem to non-abelian
groups'. It seems reasonable to assume the cryptosystem is as secure as the
El-Gamal cryptosystem over finite fields. A natural question arises can one
make a better cryptosystem using $p$-groups? In this paper we show that the
answer is no.
","[{""version"":""v1"",""created"":""Fri, 16 Feb 2007 19:04:32 GMT""}]","2007-05-23"
"cs/0702096","David Iclanzan Mr","David Iclanzan, Dan Dumitrescu","Overcoming Hierarchical Difficulty by Hill-Climbing the Building Block
  Structure","submited to GECCO 2007 (jan 31)",,,,"cs.NE cs.AI",,"  The Building Block Hypothesis suggests that Genetic Algorithms (GAs) are
well-suited for hierarchical problems, where efficient solving requires proper
problem decomposition and assembly of solution from sub-solution with strong
non-linear interdependencies. The paper proposes a hill-climber operating over
the building block (BB) space that can efficiently address hierarchical
problems. The new Building Block Hill-Climber (BBHC) uses past hill-climb
experience to extract BB information and adapts its neighborhood structure
accordingly. The perpetual adaptation of the neighborhood structure allows the
method to climb the hierarchical structure solving successively the
hierarchical levels. It is expected that for fully non deceptive hierarchical
BB structures the BBHC can solve hierarchical problems in linearithmic time.
Empirical results confirm that the proposed method scales almost linearly with
the problem size thus clearly outperforms population based recombinative
methods.
","[{""version"":""v1"",""created"":""Fri, 16 Feb 2007 21:47:04 GMT""}]","2007-05-23"
"cs/0702097","Hans van Ditmarsch","M.D. Atkinson and H.P. van Ditmarsch and S. Roehling","Avoiding bias in cards cryptography","11 pages","Australasian Journal of Combinatorics 44:3-17, 2009",,,"cs.CR cs.MA",,"  We outline the need for stricter requirements for unconditionally secure
cryptographic protocols inspired by the Russian Cards problem. A new
requirement CA4 is proposed that checks for bias in single card occurrence in
announcements consisting of alternatives for players' holdings of cards. This
requirement CA4 is shown to be equivalent to an alternative requirement CA5.
All announcements found to satisfy CA4 are 2-designs. We also show that all
binary designs are 3-designs. Instead of avoiding bias in announcements
produced by such protocols, one may as well apply unbiased protocols such that
patterns in announcements become meaningless. We gave two examples of such
protocols for card deal parameters (3,3,1), i.e. two of the players hold three
cards, and the remaining player, playing the role of eavesdropper, holds a
single card.
","[{""version"":""v1"",""created"":""Sat, 17 Feb 2007 01:42:39 GMT""}]","2011-11-02"
"gr-qc/0702098","John Barrow","John D. Barrow and Jonathan Middleton","Stable Isotropic Cosmological Singularities in Quadratic Gravity","18 pages, no figures","Phys.Rev.D75:123515,2007","10.1103/PhysRevD.75.123515",,"gr-qc astro-ph hep-th",,"  We show that, in quadratic lagrangian theories of gravity, isotropic
cosmological singularities are stable to the presence of small scalar, vector
and tensor inhomogeneities. Unlike in general relativity, a particular exact
isotropic solution is shown to be the stable attractor on approach to the
initial cosmological singularity. This solution is also known to act as an
attractor in Bianchi universes of types I, II and IX, and the results of this
paper reinforce the hypothesis that small inhomogeneous and anisotropic
perturbations of this attractor form part of the general cosmological solution
to the field equations of quadratic gravity. Implications for the existence of
a 'gravitational entropy' are also discussed.
","[{""version"":""v1"",""created"":""Fri, 16 Feb 2007 16:37:52 GMT""}]","2008-11-26"
"hep-ex/0702026","Melodi Masaniai","Burton Richter","Charting the Course for Elementary Particle Physics","AAAS National Meeting, San Francisco, 2007, Symposium, A New Frontier
  in Particle Physics, 15 pages, 8 figures",,,"SLAC-PUB-12345","hep-ex",,"  It was the best of times; it was the worst of times is the way Dickens begins
the Tale of Two Cities. The line is appropriate to our time in particle
physics. It is the best of times because we are in the midst of a revolution in
understanding, the third to occur during my career. It is the worst of times
because accelerator facilities are shutting down before new ones are opening,
restricting the opportunity for experiments, and because of great uncertainty
about future funding. My task today is to give you a view of the most important
opportunities for our field under a scenario that is constrained by a tight
budget. It is a time when we cannot afford the merely good, but must give first
priority to the really important.
","[{""version"":""v1"",""created"":""Fri, 16 Feb 2007 20:03:47 GMT""}]","2007-05-23"
"hep-ph/0702170","Joaquim Prades","Johan Bijnens and Joaquim Prades","The Hadronic Light-by-Light Contribution to the Muon Anomalous Magnetic
  Moment: Where do we stand?","16 pages, 9 figures","Mod.Phys.Lett.A22:767-782,2007","10.1142/S0217732307022992","CERN-PH-TH/2007-035; LU TP 07-05","hep-ph",,"  We review the status of the hadronic light-by-light contribution to the muon
anomalous magnetic moment and critically compare recent calculations. We also
study in detail which momentum regions the pi^0 exchange main contribution
originates. We also argue that a_\mu^{light-by-light} = (11 \pm 4) \times
10^{-10} encompasses the present understanding of this contribution and comment
on some directions to improve on that.
","[{""version"":""v1"",""created"":""Fri, 16 Feb 2007 16:02:28 GMT""}]","2008-11-26"
"hep-ph/0702171","Robi Peschanski","C. Marquet, R. Peschanski and G. Soyez","Exclusive vector meson production at HERA from QCD with saturation","10 pages, 5 figures, full analysis including the charm contribution
  and J/PSI production. Conclusions confirmed","Phys.Rev.D76:034011,2007","10.1103/PhysRevD.76.034011",,"hep-ph",,"  Following recent predictions that the geometric scaling properties of deep
inelastic scattering data in inclusive gamma*-p collisions are expected also in
exclusive diffractive processes, we investigate the diffractive production of
vector mesons. Using analytic results in the framework of the BK equation at
non-zero momentum transfer, we extend to the non-forward amplitude a
QCD-inspired forward saturation model including charm, following the
theoretical predictions for the momentum transfer dependence of the saturation
scale. We obtain a good fit to the available HERA data and make predictions for
deeply virtual Compton scattering measurements.
","[{""version"":""v1"",""created"":""Fri, 16 Feb 2007 16:11:16 GMT""},{""version"":""v2"",""created"":""Wed, 27 Jun 2007 14:50:07 GMT""}]","2008-11-26"
"hep-ph/0702172","Jernej Kamenik","Svjetlana Fajfer, Jernej Kamenik, Sasa Prelovsek","D Physics","Contribution to the proceedings of HQL06, Munich, October 16th-20th
  2006. 18 pages, 7 figures, 4 tables","ECONFC0610161:018,2006",,,"hep-ph",,"  Recently a lot of new experimental results on open charm hadrons have
appeared. In particular many D meson resonances have been discovered. We
discuss strong decays of positive and negative parity charmed mesons within
heavy meson chiral perturbation theory and study the impact of excited charm
states on the determination of the effective meson couplings. Motivated by
recent experimental results we also reconsider semileptonic D to P l nu and D
to V l nu decays within a model which combines heavy quark symmetry and
properties of the chiral Lagrangian. Using limits of soft collinear effective
theory and heavy quark effective theory we parametrize the semileptonic form
factors. We include excited charm meson states in our Lagrangians and determine
their impact on the charm meson semileptonic form factors. In some scenarios of
new physics an up-like heavy quark appears, which induces FCNC at tree level
for the c to u Z transitions. We investigate FCNC effects in D rare decays in
particular the c to u l+ l- transition which might occur in D+ to pi+ l+ l- and
D0 to rho0 l+ l-.
","[{""version"":""v1"",""created"":""Fri, 16 Feb 2007 16:46:04 GMT""}]","2008-11-26"
"hep-ph/0702173","Carlos Quimbay","J. A. Sanchez-Monroy, C. Quimbay (National University of Colombia,
  Bogota)","Some classical properties of the non-abelian Yang-Mills theories","12 pages","Rev.Mex.Fis.E56:172-176,2010",,,"hep-ph","http://arxiv.org/licenses/nonexclusive-distrib/1.0/","  We present some classical properties for non-abelian Yang-Mills theories that
we extract directly from the Maxwell's equations of the theory. We write the
equations of motion for the SU(3) Yang-Mills theory using the language of
Maxwell's equations in both differential and integral forms. We show that
vectorial gauge fields in this theory are non-fermionic sources for non-abelian
electric and magnetic fields. These vectorial gauge fields are also responsible
for the existence of magnetic monopoles. We build the continuity equation and
the energy-momentum tensor for the non-abelian case.
","[{""version"":""v1"",""created"":""Fri, 16 Feb 2007 19:04:52 GMT""},{""version"":""v2"",""created"":""Thu, 30 Dec 2010 16:55:03 GMT""}]","2011-03-28"
"hep-ph/0702174","Hirotsugu Fujii","H. Fujii, F. Gelis, R. Venugopalan","Heavy flavor production in pA collisions","Talk given at QM2006. 4p","J.Phys.G34:S937-942,2007","10.1088/0954-3899/34/8/S130",,"hep-ph",,"  Heavy quark production in high-energy proton-nucleus (pA) collisions is
described in the framework of the Color Glass Condensate. kT factorization is
broken even at leading order albeit a more general factorization in pA holds at
this order in terms of 2, 3 and 4 point correlators of Wilson lines in the
nuclear target. The x-evolution of these correlators is computed in the large A
and large N mean field limit of the Balitsky-Kovchegov equation. We show
results for heavy quark production at RHIC and LHC energies.
","[{""version"":""v1"",""created"":""Sat, 17 Feb 2007 01:27:56 GMT""}]","2008-11-26"
"hep-ph/0702175","Omar Gustavo Miranda","J. Barranco, O. G. Miranda, T. I. Rashba","Sensitivity of low energy neutrino experiments to physics beyond the
  standard model","21 pages, 5 figures. A more detailed analysis of systematic errors is
  done. Final version to be published in PRD","Phys.Rev.D76:073008,2007","10.1103/PhysRevD.76.073008","MPP-2007-15","hep-ph hep-ex",,"  We study the sensitivity of future low energy neutrino experiments to extra
neutral gauge bosons, leptoquarks and R-parity breaking interactions. We focus
on future proposals to measure coherent neutrino-nuclei scattering and
neutrino-electron elastic scattering. We introduce a new comparative analysis
between these experiments and show that in different types of new physics it is
possible to obtain competitive bounds to those of present and future collider
experiments. For the cases of leptoquarks and R-parity breaking interactions we
found that the expected sensitivity for most of the future low energy
experimental setups is better than the current constraints.
","[{""version"":""v1"",""created"":""Sat, 17 Feb 2007 01:42:57 GMT""},{""version"":""v2"",""created"":""Fri, 19 Oct 2007 14:37:36 GMT""}]","2008-11-26"
"hep-th/0702135","Ansar Fayyazuddin","Ansar Fayyazuddin","Calabi-Yau 3-folds from 2-folds","30 pages","Class.Quant.Grav.24:3151-3170,2007","10.1088/0264-9381/24/13/002","BCCUNY-HEP /07-01","hep-th",,"  We consider type IIA string theory on a Calabi-Yau 2-fold with D6-branes
wrapping 2-cycles in the 2-fold. We find a complete set of conditions on the
supergravity solution for any given wrapped brane configuration in terms of
SU(2) structures. We reduce the problem of finding a supergravity solution for
the wrapped branes to finding a harmonic function on R$\times$CY$_2$. We then
lift this solution to 11-dimensions as a product of R$^{(4.1)}$ and a
Calabi-Yau 3-fold. We show how the metric on the 3-fold is determined in terms
of the wrapped brane solution. We write down the distinguished (3,0) form and
the K{\""a}hler form of the 3-fold in terms of structures defined on the base
2-d complex manifold. We discuss the topology of the 3-fold in terms of the
D6-branes and the underlying 2-fold. We show that in addition to the
non-trivial cycles inherited from the underlying 2-fold there are $N-1$ new
2-cycles. We construct closed (1,1) forms corresponding to these new cycles. We
also display some explicit examples. One of our examples is that of D6-branes
wrapping the 2-cycle in an A$_1$ ALE space, the resulting 3-fold has
$h^{(1,1)}=N$, where $N$ is the number of D6-branes.
","[{""version"":""v1"",""created"":""Fri, 16 Feb 2007 19:01:58 GMT""}]","2008-11-26"
"hep-th/0702136","Thomas D. Cohen","Thomas D. Cohen","Is there a ""most perfect fluid"" consistent with quantum field theory?","4 pages; typos corrected and references added in new version","Phys.Rev.Lett.99:021602,2007","10.1103/PhysRevLett.99.021602",,"hep-th hep-ph nucl-th",,"  It was recently conjectured that the ratio of the shear viscosity to entropy
density, $ \eta/ s$, for any fluid always exceeds $\hbar/(4 \pi k_B)$. This
conjecture was motivated by quantum field theoretic results obtained via the
AdS/CFT correspondence and from empirical data with real fluids. A theoretical
counterexample to this bound can be constructed from a nonrelativistic gas by
increasing the number of species in the fluid while keeping the dynamics
essentially independent of the species type. The question of whether the
underlying structure of relativistic quantum field theory generically inhibits
the realization of such a system and thereby preserves the possibility of a
universal bound is considered here. Using rather conservative assumptions, it
is shown here that a metastable gas of heavy mesons in a particular controlled
regime of QCD provides a realization of the counterexample and is consistent
with a well-defined underlying relativistic quantum field theory. Thus, quantum
field theory appears to impose no lower bound on $\eta/s$, at least for
metastable fluids.
","[{""version"":""v1"",""created"":""Fri, 16 Feb 2007 20:07:58 GMT""},{""version"":""v2"",""created"":""Tue, 20 Feb 2007 13:09:18 GMT""},{""version"":""v3"",""created"":""Mon, 5 Mar 2007 14:05:59 GMT""}]","2008-11-26"
