"astro-ph/0702448","Thomas M. Brown","Thomas M. Brown, Ed Smith, Henry C. Ferguson (STScI), Puragra
  Guhathakurta, Jasonjot S. Kalirai (UCO/Lick), R. Michael Rich (UCLA), Alvio
  Renzini (INAF), Allen V. Sweigart (NASA/GSFC), David Reitzel (UCLA), Karoline
  M. Gilbert (UCO/Lick), and Marla Geha (NRC/HIA)","The Extended Star Formation History of the Andromeda Spheroid at Twenty
  One Kiloparsecs on the Minor Axis","4 pages, 1 figure, accepted for publication in The Astrophysical
  Journal Letters",,"10.1086/515395","STScI Eprint #1754","astro-ph",,"  Using the HST ACS, we have obtained deep optical images of a southeast
minor-axis field in the Andromeda Galaxy, 21 kpc from the nucleus. In both star
counts and metallicity, this field represents a transition zone between the
metal-rich, highly-disturbed inner spheroid that dominates within 15 kpc and
the metal-poor, diffuse population that dominates beyond 30 kpc. The
color-magnitude diagram reaches well below the oldest main-sequence turnoff in
the population, allowing a reconstruction of the star formation history in this
field. Compared to the spheroid population at 11 kpc, the population at 21 kpc
is ~1.3 Gyr older and ~0.2 dex more metal-poor, on average. However, like the
population at 11 kpc, the population at 21 kpc exhibits an extended star
formation history; one third of the stars are younger than 10 Gyr, although
only a few percent are younger than 8 Gyr. The relatively wide range of
metallicity and age is inconsistent with a single, rapid star-formation
episode, and instead suggests that the spheroid even at 21 kpc is dominated by
the debris of earlier merging events likely occurring more than 8 Gyr ago.
","[{""version"":""v1"",""created"":""Fri, 16 Feb 2007 20:36:28 GMT""}]","2009-11-13"
"astro-ph/0702449","Mihai Cara","M. Cara, M. L. Lister","MOJAVE: Monitoring of Jets in AGN with VLBA Experiments. IV. The Parent
  Luminosity Function of Radio-Loud Blazars","31 pages, 7 figures and 2 tables. Accepted for publication in ApJ.
  Changes: classification of sources based on radio morphology instead of
  optical classes; added the parameters of the RLF of the FR II sources; added
  more explanations; added a table listing the sample sources; added 2 extra
  figures related to the observed break in the RLF; updated references",,"10.1086/525554",,"astro-ph",,"  (Abridged) We use a complete sample of active galactic nuclei (AGN) selected
on the basis of relativistically beamed 15 GHz radio flux density to derive the
parent radio luminosity function (RLF) of bright radio-selected blazar cores.
We use a maximum likelihood method to fit a beamed RLF to the observed data and
thereby recover the parameters of the intrinsic (unbeamed) RLF. We analyze two
subsamples of the MOJAVE sample: the first contains only objects of known FR II
class, with a total of 103 sources, and the second subsample adds 24 objects of
uncertain FR class for a total of 127 sources. Both subsamples exclude four
known FR I radio galaxies and two gigahertz-peaked spectrum sources. We obtain
good fits to both subsamples using a single power law intrinsic RLF with pure
density evolution function. We find that a previously reported break in the
observed MOJAVE RLF actually arises from using incomplete bins (because of the
luminosity cutoff) across a steep and strongly evolving RLF, and does not
reflect a break in the intrinsic RLF. The derived space density of the parent
population of the FR II sources from the MOJAVE sample (with L>1.3e25 W/Hz) is
approximately 1600/Gpc^3.
","[{""version"":""v1"",""created"":""Fri, 16 Feb 2007 20:43:05 GMT""},{""version"":""v2"",""created"":""Wed, 7 Nov 2007 05:35:45 GMT""}]","2009-11-13"
"astro-ph/0702450","Eli Waxman","E. Waxman, P. Meszaros, S. Campana","GRB060218: A Relativistic Supernova Shock Breakout","Discussion of several points expanded, 1 citation corrected; accepted
  to ApJ","Astrophys.J.667:351-357,2007","10.1086/520715",,"astro-ph",,"  We show that the prompt and afterglow X-ray emission of GRB060218, as well as
its early (t<=1 d) optical-UV emission, can be explained by a model in which a
radiation- mediated shock propagates through a compact progenitor star into a
dense wind. The prompt thermal X-ray emission is produced in this model as the
mildly relativistic shock, v/c=0.85 carrying few x 10^49 erg, reaches the wind
(Thomson) photosphere, where the post-shock thermal radiation is released and
the shock becomes collisionless. Adopting this interpretation of the thermal
X-ray emission, a subsequent X-ray afterglow is predicted, due to synchrotron
emission and inverse-Compton scattering of SN UV photons by electrons
accelerated in the collisionless shock. Early optical-UV emission is also
predicted, due to the cooling of the outer \delta M ~10^{-3} M_sun envelope of
the star, which was heated to high temperature during shock passage. The
observed X-ray afterglow and the early optical-UV emission are both consistent
with those expected in this model. Detailed analysis of the early optical-UV
emission may provide detailed constraints on the density distribution near the
stellar surface.
","[{""version"":""v1"",""created"":""Fri, 16 Feb 2007 21:54:45 GMT""},{""version"":""v2"",""created"":""Sun, 3 Jun 2007 13:56:11 GMT""}]","2010-11-11"
"astro-ph/0702451","Francesca Annibali","F. Annibali (STScI), A. Bressan (INAF-OA Padova), R. Rampazzo (INAF-OA
  Padova), W. Zeilinger (Institut fur Astronomie der Universitat Wien), L.
  Danese (SISSA)","Stellar Populations in Field Early-Type Galaxies","6 pages, to appear in the Proceedings of the Conf. ""From Stars to
  Galaxies: Building the Pieces to Build Up the Universe"", Vallenari et al.
  eds., ASP Conf. Series",,,,"astro-ph",,"  We have acquired intermediate resolution spectra in the 3700-7000 A
wavelength range for a sample of 65 early-type galaxies predominantly located
in low density environments, a large fraction of which show emission lines. The
spectral coverage and the high quality of the spectra allowed us to derive Lick
line-strength indices and to study their behavior at different galacto-centric
distances. Ages, metallicities and element abundance ratios have been derived
for the galaxy sample by comparison of the line-strength index data set with
our new developed Simple Stellar Population (SSP) models. We have analyzed the
behavior of the derived stellar population parameters with the central galaxy
velocity dispersion and the local galaxy density in order to understand the
role played by mass and environment on the evolution of early-type galaxies. We
find that the chemical path is mainly driven by the halo mass, more massive
galaxies exhibiting the more efficient chemical enrichment and shorter star
formation timescales. Galaxies in denser environments are on average older than
galaxies in less dense environments. The last ones show a large age spread
which is likely to be due to rejuvenation episodes.
","[{""version"":""v1"",""created"":""Fri, 16 Feb 2007 23:47:50 GMT""}]","2007-05-23"
"astro-ph/0702453","Maurizio Falanga Dr.","Maurizio Falanga & Lev Titarchuk","Energy dependent ~100 \mu s time lags as observational evidence of
  Comptonization effects in the neutron star plasma environment","4 pages, 3 figures, ApJ accepted","Astrophys.J.661:1084-1088,2007","10.1086/514805",,"astro-ph",,"  We present a Comptonization model for the observed properties of the
energy-dependent soft/hard time lags and pulsed fraction (amplitude) associated
with the pulsed emission of a neutron star (NS). We account for the soft lags
by downscattering of hard X-ray photons in the relatively cold plasma of the
disk or NS surface. A fraction of the soft X-ray photons coming from the disk
or NS surface upscatter off hot electrons in the accretion column. This effect
leads to hard lags as a result of thermal Comptonization of the soft photons.
This model reproduces the observed soft and hard lags due to the down- and
upscattered radiation as a function of the electron number densities of the
reflector, n_{e}^{ref}, and the accretion column, n_{e}^{hot}. In the case of
the accretion-powered millisecond pulsars IGR J00291+5934, XTE J1751-305, and
SAX J1808.4-3658, the observed time lags agree well with the model. Soft lags
are observed only if n_e^{ref} << n_e^{hot}. Scattering of the pulsed emission
in the NS environment may account for the observed time lags as a non-monotonic
function of energy. The time lag measurements can be used as a probe of the
innermost parts of the NS and accretion disk. We determine the upper and lower
limits of the density variation in this region using the observed time lags.
The observed energy-dependent pulsed amplitude allows us to infer a variation
of the Thomson optical depth of the Compton cloud in which the accretion column
is embedded.
","[{""version"":""v1"",""created"":""Sat, 17 Feb 2007 12:37:13 GMT""}]","2011-02-11"
"astro-ph/0702454","Maurizio Falanga Dr.","Maurizio Falanga","Accreting X-ray millisecond pulsars observed with INTEGRAL","8 pages, 7 figures, 1 table, accepted for publication in ESA SP-622.
  Proceeding of the 6th INTEGRAL Workshop, July 3-7, 2006 Moscow, Russia",,,,"astro-ph",,"  I review the properties of three X-ray accreting millisecond pulsars observed
with INTEGRAL. Out of seven recently discovered accretion-powered pulsars (one
discovered by INTEGRAL), three were observed with the INTEGRAL satellite up to
300 keV. Detailed timing and spectral results will be presented, including data
obtained during the most recent outburst of the pulsar HETE J1900.1-2455.
Accreting X-ray millisecond pulsars are key systems to understand the spin and
accretion history of neutron stars. They are also a good laboratory in which to
study the source spectra, pulse profile, and phase shift between X-ray pulses
in different energy ranges which give additional information of the X-ray
production processes and emission environment.
","[{""version"":""v1"",""created"":""Sat, 17 Feb 2007 13:08:11 GMT""},{""version"":""v2"",""created"":""Wed, 7 Nov 2007 15:21:20 GMT""}]","2007-11-07"
"astro-ph/0702455","Sergey Rodionov","S.A. Rodionov, V.V. Orlov","Phase models of the Milky Way stellar disc","16 pages, 10 figures","Mon.Not.Roy.Astron.Soc.385:200,2008","10.1111/j.1365-2966.2008.12649.x",,"astro-ph",,"  We present a new iterative method for constructing equilibrium phase models
of stellar systems. Importantly, this method can provide phase models with
arbitrary mass distributions. The method is based on the following principle.
Our task is to generate an equilibrium N-body system with a given mass
distribution. For this purpose, we let the system reach equilibrium through its
dynamical evolution. During this evolution we hold mass distribution in this
system. This principle is realized in our method by means of an iterative
procedure. We have used our method to construct a phase model of the disc of
our Galaxy. In our method, we use the mass distribution in the Galaxy as input
data. Here we used two Galactic density models (suggested by Flynn,
Sommer-Larsen and Christensen and by Dehnen and Binney). For a fixed-mass model
of the Galaxy we can construct a one-parameter family of equilibrium models of
the Galactic disc. We can, however, choose a unique model using local kinematic
parameters that are known from Hipparcos data. We show that the phase models
constructed using our method are close to equilibrium. The problem of
uniqueness for our models is discussed, and we discuss some further
applications of our method.
","[{""version"":""v1"",""created"":""Sat, 17 Feb 2007 13:14:13 GMT""},{""version"":""v2"",""created"":""Fri, 13 Jul 2007 10:36:53 GMT""},{""version"":""v3"",""created"":""Mon, 2 Jun 2008 11:07:53 GMT""}]","2008-11-26"
"astro-ph/0702457","Michael F. Corcoran","M. F. Corcoran","Eta Car and other LBVs","to appear in the Proceedings of ""Massive Stars: Fundamental
  Parameters and Circumstellar Interactions""",,,,"astro-ph",,"  Luminous Blue Variables (LBVs) are believed to be evolved, extremely massive
stars close to the Eddington Limit and hence prone to bouts of large-scale,
unstable mass loss. I discuss current understanding of the evolutionary state
of these objects, the role duplicity may play and known physical
characteristics of these stars using the X-ray luminous LBVs Eta Carinae and HD
5980 as test cases.
","[{""version"":""v1"",""created"":""Sat, 17 Feb 2007 15:45:03 GMT""}]","2007-05-23"
"cond-mat/0702374","Alexander Kordyuk","A. A. Kordyuk, S. V. Borisenko, D. Inosov, V. B. Zabolotnyy, J. Fink,
  B. Buechner, R. Follath, V. Hinkov, B. Keimer, H. Berger","""Waterfalls"" in cuprates",,"extended version (arXiv:0710.3838) as Phys. Rev. Lett. 99, 237002
  (2007)","10.1103/PhysRevLett.99.237002",,"cond-mat.str-el cond-mat.supr-con",,"  New hot topic in ARPES on HTSC, the observation of the so called
""waterfalls"", is addressed. The energy scale at about 0.2-0.3 eV that can be
derived from the coherent component of ARPES spectra measured along the nodal
direction is not new but has been already discussed in terms of a coupling to a
bosonic continuum. However, the waterfalls, namely the long vertical parts of
the experimental dispersion around the center of the Brillouin zone (BZ), seem
to be purely artificial. They are a consequence of simple matrix-element
effect: a complete suppression of the photoemission intensity from both the
coherent and ""incoherent"" components. When the matrix-elements are taken into
account, the latter reveals a grid-like structure along the bonding directions
in the BZ.
","[{""version"":""v1"",""created"":""Fri, 16 Feb 2007 19:54:20 GMT""}]","2007-12-08"
"cond-mat/0702384","Brandon Ramakko","Brandon W. Ramakko and Mohamed Azzouz","Effect of temperature on quantum criticality in the frustrated two-leg
  Heisenberg ladder","12 pages, 19 figures","B. Ramakko and M. Azzouz, Phys. Rev. B 76, 064419 (2007)","10.1103/PhysRevB.76.064419",,"cond-mat.str-el",,"  The antiferromagnetic Heisenberg model on the two-leg ladder with exchange
interactions along the chains, rungs, and diagonals is studied using the
Jordan-Wigner transformation and bond-mean-field theory. The inclusion of all
three couplings introduces frustration to the system and depending on their
relative strengths the ladder can adopt one of three possible
magnetically-disordered gapped states. The phase diagram found in this
mean-field approach is in very good agreement with the one calculated by
Weihong and colleagues using the Lanczos exact diagonalization method. By
analyzing the ground-state energy we study quantum criticality when the
coupling parameters are varied at zero temperature. We study the effect of
temperature on the phase boundaries, and find that the system shows
thermally-induced criticality for some values of the rung and diagonal coupling
constants. All the phase transitions encountered in this system occur between
disordered phases, and are all caused by frustration.
","[{""version"":""v1"",""created"":""Fri, 16 Feb 2007 20:46:36 GMT""},{""version"":""v2"",""created"":""Tue, 21 Aug 2007 20:19:20 GMT""}]","2007-08-21"
"cond-mat/0702396","Dietrich Stauffer","F.W.S. Lima and Edina M.S. Luz","Ising model S=1, 3/2 and 2 on directed networks","Submitted to Communications in Computational Physics",,,,"cond-mat.dis-nn",,"  On directed} Barabasi-Albert and Small-World networks the
  Ising model with spin S=1, 3/2 and 2 is now studied through Monte Carlo
simulations.
  In this model, the order-disorder phase transition of the order parameter is
well defined on Small-World networks for Ising model with spin S=1. We
calculate the value of the critical temperature T_c for several values of
rewiring probability p of the directed Small-World network. This model on
directed Small-World networks we obtained a second-order phase transition for
p=0.2 and first-order phase transition for p=0.8. The critical exponentes
beta/nu, gamma/nu and
  1/\nu were calculated for p=0.2. On directed Barabasi-Albert we show that no
there is phase transition for Ising model with spin S=1, 3/2 and 2.
","[{""version"":""v1"",""created"":""Fri, 16 Feb 2007 16:43:53 GMT""}]","2007-05-23"
"cond-mat/0702397","John J. Rehr","Fernando D. Vila, J. J. Rehr, H. H. Rossner and H. J. Krappe","Theoretical X-Ray Absorption Debye-Waller Factors","11 pages, 8 figures",,"10.1103/PhysRevB.76.014301",,"cond-mat.mtrl-sci",,"  An approach is presented for theoretical calculations of the Debye-Waller
factors in x-ray absorption spectra. These factors are represented in terms of
the cumulant expansion up to third order. They account respectively for the net
thermal expansion $\sigma^{(1)}(T)$, the mean-square relative displacements
$\sigma^2(T)$, and the asymmetry of the pair distribution function
$\sigma^{(3)}(T)$. Similarly, we obtain Debye-Waller factors for x-ray and
neutron scattering in terms of the mean-square vibrational amplitudes $u^2(T)$.
Our method is based on density functional theory calculations of the dynamical
matrix, together with an efficient Lanczos algorithm for projected phonon
spectra within the quasi-harmonic approximation. Due to anharmonicity in the
interatomic forces, the results are highly sensitive to variations in the
equilibrium lattice constants, and hence to the choice of exchange-correlation
potential. In order to treat this sensitivity, we introduce two prescriptions:
one based on the local density approximation, and a second based on a modified
generalized gradient approximation. Illustrative results for the leading
cumulants are presented for several materials and compared with experiment and
with correlated Einstein and Debye models. We also obtain Born-von Karman
parameters and corrections due to perpendicular vibrations.
","[{""version"":""v1"",""created"":""Fri, 16 Feb 2007 19:08:04 GMT""}]","2009-11-13"
"cond-mat/0702398","Horacio Ceva","Laura Hernandez and Horacio Ceva","Wang-Landau study of the critical behaviour of the bimodal 3D-Random
  Field Ising Model",,"Physica A 387, 2793-2801 (2008)","10.1016/j.physa.2008.01.021",,"cond-mat.stat-mech",,"  We apply the Wang-Landau method to the study of the critical behaviour of the
three dimensional Random Field Ising Model with a bimodal probability
distribution. Our results show that for high values of the random field
intensity the transition is first order, characterized by a double-peaked
energy probability distribution at the transition temperature. On the other
hand, the transition looks continuous for low values of the field intensity. In
spite of the large sample to sample fluctuations observed, the double peak in
the probability distribution is always present for high fields
","[{""version"":""v1"",""created"":""Fri, 16 Feb 2007 17:32:48 GMT""},{""version"":""v2"",""created"":""Thu, 20 Sep 2007 13:15:50 GMT""}]","2009-11-13"
"cond-mat/0702399","Roland Combescot","R.Combescot","Introduction to FFLO phases and collective mode in the BEC-BCS crossover","20 pages, to be published in the Proceedings of the 2006 Enrico Fermi
  Summer School on ""Ultracold Fermi gases"", organized by M. Inguscio, W.
  Ketterle and C.Salomon (Varenna, Italy, June 2006)",,,,"cond-mat.supr-con cond-mat.soft",,"  The main focus of this paper is a discussion of what might happen in a BCS
superfluid when there is an imbalance between the two populations of fermionic
particles forming Cooper pairs, having in mind the case of ultracold Fermi
gases. In the last part the evolution in the BEC-BCS crossover of the
collective mode arising in such a superfluid (with balanced atomic populations)
is briefly considered.
","[{""version"":""v1"",""created"":""Fri, 16 Feb 2007 17:43:31 GMT""}]","2007-05-23"
"cond-mat/0702400","I. S. Burmistrov","I.S. Burmistrov and A.M.M. Pruisken","Coulomb Blockade and Super Universality of the Theta-Angle","RevTeX, 4 pages, 1 figure","Phys. Rev. Lett. 101, 056801 (2008)","10.1103/PhysRevLett.101.056801",,"cond-mat.mes-hall",,"  Based on the Ambegaokar-Eckern-Schon approach to the Coulomb blockade we
develop a complete quantum theory of the single electron transistor. We
identify a previously unrecognized physical observable q^\prime in the problem
that, unlike the usual average charge (Q) on the island, is robustly quantized
for any finite value of the tunneling conductance as the temperature goes to
absolute zero. This novel quantity is fundamentally related to the
non-symmetrized noise of the system. We present a unifying scaling diagram in
the q^\prime - g^\prime plane where g^\prime denotes the conductance of the
system. The results display all the super universal topological features of the
theta-angle concept that previously arose in the theory of the quantum Hall
effect.
","[{""version"":""v1"",""created"":""Fri, 16 Feb 2007 18:30:52 GMT""}]","2008-07-29"
"cond-mat/0702402","Stepanov","P. Sati, C. Deparis, C. Morhain, S. Schafer, A. Stepanov","Antiferromagnetic interactions in single crystalline Zn1-xCoxO thin
  films","4 pages, 4 figures,accepted for publication in PRL",,"10.1016/j.spmi.2007.04.053",,"cond-mat.mtrl-sci",,"  In a rather contradictory situation regarding magnetic data on Co-doped ZnO,
we have succeeded in fabricating high-quality single crystalline Zn1-xCoxO
(x=0.003-0.07) thin films. This gives us the possibility, for the first time,
to examine the it intrinsic magnetic properties of ZnO:Co at a quantitative
level and therefore to address several unsolved problems, the major one being
the nature of the Co-Co interaction in the ZnO structure.
","[{""version"":""v1"",""created"":""Fri, 16 Feb 2007 21:47:47 GMT""}]","2009-11-13"
"cond-mat/0702403","Benjamin Jacobs","Benjamin W. Jacobs, Virginia M. Ayres, Mihail P. Petkov, Joshua B.
  Halpern, MaoQe He, Andrew D. Baczewski, Kaylee McElroy, Martin A. Crimp,
  Jiaming Zhang, Harry C. Shaw","Electronic and Structural Characteristics of Zinc-Blende Wurtzite
  Biphasic Homostructure GaN Nanowires","4 pages, 5 figures","Nano Letters, 7, 1435-1438 (2007)","10.1021/nl062871y",,"cond-mat.mtrl-sci",,"  We report a new biphasic crystalline wurtzite/zinc-blende homostructure in
gallium nitride nanowires. Cathodoluminescence was used to quantitatively
measure the wurtzite and zinc-blende band gaps. High resolution transmission
electron microscopy was used to identify distinct wurtzite and zinc-blende
crystalline phases within single nanowires through the use of selected area
electron diffraction, electron dispersive spectroscopy, electron energy loss
spectroscopy, and fast Fourier transform techniques. A mechanism for growth is
identified.
","[{""version"":""v1"",""created"":""Fri, 16 Feb 2007 21:32:19 GMT""}]","2015-06-25"
"cond-mat/0702404","Raj Srivastava","R. V. A. Srivastava and W. Teizer","Analytic Density of States in the Abrikosov-Gorkov Theory","5 pages, 1 figure",,"10.1016/j.ssc.2007.11.030",,"cond-mat.supr-con",,"  Since the early 1960s, Abrikosov-Gorkov theory has been used to describe
superconductors with paramagnetic impurities. Interestingly, the density of
states resulting from the theoretical framework has to date only been known
approximately, as a numeric solution of a complex polynomial. Here we introduce
an exact analytic solution for the density of states of a superconductor with
paramagnetic impurities. The solution is valid in the whole regime of
Abrikosov-Gorkov theory; both where there is an energy gap and gapless. While
of fundamental interest, we argue that this solution also has computational
benefits in the evaluation of integrals for tunneling conductances and allows
for an analytic description of materials with densities of states that are
modeled from the basic Abrikosov-Gorkov density of states.
","[{""version"":""v1"",""created"":""Sat, 17 Feb 2007 00:40:17 GMT""}]","2009-11-13"
"cond-mat/0702405","James Patrick Clancy","J.P. Clancy, B.D. Gaulin, K.C. Rule, J.P. Castellan and F.C. Chou","Commensurate Fluctuations in the Pseudogap and Incommensurate
  spin-Peierls Phases of TiOCl","To appear in Physical Review B: Rapid Communications. 5 pages","Phys. Rev. B 75, 100401(R) (2007)","10.1103/PhysRevB.75.100401",,"cond-mat.str-el",,"  X-ray scattering measurements on single crystals of TiOCl reveal the presence
of commensurate dimerization peaks within both the incommensurate spin-Peierls
phase and the so-called pseudogap phase above T_c2. This scattering is
relatively narrow in Q-space indicating long correlation lengths exceeding ~
100 A below T* ~ 130 K. It is also slightly shifted in Q relative to that of
the commensurate long range ordered state at the lowest temperatures, and it
coexists with the incommensurate Bragg peaks below T_c2. The integrated
scattering over both commensurate and incommensurate positions evolves
continuously with decreasing temperature for all temperatures below T* ~ 130 K.
","[{""version"":""v1"",""created"":""Sat, 17 Feb 2007 01:05:24 GMT""}]","2016-08-05"
