"math/0702832","Marcos Jardim","Pedro Frejlich and Marcos Jardim","Nahm Transform for Higgs bundles","16 pages. To apperar in J. Geom. Phys","Journal of Geometry and Physics 58 (2008), 1221-1230","10.1016/j.geomphys.2008.04.006",,"math.DG",,"  We construct the Nahm transform for Higgs bundles over a Riemann surface of
genus at least 2 as hyperholomorphic connections on the total space of the
tangent bundle of its dual Jacobian.
","[{""version"":""v1"",""created"":""Tue, 27 Feb 2007 14:13:09 GMT""},{""version"":""v2"",""created"":""Wed, 14 May 2008 23:43:12 GMT""}]","2012-01-30"
"math/0702833","Masayuki Asaoka","Masayuki Asaoka","Non-homogeneous locally free actions of the affine group","20 pages, no figure",,,,"math.DS math.GT","http://arxiv.org/licenses/nonexclusive-distrib/1.0/","  We classify smooth locally free actions of the real affine group on closed
orientable three-dimensional manifolds up to smooth conjugacy. As a corollary,
there exists a non-homogeneous action when the manifold is the unit tangent
bundle of a closed surface with a hyperbolic metric.
","[{""version"":""v1"",""created"":""Tue, 27 Feb 2007 14:18:55 GMT""},{""version"":""v2"",""created"":""Fri, 24 Apr 2009 02:38:28 GMT""},{""version"":""v3"",""created"":""Wed, 19 Jan 2011 05:18:56 GMT""},{""version"":""v4"",""created"":""Thu, 20 Oct 2011 03:37:19 GMT""}]","2011-10-21"
"math/0702834","Jesus Fernandez","Marta Casanellas and Jesus Fernandez-Sanchez","Geometry of the Kimura 3-parameter model","26 pages with 4 figures",,,,"math.AG math.AC q-bio.PE",,"  The Kimura 3-parameter model on a tree of n leaves is one of the most used in
phylogenetics. The affine algebraic variety W associated to it is a toric
variety. We study its geometry and we prove that it is isomorphic to a
geometric quotient of the affine space by a finite group acting on it. As a
consequence, we are able to study the singularities of W and prove that the
biologically meaningful points are smooth points. Then we give an algorithm for
constructing a set of minimal generators of the localized ideal at these
points, for an arbitrary number of leaves n. This leads to a major improvement
of phylogenetic reconstruction methods based on algebraic geometry.
","[{""version"":""v1"",""created"":""Tue, 27 Feb 2007 14:20:00 GMT""}]","2007-05-23"
"math/0702835","Sanne ter Horst","A.E. Frazho, S. ter Horst and M.A. Kaashoek","Relaxed commutant lifting: an equivalent version and a new application","14 pages",,,,"math.FA math.OC",,"  This paper presents a few additions to commutant lifting theory. An operator
interpolation problem is introduced and shown to be equivalent to the relaxed
commutant lifting problem. Using this connection a description of all solutions
of the former problem is given. Also a new application, involving bounded
operators induced by $H^2$ operator-valued functions, is presented.
","[{""version"":""v1"",""created"":""Tue, 27 Feb 2007 14:50:41 GMT""}]","2007-05-23"
"math/0702836","S. Encinas","Santiago Encinas and Orlando Villamayor","Rees algebras and resolution of singularities","19 pages","Actas del XVI Coloquio Latinoamericano de Algebra, Biblioteca de
  la Revista Matematica Iberoamericana, Revista Matematica Iberoamericana,
  2007, pp. 63-85",,,"math.AG",,"  Embedded principalization of ideals in smooth schemes, also known as
Log-resolutions of ideals, play a central role in algebraic geometry. If two
sheaves of ideals, say $I_1$ and $I_2$, over a smooth scheme $V$ have the same
integral closure, it is well known that Log-resolution of one of them induces a
Log-resolution of the other. On the other hand, in case $V$ is smooth over a
field of characteristic zero, an algorithm of desingularization provides, for
each sheaf of ideals, a unique Log-resolution.
  In this paper we show that algorithms of desingularization define the same
Log-resolution for two ideals having the same integral closure. We prove this
result here by using the form of induction introduced by W{\l}odarczyk.
  We extend the notion of Log-resolution of ideals over a smooth scheme $V$, to
that of Rees algebras over $V$; and then we show that two Rees algebras with
the same integral closure undergo the same constructive resolution. The key
point is the interplay of integral closure with differential operators.
","[{""version"":""v1"",""created"":""Tue, 27 Feb 2007 15:05:23 GMT""}]","2008-02-28"
"math/0702837","Hugo Parlier","Javier Aramayona, Hugo Parlier, Kenneth J. Shackleton","Constructing convex planes in the pants complex","9 pages, 1 figure",,,,"math.GT",,"  Our main theorem identifies a class of totally geodesic subgraphs of the
1-skeleton of the pants complex, each isomorphic to the product of two Farey
graphs. We deduce the existence of many convex planes in the 1-skeleton of the
pants complex.
","[{""version"":""v1"",""created"":""Tue, 27 Feb 2007 15:15:39 GMT""}]","2007-05-23"
"math/0702838","Valery A. Lunts","Alexander I. Efimov, Valery A. Lunts, Dmitri O. Orlov","Deformation theory of objects in homotopy and derived categories I:
  general theory","Alexander Efimov is a new co-author of this paper. Besides some minor
  changes, Proposition 7.1 and Theorem 8.1 were corrected","Adv. Math. 222 (2009), no. 2, 359--401","10.1016/j.aim.2009.03.021",,"math.AG math.CT","http://arxiv.org/licenses/nonexclusive-distrib/1.0/","  This is the first paper in a series. We develop a general deformation theory
of objects in homotopy and derived categories of DG categories. Namely, for a
DG module $E$ over a DG category we define four deformation functors $\Def
^{\h}(E)$, $\coDef ^{\h}(E)$, $\Def (E)$, $\coDef (E)$. The first two functors
describe the deformations (and co-deformations) of $E$ in the homotopy
category, and the last two - in the derived category. We study their properties
and relations. These functors are defined on the category of artinian (not
necessarily commutative) DG algebras.
","[{""version"":""v1"",""created"":""Tue, 27 Feb 2007 15:19:13 GMT""},{""version"":""v2"",""created"":""Thu, 1 May 2008 16:03:00 GMT""},{""version"":""v3"",""created"":""Mon, 15 Sep 2008 11:08:40 GMT""}]","2018-08-13"
"math/0702839","Valery A. Lunts","Alexander I. Efimov, Valery A. Lunts, Dmitri O. Orlov","Deformation theory of objects in homotopy and derived categories II:
  pro-representability of the deformation functor","Alexander Efimov is a new co-author of this paper. New material was
  added: A_{\infty}-structures, Maurer-Cartan theory for A_{\infty}-algebras.
  This allows us to strengthen our main results on the pro-representability of
  pseudo-functors coDEF_{-} and DEF_{-}. We also obtain an equivalence between
  homotopy and derived deformation functors under weaker hypotheses","Adv. Math. 224 (2010), no. 1, 45--102","10.1016/j.aim.2009.11.004",,"math.AG math.CT","http://arxiv.org/licenses/nonexclusive-distrib/1.0/","  This is the second paper in a series. In part I we developed deformation
theory of objects in homotopy and derived categories of DG categories. Here we
extend these (derived) deformation functors to an appropriate bicategory of
artinian DG algebras and prove that these extended functors are
pro-representable in a strong sense.
","[{""version"":""v1"",""created"":""Tue, 27 Feb 2007 15:27:09 GMT""},{""version"":""v2"",""created"":""Mon, 15 Sep 2008 11:29:50 GMT""},{""version"":""v3"",""created"":""Fri, 27 Nov 2009 14:31:37 GMT""}]","2018-08-13"
"math/0702840","Valery A. Lunts","Alexander I. Efimov, Valery A. Lunts, Dmitri O. Orlov","Deformation theory of objects in homotopy and derived categories III:
  abelian categories","Alexander Efimov is a new co-author of this paper. Besides some minor
  changes, a new part (part 3) about noncommutative Grassmanians was added","Adv. Math. 226, (2011) 5, 3857-3911","10.1016/j.aim.2010.11.003",,"math.AG math.CT","http://arxiv.org/licenses/nonexclusive-distrib/1.0/","  This is the third paper in a series. In part I we developed a deformation
theory of objects in homotopy and derived categories of DG categories. Here we
show how this theory can be used to study deformations of objects in homotopy
and derived categories of abelian categories. Then we consider examples from
(noncommutative) algebraic geometry. In particular, we study noncommutative
Grassmanians that are true noncommutative moduli spaces of structure sheaves of
projective subspaces in projective spaces.
","[{""version"":""v1"",""created"":""Tue, 27 Feb 2007 15:31:33 GMT""},{""version"":""v2"",""created"":""Thu, 1 May 2008 16:01:19 GMT""},{""version"":""v3"",""created"":""Thu, 4 Dec 2008 13:53:08 GMT""}]","2018-08-13"
"math/0702841","Marc Odunlami","Daniel Grau (LMA - PAU)","Generalization of usual capability indices for unilateral tolerances","16 pages",,,"0706","math.ST stat.TH",,"  Capability indices are dimensionless quantities measuring the aptitude of a
process to manufacture items whose characteristics must be within a specified
tolerance ranges. The usual indices $C_p$, $C_{pk}$, $C_{pm}$, and $C_{pmk}$
are used for a process of normal distribution and a target located at the
center of the tolerance interval. Various indices derived from the previous
family allow to consider more complex situations when asymmetrical tolerances
and non-normal distributions are taken into account. In this paper we study the
case where a single tolerance is imposed because the shifts in the direction of
this tolerance appear much more serious than in the opposite direction. We
propose a family of four indices having interpretations and properties similar
to those of the usual family.
","[{""version"":""v1"",""created"":""Tue, 27 Feb 2007 15:32:36 GMT""}]","2007-06-13"
"math/0702842","Semyon Alesker","Semyon Alesker","A Fourier type transform on translation invariant valuations on convex
  sets","85 pages; a mistake in Example 0.1.5 corrected","Israel J. Math. 181 (2011), 189--294",,,"math.MG","http://arxiv.org/licenses/nonexclusive-distrib/1.0/","  Let $V$ be a finite dimensional real vector space. In the article we
construct an isomorphism between the space of smooth translation invariant
valuations on convex subsets of $V$ and the space of such valuations (twisted
by densities) on the dual space $V^*$. This isomorphism commutes with the
natural action of the full linear group on both spaces of valuations, maps
product on the source (introduced in arXiv:math/0301148) to the convolution on
the target (introduced in arXiv:math/0607449), and satisfies a Plancherel type
inversion formula. As an application, a version of the hard Lefschetz theorem
for valuations is proved.
","[{""version"":""v1"",""created"":""Tue, 27 Feb 2007 15:56:55 GMT""},{""version"":""v2"",""created"":""Wed, 28 Feb 2007 08:39:19 GMT""},{""version"":""v3"",""created"":""Tue, 26 May 2009 07:11:36 GMT""},{""version"":""v4"",""created"":""Wed, 30 Jan 2013 09:38:30 GMT""}]","2013-01-31"
"nlin/0702050","Dmitry Levko","Dmitry Levko, Alexander Volkov","Modeling of Kundu-Eckhaus equation","3 pages, 8 figures",,,,"nlin.PS",,"  In work the numerical solutions of Kundu-Eckhaus equation are presented. The
conditions of dominate nonlinearity or disperse are cleared up.
","[{""version"":""v1"",""created"":""Mon, 26 Feb 2007 16:18:20 GMT""},{""version"":""v2"",""created"":""Tue, 27 Feb 2007 07:22:20 GMT""},{""version"":""v3"",""created"":""Fri, 2 Mar 2007 08:57:59 GMT""},{""version"":""v4"",""created"":""Thu, 15 Mar 2007 15:51:36 GMT""}]","2007-05-23"
"nlin/0702051","Kenichi Maruno","Yasuhiro Ohta, Ken-ichi Maruno and Masayuki Oikawa","Two-component Analogue of Two-dimensional Long Wave-Short Wave Resonance
  Interaction Equations: A Derivation and Solutions","16 pages, 9 figures, revised version; The pdf file including all
  figures: http://www.math.utpa.edu/kmaruno/yajima.pdf",,"10.1088/1751-8113/40/27/015",,"nlin.SI math-ph math.MP nlin.PS physics.optics",,"  The two-component analogue of two-dimensional long wave-short wave resonance
interaction equations is derived in a physical setting. Wronskian solutions of
the integrable two-component analogue of two-dimensional long wave-short wave
resonance interaction equations are presented.
","[{""version"":""v1"",""created"":""Mon, 26 Feb 2007 20:49:54 GMT""},{""version"":""v2"",""created"":""Tue, 3 Apr 2007 16:43:49 GMT""}]","2009-11-13"
"nlin/0702052","Kenichi Maruno","Ken-ichi Maruno, Hidekazu tsuji and Masayuki Oikawa","A possible mechanism of generation of extreme waves in shallow water","16 pages, arxiv version does not include figures. The complete
  versions including figures are available in
  http://www.math.utpa.edu/kmaruno/freakpaper.ps
  http://www.math.utpa.edu/kmaruno/freakpaper.pdf",,,,"nlin.PS physics.flu-dyn",,"  We consider a mechanism of generation of huge waves by multi-soliton resonant
interactions. A non-stationary wave amplification phenomenon is found in some
exact solutions of the Kadomtsev-Petviashvili (KP) equation. The mechanism
proposed here explains the character of extreme waves and of those in Tsunami.
","[{""version"":""v1"",""created"":""Mon, 26 Feb 2007 21:46:16 GMT""}]","2007-05-23"
"nlin/0702053","William Lawless PhD","W.F. Lawless, Joseph Wood, & Lily Tung","A new organizational metrics: A quantum approach","10 pages, submitted to IEEE SMC 2007",,,,"nlin.AO",,"  A future goal of robot teams and agent-based models (ABMs) is to field
organizations and systems based on first principles derived from human
counterparts. Forestalling that opportunity, the failure of traditional
organizational theory has at the same time opened the way to innovative
theories of organizations and change. Inspired by Bohr and Heisenberg about the
application of interdependent uncertainty in the interaction between action and
observation, making organizations bistable, we have begun to construct a theory
of organizations based on the uncertainty of energy level (resources) and
belief/action consensus, leading to preliminary metrics of organizational
performance that we have discovered in field studies. Our goal in this project
is to address the problem posed by organizations with: the development of new
theory; field tests of new metrics for organizations; and the development of
quantum ABMs set within a social circuit as a building block for an
organization. Should we be successful, our research would represent a
fundamental departure from traditional observational methods of social science
by forming the basis of a predictive science of organizations. We expect that
replacing the traditional method of observation with a predictive science must
account for when cognitive observations work and when they do not (illusions).
","[{""version"":""v1"",""created"":""Mon, 26 Feb 2007 23:05:17 GMT""}]","2007-05-23"
"nlin/0702054","Michael Uleysky","D.V. Makarov, M.Yu. Uleysky","Giant acceleration in slow-fast space-periodic Hamiltonian systems",,,"10.1103/PhysRevE.75.065201",,"nlin.CD",,"  Motion of an ensemble of particles in a space-periodic potential well with a
weak wave-like perturbation imposed is considered. We found that slow
oscillations of wavenumber of the perturbation lead to occurrence of directed
particle current. This current is amplifying with time due to giant
acceleration of some particles. It is shown that giant acceleration is linked
with the existence of resonant channels in phase space.
","[{""version"":""v1"",""created"":""Tue, 27 Feb 2007 08:34:39 GMT""}]","2009-11-13"
"nucl-ex/0702054","Brijesh K. Srivastava","Brijesh K. Srivastava","Forward-Backward Multiplicity Correlations in Au+Au Collisions at
  $\sqrt{s_{NN}}$ = 200 Gev","8 pages, 4 figures, IWCF06, Hangzhou, China, Nov. 21-24, 2006","Int.J.Mod.Phys.E16:3371-3378,2008","10.1142/S021830130700935X",,"nucl-ex",,"  The study of correlations among particles produced in different rapidity
regions may provide understanding of the mechanisms of particle production.
Correlations that extend over a longer range are observed in hadron-hadron
interactions only at higher energies. Results for short and long-range
multiplicity correlations (Forward-Backward) are presented for Au+Au collisions
at $\sqrt{s_{NN}}$ = 200 GeV. The growth of long range correlations are
observed as a function of the pseudorapidity gap in central Au+Au collisions.
The Dual Parton model and Color Glass Condensate phenomenology have been
explored to understand the origin of long range correlations.
","[{""version"":""v1"",""created"":""Mon, 26 Feb 2007 16:18:59 GMT""}]","2008-11-26"
"nucl-ex/0702055","Terence Tarnowsky","Terence Tarnowsky, Rolf Scharenberg, Brijesh Srivastava","Energy and System Size Dependence Study of the Percolation Phase
  Transition","6 pages, 3 figures, Poster Proceedings for Quark Matter 2006,
  Shanghai, China, November 14-20, 2006","Int.J.Mod.Phys.E16:1859-1863,2007","10.1142/S0218301307007118",,"nucl-ex",,"  Multiparticle production at high energies is described in terms of color
strings stretched between the projectile and target. As the string density
increases, overlap in the transverse plane leads to cluster formation. At some
critical density a macroscopic cluster appears, spanning the entire system.
This marks the percolation phase transition. Data from $\sqrt{s_{NN}}$ = 200
GeV p+p, d+Au and Au+Au collisions at RHIC has been analyzed using the STAR
detector to obtain the percolation density parameter, $\eta$. The particle
p$_{T}$ spectrum from 200 GeV p+p data is parameterized using a power law.
Values of the fit parameters are used in the d+Au and Au+Au analysis. For 200
GeV Au+Au collisions, the value of $\eta$ is found to lie above the critical
percolation threshold, while for other collision systems and energies, it is
below the critical value. This supports the idea of string percolation, which
at high enough string density is a possible mechanism to explore the hadronic
phase transition to a quark-gluon plasma.
","[{""version"":""v1"",""created"":""Mon, 26 Feb 2007 21:19:06 GMT""}]","2008-11-26"
"nucl-ex/0702056","Terence Tarnowsky","Terence Tarnowsky","Energy Dependence of Short and Long-Range Multiplicity Correlations in
  Au+Au Collisions from STAR","8 pages, 6 figures, Conference Proceedings for the XI International
  Workshop on Correlation and Fluctuation in Multiparticle Production,
  Hangzhou, China, November 21-25, 2006","Int.J.Mod.Phys.E16:3363-3370,2008","10.1142/S0218301307009348",,"nucl-ex",,"  A general overview of the measurement of long-range multiplicity correlations
measured by the STAR experiment in Au+Au collisions at RHIC is presented. The
presence of long-range correlations can provide insight into the early stages,
and the type of matter produced in, these collisions. These measurements have
been made in Au+Au collisions at $\sqrt{s_{NN}}$ = 200 and 62.4 GeV. These
results indicate a relatively large long-range correlation is produced in Au+Au
collisions compared to a {\it pp} baseline at $\sqrt{s_{NN}}$ = 200 GeV. A
weaker long-range correlation is seen as a function of incident energy.
Further, comparison of the onset of the long-range correlation to the
calculated percolation density parameter at $\sqrt{s_{NN}}$ = 200 GeV is
presented.
","[{""version"":""v1"",""created"":""Mon, 26 Feb 2007 21:59:57 GMT""}]","2008-11-26"
"nucl-ex/0702057","G\'abor Veres","Christof Roland, G\'abor I. Veres and Kriszti\'an Krajcz\'ar (for the
  CMS Heavy Ion group)","Simulation of Jet Quenching Observables in Heavy Ion Collisions at the
  LHC","6 pages, 5 figures. Presented at the 19th International Conference on
  Ultra-Relativistic Nucleus-Nucleus Collisions (QM2006), Shanghai, China,
  November 14-20, 2006. [Grant numbers added in the acknowledgment.]","Int.J.Mod.Phys.E16:1937-1942,2007","10.1142/S0218301307007258",,"nucl-ex",,"  Large transverse momentum jets provide unique tools to study dense QCD matter
in high-energy heavy-ion collisions. Results from RHIC on suppression of high
transverse momentum particles in Au+Au collisions indicate a significant energy
loss of leading partons in the dense and strongly interacting matter formed in
these collisions. The LHC will collide Pb ions at sqrt(s_NN)=5500 GeV, where
the cross section of hard scattering will increase dramatically. Large
production rates, the large acceptance of the CMS calorimeters and tracking
system, combined with the capability of triggering on jets, will extend the
transverse momentum reach of charged particle spectra and nuclear modification
factors up to p_T>200 GeV/c.
","[{""version"":""v1"",""created"":""Tue, 27 Feb 2007 14:50:05 GMT""},{""version"":""v2"",""created"":""Thu, 1 Mar 2007 09:18:24 GMT""}]","2008-11-26"
"nucl-th/0702080","Plamen Krastev","P. G. Krastev and B. A. Li (Texas A&M University-Commerce)","Constraining a possible time variation of the gravitational constant G
  with terrestrial nuclear laboratory data","27 pages, 11 figures, and 2 tables. Accepted version to appear in PRC
  (2007)","Phys.Rev.C76:055804,2007","10.1103/PhysRevC.76.055804",,"nucl-th astro-ph nucl-ex",,"  Testing the constancy of the gravitational constant G has been a longstanding
fundamental question in natural science. As first suggested by Jofr\'{e},
Reisenegger and Fern\'{a}ndez [1], Dirac's hypothesis of a decreasing
gravitational constant $G$ with time due to the expansion of the Universe would
induce changes in the composition of neutron stars, causing dissipation and
internal heating. Eventually, neutron stars reach their quasi-stationary states
where cooling due to neutrino and photon emissions balances the internal
heating. The correlation of surface temperatures and radii of some old neutron
stars may thus carry useful information about the changing rate of G. Using the
density dependence of the nuclear symmetry energy constrained by recent
terrestrial laboratory data on isospin diffusion in heavy-ion reactions at
intermediate energies and the size of neutron skin in $^{208}Pb$ within the
gravitochemical heating formalism, we obtain an upper limit of the relative
changing rate of $|\dot{G}/G|\le4\times 10^{-12}yr^{-1}$ consistent with the
best available estimates in the literature.
","[{""version"":""v1"",""created"":""Mon, 26 Feb 2007 18:30:37 GMT""},{""version"":""v2"",""created"":""Tue, 23 Oct 2007 01:23:50 GMT""}]","2008-11-26"
"nucl-th/0702081","Michael Hauer","M.I. Gorenstein, M. Hauer, D.O. Nikolajenko","Particle number fluctuations in nuclear collisions within excluded
  volume hadron gas model","19 pages, 4 figures","Phys.Rev.C76:024901,2007","10.1103/PhysRevC.76.024901",,"nucl-th",,"  The multiplicity fluctuations are studied in the van der Waals excluded
volume hadron-resonance gas model. The calculations are done in the grand
canonical ensemble within the Boltzmann statistics approximation. The scaled
variances for positive, negative and all charged hadrons are calculated along
the chemical freeze-out line of nucleus-nucleus collisions at different
collision energies. The multiplicity fluctuations are found to be suppressed in
the van der Waals gas. The numerical calculations are presented for two values
of hard-core hadron radius, $r=0.3$ fm and 0.5 fm, as well as for the upper
limit of the excluded volume suppression effects.
","[{""version"":""v1"",""created"":""Mon, 26 Feb 2007 19:40:15 GMT""},{""version"":""v2"",""created"":""Tue, 19 Jun 2007 09:16:19 GMT""}]","2008-11-26"
"nucl-th/0702082","Chiho Nonaka","Chiho Nonaka","Hydrodynamic Description of Heavy Ion Collisions","8 pages, 9 figures, latex, plenary presentation at the 19th
  International Conference on Ultra-Relativistic Nucleus-Nucleus Collisions
  (QM2006), Shanghai, China Nov. 14-20, 2006","J.Phys.G34:S313-322,2007","10.1088/0954-3899/34/8/S17",,"nucl-th",,"  We give a short review of hydrodynamic models at heavy ion collisions from
the point of view of initial conditions, an equation of states (EoS) and
freezeout process. Then we show our latest results of a combined fully
three-dimensional macroscopic/microscopic transport approach. In this model for
the early, dense, deconfined stage relativistic 3D-hydrodynamics of the
reaction and a microscopic non-equilibrium model for the later hadronic stage
where the equilibrium assumptions are not valid anymore are employed. Within
this approach we study the dynamics of hot, bulk QCD matter, which is being
created in ultra-relativistic heavy ion collisions at RHIC.
","[{""version"":""v1"",""created"":""Tue, 27 Feb 2007 01:49:03 GMT""}]","2008-11-26"
"nucl-th/0702083","Volodymyr Magas","V.K. Magas, L.P. Csernai, E. Molnar","Bjorken expansion with gradual freeze out","6 pages, 3 figures. Presented at the 19th International Conference On
  Ultrarelativistic Nucleus-Nucleus Collisions: Quark Matter 2006 (QM 2006),
  Shanghai, China, November 14-20, 2006","Int.J.Mod.Phys.E16:1890-1895,2007","10.1142/S0218301307007180",,"nucl-th",,"  The freeze out of the expanding systems, created in relativistic heavy ion
collisions, will be discussed. We combine kinetic freeze out equations with
Bjorken type system expansion into a unified model. Such a model is a more
physical generalization of the earlier simplified non-expanding freeze out
models. We shall see that the basic freeze out features, pointed out in the
earlier works, are not smeared out by the expansion.
","[{""version"":""v1"",""created"":""Tue, 27 Feb 2007 10:42:08 GMT""}]","2008-11-26"
