"hep-ph/0702260","George Lazarides","G. Lazarides (Aristotle U., Thessaloniki), C. Pallis (Manchester U.)","Reducing the spectral index in F-term hybrid inflation through a
  complementary modular inflation","8 pages including 3 figures, uses Revtex, version appeared in PLB","Phys.Lett.B651:216-223,2007","10.1016/j.physletb.2007.06.008","UT-STPD-1/07, MAN/HEP/2007/3","hep-ph astro-ph",,"  We consider two-stage inflationary models in which a superheavy scale F-term
hybrid inflation is followed by an intermediate scale modular inflation. We
confront these models with the restrictions on the power spectrum P_R of
curvature perturbations and the spectral index n_s implied by the recent data
within the power-law cosmological model with cold dark matter and a
cosmological constant. We show that these restrictions can be met provided that
the number of e-foldings N_HI* suffered by the pivot scale k_*=0.002/Mpc during
hybrid inflation is appropriately restricted. The additional e-foldings
required for solving the horizon and flatness problems can be naturally
generated by the subsequent modular inflation. For central values of P_R and
n_s, we find that, in the case of standard hybrid inflation, the values
obtained for the grand unification scale are close to its supersymmetric value
M_GUT=2.86 x 10^16 GeV, the relevant coupling constant is relatively large
(0.005-0.14), and N_HI* between about 10 and 21.7. In the case of shifted
[smooth] hybrid inflation, the grand unification scale can be identified with
M_GUT provided that N_HI*=21 [N_HI*=18].
","[{""version"":""v1"",""created"":""Mon, 26 Feb 2007 16:59:07 GMT""},{""version"":""v2"",""created"":""Mon, 14 May 2007 16:57:54 GMT""},{""version"":""v3"",""created"":""Fri, 21 Sep 2007 15:53:19 GMT""}]","2008-11-26"
"hep-ph/0702265","Johannes Bluemlein","I. Bierenbaum, J. Bl\""umlein, S. Klein","Calculation of Massive 2-Loop Operator Matrix Elements with Outer Gluon
  Lines","1 Latex file, 1 style file, 3 figures","Phys.Lett.B648:195-200,2007","10.1016/j.physletb.2007.02.059","DESY 06-120, SFB-CPP/07-06","hep-ph",,"  Massive on-shell operator matrix elements and self-energy diagrams with outer
gluon lines are calculated analytically at $O(\alpha_s^2)$, using Mellin-Barnes
integrals and representations through generalized hypergeometric functions.
This method allows for a direct evaluation without decomposing the integrals
using the integration-by-parts method.
","[{""version"":""v1"",""created"":""Mon, 26 Feb 2007 16:04:05 GMT""}]","2008-11-26"
"hep-ph/0702266","Yu. A. Simonov","Yu.A.Simonov","Nonperturbative equation of state of quark-gluon plasma","40 pages, no figures; some typos corrected","Annals Phys. 323, 783 (2008), Annals Phys. 323, 1230 (2008)","10.1016/j.aop.2007.07.005, 10.1016/j.aop.2007.05.007",,"hep-ph",,"  The paper is devoted to the systematic derivation of nonperturbative
thermodynamics of quark-gluon plasma, on the basis of the background
perturbation theory. Vacuum background fields enter only in the form of field
correlators, which are known from lattice and analytic calculations. In the
lowest order in $\alpha_s$ the purely nonperturbative $sQGP$ thermodynamics is
expressed through single quark and gluon lines (single line approximation)
which are interacting nonperturbatively with vacuum fields and with other
lines. Nonperturbative EOS is obtained in terms (of the absolute value) of
fundamental (adjoint) Polyakov loop $L_{fund(adj)}$ and spatial string tension
$\sigma_s(T)$. In the lowest approximation the pressure for quarks (gluons) has
a simple factorized form $P_{q(g)}= P_{SB} L_{fund(adj)} ,$ where $ L_i$
describe the action of vacuum colorelectric fields on particle trajectory.
","[{""version"":""v1"",""created"":""Mon, 26 Feb 2007 16:45:46 GMT""},{""version"":""v2"",""created"":""Mon, 2 Apr 2007 15:07:37 GMT""}]","2014-01-29"
"hep-ph/0702267","Ayres Freitas","A. Freitas, E. Gasser, U. Haisch","Supersymmetric large tan(beta) corrections to DeltaM_(d,s) and B_(d,s)
  -> mu+mu- revisited","8 pp; few typos corrected; version to appear in Phys. Rev. D","Phys.Rev.D76:014016,2007","10.1103/PhysRevD.76.014016","ZU-TH 1/07","hep-ph",,"  We point out that in the minimal supersymmetric standard model terms from the
mixing of Higgs and Goldstone bosons which are connected to the renormalization
of tan(beta) via Slavnov-Taylor identities give rise to corrections that do not
vanish in the limit where the supersymmetric particles are much heavier than
the Higgs bosons. These additional contributions have important
phenomenological implications as they can lead to potentially large
supersymmetric effects in DeltaM_d and to a significant increase of DeltaM_s
relative to the standard model prediction for a light pseudoscalar Higgs A0. We
calculate all the missing one-loop pieces and combine them with the known
effective non-holomorphic terms to obtain improved predictions for the
B_(d,s)-anti-B_(d,s) mass differences DeltaM_(d,s) and the branching ratios of
B_(d,s) -> mu+mu- in the large tan(beta) regime of the minimal supersymmetric
standard model with minimal flavor violation.
","[{""version"":""v1"",""created"":""Mon, 26 Feb 2007 19:52:44 GMT""},{""version"":""v2"",""created"":""Wed, 1 Aug 2007 14:04:22 GMT""}]","2008-11-26"
"hep-ph/0702268","Hung-Liang Lai","H.L. Lai, P. Nadolsky, J. Pumplin, D. Stump, W.K. Tung, C.-P. Yuan","The Strange Parton Distribution of the Nucleon: Global Analysis and
  Applications","19 pages; revised version submitted to JHEP","JHEP 0704:089,2007","10.1088/1126-6708/2007/04/089","ANL-HEP-PR-07-14, MSU-HEP-07012","hep-ph",,"  The strangeness degrees of freedom in the parton structure of the nucleon are
explored in the global analysis framework, using the new CTEQ6.5 implementation
of the general mass perturbative QCD formalism of Collins. We systematically
determine the constraining power of available hard scattering experimental data
on the magnitude and shape of the strange quark and anti-quark parton
distributions. We find that current data favor a distinct shape of the strange
sea compared to the isoscalar non-strange sea. A new reference parton
distribution set, CTEQ6.5S0, and representative sets spanning the allowed
ranges of magnitude and shape of the strange distributions, are presented. Some
applications to physical processes of current interest in hadron collider
phenomenology are discussed.
","[{""version"":""v1"",""created"":""Mon, 26 Feb 2007 20:24:17 GMT""},{""version"":""v2"",""created"":""Mon, 9 Apr 2007 17:40:54 GMT""}]","2014-11-18"
"hep-ph/0702269","Joachim Kopp","Joachim Kopp, Manfred Lindner, Toshihiko Ota","Discovery reach for non-standard interactions in a neutrino factory","RevTeX 4, 10 pages, 5 figures, extended discussion of systematical
  errors and of existing bounds, matches published version","Phys.Rev.D76:013001,2007","10.1103/PhysRevD.76.013001",,"hep-ph",,"  We study the discovery reach for Non-Standard Interactions (NSIs) in a
neutrino factory experiment. After giving a theoretical, but model-independent,
overview of the most relevant classes of NSIs, we present detailed numerical
results for some of them. Our simulations take into account matter effects,
uncertainties in the neutrino oscillation parameters, systematical errors,
parameter correlations, and degeneracies. We perform scans of the parameter
space, and show that a neutrino factory has excellent prospects of detecting
NSIs originating from new physics at around 1 TeV, which is a scale favored by
many extensions of the standard model. It will also turn out that the discovery
reach depends strongly on the standard and non-standard CP violating phases in
the Lagrangian.
","[{""version"":""v1"",""created"":""Mon, 26 Feb 2007 21:01:23 GMT""},{""version"":""v2"",""created"":""Sun, 8 Jul 2007 09:47:54 GMT""}]","2008-11-26"
"hep-ph/0702270","Alakabha Datta","Alakabha Datta","$\beta(\phi_1)$ from $ B $ Decays to Charm","4 pages, 4 figures. Added references. Talk presented at CKM2006
  Workshop, Nagoya, Japan",,,"UMISS-HEP-2007-02","hep-ph",,"  The measurement of $\sin {2\beta}$ from $B_d \to J/\psi K_s$ does not resolve
the discrete ambiguities in the angle $\beta$. A measurement of $\cos {2\beta}$
is therefore desirable.This talk is about measuring the CKM angle
$\beta(\phi_1)$ from various B decays to charm final states which also allow us
a measurement of $\cos {2\beta}$.
","[{""version"":""v1"",""created"":""Mon, 26 Feb 2007 22:39:48 GMT""},{""version"":""v2"",""created"":""Wed, 28 Feb 2007 17:40:07 GMT""}]","2007-05-23"
"hep-ph/0702271","Junli Li","Yi-Bing Ding, Junli Li, Cong-Feng Qiao","Bell Inequalities in High Energy Physics","26 pages, 3 eps figures; references added, published version","High Ener. Phys. & Nucl. Phys. 31, 1086(2007)",,"GUCAS-CPS-07-03","hep-ph quant-ph","http://arxiv.org/licenses/nonexclusive-distrib/1.0/","  We review in this paper the research status on testing the completeness of
Quantum mechanics in High Energy Physics, especially on the Bell Inequalities.
We briefly introduce the basic idea of Einstein, Podolsky, and Rosen paradox
and the results obtained in photon experiments. In the tests of Bell
inequalities in high energy physics, the early attempts of using spin
correlations in particle decays and later on the mixing of neutral mesons used
to form the quasi-spin entangled states are covered. The related experimental
results in K^0 and B^0 systems are presented and discussed. We introduce the
new scheme, which is based on the non-maximally entangled state and proposed to
implement in \phi factory, in testing the Local Hidden Variable Theory. And, we
also discuss the possibility in generalizing it to the tau charm factory.
","[{""version"":""v1"",""created"":""Tue, 27 Feb 2007 06:54:06 GMT""},{""version"":""v2"",""created"":""Sat, 4 Apr 2009 03:25:06 GMT""}]","2009-04-04"
"hep-ph/0702272","Jan Nemchik","B.Z. Kopeliovich (Santa Maria U., Valparaiso & Dubna, JINR), J.
  Nemchik (IEP SAS, Kosice), Ivan Schmidt (Santa Maria U., Valparaiso)","Color Transparency at Low Energies: Predictions for JLAB","16 pages including 2 figures","Phys.Rev.C76:015205,2007","10.1103/PhysRevC.76.015205","USM-TH-206","hep-ph",,"  The study of color transparency (CT) in elastic electroproduction of vector
mesons off nuclei encounters the problem of the onset of coherence length (CL)
effects. The problem of CT-CL separation arises especially at medium energies,
corresponding to HERMES experiment, when the coherence length is of the order
of the nuclear radius R_A. Only at asymptotic large energies, corresponding to
large CL, l_c >> R_A, the CT-CL mixing can be eliminated. On the other hand,
the net CT effects can be studied in the kinematic range accessible by the CLAS
experiment, since in this case the CL is much smaller than the nuclear radius.
Using light-cone quantum chromodynamics (QCD) dipole formalism we investigate
manifestations of CT effects in electroproduction of vector mesons. Motivated
by expected data from the CLAS experiment at JLab, we predict the A and Q^2
dependence of nuclear transparency for rho^0 mesons produced incoherently off
nuclei. We demonstrate that in the CLAS kinematical region the CL effects are
weak enough to keep the photon energy at such values as to obtain maximal
photon virtualities keeping optimal statistics of the data. This has a clear
advantage in comparison with a standard investigation of net CT effects fixing
CL.
","[{""version"":""v1"",""created"":""Tue, 27 Feb 2007 09:12:15 GMT""},{""version"":""v2"",""created"":""Thu, 1 Mar 2007 11:50:03 GMT""}]","2008-11-26"
"hep-ph/0702273","Zolt\'an Tr\'ocs\'anyi","Zoltan Nagy, Gabor Somogyi and Zoltan Trocsanyi","Separation of soft and collinear infrared limits of QCD squared matrix
  elements","14 pages, 1 figure, references added",,,"CERN-PH-TH/2006-231, ZU-TH 3/07","hep-ph",,"  We present a simple way of separating the overlap between the soft and
collinear factorization formulae of QCD squared matrix elements. We check its
validity explicitly for single and double unresolved emissions of tree-level
processes. The new method makes possible the definition of helicity-dependent
subtraction terms for regularizing the real contributions in computing
radiative corrections to QCD jet cross sections. This implies application of
Monte Carlo helicity summation in computing higher order corrections.
","[{""version"":""v1"",""created"":""Tue, 27 Feb 2007 09:38:43 GMT""},{""version"":""v2"",""created"":""Wed, 28 Feb 2007 16:48:23 GMT""}]","2007-05-23"
"hep-ph/0702274","Koichi Hamaguchi","K. Hamaguchi, T. Hatsuda, M. Kamimura, Y. Kino and T. T. Yanagida","Stau-catalyzed $^6$Li Production in Big-Bang Nucleosynthesis","16 pages, 7 figures","Phys.Lett.B650:268-274,2007","10.1016/j.physletb.2007.05.030","TKYNT-07-04, UT-07-08","hep-ph astro-ph nucl-th",,"  If the gravitino mass is in the region from a few GeV to a few 10's GeV, the
scalar lepton X such as stau is most likely the next lightest supersymmetry
particle. The negatively charged and long-lived X^- may form a Coulomb bound
state (A X) with a nucleus A and may affect the big-bang nucleosynthesis
through catalyzed fusion process. We calculate a production cross section of
Li6 from the catalyzed fusion (He4 X^-) + d \to Li6 + X^- by solving the
Schr\""{o}dinger equation exactly for three-body system of He4, d, and X. We
utilize the state-of-the-art coupled-channel method, which is known to be very
accurate to describe other three-body systems in nuclear and atomic reactions.
The importance of the use of appropriate nuclear potential and the exact
treatment of the quantum tunneling in the fusion process are emphasized. We
find that the astrophysical S-factor at the Gamow peak corresponding to T=10
keV is 0.038 MeV barn. This leads to the Li6 abundance from the catalyzed
process as Li6|_{CBBN}\simeq 4.3\times 10^{-11} (D/2.8\times 10^{-5})
([n_{X^-}/s]/10^{-16}) in the limit of long lifetime of X. Particle physics
implication of this result is also discussed.
","[{""version"":""v1"",""created"":""Tue, 27 Feb 2007 13:06:38 GMT""}]","2008-11-26"
"hep-ph/0702275","Stefan Recksiegel","Robert Fleischer, Stefan Recksiegel and Felix Schwab","On Puzzles and Non-Puzzles in B -> pi pi, pi K Decays","12 pages, 4 figures. References added, to appear in EPJC","Eur.Phys.J.C51:55-61,2007","10.1140/epjc/s10052-007-0277-8","CERN-PH-TH/2007-044, TUM-HEP-663/07, UAB-FT-627","hep-ph",,"  Recently, we have seen interesting progress in the exploration of CP
violation in B^0_d -> pi^+ pi^-: the measurements of mixing-induced CP
violation by the BaBar and Belle collaborations are now in good agreement with
each other, whereas the picture of direct CP violation is still unclear. Using
the branching ratio and direct CP asymmetry of B^0_d -> pi^- K^+, this
situation can be clarified. We predict A_CP^dir(B_d -> pi^+ pi^-) =
-0.24+-0.04, which favours the BaBar result, and extract
gamma=(70.0^{+3.8}_{-4.3})deg, which agrees with the unitarity triangle fits.
Extending our analysis to other B -> pi K modes and B^0_s -> K^+ K^- with the
help of the SU(3) flavour symmetry and plausible dynamical assumptions, we find
that all observables with colour-suppressed electroweak penguin contributions
are measured in excellent agreement with the Standard Model. As far as the
ratios R_{c,n} of the charged and neutral B -> pi K branching ratios are
concerned, which are sizeably affected by electroweak penguin contributions,
our Standard-Model predictions have almost unchanged central values, but
significantly reduced errors. Since the new data have moved quite a bit towards
these results, the ""B -> pi K puzzle"" for the CP-conserving quantities has been
significantly reduced. However, the mixing-induced CP violation of B^0_d ->
pi^0 K_S does look puzzling; if confirmed by future measurements, this effect
could be accommodated through a modified electroweak penguin sector with a
large CP-violating new-physics phase. Finally, we point out that the
established difference between the direct CP asymmetries of B^+- -> pi^0 K^+-
and B_d -> pi^-+ K^+- appears to be generated by hadronic and not by new
physics.
","[{""version"":""v1"",""created"":""Tue, 27 Feb 2007 13:55:46 GMT""},{""version"":""v2"",""created"":""Fri, 9 Mar 2007 18:03:48 GMT""}]","2008-11-26"
"hep-ph/0702276","Elise Jennings","E. Jennings","Polarisation Observables in Antiproton Proton to Lepton Antilepton
  Reactions","4 pages, to be published in the Proceedings of the 17th International
  Spin Physics Symposium (SPIN 2006), Kyoto, Japan; October 2-7, 2006","AIPConf.Proc.915:693-696,2007","10.1063/1.2750874",,"hep-ph",,"  The electromagnetic form factors of hadrons as measured both in the space
like and time like domains provide fundamental information on the nucleon
structure and internal dynamics. General expressions, including the lepton
mass, for the spin averaged differential cross section for the annihilation
reaction lepton antilepton to proton antiproton are given, as well as general
formulae for the single and double spin asymmetries. The time reversed reaction
would involve a kinematic factor. We also present general expressions for the
helicity amplitudes for this reaction.
","[{""version"":""v1"",""created"":""Tue, 27 Feb 2007 15:48:37 GMT""}]","2008-11-26"
"hep-ph/0702277","Sarira Sahu Dr.","Sarira Sahu","Multi-GeV neutrinos due to neutro anti-neutron oscillation in Gamma-Ray
  Burst Fireballs","4 pages, two columns, revtex style",,"10.1142/S021773230702378X",,"hep-ph",,"  The long and short gamma-ray bursts are believed to be produced due to
collapse of massive stars and merger of compact binaries respectively. All
these objects are rich in neutron and the jet outflow from these objects must
have a neutron component in it. By postulating the neutron anti-neutron
oscillation in the gamma-ray burst fireball, we show that, 19-38 GeV neutrinos
and anti-neutrinos can be produced due to annihilation of anti-neutrons with
the background neutrons. These neutrinos and anti-neutrinos will be produced
before the 5-10 GeV neutrinos due to dynamical decoupling of neutrons from the
rest of the fireball. Observation of these neutrinos will shed more light on
the nature of the GRB progenitors and also be a unique signature of physics
beyond the standard model. A possible way of detecting these neutrinos in
future is also discussed.
","[{""version"":""v1"",""created"":""Tue, 27 Feb 2007 15:58:58 GMT""}]","2009-11-13"
"hep-th/0702192","Steven Willison","Andres Anabalon, Steven Willison and Jorge Zanelli","The Universe as a topological defect","18 pages, LaTex, 4 figures. Title of the published version changed to
  ""Universe as a Topological defect"" by the journal","Phys.Rev.D77:044019,2008","10.1103/PhysRevD.77.044019","CECS-PH-07/03","hep-th astro-ph gr-qc",,"  Four-dimensional Einstein's General Relativity is shown to arise from a gauge
theory for the conformal group, SO(4,2). The theory is constructed from a
topological dimensional reduction of the six-dimensional Euler density
integrated over a manifold with a four-dimensional topological defect. The
resulting action is a four-dimensional theory defined by a gauged
Wess-Zumino-Witten term. An ansatz is found which reduces the full set of field
equations to those of Einstein's General Relativity. When the same ansatz is
replaced in the action, the gauged WZW term reduces to the Einstein-Hilbert
action. Furthermore, the unique coupling constant in the action can be shown to
take integer values if the fields are allowed to be analytically continued to
complex values.
","[{""version"":""v1"",""created"":""Mon, 26 Feb 2007 17:00:13 GMT""},{""version"":""v2"",""created"":""Tue, 5 Jun 2007 22:21:50 GMT""},{""version"":""v3"",""created"":""Fri, 14 Mar 2008 19:57:24 GMT""}]","2008-11-26"
"hep-th/0702196","Micha{\l} Spali\'nski","Michal Spalinski","On Power Law Inflation in DBI Models","References and comments added","JCAP 0705:017,2007","10.1088/1475-7516/2007/05/017",,"hep-th",,"  Inflationary models in string theory which identify the inflaton with an open
string modulus lead to effective field theories with non-canonical kinetic
terms: Dirac-Born-Infeld scalar field theories. In the case of a $D$-brane
moving in an AdS throat with a quadratic scalar field potential DBI kinetic
terms allow a novel realization of power law inflation. This note adresses the
question of whether this behaviour is special to this particular choice of
throat geometry and potential. The answer is that for any throat geometry one
can explicitly find a potential which leads to power law inflation. This
generalizes the well known fact that an exponential potential gives power law
inflation in the case of canonical kinetic terms.
","[{""version"":""v1"",""created"":""Mon, 26 Feb 2007 20:17:51 GMT""},{""version"":""v2"",""created"":""Thu, 26 Apr 2007 13:48:03 GMT""}]","2009-11-13"
"hep-th/0702204","Masoud Soroush","Masoud Soroush","Constraints on Meta-stable de Sitter Flux Vacua","22 pages, 2 figures, LaTeX; v2: typos corrected, references added","Adv. Theor. Math. Phys. 13 (2009) 187",,"SU-ITP-2007-02, SLAC-PUB-12367","hep-th",,"  We consider flux compactification of type IIB string theory as the
orientifold limit of an F-theory on a Calabi-Yau fourfold. We show that when
supersymmetry is dominantly broken by the axion-dilaton and the contributions
of the F-terms associated with complex structure moduli are small, the Hessian
of the flux potential always has tachyonic modes for de Sitter vacua. This
implies that there exist no meta-stable de Sitter vacua in this limit.
Moreover, we find that the stability requirement imposes a relation between the
values of cosmological constant and the scale of supersymmetry breaking for
non-supersymmetric anti de Sitter vacua in this limit. The proof is general and
does not rely on the details of the geometry of the compact Calabi-Yau internal
space. We finally analyze the consequences of these constraints on the
statistics of meta-stable de Sitter vacua and address some other related
issues.
","[{""version"":""v1"",""created"":""Mon, 26 Feb 2007 19:10:47 GMT""},{""version"":""v2"",""created"":""Fri, 16 Mar 2007 23:53:10 GMT""}]","2009-01-17"
"hep-th/0702205","Stanley J. Brodsky","Stanley J. Brodsky and Guy F. de Teramond","AdS/CFT and QCD","Invited talk presented at the 2006 International Workshop On The
  Origin Of Mass And Strong Coupling Gauge Theories (SCGT 06)",,"10.1142/9789812790750_0003","slac-pub-12361","hep-th hep-ph",,"  The AdS/CFT correspondence between string theory in AdS space and conformal
field theories in physical space-time leads to an analytic, semi-classical
model for strongly-coupled QCD which has scale invariance and dimensional
counting at short distances and color confinement at large distances. Although
QCD is not conformally invariant, one can nevertheless use the mathematical
representation of the conformal group in five-dimensional anti-de Sitter space
to construct a first approximation to the theory. The AdS/CFT correspondence
also provides insights into the inherently non-perturbative aspects of QCD,
such as the orbital and radial spectra of hadrons and the form of hadronic
wavefunctions. In particular, we show that there is an exact correspondence
between the fifth-dimensional coordinate of AdS space z and a specific impact
variable zeta which measures the separation of the quark and gluonic
constituents within the hadron in ordinary space-time. This connection allows
one to compute the analytic form of the frame-independent light-front
wavefunctions, the fundamental entities which encode hadron properties and
allow the computation of decay constants, form factors, and other exclusive
scattering amplitudes. New relativistic light-front equations in ordinary
space-time are found which reproduce the results obtained using the
5-dimensional theory. The effective light-front equations possess remarkable
algebraic structures and integrability properties. Since they are complete and
orthonormal, the AdS/CFT model wavefunctions can also be used as a basis for
the diagonalization of the full light-front QCD Hamiltonian, thus
systematically improving the AdS/CFT approximation.
","[{""version"":""v1"",""created"":""Tue, 27 Feb 2007 00:10:35 GMT""}]","2017-08-23"
"hep-th/0702206","Nemanja Kaloper","Nemanja Kaloper","A New Dimension Hidden in the Shadow of a Wall","8 pages LaTeX, 1 .eps figure; typo fixed, references updated, in
  press in PLB","Phys.Lett.B652:92-96,2007","10.1016/j.physletb.2007.06.054",,"hep-th astro-ph gr-qc hep-ph",,"  We propose a new way to hide the fifth dimension, and to modify gravity in
the far infra-red. A gravitating tensional membrane in five dimensions folds
the transverse space into a truncated cone, stoppered by the membrane. For
near-critical tension, the conical opening is tiny, and the space becomes a
very narrow conical sliver. A very long section, of length comparable to the
membrane radius divided by the remaining conical angle, of this sliver is well
approximated by a narrow cylinder ending on the membrane. Inside this
cylindrical throat we can reduce the theory on the circle. At distances between
the circle radius and the length of the cylinder, the theory looks 4D, with a
Brans-Dicke-like gravity, and a preferred direction, while at larger distances
the cone opens up and the theory turns 5D. The gravitational light scalar in
the throat can get an effective local mass term from the interplay of matter
interactions and quantum effective potentials on the cone, which may suppress
its long range effects. We discuss some phenomenologically interesting
consequences.
","[{""version"":""v1"",""created"":""Tue, 27 Feb 2007 00:37:00 GMT""},{""version"":""v2"",""created"":""Sun, 8 Jul 2007 15:26:24 GMT""}]","2008-11-26"
