"0704.3621","Paul E. Reimer","Paul E. Reimer","Exploring the Partonic Structure of Hadrons through the Drell-Yan
  Process","23 pages, 9 figures, to appear in J. Phys. G, resubmission corrects
  typographical errors","J.Phys.G34:S107-S126,2007","10.1088/0954-3899/34/7/S06",,"nucl-ex",,"  The Drell-Yan process is a standard tool for probing the partonic structure
of hadrons. Since the process proceeds through a quark-antiquark annihilation,
Drell-Yan scattering possesses a unique ability to selectively probe sea
distributions. This review examines the application of Drell-Yan scattering to
elucidating the flavor asymmetry of the nucleon's sea and nuclear modifications
to the sea quark distributions in unpolarized scattering. Polarized beams and
targets add an exciting new dimension to Drell-Yan scattering. In particular,
the two initial-state hadrons give Drell-Yan sensitivity to chirally-odd
transversity distributions.
","[{""version"":""v1"",""created"":""Thu, 26 Apr 2007 20:33:14 GMT""},{""version"":""v2"",""created"":""Tue, 1 May 2007 16:04:21 GMT""}]","2008-11-26"
"0704.3622","Cynthia J. Olson Reichhardt","C. Reichhardt and C.J. Olson Reichhardt","Disordering Transitions and Peak Effect in Polydisperse Particle Systems","8 pages, 8 postscript figures. Version to appear in PRE","Phys. Rev. E 77, 041401 (2008)","10.1103/PhysRevE.77.041401",,"cond-mat.soft cond-mat.supr-con",,"  We show numerically that in a binary system of Yukawa particles, a dispersity
driven disordering transition occurs. In the presence of quenched disorder this
disordering transition coincides with a marked increase in the depinning
threshold, known as a peak effect. We find that the addition of poorly pinned
particles can increase the overall pinning in the sample by increasing the
amount of topological disorder present. If the quenched disorder is strong
enough to create a significant amount of topological disorder in the
monodisperse system, addition of a poorly pinned species generates further
disorder but does not produce a peak in the depinning force. Our results
indicate that for binary mixtures, optimal pinning occurs for topological
defect fraction densities of 0.2 to 0.25. For defect densities below this
range, the system retains orientational order. We determine the effect of the
pinning density, strength, and radius on the depinning peak and find that the
peak effect is more pronounced in weakly pinning systems.
","[{""version"":""v1"",""created"":""Thu, 26 Apr 2007 20:37:29 GMT""},{""version"":""v2"",""created"":""Mon, 7 Apr 2008 20:30:04 GMT""}]","2009-11-13"
"0704.3623","Masato Minamitsuji","Masato Minamitsuji","Casimir effect in a 6D warped flux compactification model","18 pages, 6 figures, references and comments added, typos corrected",,,"LMU-ASC 28/07","gr-qc astro-ph hep-ph hep-th",,"  We discuss Casimir effect of a massless, minimally coupled scalar field in a
6D warped flux compactification model and its implications for the hierarchy
and cosmological constant problems, which are longstanding puzzles in
phenomenology and cosmology. Due to the scale invariance of the background
theory, the 4D effective theory contains a volume modulus. To stabilize the
modulus, we consider one-loop corrections to the effective potential by the
Casimir effect. The one-loop effective potential for the volume modulus has a
form which is very similar to Coleman-Weinberg potential. We evaluate
coefficients appearing in the effective potential by employing zeta function
regularization and heat kernel analysis. The volume modulus is stabilized for
smaller degrees of warping, below a critical value, which depends on deficit
angle of the reference brane. After stabilizing the modulus, it is possible to
obtain observed values of the mass ratio between the fundamental energy scales
and a tiny effective cosmological constant (though its sign is negative). The
degree of warping should be tuned to be close to the critical value, not as
severely as the original fine-tuning.
","[{""version"":""v1"",""created"":""Thu, 26 Apr 2007 20:38:33 GMT""},{""version"":""v2"",""created"":""Mon, 7 May 2007 08:33:44 GMT""}]","2007-05-23"
"0704.3624","Alexander D. Hernandez","Alexander D. Hernandez, Arturo Lopez, and Daniel Dominguez","Anisotropic ac dissipation at the surface of mesoscopic superconductors","4 pages, 2 figures","Applied Surface Science 254, 69 (2007)","10.1016/j.apsusc.2007.07.038",,"cond-mat.supr-con cond-mat.mes-hall",,"  In this work we study the ac dissipation of mesoscopic superconductors at
microwave frequencies using the time dependent Ginzburg-Landau equations. Our
numerical simulations show that the ac dissipation is strongly dependent on the
orientation of the ac magnetic field ($h_{ac}$) relative to the dc magnetic
field ($H_{dc}$). When $h_{ac}$ is parallel to $H_{dc}$ we observe that each
vortex penetration event produces a significant supression of the ac losses
because the imaginary part of the ac susceptibility as a function of $H_{dc}$
increases before the penetration of vortices, and then it decreases abruptly
after vortices have entered into the sample. In the second case, when $h_{ac}$
is perpendicular to $H_{dc}$, we observe that the jumps in dissipation occur at
the same values of $H_{dc}$ but are much smaller than in the parallel
configuration. The behavior of the dissipation in the perpendicular
configuration is similar to previous results obtained in recent microwave
experiments using mesoscopic litographed squares of Pb [J. Low Temp. Phys. 135,
119 (2004)].
","[{""version"":""v1"",""created"":""Thu, 26 Apr 2007 20:42:13 GMT""}]","2008-06-06"
"0704.3625","Kenji Fukushima","Kenji Fukushima","Initial fields and instability in the classical model of the heavy-ion
  collision","5 pages, 2 figures","Phys.Rev.C76:021902,2007; Erratum-ibid.C77:029901,2007","10.1103/PhysRevC.76.021902 10.1103/PhysRevC.77.029901","RBRC-680","hep-ph",,"  Color Glass Condensate (CGC) provides a classical description of dense gluon
matter at high energies. Using the McLerran-Venugopalan (MV) model we calculate
the initial energy density \epsilon(\tau) in the early stage of the
relativistic nucleus-nucleus collision. Our analytical formula reproduces the
quantitative results from lattice discretized simulations and leads to an
estimate \epsilon(\tau=0.1fm)=40-50GeV/fm^3 in the Au-Au collision at RHIC
energy. We then formulate instability with respect to soft fluctuations that
violate boost invariance inherent to hard CGC backgrounds. We find unstable
modes arising as a result of ensemble average over the initial CGC fields.
","[{""version"":""v1"",""created"":""Thu, 26 Apr 2007 20:54:58 GMT""},{""version"":""v2"",""created"":""Tue, 22 May 2007 18:47:41 GMT""}]","2014-11-18"
"0704.3626","Ismail Turan","Mariana Frank, Ismail Turan (Concordia Univ.) and Lorric Ziegler
  (Concordia Univ. and Univ. of Geneva)","The Casimir Force in Randall Sundrum Models","16 pages, 2 figures, references added, text improved, accepted for
  publication in PRD","Phys.Rev.D76:015008,2007","10.1103/PhysRevD.76.015008","CUMQ/HEP 145","hep-ph hep-th",,"  We discuss and compare the effects of one extra dimension in the Randall
Sundrum models on the evaluation of the Casimir force between two parallel
plates. We impose the condition that the result reproduce the experimental
measurements within the known uncertainties in the force and the plate
separation, and get an upper bound kR < 20 if the curvature parameter k of
AdS_5 is equal to the Planck scale. Although the upper bound decreases as k
decreases, kR ~ 12, which is the required value for solving the hierarchy
problem, is consistent with the Casimir force measurements. For the case where
the 5th dimension is infinite, the correction to the Casimir force is very
small and negligible.
","[{""version"":""v1"",""created"":""Thu, 26 Apr 2007 20:55:50 GMT""},{""version"":""v2"",""created"":""Tue, 12 Jun 2007 05:19:44 GMT""}]","2008-11-26"
"0704.3627","Alastair Craw","Alastair Craw","The Special McKay correspondence as an equivalence of derived categories","17 pages. Final version, to appear in Quart. J. Math","Quarterly Journal of Mathematics 62 (2011), 573-591",,,"math.AG math.RT","http://arxiv.org/licenses/nonexclusive-distrib/1.0/","  We give a new moduli construction of the minimal resolution of the
singularity of type 1/r(1,a) by introducing the Special McKay quiver. To
demonstrate that our construction trumps that of the G-Hilbert scheme, we show
that the induced tautological line bundles freely generate the bounded derived
category of coherent sheaves on X by establishing a suitable derived
equivalence. This gives a moduli construction of the Special McKay
correspondence for abelian subgroups of GL(2).
","[{""version"":""v1"",""created"":""Thu, 26 Apr 2007 21:06:10 GMT""},{""version"":""v2"",""created"":""Wed, 6 Aug 2008 16:52:56 GMT""},{""version"":""v3"",""created"":""Mon, 25 Jan 2010 14:53:02 GMT""},{""version"":""v4"",""created"":""Sat, 5 Jun 2010 16:26:23 GMT""}]","2011-08-25"
"0704.3628","Andris Ambainis","Andris Ambainis","A nearly optimal discrete query quantum algorithm for evaluating NAND
  formulas","21 pages, 2 figures",,,,"quant-ph",,"  We present an O(\sqrt{N}) discrete query quantum algorithm for evaluating
balanced binary NAND formulas and an O(N^{{1/2}+O(\frac{1}{\sqrt{\log N}})})
discrete query quantum algorithm for evaluating arbitrary binary NAND formulas.
","[{""version"":""v1"",""created"":""Thu, 26 Apr 2007 21:11:36 GMT""}]","2007-05-23"
"0704.3629","John H. Wise","John H. Wise, Tom Abel (KIPAC, Stanford)","Resolving the Formation of Protogalaxies. I. Virialization","13 pages, 6 figures. Submitted to ApJ on 8 March 2007. Revised
  manuscript. Comments welcome","Astrophys.J.665:899-910,2007","10.1086/520036",,"astro-ph",,"  (Abridged) Galaxies form in hierarchically assembling dark matter halos. With
cosmological three dimensional adaptive mesh refinement simulations, we explore
in detail the virialization of baryons in the concordance cosmology, including
optically thin primordial gas cooling. We focus on early protogalaxies with
virial temperatures of 10^4 K and their progenitors. Without cooling, virial
heating occurs in shocks close to the virial radius for material falling in
from voids. Material in dense filaments penetrates deeper to about half that
radius. With cooling the virial shock position shrinks and also the filaments
reach scales as small as a third the virial radius. The temperatures in
protogalaxies found in adiabatic simulations decrease by a factor of two from
the center and show flat entropy cores. In cooling halos the gas reaches virial
equilibrium with the dark matter potential through its turbulent velocities. We
observe turbulent Mach numbers ranging from one to three in the cooling cases.
This turbulence is driven by the large scale merging and interestingly remains
supersonic in the centers of these early galaxies even in the absence of any
feedback processes. The virial theorem is shown to approximately hold over 3
orders of magnitude in length scale with the turbulent pressure prevailing over
the thermal energy. The turbulent velocity distributions are Maxwellian and by
far dominate the small rotation velocities associated with the total angular
momentum of the galaxies. Decomposing the velocity field using the
Cauchy-Stokes theorem, we show that ample amounts of vorticity are present
around shocks even at the very centers of these objects.
","[{""version"":""v1"",""created"":""Thu, 26 Apr 2007 22:20:25 GMT""}]","2009-06-23"
"0704.3630","Ming-Ho Siu","M. Stewart Siu","Adiabatic Rotation, Quantum Search and Preparation of Superposition
  States","Expanded to 6 pages; Accepted by Phys. Rev. A",,"10.1103/PhysRevA.75.062337",,"quant-ph",,"  We introduce the idea of using adiabatic rotation to generate superpositions
of a large class of quantum states. For quantum computing this is an
interesting alternative to the well-studied ""straight line"" adiabatic
evolution. In ways that complement recent results, we show how to efficiently
prepare three types of states: Kitaev's toric code state, the cluster state of
the measurement-based computation model and the history state used in the
adiabatic simulation of quantum circuit. We also show that the method, when
adapted for quantum search, provides quadratic speedup as other optimal methods
do with the advantages that the problem Hamiltonian is time-independent and
that the energy gap above the ground state is strictly nondecreasing with time.
Likewise the method can be used for optimization as an alternative to the usual
adiabatic algorithm.
","[{""version"":""v1"",""created"":""Thu, 26 Apr 2007 21:13:33 GMT""},{""version"":""v2"",""created"":""Fri, 4 May 2007 01:12:15 GMT""}]","2009-11-13"
"0704.3631","William Moore","W. Frank Moore","Cohomology of Fiber Products of Local Rings","13 pages","Journal of Algebra 321 (2009) 758-773",,,"math.AC math.RA",,"  Let $S$ and $T$ be local rings with common residue field $k$, let $R$ be the
fiber product $S \times_k T$, and let $M$ be an $S$-module. The Poincar\'e
series $P^R_M$ of $M$ has been expressed in terms of $P^S_M$, $P^S_k$ and
$P^T_k$ by Kostrikin and Shafarevich, and by Dress and Kr\""amer. Here, an
explicit minimal resolution, as well as theorems on the structure of
$\Ext_R(k,k)$ and $\Ext_R(M,k)$ are given that illuminate these equalities.
Structure theorems for the cohomology modules of fiber products of modules are
also given. As an application of these results, we compute the depth of
cohomology modules over a fiber product.
","[{""version"":""v1"",""created"":""Thu, 26 Apr 2007 21:32:46 GMT""}]","2009-10-07"
"0704.3632","Rolando Vald\'es Aguilar","R. Vald\'es Aguilar, A. B. Sushkov, C. L. Zhang, Y. J. Choi, S.-W.
  Cheong and H. D. Drew","Colossal magnon-phonon coupling in multiferroic
  Eu$_{0.75}$Y$_{0.25}$MnO$_3$","4 pages, 3 figures","Physical Review B 76 060404(R) (2007)","10.1103/PhysRevB.76.060404",,"cond-mat.mtrl-sci cond-mat.str-el",,"  We report the spectra of magnetically induced electric dipole absorption in
Eu$_{0.75}$Y$_{0.25}$MnO$_3$ from temperature dependent far infrared
spectroscopy (10-250 cm$^{-1}$). These spectra, which occur only in the $e||a$
polarization, consist of two relatively narrow electromagnon features that
onset at $T_{FE}=30$ K and a broad absorption band that persists to
temperatures well above $T_N=47$ K. The observed excitations account for the
step up of the static dielectric constant in the ferroelectric phase. The
electromagnon at 80 cm$^{-1}$ is observed to be strongly coupled to the nearby
lowest optical phonon which transfers more than 1/2 of its spectral weight to
the magnon. We attribute the origin of the broad background absorption to the
two magnon emission decay process of the phonon.
","[{""version"":""v1"",""created"":""Thu, 26 Apr 2007 21:46:05 GMT""},{""version"":""v2"",""created"":""Thu, 3 May 2007 21:57:27 GMT""},{""version"":""v3"",""created"":""Wed, 20 Jun 2007 19:08:24 GMT""},{""version"":""v4"",""created"":""Tue, 24 Jul 2007 15:36:51 GMT""}]","2007-10-23"
"0704.3633","Keir Lockridge","Mark Hovey and Keir H. Lockridge","Triangulations of projective modules","15 pages",,,,"math.AC math.AT math.RT",,"  We show that the category of projective modules over a graded commutative
ring admits a triangulation with respect to module suspension if and only if
the ring is a finite product of graded fields and exterior algebras on one
generator over a graded field (with a unit in the appropriate degree). We also
classify the ungraded commutative rings for which the category of projective
modules admits a triangulation with respect to the identity suspension.
Applications to two analogues of the generating hypothesis in algebraic
topology are given, and we translate our results into the setting of modules
over a symmetric ring spectrum or S-algebra.
","[{""version"":""v1"",""created"":""Thu, 26 Apr 2007 22:01:47 GMT""}]","2007-05-23"
"0704.3634","Paul Lasky","Paul Lasky, Anthony Lun","Gravitational collapse of spherically symmetric plasmas in
  Einstein-Maxwell spacetimes","Accepted for publication in Phys. Rev. D","Phys.Rev.D75:104010,2007","10.1103/PhysRevD.75.104010",,"gr-qc",,"  We utilize a recent formulation of a spherically symmetric spacetime endowed
with a general decomposition of the energy momentum tensor [Phys. Rev. D, 75,
024031 (2007)] to derive equations governing spherically symmetric
distributions of electromagnetic matter. We show the system reduces to the
Reissner-Nordstrom spacetime in general, spherically symmetric coordinates in
the vacuum limit. Furthermore, we show reduction to the charged Vaidya
spacetime in non-null coordinates when certain equations of states are chosen.
A model of gravitational collapse is discussed whereby a charged fluid resides
within a boundary of finite radial extent on the initial hypersurface, and is
allowed to radiate charged particles. Our formalism allows for the discussion
of all regions in this model without the need for complicated matching schemes
at the interfaces between successive regions. As further examples we consider
the collapse of a thin shell of charged matter onto a Reissner-Nordstrom black
hole. Finally, we reduce the entire system of equations to the static case such
that we have the equations for hydrostatic equilibrium of a charged fluid.
","[{""version"":""v1"",""created"":""Thu, 26 Apr 2007 22:15:13 GMT""},{""version"":""v2"",""created"":""Mon, 7 May 2007 01:02:23 GMT""}]","2008-11-26"
"0704.3635","Fulufhelo Vincent Nelwamondo","Fulufhelo Vincent Nelwamondo and Tshilidzi Marwala","Rough Sets Computations to Impute Missing Data","19 pages",,,,"cs.CV cs.IR",,"  Many techniques for handling missing data have been proposed in the
literature. Most of these techniques are overly complex. This paper explores an
imputation technique based on rough set computations. In this paper,
characteristic relations are introduced to describe incompletely specified
decision tables.It is shown that the basic rough set idea of lower and upper
approximations for incompletely specified decision tables may be defined in a
variety of different ways. Empirical results obtained using real data are given
and they provide a valuable and promising insight to the problem of missing
data. Missing data were predicted with an accuracy of up to 99%.
","[{""version"":""v1"",""created"":""Thu, 26 Apr 2007 22:22:45 GMT""}]","2007-05-23"
"0704.3636","Robert Buckingham","Jinho Baik, Robert Buckingham, and Jeffery DiFranco","Asymptotics of Tracy-Widom distributions and the total integral of a
  Painlev\'e II function","29 pages, 1 figure",,"10.1007/s00220-008-0433-5",,"math.FA math-ph math.MP math.PR nlin.SI",,"  The Tracy-Widom distribution functions involve integrals of a Painlev\'e II
function starting from positive infinity. In this paper, we express the
Tracy-Widom distribution functions in terms of integrals starting from minus
infinity. There are two consequences of these new representations. The first is
the evaluation of the total integral of the Hastings-McLeod solution of the
Painlev\'e II equation. The second is the evaluation of the constant term of
the asymptotic expansions of the Tracy-Widom distribution functions as the
distribution parameter approaches minus infinity. For the GUE Tracy-Widom
distribution function, this gives an alternative proof of the recent work of
Deift, Its, and Krasovsky. The constant terms for the GOE and GSE Tracy-Widom
distribution functions are new.
","[{""version"":""v1"",""created"":""Thu, 26 Apr 2007 22:35:55 GMT""}]","2009-11-13"
"0704.3637","Han Uitenbroek","Han Uitenbroek, Alexandra Tritschler, and Thomas Rimmele","The discrepancy in G-band contrast: Where is the quiet Sun?","16 pages, 8 figures",,"10.1086/521217",,"astro-ph",,"  We compare the rms contrast in observed speckle reconstructed G-band images
with synthetic filtergrams computed from two magneto-hydrodynamic simulation
snapshots. The observations consist of 103 bursts of 80 frames each taken at
the Dunn Solar Telescope (DST), sampled at twice the diffraction limit of the
telescope. The speckle reconstructions account for the performance of the
Adaptive Optics (AO) system at the DST to supply reliable photometry. We find a
considerable discrepancy in the observed rms contrast of 14.1% for the best
reconstructed images, and the synthetic rms contrast of 21.5% in a simulation
snapshot thought to be representative of the quiet Sun. The areas of features
in the synthetic filtergrams that have positive or negative contrast beyond the
minimum and maximum values in the reconstructed images have spatial scales that
should be resolved. This leads us to conclude that there are fundamental
differences in the rms G-band contrast between observed and computed
filtergrams. On the basis of the substantially reduced granular contrast of
16.3% in the synthetic plage filtergram we speculate that the quiet-Sun may
contain more weak magnetic field than previously thought.
","[{""version"":""v1"",""created"":""Thu, 26 Apr 2007 22:47:14 GMT""}]","2009-11-13"
"0704.3639","Filipe Tostevin","Filipe Tostevin, Pieter Rein ten Wolde, Martin Howard","Fundamental Limits to Position Determination by Concentration Gradients","24 pages, 2 figures","PLoS Computational Biology 3 e78 (2007)","10.1371/journal.pcbi.0030078",,"q-bio.SC cond-mat.stat-mech",,"  Position determination in biological systems is often achieved through
protein concentration gradients. Measuring the local concentration of such a
protein with a spatially-varying distribution allows the measurement of
position within the system. In order for these systems to work effectively,
position determination must be robust to noise. Here, we calculate fundamental
limits to the precision of position determination by concentration gradients
due to unavoidable biochemical noise perturbing the gradients. We focus on
gradient proteins with first order reaction kinetics. Systems of this type have
been experimentally characterised in both developmental and cell biology
settings. For a single gradient we show that, through time-averaging, great
precision can potentially be achieved even with very low protein copy numbers.
As a second example, we investigate the ability of a system with oppositely
directed gradients to find its centre. With this mechanism, positional
precision close to the centre improves more slowly with increasing averaging
time, and so longer averaging times or higher copy numbers are required for
high precision. For both single and double gradients, we demonstrate the
existence of optimal length scales for the gradients, where precision is
maximized, as well as analyzing how precision depends on the size of the
concentration measuring apparatus. Our results provide fundamental constraints
on the positional precision supplied by concentration gradients in various
contexts, including both in developmental biology and also within a single
cell.
","[{""version"":""v1"",""created"":""Thu, 26 Apr 2007 23:03:03 GMT""}]","2007-05-23"
"0704.3640","Dennis Wylie","Dennis Cates Wylie","Linked by Loops: Network Structure and Switch Integration in Complex
  Dynamical Systems","21 pages, 5 figures. Paper simplified and shortened. Quantities
  presented in table 1 are different, though related, to quantities previously
  presented in table 1",,,,"q-bio.QM cond-mat.dis-nn math.DS nlin.CD",,"  Simple nonlinear dynamical systems with multiple stable stationary states are
often taken as models for switchlike biological systems. This paper considers
the interaction of multiple such simple multistable systems when they are
embedded together into a larger dynamical ""supersystem."" Attention is focused
on the network structure of the resulting set of coupled differential
equations, and the consequences of this structure on the propensity of the
embedded switches to act independently versus cooperatively. Specifically, it
is argued that both larger average and larger variance of the node degree
distribution lead to increased switch independence. Given the frequency of
empirical observations of high variance degree distributions (e.g., power-law)
in biological networks, it is suggested that the results presented here may aid
in identifying switch-integrating subnetworks as comparatively homogenous,
low-degree, substructures. Potential applications to ecological problems such
as the relationship of stability and complexity are also briefly discussed.
","[{""version"":""v1"",""created"":""Thu, 26 Apr 2007 23:24:28 GMT""},{""version"":""v2"",""created"":""Fri, 13 Jul 2007 01:51:03 GMT""},{""version"":""v3"",""created"":""Tue, 22 Jan 2008 18:57:14 GMT""},{""version"":""v4"",""created"":""Thu, 10 Apr 2008 20:34:39 GMT""}]","2008-04-10"
