"0704.3444","Alexander J. Wagner","Qun Li, A.J. Wagner","A Symmetric Free Energy Based Multi-Component Lattice Boltzmann Method","7 pager, 4 figures",,"10.1103/PhysRevE.76.036701",,"cond-mat.soft",,"  We present a lattice Boltzmann algorithm based on an underlying free energy
that allows the simulation of the dynamics of a multicomponent system with an
arbitrary number of components. The thermodynamic properties, such as the
chemical potential of each component and the pressure of the overall system,
are incorporated in the model. We derived a symmetrical convection diffusion
equation for each component as well as the Navier Stokes equation and
continuity equation for the overall system. The algorithm was verified through
simulations of binary and ternary systems. The equilibrium concentrations of
components of binary and ternary systems simulated with our algorithm agree
well with theoretical expectations.
","[{""version"":""v1"",""created"":""Thu, 26 Apr 2007 16:22:22 GMT""}]","2009-11-13"
"0704.3448","Steve Gonek","S. M. Gonek","Finite Euler products and the Riemann Hypothesis","4 figures",,,,"math.NT math.CV",,"  We show that if the Riemann Hypothesis is true, then in a region containing
most of the right-half of the critical strip, the Riemann zeta-function is well
approximated by short truncations of its Euler product. Conversely, if the
approximation by products is good in this region, the zeta-function has at most
finitely many zeros in it. We then construct a parameterized family of
non-analytic functions with this same property. With the possible exception of
a finite number of zeros off the critical line, every function in the family
satisfies a Riemann Hypothesis. Moreover, when the parameter is not too large,
they have about the same number of zeros as the zeta-function, their zeros are
all simple, and they ""repel"". The structure of these functions makes the reason
for the simplicity and repulsion of their zeros apparent and suggests a
mechanism that might be responsible for the corresponding properties of the
zeta-function's zeros. Computer evidence suggests that the zeros of functions
in the family are remarkably close to those of the zeta-function (even for
small values of the parameter), and we show that they indeed converge to them
as the parameter increases. Furthermore, between zeros of the zeta-function,
the moduli of functions in the family tend to twice the modulus of the
zeta-function. Both assertions assume the Riemann Hypothesis. We end by
discussing analogues for other L-functions and show how they give insight into
the study of the distribution of zeros of linear combinations of L-functions.
","[{""version"":""v1"",""created"":""Thu, 26 Apr 2007 18:21:22 GMT""}]","2007-05-23"
"0704.3457","Dmitrii L. Maslov","Andrey V. Chubukov, Dmitrii L. Maslov","Cooper channel and the singularities in the thermodynamics of a Fermi
  liquid","5 pages, 1 figure",,"10.1103/PhysRevB.76.165111",,"cond-mat.str-el",,"  We analyze how the logarithmic renormalizations in the Cooper channel affect
the non-analytic temperature dependence of the specific heat coefficient \gamma
(T) - \gamma (0)=A(T)T in a 2D Fermi liquid. We show that A(T) is expressed
exactly in terms of the fully renormalized backscattering amplitude which
includes the renormalization in the Cooper channel. In contrast to the 1D case,
both charge and spin components of the backscattering amplitudes are subject to
this renormalization. We show that the logarithmic renormalization of the
charge amplitude vanishes for a flat Fermi surface, when the system becomes
effectively one-dimensional.
","[{""version"":""v1"",""created"":""Thu, 26 Apr 2007 19:12:17 GMT""}]","2009-11-13"
"0704.3469","Brant Jones","Hugh Denoncourt and Brant C. Jones","The enumeration of maximally clustered permutations","17 pages; corrected typos, added new section",,,,"math.CO","http://arxiv.org/licenses/nonexclusive-distrib/1.0/","  The maximally clustered permutations are characterized by avoiding the
classical permutation patterns 3421, 4312, and 4321. This class contains the
freely-braided permutations and the fully-commutative permutations. In this
work, we show that the generating functions for certain fully-commutative
pattern classes can be transformed to give generating functions for the
corresponding freely-braided and maximally clustered pattern classes. Moreover,
this transformation of generating functions is rational. As a result, we obtain
enumerative formulas for the pattern classes mentioned above as well as the
corresponding hexagon-avoiding pattern classes where the hexagon-avoiding
permutations are characterized by avoiding 46718235, 46781235, 56718234, and
56781234.
","[{""version"":""v1"",""created"":""Thu, 26 Apr 2007 16:49:32 GMT""},{""version"":""v2"",""created"":""Thu, 25 Sep 2008 17:54:39 GMT""}]","2008-09-25"
"0704.3486","Tilo Wettig","J. Bloch, A. Frommer, B. Lang, T. Wettig","An iterative method to compute the sign function of a non-Hermitian
  matrix and its application to the overlap Dirac operator at nonzero chemical
  potential","11 pages, 4 figures; minor changes, as published in Comput. Phys.
  Commun.","Comput.Phys.Commun.177:933-943,2007",,,"hep-lat",,"  The overlap Dirac operator in lattice QCD requires the computation of the
sign function of a matrix. While this matrix is usually Hermitian, it becomes
non-Hermitian in the presence of a quark chemical potential. We show how the
action of the sign function of a non-Hermitian matrix on an arbitrary vector
can be computed efficiently on large lattices by an iterative method. A Krylov
subspace approximation based on the Arnoldi algorithm is described for the
evaluation of a generic matrix function. The efficiency of the method is
spoiled when the matrix has eigenvalues close to a function discontinuity. This
is cured by adding a small number of critical eigenvectors to the Krylov
subspace, for which we propose two different deflation schemes. The ensuing
modified Arnoldi method is then applied to the sign function, which has a
discontinuity along the imaginary axis. The numerical results clearly show the
improved efficiency of the method. Our modification is particularly effective
when the action of the sign function of the same matrix has to be computed many
times on different vectors, e.g., if the overlap Dirac operator is inverted
using an iterative method.
","[{""version"":""v1"",""created"":""Thu, 26 Apr 2007 19:56:21 GMT""},{""version"":""v2"",""created"":""Fri, 19 Oct 2007 14:27:13 GMT""}]","2016-02-09"
"0704.3487","Charles M. Marcus","J. R. Williams, L. DiCarlo, C. M. Marcus","Quantum Hall Effect in a Graphene p-n Junction","related papers at http://marcuslab.harvard.edu. Fixed a factor of 2
  in Eq. 1 and 2","Science 317, 638 (2007)",,,"cond-mat.mes-hall cond-mat.mtrl-sci",,"  We report on the fabrication and transport studies of a single-layer graphene
p-n junction. Carrier type and density in two adjacent regions are individually
controlled by electrostatic gating using a local top gate and a global back
gate. A functionalized Al203 oxide that adheres to graphene and does not
significantly affect its electronic properties is described. Measurements in
the quantum Hall regime reveal new plateaus of two-terminal conductance across
the junction at 1 and 3/2 times the quantum of conductance, e2/h, consistent
with theory.
","[{""version"":""v1"",""created"":""Thu, 26 Apr 2007 19:57:15 GMT""},{""version"":""v2"",""created"":""Tue, 28 Aug 2007 17:18:04 GMT""}]","2007-08-28"
"0704.3502","Cyril Houdayer","Cyril Houdayer","Construction of type ${\rm II_1}$ factors with prescribed countable
  fundamental group","33 pages","J. reine angew Math. 634 (2009), 169-207",,,"math.OA math.GR","http://arxiv.org/licenses/nonexclusive-distrib/1.0/","  In the context of Free Probability Theory, we study two different
constructions that provide new examples of factors of type ${\rm II_1}$ with
prescribed fundamental group. First we investigate state-preserving group
actions on the almost periodic free Araki-Woods factors satisfying both a
condition of mixing and a condition of free malleability in the sense of Popa.
Typical examples are given by the free Bogoliubov shifts. Take an ICC $w$-rigid
group $G$ such that $\mathcal{F}(L(G)) = \{1\}$ (e.g. $G = \Z^2 \rtimes \SL(2,
\Z)$). For any countable subgroup $S \subset \R^*_+$, we show that there exists
an action of $G$ on $L(\F_\infty)$ such that $L(\F_\infty) \rtimes G$ is a type
${\rm II_1}$ factor and its fundamental group is $S$. The second construction
is based on a free product. Take $(B(H), \psi)$ any factor of type ${\rm I}$
endowed with a faithful normal state and denote by $\Gamma \subset \R^*_+$ the
subgroup generated by the point spectrum of $\psi$. We show that the
centralizer $(L(G) \ast B(H))^{\tau \ast \psi}$ is a type ${\rm II_1}$ factor
and its fundamental group is $\Gamma$. Our proofs rely on Popa's
deformation/rigidity strategy using his intertwining-by-bimodules technique.
","[{""version"":""v1"",""created"":""Thu, 26 Apr 2007 19:36:47 GMT""},{""version"":""v2"",""created"":""Mon, 31 Aug 2009 12:16:39 GMT""}]","2009-08-31"
"0704.3528","Norberto Castro Rodriguez","A. Herrero","Spectroscopic Analyses of Massive Blue Stars (Galactic or Extragalactic)","7 pages, 5 figures, conference proceedings",,,,"astro-ph",,"  We review recent advances in our understanding of massive stars through the
analysis of their spectra. Improvements in model atmospheres and analysis
methods are briefly discussed. Results obtained for stars in the Local Group
are compared and the present status of different open questions, like the
temperature scale of OB stars, the Wind Momentum-Luminosity Relation or the
stellar rotation, is outlined.
","[{""version"":""v1"",""created"":""Thu, 26 Apr 2007 17:24:56 GMT""}]","2007-05-23"
"0704.3553","Jean-Yves Ollitrault","Hans-Joachim Drescher, Adrian Dumitru, Clement Gombeaud and Jean-Yves
  Ollitrault","The centrality dependence of elliptic flow, the hydrodynamic limit, and
  the viscosity of hot QCD","5 pages, 2 figures. Extended discussion of the results, in particular
  of lower viscosity and sound velocity required by CGC initial conditions","Phys.Rev.C76:024905,2007","10.1103/PhysRevC.76.024905","SPhT-T07/049","nucl-th",,"  We show that the centrality and system-size dependence of elliptic flow
measured at RHIC are fully described by a simple model based on eccentricity
scaling and incomplete thermalization. We argue that the elliptic flow is at
least 25% below the (ideal) ``hydrodynamic limit'', even for the most central
Au-Au collisions. This lack of perfect equilibration allows for estimates of
the effective parton cross section in the Quark-Gluon Plasma and of its
viscosity to entropy density ratio. We also show how the initial conditions
affect the transport coefficients and thermodynamic quantities extracted from
the data, in particular the viscosity and the speed of sound.
","[{""version"":""v1"",""created"":""Thu, 26 Apr 2007 18:20:59 GMT""},{""version"":""v2"",""created"":""Thu, 28 Jun 2007 12:17:46 GMT""}]","2008-11-26"
"0704.3571","Joel Giedt","Maxime Gabella, Tony Gherghetta, Joel Giedt","A Gravity Dual and LHC Study of Single-Sector Supersymmetry Breaking","35 pages, 6 figures, LaTeX","Phys.Rev.D76:055001,2007","10.1103/PhysRevD.76.055001","UMN-TH-2542/07, FTPI-MINN-07/09","hep-ph hep-th",,"  We propose a gravitational dual of ``single-sector'' models of supersymmetry
breaking which contain no messenger sector and naturally explain the scale of
supersymmetry breaking and the fermion mass hierarchy. In five dimensions these
models can be given a simple interpretation. Inspired by flux-background
solutions of type IIB supergravity, a metric background that deviates from
AdS_5 in the IR breaks supersymmetry, while the fermion mass hierarchy results
from the wavefunction overlap of bulk fermions with a UV-confined Higgs field.
The first and second generation squarks and sleptons, which are localized near
the IR brane, directly feel the supersymmetry breaking and obtain masses of
order 10 TeV. These are interpreted as composite states of the dual 4D theory.
The gauginos and third generation squarks and sleptons are elementary states
that obtain soft masses of order 1 TeV at the loop level via direct gauge
mediation. This particle spectrum leads to distinctive signatures at the LHC,
similar to the usual gauge mediation with a neutralino NLSP that decays
promptly to a gravitino LSP, but with lower event rates. Nevertheless we show
that with 1-10 fb^{-1} of LHC data ""single-sector"" models can easily be
detected above background and distinguished from conventional gravity and gauge
mediation.
","[{""version"":""v1"",""created"":""Thu, 26 Apr 2007 16:41:12 GMT""}]","2008-11-26"
"0704.3576","Allal Ghanmi","Allal Ghanmi","A class of generalized complex Hermite polynomials","13 pages. Minor corrections","J. Math. Anal. Appl., 340, no 2, (2008) 1395-1406","10.1016/j.jmaa.2007.10.001",,"math.CA math-ph math.MP math.SP","http://arxiv.org/licenses/nonexclusive-distrib/1.0/","  A class of generalized complex polynomials of Hermite type, suggested by a
special magnetic Schrodinger operator, is introduced and some related basic
properties are discussed.
","[{""version"":""v1"",""created"":""Thu, 26 Apr 2007 18:48:54 GMT""},{""version"":""v2"",""created"":""Mon, 20 Aug 2007 16:40:39 GMT""},{""version"":""v3"",""created"":""Thu, 7 Aug 2008 11:27:24 GMT""}]","2015-05-13"
"0704.3578","Ivan Sergienko","Silvia Picozzi, Kunihiko Yamauchi, Biplab Sanyal, Ivan A. Sergienko,
  Elbio Dagotto","Dual nature of improper ferroelectricity in a magnetoelectric
  multiferroic","6 pages, 4 figures. Submitted for publication",,"10.1103/PhysRevLett.99.227201",,"cond-mat.mtrl-sci cond-mat.str-el",,"  Using first principles calculations, we study the microscopic origin of
ferroelectricity (FE) induced by magnetic order in the orthorhombic HoMnO3. We
obtain the largest ferroelectric polarization observed in the whole class of
improper magnetic ferroelectrics to date. We find that the two proposed
mechanisms for FE in multiferroics, lattice- and electronic-based, are
simultaneously active in this compound: a large portion of the ferroelectric
polarization arises due to quantum-mechanical effects of electron orbital
polarization, in addition to the conventional polar atomic displacements. An
interesting mechanism for switching the magnetoelectric domains by an electric
field via a 180-degree coherent rotation of Mn spins is also proposed.
","[{""version"":""v1"",""created"":""Thu, 26 Apr 2007 16:20:42 GMT""},{""version"":""v2"",""created"":""Tue, 8 May 2007 14:38:29 GMT""}]","2009-11-13"
"0704.3579","Jean-Pierre Luminet","Jean-Pierre Luminet","The Rise of Big Bang Models, from Myth to Theory and Observations","15 pages, pdf only. Invited talk at conference ""Antropogenesi :
  Dall'energia al fenomeno umano"", 19-21 october, Portogruaro (Italy). To
  appear in Proceedings, eds. A. Pavan, E. Magno",,,,"astro-ph",,"  We provide an epistemological analysis of the developments of relativistic
cosmology from 1917 to 2006, based on the seminal articles by Einstein, de
Sitter, Friedmann, Lemaitre, Hubble, Gamow and other main historical figures of
the field. It appears that most of the ingredients of the present-day standard
cosmological model, such as the accelation of the expansion due to a repulsive
dark energy, the interpretation of the cosmological constant as vacuum energy
or the possible non-trivial topology of space, had been anticipated by
Lemaitre, although his papers remain desperately unquoted.
","[{""version"":""v1"",""created"":""Thu, 26 Apr 2007 16:19:41 GMT""}]","2007-05-23"
"0704.3580","Richard L. Hall","Richard L. Hall and Wolfgang Lucha","Binding energies of semirelativistic N-boson systems","11 pages","J.Phys.A40:6183-6192,2007","10.1088/1751-8113/40/23/012","CUQM-120, HEPHY-PUB 836/07","math-ph hep-th math.MP",,"  General analytic energy bounds are derived for N-boson systems governed by
semirelativistic Hamiltonians of the form
  H=\sum_{i=1}^N \sqrt(p_i^2+m^2) + \sum_{1=i<j}^N V(r_{ij}), where V(r) is a
static attractive pair potential. A translation-invariant model Hamiltonian H_c
is constructed. We conjecture that <H> \ge <H_c> generally, and we prove this
for N=3, and for N=4 when m=0. The conjecture is also valid generally for the
harmonic oscillator and in the nonrelativistic large-m limit. This formulation
allows reductions to scaled 3- or 4-body problems, whose spectral bottoms
provide energy lower bounds. The example of the ultrarelativistic linear
potential is studied in detail and explicit upper- and lower-bound formulas are
derived and compared with earlier bounds.
","[{""version"":""v1"",""created"":""Thu, 26 Apr 2007 17:33:19 GMT""}]","2008-11-26"
"0704.3581","Santiago Garcia-Burillo","S. Garcia-Burillo, F. Combes, R. Neri, A. Fuente, A. Usero, S. Leon,
  J. Lim","Fueling the central engine of radio galaxies. I. The molecular/dusty
  disk of 4C 31.04","5 pages, 3 figures, Accepted (25/04/2007) in A&A Letters",,"10.1051/0004-6361:20077599",,"astro-ph",,"  We report the detection of a massive (M(gas) > 5x10^9 Msun) molecular/dusty
disk of 1.4kpc-size fueling the central engine of the Compact Symmetric Object
(CSO) 4C31.04 based on high-resolution (0.5''--1.2'') observations done with
the IRAM Plateau de Bure interferometer (PdBI). These observations allow for
the first time to detect and map the continuum emission from dust at 218GHz in
the disk of a CSO. The case for a massive disk is confirmed by the detection of
strong HCO+(1--0) line emission and absorption. The molecular gas mass of
4C31.04 is in the range 0.5x10^10--5x10^10Msun. While the distribution and
kinematics of the gas correspond roughly to those of a rotating disk, we find
evidence of distortions and non-circular motions suggesting that the disk is
not in a dynamically relaxed state. We discuss the implications of these
results for the general understanding of the evolution of radio galaxies.
","[{""version"":""v1"",""created"":""Thu, 26 Apr 2007 16:29:47 GMT""}]","2009-11-13"
"0704.3582","T. Becher","Thomas Becher and Kirill Melnikov","Two-loop QED corrections to Bhabha scattering","15 pages; minor changes; version to appear in JHEP","JHEP 0706:084,2007","10.1088/1126-6708/2007/06/084","FERMILAB-PUB-07-060-T, UH-511-1103-07","hep-ph",,"  We obtain a simple relation between massless and massive scattering
amplitudes in gauge theories in the limit where all kinematic invariants are
large compared to particle masses. We use this relation to derive the two-loop
QED corrections to large-angle Bhabha scattering.
","[{""version"":""v1"",""created"":""Thu, 26 Apr 2007 16:42:05 GMT""},{""version"":""v2"",""created"":""Tue, 1 May 2007 01:13:08 GMT""},{""version"":""v3"",""created"":""Fri, 29 Jun 2007 20:12:37 GMT""}]","2009-11-13"
"0704.3583","Javier Graci\'a-Carpio","J. Gracia-Carpio (1), P. Planesas (1) and L. Colina (2) ((1) OAN,
  Madrid, Spain, (2) IEM, CSIC, Madrid, Spain)","Sub-arcsecond CO(1-0) and CO(2-1) observations of the ultraluminous
  infrared galaxy IRAS 10190+1322","4 pages, 3 figures. Accepted for publication in A&A Letters Special
  Issue for the new extended configuration of the Plateau de Bure
  Interferometer",,"10.1051/0004-6361:20077448",,"astro-ph",,"  We present the results of high resolution mapping of the CO(1-0) and CO(2-1)
emission of the ultraluminous infrared galaxy (ULIRG) IRAS 10190+1322, with the
IRAM interferometer, down to an angular resolution of ~0.3 arcsec. This object
is composed of two interacting galaxies with a projected nuclear separation of
6 kpc, and was selected to analyze the physical and dynamical properties of the
molecular gas in each galaxy in order to study the conditions that lead a
galaxy pair to become ultraluminous in the infrared. With the exception of Arp
220, the closest ULIRG, this is the first time that the CO emission is
morphologically and kinematically resolved in the two interacting galaxies of a
ULIRG system. In one of the galaxies the molecular gas is highly concentrated,
distributed in a circumnuclear disk of 1.7 kpc in size. The molecular gas in
the presumably less infrared luminous galaxy is distributed in a more extended
disk of 7.4 kpc. The molecular gas mass accounts for ~10% of the dynamical mass
in each galaxy. Both objects are rich enough in molecular gas, Mgas ~ 4 10^9
Msun, as to experience an infrared ultraluminous phase.
","[{""version"":""v1"",""created"":""Thu, 26 Apr 2007 17:30:53 GMT""}]","2009-11-13"
"0704.3584","Leslie Hebb","Leslie Hebb, Larry Petro, Holland C. Ford, David R. Ardila, Ignacio
  Toledo, Dante Minniti, David A. Golimowski, Mark Clampin","A Search for Planets Transiting the M Dwarf Debris Disk Host, AU
  Microscopii","accepted to MNRAS","Mon.Not.Roy.Astron.Soc.379:63-72,2007","10.1111/j.1365-2966.2007.11904.x",,"astro-ph",,"  We present high cadence, high precision multi-band photometry of the young,
M1Ve, debris disk star, AU Microscopii. The data were obtained in three
continuum filters spanning a wavelength range from 4500\AA to 6600\AA, plus
H$\alpha$, over 28 nights in 2005. The lightcurves show intrinsic stellar
variability due to starspots with an amplitude in the blue band of 0.051
magnitudes and a period of 4.847 days. In addition, three large flares were
detected in the data which all occur near the minimum brightness of the star.
We remove the intrinsic stellar variability and combine the lightcurves of all
the filters in order to search for transits by possible planetary companions
orbiting in the plane of the nearly edge-on debris disk. The combined final
lightcurve has a sampling of 0.35 minutes and a standard deviation of 6.8
millimags (mmag). We performed Monte Carlo simulations by adding fake transits
to the observed lightcurve and find with 95% significance that there are no
Jupiter mass planets orbiting in the plane of the debris disk on circular
orbits with periods, P $\le 5$ days. In addition, there are no young
Neptune-like planets (with radii 2.5$\times$ smaller than the young Jupiter) on
circular orbits with periods, P $\le 3$ days.
","[{""version"":""v1"",""created"":""Thu, 26 Apr 2007 17:05:11 GMT""}]","2009-06-23"
"0704.3585","Massimiliano Procura","Wolfram Weise, Claudia Ratti and Simon Roessner","Phases of QCD, Polyakov Loop and Quasiparticles","9 pages, 8 figures. To appear in Proceedings YKIS2006, Prog. Theor.
  Phys. Suppl. (Kyoto)","Prog.Theor.Phys.Suppl.168:435-443,2007","10.1143/PTPS.168.435","TUM/T39-07-08, ECT*-07-09","hep-ph",,"  QCD thermodynamics is studied using a model which combines Polyakov loop
dynamics with spontaneous chiral symmetry breaking and its restoration (the
PNJL model). The input is fixed entirely by pure-gauge lattice QCD results and
by pion properties in vacuum. Successful comparisons with results from thermal
lattice QCD are achieved, including extrapolations to finite quark chemical
potential. The phase diagram and selected susceptibilities for two quark
flavors are investigated with inclusion of diquark degrees of freedom.
","[{""version"":""v1"",""created"":""Thu, 26 Apr 2007 16:51:16 GMT""}]","2008-11-26"
"0704.3586","Matthias Staudacher","A.V. Kotikov, L.N. Lipatov, A. Rej, M. Staudacher and V.N. Velizhanin","Dressing and Wrapping","20 pages, 2 tables, no figures; v2: references added, conjecture on
  exact four-loop twist-two result stated","J.Stat.Mech.0710:P10003,2007","10.1088/1742-5468/2007/10/P10003","AEI-2007-024","hep-th hep-ph",,"  We prove that the validity of the recently proposed dressed, asymptotic Bethe
ansatz for the planar AdS/CFT system is indeed limited at weak coupling by
operator wrapping effects. This is done by comparing the Bethe ansatz
predictions for the four-loop anomalous dimension of finite-spin twist-two
operators to BFKL constraints from high-energy scattering amplitudes in N=4
gauge theory. We find disagreement, which means that the ansatz breaks down for
length-two operators at four-loop order. Our method supplies precision tools
for multiple all-loop tests of the veracity of any yet-to-be constructed set of
exact spectral equations. Finally we present a conjecture for the exact
four-loop anomalous dimension of the family of twist-two operators, which
includes the Konishi field.
","[{""version"":""v1"",""created"":""Thu, 26 Apr 2007 17:11:24 GMT""},{""version"":""v2"",""created"":""Wed, 4 Jul 2007 19:07:16 GMT""}]","2008-11-26"
