"0704.3604","Remco Scheepmaker","R. A. Scheepmaker, M. R. Haas, M. Gieles, N. Bastian, S. S. Larsen, H.
  J. G. L. M. Lamers","ACS imaging of star clusters in M51. I. Identification and radius
  distribution","17 pages, 23 figures. Accepted for publication in A&A",,"10.1051/0004-6361:20077511",,"astro-ph",,"  We use HST/ACS observations of the spiral galaxy M51 in F435W, F555W and
F814W to select a large sample of star clusters with accurate effective radius
measurements in an area covering the complete disc of M51. We present the
dataset and study the radius distribution and relations between radius, colour,
arm/interarm region, galactocentric distance, mass and age. We select a sample
of 7698 (F435W), 6846 (F555W) and 5024 (F814W) slightly resolved clusters and
derive their effective radii by fitting the spatial profiles with analytical
models convolved with the point spread function. The radii of 1284 clusters are
studied in detail. We find cluster radii between 0.5 and ~10 pc, and one
exceptionally large cluster candidate with a radius of 21.6 pc. The median
radius is 2.1 pc. We find 70 clusters in our sample which have colours
consistent with being old GC candidates and we find 6 new ""faint fuzzy""
clusters in, or projected onto, the disc of M51. The radius distribution can
not be fitted with a power law, but a log-normal distribution provides a
reasonable fit to the data. This indicates that shortly after the formation of
the clusters from a fractal gas, their radii have changed in a non-uniform way.
We find an increase in radius with colour as well as a higher fraction of
redder clusters in the interarm regions, suggesting that clusters in spiral
arms are more compact. We find a correlation between radius and galactocentric
distance which is considerably weaker than the observed correlation for old
Milky Way GCs. We find weak relations between cluster luminosity and radius,
but we do not observe a correlation between cluster mass and radius.
","[{""version"":""v1"",""created"":""Thu, 26 Apr 2007 19:16:15 GMT""}]","2009-11-13"
"0704.3605","Mustafa Sarisaman","Mustafa Sarisaman","Pseudoduality and Conserved Currents in Sigma Models","15 pages, discussion section added","Mod.Phys.Lett.A24:123-134,2009","10.1142/S021773230902876X",,"hep-th","http://arxiv.org/licenses/nonexclusive-distrib/1.0/","  We discuss the current conservation laws in sigma models based on a compact
Lie groups of the same dimensionality and connected to each other via
pseudoduality transformations in two dimensions. We show that pseudoduality
transformations induce an infinite number of nonlocal conserved currents on the
pseudodual manifold.
","[{""version"":""v1"",""created"":""Thu, 26 Apr 2007 19:02:55 GMT""},{""version"":""v2"",""created"":""Tue, 27 Jan 2009 05:24:14 GMT""}]","2009-02-10"
"0704.3606","John Ward Mr","Tapan Naskar and John Ward","Type I singularities and the Phantom Menace","More references added. Final PRD version","Phys.Rev.D76:063514,2007","10.1103/PhysRevD.76.063514",,"gr-qc hep-ph",,"  We consider the future dynamics of a transient phantom dominated phase of the
universe in LQC and in the RS braneworld, which both have a non-standard
Friedmann equation. We find that for a certain class of potentials, the Hubble
parameter oscillates with simple harmonic motion in the LQC case and therefore
avoids any future singularity. For more general potentials we find that damping
effects eventually lead to the Hubble parameter becoming constant. On the other
hand in the braneworld case we find that although the type I singularity can be
avoided, the scale factor still diverges at late times.
","[{""version"":""v1"",""created"":""Thu, 26 Apr 2007 19:07:10 GMT""},{""version"":""v2"",""created"":""Wed, 2 May 2007 12:20:26 GMT""},{""version"":""v3"",""created"":""Tue, 22 May 2007 10:22:39 GMT""},{""version"":""v4"",""created"":""Thu, 11 Oct 2007 21:15:08 GMT""}]","2008-11-26"
"0704.3607","Debora Peres Menezes Menezes","C. Providencia, D.P. Menezes, L. Brito, Ph. Chomaz","Low density expansion and isospin dependence of nuclear energy
  functional: comparison between relativistic and Skyrme models","16 pages,6 figures,5 tables","Phys.Rev.C76:044316,2007","10.1103/PhysRevC.76.044316",,"nucl-th",,"  In the present work we take the non relativistic limit of relativistic models
and compare the obtained functionals with the usual Skyrme parametrization.
Relativistic models with both constant couplings and with density dependent
couplings are considered. While some models present very good results already
at the lowest order in the density, models with non-linear terms only reproduce
the energy functional if higher order terms are taken into account in the
expansion.
","[{""version"":""v1"",""created"":""Thu, 26 Apr 2007 19:27:41 GMT""}]","2008-11-26"
"0704.3608","Leonid Levitov","D. A. Abanin and L. S. Levitov","Quantized Transport in Graphene p-n Junctions in Magnetic Field","4 pages, 3 figures, available online at:
  http://www.sciencemag.org/cgi/content/abstract/1144672","Science 317, 641 (2007), originally published in Science Express
  on 28 June 2007","10.1126/science.1144672",,"cond-mat.mes-hall cond-mat.str-el",,"  Recent experimental work on locally gated graphene layers resulting in p-n
junctions have revealed quantum Hall effect in their transport behavior. We
explain the observed conductance quantization which is fractional in the
bipolar regime and integer in the unipolar regime in terms of quantum Hall edge
modes propagating along and across the p-n interface. In the bipolar regime the
electron and hole modes can mix at the p-n boundary, leading to current
partition and quantized shot noise plateaus similar to those of conductance,
while in the unipolar regime transport is noiseless. These quantum Hall
phenomena reflect the massless Dirac character of charge carriers in graphene,
with particle-hole interplay manifest in mode mixing and noise in the bipolar
regime.
","[{""version"":""v1"",""created"":""Thu, 26 Apr 2007 19:47:14 GMT""},{""version"":""v2"",""created"":""Thu, 26 Apr 2007 20:23:47 GMT""},{""version"":""v3"",""created"":""Sat, 5 May 2007 03:51:05 GMT""},{""version"":""v4"",""created"":""Sat, 30 Jun 2007 12:07:13 GMT""}]","2007-08-07"
"0704.3609","Jiasheng Huang","J.-S. Huang (1) M. L. N. Ashby (1) P. Barmby (1) M. Brodwin (2) M. J.
  I. Brown (3) N. Caldwell (1) R. J. Cool (4) P. Eisenhardt (2) D. Eisenstein
  (4) G. G. Fazio (1) E. Le Floc'h (4) P. Green (1) C. S. Kochanek (6) N. Y. Lu
  (5) M. A. Pahre (1) D. Rigopoulou (7) J. L. Rosenberg (1,8) H. A. Smith (1)
  Z. Wang (1) C. N. A. Willmer (4) and S. P. Willner (1) ((1) SAO, (2) JPL, (3)
  Monash Univ. Australia, (4) Univ. of Arizona, (5)SSC, (6) Ohio State Univ.,
  (7)Oxford Univ. UK, (8)George Mason Univ.)","The Local Galaxy 8 micron Luminosity Function","32 pages, 12 Figures (Fig. 1, Fig. 2, and Fig. 4 are JPEG files),
  accepted for publication in ApJ","Astrophys.J.664:840-849,2007","10.1086/519241",,"astro-ph",,"  A SST survey in the NOAO Deep-Wide Field in Bo\""otes provides a complete,
8-micron-selected sample of galaxies to a limiting (Vega) magnitude of 13.5. In
the 6.88 deg$^2$ field sampled, 79% of the 4867 galaxies have spectroscopic
redshifts, allowing an accurate determination of the local (z<0.3) galaxy
luminosity function. Stellar and dust emission can be separated on the basis of
observed galaxy colors. Dust emission (mostly PAH) accounts for 80% of the 8
micron luminosity, stellar photospheres account for 19%, and AGN emission
accounts for roughly 1 %. A sub-sample of the 8 micron-selected galaxies have
blue, early-type colors, but even most of these have significant PAH emission.
The luminosity functions for the total 8 micron luminosity and for the dust
emission alone are both well fit by Schechter functions. For the 8 micron
luminosity function, the characteristic luminosity is \nu L_{\nu}^*(8.0
\micron) = 1.8 \times 10^{10}$ \Lsun while for the dust emission alone it is
1.6 x 10^{10}$ \Lsun\null. The average 8 \micron luminosity density at z<0.3 is
3.1 x 10^7 \Lsun Mpc^{-3}, and the average luminosity density from dust alone
is 2.5 x 10^7 \Lsun Mpc^{-3}. This luminos ity arises predominantly from
galaxies with 8 \micron luminosities ($\nu L_{\nu}$) between $2\times 10^9$ and
$2 x 10^{10}$ \Lsun, i.e., normal galaxies, not LIRGs or ULIRGs.
","[{""version"":""v1"",""created"":""Thu, 26 Apr 2007 19:48:24 GMT""},{""version"":""v2"",""created"":""Thu, 26 Apr 2007 20:23:15 GMT""}]","2009-06-23"
"0704.3610","Akinori Tanaka","Akinori Tanaka","d-Wave Pairing State in Terms of the Zhang-Rice Singlets","19 pages, 3 figures;In Verson 2, section 'Summary and Remarks' has
  been added, typos have been corrected, and some minor changes have been made",,"10.1088/1751-8113/40/34/002",,"cond-mat.str-el cond-mat.supr-con",,"  In cuprate superconductors doping is believed to create holes on the O-sites,
which couple antiferromagnetically with holes on the Cu-sites to form the
so-called Zhang-Rice singlets. Here we study a d-wave pairing state based on
the Zhang-Rice singlet states. Upper and lower bounds of an off-diagonal
long-range order parameter with d-wave symmetry for this state are estimated.
We also introduce a concrete model with on-site Coulomb repulsion and kinds of
antiferromagnetic interactions whose ground state is this d-wave pairing state.
","[{""version"":""v1"",""created"":""Thu, 26 Apr 2007 23:44:17 GMT""},{""version"":""v2"",""created"":""Tue, 17 Jul 2007 10:01:05 GMT""}]","2009-11-13"
"0704.3611","Samir Salim","Samir Salim, R. Michael Rich, St\'ephane Charlot, Jarle Brinchmann,
  Benjamin D. Johnson, David Schiminovich, Mark Seibert, Ryan Mallery, Timothy
  M. Heckman, Karl Forster, Peter G. Friedman, D. Christopher Martin, Patrick
  Morrissey, Susan G. Neff, Todd Small, Ted K. Wyder, Luciana Bianchi, Jose
  Donas, Young-Wook Lee, Barry F. Madore, Bruno Milliard, Alex S. Szalay, Barry
  Y. Welsh and Sukyoung K. Yi","UV Star Formation Rates in the Local Universe","Accepted for publication in ApJ (Special GALEX Supplement issue - Dec
  2007). v2: Typo in Eq. 2 corrected","Astrophys.J.Suppl.173:267-292,2007","10.1086/519218",,"astro-ph",,"  We measure star formation rates of ~50,000 optically-selected galaxies in the
local universe (z~0.1), spanning a range from gas-rich dwarfs to massive
ellipticals. We obtain dust-corrected SFRs by fitting the GALEX (UV) and SDSS
(optical) photometry to a library of population synthesis models that include
dust attenuation. For star-forming galaxies, our UV-based SFRs compare
remarkably well with those derived from SDSS H alpha. Deviations from perfect
agreement between these two methods are due to differences in the dust
attenuation estimates. In contrast to H alpha, UV provides reliable SFRs for
galaxies with weak or no H alpha emission, and where H alpha is contaminated
with an emission from an AGN. We use full-SED SFRs to calibrate a simple
prescription that uses GALEX UV magnitudes to produce good SFRs for normal
star-forming galaxies. The specific SFR is considered as a function of stellar
mass for (1) star-forming galaxies with no AGN, (2) those hosting an AGN, and
for (3) galaxies without H alpha emission. We find that the three have distinct
star formation histories, with AGN lying intermediate between the star-forming
and the quiescent galaxies. Normal star forming galaxies (without an AGN) lie
on a relatively narrow linear sequence. Remarkably, galaxies hosting a strong
AGN appear to represent the massive continuation of this sequence. Weak AGN,
while also massive, have lower SFR, sometimes extending to the realm of
quiescent galaxies. We propose an evolutionary sequence for massive galaxies
that smoothly connects normal star-forming galaxies to quiescent (red sequence)
galaxies via strong and weak AGN. We confirm that some galaxies with no H alpha
emission show signs of SF in the UV. We derive a UV-based cosmic SFR density at
z=0.1 with smaller total error than previous measurements (abridged).
","[{""version"":""v1"",""created"":""Thu, 26 Apr 2007 20:15:37 GMT""},{""version"":""v2"",""created"":""Mon, 7 May 2007 22:44:39 GMT""}]","2009-10-05"
"0704.3614","Matthew Becker","M. R. Becker, T.A. McKay, B. Koester, R. H. Wechsler, E. Rozo, A.
  Evrard, D. Johnston, E. Sheldon, J. Annis, E. Lau, R. Nichol, C. Miller","The Mean and Scatter of the Velocity Dispersion-Optical Richness
  Relation for maxBCG Galaxy Clusters","25 pages, 15 figures, 2 tables, published in ApJ","Astrophys.J.669:905-928,2007","10.1086/521920",,"astro-ph",,"  The distribution of galaxies in position and velocity around the centers of
galaxy clusters encodes important information about cluster mass and structure.
Using the maxBCG galaxy cluster catalog identified from imaging data obtained
in the Sloan Digital Sky Survey, we study the BCG-galaxy velocity correlation
function. By modeling its non-Gaussianity, we measure the mean and scatter in
velocity dispersion at fixed richness. The mean velocity dispersion increases
from 202+/-10 km/s for small groups to more than 854+/-102 km/s for large
clusters. We show the scatter to be at most 40.5+/-3.5%, declining to
14.9+/-9.4% in the richest bins. We test our methods in the C4 cluster catalog,
a spectroscopic cluster catalog produced from the Sloan Digital Sky Survey DR2
spectroscopic sample, and in mock galaxy catalogs constructed from N-body
simulations. Our methods are robust, measuring the scatter to well within
one-sigma of the true value, and the mean to within 10%, in the mock catalogs.
By convolving the scatter in velocity dispersion at fixed richness with the
observed richness space density function, we measure the velocity dispersion
function of the maxBCG galaxy clusters. Although velocity dispersion and
richness do not form a true mass-observable relation, the relationship between
velocity dispersion and mass is theoretically well characterized and has low
scatter. Thus our results provide a key link between theory and observations up
to the velocity bias between dark matter and galaxies.
","[{""version"":""v1"",""created"":""Thu, 26 Apr 2007 20:02:18 GMT""},{""version"":""v2"",""created"":""Fri, 19 Oct 2007 03:19:58 GMT""}]","2010-11-11"
"0704.3615","Robin Blume-Kohout","Robin Blume-Kohout and Wojciech H.Zurek","Quantum Darwinism in quantum Brownian motion: the vacuum as a witness","5 pages","Phys.Rev.Lett.101:240405,2008","10.1103/PhysRevLett.101.240405",,"quant-ph cond-mat.mes-hall hep-th",,"  We study quantum Darwinism -- the redundant recording of information about a
decohering system by its environment -- in zero-temperature quantum Brownian
motion. An initially nonlocal quantum state leaves a record whose redundancy
increases rapidly with its spatial extent. Significant delocalization (e.g., a
Schroedinger's Cat state) causes high redundancy: many observers can measure
the system's position without perturbing it. This explains the objective (i.e.
classical) existence of einselected, decoherence-resistant pointer states of
macroscopic objects.
","[{""version"":""v1"",""created"":""Thu, 26 Apr 2007 20:23:24 GMT""}]","2009-01-09"
"0704.3616","Claudio Castelnovo","C. Castelnovo (1), and C. Chamon (2) ((1) Oxford University, (2)
  Boston University)","Entanglement and topological entropy of the toric code at finite
  temperature","(15 pages, 5 figures) v2: updated references and acknowledgments","Phys. Rev. B 76, 184442 (2007)","10.1103/PhysRevB.76.184442",,"cond-mat.str-el quant-ph",,"  We calculate exactly the von Neumann and topological entropies of the toric
code as a function of system size and temperature. We do so for systems with
infinite energy scale separation between magnetic and electric excitations, so
that the magnetic closed loop structure is fully preserved while the electric
loop structure is tampered with by thermally excited electric charges. We find
that the entanglement entropy is a singular function of temperature and system
size, and that the limit of zero temperature and the limit of infinite system
size do not commute. From the entanglement entropy we obtain the topological
entropy, which is shown to drop to half its zero-temperature value for any
infinitesimal temperature in the thermodynamic limit, and remains constant as
the temperature is further increased. Such discontinuous behavior is replaced
by a smooth decreasing function in finite-size systems. If the separation of
energy scales in the system is large but finite, we argue that our results hold
at small enough temperature and finite system size, and a second drop in the
topological entropy should occur as the temperature is raised so as to disrupt
the magnetic loop structure by allowing the appearance of free magnetic
charges. We interpret our results as an indication that the underlying magnetic
and electric closed loop structures contribute equally to the topological
entropy (and therefore to the topological order) in the system. Since each loop
structure \emph{per se} is a classical object, we interpret the quantum
topological order in our system as arising from the ability of the two
structures to be superimposed and appear simultaneously.
","[{""version"":""v1"",""created"":""Fri, 27 Apr 2007 01:56:24 GMT""},{""version"":""v2"",""created"":""Thu, 1 Nov 2007 18:01:09 GMT""}]","2007-11-30"
"0704.3617","V\'ictor Manuel Mu\~noz Mar\'in","V\'ictor M. Mu\~noz Mar\'in, Rosa M. Gonz\'alez Delgado, Henrique R.
  Schmitt, Roberto Cid Fernandes, Enrique P\'erez, Thaisa Storchi-Bergmann, Tim
  Heckman, Claus Leitherer","An Atlas of the circumnuclear regions of 75 Seyfert galaxies in the
  near-UV with HST Advanced Camera for Surveys","Accepted for publication in AJ, 58 pages, 20 figures. High-resolution
  figures for all the objects are available at
  http://www.iaa.es/~manuel/publications/paper01.html","Astron.J.134:648-667,2007","10.1086/519448",,"astro-ph",,"  We present an atlas of the central regions of 75 Seyfert galaxies imaged in
the near-UV with the Advanced Camera for Surveys of the Hubble Space Telescope
at an average resolution of ~10pc. These data complement archival high
resolution data from the Space Telescope at optical and near-IR wavelengths,
creating an extremely valuable dataset for astronomers with a broad range of
scientific interests. Our goal is to investigate the nature of the near-UV
light in these objects, its relation to the circumnuclear starburst phenomenon,
and the connection of this to the evolution and growth of the galaxy bulge and
central black hole. In this paper, we describe the near-UV morphology of the
objects and characterize the near-UV emission. We estimate the size and the
luminosity of the emitting regions and extract the luminosity profile. We also
determine the presence of unresolved compact nuclei. In addition, the
circumnuclear stellar cluster population is identified, and the contribution of
the stellar clusters to the total light, at this wavelength, is estimated. The
size of the sample allows us to draw robust statistical conclusions. We find
that {Seyfert 1} galaxies are completely dominated by its bright and compact
nucleus, that remains point-like at this resolution, while we find almost no
unresolved nucleus in Seyfert 2. The Seyfert types 1 and 2 are quite segregated
in an asymmetry vs compactness plot. Stellar clusters are found somewhat more
frequently in Sy2 (in ~70% of the galaxies) than in Sy1 (~57%), and contribute
more to the total light in Sy2, but this two differences seem to be mostly due
to the large contribution of the compact nucleus in Sy1, as the luminosity
distribution of the clusters is similar in both Sy types.
","[{""version"":""v1"",""created"":""Thu, 26 Apr 2007 20:09:27 GMT""}]","2016-08-14"
"0704.3618","Tapas Kumar Das","Tapas Kumar Das","Astrophysical Accretion as an Analogue Gravity Phenomena","56 pages, 11 figures, revtex4. Send email request to the author for
  high resolution version of the manuscript",,,,"astro-ph gr-qc",,"  In recent years, strong analogies have been established between the physics
of acoustic perturbations in an inhomogeneous dynamical fluid system, and some
kinematic features of space-time in general relativity. An effective metric,
referred to as the `acoustic metric', which describes the geometry of the
manifold in which acoustic perturbations propagate, can be constructed. This
effective geometry can capture the properties of curved space-time in general
relativity. Physical models constructed utilizing such analogies are called
`analogue gravity models'. Classical analogue gravity effect may be observed
when acoustic perturbations propagate through a inhomogeneous transonic
classical fluid. The acoustic horizon, which resembles a black hole event
horizon in many ways, is generated at the transonic point in the fluid flow.
The acoustic horizon is essentially a null hyper surface, generators of which
are the acoustic null geodesics, i.e. the phonons. The acoustic horizon emits
acoustic radiation with quasi thermal phonon spectra, which is analogous to the
actual Hawking radiation. The temperature of the radiation emitted from the
acoustic horizon is referred to as the analogue Hawking temperature.
  It has been demonstrated that, in general, the transonic accretion in
astrophysics can be considered as an example of the classical analogue gravity
model naturally found in the Universe.
","[{""version"":""v1"",""created"":""Thu, 26 Apr 2007 20:10:24 GMT""}]","2007-06-27"
"0704.3619","Marcus Kaiser","Luciano da F Costa, Marcus Kaiser, Claus C Hilgetag","Predicting the connectivity of primate cortical networks from
  topological and spatial node properties",,"BMC Systems Biology 2007, 1:16","10.1186/1752-0509-1-16",,"q-bio.NC physics.soc-ph",,"  The organization of the connectivity between mammalian cortical areas has
become a major subject of study, because of its important role in scaffolding
the macroscopic aspects of animal behavior and intelligence. In this study we
present a computational reconstruction approach to the problem of network
organization, by considering the topological and spatial features of each area
in the primate cerebral cortex as subsidy for the reconstruction of the global
cortical network connectivity. Starting with all areas being disconnected,
pairs of areas with similar sets of features are linked together, in an attempt
to recover the original network structure. Inferring primate cortical
connectivity from the properties of the nodes, remarkably good reconstructions
of the global network organization could be obtained, with the topological
features allowing slightly superior accuracy to the spatial ones. Analogous
reconstruction attempts for the C. elegans neuronal network resulted in
substantially poorer recovery, indicating that cortical area interconnections
are relatively stronger related to the considered topological and spatial
properties than neuronal projections in the nematode. The close relationship
between area-based features and global connectivity may hint on developmental
rules and constraints for cortical networks. Particularly, differences between
the predictions from topological and spatial properties, together with the
poorer recovery resulting from spatial properties, indicate that the
organization of cortical networks is not entirely determined by spatial
constraints.
","[{""version"":""v1"",""created"":""Thu, 26 Apr 2007 20:13:58 GMT""}]","2007-05-23"
"0704.3620","Dale Li","Dale Li, Yanqun Dong, R. G. Ramos, J. D. Murray, K. MacLean, A. E.
  Dementyev and S. E. Barrett","The Intrinsic Origin of Spin Echoes in Dipolar Solids Generated by
  Strong Pi Pulses","24 pages, 27 figures. Revised from helpful referee comments. Added
  new Table IV, new paragraphs on pages 3 and 19",,"10.1103/PhysRevB.77.214306",,"cond-mat.mes-hall quant-ph",,"  In spectroscopy, it is conventional to treat pulses much stronger than the
linewidth as delta-functions. In NMR, this assumption leads to the prediction
that pi pulses do not refocus the dipolar coupling. However, NMR spin echo
measurements in dipolar solids defy these conventional expectations when more
than one pi pulse is used. Observed effects include a long tail in the CPMG
echo train for short delays between pi pulses, an even-odd asymmetry in the
echo amplitudes for long delays, an unusual fingerprint pattern for
intermediate delays, and a strong sensitivity to pi-pulse phase. Experiments
that set limits on possible extrinsic causes for the phenomena are reported. We
find that the action of the system's internal Hamiltonian during any real pulse
is sufficient to cause the effects. Exact numerical calculations, combined with
average Hamiltonian theory, identify novel terms that are sensitive to
parameters such as pulse phase, dipolar coupling, and system size.
Visualization of the entire density matrix shows a unique flow of quantum
coherence from non-observable to observable channels when applying repeated pi
pulses.
","[{""version"":""v1"",""created"":""Thu, 26 Apr 2007 19:40:50 GMT""},{""version"":""v2"",""created"":""Fri, 24 Aug 2007 16:47:18 GMT""},{""version"":""v3"",""created"":""Mon, 10 Mar 2008 17:13:52 GMT""}]","2009-11-13"
