"0704.3641","Charis Quay","C. H. L. Quay, John Cumings, Sara Gamble, R. de Picciotto, H. Kataura,
  D. Goldhaber-Gordon","Kondo Physics in Nanotubes: Magnetic-field dependence and
  singlet-triplet Kondo","10 pp., 5 fig. cond-mat/0606258 was split into two papers to clarify
  their separate stories. cond-mat/0606258v2 treats the effect of C60
  intercalation on transport in nanotubes. 0704.3641 is on Kondo physics in a
  nanotube in B-field. We now note: the splitting of Kondo resonances with
  B-field is sub-linear at low field, in qualitative agreement with theories",,,,"cond-mat.mes-hall",,"  In a single-walled carbon nanotube, we observe the spin-1/2 Kondo effect. The
energy of spin-resolved Kondo peaks is proportional to magnetic field at high
fields, contrary to recent reports. At lower fields, the energy falls below
this linear dependence, in qualitative agreement with theoretical expectations.
For even electron occupancy, we observe a spin-1 Kondo effect due to the
degeneracy of the triplet ground states. Tuning gate voltage within the same
Coulomb diamond drives a transition to a singlet ground state. We also
independently tune the energy difference between singlet and triplet states
with a magnetic field. The Zeeman splitting thus measured confirms the value of
the g-factor measured from the spin-1/2 Kondo feature.
","[{""version"":""v1"",""created"":""Fri, 27 Apr 2007 03:30:43 GMT""},{""version"":""v2"",""created"":""Sun, 29 Apr 2007 04:12:03 GMT""}]","2007-05-23"
"0704.3642","Benjamin Schmidt","Benjamin Schmidt and Juan Souto","A characterization of round spheres in terms of blocking light","Replaced a theorem from an earlier version with a reference and added
  a new theorem",,,,"math.GT math.DG",,"  A closed Riemannian manifold is said to have cross blocking if whenever
distinct points p and q are at distance less than the diameter, all light rays
from p can be shaded away from q with at most two point shades. Similarly, a
closed Riemannian manifold is said to have sphere blocking if for each point p,
all the light rays from p are shaded away from p by a single point shade. We
prove that Riemannian manifolds with cross and sphere blocking are isometric to
round spheres.
","[{""version"":""v1"",""created"":""Fri, 27 Apr 2007 00:41:49 GMT""},{""version"":""v2"",""created"":""Fri, 14 Mar 2008 02:56:48 GMT""}]","2008-03-14"
"0704.3643","Allison Woodruff","Allison Woodruff, Sally Augustin, and Brooke Foucault","Sabbath Day Home Automation: ""It's Like Mixing Technology and Religion""",,,,,"cs.HC",,"  We present a qualitative study of 20 American Orthodox Jewish families' use
of home automation for religious purposes. These lead users offer insight into
real-life, long-term experience with home automation technologies. We discuss
how automation was seen by participants to contribute to spiritual experience
and how participants oriented to the use of automation as a religious custom.
We also discuss the relationship of home automation to family life. We draw
design implications for the broader population, including surrender of control
as a design resource, home technologies that support long-term goals and
lifestyle choices, and respite from technology.
","[{""version"":""v1"",""created"":""Fri, 27 Apr 2007 00:42:22 GMT""}]","2007-05-23"
"0704.3644","Chris Ng","Chris T. K. Ng, Nihar Jindal, Andrea J. Goldsmith, Urbashi Mitra","Capacity Gain from Two-Transmitter and Two-Receiver Cooperation","Accepted for publication in IEEE Transactions on Information Theory",,"10.1109/TIT.2007.904987",,"cs.IT math.IT",,"  Capacity improvement from transmitter and receiver cooperation is
investigated in a two-transmitter, two-receiver network with phase fading and
full channel state information available at all terminals. The transmitters
cooperate by first exchanging messages over an orthogonal transmitter
cooperation channel, then encoding jointly with dirty paper coding. The
receivers cooperate by using Wyner-Ziv compress-and-forward over an analogous
orthogonal receiver cooperation channel. To account for the cost of
cooperation, the allocation of network power and bandwidth among the data and
cooperation channels is studied. It is shown that transmitter cooperation
outperforms receiver cooperation and improves capacity over non-cooperative
transmission under most operating conditions when the cooperation channel is
strong. However, a weak cooperation channel limits the transmitter cooperation
rate; in this case receiver cooperation is more advantageous.
Transmitter-and-receiver cooperation offers sizable additional capacity gain
over transmitter-only cooperation at low SNR, whereas at high SNR transmitter
cooperation alone captures most of the cooperative capacity improvement.
","[{""version"":""v1"",""created"":""Fri, 27 Apr 2007 00:52:11 GMT""}]","2016-11-17"
"0704.3645","N. Christopher Phillips","Ja A Jeong, Hiroyuki Osaka, N. Christopher Phillips, Tamotsu Teruya","Cancellation for inclusions of C*-algebras of finite depth","22 pages; AMSLaTeX",,,,"math.OA",,"  Let B be a unital C*-algebra, let A be a unital subalgebra, and let E be a
conditional expectation from B to A with index-finite type and a quasi-basis of
n elements. Then the topological stable rank satisfies \tsr (B) \leq \tsr (A) +
n - 1. As an application, we show that if a unital inclusion A \subset B of
C*-algebras has index-finite type and finite depth, and A is simple with stable
rank one and Property (SP), then B has cancellation. In particular, if A is a
simple unital C*-algebra with stable rank one and Property (SP), and a finite
group G acts on A, then the crossed product has cancellation. Separately, if
the group is the integers, we obtain cancellation under the additional
hypotheses that the group action is outer and is trivial on K_0 (A).
","[{""version"":""v1"",""created"":""Fri, 27 Apr 2007 01:03:34 GMT""}]","2007-05-23"
"0704.3646","Joseph Y. Halpern","Ittai Abraham, Danny Dolev, and Joseph Y. Halpern","Lower Bounds on Implementing Robust and Resilient Mediators",,,,,"cs.GT cs.CR cs.DC",,"  We consider games that have (k,t)-robust equilibria when played with a
mediator, where an equilibrium is (k,t)-robust if it tolerates deviations by
coalitions of size up to k and deviations by up to $t$ players with unknown
utilities. We prove lower bounds that match upper bounds on the ability to
implement such mediators using cheap talk (that is, just allowing communication
among the players). The bounds depend on (a) the relationship between k, t, and
n, the total number of players in the system; (b) whether players know the
exact utilities of other players; (c) whether there are broadcast channels or
just point-to-point channels; (d) whether cryptography is available; and (e)
whether the game has a $k+t)-punishment strategy; that is, a strategy that, if
used by all but at most $k+t$ players, guarantees that every player gets a
worse outcome than they do with the equilibrium strategy.
","[{""version"":""v1"",""created"":""Fri, 27 Apr 2007 01:32:15 GMT""},{""version"":""v2"",""created"":""Thu, 6 Dec 2007 22:17:40 GMT""}]","2007-12-07"
"0704.3647","Catherine Marshall","Catherine C. Marshall, Frank McCown, and Michael L. Nelson","Evaluating Personal Archiving Strategies for Internet-based Information","6 pages, 2 tables, to be published in the Proceedings of IS&T
  Archiving 2007, May 21-24 2007, Arlington, Virginia, USA",,,,"cs.DL cs.CY cs.HC",,"  Internet-based personal digital belongings present different vulnerabilities
than locally stored materials. We use responses to a survey of people who have
recovered lost websites, in combination with supplementary interviews, to paint
a fuller picture of current curatorial strategies and practices. We examine the
types of personal, topical, and commercial websites that respondents have lost
and the reasons they have lost this potentially valuable material. We further
explore what they have tried to recover and how the loss influences their
subsequent practices. We found that curation of personal digital materials in
online stores bears some striking similarities to the curation of similar
materials stored locally in that study participants continue to archive
personal assets by relying on a combination of benign neglect, sporadic
backups, and unsystematic file replication. However, we have also identified
issues specific to Internet-based material: how risk is spread by distributing
the files among multiple servers and services; the circular reasoning
participants use when they discuss the safety of their digital assets; and the
types of online material that are particularly vulnerable to loss. The study
reveals ways in which expectations of permanence and notification are violated
and situations in which benign neglect has far greater consequences for the
long-term fate of important digital assets.
","[{""version"":""v1"",""created"":""Fri, 27 Apr 2007 01:38:55 GMT""}]","2007-05-23"
"0704.3648","Muhammad Sharif","M. Sharif","Perturbed Self-Similar Massless Scalar Field in Spherically Symmetric
  Spaceimes","15 pages, accepted for publication Int. J. Mod. Phys. A","Int.J.Mod.Phys.A22:4695-4708,2007","10.1142/S0217751X07037214",,"gr-qc",,"  In this paper, we investigate the linear perturbations of the spherically
symmetric spacetimes with kinematic self-similarity of the second kind. The
massless scalar field equations are solved which yield the background and an
exact solutions for the perturbed equations. We discuss the boundary conditions
of the resulting perturbed solutions. The possible perturbation modes turn out
to be stable as well as unstable. The analysis leads to the conclusion that
there does not exist any critical solution.
","[{""version"":""v1"",""created"":""Fri, 27 Apr 2007 02:11:59 GMT""}]","2008-11-26"
"0704.3652","Bingsong Zou","Jia-Jun Wu, Qiang Zhao, B.S.Zou","Possibility of measuring a0(980)-f0(980) mixing from J/psi -> phi a0","accepted version by PRD, slightly modified according to referee's
  suggestions","Phys.Rev.D75:114012,2007","10.1103/PhysRevD.75.114012",,"hep-ph",,"  The a0(980)-f0(980) mixing intensity has been predicted to be in the range of
0.01 to 0.1 by various theoretical models, but lacking firm experimental
observation. We examine the possibility of extracting the a0(980)-f0(980)
mixing from J/psi -> phi f0 -> phi a0 reaction at upgraded Beijing Electron
Positron Collider with BESIII detector. While the branching ratio of this
process through the a0(980)-f0(980) mixing is expected to be about $O(10^{-6})$
similar to the estimated total amount from two background reactions J/psi ->
gamma* -> phi a0 and J/psi -> K* K + c.c. -> phi a0, the peak width from the
a0(980)-f0(980) mixing is about 8 MeV, much smaller than that from other
mechanisms. With $10^9$ $J/\psi$ events at BESIII, the a0(980)-f0(980) mixing
intensity is expected to be unambiguously and precisely measured.
","[{""version"":""v1"",""created"":""Fri, 27 Apr 2007 02:25:25 GMT""},{""version"":""v2"",""created"":""Fri, 4 May 2007 01:49:18 GMT""},{""version"":""v3"",""created"":""Sat, 26 May 2007 03:19:27 GMT""}]","2008-11-26"
"0704.3653","Catherine Marshall","Catherine C. Marshall, Sara Bly, and Francoise Brun-Cottan","The Long Term Fate of Our Digital Belongings: Toward a Service Model for
  Personal Archives","6 pages, published in the Proceedings of IS&T Archiving 2006,
  (Ottawa, Canada, May 23-26, 2006), Society for Imaging Science and
  Technology, Springfield, VA, 2006, pp. 25-30",,,,"cs.DL cs.CY cs.HC",,"  We conducted a preliminary field study to understand the current state of
personal digital archiving in practice. Our aim is to design a service for the
long-term storage, preservation, and access of digital belongings by examining
how personal archiving needs intersect with existing and emerging archiving
technologies, best practices, and policies. Our findings not only confirmed
that experienced home computer users are creating, receiving, and finding an
increasing number of digital belongings, but also that they have already lost
irreplaceable digital artifacts such as photos, creative efforts, and records.
Although participants reported strategies such as backup and file replication
for digital safekeeping, they were seldom able to implement them consistently.
Four central archiving themes emerged from the data: (1) people find it
difficult to evaluate the worth of accumulated materials; (2) personal storage
is highly distributed both on- and offline; (3) people are experiencing
magnified curatorial problems associated with managing files in the aggregate,
creating appropriate metadata, and migrating materials to maintainable formats;
and (4) facilities for long-term access are not supported by the current
desktop metaphor. Four environmental factors further complicate archiving in
consumer settings: the pervasive influence of malware; consumer reliance on ad
hoc IT providers; an accretion of minor system and registry inconsistencies;
and strong consumer beliefs about the incorruptibility of digital forms, the
reliability of digital technologies, and the social vulnerability of networked
storage.
","[{""version"":""v1"",""created"":""Fri, 27 Apr 2007 02:35:57 GMT""}]","2007-05-23"
"0704.3654","Bunyo Hatsukade","Bunyo Hatsukade, Kotaro Kohno, Akira Endo, Tomoka Tosaki, Kouji Ohta,
  Seiichi Sakamoto, Nobuyuki Kawai, Juan R. Cortes, Kouichiro Nakanishi,
  Takeshi Okuda, Kazuyuki Muraoka, Takeshi Sakai, Paul M. Vreeswijk, Hajime
  Ezawa, Nobuyuki Yamaguchi, Kazuhisa Kamegai, Ryohei Kawabe","A Search for CO(J=3-2) Emission from the Host Galaxy of GRB 980425 with
  the Atacama Submillimeter Telescope Experiment","7 pages, 4 figures","Publ.Astron.Soc.Jap.59:67-72,2007","10.1093/pasj/59.1.67",,"astro-ph",,"  We report on a deep search for CO(J=3-2) line emission from the host galaxy
of GRB 980425 with the Atacama Submillimeter Telescope Experiment (ASTE). We
observed five points of the galaxy covering the entire region. After combining
all of the spectra, we obtained a global spectrum with the rms noise level of
3.3 mK in T_mb scale at a velocity resolution of 10 km s^-1. No significant
emission was detected, though we find a marginal emission feature in the
velocity range corresponding to the redshift of the galaxy. We derive 3 sigma
upper limits on the global properties: the velocity-integrated CO(3-2)
intensity of I_CO(3-2) < 0.26 K km s^-1 by adopting a velocity width of 67 km
s^-1; the H_2 column density of N(H_2) < 3 x 10^20 cm^-2; the molecular gas
mass of M(H_2) < 3 x 10^8 M_sun, by assuming a CO line luminosity to H_2
molecular gas mass conversion factor of X_CO = 5.0 x 10^20 cm^-2 (K km
s^-1)^-1; and the star formation rate of SFR < 0.1 M_sun yr^-1, based on the
Schmidt law. The SFR is consistent with the previous results of H_alpha and
mid-IR observations, thereby suggesting that there is no significant obscured
star formation in the host galaxy of GRB 980425. This result implies that there
is a variety of GRB hosts with regard to the presence of obscured star
formation.
","[{""version"":""v1"",""created"":""Fri, 27 Apr 2007 03:17:25 GMT""}]","2015-05-13"
"0704.3655","Wang Qing","Ran Lu, Qing Wang","Equivalence of different descriptions for $\eta$ Particle in Simplest
  Little Higgs Model","7 pages","Chin.Phys.Lett.24:3371-3373,2007","10.1088/0256-307X/24/12/023",,"hep-ph",,"  In SU(3) simplest little Higgs model, a characteristic particle is the light
pseudoscalar boson eta, it leads interesting signals in the LHC/ILC and is
studied in literature with different parameterizations. In this work, we show
that these different descriptions for eta particle are equivalent up to some
SU(3) rotations as long as we suitably redefine the pseudo Goldstone boson
fields. We evaluate the necessary SU(3) rotations and built up explicit
expressions for redefined fields.
","[{""version"":""v1"",""created"":""Fri, 27 Apr 2007 04:21:54 GMT""}]","2008-11-26"
"0704.3656","Anders Biltmo","A. Biltmo and P. Henelius","Phase diagram of the dilute magnet LiHo_xY_{1-x}F_4","5 pages, 4 figures","Phys. Rev. B 76, 054423 (2007)","10.1103/PhysRevB.76.054423",,"cond-mat.stat-mech cond-mat.dis-nn",,"  We study the effective long-range Ising dipole model with a local exchange
interaction appropriate for the dilute magnetic compound LiHo_{x}Y_{1-x}F_4.
Our calculations yield a value of 0.12 K for the nearest neighbor exchange
interaction. Using a Monte Carlo method we calculate the phase boundary T_c(x)
between the ferromagnetic and paramagnetic phases. We demonstrate that the
experimentally observed linear decrease in T_c with dilution is not the simple
mean-field result, but a combination of the effects of fluctuations, the
exchange interaction and the hyperfine coupling. Furthermore, we find a
critical dilution x_c=0.21(2), below which there is no ordering. In agreement
with recent Monte Carlo simulations on a similar model, we find no evidence of
the experimentally observed freezing of the glassy state in our calculation. We
apply the theory of Stephen and Aharony to LiHo_{x}Y_{1-x}F_4 and find that the
theory does predict a finite-temperature freezing of the spin glass. Reasons
for the discrepancies are discussed.
","[{""version"":""v1"",""created"":""Fri, 27 Apr 2007 15:25:37 GMT""},{""version"":""v2"",""created"":""Sun, 29 Apr 2007 10:18:17 GMT""}]","2008-10-27"
"0704.3658","Katsunori Kawamura","Katsunori Kawamura","Recursive boson system in the Cuntz algebra ${\cal O}_{\infty}$","18 pp",,"10.1063/1.2759838",,"math.OA",,"  Bosons and fermions are often written by elements of other algebras. M. Abe
gave a recursive realization of the boson by formal infinite sums of the
canonical generators of the Cuntz algebra ${\cal O}_{\infty}$. We show that
such formal infinite sum always makes sense on a certain dense subspace of any
permutative representation of ${\cal O}_{\infty}$. In this meaning, we can
regard as if the algebra ${\cal B}$ of bosons was a unital $*$-subalgebra of
${\cal O}_{\infty}$ on a given permutative representation by keeping their
unboundedness. By this relation, we compute branching laws arising from
restrictions of representations of ${\cal O}_{\infty}$ on ${\cal B}$. For
example, it is shown that the Fock representation of ${\cal B}$ is given as the
restriction of the standard representation of ${\cal O}_{\infty}$ on ${\cal
B}$.
","[{""version"":""v1"",""created"":""Fri, 27 Apr 2007 04:32:51 GMT""}]","2009-11-13"
"0704.3659","Haruhiko Terao","Haruhiko Terao and Akito Tsuchiya","Conformal dynamics in gauge theories via non-perturbative
  renormalization group","27 pages, 12 Postscript figures, corrected typos and references",,,"Kanazawa-07-04","hep-ph",,"  The dynamics at the IR fixed point realized in the $SU(N_c)$ gauge theories
with massless Dirac fermions is studied by means of the non-perturbative
renormalization group. The analysis includes the IR fixed points with
non-trivial Yukawa couplings. The renormalization properties of the scalar
field are also discussed and it is shown that hierarchical mass scale may be
allowed without intense fine-tuning due to a large anomalous dimension.
","[{""version"":""v1"",""created"":""Fri, 27 Apr 2007 05:10:48 GMT""},{""version"":""v2"",""created"":""Fri, 19 Oct 2007 04:55:50 GMT""}]","2011-11-09"
"0704.3660","A. V. Syromyatnikov","A. V. Syromyatnikov","Nonfrustrated magnetoelectric with incommensurate magnetic order in
  magnetic field","12 pages, 3 figures, accepted in JETP","JETP 105, 587 (2007)","10.1134/S1063776107090154",,"cond-mat.str-el",,"  We discuss a model nonfrustrated magnetoelectric in which strong enough
magnetoelectric coupling produces incommensurate magnetic order leading to
ferroelectricity. Properties of the magnetoelectric in magnetic field directed
perpendicular to wave vector describing the spin helix are considered in
detail. Analysis of classical energy shows that in contrast to naive
expectation the onset of ferroelectricity takes place at a field $H_{c1}$ that
is lower than the saturation field $H_{c2}$. One has $H_{c1}=H_{c2}$ at strong
enough magnetoelectric coupling. We show that at H=0 the ferroelectricity
appears at $T=T_{FE}<T_N$. Qualitative discussion of phase diagram in $H-T$
plane is presented within mean field approach.
","[{""version"":""v1"",""created"":""Fri, 27 Apr 2007 05:57:03 GMT""}]","2007-10-22"
"0704.3661","Masato Koashi","Masato Koashi","Complementarity, distillable secret key, and distillable entanglement","4 pages, 2 figures",,,,"quant-ph",,"  We consider controllability of two conjugate observables Z and X by two
parties with classical communication. The ability is specified by two
alternative tasks, (i) agreement on Z and (ii) preparation of an eigenstate of
X with use of an extra communication channel. We prove that their feasibility
is equivalent to that of key distillation if the extra channel is quantum, and
to that of entanglement distillation if it is classical. This clarifies the
distinction between two entanglement measures, distillable key and distillable
entanglement.
","[{""version"":""v1"",""created"":""Fri, 27 Apr 2007 05:29:58 GMT""}]","2007-05-23"
"0704.3662","Tian-Jian Jiang","Mike Tian-Jian Jiang, James Zhan, Jaimie Lin, Jerry Lin, Wen-Lien Hsu","An Automated Evaluation Metric for Chinese Text Entry","8 pages","Jiang, Mike Tian-Jian, et al. ""Robustness analysis of adaptive
  chinese input methods."" Advances in Text Input Methods (WTIM 2011) (2011): 53",,,"cs.HC cs.CL",,"  In this paper, we propose an automated evaluation metric for text entry. We
also consider possible improvements to existing text entry evaluation metrics,
such as the minimum string distance error rate, keystrokes per character, cost
per correction, and a unified approach proposed by MacKenzie, so they can
accommodate the special characteristics of Chinese text. Current methods lack
an integrated concern about both typing speed and accuracy for Chinese text
entry evaluation. Our goal is to remove the bias that arises due to human
factors. First, we propose a new metric, called the correction penalty (P),
based on Fitts' law and Hick's law. Next, we transform it into the approximate
amortized cost (AAC) of information theory. An analysis of the AAC of Chinese
text input methods with different context lengths is also presented.
","[{""version"":""v1"",""created"":""Fri, 27 Apr 2007 05:34:10 GMT""}]","2013-10-29"
"0704.3663","Alexey Kalachev","Alexey Kalachev","Quantum storage on subradiant states in an extended atomic ensemble","V2: considerably revised (title, text). V3: minor changes - final
  version as published in PRA","Phys. Rev. A 76, 043812 (2007)","10.1103/PhysRevA.76.043812",,"quant-ph",,"  A scheme for coherent manipulation of collective atomic states is developed
such that total subradiant states, in which spontaneous emission is suppressed
into all directions due to destructive interference between neighbor atoms, can
be created in an extended atomic ensemble. The optimal conditions for creation
of such states and suitability of them for quantum storage are discussed. It is
shown that in order to achieve the maximum signal-to-noise ratio the shape of a
light pulse to be stored and reconstructed using a homogeneously broadened
absorbtion line of an atomic system should be a time-reversed regular part of
the response function of the system. In the limit of high optical density, such
pulses allow one to prepare collective subradiant atomic states with near flat
spatial distribution of the atomic excitation in the medium.
","[{""version"":""v1"",""created"":""Fri, 27 Apr 2007 05:43:00 GMT""},{""version"":""v2"",""created"":""Fri, 8 Jun 2007 15:28:15 GMT""},{""version"":""v3"",""created"":""Sun, 6 Apr 2008 20:10:27 GMT""}]","2009-11-13"
"0704.3664","Kanishev Konstantin","I. F. Ginzburg, K.A. Kanishev","Different vacua in 2HDM","24 pages, 3 figures","Phys.Rev.D76:095013,2007","10.1103/PhysRevD.76.095013",,"hep-ph",,"  We discuss the extrema of the Two Higgs Doublet Model with different physical
properties. We have found necessary and sufficient conditions for realization
of the extrema with different properties as the vacuum state of the model. We
found explicit equations for extremum energies via parameters of potential if
it has explicitly CP conserving form. These equations allow to pick out
extremum with lower energy -- vacuum state and to look for change of extrema
(phase transitions) with the variation of parameters of potential. Our goal is
to find general picture here to apply it for description of early Universe.
","[{""version"":""v1"",""created"":""Fri, 27 Apr 2007 05:43:20 GMT""},{""version"":""v2"",""created"":""Mon, 2 Jul 2007 09:46:22 GMT""},{""version"":""v3"",""created"":""Mon, 14 Jan 2008 09:59:10 GMT""}]","2008-11-26"
"0704.3665","Tian-Jian Jiang","Mike Tian-Jian Jiang, Deng Liu, Meng-Juei Hsieh, Wen-Lien Hsu","On the Development of Text Input Method - Lessons Learned","10 pages",,,,"cs.CL cs.HC",,"  Intelligent Input Methods (IM) are essential for making text entries in many
East Asian scripts, but their application to other languages has not been fully
explored. This paper discusses how such tools can contribute to the development
of computer processing of other oriental languages. We propose a design
philosophy that regards IM as a text service platform, and treats the study of
IM as a cross disciplinary subject from the perspectives of software
engineering, human-computer interaction (HCI), and natural language processing
(NLP). We discuss these three perspectives and indicate a number of possible
future research directions.
","[{""version"":""v1"",""created"":""Fri, 27 Apr 2007 05:58:32 GMT""}]","2007-05-23"
