"astro-ph/0703680","Giuliana Fiorentino","L.Angeretti G. Fiorentino and L. Greggio","Are interpolations in metallicity reliable?","2 pages, 2 figures, Proceedings of the IAU Symp. 241 ""Stellar
  Populations as Building Blocks of Galaxies"", held in La Palma in December
  2006, eds. R. F. Peletier & A. Vazdekis",,,,"astro-ph",,"  In this proceeding we present the procedure that we have adopted to obtain a
dataset of Padova94 tracks interpolated in metallicity. The procedure requires
special care to avoid spurious features in the resulting grid, thus we have
subdivided tracks in evolutionary phases, we have chosen the suitable
interpolation method and the transition masses. Finally, we have compared our
interpolated dataset with a similar models, Girardi et al. 2000, obtaining a
general good agreement.
","[{""version"":""v1"",""created"":""Tue, 27 Mar 2007 11:45:56 GMT""}]","2007-05-23"
"astro-ph/0703681","Andrey Tlatov","A.G. Tlatov","Search for relationship between duration of the extended solar cycles
  and amplitude of sunspot cycle","7 pages, 6 figures, 1 table",,"10.1002/asna.200710886",,"astro-ph",,"  Duration of the extended solar cycles is taken into the consideration. The
beginning of cycles is counted from the moment of polarity reversal of
large-scale magnetic field in high latitudes, occurring in the sunspot cycle n
till the minimum of the cycle n+2. The connection between cycle duration and
its amplitude is established. Duration of the ""latent"" period of evolution of
extended cycle between reversals and a minimum of the current sunspot cycle is
entered. It is shown, that the latent period of cycles evolution is connected
with the next sunspot cycle amplitude and can be used for the prognosis of a
level and time of a sunspot maximum. The 24-th activity cycle prognosis is
done. Long-term behavior of extended cycle's lengths is considered.
","[{""version"":""v1"",""created"":""Tue, 27 Mar 2007 13:28:37 GMT""}]","2009-11-13"
"astro-ph/0703682","Donatella Romano","Gary Steigman (1), Donatella Romano (2), Monica Tosi (2) ((1) The Ohio
  State University; (2) INAF, Osservatorio Astronomico di Bologna)","Connecting the primordial and Galactic deuterium abundances","5 pages, 4 figures; accepted for publication in MNRAS","Mon.Not.Roy.Astron.Soc.378:576-580,2007","10.1111/j.1365-2966.2007.11780.x",,"astro-ph",,"  The deuterium abundances inferred from observations of the interstellar
medium within 1-2 kpc of the Sun range over a factor of three and the
corresponding oxygen abundances show an even larger dispersion. While the lower
D (and O) abundances likely result from depletion onto dust, the higher D
abundances are consistent with the BBN-predicted primordial D abundance and
chemical evolution models of the Galaxy with infall of primordial or nearly
primordial material. The large ranges in deuterium and oxygen abundances
suggest that the effects of depletion and/or infall have not been homogenized
in the local interstellar medium.
","[{""version"":""v1"",""created"":""Tue, 27 Mar 2007 13:36:46 GMT""}]","2008-11-26"
"astro-ph/0703683","Xing Li","X. Li, Q.M. Lu, B. Li","Ion pick-up by finite amplitude parallel propagating Alfv\'en wave",,"Astrophys.J.661:L105-L108,2007","10.1086/518420",,"astro-ph",,"  Two scenarios of possible ion heating due to finite amplitude parallel
propagating Alfv\'en waves in the solar atmosphere are investigated using a 1D
test particle approach. 1. An finite amplitude Alfv\'en wave is instantly
introduced into a plasma (or equivalently, new ions are instantly created). 2.
New ions are constantly created. In both scenarios, ions will be picked up by
the Alfv\'en wave. In case 1, the wave scatters ions in the transverse
direction leading to a randomization (or heating) process. This process is
complete when a phase shift of $\pm \pi$ in the ion gyro-speed is produced
between particles with characteristic parallel thermal speed and particles with
zero parallel speed. This corresponds to $t={\pi \over k v_{th}}$ ($k$ is the
wave number and $v_{th}$ is the ion thermal speed). A ring velocity
distribution can be produced for large wave amplitude. The process yields a
mass-proportional heating in the transverse direction, a temperature anisotropy
and a bulk flow along the background magnetic field. In case 2, continuous ion
creation represents a continuing phase shift in the ion gyro-speed leading to
heating. New particles are picked up by the Alfv\'en wave within one ion
gyroperiod. It is speculated that the mechanism may operate in the chromosphere
and active regions where transient events may generate finite amplitude
Alfv\'en waves.
","[{""version"":""v1"",""created"":""Tue, 27 Mar 2007 13:49:06 GMT""},{""version"":""v2"",""created"":""Fri, 13 Apr 2007 22:28:39 GMT""}]","2009-11-13"
"astro-ph/0703684","GianLuca Israel","G.L. Israel, S. Campana, S. Dall'Osso, M. P. Muno, J. Cummings, R.
  Perna, and L. Stella","The Post-Burst Awakening of the Anomalous X-ray Pulsar in Westerlund 1","Accepted for publication on ApJ Main Journal; 24 pages, 8 figures","Astrophys.J.664:448-457,2007","10.1086/518224",,"astro-ph",,"  On September 21, 2006, an intense (~10^39 erg/s) and short (20 ms) burst was
detected by Swift BAT at a position consistent with that of the candidate
Anomalous X-ray Pulsar, CXOU J164710.2-455216, discovered by Chandra in 2005.
Swift follow-up observations began about 13 hours after the event and found the
source at a 1-10keV flux level of about 4.5 x 10^-11 erg/s/cm^2, i.e. ~300
times brighter than measured 5 days earlier by XMM. We report the results
obtained from Swift BAT observations of the burst and subsequent Swift XRT
observations carried out during the first four months after the burst. These
data are complemented with those from two XMM observations (carried out just
before and after the BAT event) and four archival Chandra observations carried
out between 2005 and 2007. We find a phase coherent solution for the source
pulsations after the burst. The evolution of the pulse phase comprises an
exponential component decaying with timescale of 1.4d which we interpret as the
recovery stage following a large glitch (Delta nu / nu about 6 x 10^-5). We
also detect a quadratic component corresponding to a spin-down rate of Pdot ~ 9
x 10^-13, implying a magnetic field strength of 10^14 Gauss.
  During the first Swift XRT observation taken 0.6 days after the burst, the
spectrum showed a kT = 0.65keV blackbody (R_BB = 1.5km) plus a Gamma=2.3
power-law accounting for about 60% of the 1-10 keV observed flux. Analysis of
Chandra archival data, taken during 2005 when the source was in quiescence,
reveal that the modulation in quiescence is 100% pulsed at energies above 4 keV
and consistent with the (unusually small-sized) blackbody component being
occulted by the neutron star as it rotates.
","[{""version"":""v1"",""created"":""Tue, 27 Mar 2007 13:51:32 GMT""}]","2011-02-11"
"astro-ph/0703685","Ho Bun Lau","H.B. Lau, R.J. Stancliffe & C.A. Tout","Carbon Rich Extremely Metal Poor Stars: Signatures of Population-III AGB
  stars in Binary Systems","16 pages, 1 figure, 7 tables, accepted by MNRAS","Mon.Not.Roy.Astron.Soc.378:563-568,2007","10.1111/j.1365-2966.2007.11773.x",,"astro-ph",,"  We use the Cambridge stellar evolution code STARS to model the evolution and
nucleosynthesis of zero-metallicity intermediate-mass stars. We investigate the
effect of duplicity on the nucleosynthesis output of these systems and the
potential abundances of the secondaries. The surfaces of zero-metallicity stars
are enriched in CNO elements after second dredge up. During binary interaction,
such as Roche lobe overflow or wind accretion, metals can be released from
these stars and the secondaries enriched in CNO isotopes. We investigate the
formation of the two most metal poor stars known, HE 0107-5240 and HE
1327-2326. The observed carbon and nitrogen abundances of HE 0107-5240 can be
reproduced by accretion of material from the companion-enhanced wind of a seven
solar star after second dredge-up, though oxygen and sodium are underproduced.
We speculate that HE 1327-2326, which is richer in nitrogen and strontium, may
similarly be formed by wind accretion in a later AGB phase after third
dredge-up.
","[{""version"":""v1"",""created"":""Tue, 27 Mar 2007 14:07:46 GMT""}]","2008-11-26"
"astro-ph/0703686","Andrzej Odrzywolek","A. Odrzywolek, M. Kutschera","Kaon condensate with trapped neutrinos and high-density symmetry energy
  behavior","6 pages, 10 figures, submitted to PLB","Acta Phys.Polon.B40:195,2009",,,"astro-ph",,"  Effects of the neutrino trapping and symmetry energy behavior are
investigated in the framework of the chiral Kaplan-Nelson model with kaon
condensation. Decrease in the condensation threshold during deleptonization if
found to be generic regardless uncertainties in the nucleon-kaon interactions
and symmetry energy. Quantitatively however, differences are shown to be
important
","[{""version"":""v1"",""created"":""Tue, 27 Mar 2007 14:18:58 GMT""}]","2009-03-19"
"astro-ph/0703687","Cameron Reed","B. Cameron Reed","2MASS Identifications for Galactic OB Stars","8 pages",,,,"astro-ph",,"  Cross-identifications for 14,574 intrinsically luminous galactic stars
(mostly OB stars) to objects in the 2MASS survey have been determined using a
search box of +/-0.0015 degrees (+/- 5.4 arcsec) in both RA and Dec.
Instructions on obtaining the relevant files can be obtained at
othello.alma.edu/~reed/OB-2MASS.doc.
","[{""version"":""v1"",""created"":""Tue, 27 Mar 2007 14:23:23 GMT""}]","2007-05-23"
"astro-ph/0703688","Kristine Spekkens","Kristine Spekkens (NRAO/Rutgers), J. A. Sellwood (Rutgers)","Modeling Non-Circular Motions in Disk Galaxies: Application to NGC 2976","12 pages, 6 figures, accepted for publication in ApJ. v2: minor
  changes to match proofs. For version with high-resolution figures, see
  http://www.physics.rutgers.edu/~spekkens/papers/noncirc.pdf","Astrophys.J.664:204-214,2007","10.1086/518471","Rutgers Astrophysics Preprint #452","astro-ph",,"  We present a new procedure to fit non-axisymmetric flow patterns to 2-D
velocity maps of spiral galaxies. We concentrate on flows caused by bar-like or
oval distortions to the total potential that may arise either from a
non-axially symmetric halo or a bar in the luminous disk. We apply our method
to high-quality CO and Halpha data for the nearby, low-mass spiral NGC 2976
previously obtained by Simon et al., and find that a bar-like model fits the
data at least as well as their model with large radial flows. We find
supporting evidence for the existence of a bar in the baryonic disk. Our model
suggests that the azimuthally averaged central attraction in the inner part of
this galaxy is larger than estimated by these authors. It is likely that the
disk is also more massive, which will limit the increase to the allowed dark
halo density. Allowance for bar-like distortions in other galaxies may either
increase or decrease the estimated central attraction.
","[{""version"":""v1"",""created"":""Tue, 27 Mar 2007 14:47:51 GMT""},{""version"":""v2"",""created"":""Wed, 13 Jun 2007 14:18:23 GMT""}]","2011-02-11"
"astro-ph/0703689","Fr\'ed\'eric Paletou","L. Leger, L. Chevallier & F. Paletou","Fast 2D non-LTE radiative modelling of prominences I. Numerical methods
  and benchmark results","10 pages, 8 figures, accepted to A&A",,"10.1051/0004-6361:20066730",,"astro-ph",,"  New high-resolution spectropolarimetric observations of solar prominences
require improved radiative modelling capabilities in order to take into account
both multi-dimensional - at least 2D - geometry and complex atomic models. This
makes necessary the use of very fast numerical schemes for the resolution of 2D
non-LTE radiative transfer problems considering freestanding and illuminated
slabs. The implementation of Gauss-Seidel and successive over-relaxation
iterative schemes in 2D, together with a multi-grid algorithm, is thoroughly
described in the frame of the short characteristics method for the computation
of the formal solution of the radiative transfer equation in cartesian
geometry. We propose a new test for multidimensional radiative transfer codes
and we also provide original benchmark results for simple 2D multilevel atom
cases which should be helpful for the further development of such radiative
transfer codes, in general.
","[{""version"":""v1"",""created"":""Tue, 27 Mar 2007 15:01:43 GMT""}]","2009-11-13"
"astro-ph/0703690","Zhaohui Shang","Zhaohui Shang (1, 2), Beverley J. Wills (3), D. Wills (3), and Michael
  S. Brotherton (2) ((1) Tianjin Normal University, China, (2) University of
  Wyoming, USA, (3) University of Texas at Austin, USA)","Spectral Properties From Lyman-alpha to H-alpha For An Essentially
  Complete Sample of Quasars I: Data","42 pages, 10 figures, 13 tables. Accepted by AJ. Supplemental figures
  not included. Full version available at
  http://physics.uwyo.edu/~shang/pgxpaper/ShangPaper.pdf","Astron.J.134:294-313,2007","10.1086/518505",,"astro-ph",,"  We have obtained quasi-simultaneous ultraviolet-optical spectra for 22 out of
23 quasars in the complete PG-X-ray sample with redshift, z<0.4, and M_B<-23.
The spectra cover rest-frame wavelengths from at least Lyman-alpha to H-alpha.
Here we provide a detailed description of the data, including careful
spectrophotometry and redshift determination. We also present direct
measurements of the continua, strong emission lines and features, including
Lyman-alpha, SiIV+OIV], CIV, CIII], SiIII], MgII, H-beta, [OIII],
He5876+NaI5890,5896, H-alpha, and blended iron emission in the UV and optical.
The widths, asymmetries and velocity shifts of profiles of strong emission
lines show that CIV and Lyman-alpha are very different from H-beta and H-alpha.
This suggests that the motion of the broad line region is related to the
ionization structure, but the data appears not agree with the radially
stratified ionization structure supported by reverberation mapping studies, and
therefore suggest that outflows contribute additional velocity components to
the broad emission line profiles.
","[{""version"":""v1"",""created"":""Tue, 27 Mar 2007 15:21:09 GMT""},{""version"":""v2"",""created"":""Wed, 28 Mar 2007 04:59:29 GMT""},{""version"":""v3"",""created"":""Tue, 10 Apr 2007 08:20:13 GMT""}]","2008-11-26"
"astro-ph/0703691","Pascal Petit","P. Petit","Spectropolarimetry of cool stars","10 pages, proceedings of SPW4, ASP Conference Series, in press",,,,"astro-ph",,"  In recent years, the development of spectropolarimetric techniques deeply
modified our knowledge of stellar magnetism. In the case of solar-type stars,
the challenge is to measure a geometrically complex field and determine its
evolution over very different time frames. In this article, I summarize some
important observational results obtained in this field over the last two
decades and detail what they tell us about the dynamo processes that
orchestrate the activity of cool stars. I also discuss what we learn from such
observations about the ability of magnetic fields to affect the formation and
evolution of Sun-like stars. Finally, I evoke promising directions to be
explored in the coming years, thanks to the advent of a new generation of
instruments specifically designed to progress in this domain.
","[{""version"":""v1"",""created"":""Tue, 27 Mar 2007 15:22:54 GMT""}]","2007-05-23"
"cond-mat/0703641","Andreas Hemmerich","A. Hemmerich, C. Morais Smith","Exciting a d-density wave in an optical lattice with driven tunneling","4 pages, 3 figures","Phys. Rev. Lett. 99, 113002 (2007)","10.1103/PhysRevLett.99.113002",,"cond-mat.other",,"  Quantum phases with unusual symmetries may play a key role for the
understanding of solid state systems at low temperatures. We propose a
realistic scenario, well in reach of present experimental techniques, which
should permit to produce a stationary quantum state with $d_{x^2-y^2}$-symmetry
in a two-dimensional bosonic optical square lattice. This state, characterized
by alternating rotational flux in each plaquette, arises from driven tunneling
implemented by a stimulated Raman scattering process. We discuss bosons in a
square lattice, however, more complex systems involving other lattice
geometries appear possible.
","[{""version"":""v1"",""created"":""Mon, 26 Mar 2007 17:57:36 GMT""},{""version"":""v2"",""created"":""Wed, 23 May 2007 11:47:31 GMT""}]","2010-11-02"
"cond-mat/0703659","David Goldhaber-Gordon","Silvia L\""uscher, Lindsay S. Moore, Tomaz Rejec, Yigal Meir, Hadas
  Shtrikman, and David Goldhaber-Gordon","Charge rearrangement and screening in a quantum point contact","6 pages, 5 figures. Published in PRL. Supplementary Information is
  included. Changes: Two references and journal reference added","Physical Review Letters 98, 196805 (2007)","10.1103/PhysRevLett.98.196805",,"cond-mat.mes-hall cond-mat.str-el",,"  Compressibility measurements, sensitive to charge rearrangements, are
performed on a quantum point contact (QPC). Screening due to mobile charges in
the QPC is quantitatively measured, using a second point contact to detect the
screened electrical potential. These measurements are performed from pinch-off
through the opening of the first few modes in the QPC. While the measured
signal closely matches a Thomas-Fermi-Poisson prediction, deviations from the
classical behavior, in the form of additional dips, are apparent near the
openings of the different modes, with the largest dip at the opening of the
first mode. Density functional calculations attribute the first dip to exchange
interactions. The other dips reflect the diverging density of states at the
opening of each one-dimensional mode, which affects both kinetic and exchange
contributions to the energy.
","[{""version"":""v1"",""created"":""Mon, 26 Mar 2007 19:51:04 GMT""},{""version"":""v2"",""created"":""Mon, 25 Jun 2007 03:52:19 GMT""}]","2016-08-14"
"cond-mat/0703660","Masaru Uchiyama","Masaru Uchiyama","Two-Species Asymmetric Simple Exclusion Process with Open Boundaries","17 pages, 2 figures",,"10.1016/j.chaos.2006.05.013",,"cond-mat.stat-mech",,"  We study the steady state of the two-species Asymmetric Simple Exclusion
Process (ASEP) with open boundary conditions. The matrix product method works
for the determination of the stationary probability distribution. Several
physical quantities are calculated through an explicit representation for the
matrix products. By making full use of the relation with the continuous big
q-Hermite polynomials, we arrive at integral formulae for the partition
function and the n-point functions. We examine the thermodynamic limit and find
three phases: the low-density phase, the high-density phase and the maximal
current phase.
","[{""version"":""v1"",""created"":""Mon, 26 Mar 2007 17:48:03 GMT""}]","2007-05-23"
"cond-mat/0703682","Harold Fellermann","Rudolf M. F\""uchslin, Harold Fellermann, Anders Eriksson, Hans-Joachim
  Ziock","Coarse-Graining and Scaling in Dissipative Particle Dynamics","8 pages, 3 figures -- major changes to the text, simulations added",,,,"cond-mat.soft cond-mat.stat-mech",,"  Dissipative particle dynamics (DPD) is now a well-established method for
simulating soft matter systems. However, its applicability was recently
questioned because some investigations showed an upper coarse-graining limit
that would prevent the applicability of the method to the whole mesoscopic
range. This article aims to reestablish DPD as a truly scale-free method by
analyzing the problems reported by other authors and by presenting a scaling
scheme that allows one to gauge a DPD-simulation to any desired length scale.
","[{""version"":""v1"",""created"":""Mon, 26 Mar 2007 16:33:42 GMT""},{""version"":""v2"",""created"":""Fri, 10 Aug 2007 14:41:30 GMT""}]","2011-11-09"
"cond-mat/0703683","Panayiotis Varotsos","P.A. Varotsos, N.V. Sarlis and E.S. Skordas","Natural time and 1/f ""noise""","18 pages including 13 figures",,,,"cond-mat.stat-mech",,"  Seismic electric signals have been found to obey the ubiquitous $1/f^a$
behavior [{\em Phys. Rev. E} {\bf 66}, 011902(2002)]. The newly introduced
concept of natural time enables the study of the dynamic evolution of a complex
system and identifies when the system enters the critical stage. On the basis
of this concept, a simple model is proposed here which exhibits the $1/f^a$
behavior with $a$ close to unity. Furthermore, we present recent data of
electric signals, which when analyzed in the natural time domain are found to
exhibit {\em critical} dynamics and hence can be classified as seismic electric
signals.
","[{""version"":""v1"",""created"":""Mon, 26 Mar 2007 17:36:58 GMT""},{""version"":""v2"",""created"":""Mon, 2 Apr 2007 15:30:43 GMT""},{""version"":""v3"",""created"":""Tue, 24 Apr 2007 13:18:45 GMT""},{""version"":""v4"",""created"":""Tue, 8 May 2007 10:42:48 GMT""},{""version"":""v5"",""created"":""Tue, 15 May 2007 13:03:37 GMT""}]","2007-05-23"
"cond-mat/0703684","Enrico Rossi","Roy H. Nyberg, Enrico Rossi and Dirk K. Morr","Identifying Collective Modes via Impurities in the Cuprate
  Superconductors","4 pages, 4 figures","Phys. Rev. B 78, 054504 (2008)","10.1103/PhysRevB.78.054504",,"cond-mat.str-el cond-mat.supr-con",,"  We show that the pinning of collective charge and spin modes by impurities in
the cuprate superconductors leads to qualitatively different fingerprints in
the local density of states (LDOS). In particular, in a pinned (static) spin
droplet, the creation of a resonant impurity state is suppressed, the
spin-resolved LDOS exhibits a characteristic spatial pattern, and the LDOS
undergoes significant changes with increasing magnetic field. Since all of
these fingerprints are absent in a charge droplet, impurities are a new probe
for identifying the nature and relative strength of collective modes.
","[{""version"":""v1"",""created"":""Mon, 26 Mar 2007 20:00:14 GMT""}]","2009-06-22"
"cond-mat/0703685","Ram Seshadri","R. Tackett, G. Lawes, B. C. Melot, M. Grossman, E. S. Toberer, and R.
  Seshadri","Magnetodielectric coupling in Mn3O4","6 pages, 7 figures","Phys. Rev. B 76, 024409 (2007) (6 pages)","10.1103/PhysRevB.76.024409",,"cond-mat.mtrl-sci",,"  We have investigated the dielectric anomalies associated with spin ordering
transitions in the tetragonal spinel Mn$_3$O$_4$, using thermodynamic,
magnetic, and dielectric measurements. We find that two of the three magnetic
ordering transitions in Mn$_3$O$_4$ lead to decreases in the temperature
dependent dielectric constant at zero applied field. Applying a magnetic field
to the polycrystalline sample leaves these two dielectric anomalies practically
unchanged, but leads to an increase in the dielectric constant at the
intermediate spin-ordering transition. We discuss possible origins for this
magnetodielectric behavior in terms of spin-phonon coupling. Band structure
calculations suggest that in its ferrimagnetic state, Mn$_3$O$_4$ corresponds
to a semiconductor with no orbital degeneracy due to strong Jahn-Teller
distortion.
","[{""version"":""v1"",""created"":""Mon, 26 Mar 2007 20:40:42 GMT""}]","2007-10-16"
"cond-mat/0703686","Lutz Maibaum","Lutz Maibaum, David Chandler","Segue Between Favorable and Unfavorable Solvation","8 pages, 7 figures","J. Phys. Chem. B 111 (30), 9025 (2007)","10.1021/jp072266z",,"cond-mat.stat-mech",,"  Solvation of small and large clusters are studied by simulation, considering
a range of solvent-solute attractive energy strengths. Over a wide range of
conditions, both for solvation in the Lennard-Jones liquid and in the SPC model
of water, it is shown that the mean solvent density varies linearly with
changes in solvent-solute adhesion or attractive energy strength. This behavior
is understood from the perspective of Weeks' theory of solvation [Ann. Rev.
Phys. Chem. 2002, 53, 533] and supports theories based upon that perspective.
","[{""version"":""v1"",""created"":""Mon, 26 Mar 2007 20:53:49 GMT""}]","2007-07-29"
"cond-mat/0703687","Cristian F. Moukarzel","Cristian F. Moukarzel, Silvia F. Fernandez-Sabido, and J. C.
  Ruiz-Suarez","Phase Transition in Liquid Drop Fragmentation","10 pages, 11 figures. LaTeX (revtex4) with psfig/epsfig",,"10.1103/PhysRevE.75.061127",,"cond-mat.stat-mech",,"  A liquid droplet is fragmented by a sudden pressurized-gas blow, and the
resulting droplets, adhered to the window of a flatbed scanner, are counted and
sized by computerized means. The use of a scanner plus image recognition
software enables us to automatically count and size up to tens of thousands of
tiny droplets with a smallest detectable volume of approximately 0.02 nl. Upon
varying the gas pressure, a critical value is found where the size-distribution
becomes a pure power-law, a fact that is indicative of a phase transition. Away
from this transition, the resulting size distributions are well described by
Fisher's model at coexistence. It is found that the sign of the surface
correction term changes sign, and the apparent power-law exponent tau has a
steep minimum, at criticality, as previously reported in Nuclear
Multifragmentation studies [1,2]. We argue that the observed transition is not
percolative, and introduce the concept of dominance in order to characterize
it. The dominance probability is found to go to zero sharply at the transition.
Simple arguments suggest that the correlation length exponent is nu=1/2. The
sizes of the largest and average fragments, on the other hand, do not go to
zero but behave in a way that appears to be consistent with recent predictions
of Ashurst and Holian [3,4].
","[{""version"":""v1"",""created"":""Mon, 26 Mar 2007 22:56:24 GMT""}]","2009-11-13"
