"math/0703790","Albert Hanen","Albert Hanen","Un th\'{e}or\`{e}me limite pour les covariances des spins dans le
  mod\`{e}le de Sherrington--Kirkpatrick avec champ externe","Published at http://dx.doi.org/10.1214/009117906000000665 in the
  Annals of Probability (http://www.imstat.org/aop/) by the Institute of
  Mathematical Statistics (http://www.imstat.org)","Annals of Probability 2007, Vol. 35, No. 1, 141-179","10.1214/009117906000000665","IMS-AOP-AOP0197","math.PR",,"  On \'{e}tudie la covariance (pour la mesure de Gibbs) des spins en deux sites
dans le cas d'un mod\`{e}le de Sherrington--Kirkpatrick avec champ externe;
lorsque le nombre de sites du mod\`{e}le tend vers l'infini, une \'{e}valuation
asymptotique des moments d'ordre $p$ de cette covariance permet d'obtenir un
th\'{e}or\`{e}me limite faible avec une loi limite en g\'{e}n\'{e}ral non
gaussienne. We study the covariance (for Gibbs measure) of spins at two sites
in the case of a Sherrington--Kirkpatrick model with an external field. When
the number of sites of the model grows to infinity, an asymptotic evaluation of
the $p$ moments of that covariance allows us to obtain a weak limit theorem,
with a generally non-Gaussian limit law.
","[{""version"":""v1"",""created"":""Tue, 27 Mar 2007 10:08:15 GMT""}]","2007-05-23"
"math/0703791","Peter Imkeller","Shizan Fang, Peter Imkeller, Tusheng Zhang","Global flows for stochastic differential equations without global
  Lipschitz conditions","Published at http://dx.doi.org/10.1214/009117906000000412 in the
  Annals of Probability (http://www.imstat.org/aop/) by the Institute of
  Mathematical Statistics (http://www.imstat.org)","Annals of Probability 2007, Vol. 35, No. 1, 180-205","10.1214/009117906000000412","IMS-AOP-AOP0162","math.PR",,"  We consider stochastic differential equations driven by Wiener processes. The
vector fields are supposed to satisfy only local Lipschitz conditions. The
Lipschitz constants of the drift vector field, valid on balls of radius $R$,
are supposed to grow not faster than $\log R$, while those of the diffusion
vector fields are supposed to grow not faster than $\sqrt{\log R}.$ We
regularize the stochastic differential equations by associating with them
approximating ordinary differential equations obtained by discretization of the
increments of the Wiener process on small intervals. By showing that the flow
associated with a regularized equation converges uniformly to the solution of
the stochastic differential equation, we simultaneously establish the existence
of a global flow for the stochastic equation under local Lipschitz conditions.
","[{""version"":""v1"",""created"":""Tue, 27 Mar 2007 10:25:46 GMT""}]","2007-05-23"
"math/0703792","Petr Ambro\v{z}","P. Ambroz, E. Pelantova","A note on 3iet preserving morphisms","9 pages, 1 figure",,,,"math.CO",,"  An infinite word, which is aperiodic and codes the orbit of a transformation
of the exchange of three intervals is called 3iet word. Such a word is thus a
natural generalization of a sturmian word to a word over 3-letter alphabet. A
morphism is said to be 3iet preserving if it maps any 3iet word to another 3iet
word. It is known that the monoid of morphisms preserving sturmian words is
finitely generated. On the contrary, in this note we prove that the monoid of
3iet preserving morphisms is not finitely generated, that is, there are
infinitely many 3iet preserving morphisms, which cannot be written as a
non-trivial decomposition of other 3iet preserving morphisms.
","[{""version"":""v1"",""created"":""Tue, 27 Mar 2007 11:47:23 GMT""}]","2007-05-23"
"math/0703793","Ludger R\""{u}schendorf","Jan Bergenthum, Ludger R\""uschendorf","Comparison of semimartingales and L\'{e}vy processes","Published at http://dx.doi.org/10.1214/009117906000000386 in the
  Annals of Probability (http://www.imstat.org/aop/) by the Institute of
  Mathematical Statistics (http://www.imstat.org)","Annals of Probability 2007, Vol. 35, No. 1, 228-254","10.1214/009117906000000386","IMS-AOP-AOP0148","math.PR",,"  In this paper, we derive comparison results for terminal values of
$d$-dimensional special semimartingales and also for finite-dimensional
distributions of multivariate L\'{e}vy processes. The comparison is with
respect to nondecreasing, (increasing) convex, (increasing) directionally
convex and (increasing) supermodular functions. We use three different
approaches. In the first approach, we give sufficient conditions on the local
predictable characteristics that imply ordering of terminal values of
semimartingales. This generalizes some recent convex comparison results of
exponential models in [Math. Finance 8 (1998) 93--126, Finance Stoch. 4 (2000)
209--222, Proc. Steklov Inst. Math. 237 (2002) 73--113, Finance Stoch. 10
(2006) 222--249]. In the second part, we give comparison results for
finite-dimensional distributions of L\'{e}vy processes with infinite L\'{e}vy
measure. In the first step, we derive a comparison result for Markov processes
based on a monotone separating transition kernel. By a coupling argument, we
get an application to the comparison of compound Poisson processes. These
comparisons are then extended by an approximation argument to the ordering of
L\'{e}vy processes with infinite L\'{e}vy measure. The third approach is based
on mixing representations which are known for several relevant distribution
classes. We discuss this approach in detail for the comparison of generalized
hyperbolic distributions and for normal inverse Gaussian processes.
","[{""version"":""v1"",""created"":""Tue, 27 Mar 2007 11:47:30 GMT""}]","2016-08-14"
"math/0703794","Ivan Nourdin","S\'ebastien Darses, Ivan Nourdin","Asymptotic expansions at any time for scalar fractional SDEs with Hurst
  index $H>1/2$","Published in at http://dx.doi.org/10.3150/08-BEJ124 the Bernoulli
  (http://isi.cbs.nl/bernoulli/) by the International Statistical
  Institute/Bernoulli Society (http://isi.cbs.nl/BS/bshome.htm)","Bernoulli 2008, Vol. 14, No. 3, 822-837","10.3150/08-BEJ124","IMS-BEJ-BEJ124","math.PR","http://arxiv.org/licenses/nonexclusive-distrib/1.0/","  We study the asymptotic expansions with respect to $h$ of
\[\mathrm{E}[\Delta_hf(X_t)],\qquad
\mathrm{E}[\Delta_hf(X_t)|\mathscr{F}^X_t]\quadand\quad
\mathrm{E}[\Delta_hf(X_t)|X_t],\] where $\Delta_hf(X_t)=f(X_{t+h})-f(X_t)$,
when $f:\mathbb {R}\to\mathbb{R}$ is a smooth real function, $t\geq0$ is a
fixed time, $X$ is the solution of a one-dimensional stochastic differential
equation driven by a fractional Brownian motion with Hurst index $H>{1}/{2}$
and $\mathscr{F}^X$ is its natural filtration.
","[{""version"":""v1"",""created"":""Tue, 27 Mar 2007 11:49:47 GMT""},{""version"":""v2"",""created"":""Fri, 28 Sep 2007 07:12:53 GMT""},{""version"":""v3"",""created"":""Fri, 24 Oct 2008 11:42:08 GMT""}]","2009-09-29"
"math/0703795","Henrik Seppanen","Henrik Seppanen","Branching laws for minimal holomorphic representations",,,,,"math.RT",,"  In this paper we study the branching law for the restriction from $SU(n,m)$
to $SO(n,m)$ of the minimal representation in the analytic continuation of the
scalar holomorphic discrete series. We identify the the group decomposition
with the spectral decomposition of the action of the Casimir operator on the
subspace of $S(O(n) \times O(m))$-invariants. The Plancherel measure of the
decomposition defines an $L^2$-space of functions, for which certain continuous
dual Hahn polynomials furnish an orthonormal basis. It turns out that the
measure has point masses precisely when $n-m>2$. Under these conditions we
construct an irreducible representation of $SO(n,m)$, identify it with a
parabolically induced representation, and construct a unitary embedding into
the representation space for the minimal representation of $SU(n,m)$.
","[{""version"":""v1"",""created"":""Tue, 27 Mar 2007 11:57:58 GMT""}]","2007-05-23"
"math/0703796","Henrik Seppanen","Henrik Seppanen","Tube domains and restrictions of minimal representations",,,,,"math.RT",,"  In this paper we study the restrictions of the minimal representation in the
analytic continuation of the scalar holomorphic discrete series from
$Sp(n,\mathbb{R})$ to $GL(n,\mathbb{R})$, and from SU(n,n) to
$GL(n,\mathbb{C})$ respectively. We work with the realisations of the
representation spaces as $L^2$-spaces on the boundary orbits of rank one of the
corresponding cones, and give explicit integral operators that play the role of
the intertwining operators for the decomposition. We prove inversion formulas
for dense subspaces and use them to prove the Plancherel theorem for the
respective decomposition. The Plancherel measure turns out to be absolutely
continuous with respect to the Lebesgue measure in both cases.
","[{""version"":""v1"",""created"":""Tue, 27 Mar 2007 12:21:24 GMT""}]","2007-05-23"
"math/0703797","Henrik Seppanen","Henrik Seppanen","Quaternionic discrete series for Sp(1,1)",,,,,"math.RT math.DG",,"  In this paper we study the analytic realisation of the discrete series
representations for the group $G=Sp(1,1)$ as a subspace of the space of square
integrable sections in a homogeneous vector bundle over the symmetric space
$G/K:=Sp(1,1) /(Sp(1) \times Sp(1))$. We use the Szeg\""o map to give
expressions for the restrictions of the $K$-types occurring in the
representation spaces to the submanifold $AK/K$.
","[{""version"":""v1"",""created"":""Tue, 27 Mar 2007 12:29:51 GMT""}]","2007-05-23"
"math/0703798","Bartosz Kwa\'sniewski","B. K. Kwa\'sniewski","On transfer operators for C*-dynamical systems","12 pages, to appear in Rocky Mountain J. Math","Rocky J. Math. 42, No 3 (2012), 919-938",,,"math.OA math.DS","http://arxiv.org/licenses/nonexclusive-distrib/1.0/","  The theme of the paper is the question of existence and basic structure of
transfer operators for endomorphisms of a unital C*-algebra. We establish a
complete description of non-degenerate transfer operators, characterize
complete transfer operators and clarify their role in crossed product
constructions. Also, we give necessary and sufficient conditions for existence
of transfer operators for commutative systems, and discuss their form for
endomorphisms of B(H) which is relevant to Kadison-Singer problem.
","[{""version"":""v1"",""created"":""Tue, 27 Mar 2007 12:37:59 GMT""},{""version"":""v2"",""created"":""Sun, 15 Nov 2009 22:14:41 GMT""}]","2013-11-20"
"math/0703799","Pierre-Emmanuel Caprace","Pierre-Emmanuel Caprace","Buildings with isolated subspaces and relatively hyperbolic Coxeter
  groups","An erratum, correcting two errors in the original paper, has been
  appended",,,,"math.GR","http://arxiv.org/licenses/nonexclusive-distrib/1.0/","  Let $(W, S)$ be a Coxeter system. We give necessary and sufficient conditions
on the Coxeter diagram of $(W, S)$ for $W$ to be relatively hyperbolic with
respect to a collection of finitely generated subgroups. The peripheral
subgroups are necessarily parabolic subgroups (in the sense of Coxeter group
theory). As an application, we present a criterion for the maximal flats of the
Davis complex of $(W,S)$ to be isolated. If this is the case, then the maximal
affine sub-buildings of any building of type $(W,S)$ are isolated.
","[{""version"":""v1"",""created"":""Tue, 27 Mar 2007 15:18:53 GMT""},{""version"":""v2"",""created"":""Tue, 8 Jul 2008 20:16:25 GMT""},{""version"":""v3"",""created"":""Mon, 16 Dec 2013 17:36:17 GMT""}]","2013-12-17"
"math/0703800","Bartosz Kwa\'sniewski","B. K. Kwa\'sniewski","Extensions of C*-dynamical systems to systems with complete transfer
  operators","Compressed and submitted version, 9 pages","Math. Notes 98 (2015), no. 3, 419-428","10.1134/S0001434615090072",,"math.OA math.DS","http://arxiv.org/licenses/nonexclusive-distrib/1.0/","  Starting from an arbitrary endomorphism $\alpha$ of a unital C*-algebra $A$
we construct a bigger C*-algebra $B$ and extend $\alpha$ onto $B$ in such a way
that the extended endomorphism $\alpha$ has a unital kernel and a hereditary
range, i.e. there exists a unique non-degenerate transfer operator for
$(B,\alpha)$, called the complete transfer operator. The pair $(B,\alpha)$ is
universal with respect to a suitable notion of a covariant representation and
depends on a choice of an ideal in $A$. The construction enables a natural
definition of the crossed product for arbitrary $\alpha$.
","[{""version"":""v1"",""created"":""Tue, 27 Mar 2007 13:44:16 GMT""},{""version"":""v2"",""created"":""Wed, 22 Feb 2012 17:52:44 GMT""},{""version"":""v3"",""created"":""Tue, 19 Nov 2013 10:04:31 GMT""}]","2016-12-01"
"math/0703801","Bartosz Kwa\'sniewski","B. K. Kwasniewski, A. V. Lebedev","Crossed product by an arbitrary endomorphism","17 pages",,,,"math.OA math.FA",,"  Starting from an arbitrary endomorphism \delta of a unital C*-algebra A we
construct a crossed product. It is shown that the natural construction depends
not only on the C*-dynamical system (A,\delta) but also on the choice of an
ideal J orthogonal to Ker \delta.
","[{""version"":""v1"",""created"":""Tue, 27 Mar 2007 13:39:19 GMT""},{""version"":""v2"",""created"":""Wed, 28 Mar 2007 10:03:06 GMT""}]","2007-05-23"
"math/0703802","Filip Lindskog","Henrik Hult, Filip Lindskog","Extremal behavior of stochastic integrals driven by regularly varying
  L\'{e}vy processes","Published at http://dx.doi.org/10.1214/009117906000000548 in the
  Annals of Probability (http://www.imstat.org/aop/) by the Institute of
  Mathematical Statistics (http://www.imstat.org)","Annals of Probability 2007, Vol. 35, No. 1, 309-339","10.1214/009117906000000548","IMS-AOP-AOP0172","math.PR",,"  We study the extremal behavior of a stochastic integral driven by a
multivariate L\'{e}vy process that is regularly varying with index $\alpha>0$.
For predictable integrands with a finite $(\alpha+\delta)$-moment, for some
$\delta>0$, we show that the extremal behavior of the stochastic integral is
due to one big jump of the driving L\'{e}vy process and we determine its limit
measure associated with regular variation on the space of c\`{a}dl\`{a}g
functions.
","[{""version"":""v1"",""created"":""Tue, 27 Mar 2007 13:37:35 GMT""}]","2007-05-23"
"math/0703803","Nicolau C. Saldanha","Nicolau C. Saldanha and Boris Shapiro","Spaces of locally convex curves in S^n and combinatorics of the group
  B_{n+1}","22 pages, 4 figures; full rewrite of previous version",,,,"math.GT math.DG","http://arxiv.org/licenses/nonexclusive-distrib/1.0/","  In the 1920's Marston Morse developed what is now known as Morse theory
trying to study the topology of the space of closed curves on S^2. We propose
to attack a very similar problem, which 80 years later remains open, about the
topology of the space of closed curves on S^2 which are locally convex (i.e.,
without inflection points). One of the main difficulties is the absence of the
covering homotopy principle for the map sending a non-closed locally convex
curve to the Frenet frame at its endpoint.
  In the present paper we study the spaces of locally convex curves in S^n with
a given initial and final Frenet frames. Using combinatorics of B^{+}_{n+1} =
B_{n+1} \cap SO_{n+1}, where B_{n+1} \subset O_{n+1} is the usual Coxeter-Weyl
group, we show that for any n \ge 2 these spaces fall in at most
$\lceil\frac{n}{2}\rceil+1$ equivalence classes up to homeomorphism. We also
study this classification in the double cover Spin(n+1).
  For $n = 2$ our results complete the classification of the corresponding
spaces into two topologically distinct classes, or three classes in the spin
case.
","[{""version"":""v1"",""created"":""Tue, 27 Mar 2007 13:43:03 GMT""},{""version"":""v2"",""created"":""Thu, 5 Jan 2012 18:45:42 GMT""}]","2012-01-06"
"math/0703804","J\'er\'emy Blanc","J\'er\'emy Blanc","On the inertia group of elliptic curves in the Cremona group of the
  plane","14 pages, no figure","Michigan Math. J. 56 (2008), no. 2, 315-330.","10.1307/mmj/1224783516",,"math.AG",,"  We study the group of birational transformations of the plane that fix (each
point of) a curve of geometric genus 1.
  A precise description of the finite elements is given; it is shown in
particular that the order is at most 6, and that if the group contains a
non-trivial torsion, the fixed curve is the image of a smooth cubic by a
birational transformation of the plane.
  We show that for a smooth cubic, the group is generated by its elements of
degree 3, and prove that it contains a free product of Z/2Z, indexed by the
points of the curve.
","[{""version"":""v1"",""created"":""Tue, 27 Mar 2007 13:45:02 GMT""},{""version"":""v2"",""created"":""Tue, 23 Oct 2007 21:52:35 GMT""}]","2009-03-13"
"math/0703805","G. Peskir","J. du Toit, G. Peskir","The trap of complacency in predicting the maximum","Published at http://dx.doi.org/10.1214/009117906000000638 in the
  Annals of Probability (http://www.imstat.org/aop/) by the Institute of
  Mathematical Statistics (http://www.imstat.org)","Annals of Probability 2007, Vol. 35, No. 1, 340-365","10.1214/009117906000000638","IMS-AOP-AOP0184","math.PR",,"  Given a standard Brownian motion $B^{\mu}=(B_t^{\mu})_{0\le t\le T}$ with
drift $\mu \in \mathbb{R}$ and letting $S_t^{\mu}=\max_{0\le s\le t}B_s^{\mu}$
for $0\le t\le T$, we consider the optimal prediction problem: \[V=\inf_{0\le
\tau \le T}\mathsf{E}(B_{\tau}^{\mu}-S_T^{\mu})^2\] where the infimum is taken
over all stopping times $\tau$ of $B^{\mu}$. Reducing the optimal prediction
problem to a parabolic free-boundary problem we show that the following
stopping time is optimal: \[\tau_*=\inf \{t_*\le t\le T\mid b_1(t)\le
S_t^{\mu}-B_t^{\mu}\le b_2(t)\}\] where $t_*\in [0,T)$ and the functions
$t\mapsto b_1(t)$ and $t\mapsto b_2(t)$ are continuous on $[t_*,T]$ with
$b_1(T)=0$ and $b_2(T)=1/2\mu$. If $\mu>0$, then $b_1$ is decreasing and $b_2$
is increasing on $[t_*,T]$ with $b_1(t_*)=b_2(t_*)$ when $t_*\ne 0$. Using
local time-space calculus we derive a coupled system of nonlinear Volterra
integral equations of the second kind and show that the pair of optimal
boundaries $b_1$ and $b_2$ can be characterized as the unique solution to this
system. This also leads to an explicit formula for $V$ in terms of $b_1$ and
$b_2$. If $\mu \le 0$, then $t_*=0$ and $b_2\equiv +\infty$ so that $\tau_*$ is
expressed in terms of $b_1$ only. In this case $b_1$ is decreasing on $[z_*,T]$
and increasing on $[0,z_*)$ for some $z_*\in [0,T)$ with $z_*=0$ if $\mu=0$,
and the system of two Volterra equations reduces to one Volterra equation. If
$\mu=0$, then there is a closed form expression for $b_1$. This problem was
solved in [Theory Probab. Appl. 45 (2001) 125--136] using the method of time
change (i.e., change of variables). The method of time change cannot be
extended to the case when $\mu \ne 0$ and the present paper settles the
remaining cases using a different approach.
","[{""version"":""v1"",""created"":""Tue, 27 Mar 2007 13:54:25 GMT""}]","2007-05-23"
"math/0703806","Christopher J. Leininger","Christopher J. Leininger","Accidental parabolics in mapping class groups","9 pages",,,,"math.GT math.GR",,"  In this note we discuss the behavior of the Gromov boundaries and limit sets
for the surface subgroups of the mapping class group with accidental parabolics
constructed by the author and A. Reid in earlier work. Specifically, we show
that generically there are no Cannon--Thurston maps from the Gromov boundary to
Thurston's boundary of Teichmuller space.
","[{""version"":""v1"",""created"":""Tue, 27 Mar 2007 13:59:38 GMT""}]","2007-05-23"
"math/0703807","Laura Wisewell","Marianna Cs\""ornyei and Laura Wisewell","Tube-measurability","4 pages",,,,"math.CA",,"  Define an outer measure on R^n by taking the infimum, over all covers of the
set by tubes, of the sum of the cross-sectional areas of the tubes. We show
that the only measurable sets for this outer measure are its null sets and
their complements.
","[{""version"":""v1"",""created"":""Tue, 27 Mar 2007 14:22:05 GMT""}]","2007-05-23"
"math/0703808","Qinian Jin","Qinian Jin, Yanyan Li and Haoyuan Xu","Symmetry and Asymmetry: The Method of Moving Spheres",,,,,"math.AP",,"  We consider some nonlinear elliptic equations on ${\mathbb R}^n$ and
${\mathbb S}^n$. By the method of moving spheres, we obtain the symmetry
properties of solutions and some nonexistence results. Moreover, by the global
bifurcation theory, we obtain a multiplicity result for a class of semilinear
elliptic equations.
","[{""version"":""v1"",""created"":""Tue, 27 Mar 2007 14:17:36 GMT""}]","2007-05-23"
"math/0703809","Isabelle Chalendar","Isabelle Chalendar, Jonathan R. Partington","Multivariable approximate Carleman-type theorems for complex measures","Published at http://dx.doi.org/10.1214/009117906000000377 in the
  Annals of Probability (http://www.imstat.org/aop/) by the Institute of
  Mathematical Statistics (http://www.imstat.org)","Annals of Probability 2007, Vol. 35, No. 1, 384-396","10.1214/009117906000000377","IMS-AOP-AOP0138","math.PR",,"  We prove a multivariable approximate Carleman theorem on the determination of
complex measures on ${\mathbb{R}}^n$ and ${\mathbb{R}}^n_+$ by their moments.
This is achieved by means of a multivariable Denjoy--Carleman maximum principle
for quasi-analytic functions of several variables. As an application, we obtain
a discrete Phragm\'{e}n--Lindel\""{o}f-type theorem for analytic functions on
${\mathbb{C}}_+^n$.
","[{""version"":""v1"",""created"":""Tue, 27 Mar 2007 14:25:44 GMT""}]","2007-05-23"
"math/0703810","Micha{\l} Kapustka","Grzegorz Kapustka, Michal Kapustka","Primitive contractions of Calabi-Yau threefolds I","23 pages, the numeration of subarticles changed",,,,"math.AG",,"  We construct examples of primitive contractions of Calabi--Yau threefolds
with exceptional locus being $ \mathbb{P}^1 \times \mathbb{P}^1$,
$\mathbb{P}^2$, and smooth del Pezzo surfaces of degrees $\leq 5$. We describe
the images of these primitive contractions and find their smoothing families.
In particular, we give a method to compute the Hodge numbers of a generic fiber
of the smoothing family of each Calabi--Yau threefold with one isolated
singularity obtained after a primitive contraction of type II. As an
application, we get examples of natural conifold transitions between some
families of Calabi--Yau threefolds.
","[{""version"":""v1"",""created"":""Tue, 27 Mar 2007 15:18:20 GMT""},{""version"":""v2"",""created"":""Tue, 17 Jul 2007 12:03:36 GMT""},{""version"":""v3"",""created"":""Thu, 24 Jan 2008 10:36:54 GMT""}]","2008-01-24"
"nlin/0703052","Kenji Kuwabara","Kenji Hiro Kuwabara and Kiyotaka Tanikawa","A new set of variables in the three-body problem","9 pages, 3 figures",,,,"nlin.CD",,"  We propose a set of variables of the general three-body problem both for
two-dimensional and three-dimensional cases. Variables are
$(\lambda,\theta,\Lambda, \Theta,k,\omega)$ or equivalently
$(\lambda,\theta,L,\dot{I},k,\omega)$ for the two-dimensional problem, and
$(\lambda,\theta,L,\dot{I},k,\omega,\phi,\psi)$ for the three-dimensional
problem. Here $(\lambda,\theta)$ and $(\Lambda,\Theta)$ specifies the positions
in the shape spheres in the configuration and momentum spaces, $k$ is the
virial ratio, $L$ is the total angular momentum, $\dot{I}$ is the time
derivative of the moment of inertia, and $\omega,\phi$, and $\psi$ are the
Euler angles to bring the momentum triangle from the nominal position to a
given position. This set of variables defines a {\it shape space} of the
three-body problem. This is also used as an initial condition space. The
initial condition of the so-called free-fall three-body problem is
$(\lambda,\theta,k=0,L=0,\dot{I}=0,\omega=0)$. We show that the hyper-surface
$\dot{I} = 0$ is a global surface of section.
","[{""version"":""v1"",""created"":""Mon, 26 Mar 2007 18:49:06 GMT""}]","2007-05-23"
"nlin/0703053","Horacio Castellini","Horacio Castellini, Lilia Romanelli","On the propagation of social epidemics in social networks under S.I.R.
  model","10 pages",,,,"nlin.AO",,"  The S.I.R. model (Susceptible, Infected, Recovered or Died) was proposed by
chemistry Willam Kermack (1927) and the mathematician G. Mc. Kendrick (1932).
the model supposes to divide to the individuals of a population in three
categories. Susceptible to be infected, Infected and Recovered (immune or died
by the disease). On the other hand has been a similarity in the evolution of
epidemics of infect aerial, the computer science propagation of virus and the
propagation of social paradigms (fashion, rumor, etc.) it calls modernly
``Social Epidemics''. In this work it is tried to use this model in different
types from social networks, real or not. In order to evaluate a meta-analysis
of results allows to investigate under wich conditions the topology of the
network is excellent and that networks are equivalent. The result obtained can
have relevance in study of propagation of epidemics of different types.
","[{""version"":""v1"",""created"":""Mon, 26 Mar 2007 19:13:18 GMT""}]","2007-05-23"
