"cond-mat/0703707","H. H. Wensink","H. H. Wensink","Columnar versus smectic order in systems of charged colloidal rods","14 pages, 6 figures, to appear in J. Chem. Phys","J. Chem. Phys. 126, 194901 (2007)","10.1063/1.2730819",,"cond-mat.soft cond-mat.stat-mech",,"  We study the stability of inhomogeneous liquid crystalline states in systems
of monodisperse, stiff, charged rods. By means of a bifurcation analysis
applied to the Onsager free energy for charged rods in strongly nematic states,
we investigate nematic-smectic and nematic-columnar instabilities as a function
of the Debye screening length. While the nematic-smectic transition clearly
pre-emts the nematic-columnar one in the regime of strong screening a marked
stability of hexagonal columnar order is observed at larger screening lengths.
The theoretical results are substantiated by Brownian dynamics computer
simulation results based on the Yukawa-site model. Our findings connect to
experiments on tobacco mosaic virus rods in particular but might be relevant
for soft rod-like mesogens in strong external directional fields in general.
","[{""version"":""v1"",""created"":""Tue, 27 Mar 2007 14:05:45 GMT""}]","2012-07-17"
"cond-mat/0703708","Masahiro Koike","Masahiro Koike, Yoshiki Kamata, Tsunehiro Ino, Daisuke Hagishima,
  Kosuke Tatsumura, Masato Koyama, and Akira Nishiyama","Diffusion and activation of n-type dopants in germanium","6 pages, 4 figures","J. Appl. Phys. 104, 023523 (2008)","10.1063/1.2958326",,"cond-mat.mtrl-sci","http://arxiv.org/licenses/nonexclusive-distrib/1.0/","  The diffusion and activation of $n$-type impurities (P and As) implanted into
$p$-type Ge(100) substrates were examined under various dose and annealing
conditions. The secondary ion mass spectrometry profiles of chemical
concentrations indicated the existence of a sufficiently high number of
impurities with increasing implanted doses. However, spreading resistance probe
profiles of electrical concentrations showed electrical concentration
saturation in spite of increasing doses and indicated poor activation of As
relative to P in Ge. The relationships between the chemical and electrical
concentrations of P in Ge and Si were calculated, taking into account the
effect of incomplete ionization. The results indicated that the activation of P
was almost the same in Ge and Si. The activation ratios obtained experimentally
were similar to the calculated values, implying insufficient degeneration of
Ge. The profiles of P in Ge substrates with and without damage generated by Ge
ion implantation were compared, and it was clarified that the damage that may
compensate the activated $n$-type dopants has no relationship with the
activation of P in Ge.
","[{""version"":""v1"",""created"":""Tue, 27 Mar 2007 14:24:19 GMT""},{""version"":""v2"",""created"":""Fri, 28 Sep 2007 05:10:42 GMT""},{""version"":""v3"",""created"":""Thu, 31 Jul 2008 14:22:00 GMT""}]","2008-07-31"
"cond-mat/0703709","Pablo A. Ferrari","Fredy Castellares C\'aceres, Pablo A. Ferrari, Eugene Pechersky","A slow-to-start traffic model related to a M/M/1 queue","14 pages, 2 figures","J. Stat. Mech. (2007) P07008","10.1088/1742-5468/2007/07/P07008",,"cond-mat.stat-mech",,"  We consider a system of ordered cars moving in $\R$ from right to left.
  Each car is represented by a point in $\R$; two or more cars can occupy the
same point but cannot overpass. Cars have two possible velocities: either 0 or
1. An unblocked car needs an exponential random time of mean 1 to pass from
speed 0 to speed 1 (\emph{slow-to-start}). Car $i$, say, travels at speed 1
until it (possibly) hits the stopped car $i-1$ to its left. After the departure
of car $i-1$, car $i$ waits an exponential random time to change its speed to
1, travels at this speed until it hits again stopped car $i-1$ and so on.
Initially cars are distributed in $\R$ according to a Poisson process of
parameter $\lambda<1$. We show that every car will be stopped only a finite
number of times and that the final relative car positions is again a Poisson
process with parameter $\lambda$. To do that, we relate the trajectories of the
cars to a $M/M/1$ stationary queue as follows. Space in the traffic model is
time for the queue. The initial positions of the cars coincide with the arrival
process of the queue and the final relative car positions match the departure
process of the queue.
","[{""version"":""v1"",""created"":""Tue, 27 Mar 2007 11:55:19 GMT""},{""version"":""v2"",""created"":""Thu, 31 May 2007 14:28:34 GMT""}]","2007-07-09"
"cond-mat/0703710","Aleksey Rybalko S","A.S.Rybalko, S.P.Rubets, E.Ya.Rudavskii, V.A.Tikhiy, S.I.Tarapov,
  R.V.Golovashchenko, and V.N.Derkach","Resonance Microwave Absorption in He II.","10pages, 8 figures",,"10.1007/s10909-007-9529-0",,"cond-mat.other cond-mat.str-el",,"  Microwave (MW) absorption in liquid 4He is investigated in the frequency
range of 40-200 GHz at T = 1.4 - 2.5 K. Whispering gallery of waves was
generated by a dielectric disc resonator immersed into the liquid. Resonance
absorption of MWs was detected at 180.3 GHz, which corresponds to the roton
minimum of the liquid helium excitation spectrum. The creation of a single
roton is possible because of the presence of the resonator wall which absorbs
an extra momentum. The resonance frequency is shown to decreases with
temperature in an excellent agreement with the temperature dependence of the
roton gap obtained previously in the neutron scattering experiment. The
temperature dependence of the MW absorption data indicates the anomalous
behavior near the lambda-point and displays the hysteretic character.
","[{""version"":""v1"",""created"":""Tue, 27 Mar 2007 11:59:31 GMT""}]","2009-11-13"
"cond-mat/0703711","Xiao-Jie Hao","Tao Tu, Yong-Jie Zhao, Guo-Ping Guo, Xiao-Jie Hao and Guang-Can Guo","Scaling Behavior and Variable Hopping Conductivity in the Quantum Hall
  Plateau Transition","4 pages, 4 figures",,"10.1016/j.physleta.2007.03.059",,"cond-mat.mes-hall cond-mat.str-el",,"  We have measured the temperature dependence of the longitudinal resistivity
$% \rho_{xx}$ of a two-dimensional electron system in the regime of the quantum
Hall plateau transition. We extracted the quantitative form of scaling function
for $\rho_{xx}$ and compared it with the results of ordinary scaling theory and
variable range hopping based theory. We find that the two alternative
theoretically proposed scaling functions are valid in different regions.
","[{""version"":""v1"",""created"":""Tue, 27 Mar 2007 12:22:38 GMT""}]","2009-11-13"
"cond-mat/0703713","Stephan Eule","R. Friedrich, S. Eule and F. Jenko","Langevin Approach to Fractional Diffusion Equations including Inertial
  Effects",,,,,"cond-mat.stat-mech",,"  In recent years, several fractional generalizations of the usual
Kramers-Fokker-Planck equation have been presented. Using an idea of Fogedby
[H.C. Fogedby, Phys. Rev. E {\bf 50}, 041103 (1994), we show how these
equations are related to Langevin equations via the procedure of subordination.
","[{""version"":""v1"",""created"":""Tue, 27 Mar 2007 12:55:19 GMT""}]","2007-05-23"
"cond-mat/0703714","Giovanni Modugno","G. Roati, M. Zaccanti, C. D'Errico, J. Catani, M. Modugno, A. Simoni,
  M. Inguscio, and G. Modugno","39-K Bose-Einstein condensate with tunable interactions","5 pages","Phys. Rev. Lett. 99, 010403 (2007)","10.1103/PhysRevLett.99.010403",,"cond-mat.other physics.atom-ph",,"  We produce a Bose-Einstein condensate of 39-K atoms. Condensation of this
species with naturally small and negative scattering length is achieved by a
combination of sympathetic cooling with 87-Rb and direct evaporation,
exploiting the magnetic tuning of both inter- and intra-species interactions at
Feshbach resonances. We explore tunability of the self-interactions by studying
the expansion and the stability of the condensate. We find that a 39-K
condensate is interesting for future experiments requiring a weakly interacting
Bose gas.
","[{""version"":""v1"",""created"":""Tue, 27 Mar 2007 13:22:51 GMT""}]","2009-11-13"
"cond-mat/0703715","Julian Brown","J.S.Brown","H-H dipole interactions in fcc metals",,,,,"cond-mat.mes-hall",,"  It is observed that interstitial hydrogen nucleii on a metallic lattice are
strongly coupled to their near neighbours by the unscreened electromagnetic
field mediating transitions between low-lying states. It is shown that the
dominant interaction is of dipole-dipole character. By means of numerical
calculations based upon published data, it is then shown that in stoichiometric
PdD, in which essentially all interstitial sites are occupied by a deuteron,
certain specific superpositions of many-site product states exist that are
lower in energy than the single-site ground state, suggesting the existence of
a new low temperature phase. Finally, the modified behaviour of the
two-particle wavefunction at small separations is investigated and prelimary
results suggesting a radical narrowing of the effective Coulomb barrier are
presented.
","[{""version"":""v1"",""created"":""Tue, 27 Mar 2007 14:47:21 GMT""},{""version"":""v2"",""created"":""Wed, 28 Mar 2007 14:10:59 GMT""},{""version"":""v3"",""created"":""Fri, 30 Mar 2007 06:14:27 GMT""},{""version"":""v4"",""created"":""Thu, 12 Apr 2007 19:46:39 GMT""}]","2007-05-23"
"cond-mat/0703716","Alberto Girlando","Paolo Ranzieri, Matteo Masino, Alberto Girlando, and Marie-Helene
  Lemee-Cailleau","DMTTF-CA revisited: temperature-induced valence and structural
  instability","8 pages, 6 figures, Phys. Rev. B format","Phys. Rev. B 76, 134115 (2007)","10.1103/PhysRevB.76.134115",,"cond-mat.mtrl-sci cond-mat.str-el",,"  We report a detailed spectroscopic investigation of temperature-induced
valence and structural instability of the mixed-stack organic charge-transfer
(CT) crystal 4,4'-dimethyltetrathiafulvalene-chloranil (DMTTF-CA). DMTTF-CA is
a derivative of tetrathiafulvalene-chloranil (TTF-CA), the first CT crystal
exhibiting the neutral-ionic transition by lowering temperature. We confirm
that DMTTF-CA undergoes a continuous variation of the ionicity on going from
room temperature down to $\sim$ 20 K, but remains on the neutral side
throughout. The stack dimerization and cell doubling, occurring at 65 K, appear
to be the driving forces of the transition and of the valence instability. In a
small temperature interval just below the phase transition we detect the
coexistence of molecular species with slightly different ionicities. The
Peierls mode(s) precursors of the stack dimerization are identified.
","[{""version"":""v1"",""created"":""Tue, 27 Mar 2007 15:01:49 GMT""}]","2021-11-23"
"cond-mat/0703718","Robert Willett","R.L. Willett, L.N. Pfeiffer, K.W. West","Simple-layered high mobility field effect heterostructured
  two-dimensional electron device",,"Applied Physics Letters 89, 242107 (2006)",,,"cond-mat.mes-hall cond-mat.mtrl-sci",,"  We present a two-dimensional electron heterostructure field effect device of
simplistic design and ease of fabrication that displays high mobility electron
transport. This is accomplished using a high efficacy contacting scheme and
simple metallic overlapping gate, obviating dopant layers. The resultant
devices demonstrate adjustable electron densities and mobilities larger than
8x106 cm2/V-sec at the highest densities of 2.4x1011/cm2. This device type
provides an experimental avenue for studying electron correlations and may
answer demands for routine fabrication of practical HEMTs.
","[{""version"":""v1"",""created"":""Tue, 27 Mar 2007 15:31:24 GMT""}]","2007-05-23"
"cond-mat/0703719","Robert Willett","R.L. Willett, M.J. Manfra, L.N. Pfeiffer, K.W. West","Mesoscopic structures and 2D hole systems in fully field effect
  controlled heterostructures",,,"10.1063/1.2757128",,"cond-mat.mes-hall cond-mat.mtrl-sci",,"  Two fundamental extensions to the function of previously described fully
field effect two-dimensional (2D) electron heterostructures are presented:
First, using the same basic heterostructure design of lithographically defined
contacts overlain by both an insulating layer and top-gate employed for
electron systems, appropriate contact material allows a high mobility 2D hole
layer to be populated. Second, a simple method for producing mesoscopic
structures in these devices is presented in which small-scale metallic patterns
are placed on the heterostructure under the insulating and global gate layers
which allows local carrier density tuning via the overlapping gate arrays.
Example devices using these generally applicable methods are demonstrated.
","[{""version"":""v1"",""created"":""Tue, 27 Mar 2007 15:41:04 GMT""}]","2009-11-13"
"cs/0703132","Leonid Peshkin","Leonid Peshkin","Structure induction by lossless graph compression","10 pages, 7 figures, 2 tables published in Proceedings of the Data
  Compression Conference, 2007","In proceedings of the Data Compression Conference, 2007, pp 53-62,
  published by the IEEE Computer Society Press","10.1109/DCC.2007.73",,"cs.DS cs.IT cs.LG math.IT",,"  This work is motivated by the necessity to automate the discovery of
structure in vast and evergrowing collection of relational data commonly
represented as graphs, for example genomic networks. A novel algorithm, dubbed
Graphitour, for structure induction by lossless graph compression is presented
and illustrated by a clear and broadly known case of nested structure in a DNA
molecule. This work extends to graphs some well established approaches to
grammatical inference previously applied only to strings. The bottom-up graph
compression problem is related to the maximum cardinality (non-bipartite)
maximum cardinality matching problem. The algorithm accepts a variety of graph
types including directed graphs and graphs with labeled nodes and arcs. The
resulting structure could be used for representation and classification of
graphs.
","[{""version"":""v1"",""created"":""Tue, 27 Mar 2007 05:46:31 GMT""}]","2017-05-25"
"gr-qc/0703126","Timothy Clifton","Timothy Clifton","Exact Friedmann Solutions in Higher-Order Gravity Theories","24 pages, 6 figures","Class.Quant.Grav.24:5073-5091,2007","10.1088/0264-9381/24/20/010",,"gr-qc astro-ph hep-th",,"  We find the general behaviour of homogeneous and isotropic cosmological
models in some fourth-order theories of gravity. Explicit, exact, general
solutions are given for both empty universes and those filled with a perfect
fluid. For the vacuum case, solutions are found with closed, open and flat
geometries, whilst the perfect fluid solutions are all spatially flat. Both
early and late-time limits are studied, and attractor behaviour towards simple
power-law expansion is identified. Multiple solutions to the same theories,
with the same matter content and topology are found. It is shown that these
solutions exhibit great variety in their evolution.
","[{""version"":""v1"",""created"":""Mon, 26 Mar 2007 19:46:30 GMT""},{""version"":""v2"",""created"":""Fri, 24 Aug 2007 20:01:46 GMT""}]","2010-10-27"
"gr-qc/0703127","Hirotaka Yoshino","Hirotaka Yoshino, Andrei Zelnikov, Valeri P. Frolov","Apparent horizon formation in the head-on collision of gyratons","44 pages, 21 figures, published version","Phys.Rev.D75:124005,2007","10.1103/PhysRevD.75.124005","Alberta-Thy-01-07","gr-qc hep-ph hep-th",,"  The gyraton model describes a gravitational field of an object moving with
the velocity of light which has finite energy and spin distributed during some
finite time interval $L$. A gyraton may be considered as a classical toy model
for a quantum wave packet of high-energy particles with spin. In this paper we
study a head-on collision of two gyratons and black hole formation in this
process. The goal of this study is to understand the role of the gravitational
spin-spin interaction in the process of mini-black-hole formation in particle
collisions. To simplify the problem we consider several gyraton models with
special profiles of the energy and spin density distribution. For these models
we study the apparent horizon (AH) formation on the future edge of a spacetime
region before interaction. We demonstrate that the AH forms only if the energy
duration and the spin are smaller than some critical values, while the length
of the spin distribution should be at least of the order of the system
gravitational radius. We also study gravitational spin-spin interaction in the
head-on collision of two gyratons under the assumption that the values of
gyraton spins are small. We demonstrate that the metric in the interaction
region for such gyratons depends on the relative helicities of incoming
gyratons, and the collision of gyratons with oppositely directed spins allows
the AH formation in a larger parameter region than in the collision of the
gyratons with the same direction of spins. Some applications of the obtained
results to the mini-black-hole production at the Large Hadron Collider in TeV
gravity scenarios are briefly discussed.
","[{""version"":""v1"",""created"":""Mon, 26 Mar 2007 20:37:41 GMT""},{""version"":""v2"",""created"":""Fri, 27 Apr 2007 04:35:26 GMT""},{""version"":""v3"",""created"":""Tue, 5 Jun 2007 21:12:04 GMT""}]","2008-11-26"
"gr-qc/0703128","Ettore Minguzzi","E. Minguzzi","The causal ladder and the strength of K-causality. II","27 pages, 2 figures, uses Latex package ""psfrag"". v3: Old title: ``On
  the relationship between stable causality and K-causality''. v4: fixed a
  small problem with lemma 5.5","Class.Quant.Grav.25:015010,2008","10.1088/0264-9381/25/1/015010",,"gr-qc",,"  Hawking's stable causality implies Sorkin and Woolgar's K-causality. The work
investigates the possible equivalence between the two causality requirements,
an issue which was first considered by H. Seifert and then raised again by R.
Low after the introduction of K-causality. First, a new proof is given that a
spacetime is stably causal iff the Seifert causal relation is a partial order.
It is then shown that given a K-causal spacetime and chosen an event, the light
cones can be widened in a neighborhood of the event without spoiling
K-causality. The idea is that this widening of the light cones can be continued
leading to a global one. Unfortunately, due to some difficulties in the
inductive process the author was not able to complete the program for a proof
as originally conceived by H. Seifert. Nevertheless, it is proved that if
K-causality coincides with stable causality then in any K-causal spacetime the
K future coincides with the Seifert future. Explicit examples are provided
which show that the K^+ future may differ from the Seifert relation in causal
spacetimes.
","[{""version"":""v1"",""created"":""Mon, 26 Mar 2007 20:40:08 GMT""},{""version"":""v2"",""created"":""Wed, 22 Aug 2007 15:29:06 GMT""},{""version"":""v3"",""created"":""Tue, 20 Nov 2007 12:54:56 GMT""},{""version"":""v4"",""created"":""Thu, 29 Nov 2007 14:34:37 GMT""}]","2008-11-26"
"gr-qc/0703129","Luisa T. Buchman","Luisa T. Buchman and Olivier C. A. Sarbach","Improved outer boundary conditions for Einstein's field equations","accepted Class. Quant. Grav. numerical relativity special issue; 17
  pages and 1 figure","Class.Quant.Grav.24:S307-S326,2007","10.1088/0264-9381/24/12/S20",,"gr-qc",,"  In a recent article, we constructed a hierarchy B_L of outer boundary
conditions for Einstein's field equations with the property that, for a
spherical outer boundary, it is perfectly absorbing for linearized
gravitational radiation up to a given angular momentum number L. In this
article, we generalize B_2 so that it can be applied to fairly general
foliations of spacetime by space-like hypersurfaces and general outer boundary
shapes and further, we improve B_2 in two steps: (i) we give a local boundary
condition C_2 which is perfectly absorbing including first order contributions
in 2M/R of curvature corrections for quadrupolar waves (where M is the mass of
the spacetime and R is a typical radius of the outer boundary) and which
significantly reduces spurious reflections due to backscatter, and (ii) we give
a non-local boundary condition D_2 which is exact when first order corrections
in 2M/R for both curvature and backscatter are considered, for quadrupolar
radiation.
","[{""version"":""v1"",""created"":""Mon, 26 Mar 2007 23:10:22 GMT""},{""version"":""v2"",""created"":""Mon, 30 Apr 2007 00:13:10 GMT""}]","2008-11-26"
"gr-qc/0703130","Yuan  K. Ha","Yuan K. Ha","A new theorem for black holes","Contribution to the XXVI International Colloquium on Group
  Theoretical Methods in Physics, New York, June 26-30, 2006","Proceedings of the XXVI International Colloquium on Group
  Theoretical Methods in Physics (Group 26), held in New York, USA, 26-30 June
  2006, page 258 - 264 (Canopus Publishing Limited 2009)",,,"gr-qc astro-ph hep-th",,"  A new theorem for black holes is established. The mass of a black hole
depends on where the observer is. The horizon mass theorem states that for all
black holes: neutral, charged or rotating, the horizon mass is always twice the
irreducible mass observed at infinity. The horizon mass theorem is crucial for
understanding the occurrence of Hawking radiation. Without black hole
radiation, the Second Law of Thermodynamics is lost.
","[{""version"":""v1"",""created"":""Mon, 26 Mar 2007 22:21:23 GMT""}]","2011-01-18"
"gr-qc/0703132","Enrico Barausse","Enrico Barausse, Thomas P. Sotiriou, John C. Miller","A no-go theorem for polytropic spheres in Palatini f(R) gravity","7 pages, 1 figure. Version accepted for publication as a Fast Track
  Communication in CQG","Class.Quant.Grav.25:062001,2008","10.1088/0264-9381/25/6/062001",,"gr-qc astro-ph hep-th",,"  Non-vacuum static spherically-symmetric solutions in Palatini f(R) gravity
are examined. It is shown that for generic choices of f(R), there are
commonly-used equations of state for which no satisfactory physical solution of
the field equations can be found within this framework, apart from in the
special case of General Relativity, casting doubt on whether Palatini f(R)
gravity can be considered as giving viable alternatives to General Relativity.
","[{""version"":""v1"",""created"":""Tue, 27 Mar 2007 14:19:56 GMT""},{""version"":""v2"",""created"":""Thu, 31 Jan 2008 11:38:12 GMT""}]","2008-09-29"
"gr-qc/0703133","Mikhail Iofa","Mikhail Z. Iofa","A note on cosmology in a brane model","10 pages LaTex",,,,"gr-qc astro-ph",,"  We study some aspects of cosmology in a five-dimensional model with matter,
radiation and cosmological constant on the four-dimensional brane(s) and
without matter in the bulk. The action of the model does not contain explicit
curvature terms on the the brane(s). We obtain solution of the generalized
Friedman equation as a function of dimensionless ratio of the scales $b^2 =
\frac{\mu M^2_{pl}}{M^3}$ ($\mu$ is the scale in the warp factor in the 5D
metric which is taken of order $10^{3\div 4}GeV$, $M\geq\mu$ is the $5D$
fundamental scale). We assume that there is a hierarchy between 4D and 5D
scales. For $b^2 =O(1)$ the age of the Universe is found comparable, but below
the current experimental value, for $b^2\gg 1$ it is obtained much smaller than
the experimental bound. Because time dependence of temperature of the Universe
in the 5D model is different from that in the standard cosmology, the abundance
of ${}^4$He produced in the primordial nucleosynthesis is obtained about three
times more than in the standard cosmology.
","[{""version"":""v1"",""created"":""Tue, 27 Mar 2007 14:36:31 GMT""}]","2007-05-23"
"hep-ex/0703038","James G. Smith","The BABAR Collaboration, B. Aubert, et al","Search for Neutral B-Meson Decays to a0pi, a0K, etarho0, and etaf0","8 pages, 3 postscript figues, submitted to PRD RC R","Phys.Rev.D75:111102,2007","10.1103/PhysRevD.75.111102","BABAR-PUB-07/020, SLAC-PUB-12413","hep-ex",,"  We present a search for B0 decays to charmless final states involving an eta
meson, a charged pion and a second charged pion or kaon. The data sample
corresponds to 383x10^6 BBbar pairs collected with the BABAR detector operating
at the PEP-II asymmetric-energy B Factory at SLAC. We find no significant
signals and determine the following 90% C.L. upper limits: BR(B->a0-pi+) x
BR(a0- -> etapi-) < 3.1x10^-6, BR(B->a0-K+) x BR(a0- -> etapi-) < 1.9x10^-6,
BR(B->a0(1450)-pi+) x BR(a0(1450)- -> etapi-) < 2.3x10^-6, BR(B->a0(1450)-K+) x
BR(a0(1450)- -> etapi-) < 3.1x10^-6, BR(B->etarho0) < 1.5x10^-6, and BR(B->eta
f0(980)) x BR(f0(980)- -> pi+pi-) < 0.4x10^-6.
","[{""version"":""v1"",""created"":""Mon, 26 Mar 2007 17:24:20 GMT""}]","2010-04-12"
"hep-ex/0703039","Hirokazu Ishino","H. Ishino, M. Hazumi, M. Nakao, and T. Yoshikawa","New Measurements Using External Photon Conversion at a High Luminosity B
  Factory","4 pages, 2 figures",,,,"hep-ex hep-ph",,"  We propose two novel methods for testing the standard model using external
photon conversion at a high-luminosity e^+e^- B factory proposed recently. The
first method is to measure the mixing-induced CP-violation parameter
S_{pi^0pi^0} in B^0 --> pi^0 pi^0 decays. The precision of S_{pi^0pi^0} is
estimated to be 0.23 from a Monte Carlo study for a data sample containing 50 x
10^9 BBbar pairs. We demonstrate that this measurement is crucial for reducing
the discrete ambiguity of the Cabibbo-Kobayashi-Maskawa angle phi_2 determined
from the isospin analysis with B --> pi pi decays. The second method is to
measure photon polarization in B^0 --> K^{*0}(--> K^+ pi^-) gamma decays using
the external photon conversion, and combine it with S_{K^{*}gamma} from B^0 -->
K^{*0}(--> K^0_S pi^0) gamma decays. This offers a promising way of determining
the hypothetical right-handed current amplitude and phase beyond the standard
model.
","[{""version"":""v1"",""created"":""Tue, 27 Mar 2007 03:36:13 GMT""}]","2007-05-23"
