"0711.0278","Giuseppe Bimonte","G. Bimonte","The thermal Casimir effect for rough metallic plates","4 pages, 2 encapsulated figures",,,"DSF/37/2007","quant-ph",,"  We propose a new theory of thermal Casimir effect, holding for the
experimentally important case of metallic surfaces with a roughness having a
spatial scale smaller than the skin depth. The theory is based on a simple
phenomenological model for a rough conductor, that explicitly takes account of
the fact that ohmic conduction in the immediate vicinity of the surface of a
conductor is much impeded by surface roughness, if the amplitude of roughness
is smaller than the skin depth. As a result of the new model, we find that
surface roughness strongly influences the magnitude of the thermal correction
to the Casimir force, independently of the plates separation. Our model, while
consistent with recent accurate measurements of the Casimir force in the
submicron range, leads to a new prediction for the not yet observed thermal
correction to the Casimir force at large plates separation. Besides the thermal
Casimir problem, our model is relevant for the correct theoretical
interpretation of current experiments probing other proximity effects between
conductors, like radiative heat transfer and quantum friction.
","[{""version"":""v1"",""created"":""Fri, 2 Nov 2007 10:27:45 GMT""},{""version"":""v2"",""created"":""Sun, 4 Nov 2007 17:54:32 GMT""}]","2007-11-05"
"0711.0279","Md Nurujjaman","Ramesh Narayanan, Md. Nurujjaman and A.N. Sekar Iyengar","Stochastic behaviour in the edge region of the SINP tokamak","Submitted to Nuclear Fusion",,,,"physics.plasm-ph physics.data-an",,"  Stochasticity is one of the most extensively researched topics in laboratory
and space plasmas since it has been successful in explaining the various
anomalous processes like transport, particle heating, particle loss etc. Since
there is a growing need for better understanding of this nonlinear process, it
has led to the development of new and more advanced data analysis techniques.
In this paper we present an analysis of the floating potential fluctuations
which show the existence of a stochastic multifractal process along with low
dimensional chaos. This has been shown primarily by wavelet analysis, and cross
checked using other nonlinear techniques.
","[{""version"":""v1"",""created"":""Fri, 2 Nov 2007 10:30:10 GMT""},{""version"":""v2"",""created"":""Tue, 27 Nov 2007 04:32:49 GMT""}]","2007-11-27"
"0711.0280","Frantisek Maca","Frantisek Maca, Josef Kudrnovsky, Vaclav Drchal, and Georges Bouzerar","Magnetism without magnetic impurities in oxides ZrO2 and TiO2","7 pages, 5 figures, submitted","Phil. Mag. 88 (2008) 2755-2764","10.1063/1.2936858",,"cond-mat.mtrl-sci",,"  We perform a theoretical study of the magnetism induced in transition metal
dioxides ZrO2 and TiO2 by substitution of the cation by a vacancy or an
impurity from the groups 1A or 2A of the periodic table, where the impurity is
either K or Ca. In the present study both supercell and embedded cluster
methods are used. It is demonstrated that the vacancy and the K-impurity leads
to a robust induced magnetic moment on the surrounding O-atoms for both the
cubic ZrO2 and rutile TiO2 host crystals. On the other hand it is shown that
Ca-impurity leads to a non magnetic state. The native O-vacancy does not induce
a magnetic moment in the host dioxide crystal.
","[{""version"":""v1"",""created"":""Fri, 2 Nov 2007 10:30:53 GMT""}]","2013-06-27"
"0711.0281","Christer Sandin","Christer Sandin (Astrophysikalisches Institut Potsdam, Potsdam,
  Germany)","Three-component modeling of C-rich AGB star winds IV. Revised
  interpretation with improved numerical descriptions","17 pages, 5 figures, 4 tables, MNRAS (in press)","Mon. Not. R. Astron. Soc. 385 (2008) 215-230","10.1111/j.1365-2966.2007.12644.x",,"astro-ph",,"  Models describing dust-driven winds are important for understanding the
physical mechanism and properties of mass loss on the asymptotic giant branch.
These models are becoming increasingly realistic with more detailed physics
included, but also more computationally demanding. The purpose of this study is
to clarify to what extent the applied numerical approach affects resulting
physical structures of modelled winds, and to discuss resulting changes.
Following the previously developed radiation hydrodynamic model - which
includes descriptions for time-dependent dust formation and gas-dust drift -
and using its physical assumptions and parameters, numerical improvements are
introduced. Impacts of the so-called adaptive grid equation and advection
schemes are assessed from models calculated with different numerical setups.
Results show that wind models are strongly influenced by numerical imprecision,
displaying differences in calculated physical properties of up to one hundred
per cent. Using a non-adaptive grid, models become periodic (in multiples of
stellar pulsation periods), instead of irregular, as obtained previously.
Furthermore, the numerical improvements reveal changes in physical structures.
The influence of gas-dust drift is confirmed to be highly important, in
particular for the dust component. Gas and dust are less tightly coupled than
previously, and drastically larger amounts of dust form assuming drift.
","[{""version"":""v1"",""created"":""Fri, 2 Nov 2007 15:39:08 GMT""}]","2008-03-18"
"0711.0282","Guodong Liu","Guodong Liu, Guiling Wang, Yong Zhu, Hongbo Zhang, Guochun Zhang,
  Xiaoyang Wang, Yong Zhou, Wentao Zhang, Haiyun Liu, Lin Zhao, Jianqiao Meng,
  Xiaoli Dong, Chuangtian Chen, Zuyan XU and X. J. Zhou","Development of a Vacuum Ultra-Violet Laser-Based Angle-Resolved
  Photoemission System with a Super-High Energy Resolution Better Than 1 meV","29 pages, 10 figures, submitted to Review of Scientific Instruments","REVIEW OF SCIENTIFIC INSTRUMENTS 79, 023105 (2008)","10.1063/1.2835901",,"cond-mat.supr-con cond-mat.str-el",,"  The design and performance of the first vacuum ultra-violet (VUV) laser-based
angle-resolved photoemission (ARPES) system are described. The VUV laser with a
photon energy of 6.994 eV and bandwidth of 0.26 meV is achieved from the second
harmonic generation using a novel non-linear optical crystal KBe2BO3F2 (KBBF).
The new VUV laser-based ARPES system exhibits superior performance, including
super-high energy resolution better than 1 meV, high momentum resolution,
super-high photon flux and much enhanced bulk sensitivity, which are
demonstrated from measurements on a typical Bi2Sr2CaCu2O8 high temperature
superconductor. Issues and further development related to the VUV laser-based
photoemission technique are discussed.
","[{""version"":""v1"",""created"":""Fri, 2 Nov 2007 10:56:30 GMT""}]","2008-03-08"
"0711.0283","Takahiro Harada","Takahiro Harada, Akihiro Isomura, Kenichi Yoshikawa","Contraction-induced cluster formation in cardiac cell culture","12 pages, 12 figures",,"10.1016/j.physd.2008.04.013",,"q-bio.CB nlin.PS",,"  Evolution of the spatial arrangement of cells in a primary culture of cardiac
tissue derived from newborn rats was studied experimentally over extended
period. It was found that cells attract each other spontaneously to form a
clustered structure over the timescale of several days. These clusters exhibit
spontaneous rhythmic contraction and have been confirmed to consist of cardiac
muscle cells. Addition of a contraction inhibitor (2,3-butanedione-2-monoxime)
to the culture medium resulted in the inhibition of both the spontaneous
contractions exhibited by the cells as well as the formation of clusters.
Furthermore, the formation of clusters is suppressed when high concentrations
of collagen are used for coating the substratum to which the cells adhere. From
these experimental observations, it was deduced that the cells are mechanically
stressed by the tension associated with repeated contractions and that this
results in the cells becoming compact and attracting each other, finally
resulting in the formation of clusters. This process can be interpreted as
modulation of a cellular network by the activity associated with contraction,
which could be employed to control cellular networks by modifying the dynamics
associated with the contractions in cardiac tissue culture.
","[{""version"":""v1"",""created"":""Fri, 2 Nov 2007 11:12:17 GMT""},{""version"":""v2"",""created"":""Mon, 18 Feb 2008 02:32:15 GMT""}]","2009-11-13"
"0711.0284","Hagen Neidhardt Dr","Hagen Neidhardt, Valentin A. Zagrebnov","Linear non-autonomous Cauchy problems and evolution semigroups",,,,,"math-ph math.MP",,"  The paper is devoted to the problem of existence of propagators for an
abstract linear non-autonomous evolution Cauchy problem of hyperbolic type in
separable Banach spaces. The problem is solved using the so-called evolution
semigroup approach which reduces the existence problem for propagators to a
perturbation problem of semigroup generators. The results are specified to
abstract linear non-autonomous evolution equations in Hilbert spaces where the
assumption is made that the domains of the quadratic forms associated with the
generators are independent of time. Finally, these results are applied to
time-dependent Schr\""odinger operators with moving point interactions in 1D.
","[{""version"":""v1"",""created"":""Fri, 2 Nov 2007 11:12:34 GMT""}]","2007-11-05"
"0711.0285","Edward Anderson","Edward Anderson","Does relationalism alone control geometrodynamics with sources?","18 pages and 1 figure",,,,"gr-qc",,"  This paper concerns relational first principles from which the Dirac
procedure exhaustively picks out the geometrodynamics corresponding to general
relativity as one of a handful of consistent theories. This was accompanied by
a number of results and conjectures about matter theories and general features
of physics -- such as gauge theory, the universal light cone principle of
special relativity and the equivalence principle -- being likewise picked out.
I have previously shown that many of these matter results and conjectures are
contingent on further unrelational simplicity assumptions. In this paper, I
point out 1) that the exhaustive procedure in these cases with matter fields is
slower than it was previously held to be. 2) While the example of equivalence
principle violating matter theory that I previously showed how to accommodate
on relational premises has a number of pathological features, in this paper I
point out that there is another closely related equivalence principle violating
theory that also follows from those premises and is less pathological. This
example being known as an `Einstein--aether theory', it also serves for 3)
illustrating limitations on the conjectured emergence of the universal light
cone special relativity principle.
","[{""version"":""v1"",""created"":""Fri, 2 Nov 2007 11:27:50 GMT""}]","2007-11-05"
"0711.0286","Yuji Kajiyama","Yuji Kajiyama","Lepton Flavor Violating tau decay by R-Parity Violation in a Family
  Symmetry","3 pages. Talk given at Summer Institute 2007, Aug. 3-10, 2007,
  Fuji-Yoshida, Japan",,,,"hep-ph",,"  In this talk, we investigate Lepton Flavor Violating (LFV) tau decay by
R-Parity Violating (RPV) operators controlled by a non-Abelian discrete $Q_6$
family symmetry. We assume that only a family symmetry determines the whole
flavor structure of a model, and the model indicates specific predictions of
LFV tau decay processes by RPV operators. We predict $BR(\tau \to 3e)/BR(\tau
\to 3 \mu) \sim 4 m_{\mu}^2/m_{\tau}^2$ in a $Q_6$ family symmetric model.
","[{""version"":""v1"",""created"":""Fri, 2 Nov 2007 11:17:25 GMT""}]","2007-11-05"
"0711.0287","Andrew Lewis","Andrew E.M. Lewis","\Pi^0_1 classes, strong minimal covers and hyperimmune-free degrees","Bulletin of the London Mathematical Society (to appear in Dec 07
  issue online)",,,,"math.LO",,"  We investigate issues surrounding an old question of Yates' as to the
existence of a minimal Turing degree with no strong minimal cover, specifically
with respect to the hyperimmune-free degrees.
","[{""version"":""v1"",""created"":""Fri, 2 Nov 2007 11:18:41 GMT""}]","2007-11-05"
"0711.0288","Edward Anderson","Edward Anderson","New interpretation of variational principles for gauge theories. I.
  Cyclic coordinate alternative to ADM split","11 pages","Class.Quant.Grav.25:175011,2008","10.1088/0264-9381/25/17/175011",,"gr-qc",,"  I show how there is an ambiguity in how one treats auxiliary variables in
gauge theories including general relativity cast as 3 + 1 geometrodynamics.
Auxiliary variables may be treated pre-variationally as multiplier coordinates
or as the velocities corresponding to cyclic coordinates. The latter treatment
works through the physical meaninglessness of auxiliary variables' values
applying also to the end points (or end spatial hypersurfaces) of the
variation, so that these are free rather than fixed. [This is also known as
variation with natural boundary conditions.] Further principles of dynamics
workings such as Routhian reduction and the Dirac procedure are shown to have
parallel counterparts for this new formalism. One advantage of the new scheme
is that the corresponding actions are more manifestly relational. While the
electric potential is usually regarded as a multiplier coordinate and Arnowitt,
Deser and Misner have regarded the lapse and shift likewise, this paper's
scheme considers new {\it flux}, {\it instant} and {\it grid} variables whose
corresponding velocities are, respectively, the abovementioned previously used
variables. This paper's way of thinking about gauge theory furthermore admits
interesting generalizations, which shall be provided in a second paper.
","[{""version"":""v1"",""created"":""Fri, 2 Nov 2007 11:30:05 GMT""}]","2008-11-26"
"0711.0289","Viktor Eisler Dr.","V. Eisler, D. Karevski, T. Platini, I. Peschel","Entanglement evolution after connecting finite to infinite quantum
  chains","15 pages, 11 figures","J. Stat. Mech. (2008) P01023","10.1088/1742-5468/2008/01/P01023",,"cond-mat.stat-mech",,"  We study zero-temperature XX chains and transverse Ising chains and join an
initially separate finite piece on one or on both sides to an infinite
remainder. In both critical and non-critical systems we find a typical increase
of the entanglement entropy after the quench, followed by a slow decay towards
the value of the homogeneous chain. In the critical case, the predictions of
conformal field theory are verified for the first phase of the evolution, while
at late times a step structure can be observed.
","[{""version"":""v1"",""created"":""Fri, 2 Nov 2007 11:22:45 GMT""}]","2009-11-13"
"0711.0290","Felix Richter","M. Seemann, F. Kieseling, H. Stolz, M. Florian, G. Manzke, K.
  Henneberger, D. Hommel","Absorption and emission of polariton modes in a ZnSe-ZnSSe
  heterostructure","5 pages, 2 figures, RevTex4, changes: as published","Phys. stat. sol. B 245, 1093 (2008)","10.1002/pssb.200777627",,"cond-mat.str-el",,"  We investigate the absorption and emission of a 25 nm ZnSe layer, which was
grown on a GaAs buffer and cladded by ZnSSe layers. Due to the coupling of
light with the exciton resonances, polariton modes propagate through the ZnSe
layer. Their interferences appear as additional peaks in the reflection spectra
and can be explained by the effect of spatial dispersion. We present additional
experimental results for the emission of the sample after excitation by a pump
pulse, showing corresponding interference peaks of the polariton modes, whose
maxima strongly decrease to higher energies. Our exact theoretical analysis
shows that the ratio of emission and absorption is given by the population of
the globally defined states of the electromagnetic field, i.e. the polariton
distribution which is generated by the pump pulse. This distribution, being far
from thermal quasiequilibrium, shows pronounced peaks at the polariton modes
depending on the energy of the pump pulse.
","[{""version"":""v1"",""created"":""Fri, 2 Nov 2007 12:47:09 GMT""},{""version"":""v2"",""created"":""Mon, 2 Jun 2008 07:39:09 GMT""}]","2008-06-02"
"0711.0291","Andreas Freise","A. Freise, A. Bunkowski and R. Schnabel","Phase and alignment noise in grating interferometers","16 pages, 6 figures","New J.Phys.9:433,2007","10.1088/1367-2630/9/12/433",,"gr-qc",,"  Diffraction gratings have been proposed as core optical elements in future
laser-interferometric gravitational-wave detectors. In this paper we derive
equations for the coupling between alignment noise and phase noise at
diffraction gratings. In comparison to a standard reflective component (mirror
or beam splitter) the diffractive nature of the gratings causes an additional
coupling of geometry changes into alignment and phase noise. Expressions for
the change in angle and optical path length of each outgoing beam are provided
as functions of a translation or rotation of the incoming beam with respect to
the grating. The analysis is based entirely on the grating equation and the
geometry of the setup. We further analyse exemplary optical setups which have
been proposed for the use in future gravitational wave detectors. We find that
the use of diffraction gratings yields a strong coupling of alignment noise
into phase noise. By comparing the results with the specifications of current
detectors we show that this additional noise coupling results in new,
challenging requirements for the suspension and isolation systems for the
optical components.
","[{""version"":""v1"",""created"":""Fri, 2 Nov 2007 11:38:35 GMT""}]","2009-12-10"
"0711.0292","Govindaraj Ramanujam","R. Govindaraj and R. Sielemann","Attractive interaction of Indium with point defects and silicon in GeSi","7 pages and 4 figures",,,,"cond-mat.mtrl-sci",,"  In electron irradiated Ge$_{0.98}$Si$_{0.02}$, In-vacancy and In-interstitial
complexes were observed in analogy with defects in pure Ge. Isochronal
annealing measurements reveal that the temperature of dissociation of In-defect
complexes deviate from pure Ge subjected to identical e-irradiation, which is
explained on the basis of strain induced by undersized silicon atoms affecting
the binding energy of In-V and In-I complexes. Besides the pairing with
intrinsic defects the interaction of In with Si atoms is observed resulting in
several different configurations. Complementary experiments performed in
Ge$_{0.98}$Si$_{0.02}$ and Ge$_{0.94}$Si$_{0.06}$ elucidate the attractive
interaction between In and Si.
","[{""version"":""v1"",""created"":""Fri, 2 Nov 2007 11:39:23 GMT""}]","2009-09-29"
"0711.0293","Daniel Arteaga","Daniel Arteaga","Quantum Brownian representation for the quantum field modes","25 pages, 1 figure. Motivations emphasized, new application, overall
  clarity improved. Version accepted for publication in AHEP","Adv.High Energy Phys.2009:278759,2009","10.1155/2009/278759",,"quant-ph hep-ph","http://arxiv.org/licenses/nonexclusive-distrib/1.0/","  When analyzing the particle-like excitations in quantum field theory it is
natural to regard the field mode corresponding to the particle momentum as an
open quantum system, together with the opposite momentum mode. Provided that
the state of the field is stationary, homogeneous and isotropic, this scalar
two-mode system can be equivalently represented in terms of a pair of quantum
Brownian oscillators under a Gaussian approximation. In other words, the
two-mode system behaves as if it were interacting linearly with some effective
environment. In this paper we build the details of the effective linear
coupling and the effective environment, and argue that this quantum Brownian
representation provides a simple, universal and non-perturbative
characterization of any single particle-like excitation. As immediate
applications of the equivalence, we reanalyse the interpretation of the
self-energy in terms of decay rates in a general background state, and present
the master equation for the field mode corresponding to the particle momentum.
","[{""version"":""v1"",""created"":""Fri, 2 Nov 2007 13:44:30 GMT""},{""version"":""v2"",""created"":""Tue, 26 May 2009 11:38:59 GMT""}]","2009-12-17"
"0711.0294","Roman G. Mints","Maayan Moshe, C. W. Schneider, G. Bensky, and R. G. Mints","Maximum supercurrent in Josephson junctions with alternating critical
  current density","11 pages, 8 figures","Phys. Rev. B 76, (2007)","10.1103/PhysRevB.76.174518",,"cond-mat.supr-con",,"  We consider theoretically and numerically magnetic field dependencies of the
maximum supercurrent across Josephson tunnel junctions with spatially
alternating critical current density. We find that two flux-penetration fields
and one-splinter-vortex equilibrium state exist in long junctions.
","[{""version"":""v1"",""created"":""Fri, 2 Nov 2007 12:09:57 GMT""}]","2009-11-13"
"0711.0295","Zaza Osmanov","Z. Osmanov, D. Shapakidze and G. Machabeli","Dynamical feedback of the curvature drift instability on its saturation
  process","6 pages, 5 figures",,"10.1051/0004-6361/200912113",,"astro-ph","http://arxiv.org/licenses/nonexclusive-distrib/1.0/","  We investigate the reconstruction of pulsar magnetospheres close to the light
cylinder surface to study the curvature drift instability (CDI) responsible for
the twisting of magnetic field lines in the mentioned zone. The influence of
plasma dynamics on the saturation process of the CDI is studied. On the basis
of the Euler, continuity, and induction equations, we derive the increment of
the CDI and analyze parametrically excited drift modes. The dynamics of the
reconstruction of the pulsar magnetosphere is studied analytically. We show
that there is a possibility of a parametrically excited rotational-energy
pumping-process in the drift modes. It is indicated by the generation of a
toroidal component of the magnetic field that transforms the field lines into
such a configuration, in which plasma particles do not experience any forces.
At this stage, the instability process saturates and the further amplification
of the toroidal component to the magnetic field lines is suspended.
","[{""version"":""v1"",""created"":""Fri, 2 Nov 2007 12:15:41 GMT""},{""version"":""v2"",""created"":""Tue, 29 Jan 2008 09:46:16 GMT""},{""version"":""v3"",""created"":""Wed, 13 Feb 2008 12:41:07 GMT""},{""version"":""v4"",""created"":""Thu, 14 Feb 2008 08:17:33 GMT""},{""version"":""v5"",""created"":""Fri, 21 Mar 2008 11:19:01 GMT""},{""version"":""v6"",""created"":""Sat, 7 Jun 2008 20:24:19 GMT""},{""version"":""v7"",""created"":""Sun, 24 Aug 2008 14:22:57 GMT""},{""version"":""v8"",""created"":""Fri, 7 Aug 2009 10:24:04 GMT""}]","2015-05-13"
"0711.0296","Hung The Diep","V. Thanh Ngo (IOP), H. T. Diep (LPTM)","Stacked Triangular XY Antiferromagnets: End of a Controversial Issue on
  the Phase Transition","7 pages, 3 figures, to appear in J. Appl. Phys",,,,"cond-mat.stat-mech",,"  We show in this paper by using the Wang-Landau flat-histogram Monte Carlo
method that the phase transition in the XY stacked triangular antiferromagnet
is clearly of first-order, confirming results from latest Monte Carlo
simulation and from a nonperturbative renormalization group, putting an end to
a long-standing controversial issue.
","[{""version"":""v1"",""created"":""Fri, 2 Nov 2007 12:18:06 GMT""}]","2007-11-05"
"0711.0297","Patrick Elebert","P. Elebert, P. J. Callanan, A. V. Filippenko, P. M. Garnavich, G.
  Mackie, J. M. Hill, V. Burwitz","Optical Photometry and Spectroscopy of the Accretion-Powered Millisecond
  Pulsar HETE J1900.1-2455","8 pages, 6 figures; Accepted for publication in MNRAS. Minor
  revisions to match final published version","Mon. Not. R. Astron. Soc. 383 (2008) 1581-1587","10.1111/j.1365-2966.2007.12667.x",,"astro-ph",,"  We present phase resolved optical photometry and spectroscopy of the
accreting millisecond pulsar HETE J1900.1-2455. Our R-band light curves exhibit
a sinusoidal modulation, at close to the orbital period, which we initially
attributed to X-ray heating of the irradiated face of the secondary star.
However, further analysis reveals that the source of the modulation is more
likely due to superhumps caused by a precessing accretion disc. Doppler
tomography of a broad Halpha emission line reveals an emission ring, consistent
with that expected from an accretion disc. Using the velocity of the emission
ring as an estimate for the projected outer disc velocity, we constrain the
maximum projected velocity of the secondary to be 200 km/s, placing a lower
limit of 0.05 Msun on the secondary mass. For a 1.4 Msun primary, this implies
that the orbital inclination is low, < 20 degrees. Utilizing the observed
relationship between the secondary mass and orbital period in short period
cataclysmic variables, we estimate the secondary mass to be ~0.085 Msun, which
implies an upper limit of ~2.4 Msun for the primary mass.
","[{""version"":""v1"",""created"":""Fri, 2 Nov 2007 12:18:49 GMT""},{""version"":""v2"",""created"":""Wed, 23 Jan 2008 15:42:42 GMT""}]","2009-11-13"
