"0711.0216","Peter A. Sturrock","P.A. Sturrock","Analysis of bimodality in histograms formed from GALLEX and GNO solar
  neutrino data","14 pages, 8 figures",,"10.1007/s11207-008-9170-3",,"hep-ph astro-ph",,"  A histogram display of the solar neutrino capture-rate measurements made by
the GALLEX experiment appears to be bimodal, but that of the follow-on GNO
experiment does not. To assess the significance of these results, we introduce
a ""bimodality index"" based on the probability-transform procedure. This
confirms that the GALLEX measurements are indeed bimodal (at the 99.98 percent
confidence level), and that the GNO measurements are not. Tracking the
bimodality index as a function of time shows that the strongest contribution to
bimodality comes from runs 42 to 62, i.e. from the time interval 1995.1 to
1996.9. The bimodality index for the first half (runs 1 through 33) is 2.56,
whereas that for the second half (runs 33 through 65) is 7.05. Power-spectrum
analysis shows a similar distinction: the peaks in the power spectrum formed
from the second half are stronger than those in the power spectrum formed from
the first half, suggesting that bimodality and rotational modulation are
related.
","[{""version"":""v1"",""created"":""Thu, 1 Nov 2007 20:41:47 GMT""}]","2009-11-13"
"0711.0217","Constantin V. Usenko","Constantin V. Usenko","Classification of quantum channels of information transfer","9 pages, Seventh International Conference Symmetry in Nonlinear
  Mathematical Physics June 24-30, 2007 Institute of Mathematics, National
  Academy of Sciences of Ukraine, Kyiv (Kiev), Ukraine",,,,"quant-ph",,"  Classification of states of quantum channels of information transfer is built
on the basis of unreducible representations of qubit state space group of
symmetry and properties of density matrix spectrum. It is shown that pure
disentangled states form two-dimensional surface, and the reason of state
disentanglement is in degeneration of non-zero density matrix eigenvalues
","[{""version"":""v1"",""created"":""Thu, 1 Nov 2007 20:56:11 GMT""}]","2007-11-05"
"0711.0218","Peter Leek","P. J. Leek, J. M. Fink, A. Blais, R. Bianchetti, M. G\""oppl, J. M.
  Gambetta, D. I. Schuster, L. Frunzio, R. J. Schoelkopf, and A. Wallraff","Observation of Berry's Phase in a Solid State Qubit","5 pages, 4 figures, version with high resolution figures available at
  http://qudev.ethz.ch/content/science/PubsPapers.html","Science 318, 1889 (2007)","10.1126/science.1149858",,"cond-mat.mes-hall cond-mat.supr-con quant-ph",,"  In quantum information science, the phase of a wavefunction plays an
important role in encoding information. While most experiments in this field
rely on dynamic effects to manipulate this information, an alternative approach
is to use geometric phase, which has been argued to have potential fault
tolerance. We demonstrate the controlled accumulation of a geometric phase,
Berry's phase, in a superconducting qubit, manipulating the qubit geometrically
using microwave radiation, and observing the accumulated phase in an
interference experiment. We find excellent agreement with Berry's predictions,
and also observe a geometry dependent contribution to dephasing.
","[{""version"":""v1"",""created"":""Thu, 1 Nov 2007 22:04:33 GMT""}]","2007-12-24"
"0711.0219","Thomas Carne","A. F. Beardon, T. K. Carne","Euclidean and hyperbolic lenghs of images of arcs","26 pages",,"10.1112/plms/pdm060",,"math.CV",,"  Let $f$ be a function that is analytic in the unit disc. We give new
estimates, and new proofs of existing estimates, of the Euclidean length of the
image under $f$ of a radial segment in the unit disc. Our methods are based on
the hyperbolic geometry of plane domains, and we address some new questions
that follow naturally from this approach.
","[{""version"":""v1"",""created"":""Thu, 1 Nov 2007 21:24:22 GMT""}]","2014-02-26"
"0711.0220","Gerald Marsh","Gerald E. Marsh","The Vacuum and the Cosmological Constant Problem","17 pages, 2 figures. Some clarification in one section of the
  original submission and minor corrections",,,,"gr-qc","http://arxiv.org/licenses/nonexclusive-distrib/1.0/","  It will be argued here that the cosmological constant problem exists because
of the way the vacuum is defined in quantum field theory. It has been known for
some time that for QFT to be gauge invariant certain terms--such as part of the
vacuum polarization tensor--must be eliminated either explicitly or by some
form of regularization followed by renormalization. It has recently been shown
that lack of gauge invariance is a result of the way the vacuum is defined, and
redefining the vacuum so that the theory is gauge invariant may also offer a
solution to the cosmological constant problem.
","[{""version"":""v1"",""created"":""Thu, 1 Nov 2007 21:24:43 GMT""},{""version"":""v2"",""created"":""Fri, 20 Jun 2008 15:42:47 GMT""}]","2008-06-20"
"0711.0221","Henrique Boschi-Filho","C. A. Ballon Bayona, Henrique Boschi-Filho, and Nelson R. F. Braga","Deep inelastic scattering from gauge string duality in the soft wall
  model","V3: Results unchanged. We clarified the differences between the soft
  and hard wall models regarding the calculation of structure functions in DIS.
  We included a calculation of elastic form factors. We explained in more
  detail the hybrid model proposed for fermions. Version accepted for
  publication in JHEP. 20 pages, 1 Latex figure","JHEP0803:064,2008","10.1088/1126-6708/2008/03/064",,"hep-th hep-ph",,"  Deep inelastic structure functions have been calculated by Polchinski and
Strassler in gauge/string duality introducing a hard infrared (IR) cut off in
AdS space. Here we investigate this problem using a soft IR cut off that leads
to linear Regge trajectories for mesons. We calculate the structure functions
for scalar particles in the large x regime where supergravity approximation
holds and the small x regime where massive string states contribute. We also
propose a hybrid model to calculate structure functions for fermions in the
supergravity approximation. In the deep inelastic limit our results are in
agreement with those obtained using a hard cut off.
","[{""version"":""v1"",""created"":""Thu, 1 Nov 2007 21:26:42 GMT""},{""version"":""v2"",""created"":""Thu, 8 Nov 2007 17:25:22 GMT""},{""version"":""v3"",""created"":""Mon, 24 Mar 2008 19:59:33 GMT""}]","2008-11-26"
"0711.0222","Vadim Zotev","V.S. Zotev, A.N. Matlashov, P.L. Volegov, I.M. Savukov, M.A. Espy,
  J.C. Mosher, J.J. Gomez, R.H. Kraus Jr","Microtesla MRI of the human brain combined with MEG","8 pages, 5 figures - accepted by JMR","J.Magn.Resonance194:115,2008","10.1016/j.jmr.2008.06.007",,"physics.med-ph physics.ins-det","http://arxiv.org/licenses/nonexclusive-distrib/1.0/","  One of the challenges in functional brain imaging is integration of
complementary imaging modalities, such as magnetoencephalography (MEG) and
functional magnetic resonance imaging (fMRI). MEG, which uses highly sensitive
superconducting quantum interference devices (SQUIDs) to directly measure
magnetic fields of neuronal currents, cannot be combined with conventional
high-field MRI in a single instrument. Indirect matching of MEG and MRI data
leads to significant co-registration errors. A recently proposed imaging method
- SQUID-based microtesla MRI - can be naturally combined with MEG in the same
system to directly provide structural maps for MEG-localized sources. It
enables easy and accurate integration of MEG and MRI/fMRI, because microtesla
MR images can be precisely matched to structural images provided by high-field
MRI and other techniques. Here we report the first images of the human brain by
microtesla MRI, together with auditory MEG (functional) data, recorded using
the same seven-channel SQUID system during the same imaging session. The images
were acquired at 46 microtesla measurement field with pre-polarization at 30
mT. We also estimated transverse relaxation times for different tissues at
microtesla fields. Our results demonstrate feasibility and potential of human
brain imaging by microtesla MRI. They also show that two new types of imaging
equipment - low-cost systems for anatomical MRI of the human brain at
microtesla fields, and more advanced instruments for combined functional (MEG)
and structural (microtesla MRI) brain imaging - are practical.
","[{""version"":""v1"",""created"":""Thu, 1 Nov 2007 21:36:09 GMT""},{""version"":""v2"",""created"":""Mon, 4 Feb 2008 21:44:06 GMT""},{""version"":""v3"",""created"":""Sat, 28 Jun 2008 19:42:46 GMT""}]","2008-11-07"
"0711.0223","Luca Capriotti","Luca Capriotti","Least Squares Importance Sampling for Libor Market Models","14 pages, 1 figure","Wilmott Magazine, September 2007",,,"q-fin.PR cond-mat.other physics.soc-ph",,"  A recently introduced Importance Sampling strategy based on a least squares
optimization is applied to the Monte Carlo simulation of Libor Market Models.
Such Least Squares Importance Sampling (LSIS) allows the automatic optimization
of the sampling distribution within a trial class by means of a quick
presimulation algorithm of straightforward implementation. With several
numerical examples we show that LSIS can be extremely effective in reducing the
variance of Monte Carlo estimators often resulting, especially when combined
with stratified sampling, in computational speed-ups of orders of magnitude.
","[{""version"":""v1"",""created"":""Thu, 1 Nov 2007 21:39:55 GMT""}]","2008-12-02"
"0711.0224","C. Denson Hill","Judith Brinkschulte, C. Denson Hill, Mauro Nacinovich","Remarks on weakly pseudoconvex boundaries: Erratum",,"Indag. Mathem., N.S., 18 (2007), 1-2",,,"math.CV math.AP math.AT",,"  We make two tiny corrections to our previous paper with the same title, and
also obtain, as a bonus, something new.
","[{""version"":""v1"",""created"":""Fri, 2 Nov 2007 00:08:41 GMT""}]","2007-11-06"
"0711.0225","C. Denson Hill","Judith Brinkschulte, C. Denson Hill, Mauro Nacinovich","Remarks on weakly pseudoconvex boundaries",,"Indag. Mathem., N.S., 14 (2003), 1-10",,,"math.CV math.AG math.AP",,"  In this paper, we consider the boundary M of a weakly pseudoconvex domain in
a Stein manifold. We point out a striking difference between the local
cohomology and the global cohomology of M, and illustrate this with an example.
We also discuss the first and second Cousin problems, and the strong Poincare
problem for CR meromorphic functions on the weakly pseudoconvex boundary M.
","[{""version"":""v1"",""created"":""Fri, 2 Nov 2007 00:06:17 GMT""}]","2007-11-06"
"0711.0226","Alexander Shatskiy Dr.","Alexander Shatskiy","Dynamics of Phantom Matter","12 pages, 2 figures","J.Exp.Theor.Phys.104:743-750,2007;
  Zh.Eksp.Teor.Fiz.104:851-859,2007","10.1134/S1063776107050081",,"gr-qc",,"  A spherically symmetric evolution model of self-gravitating matter with the
equation of state P=wE (where w=const<-1) is considered. The equations of the
model are written in the frame of reference comoving with matter. A criterion
for the existence and formation of a horizon is defined. Part of the Einstein
equations is integrated analytically. The initial conditions and the
constraints imposed on these conditions in the presence of a horizon are
determined. For small |1+w| an analytic solution to spherically symmetric
time-dependent Einstein equations is obtained. Conditions are determined under
which the dynamics of matter changes from collapse to expansion. Characteristic
times of the evolution of the system are evaluated. It is proved that the
accretion of phantom matter (for w<-1) onto a black hole leads to the decreases
of the horizon radius of the black hole (i.e., the black hole is ""dissolved"").
","[{""version"":""v1"",""created"":""Fri, 2 Nov 2007 13:33:05 GMT""}]","2008-11-26"
"0711.0227","C. Denson Hill","Judith Brinkschulte, C. Denson Hill, Mauro Nacinovich","The Poincare lemma and local embeddability",,"Bollettino U.M.I. (8) 6-B (2003), 393-398",,,"math.CV math.AP math.AT",,"  For pseudoconvex abstract CR manifolds, the validity of the Poincare Lemma
for (0,1) forms implies local embeddability in C^N. The two properties are
equivalent for hypersurfaces of real dimension > or = 5. As a corollary we
obtain a criterion for the non validity of the Poicare Lemma for (0,1) forms
for a large class of abstract CR manifolds of CR codimension larger than one.
","[{""version"":""v1"",""created"":""Fri, 2 Nov 2007 00:02:19 GMT""}]","2007-11-06"
"0711.0228","Aruna Mohan","Aruna Mohan, Anatoly B. Kolomeisky and Matteo Pasquali","Effect of charge distribution on the translocation of an inhomogeneously
  charged polymer through a nanopore","Submitted to Journal of Chemical Physics",,"10.1063/1.2868777",,"cond-mat.soft cond-mat.stat-mech",,"  We investigate the voltage-driven translocation of an inhomogeneously charged
polymer through a nanopore by utilizing discrete and continuous stochastic
models. As a simplified illustration of the effect of charge distribution on
translocation, we consider the translocation of a polymer with a single charged
site in the presence and absence of interactions between the charge and the
pore. We find that the position of the charge that minimizes the translocation
time in the absence of pore--polymer interactions is determined by the entropic
cost of translocation, with the optimum charge position being at the midpoint
of the chain for a rodlike polymer and close to the leading chain end for an
ideal chain. The presence of attractive or repulsive pore--charge interactions
yields a shift in the optimum charge position towards the trailing end and the
leading end of the chain, respectively. Moreover, our results show that strong
attractive or repulsive interactions between the charge and the pore lengthen
the translocation time relative to translocation through an inert pore. We
generalize our results to accommodate the presence of multiple charged sites on
the polymer. Our results provide insight into the effect of charge
inhomogeneity on protein translocation through biological membranes.
","[{""version"":""v1"",""created"":""Thu, 1 Nov 2007 23:01:54 GMT""}]","2009-11-13"
"0711.0229","C. Denson Hill","Judith Brinkschulte, C. Denson Hill, Mauro Nacinovich","Obstructions to generic embeddings",,"Ann. Inst. Fourier, Grenoble 52 (2002), 1785-1792",,,"math.CV math.AT math.DG",,"  In Grauert's paper [G] it is noted that finite dimensionality of cohomology
groups sometimes implies vanishing of these cohomomogy groups. Later on Laufer
formulated a zero or infinity law for the cohomology groups of domains in Stein
manifolds. In this paper we generalize Laufer's Theorem in [L] and its version
for small domains of CR manifolds, proved in [Br], by considering Whitney
cohomology on locally closed subsets and cohomology with supports for currents.
With this approach we obtain a global result for CR manifolds generically
embedded in a Stein manifold. Namely a necessary condition for global embedding
into an open subset of a Stein manifold is that the de-bar-M-cohomology groups
must be either zero or infinite dimensional.
","[{""version"":""v1"",""created"":""Fri, 2 Nov 2007 00:04:25 GMT""}]","2007-11-06"
"0711.0230","Elizabeth Tasker Dr","Elizabeth J. Tasker (1), Greg L. Bryan (2) ((1) University of Florida,
  (2) Columbia University)","The Effect of the ISM Model on Star Formation Properties in Galactic
  Discs","4 pages, proceedings from the conference ""Formation and Evolution of
  Galaxy Disks"", Rome, October 1-5, 2007. To be published in the series of the
  Astronomical Society of the Pacific",,,,"astro-ph",,"  Modelling global disc galaxies is a difficult task which has previously
resulted in the small scale physics of the interstellar medium being greatly
simplified. In this talk, I compare simulations of galaxies with different ISM
properties to determine the importance of the ISM structure in the star
formation properties of the disc.
","[{""version"":""v1"",""created"":""Thu, 1 Nov 2007 22:53:57 GMT""}]","2007-11-05"
"0711.0233","John Chiaverini","J. Chiaverini and W. E. Lybarger Jr","Laserless trapped-ion quantum simulations without spontaneous scattering
  using microtrap arrays","12 pages, 5 figures, edited typos, added refs and text for
  clarification to reflect published version","Phys. Rev. A 77, 022324 (2008)","10.1103/PhysRevA.77.022324","LA-UR-07-7306","quant-ph",,"  We propose an architecture and methodology for large-scale quantum
simulations using hyperfine states of trapped-ions in an arbitrary-layout
microtrap array with laserless interactions. An ion is trapped at each site,
and the electrode structure provides for the application of single and pairwise
evolution operators using only locally created microwave and radio-frequency
fields. The avoidance of short-lived atomic levels during evolution effectively
eliminates errors due to spontaneous scattering; this may allow scaling of
quantum simulators based on trapped ions to much larger systems than currently
estimated. Such a configuration may also be particularly appropriate for
one-way quantum computing with trapped-ion cluster states.
","[{""version"":""v1"",""created"":""Fri, 2 Nov 2007 01:10:28 GMT""},{""version"":""v2"",""created"":""Thu, 13 Mar 2008 17:22:40 GMT""}]","2008-03-13"
"0711.0234","Hyun Seok Yang","Hyun Seok Yang","Noncommutative Spacetime and Emergent Gravity","4 pages; To appear in Proceedings (Lie Theory and Its Applications in
  Physics VII, ed. V.K. Dobrev et al, Heron Press, Sofia, 2008) of the 7th
  International Workshop ""Lie Theory and Its Applications in Physics"", 18-24
  June 2007, Varna, Bulgaria","Bulg.J.Phys.35:323-328,2008",,"KIAS-P08007","hep-th gr-qc hep-ph math.SG",,"  We argue that a field theory defined on noncommutative (NC) spacetime should
be regarded as a theory of gravity, which we refer to as the emergent gravity.
A whole point of the emergent gravity is essentially originated from the basic
property: A NC spacetime is a (NC) phase space. This fact leads to two
important consequences: (I) A NC field theory can basically be identified with
a matrix model or a large N field theory where NC fields can be regarded as
master fields of large N matrices. (II) NC fields essentially define vector
(tetrad) fields. So they define a gravitational metric of some manifold as an
emergent geometry from NC gauge fields. Of course, the pictures (I) and (II)
should refer to the same physics, which should be familiar with the large N
duality in string theory. The 1/N corrections in the picture (I) correspond to
the derivative corrections in terms of the noncommutativity \theta for the
picture (II).
","[{""version"":""v1"",""created"":""Fri, 2 Nov 2007 01:05:17 GMT""}]","2009-11-13"
"0711.0235","Yi-Fang Chang","Yi-Fang Chang","Multiply Connected Topological Economics, Confidence Relation and
  Political Economy","6 page; 3 figures",,,,"math.GM","http://arxiv.org/licenses/nonexclusive-distrib/1.0/","  Using the similar formulas of the preference relation and the utility
function, we propose the confidence relations and the corresponding influence
functions that represent various interacting strengths of different families,
cliques and systems of organization. Since they can affect products, profit and
prices, etc., in an economic system, and are usually independent of economic
results, therefore, the system can produce a multiply connected topological
economics. If the political economy is an economy chaperoned polity, it will
produce consequentially a binary economy. When the changes of the product and
the influence are independent one another, they may be a node or saddle point.
When the influence function large enough achieves a certain threshold value, it
will form a wormhole with loss of capital. Various powers produce usually the
economic wormhole and various corruptions.
","[{""version"":""v1"",""created"":""Fri, 2 Nov 2007 01:06:56 GMT""},{""version"":""v2"",""created"":""Sun, 14 Feb 2010 06:55:39 GMT""}]","2010-02-14"
"0711.0236","Thomas Schaefer","Thomas Schaefer (North Carolina State University)","Euclidean Correlation Functions in a Holographic Model of QCD","16 pages, 5 figures, minor changes (references added), to appear in
  Phys Rev D","Phys.Rev.D77:126010,2008","10.1103/PhysRevD.77.126010",,"hep-ph hep-lat",,"  We compute euclidean coordinate space correlation functions in a holographic
model of QCD. We concentrate, in particular, on channels that are related to
the U(1)_A problem, the flavor-singlet axialvector, pseudoscalar meson, and
pseudoscalar glueball (topological charge) correlator. We find that even a very
simple holographic model defined on a slice of AdS_5 provides a qualitatively
correct description of QCD correlation functions. We study the role of anomaly
terms, and show that both euclidean positivity and low energy theorems based on
the axial anomaly relation are correctly implemented. We compare the results
with expectations from an instanton model of the QCD vacuum.
","[{""version"":""v1"",""created"":""Fri, 2 Nov 2007 01:34:21 GMT""},{""version"":""v2"",""created"":""Wed, 7 May 2008 14:37:15 GMT""}]","2008-11-26"
"0711.0237","Anand Sarwate","Krishnan Eswaran, Anand D. Sarwate, Anant Sahai, and Michael Gastpar","Zero-rate feedback can achieve the empirical capacity","Revised version of paper originally submitted to IEEE Transactions on
  Information Theory, Nov. 2007. This version contains further revisions and
  clarifications",,"10.1109/TIT.2009.2034779",,"cs.IT math.IT","http://arxiv.org/licenses/nonexclusive-distrib/1.0/","  The utility of limited feedback for coding over an individual sequence of
DMCs is investigated. This study complements recent results showing how limited
or noisy feedback can boost the reliability of communication. A strategy with
fixed input distribution $P$ is given that asymptotically achieves rates
arbitrarily close to the mutual information induced by $P$ and the
state-averaged channel. When the capacity achieving input distribution is the
same over all channel states, this achieves rates at least as large as the
capacity of the state averaged channel, sometimes called the empirical
capacity.
","[{""version"":""v1"",""created"":""Fri, 2 Nov 2007 02:00:55 GMT""},{""version"":""v2"",""created"":""Wed, 14 Jan 2009 01:58:46 GMT""},{""version"":""v3"",""created"":""Mon, 10 Aug 2009 22:22:36 GMT""}]","2016-11-17"
"0711.0238","Lauren A. MacArthur","Lauren A. MacArthur (Caltech), Richard S. Ellis (Caltech), Tommaso
  Treu (UCSB), Vivian U (IfA), Kevin Bundy (Univ. of Toronto), Sean M. Moran
  (JHU)","The Evolutionary History of Galactic Bulges: Photometric and
  Spectroscopic Studies of Distant Spheroids in the GOODS Fields","32 pages, 13 embedded color figures, uses emulateapj.cls. Submitted
  to ApJ. High-resolution version available at
  http://www.astro.caltech.edu/~lam/MacArthur_bulges.pdf (strongly recommended)",,"10.1086/587887",,"astro-ph",,"  We report on the first results of a new study aimed at understanding the
diversity and evolutionary history of distant galactic bulges in the context of
now well-established trends for pure spheroidal galaxies. To this end, bulges
have been isolated for a sample of 137 spiral galaxies within the redshift
range 0.1<z<1.2 in the GOODS fields. Using proven photometric techniques we
determine the characteristic parameters (size, surface brightness, profile
shape) of both the disk and bulge components in our sample. In agreement with
earlier work which utilized aperture colors, distant bulges show a broader
range of optical colors than would be the case for passively-evolving
populations. To quantify the amount of recent star formation necessary to
explain this result, we used the DEIMOS spectrograph to secure stellar velocity
dispersions for a sizeable fraction of our sample. This has enabled us to
compare the Fundamental Plane of our distant bulges with that for spheroidal
galaxies in a similar redshift range. Bulges of spiral galaxies with a
bulge-to-total luminosity ratio (B/T)>0.2 show very similar patterns of
evolution to those seen for pure spheroidals such that the stellar populations
of all spheroids with M>10^{11}Msun are homogeneously old, consistent with a
single major burst of star formation at high redshift (z_f<~2), while bulges
with M<10^{11}Msun must have had more recent stellar mass growth (~10% in mass
since z~1). Although further data spanning a wider range of redshift and mass
is desirable, the striking similarity between the assembly histories of bulges
and low mass spheroidals is difficult to reconcile with the picture whereby the
majority of large bulges form primarily via secular processes within spiral
galaxies.
","[{""version"":""v1"",""created"":""Fri, 2 Nov 2007 02:31:46 GMT""}]","2009-11-13"
"0711.0239","Marc-Hubert Nicole","Marc-Hubert Nicole","Superspecial Abelian Varieties and the Eichler Basis Problem for Hilbert
  Modular Forms","to appear in J.N.T","Journal of Number Theory, 128, 2008, 2874-2889","10.1016/j.jnt.2008.01.006",,"math.NT math.AG","http://arxiv.org/licenses/nonexclusive-distrib/1.0/","  Let $p$ be an unramified prime in a totally real field $L$ such that
$h^+(L)=1$. Our main result shows that Hilbert modular newforms of parallel
weight two for $\Gamma_0(p)$ can be constructed naturally, via classical theta
series, from modules of isogenies of superspecial abelian varieties with real
multiplication on a Hilbert moduli space. This can be viewed as a geometric
reinterpretation of the Eichler Basis Problem for Hilbert modular forms.
","[{""version"":""v1"",""created"":""Fri, 2 Nov 2007 02:30:05 GMT""},{""version"":""v2"",""created"":""Tue, 17 Jun 2008 08:53:25 GMT""}]","2008-10-04"
