"0711.0173","Erin Pearse","Michel L. Lapidus, Erin P. J. Pearse","Tube formulas for self-similar fractals","19 pages, 12 figures, survey paper for inclusion in a proceedings","Proc. Sympos. Pure Math., 77, Amer. Math. Soc., Providence, RI,
  2008",,,"math.DS math-ph math.MG math.MP",,"  Tube formulas (by which we mean an explicit formula for the volume of an
$\epsilon$-neighbourhood of a subset of a suitable metric space) have been used
in many situations to study properties of the subset. For smooth submanifolds
of Euclidean space, this includes Weyl's celebrated results on spectral
asymptotics, and the subsequent relation between curvature and spectrum.
Additionally, a tube formula contains information about the dimension and
measurability of rough sets. In convex geometry, the tube formula of a convex
subset of Euclidean space allows for the definition of certain curvature
measures. These measures describe the curvature of sets which are not too
irregular to support derivatives. In this survey paper, we describe some recent
advances in the development of tube formulas for self-similar fractals, and
their applications and connections to the other topics mentioned here.
","[{""version"":""v1"",""created"":""Thu, 1 Nov 2007 17:13:50 GMT""}]","2010-07-30"
"0711.0174","Ismaila Dabo","Ismaila Dabo, Andrzej Wieckowski, Nicola Marzari","Vibrational Recognition of Adsorption Sites for Carbon Monoxide on
  Platinum and Platinum-Ruthenium Surfaces","21 pages, 9 figures","Journal of the American Chemical Society 129, 11045-11052 (2007)","10.1021/ja067944u",,"cond-mat.mtrl-sci cond-mat.other",,"  We have studied the vibrational properties of CO adsorbed on platinum and
platinum-ruthenium surfaces using density-functional perturbation theory within
the Perdew-Burke-Ernzerhof generalized-gradient approximation. The calculated
C-O stretching frequencies are found to be in excellent agreement with
spectroscopic measurements. The frequency shifts that take place when the
surface is covered with ruthenium monolayers are also correctly predicted. This
agreement for both shifts and absolute vibrational frequencies is made more
remarkable by the frequent failure of local and semilocal exchange-correlation
functionals in predicting the stability of the different adsorption sites for
CO on transition metal surfaces. We have investigated the chemical origin of
the C-O frequency shifts introducing an orbital-resolved analysis of the force
and frequency density of states, and assessed the effect of donation and
backdonation on the CO vibrational frequency using a GGA + molecular U
approach. These findings rationalize and establish the accuracy of
density-functional calculations in predicting absolute vibrational frequencies,
notwithstanding the failure in determining relative adsorption energies, in the
strong chemisorption regime.
","[{""version"":""v1"",""created"":""Thu, 1 Nov 2007 17:06:19 GMT""}]","2009-09-29"
"0711.0175","Razvan Radulescu M.D.","Razvan Tudor Radulescu","The insulin-RB synapse in health and disease: cellular rocket science","12 pages",,,,"q-bio.BM q-bio.SC",,"  Time has come for a survey of our knowledge on the physical interaction
between the growth-promoting insulin molecule and retinoblastoma tumor
suppressor protein (RB). Theoretical and experimental observations over the
past 15 years reviewed here indicate that the insulin-RB dimer may represent an
essential molecular crossroads involved in major physiological and pathological
conditions. Within this system, the putative tumor suppressor insulin-degrading
enzyme (IDE) should be an important modulator. Perhaps most remarkably, the
abstraction of this encounter between insulin and RB, two growth-regulatory
giants acting either in concert or against each other depending on the
respective cellular requirements, reveals that Nature may compute in
controlling cell fate and we could follow in its footsteps towards developing
more efficient therapeutics as well as novel technical devices.
","[{""version"":""v1"",""created"":""Thu, 1 Nov 2007 19:53:44 GMT""}]","2007-11-02"
"0711.0176","Tom Brown","T.W. Brown, P.J. Heslop, S. Ramgoolam","Diagonal multi-matrix correlators and BPS operators in N=4 SYM","36+12 pages, 7 figures, typos corrected, references added","JHEP 0802:030,2008","10.1088/1126-6708/2008/02/030","QMUL-PH-07-23","hep-th cond-mat.stat-mech math.RT",,"  We present a complete basis of multi-trace multi-matrix operators that has a
diagonal two point function for the free matrix field theory at finite N. This
generalises to multiple matrices the single matrix diagonalisation by Schur
polynomials. Crucially, it involves intertwining the gauge group U(N) and the
global symmetry group U(M) with Clebsch-Gordan coefficients of symmetric groups
S_n. When applied to N=4 super Yang-Mills we consider the U(3) subgroup of the
full symmetry group. The diagonalisation allows the description of a dual basis
to multi-traces, which permits the characterisation of the metric on operators
transforming in short representations at weak coupling. This gives a framework
for the comparison of quarter and eighth-BPS giant gravitons of AdS_5 x S^5
spacetime to gauge invariant operators of the dual N=4 SYM.
","[{""version"":""v1"",""created"":""Thu, 1 Nov 2007 18:03:55 GMT""},{""version"":""v2"",""created"":""Wed, 12 Dec 2007 13:57:17 GMT""},{""version"":""v3"",""created"":""Fri, 1 Feb 2008 18:43:33 GMT""}]","2009-01-16"
"0711.0177","Ronnie Jansson","Ronnie Jansson and Glennys R. Farrar","Maximum Likelihood Method for Cross Correlations with Astrophysical
  Sources","12 pages, 5 figures. Accepted for publication in JCAP","JCAP 0806:017,2008","10.1088/1475-7516/2008/06/017",,"astro-ph","http://arxiv.org/licenses/nonexclusive-distrib/1.0/","  We generalize the Maximum Likelihood-type method used to study cross
correlations between a catalog of candidate astrophysical sources and Ultrahigh
Energy Cosmic Rays (UHECRs), to allow for differing source luminosities. The
new method is applicable to any sparse data set such as UHE gamma rays or
astrophysical neutrinos. Performance of the original and generalized techniques
is evaluated in simulations of various scenarios. Applying the new technique to
data, we find an excess correlation of about 9 events between HiRes UHECRs and
known BLLacs, with a 6*10^-5 probability of such a correlation arising by
chance.
","[{""version"":""v1"",""created"":""Thu, 1 Nov 2007 18:07:28 GMT""},{""version"":""v2"",""created"":""Wed, 18 Jun 2008 15:54:06 GMT""}]","2009-06-23"
"0711.0178","Nikolai Priezjev V.","Anoosheh Niavarani and Nikolai V. Priezjev","Slip boundary conditions for shear flow of polymer melts past atomically
  flat surfaces","27 pages, 11 figures","Phys. Rev. E 77, 041606 (2008)","10.1103/PhysRevE.77.041606",,"cond-mat.soft cond-mat.mtrl-sci physics.flu-dyn",,"  Molecular dynamics simulations are carried out to investigate the dynamic
behavior of the slip length in thin polymer films confined between atomically
smooth thermal surfaces. For weak wall-fluid interactions, the shear rate
dependence of the slip length acquires a distinct local minimum followed by a
rapid growth at higher shear rates. With increasing fluid density, the position
of the local minimum is shifted to lower shear rates. We found that the ratio
of the shear viscosity to the slip length, which defines the friction
coefficient at the liquid/solid interface, undergoes a transition from a nearly
constant value to the power law decay as a function of the slip velocity. In a
wide range of shear rates and fluid densities, the friction coefficient is
determined by the product of the value of surface induced peak in the structure
factor and the contact density of the first fluid layer near the solid wall.
","[{""version"":""v1"",""created"":""Thu, 1 Nov 2007 18:08:59 GMT""},{""version"":""v2"",""created"":""Thu, 7 Feb 2008 20:21:10 GMT""}]","2008-04-21"
"0711.0179","Raf Bocklandt","Raf Bocklandt","Noncommutative Tangent Cones and Calabi Yau Algebras",,,,,"math.RA",,"  We study the generalization of the idea of a local quiver of a representation
of a formally smooth algebra, to broader classes of finitely generated
algebras. In this new setting we can construct for every semisimple
representation $M$ a local model and a non-commutative tangent cone. The
representation schemes of these new algebras model the local structure and the
tangent cone of the representation scheme of the original algebra at $M$. In
this way one can try to classify algebras according to their local behavior. As
an application we will show that the tangent cones of Calabi Yau 2 Algebras are
always preprojective algebras. For Calabi Yau 3 Algebras the corresponding
statement would be that the local model and the tangent cones derive from
superpotentials. Although we do not have a proof in all cases, we will show
that this will indeed hold in many cases.
","[{""version"":""v1"",""created"":""Thu, 1 Nov 2007 18:17:53 GMT""}]","2007-11-02"
"0711.0180","Nicholas Cross","Nicholas Cross, Nigel Hambly, Ross Collins, Mike Read and Eckhard
  Sutorius","Recalibration of Data in the VDFS Science Archives","4 pages, 1 figure, ADASS XVII conference proceeding. ASP conference
  series",,,,"astro-ph",,"  The VDFS comprises the system to pipeline process and archive the data from
infrared observations taken by both the WFCAM instrument on UKIRT and the
forthcoming VISTA telescope. These include the largest near-IR surveys to date,
such as UKIDSS, which produce terabyte sized catalogues of over 10^9 rows. Such
large data volumes present a performance challenge when the catalogue data,
stored in a relational database, require many iterations of astrometric and
photometric recalibration. Here we present the VDFS recalibration solution that
will be employed in the WSA from the forthcoming UKIDSS Data Release 4 and VSA
from its inception.
","[{""version"":""v1"",""created"":""Thu, 1 Nov 2007 18:21:31 GMT""}]","2007-11-02"
"0711.0181","Daniel Grumiller","D. Grumiller and R. Jackiw","Einstein-Weyl from Kaluza-Klein","11 pages, v2: updated Refs., minor changes","Phys.Lett.A372:2547-2551,2008","10.1016/j.physleta.2007.12.014","MIT-CTP 3901","math-ph gr-qc hep-th math.MP",,"  We discuss the Kaluza-Klein reduction of spaces with (anti-)self-dual Weyl
tensor and point out the emergence of the Einstein-Weyl equations for the
reduction from four to three dimensions. As a byproduct we get a simple
expression for the gravitational instanton density in terms of the Kaluza-Klein
functions.
","[{""version"":""v1"",""created"":""Thu, 1 Nov 2007 18:35:02 GMT""},{""version"":""v2"",""created"":""Fri, 4 Jan 2008 21:28:44 GMT""}]","2008-11-26"
"0711.0182","Erich J. Mueller","Erich J. Mueller (Cornell)","Generic features of the spectrum of trapped polarized fermions","4 Pages, 2 figures, RevTeX4",,"10.1103/PhysRevA.78.045601",,"cond-mat.other","http://arxiv.org/licenses/nonexclusive-distrib/1.0/","  We show that bimodal radio frequency spectra universally arise at
intermediate temperatures in models of strongly interacting trapped Fermi
gases. The bimodality is independent of superfluidity or pseudogap physics,
depending only on the functional form of the equation of state -- which is
constrained by dimensional analysis at low temperatures and the virial
expansion at high temperatures. In addition to these model independent results,
we present a simple calculation of the radio frequency line-shape of a highly
polarized Fermi gas which uses energetic considerations to include final state
interactions. While this model only qualitatively captures the line-shapes
observed in the experiments, it provides a conceptually clean and powerful
technique for estimating the energy scales and how they vary with experimental
parameters.
","[{""version"":""v1"",""created"":""Thu, 1 Nov 2007 18:36:30 GMT""},{""version"":""v2"",""created"":""Mon, 18 Aug 2008 20:29:33 GMT""}]","2009-11-13"
"0711.0183","Alexander Kildishev","Alexander V. Kildishev and Vladimir M. Shalaev","Engineering Space for Light via Transformation Optics","3 pages, 4 color figures",,"10.1364/OL.33.000043",,"physics.optics",,"  Conceptual studies and numerical simulations are performed for imaging
devices that transform a near-field pattern into magnified far-zone images and
are based on high-order spatial transformation in cylindrical domains. A lens
translating a near-field pattern from an almost circular input boundary onto a
magnified far-field image at a flat output boundary is considered. The lens is
made of a metamaterial with anisotropic permittivity and permeability both
depending on a single 'scaling' parameter of the transformation. Open designs
of the lens with a truncated body ('3/4-body' and '1/4-body' lenses) are
suggested and analyzed. It is shown that the ideal full-lens and the '3/4-body'
lens produce identical images. Numerical simulations of '1/4-body' designs
indicate that further truncation of the lens could limit its per-formance. A
light concentrator, ""focusing"" far-zone fields into a nanometer-scale area, is
also considered.
","[{""version"":""v1"",""created"":""Thu, 1 Nov 2007 18:48:46 GMT""}]","2009-11-13"
"0711.0184","Vasiliy Dolgushev","V.A. Dolgushev and V.N. Rubtsov","An algebraic index theorem for Poisson manifolds","accepted to Journal fur die reine und angewandte Mathematik",,,,"math.QA hep-th math.KT",,"  The formality theorem for Hochschild chains of the algebra of functions on a
smooth manifold gives us a version of the trace density map from the zeroth
Hochschild homology of a deformation quantization algebra to the zeroth Poisson
homology. We propose a version of the algebraic index theorem for a Poisson
manifold which is based on this trace density map.
","[{""version"":""v1"",""created"":""Thu, 1 Nov 2007 18:50:40 GMT""},{""version"":""v2"",""created"":""Mon, 12 Nov 2007 17:09:56 GMT""},{""version"":""v3"",""created"":""Sun, 23 Mar 2008 13:06:25 GMT""},{""version"":""v4"",""created"":""Fri, 4 Apr 2008 21:08:02 GMT""}]","2008-04-05"
"0711.0185","Julia Wolf","W.T. Gowers and J. Wolf (University of Cambridge)","The true complexity of a system of linear equations","30 pages",,"10.1112/plms/pdp019",,"math.NT math.CO",,"  It is well-known that if a subset A of a finite Abelian group G satisfies a
quasirandomness property called uniformity of degree k, then it contains
roughly the expected number of arithmetic progressions of length k, that is,
the number of progressions one would expect in a random subset of G of the same
density as A. One is naturally led to ask which degree of uniformity is
required of A in order to control the number of solutions to a general system
of linear equations. Using so-called ""quadratic Fourier analysis"", we show that
certain linear systems that were previously thought to require quadratic
uniformity are in fact governed by linear uniformity. More generally, we
conjecture a necessary and sufficient condition on a linear system L which
guarantees that any subset A of F_p^n which is uniform of degree k contains the
expected number of solutions to L.
","[{""version"":""v1"",""created"":""Thu, 1 Nov 2007 18:56:56 GMT""}]","2014-02-26"
"0711.0186","Ajay Jasra","Ajay Jasra, David A. Stephens and Chris C. Holmes","Population-Based Reversible Jump Markov Chain Monte Carlo",,,,,"stat.CO",,"  In this paper we present an extension of population-based Markov chain Monte
Carlo (MCMC) to the trans-dimensional case. One of the main challenges in
MCMC-based inference is that of simulating from high and trans-dimensional
target measures. In such cases, MCMC methods may not adequately traverse the
support of the target; the simulation results will be unreliable. We develop
population methods to deal with such problems, and give a result proving the
uniform ergodicity of these population algorithms, under mild assumptions. This
result is used to demonstrate the superiority, in terms of convergence rate, of
a population transition kernel over a reversible jump sampler for a Bayesian
variable selection problem. We also give an example of a population algorithm
for a Bayesian multivariate mixture model with an unknown number of components.
This is applied to gene expression data of 1000 data points in six dimensions
and it is demonstrated that our algorithm out performs some competing Markov
chain samplers.
","[{""version"":""v1"",""created"":""Thu, 1 Nov 2007 18:57:06 GMT""}]","2007-11-02"
"0711.0187","Mohamad Ali Gomshi Nobary","M.A. Gomshi Nobary and R. Sepahvand","Ground state heavy baryon production in a relativistic quark-diquark
  model","8 pages, 4 figures. To appear in Phys. Rev. D","Phys.Rev.D76:114006,2007","10.1103/PhysRevD.76.114006","Razi-Hep 133","hep-ph",,"  We use current-current interaction to calculate the fragmentation functions
to describe the production of spin-1/2, spin-1/2$'$ and spin-3/2 baryons with
massive constituents in a relativistic quark-diquark model. Our results are in
their analytic forms and are applicable for singly, doubly and triply heavy
baryons. We discuss the production of $\Omega_{bbc}$, $\Omega_{bcc}$ and
$\Omega_{ccc}$ baryons in some detail. The results are satisfactorily compared
with those obtained for triply heavy baryons calculated in a perturbative
regime within reasonable values of the parameters involved.
","[{""version"":""v1"",""created"":""Thu, 1 Nov 2007 18:59:12 GMT""}]","2008-11-26"
"0711.0188","Scott A. Hughes","Scott A. Hughes","LISA sources and science","8 pages, 2 figures. For the Proceedings of the 7th Edoardo Amaldi
  Conference on Gravitational Waves (to be published by Classical and Quantum
  Gravity)",,,,"gr-qc astro-ph",,"  LISA is a planned space-based gravitational-wave (GW) detector that would be
sensitive to waves from low-frequency sources, in the band of roughly (0.03 -
0.1) mHz < f < 0.1 Hz. This is expected to be an extremely rich chunk of the GW
spectrum -- observing these waves will provide a unique view of dynamical
processes in astrophysics. Here we give a quick survey of some key LISA sources
and what GWs can uniquely teach us about these sources. Particularly noteworthy
science which is highlighted here is the potential for LISA to track the
moderate to high redshift evolution of black hole masses and spins through the
measurement of GWs generated from massive black hole binaries (which in turn
form by the merger of galaxies and protogalaxies). Measurement of these binary
black hole waves has the potential to determine the masses and spins of the
constituent black holes with percent-level accuracy or better, providing a
unique high-precision probe of an aspect of early structure growth. This
article is based on the ""Astrophysics and Relativity using LISA"" talk given by
the author at the Seventh Edoardo Amaldi Conference on Gravitational Waves; it
is largely an updating of the author's writeup of a talk given at the Sixth
International LISA Symposium.
","[{""version"":""v1"",""created"":""Thu, 1 Nov 2007 19:02:54 GMT""}]","2007-11-02"
"0711.0189","Ulrike von Luxburg","Ulrike von Luxburg","A Tutorial on Spectral Clustering",,"Statistics and Computing 17(4), 2007",,,"cs.DS cs.LG",,"  In recent years, spectral clustering has become one of the most popular
modern clustering algorithms. It is simple to implement, can be solved
efficiently by standard linear algebra software, and very often outperforms
traditional clustering algorithms such as the k-means algorithm. On the first
glance spectral clustering appears slightly mysterious, and it is not obvious
to see why it works at all and what it really does. The goal of this tutorial
is to give some intuition on those questions. We describe different graph
Laplacians and their basic properties, present the most common spectral
clustering algorithms, and derive those algorithms from scratch by several
different approaches. Advantages and disadvantages of the different spectral
clustering algorithms are discussed.
","[{""version"":""v1"",""created"":""Thu, 1 Nov 2007 19:04:43 GMT""}]","2007-11-02"
"0711.0190","Zhongxiang Wang","Z. Wang and V. M. Kaspi","Search for Mid-IR Flux Variations from The Anomalous X-ray Pulsar 4U
  0142+61","5 pages, 1 figure, ApJ, accepted",,"10.1086/526449",,"astro-ph",,"  We report on our Spitzer observations of the anomalous X-ray pulsar 4U
0142+61, made following a large X-ray burst that occurred on 2007 February 7.
To search for mid-infrared flux variations, four imaging observations were
carried out at 4.5 and 8.0 $\mu$m with the Infrared Array Camera from February
14 to 21. No significant flux variations were detected, and the average fluxes
were 32.1$\pm$2.0 $\mu$Jy at 4.5 $\mu$m and 59.8$\pm8.5$ $\mu$Jy at 8.0 $\mu$m,
consistent with those obtained in 2005. The non-detection of variability is
interesting in light of reported rapid variability from this source in the
near-infrared, but consistent with the fact that the source already went back
to its quiescent state before our observations began, as indicated by
contemporaneous X-ray observations. In order to understand the origin of the
near-infrared variability, frequent, simultaneous multi-wavelength observations
are needed.
","[{""version"":""v1"",""created"":""Thu, 1 Nov 2007 19:04:56 GMT""}]","2009-11-13"
"0711.0191","William Breslin","William Breslin","Thick triangulations of hyperbolic n-manifolds","12 pages, 3 figures","Pacific J. Math. 241 (2009), no. 2, 215-225",,,"math.GT","http://arxiv.org/licenses/nonexclusive-distrib/1.0/","  We show that a complete hyperbolic n-manifold has a geodesic triangulation
such that the tetrahedra contained in the thick part are L-bilipschitz
diffeomorphic to the standard Euclidean n-simplex, for some constant L
depending only on the dimension and the constant used to define the thick-thin
decomposition of M.
","[{""version"":""v1"",""created"":""Thu, 1 Nov 2007 19:55:56 GMT""},{""version"":""v2"",""created"":""Wed, 6 Jun 2012 21:55:48 GMT""}]","2012-06-08"
"0711.0192","Andrei Mironov","A.Mironov, A.Morozov and T.Tomaras","Some properties of the Alday-Maldacena minimum","10 pages","Phys.Lett.B659:723-731,2008","10.1016/j.physletb.2007.11.025","ITEP-TH-39/07","hep-th",,"  The Alday-Maldacena solution, relevant to the n=4 gluon amplitude in N=4 SYM
at strong coupling, was recently identified as a minimum of the regularized
action in the moduli space of solutions of the AdS_5 sigma-model equations of
motion. Analogous solutions of the Nambu-Goto equations for the n=4 case are
presented and shown to form (modulo the reparametrization group) an equally
large but different moduli space, with the Alday-Maldacena solution at the
intersection of the sigma-model and Nambu-Goto moduli spaces. We comment upon
the possible form of the regularized action for n=5. A function of moduli
parameters z_a is written, whose minimum reproduces the BDDK one-loop
five-gluon amplitude. This function may thus be considered as some kind of
Legendre transform of the BDDK formula and has its own value independently of
the Alday-Maldacena approach.
","[{""version"":""v1"",""created"":""Thu, 1 Nov 2007 19:12:17 GMT""}]","2008-11-26"
"0711.0193","Paul Frampton","Paul H. Frampton and Thomas W. Kephart","Upper and Lower Bounds on Gravitational Entropy","10 pages LaTeX. Minor corrections","JCAP0806:008,2008","10.1088/1475-7516/2008/06/008",,"gr-qc",,"  The entropy in the interior of the Universe has many contributions including
well understood ones from radiation and relic neutrinos. The gravitational
entropy is larger and more subtle. One contribution which provides our lower
bound is from supermassive black holes at the centers of galaxies. The
remainder is harder to pin down. We suggest an upper bound which is many orders
of magnitude below the holographic bound yet above that of the supermassive
black holes. We propose that gravitational entropy in dark matter halos is the
largest contributor to the present entropy of the universe.
","[{""version"":""v1"",""created"":""Thu, 1 Nov 2007 19:23:51 GMT""},{""version"":""v2"",""created"":""Sun, 6 Apr 2008 18:51:50 GMT""}]","2008-11-26"
"0711.0194","Dexter Kozen","Dexter Kozen","Coinductive Proof Principles for Stochastic Processes","16 pages, 2 figures. Preliminary version appeared in: Rajeev Alur,
  ed., Proc. 21st Symp. Logic in Computer Science (LICS'06), pages 359-366.
  IEEE, August 2006","Logical Methods in Computer Science, Volume 3, Issue 4 (November
  12, 2007) lmcs:1098","10.2168/LMCS-3(4:8)2007",,"cs.LO",,"  We give an explicit coinduction principle for recursively-defined stochastic
processes. The principle applies to any closed property, not just equality, and
works even when solutions are not unique. The rule encapsulates low-level
analytic arguments, allowing reasoning about such processes at a higher
algebraic level. We illustrate the use of the rule in deriving properties of a
simple coin-flip process.
","[{""version"":""v1"",""created"":""Thu, 1 Nov 2007 19:25:13 GMT""},{""version"":""v2"",""created"":""Mon, 12 Nov 2007 09:28:32 GMT""}]","2015-07-01"
"0711.0195","Andrei Mikhailov","Andrei Mikhailov, Sakura Schafer-Nameki","Sine-Gordon-like action for the Superstring in AdS(5) x S(5)","19 pages, LaTeX; v2: added discussion of zero modes in Section 3; v3:
  improved presentation","JHEP0805:075,2008","10.1088/1126-6708/2008/05/075","CALT-68-2663","hep-th",,"  We propose an action for a sine-Gordon-like theory, which reproduces the
classical equations of motion of the Green-Schwarz-Metsaev-Tseytlin superstring
on AdS(5) x S(5). The action is relativistically invariant. It is a
mass-deformed gauged WZW model for SO(4,1) x SO(5) / SO(4) x SO(4) interacting
with fermions.
","[{""version"":""v1"",""created"":""Thu, 1 Nov 2007 19:34:01 GMT""},{""version"":""v2"",""created"":""Wed, 23 Apr 2008 18:08:25 GMT""},{""version"":""v3"",""created"":""Sun, 11 May 2008 19:24:30 GMT""}]","2008-11-26"
