"0711.0423","Jun Fukue","Jun Fukue and Chizuru Akizuki","Relativistic Radiative Flow in a Luminous Disk II","7 pages, 5 figures","Publ.Astron.Soc.Jap.58:1073,2006","10.1093/pasj/58.6.1073",,"astro-ph",,"  Radiatively-driven transfer flow perpendicular to a luminous disk is examined
in the relativistic regime of $(v/c)^2$, taking into account the gravity of the
central object. The flow is assumed to be vertical, and the gas pressure as
well as the magnetic field are ignored. Using a velocity-dependent variable
Eddington factor, we can solve the rigorous equations of the relativistic
radiative flow accelerated up to the {\it relativistic} speed. For sufficiently
luminous cases, the flow resembles the case without gravity. For less-luminous
or small initial radius cases, however, the flow velocity decreases due to
gravity. Application to a supercritical accretion disk with mass loss is
briefly discussed.
","[{""version"":""v1"",""created"":""Sat, 3 Nov 2007 04:04:35 GMT""}]","2015-05-13"
"0711.0424","Jun Fukue","Jun Fukue","Radiative Transfer in Accretion-Disk Winds","8 pages, 5 figures","Publ.Astron.Soc.Jap.59:687,2007","10.1093/pasj/59.3.687",,"astro-ph",,"  Radiative transfer equation in an accretion disk wind is examined
analytically and numerically under the plane-parallel approximation in the
subrelativistic regime of $(v/c)^1$, where $v$ is the wind vertical velocity.
Emergent intensity is analytically obtained for the case of a large optical
depth, where the flow speed and the source function are almost constant. The
usual limb-darkening effect, which depends on the direction cosine at the
zero-optical depth surface, does not appear, since the source function is
constant. Because of the vertical motion of winds, however, the emergent
intensity exhibits the {\it velocity-dependent} limb-darkening effect, which
comes from the Doppler and aberration effects. Radiative moments and emergent
intensity are also numerically obtained. When the flow speed is small ($v \leq
0.1c$), the radiative structure resembles to that of the static atmosphere,
where the source function is proportional to the optical depth, and the usual
limb-darkening effect exists. When the flow speed becomes large, on the other
hand, the flow speed attains the constant terminal one, and the
velocity-dependent limb-darkening effect appears. We thus carefully treat and
estimate the wind luminosity and limb-darkening effect, when we observe an
accretion disk wind.
","[{""version"":""v1"",""created"":""Sat, 3 Nov 2007 04:06:47 GMT""}]","2015-05-13"
"0711.0425","Leo Radzihovsky","Leo Radzihovsky, Peter B. Weichman, Jae I. Park","Superfluidity and phase transitions in a resonant Bose gas","55 pages, 18 eps figures, submitted to Annals of Physics","Annals of Physics 323, 2376-2451 (2008)","10.1016/j.aop.2008.05.008",,"cond-mat.supr-con cond-mat.stat-mech",,"  The atomic Bose gas is studied across a Feshbach resonance, mapping out its
phase diagram, and computing its thermodynamics and excitation spectra. It is
shown that such a degenerate gas admits two distinct atomic and molecular
superfluid phases, with the latter distinguished by the absence of atomic
off-diagonal long-range order, gapped atomic excitations, and deconfined atomic
pi-vortices. The properties of the molecular superfluid are explored, and it is
shown that across a Feshbach resonance it undergoes a quantum Ising transition
to the atomic superfluid, where both atoms and molecules are condensed. In
addition to its distinct thermodynamic signatures and deconfined half-vortices,
in a trap a molecular superfluid should be identifiable by the absence of an
atomic condensate peak and the presence of a molecular one.
","[{""version"":""v1"",""created"":""Sat, 3 Nov 2007 04:35:55 GMT""}]","2009-11-13"
"0711.0426","Rituparno Goswami","Pankaj S. Joshi and Rituparno Goswami","On trapped surface formation in gravitational collapse II",,,"10.1088/0264-9381/24/11/009",,"gr-qc astro-ph hep-th",,"  Further to our consideration on trapped surfaces in gravitational collapse,
where pressures were allowed to be negative while satisfying weak energy
condition to avoid trapped surface formation, we discuss here several other
attempts of similar nature in this direction. Certain astrophysical aspects are
pointed out towards examining the physical realization of such a possibility in
realistic gravitational collapse.
","[{""version"":""v1"",""created"":""Sat, 3 Nov 2007 05:02:42 GMT""}]","2015-06-30"
"0711.0427","Hitoshi Miura","Hitoshi Miura, Seiji Yasuda, Taishi Nakamoto","Fragment-collision model for compound chondrule formation: Estimation of
  collision probability","Accepted for publication in Icarus, 34 pages, including 8 figures",,"10.1016/j.icarus.2007.11.005",,"astro-ph",,"  We propose a new scenario for compound chondrule formation named as
""fragment-collision model,"" in the framework of the shock-wave heating model. A
molten cm-sized dust particle (parent) is disrupted in the high-velocity gas
flow. The extracted fragments (ejectors) are scattered behind the parent and
the mutual collisions between them will occur. We modeled the disruption event
by analytic considerations in order to estimate the probability of the mutual
collisions assuming that all ejectors have the same radius. We found that the
estimated collision probability, which is the probability of collisions
experienced by an ejector in one disruption event, can account for the observed
fraction of compound chondrules. In addition, the model predictions are
qualitatively consistent with other observational data (oxygen isotopic
composition, textural types, and size ratios of constituents). Based on these
results, we concluded that this new model can be one of the strongest
candidates for the compound chondrule formation.
  It should be noted that all collisions do not necessarily lead to the
compound chondrule formation. The formation efficiency and the future works
which should be investigated in the forthcoming paper are also discussed.
","[{""version"":""v1"",""created"":""Sat, 3 Nov 2007 05:29:43 GMT""}]","2009-11-13"
"0711.0428","Joseph Samuel","Joseph Samuel and Sutirtha Roy Chowdhury","Geometric flows and black hole entropy","11 pages, no figures","Class.Quant.Grav.24:F47-F54,2007","10.1088/0264-9381/24/11/F01",,"gr-qc",,"  Perelman has given a gradient formulation for the Ricci flow, introducing an
``entropy function'' which increases monotonically along the flow.We pursue a
thermodynamic analogy and apply Ricci flow ideas to general relativity. We
investigate whether Perelman's entropy is related to
(Bekenstein-Hawking)geometric entropy as familiar from black hole
thermodynamics. From a study of the fixed points of the flow we conclude that
Perelman entropy is not connected to geometric entropy. However, we notice that
there is a very similar flow which DOES appear to be connected to geometric
entropy. The new flow may find applications in black hole physics suggesting
for instance, new approaches to the Penrose inequality.
","[{""version"":""v1"",""created"":""Sat, 3 Nov 2007 05:34:51 GMT""}]","2008-11-26"
"0711.0429","Andreea Nicoara","Andreea C. Nicoara","Equivalence of types and Catlin boundary systems","Paper withdrawn by the author due to the fact that a Catlin type
  truncation that is used in the argument may lose finite type, in which case
  the Levi determinant could be identically zero in the domain of the
  truncation. An example of this kind and the proof that the Levi determinant
  only vanishes to an effective order for smooth domains of finite type appears
  in arXiv:1102.0356",,,,"math.CV math.AG",,"  The D'Angelo finite type is shown to be equivalent to the Kohn finite ideal
type on smooth, pseudoconvex domains in complex n space. This is known as the
Kohn Conjecture. The argument uses Catlin's notion of a boundary system as well
as methods from subanalytic and semialgebraic geometry. When a subset of the
boundary contains only two level sets of the Catlin multitype, a lower bound
for the subelliptic gain in the \bar\partial-Neumann problem is obtained in
terms of the D'Angelo type, the dimension of the ambient space, and the level
of forms.
","[{""version"":""v1"",""created"":""Sat, 3 Nov 2007 06:02:48 GMT""},{""version"":""v2"",""created"":""Thu, 15 Aug 2013 05:40:01 GMT""}]","2013-08-16"
"0711.0430","Joseph Samuel","Joseph Samuel and Sutirtha Roy Chowdhury","Energy, entropy and the Ricci flow","24 pages, two figures, paper improved in response to referees'
  comments, to appear in Classical and Quantum Gravity","Class.Quant.Grav.25:035012,2008","10.1088/0264-9381/25/3/035012",,"gr-qc",,"  The Ricci flow is a heat equation for metrics, which has recently been used
to study the topology of closed three manifolds. In this paper we apply Ricci
flow techniques to general relativity. We view a three dimensional
asymptotically flat Riemannian metric as a time symmetric initial data set for
Einstein's equations. We study the evolution of the area A and Hawking mass M
of a two dimensional closed surface under the Ricci flow. The physical
relevance of our study derives from the fact that, in general relativity the
area of apparent horizons is related to black hole entropy and the Hawking mass
of an asymptotic round 2-sphere is the ADM energy.We begin by considering the
special case of spherical symmetry to develop a physical feel for the geometric
quantities involved. We then consider a general asymptotically flat Riemannian
metric and derive an inequality which relates the evolution of the area of a
closed surface S to its Hawking mass. We suggest that there may be a maximum
principle which governs the long term existence of the asymptotically flat
Ricci flow.
","[{""version"":""v1"",""created"":""Sat, 3 Nov 2007 05:48:27 GMT""},{""version"":""v2"",""created"":""Tue, 18 Dec 2007 08:05:42 GMT""}]","2008-11-26"
"0711.0431","Harikumar E","Ajith K. M., E. Harikumar and M. Sivakumar","Bose-Fermi Equivalence in Three Dimensional Non-commutative Space-Time","10 pages, reoraganised the paper, removed one section","Mod.Phys.Lett.A23:3015-3022,2008","10.1142/S0217732308026868",,"hep-th",,"  We study the Fermionisation of Seiberg-Witten mapped action (to order
$\theta$) of the $\lambda\phi^{4}$ theory coupled minimally with U(1) gauge
field governed by Chern-Simon action. Starting from the corresponding partition
function we derive non-perturbatively (in coupling constant) the partition
function of the spin 1/2 theory following Polyakov spin factor formalism. We
find the dual interacting fermionic theory is non local. This feature persist
also in the limit of vanishing self coupling. In $\theta\to 0$ limit, the
commutative result is regained.
","[{""version"":""v1"",""created"":""Sat, 3 Nov 2007 06:31:58 GMT""},{""version"":""v2"",""created"":""Wed, 6 Feb 2008 04:38:20 GMT""}]","2009-05-20"
"0711.0432","Wei Wang","Wei Wang, Run-Hui Li and Cai-Dian L\""u","Radiative charmless B_{(s)}\to V \gamma and B_{(s)}\to A \gamma decays
  in pQCD approach","54 pages, 9 figures. Typos are corrected and more references are
  added",,,,"hep-ph hep-ex",,"  We study the radiative charmless $B_{(s)}\to V(A)\gamma $ decays in
perturbative QCD (pQCD) approach to the leading order in $\alpha_s$ (here $V$
and $A$ denotes vector mesons and two kinds of axial-vector mesons: $^3P_1$ and
$^1P_1$ states, respectively.). Our predictions of branching ratios are
consistent with the current available experimental data. We update all
$B_{(s)}\to V$ form factors and give the predictions for $B\to A$ form factors
using the recent hadronic inputs. In addition to the dominant factorizable
spectator diagrams, which is form factor like, we also calculate the so-called
``power suppressed'' annihilation type diagrams, the gluonic penguin, charming
penguin, and two photon diagrams. These diagrams give the main contributions to
direct CP asymmetries, mixing-induced CP asymmetry variables, the isospin
asymmetry and U-spin asymmetry variables. Unlike the branching ratios, these
ratios or observables possess higher theoretical precision in our pQCD
calculation, since they do not depend on the input hadronic parameters too
much. Most of the results still need experimental tests in the on-going and
forthcoming experiments.
","[{""version"":""v1"",""created"":""Sat, 3 Nov 2007 06:34:12 GMT""},{""version"":""v2"",""created"":""Thu, 8 Nov 2007 09:19:18 GMT""}]","2007-11-08"
"0711.0433","Philip Evans","P. A. Evans, L.G. Tyler, A.P. Beardmore and J. P. Osborne (University
  of Leicester)","Automatic analysis of Swift-XRT data","4 pages, 2 figures, to appear in the proceedings of ADASS XVII (ASP
  Conference Series)",,,,"astro-ph",,"  The Swift spacecraft detects and autonomously observes ~100 Gamma Ray Bursts
(GRBs) per year, ~96% of which are detected by the X-ray telescope (XRT). GRBs
are accompanied by optical transients and the field of ground-based follow-up
of GRBs has expanded significantly over the last few years, with rapid response
instruments capable of responding to Swift triggers on timescales of minutes.
To make the most efficient use of limited telescope time, follow-up astronomers
need accurate positions of GRBs as soon as possible after the trigger.
Additionally, information such as the X-ray light curve, is of interest when
considering observing strategy. The Swift team at Leicester University have
developed techniques to improve the accuracy of the GRB positions available
from the XRT, and to produce science-grade X-ray light curves of GRBs. These
techniques are fully automated, and are executed as soon as data are available.
","[{""version"":""v1"",""created"":""Sat, 3 Nov 2007 07:17:08 GMT""}]","2007-11-06"
"0711.0434","Takehiko Yasuda","Takehiko Yasuda","Non-adic formal schemes","47 pages, This is a totally revised version of math.AG/0602542",,,,"math.AG",,"  Our purpose is to make a contribution to the foundation of the theory of
formal scheme. We are interested particularly in non-Noetherian or non-adic
formal schemes, which have been little studied. We redefine the formal scheme
as a proringed space and study its basic properties. We also find several
examples of non-adic formal schemes.
","[{""version"":""v1"",""created"":""Sat, 3 Nov 2007 07:35:06 GMT""}]","2007-11-06"
"0711.0435","Thierry Appourchaux","T.Appourchaux","Bayesian approach for g-mode detection, or how to restrict our
  imagination","5 pages, 6 figures",,"10.1002/asna.200710981",,"astro-ph",,"  Nowadays, g-mode detection is based upon a priori theoretical knowledge. By
doing so, detection becomes more restricted to what we can imagine. De facto,
the universe of possibilities is made narrower. Such an approach is pertinent
for Bayesian statisticians. Examples of how Bayesian inferences can be applied
to spectral analysis and helioseismic power spectra are given. Our intention is
not to give the full statistical framework (much too ambitious) but to provide
an appetizer for going further in the direction of a proper Bayesian inference,
especially for detecting gravity modes.
","[{""version"":""v1"",""created"":""Sat, 3 Nov 2007 08:00:50 GMT""}]","2009-11-13"
"0711.0436","Ewa Krot-Sieniawska","Ewa Krot-Sieniawska","An example of algebraization of analysis and Fibonacci cobweb poset
  characterization","16 pages, submitted to publication",,,,"math.CO cs.DM math.GM",,"  In recent Kwasniewski's papers inspired by O. V. Viskov it was shown that the
$\psi$-calculus in parts appears to be almost automatic, natural extension of
classical operator calculus of Rota - Mullin or equivalently - of umbral
calculus of Roman and Rota. At the same time this calculus is an example of the
algebraization of the analysis - here restricted to the algebra of polynomials.
The first part of the article is the review of the recent author's
contribution. The main definitions and theorems of Finite Fibonomial
  Operator Calculus which is a special case of $\psi$-extented Rota's finite
operator calculus are presented there. In the second part the characterization
of Fibonacci Cobweb poset P as DAG and oDAG is given. The dim 2 poset such that
its Hasse diagram coincide with digraf of P is constructed.
","[{""version"":""v1"",""created"":""Sat, 3 Nov 2007 08:33:10 GMT""}]","2008-02-09"
"0711.0437","W. J. de Wit","W.J. de Wit, M.G. Hoare, R.D. Oudmaijer, J.C. Mottram (University of
  Leeds)","VLTI/MIDI 10 micron interferometry of the forming massive star W33A","4 pages, 4 figures. Accepted for ApJ letters",,"10.1086/525253",,"astro-ph",,"  We report on resolved interferometric observations with VLTI/MIDI of the
massive young stellar object (MYSO) W33A. The MIDI observations deliver
spectrally dispersed visibilities with values between 0.03 and 0.06, for a
baseline of 45m over the wavelength range 8-13 micron. The visibilities
indicate that W33A has a FWHM size of approximately 120AU (0.030'') at 8 micron
which increases to 240AU at 13 micron, scales previously unexplored among
MYSOs. This observed trend is consistent with the temperature falling off with
distance. 1D dust radiative transfer models are simultaneously fit to the
visibility spectrum, the strong silicate feature and the shape of the mid
infrared spectral energy distribution (SED). For any powerlaw density
distribution, we find that the sizes (as implied by the visibilities) and the
stellar luminosity are incompatible. A reduction to a third of W33A's
previously adopted luminosity is required to match the visibilities; such a
reduction is consistent with new high resolution 70 micron data from Spitzer's
MIPSGAL survey. We obtain best fits for models with shallow dust density
distributions of r^(-0.5) and r^(-1.0) and for increased optical depth in the
silicate feature produced by decreasing the ISM ratio of graphite to silicates
and using optical grain properties by Ossenkopf et al. (1992).
","[{""version"":""v1"",""created"":""Sat, 3 Nov 2007 09:07:58 GMT""}]","2009-11-13"
"0711.0438","Gintaras Valusis","D. Seliuta, B. Cechavicius, J. Kavaliauskas, G. Krivaite, I.
  Grigelionis, S. Balakauskas, G. Valusis, B. Sherliker, M. P. Halsall, M.
  Lachab, S. P. Khanna, P. Harrison, and E. H. Linfield","Terahertz detection with delta-doped GaAs/AlAs multiple quantum wells","4 pages, 2 figures; presented in the 13th International Symposium on
  Ultrafast Phenomena in Semiconductors, Vilnius",,,,"cond-mat.mtrl-sci cond-mat.other",,"  The authors demonstrate selective detection of terahertz radiation employing
beryllium delta-doped GaAs/AlAs multiple quantum wells. The sensitivity up to 1
V/W within 4.2-7.3 THz range at liquid helium temperatures is reached. The
Franz-Keldysh oscillations observed in photo- and electro-reflectance spectra
allowed one to estimate built-in electric fields in the structures studied. It
was found that the electric field strength in the cap layer region could vary
from 10 kV/cm up to 26 kV/cm, depending on the structure design and
temperature.
","[{""version"":""v1"",""created"":""Sat, 3 Nov 2007 09:25:16 GMT""}]","2007-11-06"
"0711.0439","Dragan Hajdukovic","Dragan Slavkov Hajdukovic","A new equation of state for dark energy","Improved version; submitted to Physics Letters B",,,,"physics.gen-ph","http://arxiv.org/licenses/nonexclusive-distrib/1.0/","  In the contemporary Cosmology, dark energy is modeled as a perfect fluid,
having a very simple equation of state: pressure is proportional to dark energy
density. As an alternative, I propose a more complex equation of state, with
pressure being function of three variables: dark energy density, matter density
and the size of the Universe. One consequence of the new equation is that, in
the late-time Universe, cosmological scale factor is linear function of time;
while the standard cosmology predicts an exponential function.The new equation
of state allows attributing a temperature to the physical vacuum, a temperature
proportional to the acceleration of the expansion of the Universe. The vacuum
temperature decreases with the expansion of the Universe, approaching (but
never reaching) the absolute zero.
","[{""version"":""v1"",""created"":""Sat, 3 Nov 2007 09:40:19 GMT""},{""version"":""v2"",""created"":""Tue, 4 Dec 2007 00:25:57 GMT""},{""version"":""v3"",""created"":""Wed, 26 Aug 2009 15:20:01 GMT""},{""version"":""v4"",""created"":""Wed, 4 Nov 2009 18:45:15 GMT""}]","2009-11-04"
"0711.0440","Youichi Yanase","Youichi Yanase and Manfred Sigrist","Magnetic Properties in Non-centrosymmetric Superconductors with and
  without Antiferromagnetic Order","To appear in J. Phys. Soc. Jpn. (2007) No.12",,"10.1143/JPSJ.76.124709",,"cond-mat.supr-con cond-mat.str-el",,"  The paramagnetic properties in non-centrosymmetric superconductors with and
without antiferromagnetic (AFM) order are investigated with focus on the heavy
Fermion superconductors, CePt_3Si, CeRhSi_3 and CeIrSi_3. First, we investigate
the spin susceptibility in the linear response regime and elucidate the role of
AFM order. The spin susceptibility at T=0 is independent of the pairing
symmetry and increases in the AFM state. Second, the non-linear response to the
magnetic field are investigated on the basis of an effective model for CePt_3Si
which may be also applicable to CeRhSi_3 and CeIrSi_3. The role of
antisymmetric spin-orbit coupling (ASOC), helical superconductivity,
anisotropic Fermi surfaces and AFM order are examined in the dominantly s-, p-
and d-wave states. We emphasize the qualitatively important role of the mixing
of superconducting (SC) order parameters in the p-wave state which enhances the
spin susceptibility and suppresses paramagnetic depairing effect in a
significant way. Therefore, the dominantly p-wave superconductivity admixed
with the s-wave order parameter is consistent with the paramagnetic properties
of CePt_3Si at ambient pressure. We propose some experiments which can
elucidate the novel pairing states in CePt_3Si as well as CeRhSi_3 and
CeIrSi_3.
","[{""version"":""v1"",""created"":""Sat, 3 Nov 2007 10:11:28 GMT""}]","2009-11-13"
"0711.0441","Jakob Palmkvist","Jakob Palmkvist","Generalized conformal realizations of Kac-Moody algebras","24 pages, v2: abstract and introduction rewritten, contents
  rearranged, former section 4 moved to an appendix","J.Math.Phys.50:013532,2009","10.1063/1.3063628",,"hep-th math.RA","http://arxiv.org/licenses/nonexclusive-distrib/1.0/","  We present a construction which associates an infinite sequence of Kac-Moody
algebras, labeled by a positive integer n, to one single Jordan algebra. For
n=1, this reduces to the well known Kantor-Koecher-Tits construction. Our
generalization utilizes a new relation between different generalized Jordan
triple systems, together with their known connections to Jordan and Lie
algebras. Applied to the Jordan algebra of hermitian 3x3 matrices over the
division algebras R, C, H, O, the construction gives the exceptional Lie
algebras f4, e6, e7, e8 for n=2. Moreover, we obtain their infinite-dimensional
extensions for n greater or equal to 3. In the case of 2x2 matrices the
resulting Lie algebras are of the form so(p+n,q+n) and the concomitant
nonlinear realization generalizes the conformal transformations in a spacetime
of signature (p,q).
","[{""version"":""v1"",""created"":""Sat, 3 Nov 2007 10:09:31 GMT""},{""version"":""v2"",""created"":""Mon, 17 Nov 2008 17:39:50 GMT""}]","2009-02-10"
"0711.0442","Jens Eggers","Jens Eggers and Marco A. Fontelos","A catalogue of singularities",,,,,"math.AP math.DS",,"  This paper is an attempt to classify finite-time singularities of PDEs. Most
of the problems considered describe free-surface flows, which are easily
observed experimentally. We consider problems where the singularity occurs at a
point, and where typical scales of the solution shrink to zero as the
singularity is approached. Upon a similarity transformation, exact self-similar
behaviour is mapped to the fixed point of a {\it infinite dimensional dynamical
system} representing the original dynamics. We show that the dynamics close to
the fixed point is a useful way classifying the structure of the singularity.
Specifically, we consider various types of stable and unstable fixed points,
centre-manifold dynamics, limit cycles, and chaotic dynamics.
","[{""version"":""v1"",""created"":""Sat, 3 Nov 2007 10:48:15 GMT""}]","2007-11-06"
"0711.0443","Miao Kang","Miao Kang, Nana Pan, Xiaodong Wang","Deconfinement Phase Transition Heating and Thermal Evolution of Neutron
  Stars","4 pages, to be published by American Institute of Physics, ed. D.Lai,
  X.D.Li and Y.F.Yuan, as the Proceedings of the conference Astrophysics of
  Compact Objects","AIPConf.Proc.968:203-205,2008","10.1063/1.2840397",,"astro-ph",,"  The deconfinement phase transition will lead to the release of latent heat
during spins down of neutron stars if the transition is the first-order one.We
have investigated the thermal evolution of neutron stars undergoing such
deconfinement phase transition. The results show that neutron stars may be
heated to higher temperature.This feature could be particularly interesting for
high temperature of low-magnetic field millisecond pulsar at late stage.
","[{""version"":""v1"",""created"":""Sat, 3 Nov 2007 12:54:32 GMT""},{""version"":""v2"",""created"":""Thu, 8 Nov 2007 06:39:58 GMT""}]","2008-11-26"
