"0711.0374","Suman Kumar Banik","Jyotipratim Ray Chaudhuri, Debashis Barik, and Suman Kumar Banik","Directed motion generated by heat bath nonlinearly driven by external
  noise","10 pages, 2 figures, iopart.cls included","J. Phys. A: Math. Theor. 40, 14715 (2007)","10.1088/1751-8113/40/49/007",,"cond-mat.stat-mech cond-mat.soft",,"  Based on the system heat bath approach where the bath is nonlinearly
modulated by an external Gaussian random force, we propose a new microscopic
model to study directed motion in the overdamped limit for a nonequilibrium
open system. Making use of the coupling between the heat bath and the external
modulation as a small perturbation we construct a Langevin equation with
multiplicative noise and space dependent dissipation and the corresponding
Fokker-Planck-Smoluchowski equation in the overdamped limit. We examine the
thermodynamic consistency condition and explore the possibility of observing a
phase induced current as a consequence of state dependent diffusion and,
necessarily, nonlinear driving of the heat bath by the external noise.
","[{""version"":""v1"",""created"":""Fri, 2 Nov 2007 18:58:48 GMT""}]","2007-12-11"
"0711.0375","Ricardo Carretero","R. Carretero-Gonzalez, B.P. Anderson, P.G. Kevrekidis, D.J.
  Frantzeskakis, and C.N. Weiler","Dynamics of Vortex Formation in Merging Bose-Einstein Condensate
  Fragments","11 pages, 11 figures (low res), submitted to Phys. Rev. A. November
  2007 Full resolution preprint available at:
  http://www-rohan.sdsu.edu/~rcarrete/publications/","Phys. Rev. A 77 (2008) 033625","10.1103/PhysRevA.77.033625",,"cond-mat.other",,"  We study the formation of vortices in a Bose-Einstein condensate (BEC) that
has been prepared by allowing isolated and independent condensed fragments to
merge together. We focus on the experimental setup of Scherer {\it et al.}
[Phys. Rev. Lett. {\bf 98}, 110402 (2007)], where three BECs are created in a
magnetic trap that is segmented into three regions by a repulsive optical
potential; the BECs merge together as the optical potential is removed. First,
we study the two-dimensional case, in particular we examine the effects of the
relative phases of the different fragments and the removal rate of the optical
potential on the vortex formation. We find that many vortices are created by
instant removal of the optical potential regardless of relative phases, and
that fewer vortices are created if the intensity of the optical potential is
gradually ramped down and the condensed fragments gradually merge. In all
cases, self-annihilation of vortices of opposite charge is observed. We also
find that for sufficiently long barrier ramp times, the initial relative phases
between the fragments leave a clear imprint on the resulting topological
configuration. Finally, we study the three-dimensional system and the formation
of vortex lines and vortex rings due to the merger of the BEC fragments; our
results illustrate how the relevant vorticity is manifested for appropriate
phase differences, as well as how it may be masked by the planar projections
observed experimentally.
","[{""version"":""v1"",""created"":""Fri, 2 Nov 2007 19:14:50 GMT""}]","2010-12-10"
"0711.0376","Eugeny Babichev","E. Babichev","Gauge k-vortices","8 pages, 2 figures","Phys.Rev.D77:065021,2008","10.1103/PhysRevD.77.065021",,"hep-th astro-ph hep-ph",,"  We consider gauge vortices in symmetry breaking models with a non-canonical
kinetic term. This work extends our previous study on global topological
k-defects (hep-th/0608071), including a gauge field. The model consists of a
scalar field with a non-canonical kinetic term, while for the gauge field the
standard form of its kinetic term is preserved. Topological defects arising in
such models, k-vortices, may have quite different properties as compared to
``standard'' vortices. This happens because an additional dimensional parameter
enters the Lagrangian for the considered model -- a ``kinetic'' mass. We
briefly discuss possible consequences for cosmology, in particular, the
formation of cosmic strings during phase transitions in the early universe and
their properties.
","[{""version"":""v1"",""created"":""Fri, 2 Nov 2007 19:19:48 GMT""},{""version"":""v2"",""created"":""Sun, 11 Nov 2007 14:35:39 GMT""}]","2008-11-26"
"0711.0377","Patrick Massot","Patrick Massot","Geodesible contact structures on 3--manifolds","49 pages, 6 figures. v2 includes referee's suggestions, adds some
  references and discussions, corrects small inaccuracies, minor exposition
  improvements. this is almost the published version","Geom. Topol. 12 (2008) 1729-1776","10.2140/gt.2008.12.1729",,"math.GT math.SG","http://arxiv.org/licenses/nonexclusive-distrib/1.0/","  In this paper, we study and almost completely classify contact structures on
closed 3--manifolds which are totally geodesic for some Riemannian metric. Due
to previously known results, this amounts to classifying contact structures on
Seifert manifolds which are transverse to the fibers. Actually, we obtain the
complete classification of contact structures with negative (maximal) twisting
number (which includes the transverse ones) on Seifert manifolds whose base is
not a sphere, as well as partial results in the spherical case.
","[{""version"":""v1"",""created"":""Fri, 2 Nov 2007 19:54:27 GMT""},{""version"":""v2"",""created"":""Mon, 28 Jul 2008 19:35:13 GMT""}]","2014-11-11"
"0711.0378","Allen Shafter","A. W. Shafter and R. M. Quimby","M31N-2007-06b: A Nova in the M31 Globular Cluster Bol 111","Accepted for publication in ApJ Letters",,"10.1086/525254",,"astro-ph",,"  We report spectroscopic observations of the nova M31N-2007-06b, which was
found to be spatially coincident with the M31 globular cluster Bol 111. This
nova is the first out of more than 700 discovered in M31 over the past century
to be associated with one of the galaxy's globular clusters. A total of three
spectra of the nova were obtained 3, 6, and 36 days post discovery. The data
reveal broad (FWHM ~3000 km/s) Balmer, NII, and NIII emission lines, and show
that the nova belongs to the He/N spectroscopic class. The He/N class of novae
are relatively rare, making up roughly 15% of the novae with measured spectra
in M31, and roughly 20-25% of the Galactic novae for which spectroscopic data
are available. The implications of a nova, particularly an He/N nova, occurring
in a globular cluster are discussed.
","[{""version"":""v1"",""created"":""Fri, 2 Nov 2007 19:30:24 GMT""}]","2009-11-13"
"0711.0379","Wes Campbell","Wesley C. Campbell, Gerrit C. Groenenboom, Hsin-I Lu, Edem Tsikata,
  John M. Doyle","Time-Domain Measurement of Spontaneous Vibrational Decay of Magnetically
  Trapped NH","10 pages + 3 figures (11 pages total) v2 has minor corrections and
  explanations accepted for publication in PRL","Phys. Rev. Lett. 100, 083003 (2008)","10.1103/PhysRevLett.100.083003",,"physics.atom-ph physics.ao-ph",,"  The v = 1 -> 0 radiative lifetime of NH (X triplet-Sigma-, v=1,N=0) is
determined to be tau_rad,exp. = 37.0 +/- 0.5 stat +2.0 / -0.8 sys miliseconds,
corresponding to a transition dipole moment of |mu_10| = 0.0540 + 0.0009 /
-0.0018 Debye. To achieve the long observation times necessary for direct
time-domain measurement, vibrationally excited NH (X triplet-Sigma-, v=1,N=0)
radicals are magnetically trapped using helium buffer-gas loading. Simultaneous
trapping and lifetime measurement of both the NH(v=1, N=0) and NH(v=0,N=0)
populations allows for accurate extraction of tau_rad,exp. Background helium
atoms are present during our measurement of tau_rad,exp., and the rate constant
for helium atom induced collisional quenching of NH(v=1,N=0) was determined to
be k_q < 3.9 * 10^-15 cm^3/s. This bound on k_q yields the quoted systematic
uncertainty on tau_rad,exp. Using an ab initio dipole moment function and an
RKR potential, we also determine a theoretical value of 36.99 ms for this
lifetime, in agreement with our experimental value. Our results provide an
independent determination of tau_rad,10, test molecular theory, and furthermore
demonstrate the efficacy of buffer-gas loading and trapping in determining
metastable radiative and collisional lifetimes.
","[{""version"":""v1"",""created"":""Fri, 2 Nov 2007 19:32:31 GMT""},{""version"":""v2"",""created"":""Sat, 19 Jan 2008 20:08:27 GMT""}]","2009-11-13"
"0711.0380","Gabor Furesz","Gabor Furesz, Lee W. Hartmann, Andrew H. Szentgyorgyi, Naomi A. Ridge,
  Luisa Rebull, John Stauffer, David W. Latham, Maureen A. Conroy, Daniel G.
  Fabricant, John Roll","Kinematics of NGC 2264: signs of cluster formation","15 pages, 7 figures, 4 tables","Astrophys.J.648:1090-1098,2006","10.1086/506140",,"astro-ph",,"  We present results from 1078 high resolution spectra of 990 stars in the
young open cluster NGC 2264, obtained with the Hectochelle multiobject echelle
spectrograph on the 6.5m MMT. We confirm 471 stars as members, based on their
radial velocity and/or H-alpha emission. The radial velocity distribution of
cluster members is non-Gaussian with a dispersion of approx 3.5 km/s. We find a
substantial north-south velocity gradient and spatially coherent structure
inthe radial velocity distribution, similar to that seen in the molecular gas
in the region. Our results suggest that there are at least three
distinguishable subclusters in NGC 2264, correlated with similar structure seen
in 13CO emission, which is likely to be a remnant of initial structure in this
very young cluster. We propose that this substructure is the result of
gravitational amplification of initial inhomogeneities during overall collapse
to a filamentary distribution of gas and stars, as found in simulations by
Burkert & Hartman (2004).
","[{""version"":""v1"",""created"":""Fri, 2 Nov 2007 19:45:25 GMT""},{""version"":""v2"",""created"":""Mon, 5 Nov 2007 13:42:26 GMT""}]","2010-11-11"
"0711.0381","Maren Daraktchiev","M. Daraktchiev, B. Van de Moortele, R. Schaller, E. Couteau, L. Forro","Effects of carbon nanotubes on grain boundary sliding in zirconia
  polycrystals","12 pages, 4 figures","Advanced Materials 17 (2005) 88-91",,,"cond-mat.mtrl-sci",,"  Mechanical properties of zirconia polycrystals decrease drastically at high
temperature due to thermally activated grain boundary (GB) sliding, leading to
plastic or even super-plastic deformation. As GB sliding is a source of energy
dissipation in the material, mechanical loss measurements are well suited to
study such a mechanism. They reveal, in general, a mechanical loss peak, which
evolves into an exponential increase at higher temperature. When intergranular
glassy films or/and amorphous pockets are presented in polycrystalline
ceramics, the mechanical loss is globally higher and so is the creep rate. Here
we show that introducing carbon nanotubes in zirconia, in particular, reduces
drastically GB sliding and consequently the mechanical loss at high
temperature. The nanotubes were observed at the grain boundaries by
high-resolution transmission electron microscopy and were related to the
reduction of superplasic flow through the boundaries, which should improve the
material creep resistance.
","[{""version"":""v1"",""created"":""Fri, 2 Nov 2007 19:45:33 GMT""}]","2007-11-05"
"0711.0384","Franz Elsner","F. Elsner (1,2), G. Feulner (1,3,4), U. Hopp (1,3) ((1)
  Universitaets-Sternwarte Muenchen, (2) Max-Planck-Institut fuer Astrophysik,
  Garching, (3) Max-Planck-Institut fuer extraterrestrische Physik, Garching,
  (4) Potsdam-Institut fuer Klimafolgenforschung)","The impact of Spitzer infrared data on stellar mass estimates - and a
  revised galaxy stellar mass function at 0 < z < 5","10 pages, 18 figures. Accepted for publication in A&A; replaced to
  match journal version after language editing","Astron.Astrophys. 477 (2008) 503-512","10.1051/0004-6361:20078343",,"astro-ph",,"  Aims: We estimate stellar masses of galaxies in the high redshift universe
with the intention of determining the influence of newly available Spitzer/IRAC
infrared data on the analysis. Based on the results, we probe the mass assembly
history of the universe.
  Methods: We use the GOODS-MUSIC catalog, which provides multiband photometry
from the U--filter to the 8 mum Spitzer band for almost 15,000 galaxies with
either spectroscopic (for ~7 % of the sample) or photometric redshifts, and
apply a standard model fitting technique to estimate stellar masses. We then
repeat our calculations with fixed photometric redshifts excluding Spitzer
photometry and directly compare the outcomes to look for systematic deviations.
Finally we use our results to compute stellar mass functions and mass densities
up to redshift z = 5.
  Results: We find that stellar masses tend to be overestimated on average if
further constraining Spitzer data are not included into the analysis. Whilst
this trend is small up to intermediate redshifts z < 2.5 and falls within the
typical error in mass, the deviation increases strongly for higher redshifts
and reaches a maximum of a factor of three at redshift z = 3.5. Thus, up to
intermediate redshifts, results for stellar mass density are in good agreement
with values taken from literature calculated without additional Spitzer
photometry. At higher redshifts, however, we find a systematic trend towards
lower mass densities if Spitzer/IRAC data are included.
","[{""version"":""v1"",""created"":""Fri, 2 Nov 2007 20:00:34 GMT""},{""version"":""v2"",""created"":""Mon, 12 Nov 2007 14:04:36 GMT""}]","2009-11-13"
"0711.0386","Zurab Kakushadze","Zurab Kakushadze","Massless Limit of Gravitational Higgs Mechanism","16 pages, minor misprints corrected; to appear in a special issue of
  IJGMMP","Int.J.Geom.Meth.Mod.Phys.05:157-170,2008","10.1142/S0219887808002680",,"hep-th gr-qc",,"  In gravitational Higgs mechanism graviton components acquire mass via
spontaneous diffeomorphism breaking by scalar vacuum expectation values. We
point out that in the massless limit the resulting theory is not
Einstein-Hilbert gravity (EHG) but constrained gravity (CG). Consequently,
massive solutions in the massless limit must be compared to those in CG (as
opposed to EHG). We discuss spherically symmetric solutions in this context.
The Schwarzschild solution in EHG can be coordinate-transformed such that it is
also a solution in CG. The resulting solutions are non-perturbative in the
asymptotic regime, and are reproduced in the massless limit of asymptotic
massive solutions, hence no van Dam-Veltman-Zakharov discontinuity. We point
out that higher curvature terms must be included to obtain non-singular
spherically symmetric massive solutions and discuss a suitable framework.
","[{""version"":""v1"",""created"":""Fri, 2 Nov 2007 20:03:00 GMT""},{""version"":""v2"",""created"":""Tue, 6 Nov 2007 14:51:30 GMT""},{""version"":""v3"",""created"":""Sun, 11 Nov 2007 18:04:16 GMT""},{""version"":""v4"",""created"":""Sat, 17 Nov 2007 18:39:35 GMT""}]","2008-11-26"
"0711.0388","Francois Molino","Sylvain B\'enito (INRIA Futurs, MAB), Charles-Henri Bruneau (INRIA
  Futurs, MAB), Thierry Colin (INRIA Futurs, MAB), Cyprien Gay (CRPP, MSC),
  Fran\c{c}ois Molino (CRPP, IGF)","An elasto-visco-plastic model for immortal foams or emulsions","69 pages, 29 figures",,"10.1140/epje/i2007-10284-2",,"cond-mat.soft physics.class-ph",,"  A variety of complex fluids consist in soft, round objects (foams, emulsions,
assemblies of copolymer micelles or of multilamellar vesicles -- also known as
onions). Their dense packing induces a slight deviation from their prefered
circular or spherical shape. As a frustrated assembly of interacting bodies,
such a material evolves from one conformation to another through a succession
of discrete, topological events driven by finite external forces. As a result,
the material exhibits a finite yield threshold. The individual objects usually
evolve spontaneously (colloidal diffusion, object coalescence, molecular
diffusion), and the material properties under low or vanishing stress may alter
with time, a phenomenon known as aging. We neglect such effects to address the
simpler behaviour of (uncommon) immortal fluids: we construct a minimal, fully
tensorial, rheological model, equivalent to the (scalar) Bingham model.
Importantly, the model consistently describes the ability of such soft
materials to deform substantially in the elastic regime (be it compressible or
not) before they undergo (incompressible) plastic creep -- or viscous flow
under even higher stresses.
","[{""version"":""v1"",""created"":""Fri, 2 Nov 2007 20:15:51 GMT""}]","2009-11-13"
"0711.0389","Ian Clo\""et","W. Bentz, I. C. Clo\""et, T. Ito, A. W. Thomas, K. Yazaki","Spin dependent parton distributions and structure functions","To appear in the proceedings of the 20th European Conference on
  Few-Body Problems in Physics, Pisa, September 10-14, 2007","Few Body Syst.44:71-73,2008","10.1007/s00601-008-0259-x",,"nucl-th",,"  Nuclear parton distributions and structure functions are determined in an
effective chiral quark theory. We also discuss an extension of our model to
fragmentation functions.
","[{""version"":""v1"",""created"":""Fri, 2 Nov 2007 20:30:54 GMT""}]","2009-03-27"
"0711.0390","Omer Kavaklioglu","Omer Kavaklioglu and Baruch Schneider","On the Asymptotic Representation for Transverse Magnetic Multiple
  Scattering of Radiation by an Infinite Grating of Dielectric Circular
  Cylinders at Oblique Incidence",,,,,"math-ph math.MP",,"  In this article, we present the derivation of the asymptotic forms of the
equations corresponding to the scattering coefficients of the exterior electric
and magnetic fields of an infinite grating of insulating dielectric circular
cylinders for vertically polarized and obliquely incident plane electromagnetic
waves. Exploiting the generalized forms of the Twersky's elementary function
representations for Schloemilch series, we have deducted an Ansatz describing
the behavior of the scattering coefficients of the electric and magnetic fields
for obliquely incident waves when the grating spacing is much smaller than the
wavelength of the incident electromagnetic radiation. Introducing the statement
of this Ansatz into the equations of the scattering coefficients of the
infinite grating at oblique incidence, and expanding the scattering
coefficients in the form of an asymptotic series as a function of the ratio of
the radius of the cylinders to the grating spacing, we have acquired two new
infinite sets of algebraic equations associated with the scattering
coefficients of the exterior electric and magnetic fields of the grating for
vertically polarized and obliquely incident plane waves.
","[{""version"":""v1"",""created"":""Fri, 2 Nov 2007 20:16:37 GMT""}]","2007-11-06"
"0711.0391","Gabor Furesz","Gabor Furesz, Lee W. Hartmann, S. Thomas Megeath, Andrew H.
  Szentgyorgyi, Erika T. Hamden","Kinematic Structure of the Orion Nebula Cluster and its Surroundings","23 pages, 11 figures, 3 tables - accepted by ApJ",,"10.1086/525844",,"astro-ph",,"  We present results from 1351 high resolution spectra of 1215 stars in the
Orion Nebula Cluster (ONC) and the surrounding Orion 1c association, obtained
with the Hectochelle multiobject echelle spectrograph on the 6.5m MMT. We
confirmed 1111 stars as members, based on their radial velocity and/or H-alpha
emission. The radial velocity distribution of members shows a dispersion of 3.1
km/s. We found a substantial north-south velocity gradient and spatially
coherent structure in the radial velocity distribution, similar to that seen in
the molecular gas in the region. We also identified several binary and high
velocity stars, a region exhibiting signs of triggered star formation, and a
possible foreground population of stars somewhat older than the ONC. Stars
without infrared excesses (as detected with the IRAC instrument on the Spitzer
Space Telescope) exhibit a wider spread in radial velocity than the infrared
excess stars; this spread is mostly due to a blue-shifted population of stars
that may constitute a foreground population. We also identify some accreting
stars, based on H-alpha, that do not have detectable infrared excesses with
IRAC, and thus are potential transitional disk systems (objects with inner disk
holes). We propose that the substructure seen both in stellar and gaseous
component is the result of non-uniform gravitational collapse to a filamentary
distribution of gas. The spatial and kinematic correlation between the stellar
and gaseous components suggests the region is very young, probably only ~1
crossing time old or less to avoid shock dissipation and gravitational
interactions which would tend to destroy the correlation between stars and gas.
","[{""version"":""v1"",""created"":""Fri, 2 Nov 2007 20:30:48 GMT""}]","2009-11-13"
"0711.0392","Ian Clo\""et","W. Bentz, I. C. Clo\""et, T. Ito, A. W. Thomas, K. Yazaki","Polarized structure functions of nucleons and nuclei","To appear in the proceedings of Quarks in Hadrons and Nuclei, Erice,
  16-24 September 2007","Prog.Part.Nucl.Phys.61:238-244,2008","10.1016/j.ppnp.2007.12.021",,"nucl-th",,"  We determine the quark distributions and structure functions for both
unpolarized and polarized DIS of leptons on nucleons and nuclei. The scalar and
vector mean fields in the nucleus modify the motion of the quarks inside the
nucleons. By taking into account this medium modification, we are able to
reproduce the experimental data on the unpolarized EMC effect, and to make
predictions for the polarized EMC effect. We discuss examples of nuclei where
the polarized EMC effect could be measured. We finally present an extension of
our model to describe fragmentation functions.
","[{""version"":""v1"",""created"":""Fri, 2 Nov 2007 21:26:04 GMT""}]","2008-11-26"
"0711.0393","Russell Lyons","Russell Lyons, Mika\""el Pichot, St\'ephane Vassout","Uniform non-amenability, cost, and the first l^2-Betti number","17 pp","Geometry, Groups, and Dynamics 2 (2008), 595-617.",,,"math.GR math.DS",,"  It is shown that $2\beta_1(\G)\leq h(\G)$ for any countable group $\G$, where
$\beta_1(\G)$ is the first $\ell^2$-Betti number and $h(\G)$ the uniform
isoperimetric constant. In particular, a countable group with non-vanishing
first $\ell^2$-Betti number is uniformly non-amenable.
  We then define isoperimetric constants in the framework of measured
equivalence relations. For an ergodic measured equivalence relation $R$ of type
$\IIi$, the uniform isoperimetric constant $h(R)$ of $R$ is invariant under
orbit equivalence and satisfies $$ 2\beta_1(R)\leq 2C(R)-2\leq h(R), $$ where
$\beta_1(\R)$ is the first $\ell^2$-Betti number and $C(R)$ the cost of $R$ in
the sense of Levitt (in particular $h(R)$ is a non-trivial invariant). In
contrast with the group case, uniformly non-amenable measured equivalence
relations of type $\IIi$ always contain non-amenable subtreeings.
  An ergodic version $h_e(\G)$ of the uniform isoperimetric constant $h(\G)$ is
defined as the infimum over all essentially free ergodic and measure preserving
actions $\alpha$ of $\G$ of the uniform isoperimetric constant $h(\R_\alpha)$
of the equivalence relation $R_\alpha$ associated to $\alpha$. By establishing
a connection with the cost of measure-preserving equivalence relations, we
prove that $h_e(\G)=0$ for any lattice $\G$ in a semi-simple Lie group of real
rank at least 2 (while $h_e(\G)$ does not vanish in general).
","[{""version"":""v1"",""created"":""Fri, 2 Nov 2007 20:23:58 GMT""},{""version"":""v2"",""created"":""Thu, 15 May 2008 22:34:10 GMT""}]","2010-04-27"
"0711.0394","Gonzalo Usaj","P. S. Cornaglia, Gonzalo Usaj, and C. A. Balseiro","Electronic Transport through Magnetic Molecules with Soft Vibrating
  Modes","4 pages, 3 figures, accepted in PRB RC","Phys. Rev. B 76, 241403(R) (2007)","10.1103/PhysRevB.76.241403",,"cond-mat.str-el cond-mat.mes-hall",,"  The low-temperature transport properties of a molecule are studied in the
field-effect transitor geometry. The molecule has an internal mechanical mode
that modulates its electronic levels and renormalizes both the interactions and
the coupling to the electrodes. For a soft mechanical mode the spin
fluctuations in the molecule are dominated by the bare couplings while the
valence changes are determined by the dressed energies. In this case, the
transport properties present an anomalous behavior and the Kondo temperature
has a weak gate voltage dependence. These observations are in agreement with
recent experimental data.
","[{""version"":""v1"",""created"":""Fri, 2 Nov 2007 20:30:12 GMT""}]","2008-01-23"
"0711.0395","Alex Athey","Alex E Athey","Chandra Observations of Early-type Galaxies","Chapter IV from PhD Thesis listed below. Thesis advisor: Joel N.
  Bregman","Thesis (PhD). UNIVERSITY OF MICHIGAN, Source DAI-B 64/06, p. 2713,
  Dec 2003, 272 pages",,,"astro-ph",,"  We have performed uniform analysis of a sample of 54 nearby, early-type
galaxies observed with \emph{Chandra}. In this work we present the spectral
results for both the diffuse Interstellar Medium, ISM, and low-mass X-ray
binaries, LMXBs. We determine the metallicity of the hot ISM in the 22
brightest galaxies and find a narrow range of abundance ratios relative to
iron. The average iron metallicity of these bright galaxies is $0.96\pm0.33$
relative to solar. By assuming these enrichment patterns continue to fainter
galaxies, we are able to extend accurate ISM modeling down to the faintest
galaxies in the sample. The sample of galaxies span 4.5 orders of magnitude in
X-ray luminosity starting at $L_X=10^{38} erg \cdot s^{-1}$ and the average gas
temperature in the sample is $0.58\pm0.24 keV$. We present the X-ray properties
of these galaxies scaled to one effective radius as well as radial variations
of gas and stellar binary luminosities, and radial variations of gas
temperature, metallicity, mass, entropy and density.
","[{""version"":""v1"",""created"":""Fri, 2 Nov 2007 20:45:53 GMT""}]","2007-11-06"
