"0711.0351","Falk Unger","Falk Unger","Noise threshold for universality of 2-input gates","International Symposium on Information Theory, 2007, minor
  corrections in v2",,,,"cs.IT cs.CC math.IT","http://arxiv.org/licenses/nonexclusive-distrib/1.0/","  Evans and Pippenger showed in 1998 that noisy gates with 2 inputs are
universal for arbitrary computation (i.e. can compute any function with bounded
error), if all gates fail independently with probability epsilon and
epsilon<theta, where theta is roughly 8.856%.
  We show that formulas built from gates with 2 inputs, in which each gate
fails with probability at least theta cannot be universal. Hence, there is a
threshold on the tolerable noise for formulas with 2-input gates and it is
theta. We conjecture that the same threshold also holds for circuits.
","[{""version"":""v1"",""created"":""Fri, 2 Nov 2007 16:58:21 GMT""},{""version"":""v2"",""created"":""Sat, 6 Sep 2008 16:18:09 GMT""}]","2008-09-06"
"0711.0352","James Heitsch","Moulay-Tahar Benameur and James L. Heitsch","The Twisted Higher Harmonic Signature for Foliations",,,,,"math.KT math.DG","http://arxiv.org/licenses/nonexclusive-distrib/1.0/","  We prove that the higher harmonic signature of an even dimensional oriented
Riemannian foliation of a compact Riemannian manifold with coefficients in a
leafwise U(p,q)-flat complex bundle is a leafwise homotopy invariant. We also
prove the leafwise homotopy invariance of the twisted higher Betti classes.
Consequences for the Novikov conjecture for foliations and for groups are
investigated.
  Replaces The Higher Harmonic Signature for Foliations I: The Untwisted Case,
and contains significant improvements.
","[{""version"":""v1"",""created"":""Fri, 2 Nov 2007 16:52:59 GMT""},{""version"":""v2"",""created"":""Tue, 29 Sep 2009 19:24:08 GMT""}]","2009-09-29"
"0711.0353","Lutz K\""opke","The IceCube Collaboration","The IceCube Collaboration: contributions to the 30th International
  Cosmic Ray Conference (ICRC 2007)","166 pages",,,,"astro-ph",,"  This paper bundles 40 contributions by the IceCube collaboration that were
submitted to the 30th International Cosmic Ray Conference ICRC 2007. The
articles cover studies on cosmic rays and atmospheric neutrinos, searches for
non-localized, extraterrestrial electron, muon and tau neutrino signals, scans
for steady and intermittent neutrino point sources, searches for dark matter
candidates, magnetic monopoles and other exotic particles, improvements in
analysis techniques, as well as future detector extensions.
  The IceCube observatory will be finalized in 2011 to form a cubic-kilometer
ice-Cherenkov detector at the location of the geographic South Pole. At the
present state of construction, IceCube consists of 52 paired IceTop surface
tanks and 22 IceCube strings with a total of 1426 Digital Optical Modules
deployed at depths up to 2350 m. The observatory also integrates the 19 string
AMANDA subdetector, that was completed in 2000 and extends IceCube's reach to
lower energies. Before the deployment of IceTop, cosmic air showers were
registered with the 30 station SPASE-2 surface array.
  IceCube's low noise Digital Optical Modules are very reliable, show a uniform
response and record waveforms of arriving photons that are resolvable with
nanosecond precision over a large dynamic range. Data acquisition,
reconstruction and simulation software are running in production mode and the
analyses, profiting from the improved data quality and increased overall
sensitivity, are well under way.
","[{""version"":""v1"",""created"":""Fri, 2 Nov 2007 16:45:53 GMT""}]","2012-08-27"
"0711.0354","K. Andrea Scott","K.A. Scott and F.S. Lien","Investigations of the NS-alpha model using a lid-driven cavity flow","22 pages, 11 figures; changes to Section 2 and Section 4.2",,,,"physics.flu-dyn",,"  In this paper we investigate a subgrid model based on an anisotropic version
of the NS-$\alpha$ model using a lid-driven cavity flow at a Reynolds number of
10,000. Previously the NS-$\alpha$ model has only been used numerically in the
isotropic form. The subgrid model is developed from the Eulerian-averaged
anisotropic equations [Holm, \textit{Physica D}, v.133, pp 215-269, 1999]. It
was found that when $\alpha^{2}$ was based on the mesh numerical oscillations
developed which manifested themselves in the appearance of streamwise vortices
and a `mixing out' of the velocity profile. This is analogous to the
Craik-Leibovich mechanism, with the difference being that the oscillations here
are not physical but numerical. The problem could be traced back to the
discontinuity in $\alpha^{2}$ encountered when $\alpha^{2}=0$ on the endwalls.
An alternative definition of $\alpha^{2}$ based on velocity gradients, rather
than mesh spacing, is proposed and tested. Using this definition the results
with the model shown a significant improvement. The splitting of the downstream
wall jet, rms and shear stress profiles are correctly captured a coarse mesh.
The model is shown to predict both positive and negative energy transfer in the
jet impingement region, in qualitative agreement with DNS results.
","[{""version"":""v1"",""created"":""Fri, 2 Nov 2007 17:06:13 GMT""},{""version"":""v2"",""created"":""Tue, 18 Dec 2007 12:45:57 GMT""},{""version"":""v3"",""created"":""Sat, 23 Feb 2008 23:34:14 GMT""},{""version"":""v4"",""created"":""Thu, 22 May 2008 15:45:19 GMT""}]","2008-05-22"
"0711.0355","Kevin Leung","Kevin Leung and Martijn Marsman","Energies of ions in water and nanopores within Density Functional Theory","12 pages, 3 figures","Journal of Chemical Physics Vol. 127, No. 15, pages 154722 (19
  October 2007)","10.1063/1.2772244",,"cond-mat.mtrl-sci",,"  Accurate calculations of electrostatic potentials and treatment of substrate
polarizability are critical for predicting the permeation of ions inside
water-filled nanopores. The {\it ab initio} molecular dynamics method (AIMD),
based on Density Functional Theory (DFT), accounts for the polarizability of
materials, water, and solutes, and it should be the method of choice for
predicting accurate electrostatic energies of ions. In practice, DFT coupled
with the use of periodic boundary conditions in a charged system leads to large
energy shifts. Results obtained using different DFT packages may vary because
of the way pseudopotentials and long-range electrostatics are implemented.
Using maximally localized Wannier functions, we apply robust corrections that
yield relatively unambiguous ion energies in select molecular and aqueous
systems and inside carbon nanotubes. Large binding energies are predicted for
ions in metallic carbon nanotube arrays, while with consistent definitions
Na$^+$ and Cl$^-$ energies are found to exhibit asymmetries comparable with
those computed using non-polarizable water force fields.
","[{""version"":""v1"",""created"":""Fri, 2 Nov 2007 17:13:46 GMT""}]","2007-11-05"
"0711.0356","Serge Burckel","Serge Burckel","Data Transmission in the Fourth Dimension","6 pages ; 5 figures",,,,"physics.gen-ph",,"  Alice wants to send an arbitrary binary word to Bob. We show here that there
is no problem for her to do that with only two bits. Of course, we consider
here information like a signal in 4D.
","[{""version"":""v1"",""created"":""Fri, 2 Nov 2007 17:13:58 GMT""}]","2007-11-05"
"0711.0357","Harry Warren","Harry P. Warren, Ignacio Ugarte-Urra, David H. Brooks, Jonathan W.
  Cirtain, David R. Williams, Hirohisa Harra","Observations of Transient Active Region Heating with Hinode",,,"10.1093/pasj/59.sp3.S675",,"astro-ph",,"  We present observations of transient active region heating events observed
with the Extreme Ultraviolet Imaging Spectrometer (EIS) and X-ray Telescope
(XRT) on Hinode. This initial investigation focuses on NOAA active region 10940
as observed by Hinode on February 1, 2007 between 12 and 19 UT. In these
observations we find numerous examples of transient heating events within the
active region. The high spatial resolution and broad temperature coverage of
these instruments allows us to track the evolution of coronal plasma. The
evolution of the emission observed with XRT and EIS during these events is
generally consistent with loops that have been heated and are cooling. We have
analyzed the most energetic heating event observed during this period, a small
GOES B-class flare, in some detail and present some of the spectral signatures
of the event, such as relative Doppler shifts at one of the loop footpoints and
enhanced line widths during the rise phase of the event. While the analysis of
these transient events has the potential to yield insights into the coronal
heating mechanism, these observations do not rule out the possibility that
there is a strong steady heating level in the active region. Detailed
statistical analysis will be required to address this question definitively.
","[{""version"":""v1"",""created"":""Fri, 2 Nov 2007 17:16:00 GMT""}]","2015-05-13"
"0711.0358","Andr\.es Vi\~na","Andr\'es Vi\~na","Critical values of moment maps on quantizable manifolds","10 pages, comments are wellcome",,,"11-07","math.SG",,"  Let $M$ be a quantizable symplectic manifold acted on by $T=(S^1)^r$ in a
Hamiltonian fashion and $J$ a moment map for this action. Suppose that the set
$M^{T}$ of fixed points is discrete and denote by ${\alpha}_{pj}\in{\mathbb
Z}^r$ the weights of the isotropy representation at $p$. By means of the
$\alpha_{pj}$'s we define a partition ${\mathcal Q}_+$, ${\mathcal Q}_-$ of
$M^T$. (When $r=1$, ${\mathcal Q}_{\pm}$ will be the set of fixed points such
that the half of the Morse index of $J$ at them is even (odd)). We prove the
existence of a map $\pi_{\pm}:{\mathcal Q}_{\pm}\to{\mathcal Q}_{\mp}$ such
that $J(q)-J(\pi_{\pm}(q))\in I_{\mp}$, for all $q\in {\mathcal Q}_{\pm}$,
where $I_{\pm}$ is the lattice generated by the $\alpha_{pj}$'s with
$p\in{\mathcal Q}_{\pm}.$ We define partition functions $N_p$ similar to the
ones of Kostant \cite{Gui} and we prove that $\sum_{p\in{\mathcal
Q}_+}N_p(l)=\sum_{p\in{\mathcal Q}_-}N_p(l)$, for any $l\in{\mathbb Z}^r$ with
$|l|$ sufficiently large.
","[{""version"":""v1"",""created"":""Fri, 2 Nov 2007 17:17:31 GMT""}]","2007-11-05"
"0711.0359","Aleksandra Kurek","Marek Szydlowski and Aleksandra Kurek","Dark energy FRW cosmology - dynamical system reconstruction","Talk presented at Spanish Relativity Meeting 2007, Puerto de la Cruz,
  Tenerife, Spain, 10-14 September 2007","EAS Publications Series, 30 (2008) 169-174","10.1051/eas:0830020",,"astro-ph",,"  We develop a simple method of dark energy reconstruction using a geometrical
form of the luminosity-distance relation. In this method the FRW dynamical
system with dark energy is reconstructed instead of the equation of state
parameter. We give several examples which illustrate the usefulness of our
method in fitting the redshift transition from the decelerating to accelerating
phase as the value of the Hubble function at the transition.
","[{""version"":""v1"",""created"":""Fri, 2 Nov 2007 17:20:10 GMT""}]","2017-09-29"
"0711.0360","Chris Antonopoulos","Chris Antonopoulos, Tassos Bountis","Detecting Order and Chaos by the Linear Dependence Index (LDI) Method","9 pages, 3 figures, 29 references","Already published at ROMAI Journal, 2006, Vol. 2, No. 2, pages:
  1-13",,,"nlin.CD",,"  We introduce a new methodology for a fast and reliable discrimination between
ordered and chaotic orbits in multidimensional Hamiltonian systems which we
call the Linear Dependence Index (LDI). The new method is based on the recently
introduced theory of the Generalized Alignment Indices (GALI). LDI takes
advantage of the linear dependence (or independence) of deviation vectors of a
given orbit, using the method of Singular Value Decomposition at every time
step of the integration. We show that the LDI produces estimates which
numerically coincide with those of the GALI method for the same number of $m$
deviation vectors, while its main advantage is that it requires considerable
less CPU time than GALI especially in Hamiltonian systems of many degrees of
freedom
","[{""version"":""v1"",""created"":""Fri, 2 Nov 2007 18:36:52 GMT""}]","2007-11-05"
"0711.0361","Francesco Bonechi","F. Bonechi, N. Ciccoli, N. Staffolani, M. Tarlini","On the integration of Poisson homogeneous spaces","22 pages, minor changes","J.Geom.Phys. 58 (2008) 1519-1529","10.1016/j.geomphys.2008.07.001",,"math.SG","http://arxiv.org/licenses/nonexclusive-distrib/1.0/","  We study a reduction procedure for describing the symplectic groupoid of a
Poisson homogeneous space obtained by quotient of a coisotropic subgroup. We
perform it as a reduction of the Lu-Weinstein symplectic groupoid integrating
Poisson Lie groups, that is suitable even for the non complete case.
","[{""version"":""v1"",""created"":""Fri, 2 Nov 2007 17:40:27 GMT""},{""version"":""v2"",""created"":""Tue, 9 Sep 2008 14:52:35 GMT""}]","2010-04-23"
"0711.0362","Omer Kavaklioglu","omer Kavaklioglu and Baruch Schneider","On the Asymptotic Solution for the Fourier-Bessel Multiple Scattering
  Coefficients of an Infinite Grating of Insulating Dielectric Circular
  Cylinders at Oblique Incidence","20 pages",,,,"math-ph math.MP",,"  In this article, we present the asymptotic solution for the matrix system of
equations representing the multiple scattering coefficients of an infinite
grating of insulating dielectric circular cylinders associated with vertically
polarized obliquely incident plane electromagnetic waves.
","[{""version"":""v1"",""created"":""Fri, 2 Nov 2007 17:40:48 GMT""}]","2007-11-05"
"0711.0363","Yu-Xin Liu","Wei Yuan, Huan Chen, Yu-xin Liu","Dyson-Schwinger Equation and Quantum Phase Transitions in Massless QCD","12 pages, 6 figures","Phys.Lett.B637:69-74,2006","10.1016/j.physletb.2006.03.076",,"hep-ph",,"  We study the stability of the highest symmetric solution (Wigner-solution) of
Dyson-Schwinger equations in chiral limit and at zero temperature. Our results
confirm that if the chemical potential is not very large, the QCD vacuum is in
the chiral symmetry breaking phase and the quantum phase-transition of the
chiral symmetry restoration is in first order. Meanwhile it seems that there is
not competition between chiral symmetry breaking phase and color
superconductivity phase since the color superconductivity phase appears only if
the chemical potential is very large. Moreover, we propose that chiral symmetry
breaking arises from the positive feedback with respect to the mass
perturbation.
","[{""version"":""v1"",""created"":""Fri, 2 Nov 2007 17:42:41 GMT""}]","2008-11-26"
"0711.0364","Matthew Buckley","Matthew R. Buckley, Hitoshi Murayama, William Klemm, Vikram Rentala","Discriminating spin through quantum interference","11 pages, 11 figures","Phys.Rev.D78:014028,2008","10.1103/PhysRevD.78.014028",,"hep-ph",,"  Many of the proposed solutions to the hierarchy and naturalness problems
postulate new `partner' fields to the standard model particles. Determining the
spins of these new particles will be critical in distinguishing among the
various possible SM extensions, yet proposed methods rely on the underlying
models. We propose a new model-independent method for spin measurements which
takes advantage of quantum interference among helicity states. We demonstrate
that this method will be able to discriminate scalar particles from higher spin
states at the ILC, and discuss application to higher spins and possible uses at
the LHC.
","[{""version"":""v1"",""created"":""Fri, 2 Nov 2007 17:49:53 GMT""},{""version"":""v2"",""created"":""Fri, 25 Jan 2008 08:11:47 GMT""}]","2008-11-26"
"0711.0365","Andrey Vasenko","A.S. Vasenko, A.A. Golubov, M.Yu. Kupriyanov, M. Weides","Properties of tunnel Josephson junctions with a ferromagnetic interlayer","9 pages, 8 figures, to be published in Phys. Rev. B","Phys. Rev. B 77, 134507 (2008)","10.1103/PhysRevB.77.134507",,"cond-mat.supr-con",,"  We investigate superconductor/insulator/ferromagnet/superconductor (SIFS)
tunnel Josephson junctions in the dirty limit, using the quasiclassical theory.
We formulate a quantitative model describing the oscillations of critical
current as a function of thickness of the ferromagnetic layer and use this
model to fit recent experimental data. We also calculate quantitatively the
density of states (DOS) in this type of junctions and compare DOS oscillations
with those of the critical current.
","[{""version"":""v1"",""created"":""Fri, 2 Nov 2007 18:00:49 GMT""},{""version"":""v2"",""created"":""Mon, 14 Jan 2008 20:22:53 GMT""}]","2011-01-04"
"0711.0366","Mehmet Ak\c{c}akaya","Mehmet Ak\c{c}akaya and Vahid Tarokh","Shannon Theoretic Limits on Noisy Compressive Sampling","21 pages, submitted",,,,"cs.IT math.IT",,"  In this paper, we study the number of measurements required to recover a
sparse signal in ${\mathbb C}^M$ with $L$ non-zero coefficients from compressed
samples in the presence of noise. For a number of different recovery criteria,
we prove that $O(L)$ (an asymptotically linear multiple of $L$) measurements
are necessary and sufficient if $L$ grows linearly as a function of $M$. This
improves on the existing literature that is mostly focused on variants of a
specific recovery algorithm based on convex programming, for which
$O(L\log(M-L))$ measurements are required. We also show that $O(L\log(M-L))$
measurements are required in the sublinear regime ($L = o(M)$).
","[{""version"":""v1"",""created"":""Fri, 2 Nov 2007 19:04:38 GMT""}]","2007-11-05"
"0711.0367","Gusztav Morvai","G. Morvai, S. Yakowitz, and L. Gyorfi","Nonparametric inference for ergodic, stationary time series",,"Ann. Statist. 24 (1996), no. 1, 370--379",,,"math.PR cs.IT math.IT",,"  The setting is a stationary, ergodic time series. The challenge is to
construct a sequence of functions, each based on only finite segments of the
past, which together provide a strongly consistent estimator for the
conditional probability of the next observation, given the infinite past.
Ornstein gave such a construction for the case that the values are from a
finite set, and recently Algoet extended the scheme to time series with
coordinates in a Polish space.
  The present study relates a different solution to the challenge. The
algorithm is simple and its verification is fairly transparent. Some extensions
to regression, pattern recognition, and on-line forecasting are mentioned.
","[{""version"":""v1"",""created"":""Fri, 2 Nov 2007 18:16:01 GMT""}]","2008-06-19"
"0711.0368","Remi Soummer","Remi Soummer, Laurent Pueyo, Anand Sivaramakrishnan, Robert J.
  Vanderbei","Fast computation of Lyot-style coronagraph propagation","17 pages, 9 figures, accepted for publication in Optics Express",,"10.1364/OE.15.015935",,"astro-ph",,"  We present a new method for numerical propagation through Lyot-style
coronagraphs using finite occulting masks. Standard methods for coronagraphic
simulations involve Fast Fourier Transforms (FFT) of very large arrays, and
computing power is an issue for the design and tolerancing of coronagraphs on
segmented Extremely Large Telescopes (ELT) in order to handle both the speed
and memory requirements. Our method combines a semi-analytical approach with
non-FFT based Fourier transform algorithms. It enables both fast and
memory-efficient computations without introducing any additional
approximations. Typical speed improvements based on computation costs are of
about ten to fifty for propagations from pupil to Lyot plane, with thirty to
sixty times less memory needed. Our method makes it possible to perform
numerical coronagraphic studies even in the case of ELTs using a contemporary
commercial laptop computer, or any standard commercial workstation computer.
","[{""version"":""v1"",""created"":""Fri, 2 Nov 2007 18:19:15 GMT""}]","2009-11-13"
"0711.0369","Giorgio Parisi","Giorgio Parisi","Some considerations of finite dimensional spin glasses","Contribution to the conference ""Viewing the World through Spin
  Glasses"" in honour of Professor David Sherrington on the occasion of his 65th
  birthday, 31 August - 1 September 2007. 16 pages, 8 figures",,"10.1088/1751-8113/41/32/324002",,"cond-mat.dis-nn",,"  In talk I will review the theoretical results that have been obtained for
spin glasses, paying a particular attention to finite dimensional spin glasses.
I will concentrate my attention on the formulation of the mean field approach
and on its numerical and experimental verifications. I will mainly considered
equilibrium properties at zero magnetic field, where the situation is clear and
it should be not controversial. I will present the various hypothesis at the
basis of the theory and I will discuss their physical status.
","[{""version"":""v1"",""created"":""Fri, 2 Nov 2007 18:18:13 GMT""}]","2009-11-13"
"0711.0370","Claudia Mignone","Claudia Mignone, Matthias Bartelmann","Model-independent determination of the cosmic expansion rate. I.
  Application to type-Ia supernovae","9 pages, 8 figures; accepted by A&A; subsection 3.6 added, new
  references and minor changes","Astron.Astrophys. 481 (2008) 295-303","10.1051/0004-6361:20078983",,"astro-ph",,"  Aims: In view of the substantial uncertainties regarding the possible
dynamics of the dark energy, we aim at constraining the expansion rate of the
universe without reference to a specific Friedmann model and its parameters.
Methods: We show that cosmological observables integrating over the cosmic
expansion rate can be converted into a Volterra integral equation which is
known to have a unique solution in terms of a Neumann series. Expanding
observables such as the luminosity distances to type-Ia supernovae into a
series of orthonormal functions, the integral equation can be solved and the
cosmic expansion rate recovered within the limits allowed by the accuracy of
the data. Results: We demonstrate the performance of the method applying it to
synthetic data sets of increasing complexity, and to the first-year SNLS data.
In particular, we show that the method is capable of reproducing a hypothetical
expansion function containing a sudden transition.
","[{""version"":""v1"",""created"":""Fri, 2 Nov 2007 19:09:53 GMT""},{""version"":""v2"",""created"":""Thu, 13 Mar 2008 22:05:39 GMT""}]","2008-04-08"
"0711.0371","A. Tureanu","M. Chaichian, P. P. Kulish, A. Tureanu, R. B. Zhang, Xiao Zhang","Noncommutative fields and actions of twisted Poincare algebra","20 pages","J.Math.Phys.49:042302,2008","10.1063/1.2907580",,"hep-th math-ph math.MP",,"  Within the context of the twisted Poincar\'e algebra, there exists no
noncommutative analogue of the Minkowski space interpreted as the homogeneous
space of the Poincar\'e group quotiented by the Lorentz group. The usual
definition of commutative classical fields as sections of associated vector
bundles on the homogeneous space does not generalise to the noncommutative
setting, and the twisted Poincar\'e algebra does not act on noncommutative
fields in a canonical way. We make a tentative proposal for the definition of
noncommutative classical fields of any spin over the Moyal space, which has the
desired representation theoretical properties. We also suggest a way to search
for noncommutative Minkowski spaces suitable for studying noncommutative field
theory with deformed Poincar\'e symmetries.
","[{""version"":""v1"",""created"":""Fri, 2 Nov 2007 18:34:47 GMT""}]","2008-11-26"
"0711.0372","Christophe Giraud","Christophe Giraud (JAD)","Mixing Least-Squares Estimators when the Variance is Unknown","30 pages",,,,"math.ST stat.TH",,"  We propose a procedure to handle the problem of Gaussian regression when the
variance is unknown. We mix least-squares estimators from various models
according to a procedure inspired by that of Leung and Barron (2007). We show
that in some cases the resulting estimator is a simple shrinkage estimator. We
then apply this procedure in various statistical settings such as linear
regression or adaptive estimation in Besov spaces. Our results provide
non-asymptotic risk bounds for the Euclidean risk of the estimator.
","[{""version"":""v1"",""created"":""Fri, 2 Nov 2007 18:36:35 GMT""}]","2007-11-05"
"0711.0373","Benjamin Bahr","Benjamin Bahr, Thomas Thiemann","Automorphisms in Loop Quantum Gravity","57 pages, 7 figures","Class.Quant.Grav.26:235022,2009","10.1088/0264-9381/26/23/235022",,"gr-qc",,"  We investigate a certain distributional extension of the group of spatial
diffeomorphisms in Loop Quantum Gravity. This extension, which is given by the
automorphisms Aut(P) of the path groupoid P, was proposed by Velhinho and is
inspired by category theory. This group is much larger than the group of
piecewise analytic diffeomorphisms. In particular, we will show that graphs
with the same combinatorics but different generalized knotting classes can be
mapped into each other. We describe the automorphism-invariant Hilbert space
and comment on how a combinatorial formulation of LQG might arise.
","[{""version"":""v1"",""created"":""Fri, 2 Nov 2007 19:02:18 GMT""}]","2009-11-18"
