"0711.0506","Christian Moni Bidin","C. Moni Bidin, M. Catelan, S. Villanova, G. Piotto, M. Altmann, Y.
  Momany, S. Moehler","Binaries among Extreme Horizontal Branch Stars in Globular Clusters","12 pages, 2 figures, to appear in ""Hot Subdwarf Stars and Related
  Objects"", ASP Conf. Ser",,,,"astro-ph",,"  Following a review of our present knowledge about blue subdwarf stars in
globular clusters, we present an overview of the results of searches for close
binaries among these stars, including results previously published in the
literature and reporting recent and preliminary results of new data. Previous
investigations revealed a lack of close systems in NGC 6752, which we confirm
with new, more extensive observations. Our estimate of the close binary
fraction in this cluster is only 4%. From a review of the relevant literature,
there are indications that a low close binary fraction among extreme horizontal
branch (EHB) stars is a common feature in globular star clusters. On the other
hand, the field EHB population shows evidence of a remarkably high binary
fraction. Such a difference among globular cluster and field populations,
although not yet explained in detail on the basis of theoretical models, must
necessarily be related to different formation histories for EHB stars in the
field and in clusters. In this framework, preliminary results indicate that
close systems could be relatively common in the peculiar globular cluster NGC
2808, although the sample of studied stars is still small. This would imply
that not all clusters share the same behavior, as far as EHB star formation is
concerned. We briefly explore possible explanations for these results.
","[{""version"":""v1"",""created"":""Sun, 4 Nov 2007 10:24:58 GMT""}]","2007-11-06"
"0711.0507","Ricardo Weder","Ricardo Weder","A rigorous analysis of high order electromagnetic invisibility cloaks","The final version is now published in Journal of Physics A:
  Mathematical and Theoretical, vol 41 (2008) 065207 (21 pp). Included in
  IOP-Select","Journal of Physics A: Mathematical and Theoretical, vol 41 (2008)
  065207 (21 pp)","10.1088/1751-8113/41/6/065207",,"physics.optics math-ph math.MP",,"  There is currently a great deal of interest in the invisibility cloaks
recently proposed by Pendry et al. that are based in the transformation
approach. They obtained their results using first order transformations. In
recent papers Hendi et al. and Cai et al. considered invisibility cloaks with
high order transformations. In this paper we study high order electromagnetic
invisibility cloaks in transformation media obtained by high order
transformations from general anisotropic media. We consider the case where
there is a finite number of spherical cloaks located in different points in
space. We prove that for any incident plane wave, at any frequency, the
scattered wave is identically zero. We also consider the scattering of finite
energy wave packets. We prove that the scattering matrix is the identity, i.e.,
that for any incoming wave packet the outgoing wave packet is the same as the
incoming one. This proves that the invisibility cloaks can not be detected in
any scattering experiment with electromagnetic waves in high order
transformation media, and in particular in the first order transformation media
of Pendry et al. We also prove that the high order invisibility cloaks, as well
as the first order ones, cloak passive and active devices. The cloaked objects
completely decouple from the exterior. Actually, the cloaking outside is
independent of what is inside the cloaked objects. The electromagnetic waves
inside the cloaked objects can not leave the concealed regions and viceversa,
the electromagnetic waves outside the cloaked objects can not go inside the
concealed regions. As we prove our results for media that are obtained by
transformation from general anisotropic materials, we prove that it is possible
to cloak objects inside general crystals.
","[{""version"":""v1"",""created"":""Sun, 4 Nov 2007 10:26:57 GMT""},{""version"":""v2"",""created"":""Sat, 22 Dec 2007 14:09:52 GMT""},{""version"":""v3"",""created"":""Wed, 20 Feb 2008 18:37:45 GMT""}]","2009-11-13"
"0711.0508","Artan Borici","Artan Borici","A Schur Complement Approach to Chiral Fermions","7 pages, 3 figures, proceedings of XXV International Symposium on
  Lattice Field Theory, 30 July - 4 August 2007, Regensburg, Germany","PoSLAT2007:065,2007",,,"hep-lat",,"  Lattice chiral fermions are synonymous to the Ginsparg-Wilson relation.
Indeed, this relation is satisfied by the overlap, domain wall and perfect
action fermion kernel.
  In a recent work we have shown that it is possible to take a direct RG
approach for fermions in the presence of gauge fields. This is due to an
algebraically implicit blocking technique which yields a Schur-complementary
coarse Dirac operator. Using a Schur complement approximation which is stable
and regular, the scheme can be iterated to the fixed point.
  In this talk, we elaborate more on the direct RG approach and show how to get
highly improved chiral fermions on the coarse lattice with the gauge fields
remaining on the fine lattice. We give numerical examples in the case of
lattice QCD using QCDLAB {\tt http://phys.fshn.edu.al/qcdlab.html}
","[{""version"":""v1"",""created"":""Sun, 4 Nov 2007 10:28:38 GMT""}]","2008-11-26"
"0711.0509","Attilio Cucchieri","Attilio Cucchieri, Tereza Mendes. Orlando Oliveira and Paulo J. Silva","Comparing Pure Yang-Mills SU(2) and SU(3) Propagators","4 pages; 2 figures; proceedings of the X Hadron Physics
  (Florianopolis, Brazil) to appear in Int. Jour. Mod. Phys E","Int.J.Mod.Phys.E16:2931-2934,2007","10.1142/S0218301307007970",,"hep-lat",,"  The infrared behavior of gluon and ghost propagators in Yang-Mills gauge
theories is of central importance for the understanding of confinement in QCD.
While analytic studies using Schwinger-Dyson equations predict the same
infrared exponents for the SU(2) and SU(3) gauge groups, lattice simulations
usually assume that the two cases are different, although their qualitative
infrared features may be the same. We carry out a comparative study of lattice
(Landau) propagators for both gauge groups. Our data were especially produced
with equivalent lattice parameters to allow a careful comparison of the two
cases.
","[{""version"":""v1"",""created"":""Sun, 4 Nov 2007 10:32:26 GMT""}]","2008-11-26"
"0711.0510","Grigori Amosov","Grigori G. Amosov, Stefano Mancini and Vladimir I. Man'ko","On the information completeness of quantum tomograms","12 pages","Phys. Lett. A 372 (2008) 2820-2824","10.1016/j.physleta.2007.12.058",,"quant-ph",,"  We address the problem of information completeness of quantum measuremets in
connection to quantum state tomography and with particular concern to quantum
symplectic tomography. We put forward some non-trivial situations where
informationally incomplete set of tomograms allows as well the state
reconstruction provided to have some a priori information on the state or its
dynamics. We then introduce a measure of information completeness and apply it
to symplectic quantum tomograms.
","[{""version"":""v1"",""created"":""Sun, 4 Nov 2007 10:42:34 GMT""}]","2009-11-13"
"0711.0511","Mehdi Nadjafikhah","Mehdi Nadjafikhah and Seyed-Reza Hejazi","Differential Invariants of SL(2) and SL(3)-ACTIONS on R^2","12 pages, accepted by ""Mathematical Sciences""
  http://www.kiau.ac.ir/persian/faslnameha/JMS/Home.htm","Mathematical Sciences, 1(3): 75-84, 2007",,,"math.DG",,"  The main purpose of this paper is calculation of differential invariants
which arise from prolonged actions of two Lie groups SL(2) and SL(3) on the
$n$th jet space of $R^2$. It is necessary to calculate $n$th prolonged
infenitesimal generators of the action.
","[{""version"":""v1"",""created"":""Sun, 4 Nov 2007 11:16:18 GMT""},{""version"":""v2"",""created"":""Sat, 26 Jan 2008 08:57:41 GMT""}]","2012-03-13"
"0711.0512","Taejin Lee","Taejin Lee","Applications of Thirring Model to Inhomogenous Rolling Tachyon and
  Dissipative Quantum Mechanics","19 pages, 2 figures, This work supersedes the previous one,
  arXiv:0705.3930 [hep-th]","JHEP0802:090,2008","10.1088/1126-6708/2008/02/090",,"hep-th",,"  We study the rolling tachyon and the dissipative quantum mechanics using the
Thirring model with a boundary mass. We construct a boundary state for the
dissipative quantum system in one dimension, which describes the system at the
off-critical points as well as at the critical point. Then we extend the
Thirring model with a boundary mass in order to depict the time evolution of an
unstable D-branes with one direction wrapped on a circle of radius $R$, which
is termed the inhomogeneous rolling tachyon. The analysis based on the Thirring
model shows that the time dependent evolution of the inhomogeneous tachyon is
possible only when $\frac{2}{\sqrt{3}}< R < 2$.
","[{""version"":""v1"",""created"":""Sun, 4 Nov 2007 11:23:47 GMT""}]","2008-11-26"
"0711.0513","Ciprian Tudor","Karine Bertin, Soledad Torres, Ciprian Tudor (CES, SAMOS)","Maximum likelihood estimators and random walks in long memory models","To appear in ""Statistics""",,,,"math.ST math.PR stat.TH","http://arxiv.org/licenses/nonexclusive-distrib/1.0/","  We consider statistical models driven by Gaussian and non-Gaussian
self-similar processes with long memory and we construct maximum likelihood
estimators (MLE) for the drift parameter. Our approach is based on the
approximation by random walks of the driving noise. We study the asymptotic
behavior of the estimators and we give some numerical simulations to illustrate
our results.
","[{""version"":""v1"",""created"":""Sun, 4 Nov 2007 11:38:43 GMT""},{""version"":""v2"",""created"":""Sat, 19 Dec 2009 06:49:44 GMT""}]","2009-12-19"
"0711.0515","Yang Chen","Yang Chen (NJU), Frederick D. Seward (CfA), Ming Sun (MSU), and
  Jiang-tao Li (NJU)","The Thermal Composite Supernova Remnant Kes 27 as Viewed by CHANDRA:
  Shock Reflection from a Cavity Wall","11 emulateapj pages (including 10 figures), a few references added",,"10.1086/525240",,"astro-ph",,"  We present a spatially resolved spectroscopic study of the thermal composite
supernova remnant Kes 27 with Chandra. The X-ray spectrum of Kes 27 is
characterized by K lines from Mg, Si, S, Ar, and Ca. The X-ray emitting gas is
found to be enriched in sulphur and calcium. The broadband and tri-color images
show two incomplete shell-like features in the northeastern half and brightness
fading with increasing radius in the southwest. There are over 30 unresolved
sources within the remnant. None show characteristics typical of young neutron
stars. The maximum diffuse X-ray intensity coincides with a radio bright region
along the eastern border. In general, gas in the inner region is at higher
temperature and emission is brighter than from the outer region. The gas in the
remnant appears to approach ionization equilibrium. The overall morphology can
be explained by the evolution of the remnant in an ambient medium with a
density enhancement from west to east. We suggest that the remnant was born in
a pre-existing cavity and that the inner bright emission is due to the
reflection of the initial shock from the dense cavity wall. This scenario may
provide a new candidate mechanism for the X-ray morphology of other thermal
composite supernova remnants.
","[{""version"":""v1"",""created"":""Sun, 4 Nov 2007 12:16:43 GMT""},{""version"":""v2"",""created"":""Wed, 13 Feb 2008 08:09:42 GMT""}]","2009-11-13"
"0711.0516","Ansgar Liebsch","H. Ishida, A. Liebsch","The Mott insulator LaTiO_3 in heterostructures with SrTiO_3 is metallic","4 pages, 4 figures","Phys.Rev.B77, 115350 (2008)","10.1103/PhysRevB.77.115350",,"cond-mat.str-el",,"  It is shown that LaTiO_3 in superlattices with SrTiO_3 is not a Mott
insulator but a strongly correlated metal. The tetragonal lattice geometry
imposed by the SrTiO_3 substrate leads to an increase of the Ti 3d t2g band
width and a reversal of the t2g crystal field relative to the orthorhombic bulk
geometry. Using dynamical mean field theory based on finite-temperature
multi-band exact diagonalization we show that, as a result of these effects,
local Coulomb interactions are not strong enough to induce a Mott transition in
tetragonal LaTiO_3. The metalicity of these heterostructures is therefore not
an interface property but stems from all LaTiO_3 planes.
","[{""version"":""v1"",""created"":""Sun, 4 Nov 2007 12:37:47 GMT""}]","2009-11-13"
"0711.0517","Gintaras Valusis","J. Kundrotas, A. Cerskus, G. Valusis, M. Lachab, S. P. Khanna, P.
  Harrison, and E. H. Linfield","Radiative Recombination Spectra of Heavily p-Type delta-Doped Gaas/Alas
  MQWs","4 pages, 2 figures; presented in the 13th International Symposium on
  Ultrafast Phenomena in Semiconductors, Vilnius, August 2007",,,,"cond-mat.mtrl-sci",,"  We present a study of the photoluminescence (PL) properties of heavily Be
delta-doped GaAs/AlAs multiple quantum wells measured at room and liquid
nitrogen temperatures. Possible mechanisms for photocarriers recombination are
discussed, with a particular focus on the peculiarities of the excitonic and
free carriers-acceptors PL emissions occurring below and above the Mott
metal-insulator transition. Moreover, based on a simple theoretical model, it
is found that the critical impurities concentration to observe the Mott
transition in the MQW samples exhibiting 15 nm wells width and 5 nm-thick
barrier layers is about 3 10E12 cm-2.
","[{""version"":""v1"",""created"":""Sun, 4 Nov 2007 12:57:02 GMT""}]","2007-11-06"
"0711.0518","Nabila Aghanim","Nabila Aghanim, Subhabrata Majumdar and Joseph Silk","Secondary anisotropies of the CMB","Review paper submitted to ROP","Rept.Prog.Phys.71:066902,2008","10.1088/0034-4885/71/6/066902",,"astro-ph",,"  The Cosmic Microwave Background fluctuations provide a powerful probe of the
dark ages of the universe through the imprint of the secondary anisotropies
associated with the reionisation of the universe and the growth of structure.
We review the relation between the secondary anisotropies and and the primary
anisotropies that are directly generated by quantum fluctuations in the very
early universe. The physics of secondary fluctuations is described, with
emphasis on the ionisation history and the evolution of structure. We discuss
the different signatures arising from the secondary effects in terms of their
induced temperature fluctuations, polarisation and statistics. The secondary
anisotropies are being actively pursued at present, and we review the future
and current observational status.
","[{""version"":""v1"",""created"":""Sun, 4 Nov 2007 13:00:14 GMT""}]","2009-06-23"
"0711.0519","Fei Zhang","F. Zhang, H. Z. Zheng, Y. Ji, J. Liu, G. R. Li","Electrical Control of Dynamic Spin Splitting Induced by Exchange
  Interaction as Revealed by Time Resolved Kerr Rotation in a Degenerate
  Spin-Polarized Electron Gas","8 pages, 3 figures ; added some discussions",,"10.1209/0295-5075/83/47006",,"cond-mat.mes-hall cond-mat.str-el",,"  The manipulation of spin degree of freedom have been demonstrated in spin
polarized electron plasma in a heterostructure by using exchange-interaction
induced dynamic spin splitting rather than the Rashba and Dresselhaus types, as
revealed by time resolved Kerr rotation. The measured spin splitting increases
from 0.256meV to 0.559meV as the bias varies from -0.3V to -0.6V. Both the sign
switch of Kerr signal and the phase reversal of Larmor precessions have been
observed with biases, which all fit into the framework of
exchange-interaction-induced spin splitting. The electrical control of it may
provide a new effective scheme for manipulating spin-selected transport in spin
FET-like devices.
","[{""version"":""v1"",""created"":""Sun, 4 Nov 2007 13:26:34 GMT""},{""version"":""v2"",""created"":""Tue, 25 Mar 2008 15:27:34 GMT""}]","2009-11-13"
"0711.0520","T.G Zlosnik","T.G Zlosnik, P.G. Ferreira, G.D. Starkman","On the growth of structure in theories with a dynamical preferred frame",,"Phys.Rev.D77:084010,2008","10.1103/PhysRevD.77.084010",,"astro-ph",,"  We study the cosmological stability of a class of theories with a dynamical
preferred frame. For a range of actions, we find cosmological solutions which
are compatible with observations of the recent history of the Universe: a
matter dominated era followed by accelerated expansion. We then study the
evolution of linear perturbations on these backgrounds and find conditions on
the parameters of the theory which allow for the growth of structure sourced by
the new degrees of freedom.
","[{""version"":""v1"",""created"":""Sun, 4 Nov 2007 14:05:06 GMT""}]","2009-06-23"
"0711.0521","Mikhail Rogal","M. Rogal","CC DIS at alpha_s^3 in Mellin-N and Bjorken-x spaces","To appear in the proceedings of 8'th International Symposium on
  Radiative Corrections (RADCOR 2007), October 1-5 2007, Florence, Italy","PoSRADCOR2007:033,2007","10.1088/1742-6596/110/2/022043","DESY 07-191","hep-ph",,"  Third-order results for the structure functions of charged-current
deep-inelastic scattering are discussed. New results for 11'th Mellin moment
for F_2,L^(nu P - nubar P) structure functions and 12'th moment for F_3^(nu P -
nubar P) are presented as well as corresponding higher Mellin moments of
differences between the respective crossing-even and -odd coefficient
functions. Approximations in Bjorken-x space for these differences obtained
with lowest five moments as well as consistency of new results with these
approximations are discussed. The 1/N_c suppression of the differences is shown
and the correction to the Paschos-Wolfenstein relation is discussed.
","[{""version"":""v1"",""created"":""Sun, 4 Nov 2007 14:27:15 GMT""}]","2009-11-13"
"0711.0522","Ting Li","Ting Li","Purely Algebraic Method to Construct Toric Schemes","13 pages",,,,"math.AG",,"  In this article, we first give some elementary proprieties of monoids and
fans, then construct a toric scheme over an arbitrary ring, from a given fan.
Using Valuative Criterion, we prove that this scheme is separated and give the
sufficient and necessary condition when it is proper. We also study the
regularity and logarithmic regularity of it. Finally we study the morphisms of
toric schemes induced by the homomorphisms of fans.
","[{""version"":""v1"",""created"":""Sun, 4 Nov 2007 14:32:42 GMT""},{""version"":""v2"",""created"":""Sat, 1 Dec 2007 02:56:56 GMT""}]","2011-11-10"
"0711.0523","Mirek Giersz","Mirek Giersz (1), Douglas C. Heggie (2), ((1) Nicolaus Copernicus
  Astronomical Center, Warsaw, Poland, (2) University of Edinburgh, School of
  Mathematics, Edinburgh, UK)","Monte Carlo simulations of star clusters with primordial binaries.
  Comparison with N-body simulations and observations","5 pages, 8 figures, to appear in the proceedings of the 246th IAU
  symposium on 'Dynamical Evolution of Dense Stellar Systems', eds. E.
  Vesperini, M. Giersz, A. Sills, Capri, Sept. 2007",,"10.1017/S174392130801538X",,"astro-ph",,"  We outline the steps needed in to calibrate the Monte Carlo code in order to
perform large scale simulations of real globular clusters. We calibrate the
results against $N$-body simulations for $N = 2500$, 10000 and for the old open
cluster M67. The calibration is done by choosing appropriate free code
parameters.
","[{""version"":""v1"",""created"":""Sun, 4 Nov 2007 14:44:19 GMT""}]","2009-11-13"
"0711.0524","Mohammad Reza Setare","M R Setare","Interacting generalized Chaplygin gas model in non-flat universe","8 pages, no figure","Eur.Phys.J.C52:689-692,2007","10.1140/epjc/s10052-007-0405-5",,"gr-qc",,"  We employ the generalized Chaplygin gas of interacting dark energy to obtain
the equation of state for the generalized Chaplygin gas energy density in
non-flat universe. By choosing a negative value for $B$ we see that $w_{\rm
\Lambda}^{eff}< -1$, that corresponds to a universe dominated by phantom dark
energy.
","[{""version"":""v1"",""created"":""Sun, 4 Nov 2007 14:46:50 GMT""}]","2010-10-27"
