"0711.0479","Frank Koppens","F.H.L. Koppens, K.C. Nowack, L.M.K. Vandersypen","Spin-echo of a single electron spin in a quantum dot","5 pages, 4 figures","Phys. Rev. Lett. 100, 236802 (2008)","10.1103/PhysRevLett.100.236802",,"cond-mat.mes-hall",,"  We report a measurement of the spin-echo decay of a single electron spin
confined in a semiconductor quantum dot. When we tip the spin in the transverse
plane via a magnetic field burst, it dephases in 37 ns due to the Larmor
precession around a random effective field from the nuclear spins in the host
material. We reverse this dephasing to a large extent via a spin-echo pulse,
and find a spin-echo decay time of about 0.5 microseconds at 70 mT. These
results are in the range of theoretical predictions of the electron spin
coherence time governed by the dynamics of the electron-nuclear system.
","[{""version"":""v1"",""created"":""Sat, 3 Nov 2007 22:01:43 GMT""}]","2009-08-17"
"0711.0480","Tanmoy Das","Tanmoy Das, R. S. Markiewicz, and A. Bansil","A competing order scenario of two-gap behavior in hole doped cuprates","9 pages, 7 figs","Phys. Rev. B 77, 134516 (2008)","10.1103/PhysRevB.77.134516",,"cond-mat.supr-con cond-mat.str-el",,"  Angle-dependent studies of the gap function provide evidence for the
coexistence of two distinct gaps in hole doped cuprates, where the gap near the
nodal direction scales with the superconducting transition temperature $T_c$,
while that in the antinodal direction scales with the pseudogap temperature. We
present model calculations which show that most of the characteristic features
observed in the recent angle-resolved photoemission spectroscopy (ARPES) as
well as scanning tunneling microscopy (STM) two-gap studies are consistent with
a scenario in which the pseudogap has a non-superconducting origin in a
competing phase. Our analysis indicates that, near optimal doping,
superconductivity can quench the competing order at low temperatures, and that
some of the key differences observed between the STM and ARPES results can give
insight into the superlattice symmetry of the competing order.
","[{""version"":""v1"",""created"":""Sat, 3 Nov 2007 22:30:47 GMT""},{""version"":""v2"",""created"":""Mon, 18 Feb 2008 17:56:42 GMT""}]","2009-11-13"
"0711.0481","Yilmaz Simsek","Yilmaz Simsek","On q-deformed Stirling numbers","7 pages","International Journal of Mathematics and Computations 17 (2) 2012",,,"math.NT math.GM",,"  The purpose of this article is to introduce q-deformed Stirling numbers of
the first and second kinds. Relations between these numbers, Riemann zeta
function and q-Bernoulli numbers of higher order are given. Some relations
related to the classical Stirling numbers and Bernoulli numbers of higher order
are found. By using derivative operator to the generating function of the
q-deformed Stirling numbers of the second kinds, a new function is defined
which interpolates the q-deformed Stirling numbers of the second kinds at
negative integers. The recurrence relations of the Stirling numbers of the
first and second kind are given. In addition, relation between q-deformed
Stirling numbers and q-Bell numbers is obtained.
","[{""version"":""v1"",""created"":""Sat, 3 Nov 2007 22:32:26 GMT""}]","2018-05-16"
"0711.0482","GianLuca Israel","GianLuca Israel (INAF, OA Roma), Federico Bernardini (Univ. I Roma),
  Marta Burgay (INAF, OA Cagliari), Nanda Rea (SRON/Univ. Amsterdam), Andrea
  Possenti (INAF OA Cagliari), Simone Dall'Osso (INAF OA Roma/Univ. Pisa)and
  Luigi Stella (INAF, OA Roma)","Transient Phenomena in Anomalous X-ray Pulsars","5 pages, 3 figures, proceedings of the conference ""40 Years of
  Pulsars, Millisecond Pulsars, Magnetars and More"", Montreal, August 12-17
  2007. To be published by AIPC","AIP Conf.Proc.983:244-248,2008","10.1063/1.2900152",,"astro-ph",,"  In 2003 a previously unpulsed Einstein and ROSAT source cataloged as soft and
dim (Lx of few 10^33 ergs) thermal emitting object, namely XTE J1810-197, was
identified as the first unambiguous transient Anomalous X-ray Pulsar. Two years
later this source was also found to be a bright highly polarized transient
radio pulsar, a unique property among both AXPs and radio pulsars. In September
2006 the Swift Burst Alert Telescope (BAT) detected an intense burst from the
candidate AXP CXOU J164710.2-455216, which entered in an outburst state
reaching a peak emission of at least a factor of 300 higher than quiescence.
Here, we briefly outline the recent results concerning the outburst phenomena
observed in these two AXPs. In particular, XTE J1810-197 has probed to be a
unique laboratory to monitor the timing and spectral properties of a
cooling/fading AXP, while new important information have been inferred from
X-ray and radio band simultaneous observations. CXOU J164710.2-455216 has been
monitored in X-rays and radio bands since the very beginning of its outbursting
state allowing us to cover the first phases of the outburst and to study the
timing and spectral behavior during the first months.
","[{""version"":""v1"",""created"":""Sat, 3 Nov 2007 22:45:03 GMT""}]","2009-06-23"
"0711.0483","Arcadi Santamaria","Miguel Nebot, Josep F. Oliver, David Palao and Arcadi Santamaria","Prospects for the Zee-Babu Model at the LHC and low energy experiments","50 pages, 18 figures. New data from BELLE and BABAR included in the
  analysis. New figures","Phys.Rev.D77:093013,2008","10.1103/PhysRevD.77.093013","FTUV/07-1103, IFIC/07-70, RM3-TH/07-16","hep-ph",,"  We analyze the viability of the Zee-Babu model as an explanation of observed
neutrino masses and mixings and the possibility that the model is confirmed or
discarded in experiments planned for the very close future. The allowed
parameter space is studied analytically by using some approximations and
partial data. Then, a complete scanning of all parameters and constraints is
performed numerically by using Monte Carlo methods. The cleanest signal of the
model will be the detection of the doubly charged scalar at the LHC and its
correlation with measurements of the branching ratio of $\mu\to e\gamma$ at the
MEG experiment. In addition, the model offers interesting predictions for
$\tau^{-}\to\mu^{+}\mu^{-}\mu^{-}$ experiments, lepton-hadron universality
tests, the $\theta_{13}$ mixing in neutrino oscillations and the
$<m_{\nu}>_{ee}$ parameter of neutrinoless double beta decay.
","[{""version"":""v1"",""created"":""Sat, 3 Nov 2007 23:06:59 GMT""},{""version"":""v2"",""created"":""Mon, 10 Mar 2008 18:11:26 GMT""}]","2008-11-26"
"0711.0485","Boris Grbi\'c","B. Grbic, R. Leturcq, T. Ihn, K. Ensslin, D. Reuter, A. D. Wieck","Hole transport in p-type GaAs quantum dots and point contacts","Proceedings of ICPS-28, Vienna 2006; 2 pages, 2 figures","AIP Conf. Proc. 893, 777 (2007)","10.1063/1.2730121",,"cond-mat.mes-hall",,"  Strong spin-orbit interaction characteristic for p-type GaAs systems, makes
such systems promising for the realization of spintronic devices. Here we
report on transport measurements in nanostructures fabricated on p-type,
C-doped GaAs heterostructures by scanning probe oxidation lithography. We
observe conductance quantization in a quantum point contact, as well as
pronounced Coulomb resonances in two quantum dots with different geometries.
Charging energies for both dots, extracted from Coulomb diamond measurements
are in agreement with the lithographic dimensions of the dots. The absence of
excited states in Coulomb diamond measurements indicates that the dots are in
the multi-level transport regime.
","[{""version"":""v1"",""created"":""Sun, 4 Nov 2007 00:18:37 GMT""}]","2007-11-06"
"0711.0487","Viggo Hansteen","Viggo H.Hansteen, Bart De Pontieu, Mats Carlsson, Scott McIntosh,
  Tetsuya Watanabe, Harry Warren, Louise Harra, Hirohisa Hara, Theodore D.
  Tarbell, Dick Shine, Alan Title, Carolus J. Schrijver, Saku Tsuneta, Yukio
  Katsukawa, Kiyoshi Ichimoto, Yoshinori Suematsu, Toshifumi Shimizu","On connecting the dynamics of the chromosphere and transition region
  with Hinode SOT and EIS","8 pages, 7 figures, accepted by PASJ special Hinode ""first light""
  issue",,"10.1093/pasj/59.sp3.S699",,"astro-ph",,"  We use coordinated Hinode SOT/EIS observations that include high-resolution
magnetograms, chromospheric and TR imaging and TR/coronal spectra in a first
test to study how the dynamics of the TR are driven by the highly dynamic
photospheric magnetic fields and the ubiquitous chromospheric waves. Initial
analysis shows that these connections are quite subtle and require a
combination of techniques including magnetic field extrapolations,
frequency-filtered time-series and comparisons with synthetic chromospheric and
TR images from advanced 3D numerical simulations. As a first result, we find
signatures of magnetic flux emergence as well as 3 and 5 mHz wave power above
regions of enhanced photospheric magnetic field in both chromospheric,
transition region and coronal emission.
","[{""version"":""v1"",""created"":""Sun, 4 Nov 2007 00:29:47 GMT""}]","2015-05-13"
"0711.0488","J. Lorenzo Diaz-Cruz","J. Lorenzo Diaz-Cruz","Holographic Dark Matter and Higgs","10 pages, 1 table","Phys.Rev.Lett.100:221802,2008","10.1103/PhysRevLett.100.221802","dual-cp-07-05","hep-ph",,"  We identify possible dark matter candidates within the class of strongly
interacting models where electroweak symmetry breaking is triggered by a light
composite Higgs boson. In these models, the Higgs boson emerges as a
Holographic pseudo-goldstone boson, while dark matter can be identified as a
fermionic composite state X^0, which is made stable through a conserved
(``dark'') quantum number. An effective lagrangian description of both the
Higgs and dark matter is proposed, that includes higher-dimensional operators
suppressed by an scale \Lambda_i. These operators will induce deviations from
the standard Higgs properties that could be meassured at future colliders
(LHC,ILC), and thus provide information on the dark matter scale. The dark
matter X^0, is expected to have a mass of order O(TeV), which is in agreement
with the values extracted from the cosmological bounds and the experimental
searches for dark matter.
","[{""version"":""v1"",""created"":""Sun, 4 Nov 2007 00:38:21 GMT""}]","2008-11-26"
"0711.0489","Boris Grbi\'c","Boris Grbic, Renaud Leturcq, Thomas Ihn, Klaus Ensslin, Dirk Reuter,
  Andreas D. Wieck","Aharonov-Bohm oscillations in p-type GaAs quantum rings","Proceedings of EP2DS-17, Genova 2007; Accepted for Physica E; 3
  pages, 3 figures","Physica E 40, 1273 (2008)","10.1016/j.physe.2007.08.129",,"cond-mat.mes-hall",,"  We have explored phase coherent transport of holes in two p-type GaAs quantum
rings with orbital radii 420 nm and 160 nm fabricated with AFM oxidation
lithography. Highly visible Aharonov-Bohm (AB) oscillations are measured in
both rings, with an amplitude of the oscillations exceeding 10% of the total
resistance in the case of the ring with a radius of 160 nm. Beside the h/e
oscillations, we resolve the contributions from higher harmonics of the AB
oscillations. The observation of a local resistance minimum at B=0 T in both
rings is a signature of the destructive interference of the holes' spins. We
show that this minimum is related to the minimum in the h/2e oscillations.
","[{""version"":""v1"",""created"":""Sun, 4 Nov 2007 01:34:22 GMT""}]","2008-03-30"
"0711.0490","Runliang Lin Dr.","Hongxia Wu, Xiaojun Liu, Yunbo Zeng","Two new multi-component BKP hierarchies","12 pages",,,,"nlin.SI",,"  We firstly propose two kinds of new multi-component BKP (mcBKP) hierarchy
based on the eigenfunction symmetry reduction and nonstandard reduction,
respectively. The first one contains two types of BKP equation with
self-consistent sources which Lax representations are presented. The two mcBKP
hierarchies both admit reductions to the $k-$constrained BKP hierarchy and to
integrable (1+1)-dimensional hierarchy with self-consistent sources, which
include two types of SK equation with self-consistent sources and of
bi-directional SK equations with self-consistent sources.
","[{""version"":""v1"",""created"":""Sun, 4 Nov 2007 02:03:22 GMT""}]","2007-11-06"
"0711.0491","Haluk Bingol","Mursel Tasgin, Amac Herdagdelen, and Haluk Bingol","Community Detection in Complex Networks Using Genetic Algorithms","Based on arXiv:cond-mat/0604419. 6 pages, 4 figures",,,,"physics.soc-ph",,"  Community detection is an important research topic in complex networks. We
present the employment of a genetic algorithm to detect communities in complex
networks which is based on optimizing network modularity. It does not need any
prior knowledge about the number of communities. Its performance is tested on
two real life networks with known community structures and a set of synthetic
networks. As the performance measure an information theoretical metric
variation of information is used. The results are promising and in some cases
better than previously reported studies.
","[{""version"":""v1"",""created"":""Sun, 4 Nov 2007 02:58:30 GMT""}]","2007-11-06"
"0711.0493","Krzysztof Burdzy","Krzysztof Burdzy and David White","Markov processes with product-form stationary distribution",,,,,"math.PR","http://arxiv.org/licenses/nonexclusive-distrib/1.0/","  We study a class of Markov processes with finite state space and continuous
time that have product form stationary distributions. We obtain a number of
examples that can generate conjectures for diffusions with inert drift.
","[{""version"":""v1"",""created"":""Sun, 4 Nov 2007 03:42:55 GMT""},{""version"":""v2"",""created"":""Sun, 19 Oct 2008 04:56:09 GMT""}]","2008-10-19"
"0711.0496","Defu Hou","Bo Feng, Defu Hou, Hai-cang Ren","Angular Momentum Mixing in a Non-spherical Color Superconductor","17 pages, 2 figues, in latex; References added, typos fixed","Nucl.Phys.B796:500-520,2008","10.1016/j.nuclphysb.2007.12.005",,"hep-ph",,"  We study the angular momentum mixing effects in the color superconductor with
non-spherical pairing. We first clarify the concept of the angular momentum
mixing with a toy model for non-relativistic and spinless fermions. Then we
derive the gap equation for the polar phase of dense QCD by minimizing the CJT
free energy. The solution of the gap equation consists of all angular momentum
partial waves of odd parity. The corresponding free energy is found to be lower
than that reported in the literature with p-wave only.
","[{""version"":""v1"",""created"":""Sun, 4 Nov 2007 07:04:05 GMT""},{""version"":""v2"",""created"":""Wed, 28 Nov 2007 13:46:36 GMT""}]","2008-11-26"
"0711.0497","Wei Wang","Ying Li, Cai-Dian L\""u and Wei Wang","Partners of Z(4430) and Productions in B Decays","12 pages, 5 figures. Published version","Phys.Rev.D77:054001,2008","10.1103/PhysRevD.77.054001",,"hep-ph hep-ex",,"  Recently, Belle Collaboration has reported a resonant state produced in $B\to
K \pi\psi'$, which is called Z(4430). This state is charged, so it can not be
interpreted as an ordinary charmonium state. In this paper, we analyze the
octet to which this particle belongs and predict the masses of mesons in this
octet. Utilizing flavor SU(3) symmetry, we study production rates in several
kinds of B decays. The $\bar B^0\to Z_s^-\pi^+\to K^-\psi'\pi^+$ and $B^-\to
\bar Z_s^0 \pi^-\to K_S\psi'\pi^-$ decay channels, favored by
Cabibbo-Kobayashi-Maskawa (CKM) matrix elements, can have branching ratios of
${\cal O}(10^{-5})$. This large branching ratio could be observed at the
running $B$ factories to detect $Z_s$ particles containing a strange quark. We
also predict large branching ratios of the $Z$ and $Z_c$ ($\bar cc\bar c D,
D=u,d,s$) particle production rates in non-leptonic $B_c$ decays and radiative
B decays. Measurements of these decays at the ongoing $B$ factories and the
forthcoming Large Hadron Collider (LHC)-b experiments are helpful to clarify
the mysterious $Z$ particles.
","[{""version"":""v1"",""created"":""Sun, 4 Nov 2007 07:07:41 GMT""},{""version"":""v2"",""created"":""Fri, 7 Mar 2008 09:32:13 GMT""}]","2008-11-26"
"0711.0498","Paul Cally","P. S. Cally, M. Goossens","Three Dimensional MHD Wave Propagation and Conversion to Alfven Waves
  near the Solar Surface. I. Direct Numerical Solution","Accepted for the HELAS II/ SOHO 19/ GONG 2007 Topical Issue of Solar
  Physics",,"10.1007/s11207-007-9086-3",,"astro-ph",,"  The efficacy of fast/slow MHD mode conversion in the surface layers of
sunspots has been demonstrated over recent years using a number of modelling
techniques, including ray theory, perturbation theory, differential eigensystem
analysis, and direct numerical simulation. These show that significant energy
may be transferred between the fast and slow modes in the neighbourhood of the
equipartition layer where the Alfven and sound speeds coincide. However, most
of the models so far have been two dimensional. In three dimensions the Alfven
wave may couple to the magneto-acoustic waves with important implications for
energy loss from helioseismic modes and for oscillations in the atmosphere
above the spot. In this paper, we carry out a numerical ``scattering
experiment'', placing an acoustic driver 4 Mm below the solar surface and
monitoring the acoustic and Alfvenic wave energy flux high in an isothermal
atmosphere placed above it. These calculations indeed show that energy
conversion to upward travelling Alfven waves can be substantial, in many cases
exceeding loss to slow (acoustic) waves. Typically, at penumbral magnetic field
strengths, the strongest Alfven fluxes are produced when the field is inclined
30-40 degrees from the vertical, with the vertical plane of wave propagation
offset from the vertical plane containing field lines by some 60-80 degrees.
","[{""version"":""v1"",""created"":""Sun, 4 Nov 2007 07:25:20 GMT""}]","2009-11-13"
"0711.0499","Takashi Taniguchi","Yasuo Ohno, Takashi Taniguchi, Satoshi Wakatsuki","On relations among Dirichlet series whose coefficients are class numbers
  of binary cubic forms","14pages",,,,"math.NT",,"  We study the class numbers of integral binary cubic forms. For each $SL_2(Z)$
invariant lattice $L$, Shintani introduced Dirichlet series whose coefficients
are the class numbers of binary cubic forms in $L$. We classify the invariant
lattices, and investigate explicit relationships between Dirichlet series
associated with those lattices. We also study the analytic properties of the
Dirichlet series, and rewrite the functional equation in a self dual form using
the explicit relationship.
","[{""version"":""v1"",""created"":""Sun, 4 Nov 2007 07:59:16 GMT""}]","2007-11-06"
"0711.0500","Ignas Snellen","I. Snellen, R. van der Burg, M. de Hoon, F. Vuijsje (Leiden
  Observatory)","A search for transiting extrasolar planet candidates in the OGLE-II
  microlens database of the galactic plane","8 Pages LaTeX, accepted by A&A",,"10.1051/0004-6361:20078365",,"astro-ph",,"  In the late 1990s, the Optical Gravitational Lensing Experiment (OGLE) team
conducted the second phase of their long-term monitoring programme, OGLE-II,
which since has been superseded by OGLE-III. All the monitoring data of this
second phase, which was primarily aimed at finding microlensing events, have
recently been made public. Fields in the OGLE-II survey have typically been
observed with a cadence of once per night, over a period of a few months per
year. We investigated whether these radically differently sampled data can also
be used to search for transiting extrasolar planets, in particular in the light
of future projects such as PanSTARRS and SkyMapper, which will monitor large
fields, but mostly not at a cadence typical for transit studies. We selected
data for ~15700 stars with 13.0<I<16.0 in three OGLE-II fields towards the
galactic disc in the constellation Carina, each with 500-600 epochs of I-band
photometry. These light curves were first detrended using Sys-Rem, after which
they were searched for low amplitude transits using the Box Least Squares
algorithm. The detrending algorithm significantly decreased the scatter in the
light curves, from an average of 0.5% down to 0.2-0.3% for stars with I<15.
Several dozens of eclipsing binaries and low amplitude transits were found, of
which 13 candidates exhibit transits with such depth and duration that they are
possibly caused by an object with a radius less than twice that of Jupiter.
Eleven out of these thirteen candidates show significant ellipsoidal light
variations and are unlikely to host a transiting extrasolar planet. However,
OGLE2-TR-L9 (CAR_SC2_75679), is an excellent planet candidate comparable to the
known OGLE-III transiting planets, and deserves further follow-up observations.
","[{""version"":""v1"",""created"":""Sun, 4 Nov 2007 08:20:28 GMT""}]","2009-11-13"
"0711.0501","Sourav Chatterjee","Sourav Chatterjee","A new approach to strong embeddings","A new example has been added. To appear in PTRF. 31 pages",,,,"math.PR math.ST stat.TH","http://arxiv.org/licenses/nonexclusive-distrib/1.0/","  We revisit strong approximation theory from a new perspective, culminating in
a proof of the Koml\'os-Major-Tusn\'ady embedding theorem for the simple random
walk. The proof is almost entirely based on a series of soft arguments and easy
inequalities. The new technique, inspired by Stein's method of normal
approximation, is applicable to any setting where Stein's method works. In
particular, one can hope to take it beyond sums of independent random
variables.
","[{""version"":""v1"",""created"":""Sun, 4 Nov 2007 08:35:02 GMT""},{""version"":""v2"",""created"":""Thu, 17 Jul 2008 03:22:35 GMT""},{""version"":""v3"",""created"":""Thu, 1 Jul 2010 23:13:15 GMT""}]","2010-07-05"
"0711.0502","Igor Malov","I.F.Malov","Anomalous Pulsars","13 pages, 9 figures",,,,"astro-ph",,"  Many astrophysicists believe that Anomalous X-Ray Pulsars (AXP), Soft
Gamma-Ray Repeaters (SGR), Rotational Radio Transients (RRAT), Compact Central
Objects (CCO), and X-Ray Dim Isolated Neutron Stars (XDINS) belong to different
classes of anomalous objects with neutron stars as the central bodies inducing
all their observable peculiarities. We have shown earlier (I.F.Malov and
G.Z.Machabeli, Astron. Astrophys. Trans. 25, 7, 2006) that AXPs and SGRs could
be described by the drift model in the framework of preposition on usual
properties of the central neutron star (rotation periods P ~ 0.1 - 1 sec,
surface magnetic fields B ~ 10^11 - 10^13 G). Here we shall try to show that
some differences of considered sources will be explained by their geometry
(particularly, by the angle BETA between their rotation and magnetic axes). If
BETA < 10 deg. (the aligned rotator) the drift waves at the outer layers of the
neutron star magnetosphere should play a key role in the observable
periodicity. For large values of BETA (the case of the nearly orthogonal
rotator) an accretion from the surrounding medium (for example, from the relic
disk) can cause some modulation and transient events in received radiation.
","[{""version"":""v1"",""created"":""Sun, 4 Nov 2007 08:57:19 GMT""}]","2007-11-06"
"0711.0503","Granovsky Boris","Boris L.Granovsky and Michael M. Erlihson","On time dynamics of coagulation-fragmentation processes","30pages.This is the final version that contains a few important
  changes in exposition implied by referees remarks and questions. The paper
  will be published in J. of Statistical Physics",,,,"math.PR math.CO","http://arxiv.org/licenses/nonexclusive-distrib/1.0/","  We establish a characterization of coagulation-fragmentation processes, such
that the induced birth and death processes depicting the total number of groups
at time $t\ge 0$ are time homogeneous. Based on this, we provide a
characterization of mean-field Gibbs coagulation-fragmentation models, which
extends the one derived by Hendriks et al. As a by- product of our results, the
class of solvable models is widened and a question posed by N. Berestycki and
Pitman is answered, under restriction to mean-field models.
","[{""version"":""v1"",""created"":""Sun, 4 Nov 2007 09:06:48 GMT""},{""version"":""v2"",""created"":""Thu, 24 Jul 2008 07:38:02 GMT""},{""version"":""v3"",""created"":""Mon, 8 Dec 2008 09:39:46 GMT""}]","2008-12-08"
"0711.0504","Giulio Auriemma","G. Auriemma","CPT violations in Astrophysics and Cosmology","13 pages, Invited Paper to the Frascati Workshop 2007 Vulcano
  (Italy), May 28 - June 2, 2007-Corrected minor typos and added references",,,,"astro-ph hep-ph",,"  In this paper it is given a brief review of the current limits on the
magnitude of CPT and Lorentz Invariance violations, currently predicted in
connection with quantum gravity and string/M-theory, that can be derived from
astrophysical and cosmological data. Even if not completely unambiguous, these
observational tests of fundamental physics are complementary to the ones
obtained by accelerator experiments and by ground or space based direct
experiments, because potentially can access very high energies and large
distances.
","[{""version"":""v1"",""created"":""Sun, 4 Nov 2007 09:14:50 GMT""},{""version"":""v2"",""created"":""Thu, 8 Nov 2007 11:16:19 GMT""}]","2007-11-08"
"0711.0505","Luca Marinatto","GianCarlo Ghirardi and Luca Marinatto","Proofs of nonlocality without inequalities revisited","8 pages, RevTex; to be published on PLA",,"10.1016/j.physleta.2007.11.012",,"quant-ph",,"  We discuss critically the so-called nonlocality without inequalities proofs
for bipartite quantum states, we generalize them and we analyze their relation
with the Clauser-Horne inequality.
","[{""version"":""v1"",""created"":""Sun, 4 Nov 2007 09:49:09 GMT""}]","2009-11-13"
