"0711.0414","Sanjay Reddy","J. Carlson and Sanjay Reddy","Polarization Measurements and the Pairing Gap in the Universal Regime","4 pages, 3 figures. Revised verison includes cosmetic changes to the
  text and figures. One reference added","Phys. Rev. Lett. 100, 150403 (2008)","10.1103/PhysRevLett.100.150403",,"cond-mat.str-el",,"  We analyze recent cold-atom experiments on imbalanced Fermi systems using a
minimal model with a BCS-like superfluid phase coexisting with a normal phase.
This model is used to extract the T=0 pairing gap in the fully paired
superfluid state. The recently measured particle density profiles are in good
agreement with the theoretical predictions obtained from the universal
parameters from previous Quantum Monte Carlo calculations. We find that the T=0
pairing gap is greater than 0.4 times the Fermi energy $E_F$, with a preferred
value of $0.45 \pm 0.05$ $E_F$. The ratio of the pairing gap $\Delta$ to the
Fermi Energy $E_F$ is larger here than in any other system of strongly-paired
fermions in which individual pairs are unbound.
","[{""version"":""v1"",""created"":""Sat, 3 Nov 2007 17:42:10 GMT""},{""version"":""v2"",""created"":""Fri, 16 Nov 2007 23:31:25 GMT""}]","2008-04-28"
"0711.0450","Michael Ivanov A","Michael A. Ivanov","A few remarks about the Pioneer anomaly","3 pages, no figure, Latex. Poster contribution to the STScI Workshop
  ""Astrophysics 2020: Large Space Missions Beyond the Next Decade"", 13 Nov - 15
  Nov 2007, Baltimore, USA",,,,"physics.gen-ph physics.space-ph",,"  Some features of the Pioneer anomaly are discussed in context of author's
explanation of this effect as a deceleration of the probes in the graviton
background. It is noted that if the model is true then the best parameter of
the anomalous acceleration should be not the distance to the Sun but a cosine
of the angle between a velocity of the probe and its radius-vector.
","[{""version"":""v1"",""created"":""Sun, 4 Nov 2007 09:09:37 GMT""},{""version"":""v2"",""created"":""Thu, 15 Nov 2007 11:19:59 GMT""}]","2007-11-15"
"0711.0459","Marvin D. Girardeau","M. D. Girardeau and E. M. Wright","Rotating ground states of a one-dimensional spin-polarized gas of
  fermionic atoms with attractive p-wave interactions on a mesoscopic ring","4 pages, 1 figure, revtex4; 1 incorrect phrase deleted. Submitted to
  Phys. Rev. Lett",,"10.1103/PhysRevLett.100.200403",,"cond-mat.other",,"  The major finding of this paper is that a one-dimensional spin-polarized gas
comprised of an even number of fermionic atoms interacting via attractive
p-wave interactions and confined to a mesoscopic ring has a degenerate pair of
ground states that are oppositely rotating. In any realization the gas will
thus spontaneously rotate one way or the other in spite of the fact that there
is no external rotation or bias fields. Our goal is to show that this
counter-intuitive finding is a natural consequence of the combined effects of
quantum statistics, ring topology, and exchange interactions.
","[{""version"":""v1"",""created"":""Sat, 3 Nov 2007 16:01:29 GMT""},{""version"":""v2"",""created"":""Tue, 6 Nov 2007 16:37:24 GMT""}]","2009-11-13"
"0711.0460","Gintaras Valusis","D. Seliuta, J. Kavaliauskas, B. Cechavicius, S. Balakauskas, G.
  Valusis, B. Sherliker, M. P. Halsall, P. Harrison, M. Lachab, S. P. Khanna,
  and E. H. Linfield","Terahertz sensing by beryllium and silicon delta-doped GaAs/AlAs quantum
  wells","6 pages, 3 figures",,,,"cond-mat.mtrl-sci",,"  Selective sensing of terahertz (THz) radiation by beryllium and silicon
delta-doped GaAs/AlAs multiple quantum wells (MQWs) is demonstrated. A
sensitivity up to 0.3 V/W within 0.5{4.2 THz in silicon- and up to 1 V/W within
4.2-7.3 THz range in beryllium-doped MQWs at liquid helium temperatures is
shown. The built-in electric fields as estimated from the observed
Franz-Keldysh oscillations in photoreflectance spectra were found to be located
close to the cap and buffer layers of MQWs and vary from 18 kV/cm up to 49
kV/cm depending on the structure design.
","[{""version"":""v1"",""created"":""Sat, 3 Nov 2007 16:24:19 GMT""}]","2007-11-06"
"0711.0461","Benoit Ruffl\'e","B. Ruffl\'e (Univ. Montpellier II), D.A. Parshin (Univ. Montpellier II
  and Saint Petersburg State Technical University), E. Courtens (Univ.
  Montpellier II), R. Vacher (Univ. Montpellier II)","The Boson Peak and its Relation with Acoustic Attenuation in Glasses","4 pages, 3 figures, Physical Review Letters in press","Phys. Rev. Lett. 100, 015501 (2008)","10.1103/PhysRevLett.100.015501",,"cond-mat.dis-nn cond-mat.mtrl-sci",,"  Experimental results on the density of states and on the acoustic modes of
glasses in the THz region are compared to the predictions of two categories of
models. A recent one, solely based on an elastic instability, does not account
for most observations. Good agreement without adjustable parameters is obtained
with models including the existence of non-acoustic vibrational modes at THz
frequency, providing in many cases a comprehensive picture for a range of glass
anomalies.
","[{""version"":""v1"",""created"":""Sat, 3 Nov 2007 16:51:00 GMT""}]","2011-09-16"
"0711.0462","Guoming Wang","Guoming Wang, Mingsheng Ying","Perfect many-to-one teleportation with stabilizer states","12 pages, no figure","Phys. Rev. A 77, 032324 (2008)","10.1103/PhysRevA.77.032324",,"quant-ph",,"  We study the possibility of performing perfect teleportation of unknown
quantum states from multiple senders to a single receiver with a previously
shared stabilizer state. In the model we considered, the utilized stabilizer
state is partitioned into several subsystems and then each subsystem is
distributed to a distinct party. We present two sufficient conditions for a
stabilizer state to achieve a given nonzero teleportation capacity with respect
to a given partition plan. The corresponding teleportation protocols are also
explicitly given. Interestingly, we find that even mixed stabilizer states are
also useful for perfect many-to-one teleportation. Finally, our work provides a
new perspective from stabilizer formalism to view the standard teleportation
protocol and also suggests a new technique for analyzing teleportation
capability of multipartite entangled states.
","[{""version"":""v1"",""created"":""Sun, 4 Nov 2007 07:00:59 GMT""}]","2011-08-26"
"0711.0463","Matthew Maciej Szczesny","Matthew Szczesny","On the structure and representations of the insertion-elimination Lie
  algebra",,,"10.1007/s11005-008-0235-x",,"math.QA math.RT",,"  We examine the structure of the insertion-elimination Lie algebra on rooted
trees introduced in \cite{CK}. It possesses a triangular structure $\g = \n_+
\oplus \mathbb{C}.d \oplus \n_-$, like the Heisenberg, Virasoro, and affine
algebras. We show in particular that it is simple, which in turn implies that
it has no finite-dimensional representations. We consider a category of
lowest-weight representations, and show that irreducible representations are
uniquely determined by a ""lowest weight"" $\lambda \in \mathbb{C}$. We show that
each irreducible representation is a quotient of a Verma-type object, which is
generically irreducible.
","[{""version"":""v1"",""created"":""Sat, 3 Nov 2007 17:04:04 GMT""}]","2009-11-13"
"0711.0464","Jan Stienstra","Jan Stienstra","Hypergeometric Systems in two Variables, Quivers, Dimers and Dessins
  d'Enfants","45 pages, 14 figures, submitted for proceedings of the workshop
  `Modular Forms and String Duality', BIRS June 2006",,,,"math.AG hep-th",,"  This paper presents some parallel developments in Quiver/Dimer Models,
Hypergeometric Systems and Dessins d'Enfants. The setting in which Gelfand,
Kapranov and Zelevinsky have formulated the theory of hypergeometric systems,
provides also a natural setting for dimer models. The Fast Inverse Algorithm,
the untwisting procedure and the Kasteleyn matrix for dimer models are recasted
in this setting. There is a relation between triangulations in GKZ theory and
some perfect matchings in the dimer models, so that the secondary polygon
coincides with the Newton polygon of the Kasteleyn determinant. Finally it is
observed in examples and conjectured to hold in general, that the determinant
of the Kasteleyn matrix with suitable weights becomes after a simple
transformation equal to the principal A-determinant in GKZ theory.
","[{""version"":""v1"",""created"":""Sat, 3 Nov 2007 17:13:28 GMT""}]","2007-11-12"
"0711.0465","Luca Fabrizio Di Cerbo","Luca Fabrizio Di Cerbo","Generic Properties of Homogeneous Ricci Solitons","Some changes according the comments of the referees. Added
  acknowledgments",,,,"math.DG","http://arxiv.org/licenses/nonexclusive-distrib/1.0/","  We discuss the geometry of homogeneous Ricci solitons. After showing the
nonexistence of compact homogeneous and noncompact steady homogeneous solitons,
we concentrate on the study of left invariant Ricci solitons. We show that, in
the unimodular case, the Ricci soliton equation does not admit solutions in the
set of left invariant vector fields. We prove that a left invariant soliton of
gradient type must be a Riemannian product with a nontrivial Euclidean de Rham
factor. As an application of our results we prove that any generalized metric
Heisenberg Lie group is a nongradient left invariant Ricci soliton of expanding
type.
","[{""version"":""v1"",""created"":""Sat, 3 Nov 2007 18:09:31 GMT""},{""version"":""v2"",""created"":""Mon, 9 Jan 2012 00:47:39 GMT""},{""version"":""v3"",""created"":""Sat, 22 Sep 2012 16:00:41 GMT""}]","2012-09-25"
"0711.0466","David Hartwick","F.D.A. Hartwick","A Model for Dark Matter Halos","14 pages, 3 figures, accepted for publication in ApJ",,"10.1086/525246",,"astro-ph",,"  A halo model is presented which possesses a constant phase space density (Q)
core followed by a radial CDM-like power law decrease in Q. The motivation for
the core is the allowance for a possible primordial phase space density limit
such as the Tremaine-Gunn upper bound. The space density profile derived from
this model has a constant density core and falls off rapidly beyond. The new
model is shown to improve the fits to the observations of LSB galaxy rotation
curves, naturally provides a model which has been shown to result in a
lengthened dynamical friction time scale for the Fornax dwarf spheroidal galaxy
and predicts a flattening of the density profile within the Einstein radius of
galaxy clusters. A constant gas entropy floor is predicted whose adiabatic
constant provides a lower limit in accord with observed galaxy cluster values.
While `observable-sized' cores are not seen in standard cold dark matter (CDM)
simulations, phase space considerations suggest that they could appear in warm
dark matter (WDM) cosmological simulations and in certain hierarchically
consistent SuperWIMP scenarios.
","[{""version"":""v1"",""created"":""Sat, 3 Nov 2007 18:28:22 GMT""}]","2009-11-13"
"0711.0467","Joseph A. Mu\~noz","Joseph A. Mu\~noz, Abraham Loeb","Verifying the Identity of High-Redshift Massive Galaxies Through the
  Clustering of Lower Mass Galaxies Around Them","7 pages, 5 figures. Typos corrected","2008, MNRAS, 385, 2175","10.1111/j.1365-2966.2008.12986.x",,"astro-ph","http://arxiv.org/licenses/nonexclusive-distrib/1.0/","  Massive high-redshift galaxies form in over-dense regions where the
probability of forming other galaxies is also strongly enhanced. Given an
observed flux of a galaxy, the inferred mass of its host halo tends to be
larger as its inferred redshift increases. As the mass and redshift of a galaxy
halo increase, the expected clustering of other galaxies around it gets
stronger. It is therefore possible to verify the high-redshift identity of a
galaxy (prior to an unambiguous spectral identification) from the clustering of
other galaxies around it. We illustrate this method for the massive galaxy
suggested by Mobasher et al. (2005) to be at redshift z~6.5. If this galaxy
were to exist at z~6.5, there should have been a mean of ~10 galaxies larger
than a hundredth of its mass and having z-band magnitudes less than ~25
detected as i-dropouts in the HUDF. We calculate an approximate probability
distribution for neighbor galaxies and determine that there is less than a
~0.3% chance of detecting no massive neighbor galaxies. The lack of other
massive z~6.5 galaxies in the HUDF image argues that the Mobasher et al. (2005)
galaxy is instead a low redshift interloper. We generalize our results to other
galaxy masses and redshifts.
","[{""version"":""v1"",""created"":""Sat, 3 Nov 2007 18:38:52 GMT""},{""version"":""v2"",""created"":""Thu, 13 Mar 2008 21:44:04 GMT""},{""version"":""v3"",""created"":""Sun, 13 Jul 2008 00:37:42 GMT""}]","2009-09-29"
"0711.0468","Hector Bombin","H. Bombin and M.A. Martin-Delgado","Statistical Mechanical Models and Topological Color Codes","Revtex4, color figures, submitted for publication","Phys. Rev. A 77, 042322 (2008)","10.1103/PhysRevA.77.042322",,"quant-ph cond-mat.str-el hep-th",,"  We find that the overlapping of a topological quantum color code state,
representing a quantum memory, with a factorized state of qubits can be written
as the partition function of a 3-body classical Ising model on triangular or
Union Jack lattices. This mapping allows us to test that different
computational capabilities of color codes correspond to qualitatively different
universality classes of their associated classical spin models. By generalizing
these statistical mechanical models for arbitrary inhomogeneous and complex
couplings, it is possible to study a measurement-based quantum computation with
a color code state and we find that their classical simulatability remains an
open problem. We complement the meaurement-based computation with the
construction of a cluster state that yields the topological color code and this
also gives the possibility to represent statistical models with external
magnetic fields.
","[{""version"":""v1"",""created"":""Sat, 3 Nov 2007 18:43:24 GMT""}]","2009-11-13"
"0711.0469","Susanna Widicus Weaver","Susanna L. Widicus Weaver, Anthony J. Remijan, Robert J. McMahon, and
  Benjamin J. McCall","A search for ortho-benzyne (o-C6H4) in CRL 618","13 pages, 4 figures, to be published in The Astrophysical Journal
  Letters",,"10.1086/525042",,"astro-ph",,"  Polycyclic aromatic hydrocarbons (PAHs) have been proposed as potential
carriers of the unidentified infrared bands (UIRs) and the diffuse interstellar
bands (DIBs). PAHs are not likely to form by gas-phase or solid-state
interstellar chemistry, but rather might be produced in the outflows of
carbon-rich evolved stars. PAHs could form from acetylene addition to the
phenyl radical (C6H5), which is closely chemically related to benzene (C6H6)
and ortho-benzyne (o-C6H4). To date, circumstellar chemical models have been
limited to only a partial treatment of benzene-related chemistry, and so the
expected abundances of these species are unclear. A detection of benzene has
been reported in the envelope of the proto-planetary nebula (PPN) CRL 618, but
no other benzene-related species has been detected in this or any other source.
The spectrum of o-C6H4 is significantly simpler and stronger than that of C6H5,
and so we conducted deep Ku-, K- and Q-band searches for o-C6H4 with the Green
Bank Telescope. No transitions were detected, but an upper limit on the column
density of 8.4x10^13 cm^-2 has been determined. This limit can be used to
constrain chemical models of PPNe, and this study illustrates the need for
complete revision of these models to include the full set of benzene-related
chemistry.
","[{""version"":""v1"",""created"":""Sat, 3 Nov 2007 18:47:48 GMT""},{""version"":""v2"",""created"":""Tue, 13 Nov 2007 18:49:21 GMT""}]","2015-05-13"
"0711.0470","Daniel Boyanovsky","Daniel Boyanovsky","Free streaming in mixed dark matter","19 pages, 2 figures. More discussions same conclusions and results.
  Version to appear in Phys. Rev. D","Phys.Rev.D77:023528,2008","10.1103/PhysRevD.77.023528",,"astro-ph hep-ph",,"  Free streaming in a \emph{mixture} of collisionless non-relativistic dark
matter (DM) particles is studied by implementing methods from the theory of
multicomponent plasmas. The mixture includes Fermionic, condensed and non
condensed Bosonic particles decoupling in equilibrium while relativistic, heavy
non-relativistic thermal relics (WIMPs), and sterile neutrinos that decouple
\emph{out of equilibrium} when they are relativistic. The free-streaming length
$\lambda_{fs}$ is obtained from the marginal zero of the gravitational
polarization function, which separates short wavelength Landau-damped from long
wavelength Jeans-unstable \emph{collective} modes. At redshift $z$ we find $
\frac{1}{\lambda^2_{fs}(z)}= \frac{1}{(1+z)} \big[\frac{0.071}{\textrm{kpc}}
\big]^2 \sum_{a}\nu_a g^{2/3}_{d,a}({m_a}/{\mathrm{keV}})^2 I_a $,where $0\leq
\nu_a \leq 1$ are the \emph{fractions} of the respective DM components of mass
$m_a$ that decouple when the effective number of ultrarelativistic degrees of
freedom is $g_{d,a}$, and $I_a$ only depend on the distribution functions at
decoupling, given explicitly in all cases. If sterile neutrinos produced either
resonantly or non-resonantly that decouple near the QCD scale are the
\emph{only} DM component,we find $\lambda_{fs}(0) \simeq 7 \mathrm{kpc}
(\mathrm{keV}/m)$ (non-resonant), $\lambda_{fs}(0) \simeq 1.73 \mathrm{kpc}
(\mathrm{keV}/m)$ (resonant).If WIMPs with $m_{wimp} \gtrsim 100 \mathrm{GeV}$
decoupling at $T_d \gtrsim 10 \mathrm{MeV}$ are present in the mixture with
$\nu_{wimp} \gg 10^{-12}$,$\lambda_{fs}(0) \lesssim 6.5 \times 10^{-3}
\mathrm{pc}$ is \emph{dominated} by CDM. If a Bose Einstein condensate is a DM
component its free streaming length is consistent with CDM because of the
infrared enhancement of the distribution function.
","[{""version"":""v1"",""created"":""Sat, 3 Nov 2007 19:10:30 GMT""},{""version"":""v2"",""created"":""Fri, 14 Dec 2007 21:12:10 GMT""}]","2008-12-18"
"0711.0471","Gusztav Morvai","G. Morvai and B. Weiss","Prediction for discrete time series",,"Probab. Theory Related Fields 132 (2005), no. 1, 1--12",,,"math.PR cs.IT math.IT",,"  Let $\{X_n\}$ be a stationary and ergodic time series taking values from a
finite or countably infinite set ${\cal X}$. Assume that the distribution of
the process is otherwise unknown. We propose a sequence of stopping times
$\lambda_n$ along which we will be able to estimate the conditional probability
$P(X_{\lambda_n+1}=x|X_0,...,X_{\lambda_n})$ from data segment
$(X_0,...,X_{\lambda_n})$ in a pointwise consistent way for a restricted class
of stationary and ergodic finite or countably infinite alphabet time series
which includes among others all stationary and ergodic finitarily Markovian
processes. If the stationary and ergodic process turns out to be finitarily
Markovian (among others, all stationary and ergodic Markov chains are included
in this class) then $ \lim_{n\to \infty} {n\over \lambda_n}>0$ almost surely.
If the stationary and ergodic process turns out to possess finite entropy rate
then $\lambda_n$ is upperbounded by a polynomial, eventually almost surely.
","[{""version"":""v1"",""created"":""Sat, 3 Nov 2007 19:24:35 GMT""}]","2008-06-19"
"0711.0472","Gusztav Morvai","G. Morvai and B. Weiss","Order estimation of Markov chains",,"IEEE Trans. Inform. Theory 51 (2005), no. 4, 1496--1497",,,"math.PR cs.IT math.IT",,"  We describe estimators $\chi_n(X_0,X_1,...,X_n)$, which when applied to an
unknown stationary process taking values from a countable alphabet ${\cal X}$,
converge almost surely to $k$ in case the process is a $k$-th order Markov
chain and to infinity otherwise.
","[{""version"":""v1"",""created"":""Sat, 3 Nov 2007 19:30:25 GMT""}]","2008-06-19"
"0711.0473","Thomas Fiore","Thomas M. Fiore, Simona Paoli, Dorette A. Pronk","Model Structures on the Category of Small Double Categories","103 pages. Included Quillen adjunctions with Cat, improved
  characterization of flexible double categories, proved 2-cocompleteness of
  DblCat_v, proved horizontal nerve is 2-coskeletal, cut double
  categorification for a future article, removed identity squares from double
  derivation schemes, improved counterexample to Reedy transfer.","Algebr. Geom. Topol. 8 (2008) 1855-1959","10.2140/agt.2008.8.1855",,"math.AT math.CT","http://arxiv.org/licenses/nonexclusive-distrib/1.0/","  In this paper we obtain several model structures on {\bf DblCat}, the
category of small double categories. Our model structures have three sources.
We first transfer across a categorification-nerve adjunction. Secondly, we view
double categories as internal categories in {\bf Cat} and take as our weak
equivalences various internal equivalences defined via Grothendieck topologies.
Thirdly, {\bf DblCat} inherits a model structure as a category of algebras over
a 2-monad. Some of these model structures coincide and the different points of
view give us further results about cofibrant replacements and cofibrant
objects. As part of this program we give explicit descriptions and discuss
properties of free double categories, quotient double categories, colimits of
double categories, several nerves, and horizontal categorification.
","[{""version"":""v1"",""created"":""Sat, 3 Nov 2007 19:40:21 GMT""},{""version"":""v2"",""created"":""Thu, 12 Jun 2008 08:38:18 GMT""}]","2014-10-01"
"0711.0474","Gintaras Valusis","D. Seliuta, A. Juozapavicius, V. Gruzinskis, S. Balakauskas, S.
  Asmontas, G. Valusis, W.-H. Chow, P. Steenson, P. Harrison, A. Lisauskas, H.
  G. Roskos, and K. Koehler","Electric field gradient induced effects in GaAs/AlGaAs modulation-doped
  structures and high frequency sensing","9 pages, 13 figures; version 2 -- greek letters in figures corrected",,,,"cond-mat.mtrl-sci",,"  Electric field gradient effects induced by an asymmetrically in-plane shaped
GaAs/AlGaAs modulation-doped structures of various design are investigated
within 4-300 K temperature range. It is demonstrated that current-voltage
characteristics of such structures at low, 4-80 K, temperatures exhibit
well-pronounced asymmetry arising due to a presence of two different gradients
of the electric field in a two dimensional electron gas. This phenomenon is
caused by both, different accumulation of two-dimensional electrons due to
asymmetrical shape of the structure and nonlocality in the electron drift
velocity. Experiments are illustrated by a phenomenological model and Monte
Carlo simulation. Possible applications of the effect to detect electromagnetic
radiation of GHz and THz frequencies are discussed as well.
","[{""version"":""v1"",""created"":""Sat, 3 Nov 2007 20:20:42 GMT""},{""version"":""v2"",""created"":""Mon, 21 Apr 2008 13:18:37 GMT""}]","2009-09-29"
"0711.0475","Debasis Sarkar","Indrani Chattopadhyay, Debasis Sarkar","Local Indistinguishability and Possibility of Hiding cbits in Activable
  Bound Entangled States","10 pages, no figure, latex, final version","Physics Letters A, 365 (2007) 273-277","10.1016/j.physleta.2007.01.030",,"quant-ph",,"  In this letter we prove local indistinguishability of four orthogonal
activable bound entangled states shared among even number of parties. All
reduced density matrices of such states are maximally mixed. We further proceed
to establish a multipartite quantum data hiding scheme on those states and
explore its power and limitations.
","[{""version"":""v1"",""created"":""Sat, 3 Nov 2007 20:48:24 GMT""}]","2009-11-13"
"0711.0476","Zoran \v{S}uni\'c","Zoran Sunic","A pastiche on embeddings into simple groups (following P. E. Schupp)","added details in the definition of C'(1/6) over free products",,,,"math.GR",,"  Let lambda be an infinite cardinal number and let C = {H_i| i in I} be a
family of nontrivial groups. Assume that |I|<=lambda, |H_i|<= lambda, for i in
I, and at least one member of C achieves the cardinality lambda.
  We show that there exists a simple group S of cardinality lambda that
contains an isomorphic copy of each member of C and, for all H_i, H_j in C with
|H_j|=lambda, is generated by the copies of H_i and H_j in S.
  This generalizes a result of Paul E. Schupp (moreover, our proof follows the
same approach based on small cancelation). In the countable case, we partially
recover a much deeper embedding result of Alexander Yu. Ol'shanskii.
","[{""version"":""v1"",""created"":""Sat, 3 Nov 2007 21:46:27 GMT""},{""version"":""v2"",""created"":""Thu, 7 Feb 2008 19:10:21 GMT""}]","2008-02-07"
"0711.0477","Caterina Consani","Caterina Consani","Noncommutative geometry and motives (a quoi servent les endomotifs?)","36 pages",,,,"math.QA math.AG math.NT math.OA",,"  This paper gives a short and historical survey on the theory of pure motives
in algebraic geometry and reviews some of the recent developments of this
theory in noncommutative geometry. The second part of the paper outlines the
new theory of endomotives and some of its relevant applications in
number-theory.
","[{""version"":""v1"",""created"":""Sat, 3 Nov 2007 21:15:12 GMT""}]","2007-11-06"
"0711.0478","Valentin Zagrebnov","V.A.Zagrebnov","Quasi-Sectorial Contractions",,,,,"math.FA math.GM",,"  We revise the notion of the quasi-sectorial contractions. Our main theorem
establishes a relation between semigroups of quasi-sectorial contractions and a
class of m-sectorial generators. We discuss a relevance of this kind of
contractions to the theory of operator-norm approximations of strongly
continuous semigroups.
","[{""version"":""v1"",""created"":""Sat, 3 Nov 2007 21:28:26 GMT""}]","2007-11-06"
