"0711.2380","Pavel Kurakin","P. V. Kurakin","Hidden time interpretation of quantum mechanics and ""no protocol""
  argument","8 pages, 7 figures. Reported at the International Symposium ""Quantum
  Informatics - 2007"", 1 - 5 Oct., Lipki, Russia. Discusses arguments raised at
  ""Are superluminal signals an acceptable hypothesis? - Difficulties in
  building communication protocol with them"", quant-ph/0610159",,"10.1117/12.801906",,"physics.gen-ph",,"  Previously suggested hidden time interpretation of quantum mechanics allows
to reproduce the same predictions as standard quantum mechanics provides, since
it is based on Feynman many - paths formulation of QM. While new experimental
consequences of this interpretation are under investigation, some advantages
can be enumerated. (1) The interpretation is much field theoretic - like in
classical sense, so it is local in mathematical sense, though quantum
(physical) non-locality is preserved. (2) The interpretation is based on one
type of mathematical objects, rather than two different (Hilbert space vectors
and operators). (3) The interpretation, as it was argued, overcomes the problem
of hidden variables in a radically new way, with no conflict to Bell's theorem.
Recently an important argument against hidden variables - like formulations of
quantum theory was risen - ""no protocol"" argument. It is argued in the paper,
that hidden time interpretation successfully overcomes this argument.
","[{""version"":""v1"",""created"":""Thu, 15 Nov 2007 11:33:08 GMT""}]","2009-11-13"
"0711.2381","Fernando Casas","Fernando Casas","Sufficient conditions for the convergence of the Magnus expansion","20 pages","J. Phys. A: Math. Theor. 40 (2007), 15001-15017","10.1088/1751-8113/40/50/006",,"math.CA",,"  Two different sufficient conditions are given for the convergence of the
Magnus expansion arising in the study of the linear differential equation $Y' =
A(t) Y$. The first one provides a bound on the convergence domain based on the
norm of the operator $A(t)$. The second condition links the convergence of the
expansion with the structure of the spectrum of $Y(t)$, thus yielding a more
precise characterization. Several examples are proposed to illustrate the main
issues involved and the information on the convergence domain provided by both
conditions.
","[{""version"":""v1"",""created"":""Thu, 15 Nov 2007 11:34:47 GMT""}]","2009-04-11"
"0711.2382","Nicolas Vergne","Nicolas Vergne (1) and Miguel Abadi (2) ((1) Laboratoire Statistique
  et G\'enome France, (2) Universidade de Campinas Brazil)","Poisson approximation for search of rare words in DNA sequences","29 pages, 0 figures",,,,"math.PR math.ST stat.AP stat.TH",,"  Using recent results on the occurrence times of a string of symbols in a
stochastic process with mixing properties, we present a new method for the
search of rare words in biological sequences generally modelled by a Markov
chain. We obtain a bound on the error between the distribution of the number of
occurrences of a word in a sequence (under a Markov model) and its Poisson
approximation. A global bound is already given by a Chen-Stein method. Our
approach, the psi-mixing method, gives local bounds. Since we only need the
error in the tails of distribution, the global uniform bound of Chen-Stein is
too large and it is a better way to consider local bounds. We search for two
thresholds on the number of occurrences from which we can regard the studied
word as an over-represented or an under-represented one. A biological role is
suggested for these over- or under-represented words. Our method gives such
thresholds for a panel of words much broader than the Chen-Stein method.
Comparing the methods, we observe a better accuracy for the psi-mixing method
for the bound of the tails of distribution. We also present the software PANOW
(available at http://stat.genopole.cnrs.fr/software/panowdir/) dedicated to the
computation of the error term and the thresholds for a studied word.
","[{""version"":""v1"",""created"":""Thu, 15 Nov 2007 11:37:37 GMT""}]","2007-11-16"
"0711.2383","Barbara Cerato","Barbara Cerato, Guido Masera and Emanuele Viterbo","Decoding the Golden Code: a VLSI design","25 pages, 10 figures",,,,"cs.AR",,"  The recently proposed Golden code is an optimal space-time block code for 2 X
2 multiple-input multiple-output (MIMO) systems. The aim of this work is the
design of a VLSI decoder for a MIMO system coded with the Golden code. The
architecture is based on a rearrangement of the sphere decoding algorithm that
achieves maximum-likelihood (ML) decoding performance. Compared to other
approaces, the proposed solution exhibits an inherent flexibility in terms of
modulation schemes QAM modulation size and this makes our architecture
particularly suitable for adaptive modulation schemes.
","[{""version"":""v1"",""created"":""Thu, 15 Nov 2007 11:55:30 GMT""}]","2007-11-16"
"0711.2384","Andrea Tomadin","Andrea Tomadin, Marco Polini, M.P. Tosi, Rosario Fazio","Nonequilibrium pairing instability in ultracold Fermi gases with
  population imbalance","10 pages, 6 figures. High-quality figures can be requested to the
  authors","Phys. Rev. A 77, 033605 (2008)","10.1103/PhysRevA.77.033605",,"cond-mat.str-el cond-mat.supr-con",,"  We present detailed numerical and analytical investigations of the
nonequilibrium dynamics of spin-polarized ultracold Fermi gases following a
sudden switching-on of the atom-atom pairing coupling strength. Within a
time-dependent mean-field approach we show that on increasing the imbalance it
takes longer for pairing to develop, the period of the nonlinear oscillations
lengthens, and the maximum value of the pairing amplitude decreases. As
expected, dynamical pairing is suppressed by the increase of the imbalance.
Eventually, for a critical value of the imbalance the nonlinear oscillations do
not even develop. Finally, we point out an interesting temperature-reentrant
behavior of the exponent characterizing the initial instability.
","[{""version"":""v1"",""created"":""Thu, 15 Nov 2007 11:41:07 GMT""}]","2008-03-06"
"0711.2385","Marian Lazar","M. Lazar","Fast magnetization in counterstreaming plasmas with temperature
  anisotropies",,,"10.1016/j.physleta.2007.11.063",,"physics.plasm-ph physics.gen-ph",,"  Counterstreaming plasmas exhibits an electromagnetic unstable mode of
filamentation type, which is responsible for the magnetization of plasma
system. It is shown that filamentation instability becomes significantly faster
when plasma is hotter in the streaming direction. This is relevant for
astrophysical sources, where strong magnetic fields are expected to exist and
explain the nothermal emission observed.
","[{""version"":""v1"",""created"":""Thu, 15 Nov 2007 11:49:30 GMT""}]","2009-11-13"
"0711.2386","Hajime Takami","Hajime Takami and Katsuhiko Sato","Distortion of Ultra-high-energy sky by Galactic Magnetic Field","9 pages, 6 figures, submitted to ApJ","Astrophys.J.681:1279-1287,2008","10.1086/588513",,"astro-ph",,"  We investigate the deflections of UHE protons by Galactic magnetic field(GMF)
using four conventional GMF models in order to discuss the positional
correlation between the arrival distribution of UHECRs and their sources. UHE
protons coming from the direction around the Galactic center are highly
deflected above $8^{\circ}$ by the dipole magnetic field during their
propagation in Galactic space. However, in bisymmetric spiral field models,
there are directions with the deflection angle below $1^{\circ}$. One of these
directions is toward Centaurus A, the nearest radio-loud active galactic nuclei
that is one of possible candidates of UHECR sources. On the other hand, UHE
protons arriving from the direction of the anti-Galactic center are less
deflected, especially in bisymmetric spiral field models. Thus, the northern
hemisphere, not including the Galactic center, is suitable for the studies of
correlation with sources. The dependence on model parameters is also
investigated. The deflection angles of UHE protons are dependent on the pitch
angle of the spiral field. We also investigate distortion of the supergalactic
plane by GMF. Since the distortion in the direction around Galactic center
strongly depends on the GMF model, we can obtain information on GMF around
Galactic center if Pierre Auger Observatory finds the significant positional
correlation around the supergalactic plane.
","[{""version"":""v1"",""created"":""Thu, 15 Nov 2007 12:03:06 GMT""}]","2009-02-10"
"0711.2387","Marek Karliner","Itay Hen and Marek Karliner","Hexagonal Structure of Baby Skyrmion Lattices","RevTeX, 7 pages, 6 figures","Phys.Rev.D77:054009,2008","10.1103/PhysRevD.77.054009",,"hep-th",,"  We study the zero-temperature crystalline structure of baby Skyrmions by
applying a full-field numerical minimization algorithm to baby Skyrmions placed
inside different parallelogramic unit-cells and imposing periodic boundary
conditions. We find that within this setup, the minimal energy is obtained for
the hexagonal lattice, and that in the resulting configuration the Skyrmion
splits into quarter-Skyrmions. In particular, we find that the energy in the
hexagonal case is lower than the one obtained on the well-studied rectangular
lattice, in which splitting into half-Skyrmions is observed.
","[{""version"":""v1"",""created"":""Thu, 15 Nov 2007 14:41:51 GMT""},{""version"":""v2"",""created"":""Tue, 20 Nov 2007 14:23:33 GMT""},{""version"":""v3"",""created"":""Wed, 16 Jan 2008 11:21:27 GMT""},{""version"":""v4"",""created"":""Mon, 28 Jan 2008 23:13:11 GMT""}]","2008-11-26"
"0711.2388","Sylvain Joubaud","Sylvain Joubaud (Phys-ENS), Nicolas Garnier (Phys-ENS), Sergio
  Ciliberto (Phys-ENS)","Fluctuations of the total entropy production in stochastic systems","6 p",,"10.1209/0295-5075/82/30007",,"cond-mat.stat-mech",,"  Fluctuations of the excess heat in an out of equilibrium steady state are
experimentally investigated in two stochastic systems : an electric circuit
with an imposed mean current and a harmonic oscillator driven out of
equilibrium by a periodic torque. In these two linear systems, we study excess
heat that represents the difference between the dissipated heat out of
equilibrium and the dissipated heat at equilibrium. Fluctuation theorem holds
for the excess heat in the two experimental systems for all observation times
and for all fluctuation magnitudes.
","[{""version"":""v1"",""created"":""Thu, 15 Nov 2007 12:13:19 GMT""},{""version"":""v2"",""created"":""Fri, 16 Nov 2007 13:48:36 GMT""},{""version"":""v3"",""created"":""Mon, 14 Jan 2008 11:26:34 GMT""}]","2009-11-13"
"0711.2389","Rudra Prakash Malik","R. P. Malik (Bhu), B. P. Mandal (Bhu)","Superfield approach to symmetry invariance in QED with complex scalar
  fields","LaTeX file, 14 pages, minor changes in the title and text, version to
  appear in ``Pramana - Journal of Physics''","Pramana 72: 805-818, 2009","10.1007/s12043-009-0073-0",,"hep-th","http://arxiv.org/licenses/nonexclusive-distrib/1.0/","  We show that the Grassmannian independence of the super Lagrangian density,
expressed in terms of the superfields defined on a (4, 2)-dimensional
supermanifold, is a clear-cut proof for the Becchi-Rouet-Stora-Tyutin (BRST)
and anti-BRST invariance of the corresoponding four (3 + 1)-dimensional (4D)
Lagrangian density that describes the interaction between the U(1) gauge field
and the charged complex scalar fields. The above 4D field theoretical model is
considered on a (4, 2)-dimensional supermanifold parametrized by the ordinary
four spacetime variables x^\mu (with \mu = 0, 1, 2, 3) and a pair of
Grassmannian variables \theta and \bar\theta (with \theta^2 = \bar\theta^2 = 0,
\theta \bar\theta + \bar\theta \theta = 0). Geometrically, the (anti-)BRST
invariance is encoded in the translation of the super Lagrangian density along
the Grassmannian directions of the above supermanifold such that the outcome of
this shift operation is zero.
","[{""version"":""v1"",""created"":""Thu, 15 Nov 2007 14:09:34 GMT""},{""version"":""v2"",""created"":""Thu, 19 Feb 2009 13:15:16 GMT""}]","2015-05-13"
"0711.2390","Alexander Silenko","Alexander J. Silenko","Potential for measurement of the tensor magnetic polarizability of the
  deuteron in storage ring experiments","Corrected text, 8 pages","Phys.Rev.C77:021001,2008","10.1103/PhysRevC.77.021001",,"nucl-th",,"  General formulas describing deuteron spin dynamics in storage rings with
allowance for the tensor electric and magnetic polarizabilities are derived. It
is found that an initially tensor-polarized deuteron beam can acquire a final
horizontal vector polarization of the order of 1%. This effect allows one to
measure the tensor magnetic polarizability of the deuteron in storage ring
experiments. We also confirm an existence of the effect found by Baryshevsky
and Gurinovich, hep-ph/0506135 and Baryshevsky, hep-ph/0510158; hep-ph/0603191
that the tensor magnetic polarizability of the deuteron causes the spin
rotation with two frequencies and experiences beating for polarized deuteron
beams in storage rings.
","[{""version"":""v1"",""created"":""Thu, 15 Nov 2007 12:19:52 GMT""},{""version"":""v2"",""created"":""Fri, 22 Feb 2008 07:18:50 GMT""}]","2008-11-26"
"0711.2391","Joao Lopes Dias","Joao Lopes Dias","Local conjugacy classes for analytic torus flows","inc bibl",,,,"math.DS",,"  If a real-analytic flow on the multidimensional torus close enough to linear
has a unique rotation vector which satisfies an arithmetical condition Y, then
it is analytically conjugate to linear. We show this by proving that the orbit
under renormalization of a constant Y vector field attracts all nearby orbits
with the same rotation vector.
","[{""version"":""v1"",""created"":""Thu, 15 Nov 2007 12:34:00 GMT""}]","2007-11-16"
"0711.2393","Eduard Aschenbach","Bernd Aschenbach","Grazing Incidence Reflection and Scattering of MeV Protons","7 pages, 3 figures, updated version of a paper accepted for
  publication in the SPIE Conference Proceedings 6688, 2007",,"10.1117/12.735589",,"astro-ph",,"  Treating protons as de Broglie waves shows that up to a few MeV energies
protons experience total external reflection using the index of refraction
concept for the target earlier applied to electrons. Angular scattering
distributions can be explained by random surface scattering as known for
X-rays. Applied to the {\it{Chandra}} and {\it{XMM-Newton}} X-ray telescopes
the calculated reflection efficiencies can explain the observed degradation of
the X-ray CCDs for both missions. Some discussion about the possibility of
realizing imaging sub-MeV and MeV proton optics is presented.
","[{""version"":""v1"",""created"":""Thu, 15 Nov 2007 12:37:54 GMT""}]","2009-11-13"
"0711.2394","Antonio Alarcon","Antonio Alarcon","Compact complete minimal immersions in R^3","16 pages. Main theorem improved. To appear in Trans. Amer. Math. Soc",,,,"math.DG","http://arxiv.org/licenses/nonexclusive-distrib/1.0/","  In this paper we find, for any arbitrary finite topological type, a compact
Riemann surface $\mathcal{M},$ an open domain $M\subset\mathcal{M}$ with the
fixed topological type, and a conformal complete minimal immersion $X:M\to\R^3$
which can be extended to a continuous map $X:\bar{M}\to\R^3,$ such that
$X_{|\partial M}$ is an embedding and the Hausdorff dimension of $X(\partial
M)$ is $1.$
  We also prove that complete minimal surfaces are dense in the space of
minimal surfaces spanning a finite set of closed curves in $\R^3$, endowed with
the topology of the Hausdorff distance.
","[{""version"":""v1"",""created"":""Thu, 15 Nov 2007 12:43:17 GMT""},{""version"":""v2"",""created"":""Tue, 20 Nov 2007 17:02:56 GMT""},{""version"":""v3"",""created"":""Mon, 28 Jan 2008 11:26:10 GMT""},{""version"":""v4"",""created"":""Tue, 10 Feb 2009 15:55:20 GMT""}]","2009-02-10"
"0711.2395","Andreas Wirzba","Andreas Wirzba","The Casimir effect as scattering problem","14 pages, 2 figures, plenary talk at QFEXT07, Leipzig, September
  2007, some typos corrected","J.Phys.A41:164003,2008","10.1088/1751-8113/41/16/164003","FZJ-IKP-TH-2007-28","quant-ph hep-th nlin.CD nucl-th",,"  We show that Casimir-force calculations for a finite number of
non-overlapping obstacles can be mapped onto quantum-mechanical billiard-type
problems which are characterized by the scattering of a fictitious point
particle off the very same obstacles. With the help of a modified Krein trace
formula the genuine/finite part of the Casimir energy is determined as the
energy-weighted integral over the log-determinant of the multi-scattering
matrix of the analog billiard problem. The formalism is self-regulating and
inherently shows that the Casimir energy is governed by the infrared end of the
multi-scattering phase shifts or spectrum of the fluctuating field. The
calculation is exact and in principle applicable for any separation(s) between
the obstacles. In practice, it is more suited for large- to medium-range
separations. We report especially about the Casimir energy of a fluctuating
massless scalar field between two spheres or a sphere and a plate under
Dirichlet and Neumann boundary conditions. But the formalism can easily be
extended to any number of spheres and/or planes in three or arbitrary
dimensions, with a variety of boundary conditions or non-overlapping
potentials/non-ideal reflectors.
","[{""version"":""v1"",""created"":""Thu, 15 Nov 2007 15:27:04 GMT""},{""version"":""v2"",""created"":""Mon, 11 Feb 2008 13:40:03 GMT""}]","2008-11-26"
"0711.2396","Nicolas Rey","Nicolas Rey (LPMCN), Alfonso Munoz, Placida Rodriguez-Hernandez,
  Alfonso San Miguel (LPMCN)","First-principles study of lithium-doped carbon clathrates under pressure",,,"10.1088/0953-8984/20/21/215218",,"cond-mat.mtrl-sci",,"  We present a theoretical study on the behavior under pressure of the two
hypothetical C$_{46}$ and Li$_8$C$_{46}$ type-I carbon clathrates in order to
bring new informations concerning their synthesis. Using \textit{ab initio}
calculations, we have explored the energetic and structural properties under
pressure of these two carbon based cage-like materials. These low-density
meta-stable phases show large negative pressure transitions compared to diamond
which represent a serious obstacle for their synthesis. However, we evidence
that a minimum energy barrier can be reached close to 40 GPa, suggesting that
the synthesis of the Li-clathrate under extreme conditions of pressure and
temperature may be possible. Electronic band structure with related density of
states behavior under pressure as well as the dependence of the active Raman
modes with pressure are also examined.
","[{""version"":""v1"",""created"":""Thu, 15 Nov 2007 13:05:39 GMT""}]","2009-11-13"
"0711.2397","Nikolaus Witte Dr.","Ewgenij Gawrilow, Michael Joswig, Thilo R\""orig, and Nikolaus Witte","Drawing polytopal graphs with polymake","18 pages, 17 examples, 13 figures, 0 theorems",,,,"math.CO",,"  This note wants to explain how to obtain meaningful pictures of (possibly
high-dimensional) convex polytopes, triangulated manifolds, and other objects
from the realm of geometric combinatorics such as tight spans of finite metric
spaces and tropical polytopes. In all our cases we arrive at specific,
geometrically motivated, graph drawing problems. The methods displayed are
implemented in the software system polymake.
","[{""version"":""v1"",""created"":""Thu, 15 Nov 2007 13:10:18 GMT""}]","2007-11-16"
"0711.2399","Alexander Tiskin","Vladimir Deineko and Alexander Tiskin","Minimum-weight double-tree shortcutting for Metric TSP: Bounding the
  approximation ratio",,,,,"cs.DS","http://arxiv.org/licenses/nonexclusive-distrib/1.0/","  The Metric Traveling Salesman Problem (TSP) is a classical NP-hard
optimization problem. The double-tree shortcutting method for Metric TSP yields
an exponentially-sized space of TSP tours, each of which approximates the
optimal solution within at most a factor of 2. We consider the problem of
finding among these tours the one that gives the closest approximation, i.e.\
the \emph{minimum-weight double-tree shortcutting}. Previously, we gave an
efficient algorithm for this problem, and carried out its experimental
analysis. In this paper, we address the related question of the worst-case
approximation ratio for the minimum-weight double-tree shortcutting method. In
particular, we give lower bounds on the approximation ratio in some specific
metric spaces: the ratio of 2 in the discrete shortest path metric, 1.622 in
the planar Euclidean metric, and 1.666 in the planar Minkowski metric. The
first of these lower bounds is tight; we conjecture that the other two bounds
are also tight, and in particular that the minimum-weight double-tree method
provides a 1.622-approximation for planar Euclidean TSP.
","[{""version"":""v1"",""created"":""Thu, 15 Nov 2007 13:19:01 GMT""},{""version"":""v2"",""created"":""Tue, 16 Dec 2008 11:58:25 GMT""},{""version"":""v3"",""created"":""Sun, 28 Dec 2008 17:28:18 GMT""}]","2008-12-30"
"0711.2400","Jinshan Zhang","Jinshan Zhang","Constituting Atoms of a $\sigma$ Algebra via Its Generator","8 pages",,,,"math.PR math.GM","http://arxiv.org/licenses/nonexclusive-distrib/1.0/","  To constitute atoms of a $\sigma$ algebra is not a easy task due to the large
number of its elements. However, determining them via generators seems a
feasible and simple way since most $\sigma$ algebras are generated by their
smaller proper subsets. Precisely, under some conditions each atom of a
$\sigma$ algebra equals the intersection of the elements containing a point of
the atom in the generator. In this paper, a very weak sufficient condition for
determining atoms by the generator is presented. The condition, though not
being a necessary one, is shown to be almost the weakest one in the sense that
it can hardly be improved.
","[{""version"":""v1"",""created"":""Thu, 15 Nov 2007 13:21:41 GMT""},{""version"":""v2"",""created"":""Tue, 29 Jan 2008 07:05:05 GMT""},{""version"":""v3"",""created"":""Thu, 11 Dec 2008 15:21:40 GMT""}]","2008-12-11"
"0711.2401","Genkai Zhang","Siddhartha Sahi and Genkai Zhang","Biorthogonal Expansion of Non-Symmetric Jack Functions","This is a contribution to the Proceedings of the 2007 Midwest
  Geometry Conference in honor of Thomas P. Branson, published in SIGMA
  (Symmetry, Integrability and Geometry: Methods and Applications) at
  http://www.emis.de/journals/SIGMA/","SIGMA 3 (2007), 106, 9 pages","10.3842/SIGMA.2007.106",,"math.CA math.RT",,"  We find a biorthogonal expansion of the Cayley transform of the non-symmetric
Jack functions in terms of the non-symmetric Jack polynomials, the coefficients
being Meixner-Pollaczek type polynomials. This is done by computing the
Cherednik-Opdam transform of the non-symmetric Jack polynomials multiplied by
the exponential function.
","[{""version"":""v1"",""created"":""Thu, 15 Nov 2007 13:21:45 GMT""}]","2008-04-25"
"0711.2402","J. Schaffner-Bielich","Irina Sagert, Mirjam Wietoska, Jurgen Schaffner-Bielich, Christian
  Sturm","Neutron star versus heavy-ion data: is the nuclear equation of state
  hard or soft?","10 pages, 3 figures, talk given at the International Symposium on
  Exotic States of Nuclear Matter (EXOCT07), Catania, Italy, June 11-15, 2007",,,,"astro-ph nucl-th",,"  Recent astrophysical observations of neutron stars and heavy-ion data are
confronted with our present understanding of the equation of state of dense
hadronic matter. Emphasis is put on the possible role of the presence of
hyperons in the interior of compact stars. We argue that data from low-mass
pulsars provide an important cross-check between high-density astrophysics and
heavy-ion physics.
","[{""version"":""v1"",""created"":""Thu, 15 Nov 2007 13:21:55 GMT""}]","2007-11-16"
"0711.2403","Jens Wirth","Fumihiko Hirosawa and Jens Wirth","$C^m$-theory of damped wave equations with stabilisation","13 pages","J. Math. Anal. Appl. 343(2):1022-1035, 2008","10.1016/j.jmaa.2008.02.024",,"math.AP",,"  The aim of this note is to extend the energy decay estimates from [J. Wirth,
J. Differential Equations 222 (2006) 487--514] to a broader class of
time-dependent dissipation including very fast oscillations. This is achieved
using stabilisation conditions on the coefficient in the spirit of [F.
Hirosawa, Math. Ann. 339/4 (2007) 819--839].
","[{""version"":""v1"",""created"":""Thu, 15 Nov 2007 13:23:49 GMT""}]","2010-05-17"
"0711.2404","Yota Takamura","Yota Takamura, Ryosho Nakane, Hiro Munekata and Satoshi Sugahara","Characterization of half-metallic L2_1-phase Co_2FeSi full-Heusler alloy
  films formed by rapid thermal annealing","18 pages, 5 figures","J. Appl. Phys. 103 (2008) 07D719","10.1063/1.2838648",,"cond-mat.mtrl-sci",,"  The authors developed a preparation technique of Co_2FeSi full-Heusler alloy
films with the L2_1-ordered structure on silicon-on-insulator (SOI) substrates,
employing rapid thermal annealing (RTA). The Co_2FeSi full-Heusler alloy films
were successfully formed by RTA-induced silicidation reaction between an
ultrathin SOI (001) layer and Fe/Co layers deposited on it. The highly
(110)-oriented L2_1-phase polycrystalline full-Heusler alloy films were
obtained at the RTA temperature of 700 C. Crystallographic and magnetic
properties of the RTA-formed full-Heusler alloy films were qualitatively the
same as those of bulk full-Heusler alloy. This technique is compatible with
metal source/drain formation process in advanced CMOS technology and would be
applicable to the fabrication of the half-metallic source/drain of MOSFET type
of spin transistors.
","[{""version"":""v1"",""created"":""Thu, 15 Nov 2007 14:02:14 GMT""}]","2010-05-26"
