"0711.2267","Ian Hunter","I. Hunter, I. Brott, D.J. Lennon, N. Langer, P.L. Dufton, C. Trundle,
  S.J. Smartt, A. de Koter, C.J. Evans and R.S.I. Ryans","The VLT-FLAMES survey of massive stars: rotation and nitrogen enrichment
  as the key to understanding massive star evolution","ApJL. 10 pages, 1 figure. Updated to match accepted version",,"10.1086/587436",,"astro-ph",,"  Rotation has become an important element in evolutionary models of massive
stars, specifically via the prediction of rotational mixing. Here, we study a
sample of stars, including rapid rotators, to constrain such models and use
nitrogen enrichments as a probe of the mixing process. Chemical compositions
(C, N, O, Mg and Si) have been estimated for 135 early B-type stars in the
Large Magellanic Cloud with projected rotational velocities up to ~300km/s
using a non-LTE TLUSTY model atmosphere grid. Evolutionary models, including
rotational mixing, have been generated attempting to reproduce these
observations by adjusting the overshooting and rotational mixing parameters and
produce reasonable agreement with 60% of our core hydrogen burning sample. We
find (excluding known binaries) a significant population of highly nitrogen
enriched intrinsic slow rotators vsini less than 50km/s incompatible with our
models ~20% of the sample). Furthermore, while we find fast rotators with
enrichments in agreement with the models, the observation of evolved (log g
less than 3.7dex) fast rotators that are relatively unenriched (a further ~20%
of the sample) challenges the concept of rotational mixing. We also find that
70% of our blue supergiant sample cannot have evolved directly from the
hydrogen burning main-sequence. We are left with a picture where invoking
binarity and perhaps fossil magnetic fields are required to understand the
surface properties of a population of massive main sequence stars.
","[{""version"":""v1"",""created"":""Wed, 14 Nov 2007 18:23:47 GMT""},{""version"":""v2"",""created"":""Mon, 18 Feb 2008 18:55:51 GMT""}]","2009-11-13"
"0711.2268","Fabrizio Illuminati","M. Blasone, F. Dell'Anno, S. De Siena, M. Di Mauro, F. Illuminati","Multipartite entangled states in particle mixing","18 pages, 7 figures","Phys. Rev. D 77, 096002 (2008)","10.1103/PhysRevD.77.096002",,"quant-ph hep-ph hep-th",,"  In the physics of flavor mixing, the flavor states are given by
superpositions of mass eigenstates. By using the occupation number to define a
multiqubit space, the flavor states can be interpreted as multipartite
mode-entangled states. By exploiting a suitable global measure of entanglement,
based on the entropies related to all possible bipartitions of the system, we
analyze the correlation properties of such states in the instances of three-
and four-flavor mixing. Depending on the mixing parameters, and, in particular,
on the values taken by the free phases, responsible for the CP-violation,
entanglement concentrates in preferred bipartitions. We quantify in detail the
amount and the distribution of entanglement in the physically relevant cases of
flavor mixing in quark and neutrino systems. By using the wave packet
description for localized particles, we use the global measure of entanglement,
suitably adapted for the instance of multipartite mixed states, to analyze the
decoherence induced by the free evolution dynamics on the quantum correlations
of stationary neutrino beams. We define a decoherence length as the distance
associated with the vanishing of the coherent interference effects among
massive neutrino states. We investigate the role of the CP-violating phase in
the decoherence process.
","[{""version"":""v1"",""created"":""Wed, 14 Nov 2007 18:24:56 GMT""},{""version"":""v2"",""created"":""Tue, 18 Mar 2008 22:11:56 GMT""}]","2009-07-02"
"0711.2269","Luke Rogers","Jessica L. DeGrado, Luke G. Rogers, Robert S. Strichartz","Gradients of Laplacian Eigenfunctions on the Sierpinski Gasket","LaTex, 8 pages, 4 figures",,,,"math.CA math.FA",,"  We use spectral decimation to provide formulae for computing the harmonic
gradients of Laplacian eigenfunctions on the Sierpinski Gasket. These formulae
are given in terms of special functions that are defined as infinite products.
","[{""version"":""v1"",""created"":""Wed, 14 Nov 2007 18:28:12 GMT""}]","2007-11-15"
"0711.2270","Igor M. Suslov","I. M. Suslov (P.L.Kapitza Institute for Physical Problems, Moscow,
  Russia)","Can a Computer Laugh ?","English translation of the paper in Russian; 18 pages, 6 figures
  included","Computer Chronicle (Moscow), 1994, issue 1, p.1",,,"cs.CL cs.AI q-bio.NC",,"  A computer model of ""a sense of humour"" suggested previously
[arXiv:0711.2058,0711.2061], relating the humorous effect with a specific
malfunction in information processing, is given in somewhat different
exposition. Psychological aspects of humour are elaborated more thoroughly. The
mechanism of laughter is formulated on the more general level. Detailed
discussion is presented for the higher levels of information processing, which
are responsible for a perception of complex samples of humour. Development of a
sense of humour in the process of evolution is discussed.
","[{""version"":""v1"",""created"":""Wed, 14 Nov 2007 18:32:09 GMT""}]","2007-11-27"
"0711.2271","Roger Francis Picken","J. E. Nelson and R. F. Picken","A quantum Goldman bracket in 2+1 quantum gravity","9 pages, 4 figures, dedication added, very minor corrections","J.Phys.A41:304011,2008","10.1088/1751-8113/41/30/304011",,"math-ph gr-qc hep-th math.MP","http://arxiv.org/licenses/nonexclusive-distrib/1.0/","  In the context of quantum gravity for spacetimes of dimension 2+1, we
describe progress in the construction of a quantum Goldman bracket for
intersecting loops on surfaces. Using piecewise linear paths in R^2
(representing loops on the spatial manifold, i.e. the torus) and a quantum
connection with noncommuting components, we review how holonomies and Wilson
loops for two homotopic paths are related by phases in terms of the signed area
between them. Paths rerouted at intersection points with other paths occur on
the r.h.s. of the Goldman bracket. To better understand their nature we
introduce the concept of integer points inside the parallelogram spanned by two
intersecting paths, and show that the rerouted paths must necessarily pass
through these integer points.
","[{""version"":""v1"",""created"":""Wed, 14 Nov 2007 18:41:57 GMT""},{""version"":""v2"",""created"":""Tue, 29 Jul 2008 17:05:33 GMT""}]","2008-11-26"
"0711.2272","Dmitry V. Belyaev","Dmitry V. Belyaev, Peter van Nieuwenhuizen","Tensor calculus for supergravity on a manifold with boundary","20 pages, JHEP format; published version","JHEP0802:047,2008","10.1088/1126-6708/2008/02/047","DESY-07-208, YITP-SB-07-33","hep-th hep-ph",,"  Using the simple setting of 3D N=1 supergravity, we show how the tensor
calculus of supergravity can be extended to manifolds with boundary. We present
an extension of the standard F-density formula which yields supersymmetric
bulk-plus-boundary actions. To construct additional separately supersymmetric
boundary actions, we decompose bulk supergravity and bulk matter multiplets
into co-dimension one submultiplets. As an illustration we obtain the
supersymmetric extension of the York-Gibbons-Hawking extrinsic curvature
boundary term. We emphasize that our construction does not require any boundary
conditions on off-shell fields. This gives a significant improvement over the
existing orbifold supergravity tensor calculus.
","[{""version"":""v1"",""created"":""Wed, 14 Nov 2007 20:51:59 GMT""},{""version"":""v2"",""created"":""Thu, 14 Feb 2008 15:01:59 GMT""}]","2008-11-26"
"0711.2273","Jun Takahashi","Jun Takahashi (for the STAR collaboration)","Energy and System Size Dependence of Strangeness Production from SPS to
  RHIC","6 pages, SQM2007 conference proceedings, to be published in Jornal of
  Phys. G","J.Phys.G35:044007,2008","10.1088/0954-3899/35/4/044007",,"nucl-ex",,"  Strange particle production is an important experimental observable that
allows the study of the strongly interacting matter created in relativistic
heavy-ion collisions. The STAR experiment at RHIC has a unique capability of
measuring identified strange particles over a wide range of acceptance
providing a rich set of data to perform a systematic study. In addition to the
data from Au+Au collisions, strange particles from p+p and d+Au collisions are
also available for comparison and normalization. A new set of data from Cu+Cu
reactions at 62 GeV and 200 GeV provides the chance to compare the system size
dependence observed in Au+Au collisions with this smaller system size. In
addition to the comparison of the yields, a statistical thermal model was used
to extract freeze-out characteristics for the different system sizes and
collision energies.
","[{""version"":""v1"",""created"":""Wed, 14 Nov 2007 18:54:23 GMT""},{""version"":""v2"",""created"":""Fri, 16 Nov 2007 12:32:22 GMT""}]","2019-08-13"
"0711.2274","Jose Geraldo Pereira","R. Aldrovandi, J. G. Pereira","de Sitter Relativity: a New Road to Quantum Gravity?","18 pages, no figures. v3: Important presentation changes intended to
  clarify some points of the previous version; title slightly changed and
  references added. Version to be published in Foundations of Physics","Found.Phys.39:1-19,2009","10.1007/s10701-008-9258-5",,"gr-qc hep-th","http://arxiv.org/licenses/nonexclusive-distrib/1.0/","  The Poincare' group generalizes the Galilei group for high-velocity
kinematics. The de Sitter group is assumed to go one step further, generalizing
Poincare' as the group governing high-energy kinematics. In other words,
ordinary special relativity is here replaced by de Sitter relativity. In this
theory, the cosmological constant is no longer a free parameter, and can be
determined in terms of other quantities. When applied to the whole universe, it
is able to predict the value of the cosmological constant and to explain the
cosmic coincidence. When applied to the propagation of ultra-high energy
photons, it gives a good estimate of the time delay observed in extragalactic
gamma-ray flares. It can, for this reason, be considered a new paradigm to
approach the quantum gravity problem.
","[{""version"":""v1"",""created"":""Wed, 14 Nov 2007 19:35:41 GMT""},{""version"":""v2"",""created"":""Wed, 23 Jan 2008 14:17:55 GMT""},{""version"":""v3"",""created"":""Wed, 12 Nov 2008 11:08:54 GMT""}]","2009-01-16"
"0711.2275","Joseph Schechter","Amir H. Fariborz, Renata Jora, Joseph Schechter","Scalar mesons from an effective Lagrangian approach","10 pages, 5 figures, menu 2007 talk","ECONFC070910:107,2007",,,"hep-ph",,"  A brief discussion of the recent interest in light scalar mesons motivates
the study of a generalized linear sigma model. In an SU(3) flavor invariant
version of the model there is a prediction that the the lighter scalars have
sizeable ""four quark"" content. It is further predicted that one of the singlet
scalars should be exceptionally light. Due to the presence of scalar mesons,
the model gives ""controlled"" corrections to the current algebra formula for
threshold pion pion scattering. These corections act in the direction to
improve agreement with current experiments.
","[{""version"":""v1"",""created"":""Wed, 14 Nov 2007 19:13:08 GMT""},{""version"":""v2"",""created"":""Fri, 16 Nov 2007 17:08:59 GMT""},{""version"":""v3"",""created"":""Wed, 16 Jan 2008 20:14:59 GMT""}]","2008-11-26"
"0711.2276","Valeri Dvoeglazov","Valeri V. Dvoeglazov (Universidad de Zacatecas)","Fermion-fermion and boson-boson amplitudes: surprising similarities","7 pages, no figures, talks given at the 5th International Symposium
  on ""Quantum Theory and Symmetries"", July 22-28, 2007, Valladolid, Spain and
  the 10th Workshop ""What comes beyond the Standard Model?"", July 17-27, 2007,
  Bled, Slovenia","J.Phys.Conf.Ser.128:012002,2008","10.1088/1742-6596/128/1/012002",,"math-ph hep-ph hep-th math.MP",,"  Amplitudes for fermion-fermion, boson-boson and fermion-boson interactions
are calculated in the second order of perturbation theory in the Lobachevsky
space. An essential ingredient of the model is the Weinberg's 2(2j+1)-component
formalism for describing a particle of spin j. The boson-boson amplitude is
then compared with the two-fermion amplitude obtained long ago by Skachkov on
the basis of the Hamiltonian formulation of quantum field theory on the mass
hyperboloid, p_0^2 - p^2=M^2, proposed by Kadyshevsky. The parametrization of
the amplitudes by means of the momentum transfer in the Lobachevsky space leads
to same spin structures in the expressions of T-matrices for the fermion case
and the boson case. However, certain differences are found. Possible physical
applications are discussed.
","[{""version"":""v1"",""created"":""Wed, 14 Nov 2007 19:15:01 GMT""}]","2011-09-02"
"0711.2277","Ignacio Taboada","Ignacio Taboada and Michelangelo V. D'Agostino","Correlating prompt GRB photons with neutrinos",,,,,"astro-ph",,"  It is standard in theoretical neutrino astrophysics to use a broken power law
approximation, based on the Band function, to describe the average photon flux
of the prompt emission of Gamma-Ray Bursts. We will show that this
approximation overestimates the contribution of high energy gamma-rays (and
underestimates low energy gamma-rays). As a consequence models that rely on
this approximation overestimate neutrino event rate by a factor of approx 2
depending on Earth's column density in the direction of the GRB. Furthermore
the characteristic energy of neutrinos that trigger a km^3 detector is
typically 10^{16} eV, higher than previously predicted. We also provide a new
broken power law approximation to the Band function and show that it properly
represents the photon spectra.
","[{""version"":""v1"",""created"":""Wed, 14 Nov 2007 19:24:45 GMT""}]","2007-11-15"
"0711.2278","Valeri Dvoeglazov","Valeri V. Dvoeglazov (Universidad de Zacatecas)","Antisymmetric Tensor Fields, 4-Vector Fields, Indefinite Metrics and
  Normalization","9 pages, no figures, talks given at the VII Mexican School on
  Gravitation and Mathematical Physics ""Relativistic Astrophysics and Numerical
  Relativity"", November 26 -- December 1, 2006, Playa del Carmen, QR, Mexico;
  and the 10th Workshop ""What comes beyond the Standard Model?"", July 17-27,
  2007, Bled, Slovenia","J.Phys.Conf.Ser.91:012009,2007",,,"math-ph gr-qc hep-th math.MP",,"  On the basis of our recent modifications of the Dirac formalism we generalize
the Bargmann-Wigner formalism for higher spins to be compatible with other
formalisms for bosons. Relations with dual electrodynamics, with the
Ogievetskii-Polubarinov notoph and the Weinberg 2(2J+1) theory are found. Next,
we introduce the dual analogues of the Riemann tensor and derive corresponding
dynamical equations in the Minkowski space. Relations with the Marques-Spehler
chiral gravity theory are discussed. The problem of indefinite metrics,
particularly, in quantization of 4-vector fields is clarified.
","[{""version"":""v1"",""created"":""Wed, 14 Nov 2007 19:22:19 GMT""}]","2011-09-15"
"0711.2279","Andrew DeBenedictis","A. DeBenedictis","Developments in Black Hole Research: Classical, Semi-classical, and
  Quantum","59 pages, 17 figures (some are quality reduced due to file size
  restrictions). Version 2 has extra references and minor changes to match
  version for publication. Invited chapter to appear in an edited collection
  'Classical and Quantum Gravity Research', Nova Science Publishers","Classical and Quantum Gravity Research, 371-426, (2008), Nova Sci.
  Pub. ISBN 978-1-60456-366-5",,,"gr-qc",,"  The possible existence of black holes has fascinated scientists at least
since Michell and Laplace's proposal that a gravitating object could exist from
which light could not escape. In the 20th century, in light of the general
theory of relativity, it became apparent that, were such objects to exist,
their structure would be far richer than originally imagined. Today,
astronomical observations strongly suggest that either black holes, or objects
with similar properties, not only exist but may well be abundant in our
universe. In light of this, black hole research is now not only motivated by
the fascinating theoretical properties such objects must possess but also as an
attempt to better understand the universe around us. We review here some
selected developments in black hole research, from a review of its early
history to current topics in black hole physics research. Black holes have been
studied at all levels; classically, semi-classically, and more recently, as an
arena to test predictions of candidate theories of quantum gravity. We will
review here progress and current research at all these levels as well as
discuss some proposed alternatives to black holes.
","[{""version"":""v1"",""created"":""Wed, 14 Nov 2007 19:25:27 GMT""},{""version"":""v2"",""created"":""Fri, 21 Mar 2008 01:01:53 GMT""}]","2008-11-15"
"0711.2280","Peter Petreczky","Peter Petreczky","Properties of quark gluon plasma from lattice calculations","Invited talk at Zimanyi 75 Memorial workshop, 8 pages, uses
  svjour.cls","Eur.Phys.J.ST155:123-130,2008","10.1140/epjst/e2008-00596-y",,"hep-lat",,"  I discuss lattice QCD calculations of the properties of strongly interacting
matter at finite temperature, including the determination of the transition
temperature Tc, equation of state, different static screening lengths and
quarkonium spectral functions. The lattice data suggest that at temperatures
above 2Tc many properties of the quark gluon plasma can be understood using
weak coupling approach, although non-perturbative effects due to static
magnetic fields are significant in some quantities.
","[{""version"":""v1"",""created"":""Wed, 14 Nov 2007 19:28:12 GMT""}]","2008-11-26"
"0711.2281","Eduardo Gonz\'alez-Alfonso","Eduardo Gonz\'alez-Alfonso, Howard A. Smith, Matthew L. N. Ashby,
  Jacqueline Fischer, Luigi Spinoglio, Timothy W. Grundy","High-excitation OH and H_2O lines in Markarian 231: the molecular
  signatures of compact far-infrared continuum sources","16 pages, 6 figures, accepted for publication in The Astrophysical
  Journal",,"10.1086/527292",,"astro-ph",,"  The ISO/LWS far-infrared spectrum of the ultraluminous galaxy Mkn 231 shows
OH and H_2O lines in absorption from energy levels up to 300 K above the ground
state, and emission in the [O I] 63 micron and [C II] 158 micron lines. Our
analysis shows that OH and H_2O are radiatively pumped by the far-infrared
continuum emission of the galaxy. The absorptions in the high-excitation lines
require high far-infrared radiation densities, allowing us to constrain the
properties of the underlying continuum source. The bulk of the far-infrared
continuum arises from a warm (T_dust=70-100 K), optically thick
(tau_100micron=1-2) medium of effective diameter 200-400 pc. In our best-fit
model of total luminosity L_IR, the observed OH and H2O high-lying lines arise
from a luminous (L/L_IR~0.56) region with radius ~100 pc. The high surface
brightness of this component suggests that its infrared emission is dominated
by the AGN. The derived column densities N(OH)>~10^{17} cm^{-2} and
N(H_2O)>~6x10^{16} cm^{-2} may indicate XDR chemistry, although significant
starburst chemistry cannot be ruled out. The lower-lying OH, [C II] 158 micron,
and [O I] 63 micron lines arise from a more extended (~350 pc) starburst
region. We show that the [C II] deficit in Mkn 231 is compatible with a high
average abundance of C+ because of an extreme overall luminosity to gas mass
ratio. Therefore, a [C II] deficit may indicate a significant contribution to
the luminosity by an AGN, and/or by extremely efficient star formation.
","[{""version"":""v1"",""created"":""Wed, 14 Nov 2007 19:33:18 GMT""},{""version"":""v2"",""created"":""Thu, 15 Nov 2007 17:26:58 GMT""},{""version"":""v3"",""created"":""Mon, 19 Nov 2007 08:44:48 GMT""},{""version"":""v4"",""created"":""Tue, 20 Nov 2007 18:57:27 GMT""},{""version"":""v5"",""created"":""Mon, 24 Dec 2007 09:18:52 GMT""}]","2009-11-13"
"0711.2282","Todor Stanev","Todor Stanev (Bartol Research Institute, Department of Physics and
  Astronomy, University of Delaware)","Ultra High Energy Cosmic Rays: origin and propagation","LaTeX, 15 pages, 13 postscript figures, Invited talk at the 30th
  International Conference of Cosmic Rays, July 2007, Merida, Mexico",,"10.1142/9789812790156_0008",,"astro-ph",,"  We discuss the basic difficulties in understanding the origin of the highest
energy particles in the Universe - the ultrahigh energy cosmic rays (UHECR). It
is difficult to imagine the sources they are accelerated in. Because of the
strong attenuation of UHECR on their propagation from the sources to us these
sources should be at cosmologically short distance from us but are currently
not identified. We also give information of the most recent experimental
results including the ones reported at this conference and compare them to
models of the UHECR origin.
","[{""version"":""v1"",""created"":""Wed, 14 Nov 2007 19:37:25 GMT""}]","2017-08-23"
"0711.2283","Mohamed Assad Abdel-Raouf","Mohamed Assad Abdel-Raouf","Possible Coexistence of Antihydrogen with Hydrogen, Deuterium and
  Tritium Atoms","29 pages, 3 Figures and 4 Tables",,,,"physics.atm-clus physics.plasm-ph",,"  Recent productions of large numbers of cold antiprotons as well as the
formation of antihydrogens at CERN and Fermilab have raised basic questions
about possible coexistence of matter and antimatter in nature. In the present
work, previous mathematical considerations are revisited which support the
possible coexistence of Antihydrogen with Hydrogen, Deuterium and Tritium
atoms. In particular, the main objective of the present work is to present
computational treatments which confirm the possible formation of these quasi
molecules in laboratory. These treatments are based on a nonadiabatic picture
of the system in which generalized basis functions are adjusted within the
framework of Rayleigh-Ritz' variational method. Thus, it is ruled out in the
present work the Born-Oppenheimer adiabatic picture of the system, which
demands the existence of bound states composed of fixed quasi heavy atoms
(containing at least two baryons, e.g. protonium (Pn), with mean lifetime
1.0x10^^-6 s) and quasi light atoms (composed of two leptons, e.g. positronium
(Ps), with mean lifetime 125x10^^-12 s for para-Ps and 142.05x10^^-9 s for
ortho-Ps). Our calculations of the binding energies and internal structure of
Antihydrogen-Hydrogen, Antihydrogen-Deuterium and Antihydrogen-Tritium show
that these quasi molecules are bound and could be formed in nature. On the
other hand, having in mind the adiabatic picture of the systems, our results
suggest the possible formation of these molecules as resonant states in
Antihydrogen-Atom interaction. Nevertheless, several arguments are accumulated
in the conclusion as consequences of the proposed bound states.
","[{""version"":""v1"",""created"":""Wed, 14 Nov 2007 19:38:39 GMT""},{""version"":""v2"",""created"":""Wed, 9 Jan 2008 11:21:22 GMT""}]","2008-01-09"
"0711.2284","Rainer Grauer","Tobias Grafke, Holger Homann, Juergen Dreher, and Rainer Grauer","Numerical simulations of possible finite time singularities in the
  incompressible Euler equations: comparison of numerical methods","Euler equations: 250 years on",,"10.1016/j.physd.2007.11.006",,"physics.flu-dyn physics.comp-ph",,"  The numerical simulation of the 3D incompressible Euler equation is analyzed
with respect to different integration methods. The numerical schemes we
considered include spectral methods with different strategies for dealiasing
and two variants of finite difference methods. Based on this comparison, a
Kida-Pelz like initial condition is integrated using adaptive mesh refinement
and estimates on the necessary numerical resolution are given. This estimate is
based on analyzing the scaling behavior similar to the procedure in critical
phenomena and present simulations are put into perspective.
","[{""version"":""v1"",""created"":""Wed, 14 Nov 2007 19:40:17 GMT""}]","2009-11-13"
"0711.2285","Eric White","Eric White and Qing He","Impact on $\gamma\phi_3$ from CLEO-c Using CP-tagged $D\toK_{S,L}\pi\pi$
  Decays","5 pages, 5 figures, submitted to Charm 2007 Workshop Conference
  proceedings","ECONF C070805:26,2007",,,"hep-ex",,"  Precision determination of the CKM angle $\gamma/\phi_3$ depends upon
constraints on charm mixing amplitudes, measurements of doubly-Cabibbo
suppressed amplitudes and relative phases, and studies of charm Dalitz plots
tagged by flavor or CP eigenstates. In this note we describe the technique used
at CLEO-c to constrain the $K_{S,L}\pi\pi$ model uncertainty, and its impact on
$\gamma/\phi_3$ measurements at B-factories presented at the Charm 2007
Workshop.
","[{""version"":""v1"",""created"":""Wed, 14 Nov 2007 19:46:04 GMT""}]","2010-01-05"
"0711.2286","Anton Klimovsky","Anton Bovier, Anton Klimovsky","The Aizenman-Sims-Starr scheme for the SK model with multidimensional
  spins","29 pages, presented on Frankfurter Stochastik-Tage 2006, Frankfurt,
  14-17.03.2006 and on The 5th Prague Summer School on Mathematical Statistical
  Mechanics, September 10-23, Prague, 2006 This paper has been temporarily
  withdrawn for revision by the authors",,,,"math.PR math-ph math.MP",,"  This paper has been temporarily withdrawn for revision by the authors.
","[{""version"":""v1"",""created"":""Wed, 14 Nov 2007 20:23:42 GMT""},{""version"":""v2"",""created"":""Thu, 15 Nov 2007 14:48:56 GMT""},{""version"":""v3"",""created"":""Sat, 24 Nov 2007 17:35:50 GMT""}]","2007-11-24"
