"0711.2065","Xiangyu Wang","Xiang-Yu Wang, Soebur Razzaque and Peter Meszaros","On the Origin and Survival of UHE Cosmic-Ray Nuclei in GRBs and
  Hypernovae","accepted by ApJ, references added, 12 pages, 4 figures, emulateapj
  style","Astrophys.J.677:432-440,2008","10.1086/529018",,"astro-ph hep-ph",,"  The chemical composition of the ultra-high-energy (UHE) cosmic rays serves as
an important clue for their origin. Recent measurements of the elongation rates
by the Pierre Auger Observatory hint at the possible presence of heavy or
intermediate mass nuclei in the UHE cosmic rays. Gamma-ray bursts (GRBs) and
hypernovae have been suggested as possible sources of the UHE cosmic rays. Here
we derive the constraints on the physical conditions under which UHE heavy
nuclei, if they are accelerated in these sources, can survive in their intense
photon fields. We find that in the GRB external shock and in the hypernova
scenarios, UHE nuclei can easily survive photo-disintegration. In the GRB
internal shock scenario, UHE nuclei can also survive, provided the dissipation
radius and/or the bulk Lorentz factor of the relativistic outflow are
relatively large, or if the low-energy self-absorption break in the photon
spectrum of the prompt emission occurs above several KeV. In internal shocks
and in the other scenarios, intermediate-mass UHE nuclei have a higher
probability of survival against photo-disintegration than UHE heavy nuclei such
as Fe.
","[{""version"":""v1"",""created"":""Wed, 14 Nov 2007 19:38:38 GMT""},{""version"":""v2"",""created"":""Sat, 22 Dec 2007 14:20:27 GMT""},{""version"":""v3"",""created"":""Tue, 8 Jan 2008 01:38:53 GMT""}]","2010-11-11"
"0711.2079","Iain W. Stewart","Sean Fleming, Andre H. Hoang, Sonny Mantry, Iain W. Stewart","Top Jets in the Peak Region: Factorization Analysis with NLL Resummation","92 pages, 22 figs, typos corrected, journal version","Phys.Rev.D77:114003,2008","10.1103/PhysRevD.77.114003","MIT-CTP 3868, CALT-68-2625, MPP-2007-103","hep-ph nucl-th",,"  We consider top-quarks produced at large energy in e+e- collisions, and
address the question of what top-mass can be measured from reconstruction. The
production process is characterized by well separated scales: the
center-of-mass energy, Q, the top mass, m, the top decay width, Gamma_t, and
also LambdaQCD; scales which can be disentangled with effective theory methods.
In particular we show how the mass measurement depends on the way in which soft
radiation is treated, and that this can shift the mass peak by an amount of
order Q LambdaQCD/m. We sum large logs for Q >> m >> Gamma_t > LambdaQCD and
demonstrate that the renormalization group ties together the jet and soft
interactions below the scale m. Necessary conditions for the invariant mass
spectrum to be protected from large logs are formulated. Results for the
cross-section are presented at next-to-leading order with next-to-leading-log
resummation, for invariant masses in the peak region and the tail region. Using
our results we also predict the thrust distribution for massive quark jets at
NLL order for large thrust. We demonstrate that soft radiation can be precisely
controlled using data on massless jet production, and that in principle, a
short distance mass parameter can be measured using jets with precision better
than LambdaQCD.
","[{""version"":""v1"",""created"":""Wed, 14 Nov 2007 20:52:46 GMT""},{""version"":""v2"",""created"":""Sat, 31 May 2008 18:27:31 GMT""}]","2008-11-26"
"0711.2108","Kallosh Renata","Renata Kallosh","The Effective Action of N=8 Supergravity","17 pages",,,,"hep-th",,"  We present a simple form of the on-shell gauge-invariant 1-loop effective
action of N=8 supergravity which is manifestly N=8 supersymmetric at the linear
level. By generalizing the dimensional arguments in superspace to non-local
invariants, we show that the 1-loop effective action does not contain any
contributions from bubble and triangle diagrams. The absence of bubbles implies
the absence of conformal and axial anomalies. We also show that the 1-loop
effective action of N=8 supergravity features a ""dual"" conformal symmetry in
the momentum space.
","[{""version"":""v1"",""created"":""Wed, 14 Nov 2007 20:22:54 GMT""}]","2007-11-15"
"0711.2143","Timothy Johnson","Andrew J. F. Jack, Timothy C. Johnson, Mihail Zervos","A Singular Control Model with Application to the Goodwill Problem",,,,,"math.PR math.OC",,"  We consider a stochastic system whose uncontrolled state dynamics are
modelled by a general one-dimensional It\^{o} diffusion. The control effort
that can be applied to this system takes the form that is associated with the
so-called monotone follower problem of singular stochastic control. The control
problem that we address aims at maximising a performance criterion that rewards
high values of the utility derived from the system's controlled state but
penalises any expenditure of control effort. This problem has been motivated by
applications such as the so-called goodwill problem in which the system's state
is used to represent the image that a product has in a market, while control
expenditure is associated with raising the product's image, e.g., through
advertising. We obtain the solution to the optimisation problem that we
consider in a closed analytic form under rather general assumptions. Also, our
analysis establishes a number of results that are concerned with analytic as
well as probabilistic expressions for the first derivative of the solution to a
second order linear non-homogeneous ordinary differential equation. These
results have independent interest and can potentially be of use to the solution
of other one-dimensional stochastic control problems.
","[{""version"":""v1"",""created"":""Wed, 14 Nov 2007 20:46:06 GMT""}]","2007-11-15"
"0711.2186","Anne-Sophie Kaloghiros","Anne-Sophie Kaloghiros","The defect of Fano 3-folds","24 pages, minor changes in exposition, final version",,,,"math.AG","http://arxiv.org/licenses/nonexclusive-distrib/1.0/","  This paper studies the defect of terminal Gorenstein Fano 3 folds. I
determine a bound on the defect of terminal Gorenstein Fano 3-folds of Picard
rank 1 that do not contain a plane. I give a general bound for quartic 3-folds
and indicate how to study the defect of terminal Gorenstein Fano 3-folds with
Picard rank 1 that contain a plane.
","[{""version"":""v1"",""created"":""Wed, 14 Nov 2007 17:42:43 GMT""},{""version"":""v2"",""created"":""Thu, 31 Jul 2008 14:14:16 GMT""},{""version"":""v3"",""created"":""Mon, 24 Aug 2009 11:12:33 GMT""}]","2009-08-24"
"0711.2187","Yi-Fu Cai","Yi-Fu Cai, Taotao Qiu, Robert Brandenberger, Yun-Song Piao, Xinmin
  Zhang","On Perturbations of Quintom Bounce","24 pages, 9 figures","JCAP0803:013,2008","10.1088/1475-7516/2008/03/013",,"hep-th astro-ph gr-qc hep-ph",,"  A Quintom universe with an equation-of-state crossing the cosmological
constant boundary can provide a bouncing solution dubbed the Quintom Bounce and
thus resolve the Big Bang singularity. In this paper, we investigate the
cosmological perturbations of the Quintom Bounce both analytically and
numerically. We find that the fluctuations in the dominant mode in the
post-bounce expanding phase couple to the growing mode of the perturbations in
the pre-bounce contracting phase.
","[{""version"":""v1"",""created"":""Wed, 14 Nov 2007 17:57:48 GMT""},{""version"":""v2"",""created"":""Mon, 17 Mar 2008 18:04:04 GMT""}]","2008-11-26"
"0711.2221","Chris Lodewijk","T. Zijlstra, C. F. J. Lodewijk, N. Vercruyssen, F. D. Tichelaar, D. N.
  Loudkov, and T. M. Klapwijk","Epitaxial aluminium-nitride tunnel barriers grown by nitridation with a
  plasma source","3 pages, 3 figures, accepted for publication in APL","Appl. Phys. Lett. 91, 233102 (2007)","10.1063/1.2819532",,"cond-mat.mes-hall cond-mat.supr-con",,"  High critical current-density (10 to 420 kA/cm^2)
superconductor-insulator-superconductor tunnel junctions with aluminium nitride
barriers have been realized using a remote nitrogen plasma from an inductively
coupled plasma source operated in a pressure range of 10^{-3} to 10^{-1} mbar.
We find a much better reproducibility and control compared to previous work.
  From the current-voltage characteristics and cross-sectional TEM images it is
inferred that, compared to the commonly used AlO_x barriers, the
poly-crystalline AlN barriers are much more uniform in transmissivity, leading
to a better quality at high critical current-densities.
","[{""version"":""v1"",""created"":""Wed, 14 Nov 2007 17:00:11 GMT""}]","2008-06-03"
"0711.2232","S. M. Iftiquar","S. M. Iftiquar","Electromagnetically induced transparency in two channels of a $\Lambda$
  system","5 pages, 6 figures",,,,"physics.optics physics.atom-ph",,"  We show two channel electromagnetically induced transparency (EIT) spectra at
various optical power. The two channels are coupling field and probe field
absorption. It is shown that EIT width and intensity increases linearly with
pump power. A density matrix calculation is used to determine nature of EIT
spectra induced by optical field. It has been observed that EIT occurs in cases
when coupling laser is at fixed frequency while probe laser frequency is
scanned, when coupling laser is frequency scanned and probe is at fixed
frequency.
","[{""version"":""v1"",""created"":""Wed, 14 Nov 2007 16:06:30 GMT""}]","2007-11-15"
"0711.2234","Anne Green","Anne M. Green, Ben Morgan","Consequences of statistical sense determination for WIMP directional
  detection","5 pages, 3 figures, version to appear in PRD, minor changes","Phys.Rev.D77:027303,2008","10.1103/PhysRevD.77.027303",,"astro-ph hep-ex hep-ph",,"  We study the consequences of limited recoil sense reconstruction on the
number of events required to reject isotropy and detect a WIMP signal using a
directional detector. For a constant probability of determining the sense
correctly, 3-d read-out and zero background, we find that as the probability is
decreased from 1.0 to 0.75 the number of events required to reject isotropy
using the mean angle statistic is increased by a factor of a few. As the
probability is decreased further the number of events required using this
statistic increases sharply, and in fact isotropy can be rejected more easily
by discarding the sense information and using axial statistics. This however
requires an order of magnitude more events than vectorial data with perfect
sense determination. We also consider energy dependent probabilities of
correctly measuring the sense, 2-d read-out and non-zero background. Our main
conclusion regarding the sense determination is that correctly determining the
sense of the abundant, but less anisotropic, low energy recoils is most
important for minimising the number of events required.
","[{""version"":""v1"",""created"":""Wed, 14 Nov 2007 16:00:01 GMT""},{""version"":""v2"",""created"":""Fri, 14 Dec 2007 09:41:52 GMT""}]","2008-11-26"
"0711.2235","Lee Martin","L. C. Martin and F. F. Assaad","Evolution of the Fermi Surface across a Magnetic Order-Disorder
  Transition in the Two-Dimensional Kondo Lattice Model: A Dynamical Cluster
  Approach","5 pages, 5 figures, v3 text restructured and results clarified",,"10.1103/PhysRevLett.101.066404",,"cond-mat.str-el","http://arxiv.org/licenses/nonexclusive-distrib/1.0/","  We use the dynamical cluster approximation, with a quantum Monte Carlo
cluster solver on clusters of up to 16 orbitals, to investigate the evolution
of the Fermi surface across the magnetic order-disorder transition in the
two-dimensional doped Kondo lattice model. In the paramagnetic phase we observe
the generic hybridized heavy fermion band structure with large Luttinger
volume. In the antiferromagnetic phase, the heavy fermion band drops below the
Fermi surface giving way to hole pockets centered around k=(pi/2,pi/2) and
equivalent points. In this phase Kondo screening does not break down but the
topology of the resulting Fermi surface is that of a spin-density wave
approximation in which the localized spins are frozen.
","[{""version"":""v1"",""created"":""Wed, 14 Nov 2007 16:01:30 GMT""},{""version"":""v2"",""created"":""Thu, 22 Nov 2007 15:38:20 GMT""},{""version"":""v3"",""created"":""Thu, 3 Jul 2008 09:32:05 GMT""}]","2009-11-13"
"0711.2236","Alexander Chervov","Alexander Chervov, Gregorio Falqui","Manin matrices and Talalaev's formula","40 pages, V2: exposition reorganized, some proofs added, misprints
  e.g. in Newton id-s fixed, normal ordering convention turned to standard one,
  refs. added","J.Phys.A41:194006,2008","10.1088/1751-8113/41/19/194006","ITEP-TH-45/07","math.QA hep-th math.RA math.RT nlin.SI",,"  We study special class of matrices with noncommutative entries and
demonstrate their various applications in integrable systems theory. They
appeared in Yu. Manin's works in 87-92 as linear homomorphisms between
polynomial rings; more explicitly they read: 1) elements in the same column
commute; 2) commutators of the cross terms are equal: $[M_{ij},
M_{kl}]=[M_{kj}, M_{il}]$ (e.g. $[M_{11}, M_{22}]=[M_{21}, M_{12}]$). We claim
that such matrices behave almost as well as matrices with commutative elements.
Namely theorems of linear algebra (e.g., a natural definition of the
determinant, the Cayley-Hamilton theorem, the Newton identities and so on and
so forth) holds true for them.
  On the other hand, we remark that such matrices are somewhat ubiquitous in
the theory of quantum integrability. For instance, Manin matrices (and their
q-analogs) include matrices satisfying the Yang-Baxter relation ""RTT=TTR"" and
the so--called Cartier-Foata matrices. Also, they enter Talalaev's
hep-th/0404153 remarkable formulas: $det(\partial_z-L_{Gaudin}(z))$,
$det(1-e^{-\p}T_{Yangian}(z))$ for the ""quantum spectral curve"", etc. We show
that theorems of linear algebra, after being established for such matrices,
have various applications to quantum integrable systems and Lie algebras, e.g
in the construction of new generators in $Z(U(\hat{gl_n}))$ (and, in general,
in the construction of quantum conservation laws), in the
Knizhnik-Zamolodchikov equation, and in the problem of Wick ordering. We also
discuss applications to the separation of variables problem, new Capelli
identities and the Langlands correspondence.
","[{""version"":""v1"",""created"":""Wed, 14 Nov 2007 16:03:13 GMT""},{""version"":""v2"",""created"":""Mon, 11 Feb 2008 18:48:02 GMT""}]","2008-11-26"
"0711.2237","Norbert Kaiser","N. Kaiser","$\Sigma$-nuclear spin-orbit coupling from two-pion exchange","7 pages, 2 figures, submitted to Phys. Rev. C","Phys.Rev.C76:068201,2007","10.1103/PhysRevC.76.068201",,"nucl-th",,"  Using SU(3) chiral perturbation theory we calculate the density-dependent
complex-valued spin-orbit coupling strength $U_{\Sigma ls}(k_f)+ i W_{\Sigma
ls}(k_f)$ of a $\Sigma$ hyperon in the nuclear medium. The leading long-range
$\Sigma N$ interaction arises from iterated one-pion exchange with a $\Lambda$
or a $\Sigma$ hyperon in the intermediate state. We find from this unique
long-range dynamics a sizeable ``wrong-sign'' spin-orbit coupling strength of
$U_{\Sigma ls}(k_{f0}) \simeq -20$ MeVfm$^2$ at normal nuclear matter density
$\rho_0 = 0.16 $fm$^{-3}$. The strong $\Sigma N\to \Lambda N$ conversion
process contributes at the same time an imaginary part of $W_{\Sigma
ls}(k_{f0}) \simeq -12$ MeVfm$^2$. When combined with estimates of the
short-range contribution the total $\Sigma$-nuclear spin-orbit coupling becomes
rather weak.
","[{""version"":""v1"",""created"":""Wed, 14 Nov 2007 16:07:42 GMT""}]","2008-11-26"
"0711.2238","Martin G. Gulbrandsen","Martin G. Gulbrandsen","Fourier-Mukai transforms of line bundles on derived equivalent abelian
  varieties",,"Le Matematiche, Vol. 63, no. 1, 123--137 (2008)",,,"math.AG",,"  We study the Fourier-Mukai functor D(Y) -> D(X) induced by the universal
family on a fine moduli space Y for simple semihomogeneous vector bundles on an
abelian variety X. The main result is that the Fourier-Mukai transform of a
very negative line bundle on Y is ample if and only if the bundles parametrized
by Y are nef.
","[{""version"":""v1"",""created"":""Wed, 14 Nov 2007 16:37:54 GMT""}]","2011-11-07"
"0711.2239","Guillaume Thomann","Guillaume Thomann (LGS), Jean Caelen (LIG), Morgan Verdier (LGS),
  Brigitte Meillon (LIG)","Mise en place de sc\'enarios pour la conception d'outils en Chirurgie
  Minimalement Invasive",,"Les Syst\`emes de Production, Lavoisier (Ed.) (2007) 93-107",,,"cs.HC",,"  Nowadays, more and more surgical interventions are carried out in Minimally
Invasive Surgery, to make the post-operative constraints less painful for the
patient. Actually, new surgical tools or medical products are designed after
informal discussions between surgeons and designers. The user requirements
documents are the main document used by the mechanical designers to design and
improve the product. Medical terms, often used by surgeons and employed to
explain their needs, don't allow for an instantaneous understanding by
designers. Unfortunately, this relation causes a dysfunction in the definition
cycle of the product. Our aim is to work on the design process, its assistance
thanks to methods and tools and on its organisation for better understandings
and more complementarities between surgeons and designers. We propose on this
article a design method already tested in the informatics domain: User Centred
Design which takes the user into account more effectively in the process
design. We already propose a scenario oriented design method centred on the
user and represented as a scenario (Scenario-Based Design). We start in this
article by clarifying these concepts before detailing their implementation for
the design of a new surgical tool.
","[{""version"":""v1"",""created"":""Wed, 14 Nov 2007 16:18:42 GMT""}]","2007-11-19"
"0711.2240","Moubariz Garaev Z.","M. Z. Garaev","A note on the least totient of a residue class","Improved version",,,,"math.NT",,"  Let $q$ be a large prime number, $a$ be any integer, $\epsilon$ be a fixed
small positive quantity. Friedlander and Shparlinksi \cite{FSh} have shown that
there exists a positive integer $n\ll q^{5/2+\epsilon}$ such that $\phi(n)$
falls into the residue class $a \pmod q.$ Here, $\phi(n)$ denotes Euler's
function. In the present paper we improve this bound to $n\ll q^{2+\epsilon}.$
","[{""version"":""v1"",""created"":""Wed, 14 Nov 2007 16:19:48 GMT""},{""version"":""v2"",""created"":""Mon, 19 Nov 2007 19:57:45 GMT""}]","2007-11-19"
"0711.2241","Kerry Soileau","Kerry M. Soileau","Bounds on the cardinality of partition","I'm no longer satisfied with my treatment of this topic",,,,"math.GM","http://arxiv.org/licenses/nonexclusive-distrib/1.0/","  If A is infinite and well-ordered, then |2^A|<=|Part(A)|<=|A^A|.
","[{""version"":""v1"",""created"":""Wed, 14 Nov 2007 16:51:17 GMT""},{""version"":""v10"",""created"":""Sun, 14 Aug 2022 14:03:30 GMT""},{""version"":""v2"",""created"":""Fri, 16 Nov 2007 19:29:16 GMT""},{""version"":""v3"",""created"":""Tue, 20 Nov 2007 18:16:59 GMT""},{""version"":""v4"",""created"":""Tue, 20 Nov 2007 21:17:54 GMT""},{""version"":""v5"",""created"":""Wed, 21 Nov 2007 22:23:24 GMT""},{""version"":""v6"",""created"":""Sun, 25 Nov 2007 22:37:12 GMT""},{""version"":""v7"",""created"":""Tue, 16 Jun 2009 18:10:23 GMT""},{""version"":""v8"",""created"":""Mon, 4 Jan 2016 21:39:40 GMT""},{""version"":""v9"",""created"":""Fri, 16 Nov 2018 16:50:32 GMT""}]","2022-08-16"
"0711.2242","Marco Tarzia","M. M\'ezard, M.Tarzia, C. Toninelli","Group testing with Random Pools: Phase Transitions and Optimal Strategy",,,"10.1007/s10955-008-9528-9",,"cond-mat.stat-mech",,"  The problem of Group Testing is to identify defective items out of a set of
objects by means of pool queries of the form ""Does the pool contain at least a
defective?"". The aim is of course to perform detection with the fewest possible
queries, a problem which has relevant practical applications in different
fields including molecular biology and computer science. Here we study GT in
the probabilistic setting focusing on the regime of small defective probability
and large number of objects, $p \to 0$ and $N \to \infty$. We construct and
analyze one-stage algorithms for which we establish the occurrence of a
non-detection/detection phase transition resulting in a sharp threshold, $\bar
M$, for the number of tests. By optimizing the pool design we construct
algorithms whose detection threshold follows the optimal scaling $\bar M\propto
Np|\log p|$. Then we consider two-stages algorithms and analyze their
performance for different choices of the first stage pools. In particular, via
a proper random choice of the pools, we construct algorithms which attain the
optimal value (previously determined in Ref. [16]) for the mean number of tests
required for complete detection. We finally discuss the optimal pool design in
the case of finite $p$.
","[{""version"":""v1"",""created"":""Wed, 14 Nov 2007 16:52:31 GMT""}]","2009-11-13"
"0711.2243","Bernard Jancovici","Bernard Jancovici and Ladislav \v{S}amaj","Guest Charge and Potential Fluctuations in Two-Dimensional Classical
  Coulomb Systems","21 pages. Latex. Appendix moved, with changes, to new subsection 2.3.
  Description of the Appendix at the end of the Introduction, from an earlier
  version, deleted","J.Stat.Phys. 131, 613 (2008)","10.1007/s10955-008-9515-1","LPT-07-116","cond-mat.stat-mech",,"  A known generalization of the Stillinger-Lovett sum rule for a guest charge
immersed in a two-dimensional one-component plasma (the second moment of the
screening cloud around this guest charge) is more simply retrieved, just by
using the BGY hierarchy for a mixture of several species; the zeroth moment of
the excess density around a guest charge immersed in a two-component plasma is
also obtained. The moments of the electric potential are related to the excess
chemical potential of a guest charge; explicit results are obtained in several
special cases.
","[{""version"":""v1"",""created"":""Wed, 14 Nov 2007 17:00:39 GMT""},{""version"":""v2"",""created"":""Thu, 21 Feb 2008 08:48:54 GMT""},{""version"":""v3"",""created"":""Tue, 8 Apr 2008 13:40:51 GMT""}]","2008-04-08"
"0711.2244","Jos\'e Eduardo S. Costa","J. E. S. Costa, S. O. Kepler, D. E. Winget, M. S. O'Brien, S. D.
  Kawaler, A. F. M. Costa, O. Giovannini, A. Kanaan, A. S. Mukadam, F.
  Mullally, A. Nitta, J. L. Proven\c{c}al, H. Shipman, M. A. Wood, T. J.
  Ahrens, A. Grauer, M. Kilic, P. A. Bradley, K. Sekiguchi, R. Crowe, X. J.
  Jiang, D. Sullivan, T. Sullivan, R. Rosen, J. C. Clemens, R. Janulis, D.
  O'Donoghue, W. Ogloza, A. Baran, R. Silvotti, S. Marinoni,, G. Vauclair, N.
  Dolez, M. Chevreton, S. Dreizler, S. Schuh, J. Deetjen, T. Nagel, J.-E.
  Solheim, J. M. Gonzalez Perez, A. Ulla, Martin Barstow, M. Burleigh, S. Good,
  T.S. Metcalfe, S.-L. Kim, H. Lee, A. Sergeev, M.C. Akan, \""O. \c{C}akirli, M.
  Paparo, G. Viraghalmy, B. N. Ashoka, G. Handler, \""Ozlem H\""urkal, F.
  Johannessen, S. J. Kleinman, R. Kalytis, J. Krzesinski, E. Klumpe, J.
  Larrison, T. Lawrence, E. Mei\v{s}tas, P. Martinez, R. E. Nather, J.-N. Fu,
  E. Pak\v{s}tien\.e, R. Rosen, E. Romero-Colmenero, R. Riddle, S. Seetha, N.
  M. Silvestri, M. Vu\v{c}kovi\'c, B. Warner, S. Zola, L. G. Althaus, A. H.
  C\'orsico and M. H. Montgomery","The pulsation modes of the pre-white dwarf PG 1159-035","25 pages, 11 figures, appendix with 6 long tables. The resolution of
  some of the figures were changed and some of them can appear with a bit lower
  quality","2008A&A...477..627","10.1051/0004-6361:20053470",,"astro-ph",,"  PG 1159-035, a pre-white dwarf with T_eff=140,000 K, is the prototype of both
two classes: the PG1159 spectroscopic class and the DOV pulsating class.
Previous studies of PG 1159-035 photometric data obtained with the Whole Earth
Telescope (WET) showed a rich frequency spectrum allowing the identification of
122 pulsation modes. In this work, we used all available WET photometric data
from 1983, 1985, 1989, 1993 and 2002 to identify the pulsation periods and
identified 76 additional pulsation modes, increasing to 198 the number of known
pulsation modes in PG 1159-035, the largest number of modes detected in any
star besides the Sun. From the period spacing we estimated a mass M = 0.59 +/-
0.02 solar masses for PG 1159-035, with the uncertainty dominated by the
models, not the observation. Deviations in the regular period spacing suggest
that some of the pulsation modes are trapped, even though the star is a
pre-white dwarf and the gravitational settling is ongoing. The position of the
transition zone that causes the mode trapping was calculated at r_c = 0.83 +/-
0.05 stellar radius. From the multiplet splitting, we calculated the rotational
period P_rot = 1.3920 +/- 0.0008 days and an upper limit for the magnetic
field, B < 2000 G. The total power of the pulsation modes at the stellar
surface changed less than 30% for l=1 modes and less than 50% for l=2 modes. We
find no evidence of linear combinations between the 198 pulsation mode
frequencies. PG 1159-035 models have not significative convection zones,
supporting the hypothesis that nonlinearity arises in the convection zones in
cooler pulsating white dwarf stars.
","[{""version"":""v1"",""created"":""Wed, 14 Nov 2007 17:19:21 GMT""},{""version"":""v2"",""created"":""Tue, 18 Dec 2007 12:43:29 GMT""}]","2007-12-18"
