"0711.2306","Xavier Calmet","Xavier Calmet and Stephen D. H. Hsu","TeV gravity in four dimensions?","5 pages","Phys.Lett.B663:95-98,2008","10.1016/j.physletb.2008.04.002",,"hep-ph hep-th",,"  We describe a model in which the fundamental scale M_\star of the theory
which unifies gravity and quantum mechanics is in the TeV range, but without
requiring additional spacetime dimensions. The weakness of gravity at low
energies is due to a large vacuum expectation of a dilaton like field. The
model requires a small dimensionless parameter (the self-coupling of the
dilaton) but no fine-tuning. We discuss in detail the dynamical assumptions
about nonperturbative quantum gravity required within the model. We observe
that M_\star could be quite small, less than a TeV, and that the model could
lead to copious strong coupling effects at the LHC. However, semiclassical
black holes will not be produced.
","[{""version"":""v1"",""created"":""Wed, 14 Nov 2007 21:25:49 GMT""}]","2008-11-26"
"0711.2307","Matilde Mart\'iAnez","Matilde Mart\'inez, Shigenori Matsumoto and Alberto Verjovsky","Horocycle flows for laminations by hyperbolic Riemann surfaces and
  Hedlund's theorem","Corrected version of previous paper ""Hedlund's theorem for compact
  minimal laminations""",,,,"math.DS","http://arxiv.org/licenses/nonexclusive-distrib/1.0/","  We study the dynamics of the geodesic and horocycle flows of the unit tangent
bundle $(\hat M, T^1\mathcal{F})$ of a compact minimal lamination $(M,\mathcal
F)$ by negatively curved surfaces. We give conditions under which the action of
the affine group generated by the joint action of these flows is minimal, and
examples where this action is not minimal. In the first case, we prove that if
$\mathcal F$ has a leaf which is not simply connected, the horocyle flow is
topologically transitive.
","[{""version"":""v1"",""created"":""Wed, 14 Nov 2007 21:45:22 GMT""},{""version"":""v2"",""created"":""Tue, 27 May 2008 19:50:59 GMT""},{""version"":""v3"",""created"":""Wed, 21 Nov 2012 21:54:46 GMT""},{""version"":""v4"",""created"":""Wed, 15 Apr 2015 17:23:43 GMT""}]","2016-02-01"
"0711.2309","Le Hur Karyn","Peter P. Orth, Ivan Stanic, Karyn Le Hur","Dissipative Quantum Ising model in a cold atomic spin-boson mixture","4 pages, 2 figures, 1 table; Title modified and cosmetic changes","Phys. Rev. A 77, 051601(R) (2008)","10.1103/PhysRevA.77.051601",,"cond-mat.other",,"  Using cold bosonic atoms with two (hyperfine) ground states, we introduce a
spin-boson mixture which allows to implement the quantum Ising model in a
tunable dissipative environment. The first specie lies in a deep optical
lattice with tightly confining wells and forms a spin array; spin-up/down
corresponds to occupation by one/no atom at each site. The second specie forms
a superfluid reservoir. Different species are coupled coherently via laser
transitions and collisions. Whereas the laser coupling mimics a transverse
field for the spins, the coupling to the reservoir sound modes induces a
ferromagnetic (Ising) coupling as well as dissipation. This gives rise to an
order-disorder quantum phase transition where the effect of dissipation can be
studied in a controllable manner.
","[{""version"":""v1"",""created"":""Wed, 14 Nov 2007 23:06:04 GMT""},{""version"":""v2"",""created"":""Fri, 23 Nov 2007 17:32:38 GMT""},{""version"":""v3"",""created"":""Mon, 24 Mar 2008 15:55:53 GMT""}]","2009-11-13"
"0711.2310","Simon Kochen","John Conway and Simon Kochen","Thou Shalt Not Clone One Bit!",,,,,"quant-ph",,"  We prove a no-triplets theorem for spin 1 particles, which implies a
strengthened form of the no-cloning theorem.
","[{""version"":""v1"",""created"":""Wed, 14 Nov 2007 21:49:32 GMT""}]","2007-11-16"
"0711.2313","Alexei Moiseev","V.P. Arkhipova (1), T.A. Lozinskaya (1), A.V. Moiseev (2), O.V. Egorov
  (1) ((1) Sternberg Astronomical Institute, Moscow, Russia, (2) Special
  Astrophysical Observatory, Russia)","The gas emission spectrum in a star-forming region in the BCD galaxy VII
  Zw 403 (UGC 6456)","9 pages, 6 EPS figures","Astron.Rep.51:871-881,2007","10.1134/S1063772907110017","Astron. Reports, 2007, vol. 51, N 11, pp. 871-881","astro-ph",,"  Observations with the 6-m telescope of the Special Astrophysical Observatory
obtained with the MPFS integral-field spectrograph and a longslit spectrograph
with the SCORPIO focal reducer are used to analyze the emission spectrum of the
ionized gas in a star-forming region in the BCD galaxy VII Zw 403. We present
images of the galactic central region in the H-alpha, H-beta, [SII], and [OIII]
emission lines, together with maps of the relative [OIII]/H-beta and
[SII]/H-alpha intensities. We have determined the parameters of the gas in
bright ionized supershells, and estimated the relative abundances of oxygen,
nitrogen, and sulfur; a low relative N/O abundance was detected.
","[{""version"":""v1"",""created"":""Wed, 14 Nov 2007 22:20:38 GMT""}]","2008-11-26"
"0711.2314","Kevin E. Bassler","Min Liu and Kevin E. Bassler","Finite size effects and symmetry breaking in the evolution of networks
  of competing Boolean nodes","30 pages, 8 figures, 3 tables",,,,"cond-mat.stat-mech cond-mat.dis-nn nlin.AO physics.bio-ph physics.soc-ph q-bio.PE",,"  The effects of the finite size of the network on the evolutionary dynamics of
a Boolean network are analyzed. In the model considered, Boolean networks
evolve via a competition between nodes that punishes those in the majority. It
is found that finite size networks evolve in a fundamentally different way than
infinitely large networks do. The symmetry of the evolutionary dynamics of
infinitely large networks that selects for canalizing Boolean functions is
broken in the evolutionary dynamics of finite size networks. In finite size
networks there is an additional selection for input inverting Boolean functions
that output a value opposite to the majority of input values. These results are
revealed through an empirical study of the model that calculates the frequency
of occurrence of the different possible Boolean functions. Classes of functions
are found to occur with the same frequency. Those classes depend on the
symmetry of the evolutionary dynamics and correspond to orbits of the relevant
symmetry group. The empirical results match analytic results, determined by
utilizing Polya's theorem, for the number of orbits expected in both finite
size and infinitely large networks. The reason for the symmetry breaking in the
evolutionary dynamics is found to be due to the need for nodes in finite size
networks to behave differently in order to cooperate so that the system
collectively performs as well as possible. The results suggest that both finite
size effects and symmetry are important for understanding the evolution of
real-world complex networks, including genetic regulatory networks.
","[{""version"":""v1"",""created"":""Wed, 14 Nov 2007 22:44:46 GMT""}]","2016-09-08"
"0711.2315","Margaret Reid","E. G. Cavalcanti and M. D. Reid","Uncertainty relations for the realisation of macroscopic quantum
  superpositions and EPR paradoxes","9 pages, 2 figures, to appear Journ Mod Optics work presented at PQE
  2007 conference","Journal of Modern Optics, 54, 2373 (2007)","10.1080/09500340701639623",,"quant-ph",,"  We present a unified approach, based on the use of quantum uncertainty
relations, for arriving at criteria for the demonstration of the EPR paradox
and macroscopic superpositions. We suggest to view each criterion as a means to
demonstrate an EPR-type paradox, where there is an inconsistency between the
assumptions of a form of realism, either macroscopic realism (MR) or local
realism (LR), and the completeness of quantum mechanics.
","[{""version"":""v1"",""created"":""Wed, 14 Nov 2007 22:55:51 GMT""}]","2008-06-18"
"0711.2316","Benjamin Monreal","Benjamin Monreal, Lorne A. Nelson, and Joseph A. Formaggio","Spallation nuclei in substellar objects: a new dark-matter signature?","preprint, 9 pages, 3 figures",,,,"astro-ph",,"  Although dark matter makes up 80% of the gravitational mass of our Galaxy,
its composition is not known. One hypothesis is that dark matter consists of
massive particles called WIMPs. WIMPs are expected to accumulate and
coannihilate in the cores of stars, but the only signature of this accumulation
has been thought to be hard- to-observe high-energy neutrinos. Here we propose
an entirely new observable signature. WIMP coannihilations in the core of a
very low-mass star, brown dwarf, or planetary-mass object should alter the
star's chemical composition via spallation reactions. Very close to the
Galactic center, these stars may acquire extremely high lithium, beryllium, and
boron abundances, even for models with otherwise- undetectable WIMP-nucleon
cross sections. These abundances should be measurable in certain stellar
systems and phenomena.
","[{""version"":""v1"",""created"":""Wed, 14 Nov 2007 23:06:15 GMT""}]","2007-11-16"
"0711.2318","Sergey Cherkis","Sergey A. Cherkis and Brian Durcan","The 't Hooft-Polyakov Monopole in the Presence of a 't Hooft Operator","11 pages, 7 figures. Exposition improved, appendix added with
  construction details","Phys.Lett.B671:123-127,2009","10.1016/j.physletb.2008.11.065","TCDMATH 07-22, HMI 07-09","hep-th","http://arxiv.org/licenses/nonexclusive-distrib/1.0/","  We present explicit BPS field configurations representing one nonabelian
monopole with one minimal weight 't Hooft operator insertion. We explore the
SO(3) and SU(2) gauge groups. In the case of SU(2) gauge group the minimal 't
Hooft operator can be completely screened by the monopole. If the gauge group
is SO(3), however, such screening is impossible. In the latter case we observe
a different effect of the gauge symmetry enhancement in the vicinity of the 't
Hooft operator.
","[{""version"":""v1"",""created"":""Wed, 14 Nov 2007 23:30:48 GMT""},{""version"":""v2"",""created"":""Tue, 2 Dec 2008 18:02:32 GMT""}]","2009-01-16"
"0711.2319","Wen Zhao","Wen Zhao","Statefinder diagnostic for Yang-Mills dark energy model","13 pages, 3figures, minor typos corrected","Int.J.Mod.Phys.D17:1245-1254,2008","10.1142/S0218271808012796",,"gr-qc astro-ph.CO","http://arxiv.org/licenses/nonexclusive-distrib/1.0/","  We study the statefinder parameters in the Yang-Mills condensate dark energy
models, and find that the evolving trajectories of these models are different
from those of other dark energy models. We also define two eigenfunctions of
the Yang-Mills condensate dark energy models. The values of these
eigenfunctions are quite close to zero if the equation-of-state of the
Yang-Mills condensate is not far from -1, which can be used to simply
differentiate between the Yang-Mills condensate models and other dark energy
models.
","[{""version"":""v1"",""created"":""Wed, 14 Nov 2007 23:52:17 GMT""},{""version"":""v2"",""created"":""Sun, 25 Nov 2007 01:20:56 GMT""},{""version"":""v3"",""created"":""Fri, 28 Nov 2008 21:36:26 GMT""}]","2009-04-10"
"0711.2320","Tom H. Koornwinder","Tom H. Koornwinder","Zhedanov's Algebra AW(3) and the Double Affine Hecke Algebra in the Rank
  One Case. II. The Spherical Subalgebra","This is a contribution to the Proc. of the Seventh International
  Conference ''Symmetry in Nonlinear Mathematical Physics'' (June 24-30, 2007,
  Kyiv, Ukraine), published in SIGMA (Symmetry, Integrability and Geometry:
  Methods and Applications) at http://www.emis.de/journals/SIGMA/ In v2 remarks
  about duality anti-algebra isomorphism and about shift operators added","SIGMA 4 (2008), 052, 17 pages","10.3842/SIGMA.2008.052",,"math.QA","http://arxiv.org/licenses/nonexclusive-distrib/1.0/","  This paper builds on the previous paper arXiv:math/0612730 by the author,
where a relationship between Zhedanov's algebra AW(3) and the double affine
Hecke algebra (DAHA) corresponding to the Askey-Wilson polynomials was
established. It is shown here that the spherical subalgebra of this DAHA is
isomorphic to AW(3) with an additional relation that the Casimir operator
equals an explicit constant. A similar result with q-shifted parameters holds
for the antispherical subalgebra. Some theorems on centralizers and centers for
the algebras under consideration will finally be proved as corollaries of the
characterization of the spherical and antispherical subalgebra.
","[{""version"":""v1"",""created"":""Wed, 14 Nov 2007 23:58:24 GMT""},{""version"":""v2"",""created"":""Thu, 5 Jun 2008 07:45:55 GMT""},{""version"":""v3"",""created"":""Tue, 10 Jun 2008 15:19:44 GMT""}]","2008-06-10"
"0711.2321","Cora Dvorkin","Cora Dvorkin (U. Chicago), Hiranya V. Peiris (U. Chicago/Cambridge),
  and Wayne Hu (U. Chicago)","Testable polarization predictions for models of CMB isotropy anomalies","17 pages, 15 figures; published in PRD; references added","Phys.Rev.D77:063008,2008","10.1103/PhysRevD.77.063008",,"astro-ph",,"  Anomalies in the large-scale CMB temperature sky measured by WMAP have been
suggested as possible evidence for a violation of statistical isotropy on large
scales. In any physical model for broken isotropy, there are testable
consequences for the CMB polarization field. We develop simulation tools for
predicting the polarization field in models that break statistical isotropy
locally through a modulation field. We study two different models: dipolar
modulation, invoked to explain the asymmetry in power between northern and
southern ecliptic hemispheres, and quadrupolar modulation, posited to explain
the alignments between the quadrupole and octopole. For the dipolar case, we
show that predictions for the correlation between the first 10 multipoles of
the temperature and polarization fields can typically be tested at better than
the 98% CL. For the quadrupolar case, we show that the polarization quadrupole
and octopole should be moderately aligned. Such an alignment is a generic
prediction of explanations which involve the temperature field at recombination
and thus discriminate against explanations involving foregrounds or local
secondary anisotropy. Predicted correlations between temperature and
polarization multipoles out to l = 5 provide tests at the ~ 99% CL or stronger
for quadrupolar models that make the temperature alignment more than a few
percent likely. As predictions of anomaly models, polarization statistics move
beyond the a posteriori inferences that currently dominate the field.
","[{""version"":""v1"",""created"":""Thu, 15 Nov 2007 00:23:47 GMT""},{""version"":""v2"",""created"":""Fri, 25 Apr 2008 21:51:55 GMT""}]","2008-12-18"
"0711.2322","Yoshiaki Koma","Yoshiaki Koma, Miho Koma, Hartmut Wittig","Relativistic corrections to the static potential at O(1/m) and O(1/m^2)","10 pages, Talk presented at Lattice 2007 (Hadron spectroscopy)","PoSLAT2007:111,2007",,"MKPH-T-07-15","hep-lat hep-ph nucl-th",,"  We investigate the relativistic corrections to the static potential, i.e. the
O(1/m) potential and the O(1/m^2) velocity-dependent potentials, in SU(3)
lattice gauge theory. They are important ingredients of potential
nonrelativistic QCD for heavy quarkonium. Utilizing the multi-level algorithm,
we obtain remarkably clean signals of these potentials up to r=0.9 fm. We
observe long range nonperturbative contributions to these corrections.
","[{""version"":""v1"",""created"":""Thu, 15 Nov 2007 00:14:22 GMT""}]","2008-11-26"
"0711.2323","Mitsusada M. Sano","Hiroyuki Tomita and Mitsusada M. Sano","Irreversible Circulation of Fluctuation and Entropy Production","17pages, no figures, to appear in Progreess of Theoretical Physics,
  Vol. 119, No.4",,"10.1143/PTP.119.515",,"cond-mat.stat-mech",,"  Physical and chemical stochastic processes described by the master equation
are investigated. In this paper, we examine the entropy production both for the
master equation and for the corresponding Fokker-Planck equation. For the
master equation, the exact expression of the entropy production was recently
derived by Gaspard using the Kolmogorov-Sinai entropy ({\em J.Stat.Phys.},
\textbf{117} (2004), 599; [Errata; \textbf{126} (2006), 1109 ]). Although
Gaspard's expression is derived from a stochastic consideration, it should be
noted that Gaspard's expression conincides with the thermodynamical expression.
For the corresponding Fokker-Planck equation, by using the detailed imbalance
relation which appears in the derivation process of the fluctuation theorem
through the Onsger-Machlup theory, the entropy production is expressed in terms
of the {\em irreversible circulation of fluctuation}, which was proposed by
Tomita and Tomita ({\em Prog.Theor.Phys.}, \textbf{51} (1974), 1731). However,
this expression for the corresponding Fokker-Planck equation differs from that
of the entropy production for the master equation. This discrepancy is due to
the difference between the master equation and the corresponding Fokker-Planck
equation, namely the former treats discrete events, but the latter equation is
an approximation of the former one. In fact, in the latter equation, the
original discrete events are smoothed out. To overcome this difficulty, we
propose the {\em path weight principle}. By using this principle, the modified
expression of the entropy production for the corresponding Fokker-Planck
equation coincides with that of the master equation (i.e., the thermodynamical
expression) for a simple chemical reaction system and a diffusion system.
","[{""version"":""v1"",""created"":""Thu, 15 Nov 2007 00:25:01 GMT""},{""version"":""v2"",""created"":""Wed, 16 Apr 2008 04:56:22 GMT""}]","2009-11-13"
"0711.2324","Igor Belegradek","Igor Belegradek (Georgia Tech)","Rigidity and relative hyperbolicity of real hyperbolic hyperplane
  complements","to appear in Pure and Applied Mathematics Quarterly in the special
  issue in honor of Farrell and Jones",,,,"math.GR math.DG","http://arxiv.org/licenses/nonexclusive-distrib/1.0/","  For n>3 we study spaces obtained from finite volume complete real hyperbolic
n-manifolds by removing a compact totally geodesic submanifold of codimension
two. We prove that their fundamental groups are relative hyperbolic, co-Hopf,
biautomatic, residually hyperbolic, not K\""ahler, not isomorphic to lattices in
virtually connected real Lie groups, have no nontrivial subgroups with property
(T), have finite outer automorphism groups, satisfy Mostow-type Rigidity, have
finite asymptotic dimension and rapid decay property, and satisfy Baum-Connes
conjecture. We also characterize those lattices in real Lie groups that are
isomorphic to relatively hyperbolic groups.
","[{""version"":""v1"",""created"":""Thu, 15 Nov 2007 00:28:51 GMT""},{""version"":""v2"",""created"":""Mon, 14 Jan 2008 19:46:02 GMT""},{""version"":""v3"",""created"":""Wed, 24 Dec 2008 23:43:06 GMT""},{""version"":""v4"",""created"":""Sat, 28 Aug 2010 13:04:29 GMT""}]","2010-08-31"
"0711.2325","Sarah Morrison","S. Morrison, A.S. Parkins","Collective spin systems in dispersive optical cavity QED: Quantum phase
  transitions and entanglement","19 pages, 18 figures, shortened version","Phys. Rev. A 77, 043810 (2008)","10.1103/PhysRevA.77.043810",,"quant-ph cond-mat.other",,"  We propose a cavity QED setup which implements a dissipative
Lipkin-Meshkov-Glick model -- an interacting collective spin system. By varying
the external model parameters the system can be made to undergo both first-and
second-order quantum phase transitions, which are signified by dramatic changes
in cavity output field properties, such as the probe laser transmission
spectrum. The steady-state entanglement between pairs of atoms is shown to peak
at the critical points and can be experimentally determined by suitable
measurements on the cavity output field. The entanglement dynamics also
exhibits pronounced variations in the vicinities of the phase transitions.
","[{""version"":""v1"",""created"":""Thu, 15 Nov 2007 00:40:43 GMT""},{""version"":""v2"",""created"":""Wed, 7 May 2008 02:27:41 GMT""}]","2008-05-07"
"0711.2327","David Harrington","D. M. Harrington and J.R. Kuhn","Spectropolarimetric observations of Herbig Ae/Be Stars I: HiVIS
  spectropolarimetric calibration and reduction techniques","35 pages, 44 figures, Accepted by PASP",,"10.1086/526549","IfA-07-195","astro-ph",,"  Using the HiVIS spectropolarimeter built for the Haleakala 3.7m AEOS
telescope in Hawaii, we are collecting a large number of high precision
spectropolarimetrc observations of stars. In order to precisely measure very
small polarization changes, we have performed a number of polarization
calibration techniques on the AEOS telescope and HiVIS spectrograph. We have
extended our dedicated IDL reduction package and have performed some hardware
upgrades to the instrument. We have also used the ESPaDOnS spectropolarimeter
on CFHT to verify the HiVIS results with back-to-back observations of MWC 361
and HD163296. Comparision of this and other HiVIS data with stellar
observations from the ISIS and WW spectropolarimeters in the literature further
shows the usefulness of this instrument.
","[{""version"":""v1"",""created"":""Thu, 15 Nov 2007 00:52:58 GMT""}]","2009-11-13"
"0711.2328","Hiroki Takesue","Hiroki Takesue, Yasuhiro Tokura, Hiroshi Fukuda, Tai Tsuchizawa,
  Toshifumi Watanabe, Koji Yamada, and Sei-ichi Itabashi","Entanglement generation using silicon wire waveguide","8 pages, 3 figures. A part of this content was presented at Eur.
  Conf. Opt. Commun. ECOC 2007, postdeadline paper 2.3, September 20, 2007,
  Berlin","Appl. Phys. Lett. 91, 201108 (2007)","10.1063/1.2814040",,"quant-ph",,"  We report the first entanglement generation experiment that utilizes a
silicon waveguide. Using spontaneous four-wave mixing in a 1.09-cm-long silicon
wire waveguide, we generated 1.5-um, high-purity time-bin entangled photons
without temperature control, and observed a two-photon interference fringe with
>73% visibility.
","[{""version"":""v1"",""created"":""Thu, 15 Nov 2007 01:15:19 GMT""}]","2007-11-16"
"0711.2329","Sumanta Tewari","Sumanta Tewari, Chuanwei Zhang, Victor M. Yakovenko, S. Das Sarma","Time-reversal symmetry breaking by a $(d+id)$ density-wave state in
  underdoped cuprate superconductors","4 pages, 3 eps figures; minor typos corrected, references updated,
  new title as suggested by the PRL editor; references updated, final version
  as published in PRL","Phys. Rev. Lett. 100, 217004 (2008)","10.1103/PhysRevLett.100.217004",,"cond-mat.str-el",,"  It was proposed that the $id_{x^2-y^2}$ density-wave state (DDW) may be
responsible for the pseudogap behavior in the underdoped cuprates. Here we show
that the admixture of a small $d_{xy}$ component to the DDW state breaks the
symmetry between the counter-propagating orbital currents of the DDW state and,
thus, violates the macroscopic time-reversal symmetry. This symmetry breaking
results in a non-zero polar Kerr effect, which has recently been observed in
the pseudogap phase.
","[{""version"":""v1"",""created"":""Thu, 15 Nov 2007 15:59:00 GMT""},{""version"":""v2"",""created"":""Tue, 20 Nov 2007 17:17:16 GMT""},{""version"":""v3"",""created"":""Wed, 4 Jun 2008 00:29:05 GMT""}]","2008-06-04"
"0711.2330","Hiromi Saida","Hiromi Saida","Black Hole Evaporation and Generalized 2nd Law with Nonequilibrium
  Thermodynamics","Typo is corrected. 10 pages, 2 figures. Based on proceedings and
  talks given at: APCTP Jeju Meeting on Gravitation and Cosmology (Jeju, Korea,
  2007), Dynamics and Thermodynamics of Black Holes and Naked Singularities II,
  (Politecnico di Milano, Italy, 2007) and 16th General Relativity and
  Gravitation (Niigata, Japan, 2006)",,,,"gr-qc",,"  In general, when a black hole evaporates, there arises a net energy flow from
black hole into its outside environment due to Hawking radiation and energy
accretion onto black hole. The existence of energy flow means that the
thermodynamic state of the whole system, which consists of a black hole and its
environment, is in a nonequilibrium state. To know the detail of evaporation
process, the nonequilibrium effects of energy flow should be taken into
account. The nonequilibrium nature of black hole evaporation is a challenging
topic including issues of not only black hole physics but also nonequilibrium
physics. Using the nonequilibrium thermodynamics which has been formulated
recently, this report shows: (1) the self-gravitational effect of black hole
which appears as its negative heat capacity guarantees the validity of
generalized 2nd law without entropy production inside the outside environment,
(2) the nonequilibrium effect of energy flow tends to shorten the evaporation
time (life time) of black hole, and consequently specific nonequilibrium
phenomena are suggested. Finally a future direction of this study is commented.
","[{""version"":""v1"",""created"":""Thu, 15 Nov 2007 02:25:37 GMT""},{""version"":""v2"",""created"":""Fri, 16 Nov 2007 03:39:06 GMT""}]","2007-11-16"
"0711.2331","Artem Sabourov","A.V. Sabourov, M.I. Pravdin and S.P. Knurenko","A shape of charged particle lateral distribution in individual EAS
  events with energy above 10^19 eV arriving from different celestial regions","5 pages, 4 figures",,,,"astro-ph",,"  A shape of lateral distribution for charged particles in events with energy
above 10^19eV is considered. Two methods were used for individual LDF
parametrization. In the first approach, the index of power was determined for
generalized Greisen-Linsley approximation. In second, mean square radius of the
shower was determined for approximation proposed by Lagutin et al. Comparison
of resulted parameters is presented for individual events arrived from
different celestial regions -- Galactic planes and the region with increased
flux of particles with E(0)>=10^19eV (according to Yakutsk array): 1.7h-3.7h
right ascension; 45-60 degrees declination.
","[{""version"":""v1"",""created"":""Thu, 15 Nov 2007 03:19:11 GMT""}]","2007-11-16"
