"0709.2809","Urs Hartl","Matthias Bornhofen, Urs Hartl","Pure Anderson Motives and Abelian \tau-Sheaves","final version as it appears in Mathematische Zeitschrift","Mathematische Zeitschrift 268 (2011), 67-100","10.1007/s00209-009-0661-1",,"math.NT math.AG","http://arxiv.org/licenses/nonexclusive-distrib/1.0/","  Pure t-motives were introduced by G. Anderson as higher dimensional
generalizations of Drinfeld modules, and as the appropriate analogs of abelian
varieties in the arithmetic of function fields. In order to construct moduli
spaces for pure t-motives the second author has previously introduced the
concept of abelian \tau-sheaf. In this article we clarify the relation between
pure t-motives and abelian \tau-sheaves. We obtain an equivalence of the
respective quasi-isogeny categories. Furthermore, we develop the elementary
theory of both structures regarding morphisms, isogenies, Tate modules, and
local shtukas. The later are the analogs of p-divisible groups.
","[{""version"":""v1"",""created"":""Tue, 18 Sep 2007 14:09:19 GMT""},{""version"":""v2"",""created"":""Fri, 15 Jan 2010 09:24:08 GMT""}]","2014-01-28"
"0709.2810","Lisa Hall","Carsten van de Bruck, Ki-Young Choi, Lisa M.H. Hall","Moduli Evolution in the Presence of Matter Fields and Flux
  Compactification","28 pages, 32 figures, JCAP format","JCAP 0711:018,2007","10.1088/1475-7516/2007/11/018",,"hep-th",,"  We provide a detailed analysis of the dynamics of moduli fields in the KKLT
scenario coupled to a Polonyi field, which plays the role of a hidden matter
sector field. It was previously shown that such matter fields can uplift AdS
vacua to Minkowski or de Sitter vacua. Additionally, we take a background fluid
into account (which can be either matter or radiation), which aids moduli
stabilisation. Our analysis shows that the presence of the matter field further
aids stabilisation, due to a new scaling regime. We study the system both
analytically and numerically.
","[{""version"":""v1"",""created"":""Tue, 18 Sep 2007 12:25:28 GMT""}]","2009-06-11"
"0709.2811","Yohan Payan","Nicolas Vuillerme (TIMC - IMAG), Nicolas Pinsault (TIMC - IMAG),
  Olivier Chenu (TIMC - IMAG), Matthieu Boisgontier (TIMC - IMAG), Jacques
  Demongeot (TIMC - IMAG), Yohan Payan (TIMC - IMAG)","How a plantar pressure-based, tongue-placed tactile biofeedback modifies
  postural control mechanisms during quiet standing",,"Experimental Brain Research 181, 4 (2007) 547-54","10.1007/s00221-007-0953-9",,"physics.med-ph q-bio.NC",,"  The purpose of the present study was to determine the effects of a plantar
pressure-based, tongue-placed tactile biofeedback on postural control
mechanisms during quiet standing. To this aim, sixteen young healthy adults
were asked to stand as immobile as possible with their eyes closed in two
conditions of No-biofeedback and Biofeedback. Centre of foot pressure (CoP)
displacements, recorded using a force platform, were used to compute the
horizontal displacements of the vertical projection the centre of gravity
(CoGh) and those of the difference between the CoP and the vertical projection
of the CoG (CoP-CoGv). Altogether, the present findings suggest that the main
way the plantar pressure-based, tongue-placed tactile biofeedback improves
postural control during quiet standing is via both a reduction of the
correction thresholds and an increased efficiency of the corrective mechanism
involving the CoGh displacements.
","[{""version"":""v1"",""created"":""Tue, 18 Sep 2007 12:48:54 GMT""}]","2007-09-19"
"0709.2812","Thomas Chen","Thomas Chen, Juerg Froehlich, Alessandro Pizzo","Infraparticle Scattering States in Non-Relativistic QED: II. Mass Shell
  Properties","AMS Latex, 45 pages, 2 figures","Journal of Mathematical Physics, 50 (1), 012103, 2009.","10.1063/1.3000088",,"math-ph math.MP","http://arxiv.org/licenses/nonexclusive-distrib/1.0/","  We study the infrared problem in the usual model of QED with non-relativistic
matter. We prove spectral and regularity properties characterizing the mass
shell of an electron and one-electron infraparticle states of this model. Our
results are crucial for the construction of infraparticle scattering states,
which are treated in a separate paper.
","[{""version"":""v1"",""created"":""Tue, 18 Sep 2007 14:59:22 GMT""},{""version"":""v2"",""created"":""Tue, 22 Apr 2008 14:01:42 GMT""},{""version"":""v3"",""created"":""Sun, 14 Dec 2008 17:26:08 GMT""}]","2015-05-13"
"0709.2813","Luca Giuzzi","L. Giuzzi, A. Sonnino","LDPC codes from Singer cycles","11 Pages","Discrete Applied Mathematics 157: 1723-1728 (2009)","10.1016/j.dam.2009.01.013",,"cs.IT math.IT",,"  The main goal of coding theory is to devise efficient systems to exploit the
full capacity of a communication channel, thus achieving an arbitrarily small
error probability. Low Density Parity Check (LDPC) codes are a family of block
codes--characterised by admitting a sparse parity check matrix--with good
correction capabilities. In the present paper the orbits of subspaces of a
finite projective space under the action of a Singer cycle are investigated.
","[{""version"":""v1"",""created"":""Tue, 18 Sep 2007 15:17:21 GMT""}]","2009-07-18"
"0709.2814","Celine Robert","C\'eline Robert (LJK), Eric Blayo (LJK), Jacques Verron (LEGI)","Reduced-order 4D-Var: a preconditioner for the Incremental 4D-Var data
  assimilation method",,"Geophysical Research Letters 33, L18609 (2006) 1-4",,,"physics.geo-ph math.AP math.OC",,"  This study demonstrates how the incremental 4D-Var data assimilation method
can be applied efficiently preconditione d in an application to an
oceanographic problem. The approach consists in performing a few iterations of
the reduced-order 4D-Var prior to the incremental 4D-Var in the full space in
order to achieve faster convergence. An application performed in the tropical
Pacific Ocean, with assimilation of TAO temperature data, shows the method to
be both feasible and efficient. It allows the global cost of the assimilation
to be reduced by a factor of 2 without affecting the quality of the solution.
","[{""version"":""v1"",""created"":""Tue, 18 Sep 2007 13:07:14 GMT""}]","2007-09-19"
"0709.2815","Urs Hartl","Matthias Bornhofen, Urs Hartl","Pure Anderson Motives over Finite Fields","v2: final version to appear in Journal of Number Theory. Note, this
  is the second part of the two-in-one article arXiv:math.NT/0609733","Journal of Number Theory 129, n. 2 (2009), 247-283","10.1016/j.jnt.2008.09.006",,"math.NT math.AG","http://arxiv.org/licenses/nonexclusive-distrib/1.0/","  In the arithmetic of function fields Drinfeld modules play the role that
elliptic curves take on in the arithmetic of number fields. As higher
dimensional generalizations of Drinfeld modules, and as the appropriate
analogues of abelian varieties, G. Anderson introduced pure t-motives. In this
article we study the arithmetic of the later. We investigate which pure
t-motives are semisimple, that is, isogenous to direct sums of simple ones. We
give examples for pure t-motives which are not semisimple. Over finite fields
the semisimplicity is equivalent to the semisimplicity of the endomorphism
algebra, but also this fails over infinite fields. Still over finite fields we
study the endomorphism rings of pure t-motives and criteria for the existence
of isogenies. We obtain answers which are similar to Tate's famous results for
abelian varieties.
","[{""version"":""v1"",""created"":""Tue, 18 Sep 2007 14:12:53 GMT""},{""version"":""v2"",""created"":""Thu, 30 Oct 2008 20:02:34 GMT""}]","2014-01-28"
"0709.2816","Hartmut Machner","A.Budzanowski, D.Filges, F.Goldenbaum, A.Heczko, H.Hodde, L.Jarczyk,
  B.Kamys, M.Kistryn, St.Kistryn, St.Kliczewski, A.Kowalczyk, M. Smoluchowski,
  E.Kozik, P.Kulessa, H.Machner, A.Magiera, W.Migdal, N.Paul,
  B.Piskor-Ignatowicz, M.Puchala, K.Pysz, Z.Rudy, R.Siudak, M.Wojciechowski","Non-equilibrium emission of complex fragments from p+Au collisions at
  2.5 GeV proton beam energy",,"Phys.Rev.C76:014618,2007","10.1103/PhysRevC.76.014618",,"nucl-ex",,"  Energy and angular dependence of double differential cross sections
d$^2\sigma$/d$\Omega$dE was measured for reactions induced by 2.5 GeV protons
on Au target with isotopic identification of light products (H, He, Li, Be, and
B) and with elemental identification of heavier intermediate mass fragments (C,
N, O, F, Ne, Na, Mg, and Al). It was found that two different reaction
mechanisms give comparable contributions to the cross sections. The
intranuclear cascade of nucleon-nucleon collisions followed by evaporation from
an equilibrated residuum describes low energy part of the energy distributions
whereas another reaction mechanism is responsible for high energy part of the
spectra of composite particles. Phenomenological model description of the
differential cross sections by isotropic emission from two moving sources led
to a very good description of all measured data. Values of the extracted
parameters of the emitting sources are compatible with the hypothesis claiming
that the high energy particles emerge from pre-equilibrium processes consisting
in a breakup of the target into three groups of nucleons; small, fast and hot
fireball of $\sim$ 8 nucleons, and two larger, excited prefragments, which
emits the light charged particles and intermediate mass fragments. The smaller
of them contains $\sim$ 20 nucleons and moves with velocity larger than the CM
velocity of the proton projectile and the target. The heavier prefragment
behaves similarly as the heavy residuum of the intranuclear cascade of
nucleon-nucleon collisions. %The mass and charge dependence of the total
production cross %sections was extracted from the above analysis for all
observed %reaction products. This dependence follows the power low behavior
%(A$^{-\tau}$ or Z$^{-\tau}$).
","[{""version"":""v1"",""created"":""Tue, 18 Sep 2007 13:16:05 GMT""}]","2008-11-26"
"0709.2817","Pietro Colangelo","P. Colangelo, F. De Fazio, R. Ferrandes, T.N. Pham","FCNC $B_s$ and $\Lambda_b$ transitions: Standard Model versus a single
  Universal Extra Dimension scenario","LaTex, 8 pages, 7 eps figures. Version to be published in Physical
  Review D","Phys.Rev.D77:055019,2008","10.1103/PhysRevD.77.055019","BARI-TH/07-572","hep-ph",,"  We study the FCNC $B_s \to \phi \gamma, \phi \nu \bar \nu$ and $\Lambda_b \to
\Lambda \gamma, \Lambda \nu \bar \nu$ transitions in the Standard Model and in
a scenario with a single Universal Extra Dimension. In particular, we focus on
the present knowledge of the hadronic uncertainties and on possible
improvements. We discuss how the measurements of these modes can be used to
constrain the new parameter involved in the extra dimensional scenario, the
radius $R$ of the extra dimension, completing the information available from
B-factories. The rates of these $b \to s$ induced decays are within the reach
of new experiments, such as LHCb.
","[{""version"":""v1"",""created"":""Tue, 18 Sep 2007 13:22:41 GMT""},{""version"":""v2"",""created"":""Fri, 15 Feb 2008 09:09:41 GMT""}]","2008-11-26"
"0709.2818","Rui Santos","P.M. Ferreira, R.B. Guedes and R. Santos","Lepton Flavour Violation at the ILC","Presented at XXVII Physics in Collision - Annecy, France, 26 - 29
  June 2007 (to appear in Acta Physica Polonica B)","Acta Phys.Polon.Supp.1:433-436,2008",,,"hep-ph",,"  We explore the possibility of detecting lepton flavour violation, now a well
established experimental fact, at the International Linear Collider. Using a
model independent approach we conclude that, given all experimental constraints
available, there is still room to detect lepton flavour violation at the ILC.
","[{""version"":""v1"",""created"":""Tue, 18 Sep 2007 13:23:08 GMT""}]","2009-06-12"
"0709.2819","Vladimir Peskov","V. Peskov and A. Zichichi","A New Supersensitive Flame Detector and its Use for Early Forest Fire
  Detection",,,,"CERN-LAA- Preprint -863/07","physics.ins-det",,"  A new flame detector, three orders of magnitude more powerful than the
existing ones, is presented. This detector needs to be mass-produced for its
use in order to be incorporated in an early forest fire detection system. A
project able to implement its use to overcome the forest fire emergency is
described.
","[{""version"":""v1"",""created"":""Tue, 18 Sep 2007 13:26:12 GMT""}]","2007-09-19"
"0709.2820","Christophe Martayan","Christophe Martayan (GEPI), Yves Fremat, Anne-Marie Hubert (GEPI),
  Michele Floquet (GEPI), Coralie Neiner (GEPI), Jean Zorec, Dietrich Baade
  (ESO), Juan Guti\'errez-Soto (GEPI), Juan Fabregat, Malek Mekkas (GEPI)","On the behaviour of B and Be stars at low metallicity","sf2a 2007 PNPS",,,,"astro-ph",,"  We present new results obtained with the VLT GIRAFFE for a large sample of B
and Be stars belonging to the Magellanic Clouds, i.e. at low metallicity.
First, we show the effects of the metallicity of the environment on their
rotation (linear, angular, and at the ZAMS). Second, we present the analysis of
the effects of metallicity and evolution on the appearance of Be stars. We also
new present results about the proportions of Be stars to B stars. Third, by
cross-correlation with large photometric surveys such as MACHO and OGLE, we
report on the detection for the first time of short-term multi-periodicity in 9
Be stars in the Small Magellanic Cloud, which can be interpreted in terms of
pulsations.
","[{""version"":""v1"",""created"":""Tue, 18 Sep 2007 13:27:12 GMT""},{""version"":""v2"",""created"":""Wed, 19 Sep 2007 16:56:15 GMT""}]","2007-09-19"
"0709.2821","Wolfgang Reichel","Wolfgang Reichel and Tobias Weth","A priori bounds and a Liouville theorem on a half-space for higher order
  elliptic Dirichlet problems","23 pages",,,,"math.AP",,"  We consider the $2m$-th order elliptic boundary value problem $Lu=f(x,u)$ on
a bounded smooth domain $\Omega$ in $R^N$ with Dirichlet boundary conditions.
The operator $L$ is a uniformly elliptic operator of order $2m$. We assume that
for $s\to \pm\infty$ the nonlinearity $f(x,s)$ behaves like $|s|^q$ multiplied
by a continuous and positive function of $x$. Here the exponent $q$ is
subcritical, i.e., $q>1$ if $N<=2m$, $1<q<\frac{N+2m}{N-2m}$ if $N>2m$. We
prove a priori bounds, i.e, we show that the $L^\infty$-norm of every solution
$u$ is bounded by a constant independent of $u$. The solutions are allowed to
be sign-changing. The proof is done by a blow-up argument which relies on the
following new Liouville-type theorem on a half-space: if $u$ is a classical,
bounded, non-negative solution of $(-\Delta)^m u = u^q$ in a half-space with
Dirichlet boundary conditions and if $q>1$ is subcritical then $u$ vanishes
identically.
","[{""version"":""v1"",""created"":""Tue, 18 Sep 2007 13:27:17 GMT""}]","2007-09-19"
"0709.2822","Roberto D. Mota Esteves","Ruben Cordero and Roberto D. Mota","Soliton Stability in a Generalized Sine-Gordon Potential",,"Int.J.Theor.Phys.43:2215-2222,2004","10.1023/B:IJTP.0000049020.06344.54",,"hep-th",,"  We study stability of a generalized sine-Gordon model with two coupled scalar
fields in two dimensions. Topological soliton solutions are found from the
first-order equations that solve the equations of motion. The perturbation
equations can be cast in terms of a Schrodinger-like operators for fluctuations
and their spectra are calculated.
","[{""version"":""v1"",""created"":""Tue, 18 Sep 2007 13:29:25 GMT""}]","2008-11-26"
"0709.2823","Christophe Martayan","Christophe Martayan (GEPI), Michele Floquet (GEPI), Anne-Marie Hubert
  (GEPI), Juan Fabregat, Yves Fremat, Dietrich Baade (ESO), Coralie Neiner
  (GEPI)","On the nature of early-type emission line objects in NGC6611","Sf2a 2007 PNPS",,,,"astro-ph",,"  The number and the nature of emission line stars in the young open cluster
NGC6611 is still the object of debates. Due to the presence of a strong and
variable nebulosity in the cluster, the number of emission line stars is highly
depending on the technique and the resolution used for the observations. Thanks
to observations with the ESO-WFI, in slitless spectroscopic mode, and with the
VLT-GIRAFFE we have been able to disentangle the circumstellar and nebular
emissions. We confirm the small number of true emission line objects and we
precise their nature: mainly Herbig Be stars.
","[{""version"":""v1"",""created"":""Tue, 18 Sep 2007 13:29:39 GMT""},{""version"":""v2"",""created"":""Wed, 19 Sep 2007 16:50:41 GMT""}]","2007-09-19"
"0709.2824","Simon Rosenfeld","Simon Rosenfeld","Pseudo-Random Fluctuations, Stochastic Cooperativity and Burstiness in
  Dynamically Unstable High-Dimensional Biochemical Networks","34 pages, 8 figures",,,,"q-bio.MN q-bio.GN",,"  The goal of this paper is to outline a scenario of emerging stochasticity in
high-dimensional highly nonlinear systems, such as genetic regulatory networks
(GRN). We focus attention on the fact that in such systems confluence of all
the factors necessary for gene expression is a comparatively rare event, and
only massive redundancy makes such events sufficiently frequent. An immediate
consequence of this rareness is burstiness in mRNA and protein copy numbers, a
well known experimentally observed effect. We introduce the concept of
stochastic cooperativity and show that this phenomenon is a natural consequence
of high dimensionality coupled with highly nonlinearity of a dynamical system.
In mathematical terms, burstiness is associated with heavy-tailed probability
distributions of stochastic processes describing the dynamics of the system.
The sequence of stochastic cooperativity events allows for transition from
continuous deterministic dynamics expressed in terms of ordinary differential
equations (ODE) to discrete stochastic dynamics expressed in terms of Langevin
and Fokker-Plank equations. We demonstrate also that high-dimensional nonlinear
systems, even in the absence of explicit mechanisms for suppressing inherent
instability, may nevertheless reside in a state of stationary pseudo-random
fluctuations which for all practical purposes may be regarded as stochastic
process. This type of stochastic behavior is an inherent property of such
systems and requires neither an external random force, nor highly specialized
conditions of bistability.
","[{""version"":""v1"",""created"":""Tue, 18 Sep 2007 13:32:07 GMT""}]","2007-09-19"
"0709.2825","Celine Robert","C\'eline Robert (LJK), S. Durbiano (LJK), Eric Blayo (LJK), Jacques
  Verron (LEGI), Jacques Blum (JAD), Fran\c{c}ois-Xavier Le Dimet (LJK)","A reduced-order strategy for 4D-Var data assimilation",,"Journal of Marine Systems 57 (2005) 70-82","10.1016/j.jmarsys.2005.04.003",,"physics.geo-ph math.AP math.OC",,"  This paper presents a reduced-order approach for four-dimensional variational
data assimilation, based on a prior EO F analysis of a model trajectory. This
method implies two main advantages: a natural model-based definition of a mul
tivariate background error covariance matrix $\textbf{B}_r$, and an important
decrease of the computational burden o f the method, due to the drastic
reduction of the dimension of the control space. % An illustration of the
feasibility and the effectiveness of this method is given in the academic
framework of twin experiments for a model of the equatorial Pacific ocean. It
is shown that the multivariate aspect of $\textbf{B}_r$ brings additional
information which substantially improves the identification procedure. Moreover
the computational cost can be decreased by one order of magnitude with regard
to the full-space 4D-Var method.
","[{""version"":""v1"",""created"":""Tue, 18 Sep 2007 13:37:41 GMT""}]","2007-09-19"
"0709.2826","Paolo Bolzoni","Paolo Bolzoni","Sudakov resummation in QCD","PHD thesis, 147 pages, 16 figures, Tutor: Stefano Forte, Referee:
  Giovanni Ridolfi, added references","ISSN 1435-8085 (2007)",,"DESY-THESIS-2007-032","hep-ph",,"  In this PhD thesis, we analyze and generalize the renormalization group
approach to the resummation of large logarithms in the perturbative expansion
due to soft and collinear multiparton emissions. In particular, we present a
generalization of this approach to prompt photon production. It is interesting
to see that also with the more intricate two-scale kinematics that
characterizes prompt photon production in the soft limit, it remains true that
resummation simply follows from general kinematic properties of the phase
space. Also, this approach does not require a separate treatment of individual
colour structures when more than one colour structure contributes to fixed
order results. However, the resummation formulae obtained here turn out to be
less predictive than previous results: this depends on the fact that here
neither specific factorization properties of the cross section in the soft
limit is assumed, nor that soft emission satisfies eikonal-like relations. We
also derive resumation formulae to all logarithmic accuracy and valid for all
values of rapidity for the prompt photon production and the Drell-Yan rapidity
distributions. We show that for the fixed-target experiment E866/NuSea, the NLL
resummation corrections are comparable to NLO fixed-order corrections and are
crucial to obtain agreement with the data. Finally we outline also possible
future applications of the renormalization group approach.
","[{""version"":""v1"",""created"":""Tue, 18 Sep 2007 13:38:46 GMT""},{""version"":""v2"",""created"":""Thu, 20 Sep 2007 08:35:57 GMT""}]","2010-06-30"
"0709.2827","Paul Goddard","Andrzej Nowojewski, Paul A. Goddard, Stephen J. Blundell","An analytically solvable model of the effect of magnetic breakdown on
  angle-dependent magnetoresistance in a quasi-two-dimensional metal","4 pages, 3 figures","Phys. Rev. B 77, 012402 (2008)","10.1103/PhysRevB.77.012402",,"cond-mat.str-el",,"  We have developed an analytical model of angle-dependent magnetoresistance
oscillations (AMROs) in a quasi-two-dimensional metal in which magnetic
breakdown occurs. The model takes account of all the contributions from
quasiparticles undergoing both magnetic breakdown and Bragg reflection at each
junction and allows extremely efficient simulation of data which can be
compared with recent experimental results on the organic metal
kappa-ET2Cu(NCS)2. AMROs resulting from both closed and open orbits emerge
naturally at low field, and the model enables the transition to breakdown-AMROs
with increasing field to be described in detail.
","[{""version"":""v1"",""created"":""Tue, 18 Sep 2007 13:39:27 GMT""}]","2008-01-09"
"0709.2828","Alexander Eigenbrod","A. Eigenbrod (1), F. Courbin (1), D. Sluse (1), G. Meylan (1), E. Agol
  (2) ((1) EPFL, Switzerland, (2) University of Washington, USA)","Microlensing variability in the gravitationally lensed quasar Q2237+0305
  = the Einstein Cross, I. Spectrophotometric monitoring with the VLT","16 pages, 16 figures, A&A accepted, corrected Fig. 16",,"10.1051/0004-6361:20078703",,"astro-ph",,"  We present the results of the first long-term (2.2 years) spectroscopic
monitoring of a gravitationally lensed quasar, namely the Einstein Cross
Q2237+0305. The goal of this paper is to present the observational facts to be
compared in follow-up papers with theoretical models to constrain the inner
structure of the source quasar. We spatially deconvolve deep VLT/FORS1 spectra
to accurately separate the spectrum of the lensing galaxy from the spectra of
the quasar images. Accurate cross-calibration of the 58 observations at
31-epoch from October 2004 to December 2006 is carried out with non-variable
foreground stars observed simultaneously with the quasar. The quasar spectra
are further decomposed into a continuum component and several broad emission
lines to infer the variations of these spectral components. We find prominent
microlensing events in the quasar images A and B, while images C and D are
almost quiescent on a timescale of a few months. The strongest variations are
observed in the continuum of image A. Their amplitude is larger in the blue
(0.7 mag) than in the red (0.5 mag), consistent with microlensing of an
accretion disk. Variations in the intensity and profile of the broad emission
lines are also reported, most prominently in the wings of the CIII] and center
of the CIV emission lines. During a strong microlensing episode observed in
June 2006 in quasar image A, the broad component of the CIII] is more highly
magnified than the narrow component. In addition, the emission lines with
higher ionization potentials are more magnified than the lines with lower
ionization potentials, consistent with the results obtained with reverberation
mapping. Finally, we find that the V-band differential extinction by the lens,
between the quasar images, is in the range 0.1-0.3 mag.
","[{""version"":""v1"",""created"":""Tue, 18 Sep 2007 13:45:04 GMT""},{""version"":""v2"",""created"":""Mon, 14 Jan 2008 09:13:58 GMT""},{""version"":""v3"",""created"":""Tue, 22 Jan 2008 15:57:26 GMT""}]","2009-11-13"
