"0709.2693","Chick Woodward","Robert D. Gehrz, Charles E. Woodward, L. Andrew Helton, Elisha F.
  Polomski, Thomas L. Hayward, James R. Houck, A. Evans, Joachim Krautter,
  Steven N. Shore, Sumner Starrfield, James Truran, G. J. Schwarz, R. Mark
  Wagner","The Neon Abundance in the Ejecta of QU Vul From Late-Epoch IR Spectra","ApJ 2007 accepted, 18 pages, including 5 figures, 1 table",,"10.1086/523660",,"astro-ph",,"  We present ground-based SpectroCam-10 mid-infrared, MMT optical, and Spitzer
Space Telescope IRS mid-infrared spectra taken 7.62, 18.75, and 19.38 years
respectively after the outburst of the old classical nova QU Vulpeculae (Nova
Vul 1984 #2). The spectra of the ejecta are dominated by forbidden line
emission from neon and oxygen. Our analysis shows that neon was, at the first
and last epochs respectively, more than 76 and 168 times overabundant by number
with respect to hydrogen compared to the solar value. These high lower limits
to the neon abundance confirm that QU Vul involved a thermonuclear runaway on
an ONeMg white dwarf and approach the yields predicted by models of the
nucleosynthesis in such events.
","[{""version"":""v1"",""created"":""Mon, 17 Sep 2007 18:47:40 GMT""}]","2009-11-13"
"0709.2694","Tanya Araujo","Tanya Araujo, R. Vilela Mendes","Innovation Success and Structural Change: An Abstract Agent Based Study","20 pages, 12 figures","Advances in Complex Systems 12 (2009) 233-253",,,"q-fin.GN nlin.AO",,"  A model is developed to study the effectiveness of innovation and its impact
on structure creation and structure change on agent-based societies. The
abstract model that is developed is easily adapted to any particular field. In
any interacting environment, the agents receive something from the environment
(the other agents) in exchange for their effort and pay the environment a
certain amount of value for the fulfilling of their needs or for the very price
of existence in that environment. This is coded by two bit strings and the
dynamics of the exchange is based on the matching of these strings to those of
the other agents. Innovation is related to the adaptation by the agents of
their bit strings to improve some utility function.
","[{""version"":""v1"",""created"":""Mon, 17 Sep 2007 19:44:14 GMT""}]","2010-08-31"
"0709.2695","Bartlomiej Dybiec","Bart{\l}omiej Dybiec, Ewa Gudowska-Nowak","Bimodality and hysteresis in systems driven by confined L\'evy flights","4 pages, 5 figures, 30 references","New J. Phys. 9 452 (2007)","10.1088/1367-2630/9/12/452",,"cond-mat.stat-mech",,"  We demonstrate occurrence of bimodality and dynamical hysteresis in a system
describing an overdamped quartic oscillator perturbed by additive white and
asymmetric L\'evy noise. Investigated estimators of the stationary probability
density profiles display not only a turnover from unimodal to bimodal character
but also a change in a relative stability of stationary states that depends on
the asymmetry parameter of the underlying noise term. When varying the
asymmetry parameter cyclically, the system exhibits a hysteresis in the
occupation of a chosen stationary state.
","[{""version"":""v1"",""created"":""Mon, 17 Sep 2007 18:48:07 GMT""}]","2009-11-13"
"0709.2696","Victor Bovdi","Alexander N. Grishkov, Andrei V. Zavarnitsine","Sylow's theorem for Moufang loops","21 pages","J. Algebra, V 321, N 7 (2009), 1813--1825.","10.1016/j.jalgebra.2008.08.035",,"math.GR",,"  For finite Moufang loops, we prove an analog of the first Sylow theorem
giving a criterion of the existence of a p-Sylow subloop. We also find the
maximal order of p-subloops in the Moufang loops that do not possess p-Sylow
subloops.
","[{""version"":""v1"",""created"":""Mon, 17 Sep 2007 18:49:38 GMT""}]","2009-05-14"
"0709.2697","Eric Braaten","Eric Braaten and Meng Lu","Line Shapes of the X(3872)","24 pages, 7 figures","Phys.Rev.D76:094028,2007","10.1103/PhysRevD.76.094028",,"hep-ph",,"  If the quantum numbers of the X(3872) are J^{PC}=1^{++}, the measurement of
its mass implies that it is either a loosely-bound hadronic molecule whose
constituents are a superposition of the charm mesons pairs D^{*0} Dbar^0 and
D^0 Dbar^{*0} or else it is a virtual state of these charm mesons. Its binding
energy is small enough that the decay width of a constituent D^{*0} or
Dbar^{*0} has a significant effect on the line shapes of the X resonance. We
develop a simple approximation to the line shapes that takes into account the
effect of the D^{*0} width as well as inelastic scattering channels of the
charm mesons. We carry out a simultaneous fit to the line shapes in the J/psi
pi^+ pi^- and D^0 Dbar^0 pi^0 channels measured in the decays B^+ to K^+ + X by
the Belle Collaboration. The best fit corresponds to the X(3872) being a bound
state just below the D^{*0} Dbar^0 threshold, but a virtual state just above
the D^{*0} D-ar^0 threshold is not excluded.
","[{""version"":""v1"",""created"":""Mon, 17 Sep 2007 19:02:50 GMT""}]","2008-11-26"
"0709.2698","Maria A. H. Vozmediano","Alberto Cortijo and Mar\'i A. H. Vozmediano","Minimal conductivity of rippled graphene with topological disorder","12 pages, no figures","Phys. Rev. B 79, 184205 (2009)","10.1103/PhysRevB.79.184205",,"cond-mat.dis-nn cond-mat.other",,"  We study the transport properties of a neutral graphene sheet with curved
regions induced or stabilized by topological defects. The proposed model gives
rise to Dirac fermions in a random magnetic field and in the random space
dependent Fermi velocity induced by the curvature. This last term leads to
singular long range correlated disorder with special characteristics. The Drude
minimal conductivity at zero energy is found to be inversely proportional to
the density of topological disorder, a signature of diffusive behavior.
","[{""version"":""v1"",""created"":""Mon, 17 Sep 2007 18:52:45 GMT""}]","2013-05-29"
"0709.2699","Jorge Piekarewicz","J. Piekarewicz","Validating relativistic models of nuclear structure against theoretical,
  experimental, and observational constraints","14 pages (5 figures and 2 tables included)","Phys.Rev.C76:064310,2007","10.1103/PhysRevC.76.064310",,"nucl-th astro-ph nucl-ex",,"  Relativistic mean-field models of nuclear structure have been enormously
successful at reproducing ground-state properties of finite nuclei throughout
the periodic table using a handful of accurately calibrated parameters. In this
contribution we use powerful theoretical, experimental, and observational
constraints -- not employed in the calibration procedure -- to validate two
such models: NL3 and FSUGold. It is observed that FSUGold is consistent with
all these constraints, except perhaps for a high density equation of state that
appears mildly softer than required by astronomical observations. It is argued
that incorporating such constrains goes a long way in removing much of the
ambiguity left over from the standard calibrating procedure.
","[{""version"":""v1"",""created"":""Mon, 17 Sep 2007 18:57:04 GMT""}]","2008-11-26"
"0709.2700","Karen Vogtmann","Ruth Charney and Karen Vogtmann","Automorphisms of higher-dimensional right-angled Artin groups","9 pages",,,,"math.GR","http://arxiv.org/licenses/nonexclusive-distrib/1.0/","  We study the algebraic structure of the automorphism group of a general
right-angled Artin group. We show that this group is virtually torsion-free and
has finite virtual cohomological dimension. This generalizes results proved by
the authors and John Crisp (arXiv:math/0610980) for two-dimensional
right-angled Artin groups.
","[{""version"":""v1"",""created"":""Mon, 17 Sep 2007 18:57:55 GMT""},{""version"":""v2"",""created"":""Thu, 3 Jul 2008 20:29:32 GMT""}]","2008-07-03"
"0709.2701","Steven Yellin","S. Yellin","Extending the optimum interval method","12 pages, 5 figures",,,,"physics.data-an physics.gen-ph stat.AP",,"  The optimum interval method for finding an upper limit of a one-dimensionally
distributed signal in the presence of an unknown background is extended to the
case of high statistics. There is also some discussion of how the method can be
extended to the multiple dimensional case.
","[{""version"":""v1"",""created"":""Mon, 17 Sep 2007 18:58:30 GMT""}]","2007-09-19"
"0709.2702","Dorin Ervin Dutkay","Dorin Ervin Dutkay and Palle E.T. Jorgensen","Fourier series on fractals: a parallel with wavelet theory","v2, minor correction in section 4",,,,"math.FA math.DS",,"  We study orthogonality relations for Fourier frequencies and complex
exponentials in Hilbert spaces $L^2(\mu)$ with measures $\mu$ arising from
iterated function systems (IFS). This includes equilibrium measures in complex
dynamics. Motivated by applications, we draw parallels between analysis of
fractal measures on the one hand, and the geometry of wavelets on the other.
  We are motivated by spectral theory for commuting partial differential
operators and related duality notions. While stated initially for bounded and
open regions in $\br^d$, they have since found reformulations in the theory of
fractals and wavelets. We include a historical sketch with questions from early
operator theory.
","[{""version"":""v1"",""created"":""Mon, 17 Sep 2007 19:09:12 GMT""},{""version"":""v2"",""created"":""Fri, 28 Sep 2007 17:10:37 GMT""}]","2007-09-28"
"0709.2703","Kevin Ann","Gregg Jaeger, Kevin Ann","Disentanglement and decoherence in a pair of qutrits under dephasing
  noise","9 pages, submitted to J. Mod. Opt. 01/21/07, accepted 08/14/07
  Version 2 corrections: 1) E and D operators in second-to-last paragraph of
  Sec. 2. 2) matrix elements (8,6) and (9,1) in Eq. 6",,"10.1080/09500340701639573",,"quant-ph","http://arxiv.org/licenses/nonexclusive-distrib/1.0/","  We relate disentanglement and decoherence rates in a pair of three-level
atoms subjected to multi-local and collective pure dephasing noise acting in a
preferred basis. The bipartite entanglement decay rate, as bounded from above
by the negativity, is found to be greater than or equal to the
dephasing-decoherence rates characterized by the decay of off-diagonal elements
in the corresponding full density matrix describing the system or the reduced
density matrix describing either qutrit, extending previous results for qubit
pairs subject to such noise.
","[{""version"":""v1"",""created"":""Mon, 17 Sep 2007 19:38:39 GMT""},{""version"":""v2"",""created"":""Wed, 4 Nov 2009 19:00:15 GMT""}]","2017-08-23"
"0709.2704","Igor Shparlinski","Sidney W. Graham and Igor E. Shparlinski","On RSA Moduli with Almost Half of the Bits Prescribed",,,,,"math.NT",,"  We show that using character sum estimates due to H. Iwaniec leads to an
improvement of recent results about the distribution and finding RSA moduli
$M=pl$, where $p$ and $l$ are primes, with prescribed bit patterns. We are now
able to specify about $n$ bits instead of about $n/2$ bits as in the previous
work. We also show that the same result of H. Iwaniec can be used to obtain an
unconditional version of a combinatorial result of W. de Launey and D. Gordon
that was originally derived under the Extended Riemann Hypothesis.
","[{""version"":""v1"",""created"":""Mon, 17 Sep 2007 19:27:14 GMT""}]","2007-09-18"
"0709.2705","Michael Robinson","Michael Robinson","Classification of connecting solutions of semilinear parabolic equations",,,,,"math.AP",,"  For a given semilinear parabolic equation with polynomial nonlinearity, many
solutions blow up in finite time. For a certain large class of these equations,
we show that some of the solutions which do not blow up actually tend to
equilibria. The characterizing property of such solutions is a finite energy
constraint, which comes about from the fact that this class of equations can be
written as the $L^2$ gradient of a certain functional.
","[{""version"":""v1"",""created"":""Mon, 17 Sep 2007 19:39:15 GMT""}]","2007-09-18"
"0709.2706","Sheldon Stone","Sheldon Stone","B(Ds^+ -> l^+ nu) and the Decay Constant f_(D_s^+)","Presented at ""The 2007 Europhysics Conference on High Energy
  Physics,"" Manchester, England, 19-25 July 2007, to appear in the proceedings.
  Three pages, 1 figure",,"10.1088/1742-6596/110/5/052051",,"hep-ex hep-lat hep-ph",,"  I report final CLEO-c results on the purely leptonic decays of the D_s^+ ->
l^+ nu, for the cases when l^+ is a mu^+ or tau^+, when it decays into pi^+
anti-nu, using 314/pb of data at 4.170 GeV. I also include preliminary results
from the tau^+ -> e^+ nu anti-nu channel using 195/pb. Combining both we
measure f_{D_s}= 275 +/- 10 +/- 5 MeV, and f_{D_s^+}/{f_{D^+}=1.24 +/- 0.10 =/-
0.03 .
","[{""version"":""v1"",""created"":""Mon, 17 Sep 2007 23:21:56 GMT""},{""version"":""v2"",""created"":""Wed, 19 Sep 2007 15:11:26 GMT""},{""version"":""v3"",""created"":""Tue, 20 Nov 2007 15:36:31 GMT""}]","2009-11-13"
"0709.2707","Lukasz Cywinski","L. Cywinski, H. Dery, P. Dalal, L.J. Sham","Electrical expression of spin accumulation in ferromagnet/semiconductor
  structures","A review to appear in Mod. Phys. Lett. B","Mod. Phys. Lett. B 21, 1509 (2007)","10.1142/S021798490701395X",,"cond-mat.mtrl-sci cond-mat.mes-hall",,"  We treat the spin injection and extraction via a ferromagnetic
metal/semiconductor Schottky barrier as a quantum scattering problem. This
enables the theory to explain a number of phenomena involving spin-dependent
current through the Schottky barrier, especially the counter-intuitive spin
polarization direction in the semiconductor due to current extraction seen in
recent experiments. A possible explanation of this phenomenon involves taking
into account the spin-dependent inelastic scattering via the bound states in
the interface region. The quantum-mechanical treatment of spin transport
through the interface is coupled with the semiclassical description of
transport in the adjoining media, in which we take into account the in-plane
spin diffusion along the interface in the planar geometry used in experiments.
The theory forms the basis of the calculation of spin-dependent current flow in
multi-terminal systems, consisting of a semiconductor channel with many
ferromagnetic contacts attached, in which the spin accumulation created by spin
injection/extraction can be efficiently sensed by electrical means. A
three-terminal system can be used as a magnetic memory cell with the bit of
information encoded in the magnetization of one of the contacts. Using five
terminals we construct a reprogrammable logic gate, in which the logic inputs
and the functionality are encoded in magnetizations of the four terminals,
while the current out of the fifth one gives a result of the operation.
","[{""version"":""v1"",""created"":""Mon, 17 Sep 2007 23:24:47 GMT""}]","2008-02-20"
"0709.2708","Martin Snoager Sloth","Philip R. Jarnhus and Martin S. Sloth","de Sitter limit of inflation and nonlinear perturbation theory","14 pages, 1 figure; typos corrected and discussion of tensor modes
  added","JCAP 0802:013,2008","10.1088/1475-7516/2008/02/013",,"hep-th astro-ph gr-qc",,"  We study the fourth order action of the comoving curvature perturbation in an
inflationary universe in order to understand more systematically the de Sitter
limit in nonlinear cosmological perturbation theory. We derive the action of
the curvature perturbation to fourth order in the comoving gauge, and show that
it vanishes sufficiently fast in the de Sitter limit. By studying the de Sitter
limit, we then extrapolate to the n'th order action of the comoving curvature
perturbation and discuss the slow-roll order of the n-point correlation
function.
","[{""version"":""v1"",""created"":""Mon, 17 Sep 2007 20:56:32 GMT""},{""version"":""v2"",""created"":""Wed, 5 Dec 2007 15:04:42 GMT""}]","2009-06-11"
"0709.2710","Hajime Tsuji","Hajime Tsuji","Extension of log pluricanonical forms from subvarieties","numerous typos corrected, minor change of the statements",,,,"math.AG math.CV",,"  In this paper, I prove a very general extension theorem for log
pluricanonical systems. The main application of this extension theorem is
(together with Kawamata's subadjunction theorem) to give an optimal
subadjunction theorem which relates the positivities of canonical bundle of the
ambient projective manifold and that of the (maximal) center of log canonical
singularities. This is an extension of the corresponding result in my previous
work where I dealt with log pluricanonical systems of general type. This
subadjunction theorem indicates an approach to solve the abundance conjecture
for canonical divisors (or log canonical divisors) in terms of the induction in
dimension.
","[{""version"":""v1"",""created"":""Mon, 17 Sep 2007 20:00:29 GMT""},{""version"":""v2"",""created"":""Mon, 5 Nov 2007 12:34:16 GMT""}]","2007-11-05"
"0709.2711","Alberto Buzzoni","A. Buzzoni (1), E. Bertone (2), M. Chavez (2), L. H. Rodriguez-Merino
  (2) ((1) INAF - Osservatorio Astr. di Bologna, Italy, (2) INAOE Puebla,
  Mexico)","Population synthesis at short wavelengths and spectrophotometric
  diagnostic tools for galaxy evolution","Invited contribution to ""New quests in stellar astrophysics. II:
  Ultraviolet properties of evolved stellar populations"" (Puerto Vallarta,
  Mexico, Apr 2007), eds. M. Chavez et al. - More info on the UVBLUE spectral
  library at http://www.bo.astro.it/~eps/home.html",,,,"astro-ph",,"  Taking advantage of recent important advances in the calculation of
high-resolution spectral grids of stellar atmospheres at short wavelengths, and
their implementation for population synthesis models, we briefly review here
some special properties of ultraviolet emission in SSPs, and discuss their
potential applications for identifying and tuning up effective diagnostic tools
to probe distinctive evolutionary properties of early-type galaxies and other
evolved stellar systems.
","[{""version"":""v1"",""created"":""Mon, 17 Sep 2007 20:01:15 GMT""}]","2007-09-19"
"0709.2712","Steen Hannestad","Alessandro Cuoco, Steen Hannestad, Troels Haugboelle, Michael
  Kachelriess, Pasquale D. Serpico","Clustering properties of ultrahigh energy cosmic rays and the search for
  their astrophysical sources","11 pages, 8 figures, 4 tables; minor changes, matches published
  version","Astrophys.J.676:807-815,2008","10.1086/526493","FERMILAB-PUB-07-467-A","astro-ph hep-ph",,"  The arrival directions of ultrahigh energy cosmic rays (UHECRs) may show
anisotropies on all scales, from just above the experimental angular resolution
up to medium scales and dipole anisotropies. We find that a global comparison
of the two-point auto-correlation function of the data with the one of
catalogues of potential sources is a powerful diagnostic tool. In particular,
this method is far less sensitive to unknown deflections in magnetic fields
than cross-correlation studies while keeping a strong discrimination power
among source candidates. We illustrate these advantages by considering ordinary
galaxies, gamma ray bursts and active galactic nuclei as possible sources.
Already the sparse publicly available data suggest that the sources of UHECRs
may be a strongly clustered sub-sample of galaxies or of active galactic
nuclei. We present forecasts for various cases of source distributions which
can be checked soon by the Pierre Auger Observatory.
","[{""version"":""v1"",""created"":""Tue, 18 Sep 2007 13:46:06 GMT""},{""version"":""v2"",""created"":""Mon, 21 Apr 2008 15:11:49 GMT""}]","2010-11-11"
"0709.2713","Michael T. Lacey","Dmitriy Bilyk, Michael T Lacey, Armen Vagharshakyan","On the Signed Small Ball Inequality","10 pages",,,,"math.CA",,"  This paper is a companion to our prior paper arXiv:0705.4619 on the `Small
Ball Inequality in All Dimensions.' In it, we address a more restrictive
inequality, and obtain a non-trivial, explicit bound, using a single essential
estimate from our prior paper. The prior bound was not explicit and much more
involved.
","[{""version"":""v1"",""created"":""Mon, 17 Sep 2007 20:11:46 GMT""}]","2007-09-19"
"0709.2714","Masayuki Akiyama","M.Akiyama, Y.Minowa, N.Kobayashi, K.Ohta, M.Ando, I.Iwata","Adaptive Optics Rest-Frame V-band Imaging of Lyman Break Galaxies at
  z~3: High-surface Density Disk-like Galaxies ?","Accepted for publication in Astrophysical Journal Supplement. 38
  pages, 26 postscript figures. Original version with high resolution figures
  is available from http://www.naoj.org/staff/akiyama/papers/LBG_AO.pdf",,"10.1086/523670",,"astro-ph",,"  In order to reveal the rest-frame V-band morphology of galaxies at z~3, we
conducted AO-assisted K-band imaging observations of z~3 LBGs with Mv*-0.5 to
Mv*+3.0 mag. LBGs brighter than Mv* have larger rHL (0.40"") than the fainter
LBGs (0.23"") on average, and there is no bright LBGs with a small rHL. The LBGs
brighter than Mv* have red rest-frame U-V colors (average of 0.2 mag) and most
of the fainter LBGs show blue rest-frame U-V colors (average of -0.4 mag). The
K-band peaks of some of the LBGs brighter than K=22.0 mag show significant
shift from those in the optical images. The images of all but one of the LBGs
with K<21.5 mag are fitted well with Sersic profile with n index less than 2,
similar to disk galaxies in the local universe. Assuming that the LBGs have a
disk-shape, we compared their size-luminosity and size-stellar mass relation
with those of z=0 and z=1 disk galaxies. The LBGs are brighter than z=0 and z=1
disk galaxies at the same effective radius. The rest-frame V-band surface
brightness of the LBGs are 2.2-2.9 mag and 1.2-1.9 mag brighter than the disk
galaxies at z=0 and z=1, respectively. The size-stellar mass relation of the
LBGs shows that the effective radii of the LBGs do not depend on their stellar
mass. For the LBGs brighter than Mv*, the average surface stellar mass density
is 3-6 times larger than those of the z=0 and z=1 disk galaxies. We also
examine the profiles of the serendipitously observed DRGs. They are also fitted
with the Sersic profiles with n<2. The implications of the dominance of n<2
population among galaxies at z~3 and the presence of the high surface stellar
mass density disk systems are discussed.
","[{""version"":""v1"",""created"":""Mon, 17 Sep 2007 20:05:06 GMT""}]","2009-11-13"
"0709.2715","Christian Flacco","The BaBar Collaboration: B. Aubert, et al","Search for CP Violation in the Decays D0 --> K- K+ and D0 --> pi- pi+","7 pages, 3 postscript figures, submitted to Phys. Rev. Lett","Phys.Rev.Lett.100:061803,2008","10.1103/PhysRevLett.100.061803","BABAR-PUB-07/058, SLAC-PUB-12756","hep-ex",,"  We measure CP-violating asymmetries of neutral charmed mesons in the modes D0
--> K- K+ and D0 --> pi- pi+ with the highest precision to date by using D0 -->
K- pi+ decays to correct detector asymmetries. An analysis of 385.8 fb-1 of
data collected with the BaBar detector yields values of aCP(KK) = (0.00 +/-
0.34 (stat.) +/- 0.13 (syst.))% and aCP(pipi) = (-0.24 +/- 0.52 (stat.) +/-
0.22 (syst.))%, which agree with Standard Model predictions.
","[{""version"":""v1"",""created"":""Mon, 17 Sep 2007 20:18:17 GMT""}]","2010-04-12"
"0709.2716","Jan van Ruitenbeek","W.H.A. Thijssen, M. Strange, J.M.J. aan de Brugh, J.M. van Ruitenbeek","Formation and properties of metal-oxygen atomic chains","10 pages, 9 figs","New J. Phys. 10, 033005 (2008)","10.1088/1367-2630/10/3/033005",,"cond-mat.mes-hall cond-mat.mtrl-sci",,"  Suspended chains consisting of single noble metal and oxygen atoms have been
formed. We provide evidence that oxygen can react with and be incorporated into
metallic one-dimensional atomic chains. Oxygen incorporation reinforces the
linear bonds in the chain, which facilitates the creation of longer atomic
chains. The mechanical and electrical properties of these diatomic chains have
been investigated by determining local vibration modes of the chain and by
measuring the dependence of the average chain-conductance on the length of the
chain. Additionally, we have performed calculations that give insight in the
physical mechanism of the oxygen-induced strengthening of the linear bonds and
the conductance of the metal-oxygen chains.
","[{""version"":""v1"",""created"":""Mon, 17 Sep 2007 20:19:28 GMT""}]","2017-12-11"
"0709.2718","Margrethe Wold","M. Wold (1), M. S. Brotherton (2), Z. Shang (2) ((1) Institute of
  Theoretical Astrophysics, University of Oslo, (2) Department of Physics and
  Astronomy, University of Wyoming)","Quasar optical variability and black hole mass","To be published in the proceedings of ""The nuclear region, host
  galaxy and environment of active galaxies"", 60th birthday symposium of
  Deborah Dultzin-Hacyan, Huatulco, April 18-20, 2007, eds. E. Benitez, I.
  Cruz-Gonzalez, Y. Krongold",,,,"astro-ph",,"  In order to investigate the dependence of quasar optical-UV variability on
fundamental physical parameters like black hole mass, we have matched quasars
from the QUEST1 variability survey with broad-lined objects from the SDSS.
Black hole masses and bolometric luminosities are estimated from Sloan spectra,
and variability amplitudes from the QUEST1 light curves. Long-term variability
amplitudes (rest-frame time scales 0.5--2 yrs) are found to correlate with
black hole mass at the 99% significance level or better. This means that
quasars with larger black hole masses have larger percentage flux variations.
Partial rank correlation analysis shows that the correlation cannot explained
by obvious selection effects inherent to flux-limited samples. We discuss
whether the correlation is a manifestation of a relation between BH mass and
accretion disk thermal time scales, or if it is due to changes in the optical
depth of the accretion disk with black hole mass. Perhaps the most likely
explanation is that the more massive black holes are starving, and produce
larger flux variations because they do not have a steady inflow of gaseous
fuel.
","[{""version"":""v1"",""created"":""Mon, 17 Sep 2007 20:25:01 GMT""}]","2007-09-19"
