"0709.2743","Hyung Won Lee","Kyoung Yee Kim, Hyung Won Lee and Yun Soo Myung","Instability of agegraphic dark energy models","15 pages 4 figures","Phys.Lett.B660:118-124,2008","10.1016/j.physletb.2007.12.045","INJE-TP-07-09","gr-qc",,"  We investigate the agegraphic dark energy models which were recently proposed
to explain the dark energy-dominated universe. For this purpose, we calculate
their equation of states and squared speeds of sound. We find that the squared
speed for agegraphic dark energy is always negative. This means that the
perfect fluid for agegraphic dark energy is classically unstable. Furthermore,
it is shown that the new agegraphic dark energy model could describe the matter
(radiation)-dominated universe in the far past only when the parameter $n$ is
chosen to be $n>n_c$, where the critical values are determined to be
$n_c=2.6878(2.5137752)$ numerically. It seems that the new agegraphic dark
energy model is no better than the holographic dark energy model for the
description of the dark energy-dominated universe, even though it resolves the
causality problem.
","[{""version"":""v1"",""created"":""Tue, 18 Sep 2007 03:14:56 GMT""}]","2008-11-26"
"0709.2744","Pengfei Lan","Pengfei Lan, Peixiang Lu, Wei Cao, Xinlin Wang","Efficient generation of an isolated single-cycle attosecond pulse","5 pages, 4 figures",,"10.1103/PhysRevA.76.043808",,"physics.atom-ph physics.optics",,"  A new method for efficiently generating an isolated single-cycle attosecond
pulse is proposed. It is shown that the ultraviolet (UV) attosecond pulse can
be utilized as a robust tool to control the dynamics of electron wave packets
(EWPs). By adding a UV attosecond pulse to an infrared (IR) few-cycle pulse at
a proper time, only one return of the EWP to the parent ion is selected to
effectively contribute to the harmonics, then an isolated two-cycle 130-as
pulse with a bandwidth of 45 eV is obtained. After complementing the chirp, an
isolated single-cycle attosecond pulse with a duration less than 100 as seems
achievable. In addition, the contribution of the quantum trajectories can be
selected by adjusting the delay between the IR and UV fields. Using this
method, the harmonic and attosecond pulse yields are efficiently enhanced in
contrast to the scheme [G. Sansone {\it et al.}, Science {\bf314}, 443 (2006)]
using a few-cycle IR pulse in combination with the polarization gating
technique.
","[{""version"":""v1"",""created"":""Tue, 18 Sep 2007 02:18:05 GMT""}]","2009-11-13"
"0709.2745","Tong-Jie Zhang Dr.","Yongping Zhang (1), Ze-Long Yi (2), Tong-Jie Zhang (2,3), Wenbiao Liu
  (1)((1)Department of Physics, Institute of Theoretical Physics, Beijing
  Normal University,(2)Department of Astronomy, Beijing Normal
  University,(3)Kavli Institute for Theoretical Physics China, Institute of
  Theoretical Physics, Chinese Academy of Sciences)","Thermodynamical properties of dark energy with the equation of state $%
  \omega =\omega_{0}+\omega_{1}z$","6 pages, 5 figures, Accepted for publication in Physical Review D","Phys.Rev.D77:023502,2008","10.1103/PhysRevD.77.023502",,"astro-ph",,"  The thermodynamical properties of dark energy are usually investigated with
the equation of state $\omega =\omega_{0}+\omega_{1}z$. Recent observations
show that our universe is accelerating, and the apparent horizon and the event
horizon vary with redshift $z$. When definitions of the temperature and entropy
of a black hole are used to the two horizons of the universe, we examine the
thermodynamical properties of the universe which is enveloped by the apparent
horizon and the event horizon respectively. We show that the first and the
second laws of thermodynamics inside the apparent horizon in any redshift are
satisfied, while they are broken down inside the event horizon in some
redshift. Therefore, the apparent horizon for the universe may be the boundary
of thermodynamical equilibrium for the universe like the event horizon for a
black hole.
","[{""version"":""v1"",""created"":""Tue, 18 Sep 2007 02:24:33 GMT""},{""version"":""v2"",""created"":""Tue, 30 Oct 2007 06:57:59 GMT""}]","2008-11-26"
"0709.2746","Phillip C. Stancil","B. C. Shepler, B. H. Yang, T. J. Dhilip Kumar, P. C. Stancil, J. M.
  Bowman, N. Balakrishnan, P. Zhang, E. Bodo, and A. Dalgarno","Low energy H+CO scattering revisited: CO rotational excitation with new
  potential surfaces","3 figures",,"10.1051/0004-6361:20078693",,"astro-ph",,"  A recent modeling study of brightness ratios for CO rotational transitions in
gas typical of the diffuse ISM by Liszt found the role of H collisions to be
more important than previously assumed. This conclusion was based on quantum
scattering calculations using the so-called WKS potential energy surface (PES)
which reported a large cross section for the important 0->1 rotational
transition. New close-coupling (CC) rigid-rotor calculations for CO(v=0,J=0)
excitation by H are performed on four different PESs. Two of the PESs are
obtained in this work using state-of-the-art quantum chemistry techniques at
the CCSD(T) and MRCI levels of theory. Cross sections for the J=0->1, as well
as other odd Delta J, transitions are significantly suppressed compared to even
Delta J transitions in thermal energy CC calculations using the CCSD(T) and
MRCI surfaces. This is consistent with a expected even Delta J propensity and
in contrast to CC calculations using the earlier WKS PES which predict a
dominating 0->1 transition. The current results suggest that the original
astrophysical assumption that excitation of CO by H_2 dominates the kinetics of
CO in diffuse ISM gas is likely to remain valid.
","[{""version"":""v1"",""created"":""Tue, 18 Sep 2007 02:31:50 GMT""}]","2009-11-13"
"0709.2747","Guang-Ri Jin Dr.","Guang-Ri Jin and Sang Wook Kim","Spin squeezing and maximal-squeezing time","7 pages, 5 figures, 1 table. Resubmitted to Phys. Rev. A","Phys. Rev. A76, 043621(2007)","10.1103/PhysRevA.76.043621",,"quant-ph cond-mat.other",,"  Spin squeezing of a nonlinear interaction model with Josephson-like coupling
is studied to obtain time scale of maximal squeezing. Based upon two exactly
solvable cases for two and three particles, we find that the maximal-squeezing
time depends on the level spacing between the ground state and its next
neighbor eigenstate.
","[{""version"":""v1"",""created"":""Tue, 18 Sep 2007 02:35:47 GMT""}]","2011-11-10"
"0709.2748","Haifeng Wang","Haifeng Wang, L. P. Shi, B. S. Luk`yanchuk, C. J. R. Sheppard, T.C.
  Chong, G. Q. Yuan","Super-resolution and non-diffraction longitudinal polarized beam","submitted to PRL",,,,"physics.pop-ph physics.optics",,"  A method is presented for generation of a subwavelength (0.43 lambda)
longitudinally polarized beam, which propagates without divergence over lengths
of about 4 lambda in free space. This is achieved by controlling the amplitude,
phase and polarization property of the Bessel-Gaussian field on the aperture of
a high numerical aperture focusing lens.
","[{""version"":""v1"",""created"":""Tue, 18 Sep 2007 02:50:44 GMT""}]","2007-09-19"
"0709.2749","Kali Prasanna Nayak","K. P. Nayak and K. Hakuta","Single Atoms on an Optical Nanofiber","4 pages, 5 figures",,"10.1088/1367-2630/10/5/053003",,"quant-ph",,"  We show that single-atoms can be trapped on the surface of a
subwavelength-diameter silica-fiber, an optical nanofiber, without any external
field, and that single photons spontaneously emitted from the atoms can be
readily detected through the single guided-mode of the nanofiber. A key point
of the work is our finding that atom trapping sites are created on the
nanofiber surface by irradiating the atom cloud around the nanofiber with a
violet laser radiation.
","[{""version"":""v1"",""created"":""Tue, 18 Sep 2007 03:18:09 GMT""}]","2009-11-13"
"0709.2750","Archil Kobakhidze","Robert Foot, Archil Kobakhidze, Kristian L. McDonald and Raymond R.
  Volkas","A solution to the hierarchy problem from an almost decoupled hidden
  sector within a classically scale invariant theory","10 pages","Phys.Rev.D77:035006,2008","10.1103/PhysRevD.77.035006",,"hep-ph hep-th",,"  If scale invariance is a classical symmetry then both the Planck scale and
the weak scale should emerge as quantum effects. We show that this can be
realized in simple scale invariant theories with a hidden sector. The
weak/Planck scale hierarchy emerges in the (technically natural) limit where
the hidden sector decouples from the ordinary sector. The weak scale is
protected from quadratic divergences because of classical scale invariance, so
there is no hierarchy problem.
","[{""version"":""v1"",""created"":""Tue, 18 Sep 2007 03:27:28 GMT""},{""version"":""v2"",""created"":""Wed, 5 Dec 2007 02:45:13 GMT""}]","2008-11-26"
"0709.2751","Terry Mart","A. Sulaksono, T. Mart, T.J. Buervenich, J.A. Maruhn","Instabilities of relativistic mean field models and the role of
  nonlinear terms","11 pages, 5 figures, accepted in Phys. Rev. C, typos corrected","Phys.Rev.C76:041301,2007","10.1103/PhysRevC.76.041301",,"nucl-th astro-ph hep-ph",,"  The instability of nuclear matter due to particle-hole excitation modes has
been studied in the frame-work of several relativistic mean field (RMF) models.
It is found that both the longitudinal and the transversal modes depend
sensitively on the parameter sets used. The important impact of the vector and
vector-scalar nonlinear terms on the stability of both modes is demonstrated.
Our finding corroborates the result of previous studies, namely that certain
RMF models cannot be used in high density applications. However, we show that
for certain parameter sets of RMF models this shortcoming can be alleviated by
adding these nonlinear terms.
","[{""version"":""v1"",""created"":""Tue, 18 Sep 2007 03:35:53 GMT""},{""version"":""v2"",""created"":""Tue, 6 Nov 2007 02:34:33 GMT""}]","2008-11-26"
"0709.2752","Juli\'an Candia","Paul E. Parris, Juli\'an Candia, V.M. Kenkre","Random Walk Access Times on Partially-Disordered Complex Networks: an
  Effective Medium Theory","12 pages, 8 figures; added new results and discussion; added appendix
  on numerical procedures. To appear in PRE","Phys. Rev. E 77, 061113 (2008)","10.1103/PhysRevE.77.061113",,"cond-mat.dis-nn cond-mat.stat-mech",,"  An analytic effective medium theory is constructed to study the mean access
times for random walks on hybrid disordered structures formed by embedding
complex networks into regular lattices, considering transition rates $F$ that
are different for steps across lattice bonds from the rates $f$ across network
shortcuts. The theory is developed for structures with arbitrary shortcut
distributions and applied to a class of partially-disordered traversal enhanced
networks in which shortcuts of fixed length are distributed randomly with
finite probability. Numerical simulations are found to be in excellent
agreement with predictions of the effective medium theory on all aspects
addressed by the latter. Access times for random walks on these partially
disordered structures are compared to those on small-world networks, which on
average appear to provide the most effective means of decreasing access times
uniformly across the network.
","[{""version"":""v1"",""created"":""Tue, 18 Sep 2007 04:03:47 GMT""},{""version"":""v2"",""created"":""Wed, 30 Apr 2008 15:04:11 GMT""}]","2009-11-13"
"0709.2753","Sacha E. Kopp","M. Bai (1), R. Calaga (1), W. Fischer (1), P. Oddo (1), H. Schmickler
  (2), J. Serrano (2), A. Jansson (3), M. Syphers (3), S. Kopp (4), R. Miyamoto
  (4) ((1) BNL, (2) CERN, (3) FNAL, (4) University of Texas at Austin)","Considerations for an Ac Dipole for the LHC","proceedings of the 2007 Particle Accelerator Conference",,,,"physics.acc-ph",,"  Following successful experience at the BNL AGS, FNAL Tevatron, and CERN SPS,
an AC Dipole will be adopted at the LHC for rapid measurements of ring optics.
This paper describes some of the parameters of the AC dipole for the LHC,
scaling from performance of the FNAL and BNL devices.
","[{""version"":""v1"",""created"":""Tue, 18 Sep 2007 04:25:29 GMT""}]","2007-09-19"
"0709.2754","Soumitra SenGupta","Tanwi Ghosh and Soumitra SenGupta","Slowly Rotating Dilaton Black hole In Anti-de Sitter Spacetime","5 pages, Revtex, To appear in Phys.Rev.D","Phys.Rev.D76:087504,2007","10.1103/PhysRevD.76.087504",,"hep-th gr-qc",,"  Rotating dilaton black hole solution for asymptotically anti-de Sitter
spacetime are obtained in the small angular momentum limit with an appropriate
combination of three Liouville-type dilaton potentials. The angular momentum,
magnetic dipole moment and the gyromagnetic ratio of such a black hole are
determined for arbitrary values of the dilaton-electromagnetic coupling
parameter.
","[{""version"":""v1"",""created"":""Tue, 18 Sep 2007 04:26:34 GMT""}]","2008-11-26"
"0709.2755","Yuri A. Rylov","Yuri A. Rylov","Different representations of Euclidean geometry and their application to
  the space-time geometry","17 pages, 0 figures, some additions",,,,"math.GM","http://arxiv.org/licenses/nonexclusive-distrib/1.0/","  Three different representation of the proper Euclidean geometry are
considered. They differ in the number of basic elements, from which the
geometrical objects are constructed. In E-representation there are three basic
elements (point, segment, angle) and no additional structures. V-representation
contains two basic elements (point, vector) and additional structure: linear
vector space. In sigma-representation there is only one basic element and
additional structure: world function \sigma =\rho^{2}/2, where \rho is the
distance. The concept of distance appears in all representations. However, as a
structure, determining the geometry, the distance appears only in the
sigma-representation. The sigma-representation is most appropriate for
modification of the proper Euclidean geometry. Practically any modification of
the proper Euclidean geometry turns it into multivariant geometry, where there
are many vectors Q_0Q_1, Q_0Q_1^{\prime},..., which are equal to the vector
P_0P_1, but they are not equal between themselves, in general. Concept of
multivariance is very important in application to the space-time geometry. The
real space-time geometry is multivariant. Multivariance of the space-time
geometry is responsible for quantum effects.
","[{""version"":""v1"",""created"":""Tue, 18 Sep 2007 04:47:33 GMT""},{""version"":""v2"",""created"":""Mon, 24 Sep 2007 13:26:53 GMT""},{""version"":""v3"",""created"":""Fri, 20 Jun 2008 09:22:32 GMT""},{""version"":""v4"",""created"":""Wed, 2 Mar 2011 07:56:49 GMT""}]","2011-03-03"
"0709.2756","Laurent Vila","Laurent Vila (1), Takashi Kimura (1 and 2), YoshiChika Otani (1 and 2)
  ((1) Institute for Solid State Physics, University of Tokyo, Japan, (2)
  Frontier Research System, RIKEN, Japan)","Evolution of the spin Hall effect in Pt nanowires: Size and temperature
  effects","4 pages, 4 figures",,"10.1103/PhysRevLett.99.226604",,"cond-mat.mtrl-sci cond-mat.mes-hall",,"  We have studied the evolution of the Spin Hall Effect in the regime where the
material size responsible for the spin accumulation is either smaller or larger
than the spin diffusion length. Lateral spin valve structures with Pt
insertions were successfully used to measure the spin absorption efficiency as
well as the spin accumulation in Pt induced through the spin Hall effect. Under
a constant applied current the results show a decrease of the spin accumulation
signal is more pronounced as the Pt thickness exceeds the spin diffusion
length. This implies that the spin accumulation originates from bulk scattering
inside the Pt wire and the spin diffusion length limits the SHE. We have also
analyzed the temperature variation of the spin hall conductivity to identify
the dominant scattering mechanism.
","[{""version"":""v1"",""created"":""Tue, 18 Sep 2007 05:01:27 GMT""}]","2009-11-13"
"0709.2757","Marco Cozzini","Gentaro Watanabe, Marco Cozzini, and Sandro Stringari","Tkachenko modes in a superfluid Fermi gas at unitarity","5 pages, 1 figure; minor changes, now published as Phys. Rev. A 77,
  021602(R) (2008)","Phys. Rev. A 77, 021602(R) (2008)","10.1103/PhysRevA.77.021602",,"cond-mat.other cond-mat.supr-con",,"  We calculate the frequencies of the Tkachenko oscillations of a vortex
lattice in a harmonically trapped superfluid Fermi gas. We use the
elasto-hydrodynamic theory by properly accounting for the elastic constants,
the Thomas-Fermi density profile of the atomic cloud, and the boundary
conditions. Thanks to the Fermi pressure, which is responsible for larger cloud
radii with respect to the case of dilute Bose-Einstein condensed gases, large
vortex lattices are achievable in the unitary limit of infinite scattering
length, even at relatively small angular velocities. This opens the possibility
of experimentally observing vortex oscillations in the regime where the
dispersion relation approaches the Tkachenko law for incompressible fluids and
the mode frequency is almost comparable to the trapping frequencies.
","[{""version"":""v1"",""created"":""Tue, 18 Sep 2007 15:44:52 GMT""},{""version"":""v2"",""created"":""Fri, 15 Feb 2008 13:05:03 GMT""}]","2009-07-01"
"0709.2758","Erasmo Recami","Erasmo Recami","Einstein e il Rinnovamento delle Scienze (Einstein and the Renewal of
  Science)","9 pages [pdf produced from a source-file in html]. This paper was
  originally presented as an invited talk at the conference ""Il centenario di
  Eisntein"" organized by the Nobel Foundation c/o its Italian headquarters at
  Sanremo, IM (1978); but it has been recently (in 2002) reprinted by D.I.E.A.,
  University of Bologna, Bologna, Italy","Civilta' delle Macchine [Rome] 26 (1979), issue no. 3-6, pages
  109-112; reprinted (2002) by ""Centro DIEA"", Fac. of Eng., Univ. of Bologna,
  Bologna, Italy",,,"physics.hist-ph physics.pop-ph",,"  As it is well-known, the year 2005 has been the centenary of the ""annus
mirabilis"" (1905) during which Albert Einstein published four fundamental
papers of his. But already in 1979, for the centenary of Einstein's birth, the
world celebrated his monumantal work. In Italy too, there appeared scientific
books, and many semi-popularization (or popularization) articles. The present
paper represents a talk delivered in Italian, at the invitation of the Nobel
Foundation (Sanremo, IM; Italy), in time for its publication in 1979. This
article has been however reprinted, much more recently, in 2002, by the ""Centro
DIEA"", Faculty of Engineering, University of Bologna, Bologna, Italy [and its
source-file, in html, has been prepared with DIEA's collaboration]. We present
here a description of the human, philosophycal and scientific background,
starting from which Einstein produced his amazing results: Indeed, we try to
show why Einstein's writings today are still so important not only for pure
physics (and technology!), but also for our epistemological understanding of
the procedures followed by science, and by our own mind, in their development,
as well as for our philosophical views about the world we live in; without
forgetting the teachings that come (or should come) from Einstein's life and
claims for modern pedagogy.
","[{""version"":""v1"",""created"":""Tue, 18 Sep 2007 05:45:30 GMT""}]","2007-09-19"
"0709.2759","Satoru Akiyama","Satoru Akiyama and Masahiro Kawabata","Stability of the rotating SU(3) Skyrmion","29 pages, 9 figures, references added, typos fixed","Phys.Rev.D76:096002,2007","10.1103/PhysRevD.76.096002",,"hep-ph",,"  The profile functions of the SU(3) Skyrme soliton are investigated for the
octet, decuplet, and antidecuplet baryons by the mean field approach. In this
approach, the profile functions are affected by the spatial rotation, the
flavor rotation, and the flavor symmetry breaking. The solitons are stable only
in the restricted areas of the parameter space for each multiplet. When the
flavor symmetry breaking is large, the area for the antidecuplet is narrow
compared to those for the octet and decuplet. The parameters are determined by
the baryon mass spectrum, and the deformation of the soliton has sizable
effects on the masses.
","[{""version"":""v1"",""created"":""Tue, 18 Sep 2007 07:59:00 GMT""},{""version"":""v2"",""created"":""Tue, 13 Nov 2007 01:52:15 GMT""}]","2008-11-26"
"0709.2760","Chien-Yu Chen","Yen-Jen Oyang, Darby Tien-Hao Chang, Yu-Yen Ou, Hao-Geng Hung,
  Chih-Peng Wu and Chien-Yu Chen","Supervised Machine Learning with a Novel Kernel Density Estimator","The new version includes an additional theorem, Theorem 3",,,,"stat.ML",,"  In recent years, kernel density estimation has been exploited by computer
scientists to model machine learning problems. The kernel density estimation
based approaches are of interest due to the low time complexity of either O(n)
or O(n*log(n)) for constructing a classifier, where n is the number of sampling
instances. Concerning design of kernel density estimators, one essential issue
is how fast the pointwise mean square error (MSE) and/or the integrated mean
square error (IMSE) diminish as the number of sampling instances increases. In
this article, it is shown that with the proposed kernel function it is feasible
to make the pointwise MSE of the density estimator converge at O(n^-2/3)
regardless of the dimension of the vector space, provided that the probability
density function at the point of interest meets certain conditions.
","[{""version"":""v1"",""created"":""Tue, 18 Sep 2007 06:45:30 GMT""},{""version"":""v2"",""created"":""Fri, 21 Sep 2007 15:07:27 GMT""},{""version"":""v3"",""created"":""Tue, 16 Oct 2007 15:30:16 GMT""}]","2007-10-16"
"0709.2761","Rudy Raymond","Kazuo Iwama, Harumichi Nishimura, Rudy Raymond and Shigeru Yamashita","Unbounded-Error Classical and Quantum Communication Complexity","11 pages. To appear at Proc. ISAAC 2007","Proceedings of 18th International Symposium on Algorithms and
  Computation (ISAAC2007), Lecture Notes in Computer Science 4835, pp.100-111,
  2007","10.1007/978-3-540-77120-3_11",,"quant-ph",,"  Since the seminal work of Paturi and Simon \cite[FOCS'84 & JCSS'86]{PS86},
the unbounded-error classical communication complexity of a Boolean function
has been studied based on the arrangement of points and hyperplanes. Recently,
\cite[ICALP'07]{INRY07} found that the unbounded-error {\em quantum}
communication complexity in the {\em one-way communication} model can also be
investigated using the arrangement, and showed that it is exactly (without a
difference of even one qubit) half of the classical one-way communication
complexity. In this paper, we extend the arrangement argument to the {\em
two-way} and {\em simultaneous message passing} (SMP) models. As a result, we
show similarly tight bounds of the unbounded-error two-way/one-way/SMP
quantum/classical communication complexities for {\em any} partial/total
Boolean function, implying that all of them are equivalent up to a
multiplicative constant of four. Moreover, the arrangement argument is also
used to show that the gap between {\em weakly} unbounded-error quantum and
classical communication complexities is at most a factor of three.
","[{""version"":""v1"",""created"":""Tue, 18 Sep 2007 06:46:58 GMT""}]","2016-05-24"
"0709.2762","Sylvain Hanneton","B. Durette (GIPSA-lab, LPN), L. Gamond (GIPSA-lab), Sylvain Hanneton
  (NPSM), D. Alleysson (LPN), J. H\'erault (GIPSA-lab)","Biomimetic Space-Variant Sampling in a Vision Prosthesis Improves the
  User's Skill in a Localization Task",,"CVHI 2007, Conference & Workshop on Assistive Technologies for
  People with Vision & Hearing Impairments, Granada : Espagne (2007)",,,"q-bio.NC",,"  In this experiment, we test the hypothesis of whether a 'retina-like' space
variant sampling pattern can improve the efficiency of a visual prosthesis.
Subjects wearing a visuo-auditory substitution system were tested for their
ability to point at visual targets. The test group (space-variant sampling),
performed significantly better than the control group (uniform sampling). The
pointing accuracy was enhanced, as was the speed to find the target.
Surprisingly, the time spanned to complete the training was also reduced,
suggesting that this space-variant sampling scheme facilitates the mastering of
sensorimotor contingencies.
","[{""version"":""v1"",""created"":""Tue, 18 Sep 2007 06:52:58 GMT""}]","2007-09-19"
