"0709.2375","Bhuvnesh Jain","Bhuvnesh Jain (Penn), Pengjie Zhang (Shanghai)","Observational Tests of Modified Gravity","19 pages, 3 figures. Submitted to PRD","Phys.Rev.D78:063503,2008","10.1103/PhysRevD.78.063503",,"astro-ph",,"  Modified gravity theories have richer observational consequences for
large-scale structure than conventional dark energy models, in that different
observables are not described by a single growth factor even in the linear
regime. We examine the relationships between perturbations in the metric
potentials, density and velocity fields, and discuss strategies for measuring
them using gravitational lensing, galaxy cluster abundances, galaxy
clustering/dynamics and the ISW effect. We show how a broad class of gravity
theories can be tested by combining these probes. A robust way to interpret
observations is by constraining two key functions: the ratio of the two metric
potentials, and the ratio of the Gravitational ``constant'' in the Poisson
equation to Newton's constant. We also discuss quasilinear effects that carry
signatures of gravity, such as through induced three-point correlations.
  Clustering of dark energy can mimic features of modified gravity theories and
thus confuse the search for distinct signatures of such theories. It can
produce pressure perturbations and anisotropic stresses, which breaks the
equality between the two metric potentials even in general relativity. With
these two extra degrees of freedom, can a clustered dark energy model mimic
modified gravity models in all observational tests? We show with specific
examples that observational constraints on both the metric potentials and
density perturbations can in principle distinguish modifications of gravity
from dark energy models. We compare our result with other recent studies that
have slightly different assumptions (and apparently contradictory conclusions).
","[{""version"":""v1"",""created"":""Mon, 17 Sep 2007 19:48:35 GMT""}]","2009-02-20"
"0709.2380","Jane MacGibbon","Jane H. MacGibbon, B. J. Carr and Don N. Page","Do Evaporating Black Holes Form Photospheres?","version published in Phys Rev D 78, 064043; 25 pages, 3 figures;
  includes discussion on extending our analysis to TeV-scale,
  higher-dimensional black holes","Phys.Rev.D78:064043,2008","10.1103/PhysRevD.78.064043",,"astro-ph gr-qc hep-th","http://arxiv.org/licenses/nonexclusive-distrib/1.0/","  Several authors, most notably Heckler, have claimed that the observable
Hawking emission from a microscopic black hole is significantly modified by the
formation of a photosphere around the black hole due to QED or QCD interactions
between the emitted particles. In this paper we analyze these claims and
identify a number of physical and geometrical effects which invalidate these
scenarios. We point out two key problems. First, the interacting particles must
be causally connected to interact, and this condition is satisfied by only a
small fraction of the emitted particles close to the black hole. Second, a
scattered particle requires a distance ~ E/m_e^2 for completing each
bremsstrahlung interaction, with the consequence that it is improbable for
there to be more than one complete bremsstrahlung interaction per particle near
the black hole. These two effects have not been included in previous analyses.
We conclude that the emitted particles do not interact sufficiently to form a
QED photosphere. Similar arguments apply in the QCD case and prevent a QCD
photosphere (chromosphere) from developing when the black hole temperature is
much greater than Lambda_QCD, the threshold for QCD particle emission.
Additional QCD phenomenological arguments rule out the development of a
chromosphere around black hole temperatures of order Lambda_QCD. In all cases,
the observational signatures of a cosmic or Galactic halo background of
primordial black holes or an individual black hole remain essentially those of
the standard Hawking model, with little change to the detection probability. We
also consider the possibility, as proposed by Belyanin et al. and D. Cline et
al., that plasma interactions between the emitted particles form a photosphere,
and we conclude that this scenario too is not supported.
","[{""version"":""v1"",""created"":""Mon, 17 Sep 2007 19:01:54 GMT""},{""version"":""v2"",""created"":""Mon, 25 Feb 2008 20:34:00 GMT""},{""version"":""v3"",""created"":""Mon, 17 Mar 2008 19:06:11 GMT""},{""version"":""v4"",""created"":""Sun, 23 Mar 2008 17:40:28 GMT""},{""version"":""v5"",""created"":""Tue, 29 Jul 2008 22:59:10 GMT""},{""version"":""v6"",""created"":""Thu, 25 Sep 2008 17:18:34 GMT""}]","2009-11-13"
"0709.2381","Jane MacGibbon","Don N. Page, B. J. Carr, and Jane H. MacGibbon","Bremsstrahlung Effects around Evaporating Black Holes","version published in PRD 78, 064044; 10 pages","Phys.Rev.D78:064044,2008","10.1103/PhysRevD.78.064044","Alberta-Thy-13-07","astro-ph gr-qc hep-th","http://arxiv.org/licenses/nonexclusive-distrib/1.0/","  We discuss a variety of bremsstrahlung processes associated with charged
particles emitted by evaporating black holes. We show that such particles
produce a negligible number of bremsstrahlung photons from their scattering off
each other, though at low frequencies inner bremsstrahlung photons dominate
over the direct Hawking emission of photons. This analysis and the further
analysis of the accompanying paper invalidate Heckler's claim that sufficiently
hot evaporating black holes form QED photospheres.
","[{""version"":""v1"",""created"":""Mon, 17 Sep 2007 18:47:08 GMT""},{""version"":""v2"",""created"":""Tue, 29 Jul 2008 23:02:18 GMT""},{""version"":""v3"",""created"":""Thu, 25 Sep 2008 17:30:49 GMT""}]","2009-11-13"
"0709.2385","Kevin M. Huffenberger","K. M. Huffenberger, I. J. O'Dwyer, K. M. Gorski, B. D. Wandelt","Applications of Fast Convolution on the Sphere","8 pages, 6 figures",,,,"astro-ph",,"  We present several diverse applications of the spherical fast convolution
method suggested by Wandelt and Gorski (2001), which is useful for studies of
telescope optical properties and for construction of shaped filters for
analysis of all-sky data. We study sidelobe pickup in three design concepts for
the CALISTO infrared telescope. The beam convolution allows for direct
comparison of the performance of each telescope design. At 100 microns, the
best of these designs limits sidelobe contamination from Galactic dust emission
to < 0.1 MJy/sr for most of the sky with |b| > 25 deg. With the fast
convolution method, we illustrate the impact of asymmetric primary beams on the
recovery of the temperature power spectrum for the Planck microwave background
mission. Finally, we use the fast convolution method to specify a class of
orientable filters on the sphere, working through a pedagogical example.
","[{""version"":""v1"",""created"":""Mon, 17 Sep 2007 18:25:23 GMT""}]","2007-09-18"
"0709.2406","Andrew Dawes","Andrew M. C. Dawes, Lucas Illing, Joel A. Greenberg, Daniel J.
  Gauthier","All-Optical Switching with Transverse Optical Patterns",,,"10.1103/PhysRevA.77.013833",,"physics.optics nlin.PS",,"  We demonstrate an all-optical switch that operates at ultra-low-light levels
and exhibits several features necessary for use in optical switching networks.
An input switching beam, wavelength $\lambda$, with an energy density of
$10^{-2}$ photons per optical cross section [$\sigma=\lambda^2/(2\pi)$] changes
the orientation of a two-spot pattern generated via parametric instability in
warm rubidium vapor. The instability is induced with less than 1 mW of total
pump power and generates several $\mu$Ws of output light. The switch is
cascadable: the device output is capable of driving multiple inputs, and
exhibits transistor-like signal-level restoration with both saturated and
intermediate response regimes. Additionally, the system requires an input power
proportional to the inverse of the response time, which suggests thermal
dissipation does not necessarily limit the practicality of optical logic
devices.
","[{""version"":""v1"",""created"":""Mon, 17 Sep 2007 18:26:06 GMT""}]","2014-07-22"
"0709.2430","Neil Butcher","Neil A. Butcher and Paul M. Saffin","Singular manifolds, topology change and the dynamics of compactification","18 pages 6 figures","JHEP 0711:062,2007","10.1088/1126-6708/2007/11/062",,"hep-th",,"  We investigate the dynamics of the geometric transitions associated to
compactified spacetimes. By including the dynamics of gravity we are able to
follow the evolution of collapsing cycles as they attempt to undergo a topology
changing transition. Rather than achieving this singular geometry we find that
one of two scenarios occur, depending on the initial conditions. Either a
horizon forms, shielding a curvature singularity, or the cycle re-expands after
an initial contraction phase. For the case where a horizon forms we identify
the final state with a known analytic black-hole solution. We also show use our
results to demonstate a novel compactification mechanism, owing to the
asymptotic structure of this black-hole solution.
","[{""version"":""v1"",""created"":""Mon, 17 Sep 2007 16:00:28 GMT""}]","2009-06-10"
"0709.2508","Stephen Semmes","Stephen Semmes","Some aspects of calculus on non-smooth sets","5 pages, latex-2e. A few clarifications and additions",,,,"math.CA",,"  Sets in R^n in which every pair of elements x, y can be connected by a path
in the set of length bounded by a constant multiple of the distance between x
and y are considered.
","[{""version"":""v1"",""created"":""Mon, 17 Sep 2007 18:43:23 GMT""},{""version"":""v2"",""created"":""Wed, 19 Sep 2007 19:12:27 GMT""},{""version"":""v3"",""created"":""Thu, 20 Sep 2007 14:17:48 GMT""}]","2007-09-20"
"0709.2535","David Wiltshire","Ben M. Leith, S. C. Cindy Ng, David L. Wiltshire","Gravitational energy as dark energy: Concordance of cosmological tests","4 pages, 2 figures; v2 improved statistics, references added, to
  appear in ApJ Letters","Astrophys.J.672:L91-L94,2008","10.1086/527034",,"astro-ph gr-qc hep-ph hep-th",,"  We provide preliminary quantitative evidence that a new solution to averaging
the observed inhomogeneous structure of matter in the universe [gr-qc/0702082,
arxiv:0709.0732], may lead to an observationally viable cosmology without
exotic dark energy. We find parameters which simultaneously satisfy three
independent tests: the match to the angular scale of the sound horizon detected
in the cosmic microwave background anisotropy spectrum; the effective comoving
baryon acoustic oscillation scale detected in galaxy clustering statistics; and
type Ia supernova luminosity distances. Independently of the supernova data,
concordance is obtained for a value of the Hubble constant which agrees with
the measurement of the Hubble Key team of Sandage et al [astro-ph/0603647].
Best-fit parameters include a global average Hubble constant H_0 = 61.7
(+1.2/-1.1) km/s/Mpc, a present epoch void volume fraction of f_{v0} = 0.76
(+0.12/-0.09), and an age of the universe of 14.7 (+0.7/-0.5) billion years as
measured by observers in galaxies. The mass ratio of non-baryonic dark matter
to baryonic matter is 3.1 (+2.5/-2.4), computed with a baryon-to-photon ratio
that concords with primordial lithium abundances.
","[{""version"":""v1"",""created"":""Mon, 17 Sep 2007 19:33:44 GMT""},{""version"":""v2"",""created"":""Wed, 21 Nov 2007 23:05:23 GMT""}]","2008-11-26"
"0709.2543","Seung-Kyun Lee","S. -K. Lee, M. V. Romalis","Calculation of Magnetic Field Noise from High-Permeability Magnetic
  Shields and Conducting Objects with Simple Geometry","10 pages",,"10.1063/1.2885711",,"physics.ins-det",,"  High-permeability magnetic shields generate magnetic field noise that can
limit the sensitivity of modern precision measurements. We show that
calculations based on the fluctuation-dissipation theorem allow quantitative
evaluation of magnetic field noise, either from current or magnetization
fluctuations, inside enclosures made of high-permeability materials. Explicit
analytical formulas for the noise are derived for a few axially symmetric
geometries, which are compared with results of numerical finite element
analysis. Comparison is made between noises caused by current and magnetization
fluctuations inside a high-permeability shield and also between
current-fluctuation-induced noises inside magnetic and non-magnetic conducting
shells. A simple model is suggested to predict power-law decay of noise spectra
beyond quasi-static regime. Our results can be used to assess noise from
existing shields and to guide design of new shields for precision measurements.
","[{""version"":""v1"",""created"":""Mon, 17 Sep 2007 19:44:45 GMT""}]","2009-11-13"
"0709.2589","Emanuele Berti","Emanuele Berti, Sai Iyer, Clifford M. Will","A post-Newtonian diagnosis of quasiequilibrium configurations of neutron
  star-neutron star and neutron star-black hole binaries","17 pages, 6 tables, 8 figures","Phys.Rev.D77:024019,2008","10.1103/PhysRevD.77.024019",,"gr-qc astro-ph",,"  We use a post-Newtonian diagnostic tool to examine numerically generated
quasiequilibrium initial data sets for non-spinning double neutron star and
neutron star-black hole binary systems. The PN equations include the effects of
tidal interactions, parametrized by the compactness of the neutron stars and by
suitable values of ``apsidal'' constants, which measure the degree of
distortion of stars subjected to tidal forces. We find that the post-Newtonian
diagnostic agrees well with the double neutron star initial data, typically to
better than half a percent except where tidal distortions are becoming extreme.
We show that the differences could be interpreted as representing small
residual eccentricity in the initial orbits. In comparing the diagnostic with
preliminary numerical data on neutron star-black hole binaries, we find less
agreement.
","[{""version"":""v1"",""created"":""Mon, 17 Sep 2007 19:55:26 GMT""}]","2008-11-26"
"0709.2605","Florian Goebel","Florian Goebel (for the MAGIC collaboration)","Status of the second phase of the MAGIC telescope","4 pages, 5 figures, to appear in the proceedings of the 30th
  International Cosmic Ray Conference, Merida, July 2007","Proc. 30th Int. Cosm. Ray Conf., R. Caballero et al. (eds.), UNAM,
  Mexico City, 2008, Vol. 3, pg. 1485-1488",,"MPP-2007-131","astro-ph",,"  The MAGIC 17m diameter Cherenkov telescope will be upgraded with a second
telescope with advanced photon detectors and ultra fast readout within the year
2007. The sensitivity of MAGIC-II, the two telescope system, will be improved
by a factor of 2. In addition the energy threshold will be reduced and the
energy and angular resolution will be improved. The design, status and expected
performance of MAGIC-II is presented here.
","[{""version"":""v1"",""created"":""Mon, 17 Sep 2007 19:47:25 GMT""}]","2019-08-13"
"0709.2621","Giuliano Orso","G. Orso","BCS-BEC crossover in a random external potential","Revised version, one reference added, Phys. Rev. Lett. in press",,"10.1103/PhysRevLett.99.250402",,"cond-mat.supr-con",,"  We investigate the ground state properties of a disordered superfluid Fermi
gas across the BCS-BEC (Bose Einstein condensate) crossover. We show that, for
weak disorder, both the depletion of the condensate fraction of pairs and the
normal fluid density exhibit a nonmonotonic behavior as a function of the
interaction parameter $1/k_Fa$, reaching their minimum value near unitarity. We
find that, moving away from the weak coupling BCS regime, Anderson's theorem
ceases to apply and the superfluid order parameter is more and more affected by
the random potential.
","[{""version"":""v1"",""created"":""Mon, 17 Sep 2007 16:15:31 GMT""},{""version"":""v2"",""created"":""Mon, 5 Nov 2007 09:53:27 GMT""}]","2009-11-13"
"0709.2626","Pouyan Ghaemi","Pouyan Ghaemi, Frank Wilczek","Near-Zero Modes in Superconducting Graphene","9 pages, to appear in Proceedings of the Nobel Symposium on Graphene
  and Quantum Matter","Phys. Scr. T 146 (2012) 014019",,,"cond-mat.supr-con","http://arxiv.org/licenses/nonexclusive-distrib/1.0/","  Vortices in the simplest superconducting state of graphene contain very low
energy excitations, whose existence is connected to an index theorem that
applies strictly to an approximate form of the relevant Bogoliubov-deGennes
equations. When Zeeman interactions are taken into account, the zero modes
required by the index theorem are (slightly) displaced. Thus the vortices
acquire internal structure, that plausibly supports interesting dynamical
phenomena.
","[{""version"":""v1"",""created"":""Mon, 17 Sep 2007 19:56:01 GMT""},{""version"":""v2"",""created"":""Wed, 7 Sep 2011 18:14:27 GMT""}]","2012-02-03"
"0709.2663","Carl Mueller","Carl Mueller and David Nualart","Regularity of the density for the stochastic heat equation",,"Electronic J. Prob., 13, paper 74, 2248-2258, (2008)",,,"math.PR",,"  We study the smoothness of the density of a semilinear heat equation with
multiplicative spacetime white noise. Using Malliavin calculus, we reduce the
problem to a question of negative moments of solutions of a linear heat
equation with multiplicative white noise. Then we settle this question by
proving that solutions to the linear equation have negative moments of all
orders.
","[{""version"":""v1"",""created"":""Mon, 17 Sep 2007 16:11:18 GMT""}]","2011-02-18"
"0709.2664","Paul Benioff","Paul Benioff","Reference Frame Fields based on Quantum Theory Representations of Real
  and Complex Numbers","Extensively revised and expanded, title changed. Submitted to
  Conference proceedings, NSF Conference, Tyler TX, Sept. 2007","Advances in Quantum Computation, K. Mahdavi and D. Koslover, Eds.,
  Contemporary Mathematics Vol. 482, pp125-163, (2009)",,,"quant-ph hep-th math.GM",,"  A quantum theory representations of real (R) and complex (C) numbers is given
that is based on states of single, finite strings of qukits for any base k > 1.
Both unary representations and the possibility that qukits with k a prime
number are elementary and the rest composite are discussed. Cauchy sequences of
qukit string states are defined from the arithmetic properties. The
representations of R and C, as equivalence classes of these sequences, differ
from classical kit string state representations in two ways: the freedom of
choice of basis states, and the fact that each quantum theory representation is
part of a mathematical structure that is itself based on the real and complex
numbers. These aspects enable the description of 3 dimensional frame fields
labeled by different k values, different basis or gauge choices, and different
iteration stages. The reference frames in the field are based on each R and C
representation where each frame contains representations of all physical
theories as mathematical structures based on the R and C representation.
Approaches to integrating this with physics are described. It is observed that
R and C values of physical quantities, matrix elements, etc. which are viewed
in a frame as elementary and featureless, are seen in a parent frame as
equivalence classes of Cauchy sequences of qukit string states.
","[{""version"":""v1"",""created"":""Mon, 17 Sep 2007 16:34:33 GMT""},{""version"":""v2"",""created"":""Wed, 5 Mar 2008 17:36:03 GMT""}]","2009-11-17"
"0709.2665","Marc-Andr\'e Pleier","Marc-Andr\'e Pleier (for the CDF and D0 Collaborations)","Top Quark Physics at the Tevatron","September 2007. 8 pages, 3 figures. Prepared for the proceedings of
  the XXVII Physics in Collision Symposium, Annecy, France, 26-29 June 2007","Acta Phys.Polon.Supp.1:237-244,2008",,,"hep-ex",,"  The Tevatron proton-antiproton collider at Fermilab with its centre of mass
energy of 1.96 TeV is currently the only source for the production of top
quarks. Its increased luminosity and centre of mass energy in Run II allow both
collider detectors CDF and D0 to study top quarks with unprecedented scrutiny.
  Recent results on the top quark's pair production cross section and its
properties such as mass, electric charge, helicity of the W boson in its decay
and branching fraction B(t->Wb) are presented and probe the validity of the
Standard Model.
","[{""version"":""v1"",""created"":""Mon, 17 Sep 2007 16:37:28 GMT""}]","2019-08-14"
"0709.2666","Damien A. Easson","Damien A. Easson, Ruth Gregory, David F. Mota, Gianmassimo Tasinato
  and Ivonne Zavala","Spinflation","29 pages, 6 figures, minor changes, typos fixed, to appear in JCAP","JCAP 0802:010,2008","10.1088/1475-7516/2008/02/010","DCPT-07/53","hep-th astro-ph gr-qc hep-ph",,"  We study the cosmological implications of including angular motion in the DBI
brane inflation scenario. The non-canonical kinetic terms of the
Dirac-Born-Infeld action give an interesting alternative to slow roll
inflation, and cycling branes can drive periods of accelerated expansion in the
Universe. We present explicit numerical solutions demonstrating brane inflation
in the Klebanov-Strassler throat. We find that demanding sufficient inflation
takes place in the throat is in conflict with keeping the brane's total energy
low enough so that local gravitational backreaction on the Calabi-Yau manifold
can be safely ignored. We deduce that spinflation (brane inflation with angular
momentum) can ease this tension by providing extra e-foldings at the start of
inflation. Cosmological expansion rapidly damps the angular momentum causing an
exit to a more conventional brane inflation scenario. Finally, we set up a
general framework for cosmological perturbation theory in this scenario, where
we have multi-field non-standard kinetic term inflation.
","[{""version"":""v1"",""created"":""Mon, 17 Sep 2007 16:40:22 GMT""},{""version"":""v2"",""created"":""Fri, 29 Feb 2008 16:54:48 GMT""}]","2009-06-10"
"0709.2667","Jairo Bochi","Artur Avila, Jairo Bochi, David Damanik","Cantor Spectrum for Schr\""odinger Operators with Potentials arising from
  Generalized Skew-shifts","Final version. To appear in Duke Mathematical Journal","Duke Mathematical Journal, 146, no. 2 (2009), 253-280","10.1215/00127094-2008-065",,"math.DS math-ph math.MP math.SP",,"  We consider continuous $SL(2,\mathbb{R})$-cocycles over a strictly ergodic
homeomorphism which fibers over an almost periodic dynamical system
(generalized skew-shifts). We prove that any cocycle which is not uniformly
hyperbolic can be approximated by one which is conjugate to an
$SO(2,\mathbb{R})$-cocycle. Using this, we show that if a cocycle's homotopy
class does not display a certain obstruction to uniform hyperbolicity, then it
can be $C^0$-perturbed to become uniformly hyperbolic. For cocycles arising
from Schr\""odinger operators, the obstruction vanishes and we conclude that
uniform hyperbolicity is dense, which implies that for a generic continuous
potential, the spectrum of the corresponding Schr\""odinger operator is a Cantor
set.
","[{""version"":""v1"",""created"":""Mon, 17 Sep 2007 16:43:42 GMT""},{""version"":""v2"",""created"":""Tue, 22 Apr 2008 14:52:26 GMT""}]","2009-12-18"
"0709.2668","Marcus M. Weber","M. M. Weber","Higgs Production by Gluon initiated Weak Boson Fusion","5 pages, proceedings for the 2007 Linear Collider Workshop at DESY,
  Hamburg, Germany","ECONF C0705302:LOOP07,2007",,,"hep-ph",,"  The gluon-gluon induced terms for Higgs production through weak-boson fusion
are calculated. They form a finite and gauge-invariant subset of the NNLO
corrections in the strong coupling constant. This is also the lowest order with
sizeable t-channel colour exchange contributions, leading to additional
hadronic activity between the outgoing jets.
","[{""version"":""v1"",""created"":""Mon, 17 Sep 2007 16:48:11 GMT""}]","2009-02-16"
"0709.2669","Reimar Finken","Reimar Finken, Antonio Lamura, Udo Seifert and Gerhard Gompper","Two-Dimensional Fluctuating Vesicles in Linear Shear Flow","13 pages, 7 figures","Eur. Phys. J. E 25, 309 (2008)","10.1140/epje/i2007-10299-7",,"cond-mat.soft cond-mat.stat-mech",,"  The stochastic motion of a two-dimensional vesicle in linear shear flow is
studied at finite temperature. In the limit of small deformations from a
circle, Langevin-type equations of motion are derived, which are highly
nonlinear due to the constraint of constant perimeter length. These equations
are solved in the low temperature limit and using a mean field approach, in
which the length constraint is satisfied only on average. The constraint
imposes non-trivial correlations between the lowest deformation modes at low
temperature. We also simulate a vesicle in a hydrodynamic solvent by using the
multi-particle collision dynamics technique, both in the quasi-circular regime
and for larger deformations, and compare the stationary deformation correlation
functions and the time autocorrelation functions with theoretical predictions.
Good agreement between theory and simulations is obtained.
","[{""version"":""v1"",""created"":""Mon, 17 Sep 2007 17:34:31 GMT""}]","2009-11-13"
