"0705.2004","Francis O'Donovan","Francis T. O'Donovan, David Charbonneau, G\'asp\'ar \'A. Bakos, Georgi
  Mandushev, Edward W. Dunham, Timothy M. Brown, David W. Latham, Guillermo
  Torres, Alessandro Sozzetti, G\'eza Kov\'acs, Mark E. Everett, Nairn Baliber,
  M\'arton G. Hidas, Gilbert A. Esquerdo, Markus Rabus, Hans J. Deeg, Juan A.
  Belmonte, Lynne A. Hillenbrand, Robert P. Stefanik","TrES-3: A Nearby, Massive, Transiting Hot Jupiter in a 31-Hour Orbit","v1. 14 pages, 2 figures, 3 tables. Submitted to ApJL 27 April 2007.
  Accepted for publication in ApJL 14 May 2007","Astrophysical Journal, Volume 663, Issue 1, pp. L37-L40. (2007)","10.1086/519793",,"astro-ph",,"  We describe the discovery of a massive transiting hot Jupiter with a very
short orbital period (1.30619 d), which we name TrES-3. From spectroscopy of
the host star GSC 03089-00929, we measure T_eff = 5720 +- 150 K, logg=4.6 +-
0.3, and vsini < 2 km/s, and derive a stellar mass of 0.90 +- 0.15 M_sun. We
estimate a planetary mass of 1.92 +- 0.23 M_Jup, based on the sinusoidal
variation of our high-precision radial velocity measurements. This variation
has a period and phase consistent with our transit photometry. Our spectra show
no evidence of line bisector variations that would indicate a blended eclipsing
binary star. From detailed modeling of our B and z photometry of the 2.5%-deep
transits, we determine a stellar radius 0.802 +- 0.046 R_sun and a planetary
radius 1.295 +- 0.081 R_Jup. TrES-3 has one of the shortest orbital periods of
the known transiting exoplanets, facilitating studies of orbital decay and mass
loss due to evaporation, and making it an excellent target for future studies
of infrared emission and reflected starlight.
","[{""version"":""v1"",""created"":""Mon, 14 May 2007 18:55:27 GMT""}]","2010-02-04"
"0705.2005","Witold Maciejewski","Witold Maciejewski and E. Athanassoula","Regular motions in double bars. I. Double-frequency orbits and loops","10 pages, 6 figures, submitted to MNRAS",,"10.1111/j.1365-2966.2007.12069.x",,"astro-ph",,"  Bars in galaxies are mainly supported by particles trapped around stable
periodic orbits. These orbits represent oscillatory motion with only one
frequency, which is the bar driving frequency, and miss free oscillations. We
show that a similar situation takes place in double bars: particles get trapped
around parent orbits, which in this case represent oscillatory motion with two
frequencies of driving by the two bars, and which also lack free oscillations.
Thus the parent orbits, which constitute the backbone of an oscillating
potential of two independently rotating bars, are the double-frequency orbits.
These orbits do not close in any reference frame, but they map onto loops,
first introduced by Maciejewski & Sparke (1997). Trajectories trapped around
the parent double-frequency orbit map onto a set of points confined within a
ring surrounding the loop.
","[{""version"":""v1"",""created"":""Mon, 14 May 2007 18:54:46 GMT""}]","2009-11-13"
"0705.2006","Thiago P. Mayer Alegre","T. P. Mayer Alegre, C. Santori, G. Medeiros-Ribeiro, and R. G.
  Beausoleil","Polarization-selective excitation of N-V centers in diamond",,"Phys. Rev. B, 76, 165205 (2007)","10.1103/PhysRevB.76.165205",,"cond-mat.other",,"  The nitrogen-vacancy (N-V) center in diamond is promising as an electron spin
qubit due to its long-lived coherence and optical addressability. The ground
state is a spin triplet with two levels ($m_s = \pm 1$) degenerate at zero
magnetic field. Polarization-selective microwave excitation is an attractive
method to address the spin transitions independently, since this allows
operation down to zero magnetic field. Using a resonator designed to produce
circularly polarized microwaves, we have investigated the polarization
selection rules of the N-V center. We first apply this technique to N-V
ensembles in [100] and [111]-oriented samples. Next, we demonstrate an imaging
technique, based on optical polarization dependence, that allows rapid
identification of the orientations of many single N-V centers. Finally, we test
the microwave polarization selection rules of individual N-V centers of known
orientation.
","[{""version"":""v1"",""created"":""Mon, 14 May 2007 19:12:43 GMT""},{""version"":""v2"",""created"":""Thu, 17 May 2007 23:11:27 GMT""}]","2007-10-15"
"0705.2007","Carlos Munoz","C. Munoz","SUSY: New Perspectives and Variants","Small modifications in text and references. Review prepared for
  Moriond 2006. 12 pages",,,,"hep-ph","http://arxiv.org/licenses/nonexclusive-distrib/1.0/","  Although supersymmetry (SUSY) is thirty five years old, it is still one of
the most attractive theories for physics beyond the standard model. Assuming
that SUSY will be discovered at the LHC, the key question is: What SUSY model
do we expect to be the correct one ? After reviewing briefly the advantages and
problems of SUSY, several interesting models that have been proposed in the
literature will be discussed. In particular, models such as the MSSM, BRpV,
NMSSM, and possible extensions. We will also introduce the $\mu\nuSSM$ whose
interest resides in the fact that it generates a solution to the (famous) $\mu$
problem of SUSY models that is connected to the (nowadays very popular)
neutrino physics.
","[{""version"":""v1"",""created"":""Mon, 14 May 2007 19:35:40 GMT""},{""version"":""v2"",""created"":""Thu, 10 Jan 2013 19:00:21 GMT""}]","2013-01-11"
"0705.2008","Pran Nath","Tarek Ibrahim and Pran Nath","CP Violation From Standard Model to Strings","51 pages, 17 figures. RMP format","Rev.Mod.Phys.80:577-631,2008","10.1103//RevModPhys.80.577",,"hep-ph",,"  A review of CP violation from the Standard Model to strings is given which
includes a broad landscape of particle physics models, encompassing the
non-supersymmetric 4D extensions of the standard model, and models based on
supersymmetry, on extra dimensions, on strings and on branes. The
supersymmetric models discussed include complex mSUGRA and its extensions,
while the models based on extra dimensions include 5D models including models
based on warped geometry. CP violation beyond the standard model is central to
achieving the desired amount of baryon asymmetry in the universe via
baryogenesis and leptogenesis. They also affect a variety of particle physics
phenomena: electric dipole moments, $g-2$, relic density and detection rates
for neutralino dark matter in supersymmetric theories, Yukawa unification in
grand unified and string based models, and sparticle production cross sections,
and their decays patterns and signatures at hadron colliders. Additionally CP
violations can generate CP even-CP odd Higgs mixings, affect the neutral Higgs
spectrum and lead to phenomena detectable at colliders. Prominent among these
are the CP violation effects in decays of neutral and charged Higgs bosons.
Neutrino masses introduce new sources of CP violation which will be explored in
neutrino factories in the future. Such phases can also enter in proton
stability in unified models of particle interactions. The current experimental
status of CP violation is discussed and possibilities for the future outlined.
","[{""version"":""v1"",""created"":""Mon, 14 May 2007 19:31:27 GMT""},{""version"":""v2"",""created"":""Thu, 10 Jan 2008 21:15:28 GMT""}]","2008-11-26"
"0705.2009","Ersin Sengul","Ersin Sengul, Hong Ju Park, Ender Ayanoglu","Bit-Interleaved Coded Multiple Beamforming with Imperfect CSIT",,,,,"cs.IT math.IT",,"  This paper addresses the performance of bit-interleaved coded multiple
beamforming (BICMB) [1], [2] with imperfect knowledge of beamforming vectors.
Most studies for limited-rate channel state information at the transmitter
(CSIT) assume that the precoding matrix has an invariance property under an
arbitrary unitary transform. In BICMB, this property does not hold. On the
other hand, the optimum precoder and detector for BICMB are invariant under a
diagonal unitary transform. In order to design a limited-rate CSIT system for
BICMB, we propose a new distortion measure optimum under this invariance. Based
on this new distortion measure, we introduce a new set of centroids and employ
the generalized Lloyd algorithm for codebook design. We provide simulation
results demonstrating the performance improvement achieved with the proposed
distortion measure and the codebook design for various receivers with linear
detectors. We show that although these receivers have the same performance for
perfect CSIT, their performance varies under imperfect CSIT.
","[{""version"":""v1"",""created"":""Mon, 14 May 2007 19:33:20 GMT""},{""version"":""v2"",""created"":""Thu, 8 May 2008 08:38:20 GMT""}]","2008-05-08"
"0705.2010","Alexander Titov","A.I. Titov and B. K\""ampfer","Photoproduction of phi meson off deuteron near threshold","26 pages, 19 figures","Phys.Rev.C76:035202,2007","10.1103/PhysRevC.76.035202",,"nucl-th",,"  We discuss coherent and incoherent $\phi$ meson photoproduction off the
deuteron at low energy and small momentum transfer with the aim to check
whether the recent experimental data need for their interpretation the
inclusion of exotic channels. Our analysis of the differential cross section
and spin-density matrix elements shows that the existing data may be understood
on the base of conventional dynamics. For a firm conclusion about a possible
manifestation of exotic channels one has to improve the resolution of the data
with providing additional information on channels with spin- and double-spin
flip transitions being sensitive to the properties of the photoproduction
amplitude in $\gamma p$ and $\gamma D$ reactions.
","[{""version"":""v1"",""created"":""Mon, 14 May 2007 19:46:36 GMT""}]","2008-11-26"
"0705.2011","Alex Graves","Alex Graves, Santiago Fernandez, Juergen Schmidhuber","Multi-Dimensional Recurrent Neural Networks","10 pages, 10 figures",,,"04-07","cs.AI cs.CV",,"  Recurrent neural networks (RNNs) have proved effective at one dimensional
sequence learning tasks, such as speech and online handwriting recognition.
Some of the properties that make RNNs suitable for such tasks, for example
robustness to input warping, and the ability to access contextual information,
are also desirable in multidimensional domains. However, there has so far been
no direct way of applying RNNs to data with more than one spatio-temporal
dimension. This paper introduces multi-dimensional recurrent neural networks
(MDRNNs), thereby extending the potential applicability of RNNs to vision,
video processing, medical imaging and many other areas, while avoiding the
scaling problems that have plagued other multi-dimensional models. Experimental
results are provided for two image segmentation tasks.
","[{""version"":""v1"",""created"":""Mon, 14 May 2007 19:49:56 GMT""}]","2007-05-23"
"0705.2012","Leszek Roszkowski","Leszek Roszkowski (Univ. of Sheffield and CERN), Roberto Ruiz de
  Austri (Univ. Autonoma Madrid), Roberto Trotta (Univ. of Oxford)","Implications for the Constrained MSSM from a new prediction for b to s
  gamma","JHEP version","JHEP 0707:075,2007","10.1088/1126-6708/2007/07/075",,"hep-ph astro-ph",,"  We re-examine the properties of the Constrained MSSM in light of updated
constraints, paying particular attention to the impact of the recent
substantial shift in the Standard Model prediction for BR(B to X_s gamma). With
the help of a Markov Chain Monte Carlo scanning technique, we vary all relevant
parameters simultaneously and derive Bayesian posterior probability maps. We
find that the case of \mu>0 remains favored, and that for \mu<0 it is
considerably more difficult to find a good global fit to current constraints.
In both cases we find a strong preference for a focus point region. This leads
to improved prospects for detecting neutralino dark matter in direct searches,
while superpartner searches at the LHC become more problematic, especially when
\mu<0. In contrast, prospects for exploring the whole mass range of the
lightest Higgs boson at the Tevatron and the LHC remain very good, which
should, along with dark matter searches, allow one to gain access to the
otherwise experimentally challenging focus point region. An alternative measure
of the mean quality-of-fit which we also employ implies that present data are
not yet constraining enough to draw more definite conclusions. We also comment
on the dependence of our results on the choice of priors and on some other
assumptions.
","[{""version"":""v1"",""created"":""Mon, 14 May 2007 19:52:16 GMT""},{""version"":""v2"",""created"":""Thu, 13 Dec 2007 22:32:24 GMT""}]","2009-04-21"
"0705.2013","M. B. Paranjape","F. Paul Esposito, L.-P. Guay, R. B. MacKenzie, M. B. Paranjape, and L.
  C. R. Wijewardhana","Field theoretic description of the abelian and non-abelian Josephson
  effect","10 pages no figures","Phys.Rev.Lett.98:241602,2007","10.1103/PhysRevLett.98.241602","UdeM-GPP-TH-06-155","hep-ph cond-mat.supr-con",,"  We formulate the Josephson effect in a field theoretic language which affords
a straightforward generalization to the non-abelian case. Our formalism
interprets Josephson tunneling as the excitation of pseudo-Goldstone bosons. We
demonstrate the formalism through the consideration of a single junction
separating two regions with a purely non-abelian order parameter and a sandwich
of three regions where the central region is in a distinct phase. Applications
to various non-abelian symmetry breaking systems in particle and condensed
matter physics are given.
","[{""version"":""v1"",""created"":""Mon, 14 May 2007 19:55:58 GMT""}]","2008-11-26"
"0705.2014","Michael A. Clark","M. A. Clark, A. D. Kennedy","Asymptotics of Fixed Point Distributions for Inexact Monte Carlo
  Algorithms","24 pages, accepted for publication in Physics Review D","Phys.Rev.D76:074508,2007","10.1103/PhysRevD.76.074508",,"hep-lat",,"  We introduce a simple general method for finding the equilibrium distribution
for a class of widely used inexact Markov Chain Monte Carlo algorithms. The
explicit error due to the non-commutivity of the updating operators when
numerically integrating Hamilton's equations can be derived using the
Baker-Campbell-Hausdorff formula. This error is manifest in the conservation of
a ``shadow'' Hamiltonian that lies close to the desired Hamiltonian. The fixed
point distribution of inexact Hybrid algorithms may then be derived taking into
account that the fixed point of the momentum heatbath and that of the molecular
dynamics do not coincide exactly. We perform this derivation for various
inexact algorithms used for lattice QCD calculations.
","[{""version"":""v1"",""created"":""Mon, 14 May 2007 19:56:52 GMT""},{""version"":""v2"",""created"":""Mon, 14 May 2007 20:38:21 GMT""},{""version"":""v3"",""created"":""Thu, 18 Oct 2007 22:42:44 GMT""}]","2008-11-26"
"0705.2015","Michael Pustilnik","M. Khodas, M. Pustilnik, A. Kamenev, L.I. Glazman","Dynamics of excitations in a one-dimensional Bose liquid",,"Phys. Rev. Lett. 99, 110405 (2007)","10.1103/PhysRevLett.99.110405",,"cond-mat.stat-mech cond-mat.mes-hall",,"  We show that the dynamic structure factor of a one-dimensional Bose liquid
has a power-law singularity defining the main mode of collective excitations.
Using the Lieb-Liniger model, we evaluate the corresponding exponent as a
function of the wave vector and the interaction strength.
","[{""version"":""v1"",""created"":""Mon, 14 May 2007 20:00:04 GMT""},{""version"":""v2"",""created"":""Fri, 14 Sep 2007 18:37:29 GMT""}]","2011-11-09"
"0705.2016","Pascu Catalin Moca","C. P. Moca, B. L. Sheu, N. Samarth, P. Schiffer, B. Janko and G.
  Zarand","Scaling analysis of the magnetoresistance in Ga_{1-x}Mn_xAs","4 pages, 3 figures","Phys. Rev. Lett. 102, 137203 (2009)","10.1103/PhysRevLett.102.137203",,"cond-mat.mtrl-sci",,"  We compare experimental resistivity data on Ga_{1-x}Mn_xAs films with
theoretical calculations using a scaling theory for strongly disordered
ferromagnets. All characteristic features of the temperature dependence of the
resistivity can be quantitatively understood through this approach as
originating from the close vicinity of the metal-insulator transition. In
particular, we find that the magnetic field induced changes in resistance
cannot be explained within a mean-field treatment of the magnetic state, and
that accounting for thermal fluctuations is crucial for a quantitative
analysis. Similarly, while the non-interacting scaling theory is in reasonable
agreement with the data, we find clear evidence in favor of interaction effects
at low temperatures.
","[{""version"":""v1"",""created"":""Mon, 14 May 2007 20:00:13 GMT""},{""version"":""v2"",""created"":""Wed, 16 Apr 2008 08:02:24 GMT""}]","2015-05-13"
"0705.2017","Yutaka Fujita","Yutaka Fujita, Noriaki Tawa, Kiyoshi Hayashida (Osaka), Motokazu
  Takizawa (Yamagata), Hironori Matsumoto (Kyoto), Nobuhiro Okabe (Tohoku), and
  Thomas. H. Reiprich (Bonn)","High Metallicity of the X-Ray Gas up to the Virial Radius of a Binary
  Cluster of Galaxies: Evidence of Galactic Superwinds at High-Redshift","Typo corrected. The published version is available on-line free of
  charge by the end of 2008. http://pasj.asj.or.jp/v60/sp1/60s133/60s133.pdf","PASJ, 60, S343 (2008)","10.1093/pasj/60.sp1.S343",,"astro-ph",,"  We present an analysis of a Suzaku observation of the link region between the
galaxy clusters A399 and A401. We obtained the metallicity of the intracluster
medium (ICM) up to the cluster virial radii for the first time. We determine
the metallicity where the virial radii of the two clusters cross each other (~2
Mpc away from their centers) and found that it is comparable to that in their
inner regions (~0.2 Zsun). It is unlikely that the uniformity of metallicity up
to the virial radii is due to mixing caused by a cluster collision. Since the
ram-pressure is too small to strip the interstellar medium of galaxies around
the virial radius of a cluster, the fairly high metallicity that we found there
indicates that the metals in the ICM are not transported from member galaxies
by ram-pressure stripping. Instead, the uniformity suggests that the
proto-cluster region was extensively polluted with metals by extremely powerful
outflows (superwinds) from galaxies before the clusters formed. We also
searched for the oxygen emission from the warm--hot intergalactic medium in
that region and obtained a strict upper limit of the hydrogen density
(nH<4.1x10^-5 cm^-3).
","[{""version"":""v1"",""created"":""Tue, 15 May 2007 00:01:22 GMT""},{""version"":""v2"",""created"":""Tue, 4 Mar 2008 07:50:06 GMT""}]","2017-01-18"
"0705.2018","Lily Schrempp","Ole Eggers Bjaelde, Anthony W. Brookfield, Carsten van de Bruck, Steen
  Hannestad, David F. Mota, Lily Schrempp, Domenico Tocchini-Valentini","Neutrino Dark Energy -- Revisiting the Stability Issue","24 pages, 8 figures, stable scenario with negative sound speed
  squared included, figures added, references added, conclusions unchanged.
  Matches version to be published in JCAP","JCAP 0801:026,2008","10.1088/1475-7516/2008/01/026","DESY 06-230","astro-ph hep-ph",,"  A coupling between a light scalar field and neutrinos has been widely
discussed as a mechanism for linking (time varying) neutrino masses and the
present energy density and equation of state of dark energy. However, it has
been pointed out that the viability of this scenario in the non-relativistic
neutrino regime is threatened by the strong growth of hydrodynamic
perturbations associated with a negative adiabatic sound speed squared. In this
paper we revisit the stability issue in the framework of linear perturbation
theory in a model independent way. The criterion for the stability of a model
is translated into a constraint on the scalar-neutrino coupling, which depends
on the ratio of the energy densities in neutrinos and cold dark matter. We
illustrate our results by providing meaningful examples both for stable and
unstable models.
","[{""version"":""v1"",""created"":""Tue, 15 May 2007 14:00:36 GMT""},{""version"":""v2"",""created"":""Thu, 17 Jan 2008 14:08:56 GMT""}]","2009-06-23"
"0705.2019","Korneel van den Broek","Korneel van den Broek (Rutgers U., Piscataway)","Vscape V1.1.0 - An Interactive Tool for Metastable Vacua","JHEP3 LaTeX - 32 pages - 1 figure; Vscape can be obtained from
  http://www.physics.rutgers.edu/~korneel/vscape/vscape.html; v2: corrected
  typos, added references","Comput.Phys.Commun.178:52-72,2008","10.1016/j.cpc.2007.08.009","RUNHETC-06-07","hep-ph",,"  Vscape is an interactive tool for studying the one-loop effective potential
of an ungauged supersymmetric model of chiral multiplets. The program allows
the user to define a supersymmetric model by specifying the superpotential. The
F-terms and the scalar and fermionic mass matrices are calculated symbolically.
The program then allows you to search numerically for (meta)stable minima of
the one-loop effective potential. Additional commands enable you to further
study specific minima, by e.g. computing the mass spectrum for those vacua.
Vscape combines the flexibility of symbolic software, with the speed of a
numerical package.
","[{""version"":""v1"",""created"":""Mon, 14 May 2007 22:11:14 GMT""},{""version"":""v2"",""created"":""Mon, 18 Jun 2007 05:06:21 GMT""}]","2008-11-26"
"0705.2021","Arcadio Poveda","A. Poveda, C. Allen, A. Hernandez-Alcantara","The Frequency Distribution of Semi-major Axis of Wide Binaries.
  Cosmogony and Dynamical Evolution","International Astronomical Union. Symposium no. 240, held 22-25
  August, 2006 in Prague, Czech Republic",,"10.1017/S1743921307004383",,"astro-ph",,"  The frequency distribution f(a) of semi-major axis of double and multiple
systems, as well as their eccentricities and mass ratios, contain valuable
fossil information about the process of star formation and the dynamical
history of the systems. In order to advance in the understanding of these
questions, we have made an extensive analysis of the frequency distribution f
(a) for wide binaries (a>25 AU) in the various published catalogues, as well as
in our own (Poveda et al., 1994; Allen et al., 2000; Poveda & Hernandez, 2003).
Based upon all these studies we have established that the frequency f(a) is
function of the age of the system and follows Oepik's distribution f(a) ~ 1/a
in the range of 100 AU < a < a[c](t), where a[c](t) is a critical semi-major
axis beyond which binaries have dissociated by encounters with massive objects.
We argue that the physics behind the distribution f(a) ~ 1/a is a process of
energy relaxation, analogous to that present in stellar clusters (secular
relaxation) or in spherical galaxies (violent relaxation). The frequency
distribution of mass ratios in triple systems as well as the existence of
runaway stars, indicate that both types of relaxation are important in the
process of binary and multiple star formation.
","[{""version"":""v1"",""created"":""Mon, 14 May 2007 22:35:38 GMT""}]","2009-11-13"
"0705.2022","Iliya Radulov","Radulov Iliya, Lovchinov Vassil, Dimitrov Dimitar, and Nizhankovskii
  Viktor","Correlation between magnetostriction and polarization in orthorhombic
  manganites",,,,,"cond-mat.str-el",,"  Recently we have reported the observation of colossal magnetostriction effect
in HoMn2O5 single crystals. Besides we have made the supposition for possible
correlation between the peculiarities, observed in the field depended
polarization measurements, and the colossal magnetostriction effect at a 4.2 K
temperature. In this article we present our results received by polarization
and magnetostriction measurements on HoMn2O5 and TbMn2O5 single crystals and
the strong correlation between magnetostriction and polarization phase
transition for these two compounds. The origin of this correlation is
discussed.
","[{""version"":""v1"",""created"":""Mon, 14 May 2007 20:18:27 GMT""}]","2007-05-23"
"0705.2023","Lin Tian","L. Tian, F. Fujiwara, T. Byrnes, and Y. Yamamoto","Recovery of Hidden Interference in Mott Insulators","4 figures",,,,"quant-ph cond-mat.other",,"  Particle statistics plays a crucial role in a strongly interacting quantum
many-body system. Here, we study the Hubbard model for distinguishable
particles at unit filling. Starting from the superfluid-like state in the
strong tunneling limit and gradually reducing the tunneling so that the on-site
repulsive interaction dominates, the state ends up in a symmetric superposition
of Mott insulator states. This result can be experimentally confirmed by the
recovery of interference patterns in the density correlation functions. We also
show that this state is a maximally entangled state, in contrast to the
standard picture.
","[{""version"":""v1"",""created"":""Mon, 14 May 2007 20:22:29 GMT""}]","2007-05-23"
