"0705.2043","Christopher Varney","H. A. Craig, C. N. Varney, W. E. Pickett, R. T. Scalettar","Static versus dynamic fluctuations in the one-dimensional extended
  Hubbard model","Corrected typos. (10 pages, 9 figures)","H. A. Craig, C. N. Varney, W. E. Pickett, R. T. Scalettar, Phys
  Rev B 76, 125103 (2007)","10.1103/PhysRevB.76.125103",,"cond-mat.str-el",,"  The extended Hubbard Hamiltonian is a widely accepted model for uncovering
the effects of strong correlations on the phase diagram of low-dimensional
systems, and a variety of theoretical techniques have been applied to it. In
this paper the world-line quantum Monte Carlo method is used to study spin,
charge, and bond order correlations of the one-dimensional extended Hubbard
model in the presence of coupling to the lattice. A static alternating lattice
distortion (the ionic Hubbard model) leads to enhanced charge density wave
correlations at the expense of antiferromagnetic order. When the lattice
degrees of freedom are dynamic (the Hubbard-Holstein model), we show that a
similar effect occurs even though the charge asymmetry must arise
spontaneously. Although the evolution of the total energy with lattice coupling
is smooth, the individual components exhibit sharp crossovers at the phase
boundaries. Finally, we observe a tendency for bond order in the region between
the charge and spin density wave phases.
","[{""version"":""v1"",""created"":""Mon, 14 May 2007 22:25:47 GMT""},{""version"":""v2"",""created"":""Fri, 18 May 2007 17:29:57 GMT""},{""version"":""v3"",""created"":""Thu, 6 Sep 2007 22:42:48 GMT""}]","2007-09-07"
"0705.2044","Matheus Lazo Lazo","Matheus Jatkoske Lazo","The matrix product ansatz for the six-vertex model",,"Lazo M J, 2007 Physica A 374 655",,,"cond-mat.stat-mech cond-mat.str-el",,"  Recently it was shown that the eigenfunctions for the the asymmetric
exclusion problem and several of its generalizations as well as a huge family
of quantum chains, like the anisotropic Heisenberg model, Fateev- Zamolodchikov
model, Izergin-Korepin model, Sutherland model, t-J model, Hubbard model, etc,
can be expressed by a matrix product ansatz. Differently from the coordinate
Bethe ansatz, where the eigenvalues and eigenvectors are plane wave
combinations, in this ansatz the components of the eigenfunctions are obtained
through the algebraic properties of properly defined matrices. In this work, we
introduce a formulation of a matrix product ansatz for the six-vertex model
with periodic boundary condition, which is the paradigmatic example of
integrability in two dimensions. Remarkably, our studies of the six-vertex
model are in agreement with the conjecture that all models exactly solved by
the Bethe ansatz can also be solved by an appropriated matrix product ansatz.
","[{""version"":""v1"",""created"":""Mon, 14 May 2007 22:27:10 GMT""}]","2007-05-23"
"0705.2045","Scott Glancy","S. Glancy and H. M. Vasconcelos","Methods for Producing Optical Coherent State Superpositions","25 pages, 27 figures, revtex. Version 2 includes expanded discussion
  of some earlier methods and more references. Version 3 includes even more
  references and a more conclusive conclusion. Version 3 is the published
  version","J. Opt. Soc. Am. B 25, 712-733 (2008)","10.1364/JOSAB.25.000712",,"quant-ph",,"  We discuss several methods to produce superpositions of optical coherent
states (also known as ""cat states""). Cat states have remarkable properties that
could allow them to be powerful tools for quantum information processing and
metrology. A number of proposals for how one can produce cat states have
appeared in the literature in recent years. We describe these proposals and
present new simulation and analysis of them incorporating practical issues such
as photon loss, detector inefficiency, and limited strength of nonlinear
interactions. We also examine how each would perform in a realistic experiment.
","[{""version"":""v1"",""created"":""Mon, 14 May 2007 22:38:00 GMT""},{""version"":""v2"",""created"":""Tue, 17 Jul 2007 20:21:33 GMT""},{""version"":""v3"",""created"":""Tue, 29 Apr 2008 19:48:13 GMT""}]","2009-11-13"
"0705.2046","Denis Sheka","Volodymyr P. Kravchuk, Denis D. Sheka, Yuri Gaididei and Franz G.
  Mertens","Controlled vortex core switching in a magnetic nanodisk by a rotating
  field","REVTeX, 5 pages, 5 figures","J. Appl. Phys. 101 (2007) 043908","10.1063/1.2770819",,"cond-mat.str-el",,"  The switching process of the vortex core in a Permalloy nanodisk affected by
a rotating magnetic field is studied theoretically. A detailed description of
magnetization dynamics is obtained by micromagnetic simulations.
","[{""version"":""v1"",""created"":""Tue, 15 May 2007 14:00:07 GMT""},{""version"":""v2"",""created"":""Mon, 21 May 2007 22:15:45 GMT""}]","2007-08-26"
"0705.2047","Yuri Shtanov","Kirill Krasnov, Yuri Shtanov","Non-Metric Gravity II: Spherically Symmetric Solution, Missing Mass and
  Redshifts of Quasars","39 pages, 2 figures, text slightly extended, references added","Class.Quant.Grav.25:025002,2008","10.1088/0264-9381/25/2/025002",,"gr-qc astro-ph hep-th",,"  We continue the study of the non-metric theory of gravity introduced in
hep-th/0611182 and gr-qc/0703002 and obtain its general spherically symmetric
vacuum solution. It respects the analog of the Birkhoff theorem, i.e., the
vacuum spherically symmetric solution is necessarily static. As in general
relativity, the spherically symmetric solution is seen to describe a black
hole. The exterior geometry is essentially the same as in the Schwarzschild
case, with power-law corrections to the Newtonian potential. The behavior
inside the black-hole region is different from the Schwarzschild case in that
the usual spacetime singularity gets replaced by a singular surface of a new
type, where all basic fields of the theory remain finite but metric ceases to
exist. The theory does not admit arbitrarily small black holes: for small
objects, the curvature on the would-be horizon is so strong that non-metric
modifications prevent the horizon from being formed. The theory allows for
modifications of gravity of very interesting nature. We discuss three physical
effects, namely, (i) correction to Newton's law in the neighborhood of the
source, (ii) renormalization of effective gravitational and cosmological
constants at large distances from the source, and (iii) additional redshift
factor between spatial regions of different curvature. The first two effects
can be responsible, respectively, for the observed anomaly in the acceleration
of the Pioneer spacecraft and for the alleged missing mass in spiral galaxies
and other astrophysical objects. The third effect can be used to propose a
non-cosmological explanation of high redshifts of quasars and gamma-ray bursts.
","[{""version"":""v1"",""created"":""Mon, 14 May 2007 22:55:46 GMT""},{""version"":""v2"",""created"":""Mon, 15 Oct 2007 21:02:03 GMT""}]","2008-11-26"
"0705.2049","Andrea Markelz","Andrea G. Markelz, Joseph R. Knab, Jing Yin Chen, and Yunfen He","Protein Dynamical Transition in Terahertz Dielectric Response",,,"10.1016/j.cplett.2007.05.080",,"physics.bio-ph physics.chem-ph",,"  The 200 K protein dynamical transition is observed for the first time in the
teraherz dielectric response. The complex dielectric permittivity $\epsilon$ =
$\epsilon$' + i$\epsilon$"" is determined in the 0.2 - 2.0 THz and 80-294 K
ranges. $\epsilon$"" has a linear temperature dependence up to 200 K then
sharply increases. The low temperature linear dependence in $\epsilon$""
indicates anharmonicity for temperatures 80 K < T < 180 K, challenging the
assumed harmonicity below 200K. The temperature dependence is consistent with
beta relaxation response and shows the protein motions involved in the
dynamical transition extend to subpicosecond time scales.
","[{""version"":""v1"",""created"":""Mon, 14 May 2007 23:04:51 GMT""}]","2009-11-13"
"0705.2050","Gokhan Bagci","G. B. Bagci","Nonextensive Reaction Rate","6 pages, 1 Figure",,"10.1016/j.physa.2007.06.045",,"cond-mat.stat-mech",,"  The Kramers' survival probability has been generalized by using nonextensive
formalism. This nonextensive survival probability is studied in detail and
associated Kramers' rate has been calculated in the high and low viscosity
limit. It has been showed that the proportionality of nonextensive Kramers'
rate to the nonextensive friction term in the high viscosity limit changes to
inverse proportionality in the low viscosity limit. It has also been observed
that friction constant of nonextensive processes is of rescaled form of the
ordinary frictional term. Since the relation between the ordinary rate and
nonextensive rate is found out to be linear, the Arrhenius nature of the
Kramers' rate is preserved. By using experimental results related to CO
rebinding to myoglobin after photodissociation, we conclude that nonextensivity
plays an important role in protein reactions.
","[{""version"":""v1"",""created"":""Mon, 14 May 2007 23:13:32 GMT""}]","2009-11-13"
"0705.2051","Richard K Bowles","Eduardo Mendez-Villuendas Ivan Saika-Voivod Richard K. Bowles","A Limit of Stability in Supercooled Liquid Clusters","5 pages, 4 figures",,,,"cond-mat.soft cond-mat.stat-mech",,"  We examine the metastable liquid phase of a supercooled gold nanocluster by
studying the free energy landscape using the largest solid-like embryo as an
order parameter. Just below freezing, the free energy exhibits a local minimum
at small embryo sizes and a maximum at larger embryo sizes which denotes the
critical embryo size. At T=660K the free energy becomes a monotonically
decreasing function of the order parameter as the liquid phase becomes
unstable, indicating we have reached a spinodal. In contrast to the usual
mean-field theory predictions, the size of the critical embryo remains finite
as the spinodal is approached. We also calculate the rate of nucleation,
independently from our free energy calculations, and observe a rapid increase
in its temperature dependence when the free energy barrier is in the order of
$kT$. This supports the idea that freezing becomes a barrierless process around
the spinodal temperature.
","[{""version"":""v1"",""created"":""Mon, 14 May 2007 23:18:59 GMT""}]","2007-05-23"
"0705.2052","Takatsugu Masuda","T. Masuda, K. Kakurai, M. Matsuda, K. Kaneko and N. Metoki","Indirect magnetic interaction mediated by spin dimer in
  Cu$_2$Fe$_2$Ge$_4$O$_{13}$","to be published in PRB rapid communication",,"10.1103/PhysRevB.75.220401",,"cond-mat.str-el",,"  Cu$_2$Fe$_2$Ge$_4$O$_{13}$ is a bicomponent compound that consists of Cu
dimers and Fe chains with separate energy scale. By inelastic neutron
scattering technique with high-energy resolution we observed the indirect Fe -
Fe exchange coupling by way of the Cu dimers. The obtained parameters of the
effective indirect interaction and related superexchange interactions are
consistent with those estimated semi-statically. The consistency reveals that
the Cu dimers play the role of nonmagnetic media in the indirect magnetic
interaction.
","[{""version"":""v1"",""created"":""Mon, 14 May 2007 23:20:08 GMT""}]","2009-11-13"
"0705.2053","Gokhan Bagci","G. B. Bagci","Klimontovich`s S theorem in nonextensive formalism and the problem of
  constraints","12 pages, 2 Figures",,,,"cond-mat.stat-mech",,"  Ordinary Boltzmann-Gibbs entropy is inadequate to be used in systems
depending on a control parameter that yield different mean energy values. Such
systems fail to give the correct comparison between the off-equilibrium and
equilibrium entropy values. Klimontovich's S theorem solves this problem by
renormalizing energy and making use of escort distributions. Since nonextensive
thermostatistics is a generalization of Boltzmann-Gibbs entropy, it too
exhibits this same deficiency. In order to remedy this, we present the
nonextensive generalization of Klimontovich's S theorem. We show that this
generalization requires the use of ordinary probability and the associated
relative entropy in addition to the renormalization of energy. Lastly, we
illustrate the generalized S theorem for the Van der Pol oscillator.
","[{""version"":""v1"",""created"":""Mon, 14 May 2007 23:23:03 GMT""}]","2007-05-23"
"0705.2054","Gregg Hallinan","G. Hallinan, S. Bourke, C. Lane, A. Antonova, R. T. Zavala, W. F.
  Brisken, R.P. Boyle, F. J. Vrba, J.G. Doyle, A. Golden","Periodic Bursts of Coherent Radio Emission from an Ultracool Dwarf","12 pages, 3 figures, accepted for publication in ApJ Letters",,"10.1086/519790",,"astro-ph",,"  We report the detection of periodic (p = 1.96 hours) bursts of extremely
bright, 100% circularly polarized, coherent radio emission from the M9 dwarf
TVLM 513-46546. Simultaneous photometric monitoring observations have
established this periodicity to be the rotation period of the dwarf. These
bursts, which were not present in previous observations of this target, confirm
that ultracool dwarfs can generate persistent levels of broadband, coherent
radio emission, associated with the presence of kG magnetic fields in a
large-scale, stable configuration. Compact sources located at the magnetic
polar regions produce highly beamed emission generated by the electron
cyclotron maser instability, the same mechanism known to generate planetary
coherent radio emission in our solar system. The narrow beams of radiation pass
our line of sight as the dwarf rotates, producing the associated periodic
bursts. The resulting radio light curves are analogous to the periodic light
curves associated with pulsar radio emission highlighting TVLM 513-46546 as the
prototype of a new class of transient radio source.
","[{""version"":""v1"",""created"":""Mon, 14 May 2007 23:39:33 GMT""}]","2009-11-13"
"0705.2055","Florin Radu","Florin Radu and Hartmut Zabel","Exchange bias effect of ferro-/antiferromagnetic heterostructures","This contribution will be published as a book chapter in Springer
  :Tracts on Materials Science: ""Magnetic Heterostructures, Advances and
  Perspectives in Spinstructures and Spintransport"", edited by Hartmut Zabel
  and Samuel D. Bader","Springer Tracts in Modern Physics 227, pp. 97-184, 2008","10.1007/978-3-540-73462-8_3",,"cond-mat.mtrl-sci",,"  The exchange bias (EB) effect was discovered 60 years ago by Meiklejohn and
Bean. Meanwhile the EB effect has become an integral part of modern magnetism
with implications for basic research and for numerous device applications. The
EB effect was the first of its kind which relates to an interface effect
between two different classes of materials, here between a ferromagnet and an
antiferromagnet. Here we review fundamental aspects of the exchange bias
effect.
","[{""version"":""v1"",""created"":""Tue, 15 May 2007 00:19:38 GMT""}]","2007-12-22"
"0705.2056","Philip Candelas","Philip Candelas and Xenia de la Ossa","The Zeta-Function of a p-Adic Manifold, Dwork Theory for Physicists","29 pages, 1 figure",,,,"hep-th math.NT",,"  In this article we review the observation, due originally to Dwork, that the
zeta-function of an arithmetic variety, defined originally over the field with
p elements, is a superdeterminant. We review this observation in the context of
a one parameter family of quintic threefolds, and study the zeta-function as a
function of the parameter \phi. Owing to cancellations, the superdeterminant of
an infinite matrix reduces to the (ordinary) determinant of a finite matrix,
U(\phi), corresponding to the action of the Frobenius map on certain cohomology
groups. The parameter-dependence of U(\phi) is given by a relation
U(\phi)=E^{-1}(\phi^p)U(0)E(\phi) with E(\phi) a Wronskian matrix formed from
the periods of the manifold. The periods are defined by series that converge
for $|\phi|_p < 1$. The values of \phi that are of interest are those for which
\phi^p = \phi so, for nonzero \phi, we have |\vph|_p=1. We explain how the
process of p-adic analytic continuation applies to this case. The matrix
U(\phi) breaks up into submatrices of rank 4 and rank 2 and we are able from
this perspective to explain some of the observations that have been made
previously by numerical calculation.
","[{""version"":""v1"",""created"":""Mon, 14 May 2007 23:53:56 GMT""}]","2007-05-23"
"0705.2057","Nikolai Sinitsyn","N. A. Sinitsyn and I. Nemenman","The unified geometric theory of mesoscopic stochastic pumps and
  reversible ratchets","5 pages","Phys. Rev. Lett. 99, 220408 (2007)","10.1103/PhysRevLett.99.220408","LAUR- 07-0243","cond-mat.stat-mech q-bio.QM",,"  We construct a unifying theory of geometric effects in mesoscopic stochastic
kinetics. We demonstrate that the adiabatic pump and the reversible ratchet
effects, as well as similar new phenomena in other domains, such as in
epidemiology, all follow from geometric phase contributions to the effective
action in the stochastic path integral representation of the moment generating
function. The theory provides the universal technique for identification,
prediction and calculation of pump-like phenomena in an arbitrary mesoscopic
stochastic framework.
","[{""version"":""v1"",""created"":""Tue, 15 May 2007 00:01:17 GMT""},{""version"":""v2"",""created"":""Thu, 6 Dec 2007 23:33:01 GMT""}]","2009-11-13"
"0705.2058","David Milovich","David Milovich","Noetherian types of homogeneous compacta and dyadic compacta","30 pages","Topology and its Applications 156 (2008) 443--464","10.1016/j.topol.2008.08.002",,"math.GN math.LO",,"  The Noetherian type of a space is the least $\kappa$ such that it has a base
that is $\kappa$-like with respect to containment. Just as all known
homogeneous compacta have cellularity at most $2^\omega$, they satisfy similar
upper bounds in terms of Noetherian type and related cardinal functions. We
prove these and many other results about these cardinal functions. For example,
every homogeneous dyadic compactum has Noetherian type $\omega$. Assuming GCH,
every point in a homogeneous compactum $X$ has a local base that is $c(X)$-like
with respect to containment. If every point in a compactum has a
well-quasiordered local base, then some point has a countable local $\pi$-base.
","[{""version"":""v1"",""created"":""Tue, 15 May 2007 05:04:24 GMT""}]","2010-01-05"
"0705.2059","Axel de la Macorra","A. de la Macorra and U. Filobello","Interacting Tachyon: generic cosmological evolution for a tachyon and a
  scalar field","13 pages, 5 figures","Phys.Rev.D77:023531,2008","10.1103/PhysRevD.77.023531",,"hep-th",,"  We study the cosmological evolution of a tachyon scalar field T with a
Dirac-Born-Infeld type lagrangian and potential V(T) coupled to a canonically
normalized scalar field \phi with an arbitrary interaction term B(T,\phi) in
the presence of a barotropic fluid $\rb$, which can be matter or radiation. The
force between the barotropic fluid and the scalar fields is only gravitational.
We show that the dynamics is completely determine by only three parameters L1 =
- V_T/ V^{3/2}, L2= - B_T /B^{3/2} and L3 =-B_{\phi}/B. We determine
analytically theconditions for $\lm_i$ under which the energy density of T,
\phi and $\rb$ have the same redshift. We study the behavior of T and \phi in
the asymptotic limits for L_i and we show the numerical solution for different
interesting cases.
  The effective equation of state for the tachyon field changes due to the
interaction with the scalar field and we show that it is possible for a tachyon
field to redshift as matter in the absence of an interaction term B and as
radiation when B is turned on. This result solves then the tachyonic matter
problem.
","[{""version"":""v1"",""created"":""Tue, 15 May 2007 00:04:23 GMT""}]","2008-11-26"
"0705.2060","Thomas Bensby","T. Bensby (1), A.R. Zenn (1), M.S. Oey (1), S. Feltzing (2) ((1) Dept.
  of Astronomy, University of Michigan, Ann Arbor, USA, (2) Lund Observatory,
  Sweden)","Tracing the Galactic thick disk to Solar metallicities","Accepted for publication in ApJ Letters","Astrophys.J.663:L13-L16,2007","10.1086/519792",,"astro-ph",,"  We show that the Galactic thick disk reaches at least solar metallicities,
and that it experienced strong chemical enrichment during a period of ~3 Gyr,
ending around 8-9 Gyr ago. This finding puts further constraints on the
relation and interface between the thin and thick disks, and their formation
processes. Our results are based on a detailed elemental abundance analysis of
261 kinematically selected F and G dwarf stars in the solar neighborhood: 194
likely members of the thick disk and 67 likely members of the thin disk, in the
range -1.3<[Fe/H]<+0.4.
","[{""version"":""v1"",""created"":""Tue, 15 May 2007 02:04:18 GMT""}]","2010-11-11"
"0705.2061","Yutaka Ohira","Yutaka Ohira, Fumio Takahara","Absence of Electron Surfing Acceleration in a Two-Dimensional Simulation","12 pages, 4 figures, accepted for publication in ApJL",,"10.1086/518888",,"astro-ph",,"  Electron acceleration in high Mach number perpendicular shocks is
investigated through two-dimensional electrostatic particle-in-cell (PIC)
simulation. We simulate the shock foot region by modeling particles that
consist of three components such as incident protons and electrons and
reflected protons in the initial state which satisfies the Buneman instability
condition. In contrast to previous one-dimensional simulations in which strong
surfing acceleration is realized, we find that surfing acceleration does not
occur in two-dimensional simulation. This is because excited electrostatic
potentials have a two-dimensional structure that makes electron trapping
impossible. Thus, the surfing acceleration does not work either in itself or as
an injection mechanism for the diffusive shock acceleration. We briefly discuss
implications of the present results on the electron heating and acceleration by
shocks in supernova remnants.
","[{""version"":""v1"",""created"":""Tue, 15 May 2007 00:45:29 GMT""},{""version"":""v2"",""created"":""Wed, 16 May 2007 07:02:23 GMT""}]","2009-11-13"
"0705.2062","Martin B. Halpern","M.B. Halpern","The Orbifolds of Permutation-Type as Physical String Systems at
  Multiples of $\mathbf{c=26}$ V. Cyclic Permutation Orbifolds","46 pages, 4 figures","J.Math.Phys.48:122301,2007","10.1063/1.2824499",,"hep-th math-ph math.MP",,"  I consider the $\mathbb{Z}_\lambda,$ $\lambda$ prime free-bosonic permutation
orbifolds as interacting physical string systems at $\hat{c} = 26\lambda $. As
a first step, I introduce twisted tree diagrams which confirm at the
interacting level that the physical spectrum of each twisted sector is
equivalent to that of an ordinary $c=26$ closed string. The untwisted sectors
are surprisingly more difficult to understand, and there are subtleties in the
sewing of the loops, but I am able to propose provisional forms for the full
modular-invariant cosmological constants and one-loop diagrams with insertions.
","[{""version"":""v1"",""created"":""Tue, 15 May 2007 00:50:48 GMT""},{""version"":""v2"",""created"":""Mon, 7 Jan 2008 00:28:03 GMT""}]","2008-11-26"
"0705.2063","Kerry Soileau","Kerry M. Soileau","The Maximal Integral Domain Generated By A Commutative Ring",,,,,"math.RA math.AC",,"  In this paper, we exhibit the creation of the maximal integral domain mid(R)
generated by a nonzero commutative ring R.
","[{""version"":""v1"",""created"":""Tue, 15 May 2007 01:05:18 GMT""}]","2007-05-23"
"0705.2064","Bo-Qiang Ma","Baogui Lu, Bo-Qiang Ma","EMC effect in semi-inclusive deep-inelastic scattering process","21 latex pages, 15 figures","Phys.Rev.C74:055202,2006","10.1103/PhysRevC.74.055202",,"nucl-th hep-ph nucl-ex",,"  By considering the $x$-dependence of $\pi^+$, $\pi^-$, $K^+$, $K^-$,
$\Lambda$, $\bar{\Lambda}$, $p$, $\bar{p}$ hadron productions in charged lepton
semi-inclusive deep inelastic scattering off nuclear target (using Fe as an
example) and deuteron D target, % at $Q^2=5$ GeV$^2$, we find that
$(\bar{\Lambda}^A/\Lambda^A)/(\bar{\Lambda}^D/\Lambda^D)$ and
$({\bar{p}}^A/{p}^A)/({\bar{p}}^A/p^A)$ are ideal to figure out the nuclear sea
content, which is predicted to be different by different models accounting for
the nuclear EMC effect.
","[{""version"":""v1"",""created"":""Tue, 15 May 2007 01:14:46 GMT""}]","2008-11-26"
"0705.2065","Aaron Harwood","Aaron Harwood, Olga Ohrimenko","Mean Field Models of Message Throughput in Dynamic Peer-to-Peer Systems",,,,,"cs.DC cs.PF",,"  The churn rate of a peer-to-peer system places direct limitations on the rate
at which messages can be effectively communicated to a group of peers. These
limitations are independent of the topology and message transmission latency.
In this paper we consider a peer-to-peer network, based on the Engset model,
where peers arrive and depart independently at random. We show how the arrival
and departure rates directly limit the capacity for message streams to be
broadcast to all other peers, by deriving mean field models that accurately
describe the system behavior. Our models cover the unit and more general k
buffer cases, i.e. where a peer can buffer at most k messages at any one time,
and we give results for both single and multi-source message streams. We define
coverage rate as peer-messages per unit time, i.e. the rate at which a number
of peers receive messages, and show that the coverage rate is limited by the
churn rate and buffer size. Our theory introduces an Instantaneous Message
Exchange (IME) model and provides a template for further analysis of more
complicated systems. Using the IME model, and assuming random processes, we
have obtained very accurate equations of the system dynamics in a variety of
interesting cases, that allow us to tune a peer-to-peer system. It remains to
be seen if we can maintain this accuracy for general processes and when
applying a non-instantaneous model.
","[{""version"":""v1"",""created"":""Tue, 15 May 2007 01:42:44 GMT""}]","2007-05-23"
