"0705.2112","Simonetta Abenda","Simonetta Abenda","Algebraically closed real geodesics on n-dimensional ellipsoids are
  dense in the parameter space and related to hyperelliptic tangential
  coverings","v2: 37 pages, 6 figures v1: 25 pages, 6 figures",,,,"nlin.SI",,"  The closedness condition for real geodesics on n-dimensional ellipsoids is in
general transcendental in the parameters (semiaxes of the ellipsoid and
constants of motion). We show that it is algebraic in the parameters if and
only if both the real and the imaginary geodesics are closed and we
characterize such double--periodicity condition via real hyperelliptic
tangential coverings. We prove the density of algebraically closed geodesics on
n-dimensional ellipsoids with respect to the natural topology in the
(2n)-dimensional real parameter space. In particular, the approximating
sequence of algebraic closed geodesics on the approximated ellipsoids may be
chosen so to share the same values of the length and of the real period vector
as the limiting closed geodesic on the limiting ellipsoid.
  Finally, for real doubly-periodic geodesics on triaxial ellipsoids, we show
how to evaluate algebraically the period mapping and we present some explicit
examples of families of algebraically closed geodesics.
","[{""version"":""v1"",""created"":""Tue, 15 May 2007 15:13:23 GMT""},{""version"":""v2"",""created"":""Tue, 3 Jun 2008 10:33:30 GMT""}]","2008-06-03"
"0705.2113","Valentin V. Khoze","Steven Abel, Stefan Forste, Valentin V. Khoze","Scattering amplitudes in strongly coupled N=4 SYM from semiclassical
  strings in AdS","V3 extended version to appear in JHEP, new figures, clarifications
  and references added. 8 pages and 5 figs","JHEP0802:042,2008","10.1088/1126-6708/2008/02/042","IPPP/07/22, DCPT/07/44","hep-th hep-ph",,"  Very recently in arXiv:0705.0303 Alday and Maldacena gave a string theory
prescription for computing (all) planar amplitudes in N=4 supersymmetric gauge
theory at strong coupling using the AdS/CFT correspondence. These amplitudes
are determined by a classical string solution and contain a universal
exponential factor involving the action of the classical string. On the gauge
theory side, expressions for perturbative amplitudes at strong coupling were
previously proposed only for specific helicities of external particles -- the
maximally helicity violating or MHV amplitudes. These follow from the
exponential ansatz of Bern, Dixon and Smirnov for MHV amplitudes in N=4 SYM. In
this paper we examine the amplitudes dependence on helicities and
particle-types of external states. We consider the prefactor of string
amplitudes and give arguments suggesting that the prefactor at strong coupling
should be the same as the Yang-Mills tree-level amplitude for the same process.
This implies that scattering amplitudes in N=4 SYM simplify dramatically in the
strong coupling limit. It follows from our proposal that in this limit all (MHV
and non-MHV) n-point amplitudes are given by the (known) tree-level Yang-Mills
result times the helicity-independent (and particle-type-independent) universal
exponential.
","[{""version"":""v1"",""created"":""Tue, 15 May 2007 12:06:39 GMT""},{""version"":""v2"",""created"":""Mon, 4 Jun 2007 15:14:17 GMT""},{""version"":""v3"",""created"":""Mon, 4 Feb 2008 19:47:13 GMT""}]","2008-11-26"
"0705.2114","Harri Niemi","K.J. Eskola, H. Niemi and P.V. Ruuskanen","Elliptic flow from pQCD + saturation + hydro model","2 pages, 2 figures, to be presented at the workshop ""Heavy Ion
  Collisions at the LHC: Last Call for Predictions"" at CERN 29 May - 2 June",,,,"hep-ph",,"  We have previously predicted multiplicities and transverse momentum spectra
of hadrons for the most central LHC Pb+Pb collisions at $\sqrt{s_{NN}}=5.5$ TeV
using initial state for hydrodynamic evolution from pQCD + final state
saturation model. By considering binary collision and wounded nucleon profiles
we extend these studies to non-central collisions, and predict the $p_{T}$
dependence of minimum bias $v_{2}$ for pions at the LHC. For protons we also
show how the $p_{T}$ dependence of $v_2$ changes from RHIC to the LHC.
","[{""version"":""v1"",""created"":""Tue, 15 May 2007 11:46:03 GMT""}]","2007-05-23"
"0705.2115","Jan-Erik Solheim","J.-E. Solheim, G. Vauclair, A. S. Mukadam, R. Janulis, V. Dobrovolskas","Abell 43: Longest period Planetary Nebula Nucleus variable","5 pages, 5 figures, to be published in Astronomy and Astrophysics",,"10.1051/0004-6361:20077364",,"astro-ph",,"  Based on 24h high speed photometry of the hybrid PG 1159 star Abell 43, we
have detected 6 sighificant pulsations with periods between 2380 s and 6075 s.
A short (4h) run on the almost spectroscopic twin NGC 7094 central star
resulted in detection of 3 low amplitude pulsations with periods between 2000 s
and 5000 s. The results are close to predictions for g-mode pulsations driven
by the kappa-mechanism induced by the partial ionization of carbon and oxygen.
","[{""version"":""v1"",""created"":""Tue, 15 May 2007 10:56:53 GMT""}]","2009-11-13"
"0705.2116","Hassan Chamati","H Chamati and S Romano","First order phase transitions in classical lattice gas spin models","9 pages, 12 figures","Phys. Rev. B 75, 184413 (2007) (9 pages)","10.1103/PhysRevB.75.184413",,"cond-mat.stat-mech cond-mat.dis-nn",,"  The present paper considers some classical ferromagnetic lattice--gas models,
consisting of particles that carry $n$--component spins ($n=2,3$) and
associated with a $D$--dimensional lattice ($D=2,3$); each site can host one
particle at most, thus implicitly allowing for hard--core repulsion; the pair
interaction, restricted to nearest neighbors, is ferromagnetic, and site
occupation is also controlled by the chemical potential $\mu$. The models had
previously been investigated by Mean Field and Two--Site Cluster treatments
(when D=3), as well as Grand--Canonical Monte Carlo simulation in the case
$\mu=0$, for both D=2 and D=3; the obtained results showed the same kind of
critical behaviour as the one known for their saturated lattice counterparts,
corresponding to one particle per site. Here we addressed by Grand--Canonical
Monte Carlo simulation the case where the chemical potential is negative and
sufficiently large in magnitude; the value $\mu=-D/2$ was chosen for each of
the four previously investigated counterparts, together with $\mu=-3D/4$ in an
additional instance. We mostly found evidence of first order transitions, both
for D=2 and D=3, and quantitatively characterized their behaviour. Comparisons
are also made with recent experimental results.
","[{""version"":""v1"",""created"":""Tue, 15 May 2007 10:59:48 GMT""}]","2007-05-23"
"0705.2117","Hassan Chagani","R. Bisset, M. J. Carson, H. Chagani, D. B. Cline, E. J. Daw, T.
  Ferbel, J. Gao, Y. S. Gao, V. A. Kudryavtsev, P. K. Lightfoot, P. Majewski,
  J. Maxin, J. Miller, W. C. Ooi, M. Robinson, G. Salinas, U. Schroeder, J.
  Seifert, F. Sergiampietri, W. Skulski, P. F. Smith, N. J. C. Spooner, J.
  Toke, H. Wang, J. T. White, F. Wolfs, X. Yang","R & D for Future Zeplin","to appear in Proc. 7th UCLA Symposium on Sources and Detection of
  Dark Matter and Dark Energy in the Universe, 22-24 February, Marina del Rey,
  USA; Nucl. Phys. B Proc. Suppl., in press; 4 pages, 3 figues","Nucl.Phys.Proc.Suppl.173:164-167,2007","10.1016/j.nuclphysbps.2007.08.154",,"astro-ph",,"  We propose a new concept for a very low background multi-ton liquid xenon
Dark Matter experiment. The detector consists of two concentric spheres and a
charge readout device in the centre. Xenon between the two spheres forms a
self-shield and veto device. The inner surface of the central sphere is coated
with CsI to form an internal photocathode with minimum of 2\pi coverage for any
event in the active volume. Photoelectrons from the CsI photocathode drift
toward the charge readout micro-structure in the centre of the detector. Both
scintillation and ionisation are measured simultaneously for background
rejection and 3-D event mapping. In addition to external shielding, the low
background is achieved by eliminating PMTs and by using low radioactivity pure
materials throughout the detector. We present detailed calculations of the
charge readout system and design details. The detector is expected to probe the
full SUSY parameter space.
","[{""version"":""v1"",""created"":""Tue, 15 May 2007 11:02:19 GMT""}]","2009-06-23"
"0705.2118","Todor Gramchev","Todor Gramchev and Andrea Loi","TYZ expansion for the Kepler manifold","27 pages",,,,"math.DG math.CV",,"  The main goal of the paper is to address the issue of the existence of
Kempf's distortion function and the Tian-Yau-Zelditch (TYZ) asymptotic
expansion for the Kepler manifold - an important example of non compact
manfold. Motivated by the recent results for compact manifolds we construct
Kempf's distortion function and derive a precise TYZ asymptotic expansion for
the Kepler manifold. We get an exact formula: finite asymptotic expansion of
$n-1$ terms and exponentially small error terms uniformly with respect to the
discrete quantization parameter $m\to \infty $ and $\rho \to \infty$, $\rho$
being the polar radius in $\C^n$.
  Moreover, the coefficents are calculated explicitly and they turned out to be
homogeneous functions with respect to the polar radius in the Kepler manifold.
We also prove and derive an asymptotic expansion of the obtstruction term with
the coefficients being defined by geometrical quantities. We show that our
estimates are sharp by analyzing the nonharmonic behaviour of $T_m$ and the
error term of the approximation of the Fubini--Study metric by $m\omega$ for
$m\to +\infty$. The arguments of the proofs combine geometrical methods,
quantization tools and functional analytic techniques for investigating
asymptotic expansions in the framework of analytic-Gevrey spaces.
","[{""version"":""v1"",""created"":""Tue, 15 May 2007 11:07:17 GMT""}]","2007-05-23"
"0705.2119","Michel Calame","L. Bernard, M. Calame, S. J. van der Molen, J. Liao and C.
  Schoenenberger","Controlled formation of metallic nanowires via Au nanoparticle ac
  trapping","Nanotechnology 18, 235202 (2007)",,"10.1088/0957-4484/18/23/235202",,"cond-mat.mes-hall",,"  Applying ac voltages, we trapped gold nanoparticles between microfabricated
electrodes under well-defined conditions. We demonstrate that the nanoparticles
can be controllably fused together to form homogeneous gold nanowires with
pre-defined diameters and conductance values. Whereas electromigration is known
to form a gap when a dc voltage is applied, this ac technique achieves the
opposite, thereby completing the toolkit for the fabrication of nanoscale
junctions.
","[{""version"":""v1"",""created"":""Tue, 15 May 2007 14:01:11 GMT""}]","2007-05-23"
"0705.2120","Christopher Allan Watson","C.A. Watson, D. Steeghs, V.S. Dhillon, T. Shahbaz","Imaging the cool stars in the interacting binaries AE Aqr, BV Cen and
  V426 Oph","4 pages, 3 figures. Conference proceedings for the N+N+N Workshop,
  ""From our star to far stars: Variation and Variability"". Accepted for
  publication in Astronomische Nachrichten",,"10.1002/asna.200710800",,"astro-ph",,"  It is well known that magnetic activity in late-type stars increases with
increasing rotation rate. Using inversion techniques akin to medical imaging,
the rotationally broadened profiles from such stars can be used to reconstruct
`Doppler images' of the distribution of cool, dark starspots on their stellar
surfaces. Interacting binaries, however, contain some of the most rapidly
rotating late-type stars known and thus provide important tests of stellar
dynamo models. Furthermore, magnetic activity is thought to play a key role in
their evolution, behaviour and accretion dynamics. Despite this, we know
comparatively little about the magnetic activity and its influence on such
binaries. In this review we summarise the concepts behind indirect imaging of
these systems, and present movies of the starspot distributions on the cool
stars in some interacting binaries. We conclude with a look at the future
opportunities that such studies may provide.
","[{""version"":""v1"",""created"":""Tue, 15 May 2007 11:10:15 GMT""}]","2009-11-13"
"0705.2121","Iwo Bialynicki-Birula","Iwo Bialynicki-Birula and Tomasz Sowinski","Quantum Electrodynamics of qubits","23 pages, 6 figures","Physical Review A 76, 06106 (2007)","10.1103/PhysRevA.76.062106",,"quant-ph",,"  Systematic description of a spin one-half system endowed with magnetic moment
or any other two-level system (qubit) interacting with the quantized
electromagnetic field is developed. This description exploits a close analogy
between a two-level system and the Dirac electron that comes to light when the
two-level system is described within the formalism of second quantization in
terms of fermionic creation and annihilation operators. The analogy enables one
to introduce all the powerful tools of relativistic QED (albeit in a greatly
simplified form). The Feynman diagrams and the propagators turn out to be very
useful. In particular, the QED concept of the vacuum polarization finds its
close counterpart in the photon scattering off a two level-system leading via
the linear response theory to the general formulas for the atomic
polarizability and the dynamic single spin susceptibility. To illustrate the
usefulness of these methods, we calculate the polarizability and susceptibility
up to the fourth order of perturbation theory. These {\em ab initio}
calculations resolve some ambiguities concerning the sign prescription and the
optical damping that arise in the phenomenological treatment. We also show that
the methods used to study two-level systems (qubits) can be extended to
many-level systems (qudits). As an example, we describe the interaction with
the quantized electromagnetic field of an atom with four relevant states: one S
state and three degenerate P states.
","[{""version"":""v1"",""created"":""Tue, 15 May 2007 11:24:13 GMT""},{""version"":""v2"",""created"":""Wed, 12 Dec 2007 11:30:17 GMT""}]","2009-11-13"
"0705.2122","Robert Tautz","R. C. Tautz, I. Lerche","Isolated unstable Weibel modes in unmagnetized plasmas with tunable
  asymmetry","Comments: references added","J.Phys.A40:F677-F684,2007","10.1088/1751-8113/40/29/F04",,"astro-ph",,"  In this letter, an initially unmagnetized pair plasma with asymmetric
velocity distributions is investigated where any unstable Weibel mode must be
isolated, with discrete values for the growth rates and the unstable
wavenumbers. For both a non-relativistic distribution with thermal spread and a
high-relativistic two-stream distribution it is shown that isolated modes are
excited and that, as the asymmetry tends to zero, the growth rate remains
finite, as long as the distribution function is not precisely symmetric.
","[{""version"":""v1"",""created"":""Tue, 15 May 2007 11:30:22 GMT""},{""version"":""v2"",""created"":""Tue, 22 May 2007 13:12:16 GMT""},{""version"":""v3"",""created"":""Tue, 3 Jul 2007 14:12:47 GMT""}]","2013-06-25"
"0705.2123","Hagai B. Perets","Hagai B. Perets, Tal Alexander","Massive perturbers and the efficient merger of binary massive black
  holes","14 pages, 4 figures, 3 tables. More detailed explanations and changes
  in structure. Section on hypervelocity stars moved to another paper (in
  preparation). Results and conclusions unchanged. Accepted to ApJ",,"10.1086/527525",,"astro-ph",,"  We show that dynamical relaxation in the aftermath of a galactic merger and
the ensuing formation and decay of a binary massive black hole (MBH), are
dominated by massive perturbers (MPs) such as giant molecular clouds or
clusters. MPs accelerate relaxation by orders of magnitude relative to 2-body
stellar relaxation alone, and efficiently scatter stars into the binary MBH's
orbit. The 3-body star-binary MBH interactions shrink the binary MBH to the
point where energy losses from the emission of gravitational waves (GW) lead to
rapid coalescence. We model this process based on observed and simulated MP
distributions and take into account the decreased efficiency of the star-binary
MBH interaction due to acceleration in the galactic potential. We show that
mergers of gas-rich galactic nuclei lead to binary MBH coalescence well within
the Hubble time. Moreover, lower-mass binary MBHs (<10^8 Msun) require only a
few percent of the typical gas mass in a post-merger nucleus to coalesce in a
Hubble time. The fate of a binary MBH in a gas poor galactic merger is less
certain, although massive stellar structures (e.g. clusters, stellar rings)
could likewise lead to efficient coalescence. These coalescence events are
observable by their strong GW emission. MPs thus increase the cosmic rate of
such GW events, lead to a higher mass deficit in the merged galactic core and
suppress the formation of triple MBH systems and the resulting ejection of MBHs
into intergalactic space.
","[{""version"":""v1"",""created"":""Tue, 15 May 2007 12:39:31 GMT""},{""version"":""v2"",""created"":""Tue, 4 Dec 2007 06:07:16 GMT""}]","2009-11-13"
"0705.2124","Fabio Zuddas","Andrea Loi and Fabio Zuddas","Extremal metrics on Hartogs domains","14 pages",,,,"math.DG math.CV",,"  An $n$-dimensional Hartogs domain $D_F$ with strongly pseudoconvex boundary
can be equipped with a natural \K metric $g_F$. In this paper we prove that if
$g_F$ is an extremal \K metric then $(D_F, g_F)$ is biholomorphically isometric
to the $n$-dimensional complex hyperbolic space.
","[{""version"":""v1"",""created"":""Tue, 15 May 2007 11:36:40 GMT""}]","2007-05-23"
"0705.2126","Francois De Ferriere","Francois De Ferriere","Improvements to the Psi-SSA representation",,"Published in proceedings for the workshop ""Software and Compilers
  for Embedded Systems (SCOPES) 2007"" (20/04/2007)",,,"cs.PL",,"  Modern compiler implementations use the Static Single Assignment
representation as a way to efficiently implement optimizing algorithms. However
this representation is not well adapted to architectures with a predicated
instruction set. The Psi-SSA representation extends the SSA representation such
that standard SSA algorithms can be easily adapted to an architecture with a
fully predicated instruction set. A new pseudo operation, the Psi operation, is
introduced to merge several conditional definitions into a unique definition.
","[{""version"":""v1"",""created"":""Tue, 15 May 2007 12:06:32 GMT""}]","2007-05-23"
"0705.2127","Ali Ayad","Ali Ayad (IRMAR)","On the complexity of solving ordinary differential equations in terms of
  Puiseux series",,,,"2007-30","math.GM",,"  We prove that the binary complexity of solving ordinary polynomial
differential equations in terms of Puiseux series is single exponential in the
number of terms in the series. Such a bound was given by Grigoriev [10] for
Riccatti differential polynomials associated to ordinary linear differential
operators. In this paper, we get the same bound for arbitrary differential
polynomials. The algorithm is based on a differential version of the
Newton-Puiseux procedure for algebraic equations.
","[{""version"":""v1"",""created"":""Tue, 15 May 2007 12:06:58 GMT""}]","2007-05-23"
"0705.2128","Jean Picard","Jean Picard","A tree approach to $p$-variation and to integration",,"Annals of Probability 36, 6 (2008) 2235-2279","10.1214/07-AOP388",,"math.PR","http://arxiv.org/licenses/nonexclusive-distrib/1.0/","  We consider a real-valued path; it is possible to associate a tree to this
path, and we explore the relations between the tree, the properties of
$p$-variation of the path, and integration with respect to the path. In
particular, the fractal dimension of the tree is estimated from the variations
of the path, and Young integrals with respect to the path, as well as integrals
from the rough paths theory, are written as integrals on the tree. Examples
include some stochastic paths such as martingales, L\'evy processes and
fractional Brownian motions (for which an estimator of the Hurst parameter is
given).
","[{""version"":""v1"",""created"":""Tue, 15 May 2007 12:08:23 GMT""},{""version"":""v2"",""created"":""Thu, 22 Jan 2009 10:59:12 GMT""}]","2009-01-22"
"0705.2129","Evgeny Kurbatov","E.P. Kurbatov","An efficient method for calculation of cooling in Lagrange computational
  gas dynamics","submitted to JCompPhys, 5 pages, 1 figure",,,,"astro-ph",,"  A new method for computation of gas cooling for Lagrange approach is
suggested. The method is based on precalculation of cooling law for known
cooling function. Unlike implicit methods, this method is very efficient, it is
an one-step method which is even more accurate than implicit methods of the
same order.
","[{""version"":""v1"",""created"":""Tue, 15 May 2007 12:10:39 GMT""}]","2007-05-23"
"0705.2130","Alain Corfdir","Alain Corfdir (ENPC-Cermes), Guy Bonnet (LaM)","Validity conditions of the direct boundary integral equation for
  exterior problems of plane elasticity",,"Comptes Rendus Mecanique 335 (2007) 219-224","10.1016/j.crme.2007.03.010",,"physics.class-ph",,"  Writing the boundary integral equation for an exterior problem of elasticity
is subordinate so far to hypotheses on the asymptotical behaviour at infinity
of solutions. The sufficient conditions met in the literature are too
restrictive and do not notably cover the case when the loading has a non zero
resultant force. This difficulty can be removed by considering the problem in
displacements relatively to one point located at a finite distance from the
loading. Finally, this auxiliary problem allows widening the conditions of
validity of the usual formulation of the direct integral method.
","[{""version"":""v1"",""created"":""Tue, 15 May 2007 12:13:35 GMT""}]","2009-11-13"
"0705.2131","Winfried Zimdahl","Winfried Zimdahl","Dark Energy: A Unifying View","9 pages, selected for ""Honorable Mention"" by the Gravity Research
  Foundation","Int.J.Mod.Phys.D17:651-658,2008","10.1142/S0218271808012395",,"gr-qc astro-ph hep-th",,"  Different models of the cosmic substratum which pretend to describe the
present stage of accelerated expansion of the Universe like the $\Lambda$CDM
model or a Chaplygin gas, can be seen as special realizations of a holographic
dark energy cosmology if the option of an interaction between pressurless dark
matter and dark energy is taken seriously. The corresponding interaction
strength parameter plays the role of a cosmological constant. Differences occur
at the perturbative level. In particular, the pressure perturbations are
intrinsically non-adiabatic.
","[{""version"":""v1"",""created"":""Tue, 15 May 2007 12:18:10 GMT""}]","2008-11-26"
"0705.2132","Yair Goldfarb","Yair Goldfarb, Ilan Degani and David, J. Tannor","Semiclassical approximation with zero velocity trajectories","16 pages, 7 figures",,"10.1016/j.chemphys.2007.05.014",,"quant-ph",,"  We present a new semiclassical method that yields an approximation to the
quantum mechanical wavefunction at a fixed, predetermined position. In the
approach, a hierarchy of ODEs are solved along a trajectory with zero velocity.
The new approximation is local, both literally and from a quantum mechanical
point of view, in the sense that neighboring trajectories do not communicate
with each other. The approach is readily extended to imaginary time propagation
and is particularly useful for the calculation of quantities where only local
information is required. We present two applications: the calculation of
tunneling probabilities and the calculation of low energy eigenvalues. In both
applications we obtain excellent agrement with the exact quantum mechanics,
with a single trajectory propagation.
","[{""version"":""v1"",""created"":""Tue, 15 May 2007 12:19:11 GMT""}]","2009-11-13"
"0705.2133","Ying-Qiu Gu","Ying-Qiu Gu","The Exact Solutions to the Gravitational Contraction in Comoving
  Coordinate System","9 pages, 1 figure",,,,"gr-qc astro-ph.SR","http://arxiv.org/licenses/nonexclusive-distrib/1.0/","  The gravitational collapse of a star is a warmly discussed but still puzzling
problem, which not only involves the dynamics of the gases, but also the subtle
coordinate transformation. In this letter, we give some more detailed
investigation on this problem, and reach the results: (I). The comoving
coordinate system for the stellar system is only compatible with the
zero-pressure free falling particles. (II). For the free falling dust, there
are three kind of solutions respectively corresponding to the oscillating, the
critical and the open trajectories. The solution of Oppenheimer and Snyder is
the critical case. (III). All solutions are exactly derived. There is a new
kind singularity in the solution, but its origin is unclear.
","[{""version"":""v1"",""created"":""Tue, 15 May 2007 12:35:47 GMT""},{""version"":""v2"",""created"":""Sat, 25 Apr 2009 03:08:13 GMT""}]","2009-04-30"
