"0706.1879","Masayuki Asaoka","Masayuki Asaoka, Emmanuel Dufraine, and Takeo Noda","Homotopy classes of total foliations and bi-contact structures on
  three-manifolds","27 pages, 13 figures. This is the final version. To appear in Comm.
  Math. Helv",,,,"math.GT","http://arxiv.org/licenses/nonexclusive-distrib/1.0/","  On every compact and orientable three-manifold, we construct total foliations
(three codimension 1 foliations that are transverse at every point). This
construction can be performed on any homotopy class of plane fields with
vanishing Euler class.
  As a corollary we obtain similar results on bi-contact structures.
","[{""version"":""v1"",""created"":""Wed, 13 Jun 2007 12:09:12 GMT""},{""version"":""v2"",""created"":""Mon, 19 Oct 2009 04:56:28 GMT""}]","2009-10-19"
"0706.1880","Elena G. Ferreiro","A. Capella and E. G. Ferreiro","Multiplicities and $J/\psi$ suppression at LHC energies","2 pages, 2 figures. Contributed to Workshop on Heavy Ion Collisions
  at the LHC: Last Call for Predictions, Geneva, Switzerland, 14 May - 8 Jun
  2007",,,,"hep-ph",,"  We present our predictions on multiplicities and $J/\psi$ suppression at LHC
energies. Our results take into account shadowing effects in the initial state
and final state interactions with the hot medium. We obtain 1800 charged
particles at LHC and the $J/\psi$ suppression increases by a factor 5 to 6
compared to RHIC.
","[{""version"":""v1"",""created"":""Wed, 13 Jun 2007 12:01:06 GMT""}]","2007-06-14"
"0706.1881","V. Pomjakushin","A. Podlesnyak, V. Pomjakushin, E. Pomjakushina, K. Conder, and A.
  Furrer","Magnetic excitations in the spin-trimer compounds Ca3Cu3-xNix(PO4)4
  (x=0,1,2)","22 pages (double spacing), 1 table, 9 figures, Submitted to Phys.
  Rev. B (2007)","Phys. Rev. B 76, 064420 (2007)","10.1103/PhysRevB.76.064420",,"cond-mat.other",,"  Inelastic neutron scattering experiments were performed for the spin-trimer
compounds Ca3Cu3-xNix(PO4)4 (x=0,1,2) in order to study the dynamic magnetic
properties. The observed excitations can be associated with transitions between
the low-lying electronic states of linear Cu-Cu-Cu, Cu-Cu-Ni, and Ni-Cu-Ni
trimers which are the basic constituents of the title compounds. The exchange
interactions within the trimers are well described by the Heisenberg model with
dominant antiferromagnetic nearest-neighbor interactions J. For x=0 we find
JCu-Cu=-4.74(2) meV which is enhanced for x=1 to JCu-Cu=-4.92(6) meV. For x=1
and x=2 we find JCu-Ni=-0.85(10) meV and an axial single-ion anisotropy
parameter DNi=-0.7(1) meV. While the x=0 and x=1 compounds do not exhibit
long-range magnetic ordering down to 1 K, the x=2 compound shows
antiferromagnetic ordering below TN=20 K, which is compatible with the
molecular-field parameter 0.63(12) meV derived by neutron spectroscopy.
","[{""version"":""v1"",""created"":""Wed, 13 Jun 2007 12:17:57 GMT""}]","2009-11-13"
"0706.1882","Dmitry Nuzhnyy","S. Kamba, D. Nuzhnyy, P. Vanek, M. Savinov, K. Knizek, Z. Shen, E.
  Santava, K. Maca, M. Sadowski and J. Petzelt","Magnetodielectric effect and optic soft mode behaviour in quantum
  paraelectric EuTiO3 ceramics",,"EPL, 80 (2007) 27002","10.1209/0295-5075/80/27002",,"cond-mat.mtrl-sci",,"  Infrared reflectivity and time-domain terahertz transmission spectra of
EuTiO3 ceramics revealed a polar optic phonon at 6 - 300K, whose softening is
fully responsible for the recently observed quantum paraelectric behaviour.
Even if our EuTiO3 ceramics show lower permittivity than the single crystal due
to a reduced density and/or small amount of secondary pyrochlore Eu2Ti2O7
phase, we confirmed the magnetic field dependence of the permittivity, also
slightly smaller than in single crystal. Attempt to reveal the soft phonon
dependence at 1.8K on the magnetic field up to 13T remained below the accuracy
of our infrared reflectivity experiment.
","[{""version"":""v1"",""created"":""Wed, 13 Jun 2007 12:32:28 GMT""},{""version"":""v2"",""created"":""Thu, 2 Aug 2007 13:57:51 GMT""},{""version"":""v3"",""created"":""Mon, 24 Sep 2007 14:56:58 GMT""}]","2007-09-24"
"0706.1883","Philip Brydon","P. M. R. Brydon","Slave boson theory of the extended Falicov-Kimball model","23 pages, 10 figures","Phys. Rev. B 77, 045109 (2008)","10.1103/PhysRevB.77.045109",,"cond-mat.str-el",,"  The extended Falicov-Kimball model, with both an on-site hybridization
potential and dispersive narrow band, is examined within the saddle-point
approximation to the Kotliar-Ruckenstein slave boson theory. We first set the
hybridization potential to zero and find that the phase diagram depends
strongly upon the orbital structure: for degenerate orbitals, a
correlated-insulating state is found at sufficiently strong interaction
strengths, whereas a finite orbital energy difference can lead to discontinuous
valence transitions. The obtained phase diagram is very sensitive to the
presence of a finite hybridization potential. As in Hartree-Fock theory, we
find an enhancement of the hybridization by the inter-orbital Coulomb
repulsion. The more precise treatment of correlation effects, however, leads to
large deviations from the Hartree-Fock results. In the limit of vanishing
hybridization an excitonic insulator state is only found when the orbitals are
degenerate, which restricts this phase to a much smaller parameter space than
in other available mean-field theories.
","[{""version"":""v1"",""created"":""Wed, 13 Jun 2007 12:20:07 GMT""}]","2009-01-26"
"0706.1884","Bernd Beschoten","L. Schreiber, M. Heidkamp, T. Rohleder, B. Beschoten, G. G\""untherodt","Mapping of spin lifetimes to electronic states in n-type GaAs near the
  metal-insulator transition","4 pages, 4 figures",,,,"cond-mat.mtrl-sci",,"  The longest spin lifetimes in bulk n-GaAs exceed 100 ns for doping
concentrations near the metal-insulator transition (J.M. Kikkawa, D.D.
Awschalom, Phys. Rev. Lett. 80, 4313 (1998)). The respective electronic states
have yet not been identified. We therefore investigate the energy dependence of
spin lifetimes in n-GaAs by time-resolved Kerr rotation. Spin lifetimes vary by
three orders of magnitude as a function of energy when occupying donor and
conduction band states. The longest spin lifetimes (>100 ns) are assigned to
delocalized donor band states, while conduction band states exhibit shorter
spin lifetimes. The occupation of localized donor band states is identified by
short spin lifetimes (~300 ps) and a distinct Overhauser shift due to dynamic
nuclear polarization.
","[{""version"":""v1"",""created"":""Wed, 13 Jun 2007 12:27:03 GMT""}]","2007-06-14"
"0706.1885","Nicholas Schurch","N. J. Schurch (1) and C. Done (1) ((1) University of Durham, Durham,
  UK)","The impact of accretion disk winds on the X-ray spectrum of AGN: Part 1
  - XSCORT","14 pages, 9 figures (colour), Accepted for publication in MNRAS (13th
  Aug 2007). Several significant changes to the text from v1",,"10.1111/j.1365-2966.2007.12336.x",,"astro-ph",,"  (abridged) The accretion disk in AGN is expected to produce strong outflows,
in particular a UV-line driven wind. Despite providing a good fit to the data,
current spectral models of the X-ray spectrum of AGN observed through an
accretion disk wind are ad-hoc in their treatment of the properties of the wind
material. In order to address these limitations we adopt a numerical
computation method that links a series of radiative transfer calculations,
incorporating the effect of a global velocity field in a self-consistent manner
(XSCORT). We present a series of example spectra from the XSCORT code that
allow us to examine the shape of AGN X-ray spectra seen through a wind, for a
range of velocity and density distributions, total column densities and initial
ionization parameters. These detailed spectral models clearly show considerable
complexity and structure that is strongly affected by all these factors. The
presence of sharp features in the XSCORT spectra contrasts strongly with both
the previous models and with the smooth nature of the observed X-ray spectra of
AGN with soft X-ray excesses, demonstrating that accretion disk winds are
unlikely to be the origin of this mysterious spectral feature. The most
significant parameter affecting the presence of the sharp features in the
models is the terminal velocity of the wind. Increasing the terminal velocity
of the absorbing material to ~c, and hence dramatically increasing the velocity
dispersion across the wind, could potentially remove these features resulting
in a spectrum similar to the previous models. Such a fast moving outflow cannot
be associated with a radiatively driven accretion disk wind, however the
presence of a highly relativistic jet may provide an origin for such material.
","[{""version"":""v1"",""created"":""Wed, 13 Jun 2007 12:28:00 GMT""},{""version"":""v2"",""created"":""Wed, 15 Aug 2007 14:43:47 GMT""}]","2009-11-13"
"0706.1886","Victor Katsnelson","Victor Katsnelson","On Transformation of Potapov's Fundamental Matrix Inequality",,"Topics in Interpolatory Theory. Operator Theory: Advances and
  Applications, Vol.95, Birkhauser 1997",,,"math.CA",,"  According to V.P.Potapov, a classical interpolation problem can be
reformulated in terms of a so-called Fundamental Matrix Inequality (FMI). To
show that every solution of the FMI satisfies the interpolation problem, we
usualy have to transform the FMI in some special way. In this paper the number
of of transformations of the FMI which come into play are motivated and
demonstrated by simple, but typical examples.
","[{""version"":""v1"",""created"":""Wed, 13 Jun 2007 12:32:26 GMT""}]","2007-06-14"
"0706.1887","Max Dohse","Max Dohse","Configuration Space Methods and Time Ordering for Scalar Propagators in
  (Anti and) de Sitter Spacetimes","master thesis, 111 pages, 35 figures, PDF-LaTeX, typos and minor
  errors corrected, minor explanations and one reference added",,,,"hep-th",,"  In this master thesis a configuration space method presented by C. Dullemond
and E. van Beveren for computing all propagators of a scalar field (Wightman,
Hadamard and Schwinger functions,retarded, advanced and Feynman propagator) is
reviewed for four-dimensional Minkowski and Anti de Sitter spacetime AdS_4.
This method is then applied for AdS_d as well as de Sitter spacetime dS_d of
arbitrary dimension d, obtaining results in agreement with the literature. The
advantages of the method are that it needs neither mode summation nor analytic
continuation from euclidean time, while delivering the propagators above
including (i-epsilon)-prescription, plus as a nice bonus the conformal
dimension of a corresponding CFT field. General properties of the considered
spacetimes (namely various coordinate systems and their metrics, chordal
distances, relations between conformal dimensions \Delta and the mass m of the
scalar field, geodesics and the invariance of time ordering) are also examined
and compiled from various sources, providing an overview of geometrical
properties of AdS and dS spacetimes.
","[{""version"":""v1"",""created"":""Wed, 13 Jun 2007 12:32:28 GMT""},{""version"":""v2"",""created"":""Sun, 17 Jun 2007 18:24:23 GMT""},{""version"":""v3"",""created"":""Wed, 11 Jul 2007 14:57:55 GMT""},{""version"":""v4"",""created"":""Wed, 29 Aug 2007 07:34:58 GMT""}]","2007-08-29"
"0706.1888","Maxim Trushin","Maxim Trushin and John Schliemann","Minimum Electrical and Thermal Conductivity of Graphene: A
  Quasiclassical Approach","4 pages 1 figure (final version, as published in PRL)","Phys. Rev. Lett. v.99, 216602 (2007)","10.1103/PhysRevLett.99.216602",,"cond-mat.mes-hall cond-mat.mtrl-sci",,"  We investigate the minimum conductivity of graphene within a quasiclassical
approach taking into account electron-hole coherence effects which stem from
the chiral nature of low energy excitations. Relying on an analytical solution
of the kinetic equation in the electron-hole coherent and incoherent cases we
study both the electrical and thermal conductivity whose relation fullfills
Wiedemann-Franz law. We found that the most of the previous findings based on
the Boltzmann equation are restricted to only high mobility samples where
electron-hole coherence effects are not sufficient.
","[{""version"":""v1"",""created"":""Wed, 13 Jun 2007 12:38:57 GMT""},{""version"":""v2"",""created"":""Thu, 13 Sep 2007 12:54:38 GMT""},{""version"":""v3"",""created"":""Fri, 23 Nov 2007 10:59:43 GMT""}]","2011-11-10"
"0706.1889","Richard Wunsch","R. Wunsch, S. Silich, J. Palous, G. Tenorio-Tagle","Super stellar clusters with a bimodal hydrodynamic solution: an
  Approximate Analytic Approach","5 pages, 4 figures, accepted by A&A",,"10.1051/0004-6361:20077282",,"astro-ph",,"  We look for a simple analytic model to distinguish between stellar clusters
undergoing a bimodal hydrodynamic solution from those able to drive only a
stationary wind. Clusters in the bimodal regime undergo strong radiative
cooling within their densest inner regions, which results in the accumulation
of the matter injected by supernovae and stellar winds and eventually in the
formation of further stellar generations, while their outer regions sustain a
stationary wind. The analytic formulae are derived from the basic hydrodynamic
equations. Our main assumption, that the density at the star cluster surface
scales almost linearly with that at the stagnation radius, is based on results
from semi-analytic and full numerical calculations. The analytic formulation
allows for the determination of the threshold mechanical luminosity that
separates clusters evolving in either of the two solutions. It is possible to
fix the stagnation radius by simple analytic expressions and thus to determine
the fractions of the deposited matter that clusters evolving in the bimodal
regime blow out as a wind or recycle into further stellar generations.
","[{""version"":""v1"",""created"":""Wed, 13 Jun 2007 12:40:34 GMT""}]","2009-11-13"
"0706.1890","Alexander Povolotsky","A.M. Povolotsky, V.B. Priezzhev","Determinant solution for the Totally Asymmetric Exclusion Process with
  parallel update II. Ring geometry","28 pages, 3 figures","J. Stat. Mech. (2007) P08018","10.1088/1742-5468/2007/08/P08018",,"cond-mat.stat-mech math-ph math.MP",,"  Using the Bethe ansatz we obtain the determinant expression for the time
dependent transition probabilities in the totally asymmetric exclusion process
with parallel update on a ring. Developing a method of summation over the roots
of Bethe equations based on the multidimensional analogue of the Cauchy residue
theorem, we construct the resolution of the identity operator, which allows us
to calculate the matrix elements of the evolution operator and its powers.
Representation of results in the form of an infinite series elucidates
connection to other results obtained for the ring geometry. As a byproduct we
also obtain the generating function of the joint probability distribution of
particle configurations and the total distance traveled by the particles.
","[{""version"":""v1"",""created"":""Wed, 13 Jun 2007 12:42:35 GMT""},{""version"":""v2"",""created"":""Mon, 10 Sep 2007 12:59:43 GMT""}]","2007-09-10"
"0706.1891","Martin Lemoine","Kumiko Kotera, Martin Lemoine (IAP)","Inhomogeneous extragalactic magnetic fields and the second knee in the
  cosmic ray spectrum","15 pages, 10 figures. Version to appear in PRD (minor changes)","Phys.Rev.D77:023005,2008","10.1103/PhysRevD.77.023005",,"astro-ph",,"  Various experiments indicate the existence of a second knee around energy
E=3.10^{17} eV in the cosmic ray spectrum. This feature could be the signature
of the end of the galactic component and of the emergence of the extragalactic
one, provided that the latter cuts off at low energies. Recent analytical
calculations have shown that this cut-off could be a consequence of the
existence of extragalactic magnetic fields: low energy protons diffuse on
extragalactic magnetic fields and cannot reach the observer within a given
time. We study the influence of inhomogeneous magnetic fields on the magnetic
horizon, using a new semi-analytical propagation code. Our results indicate
that, at a fixed value of the volume averaged magnetic field <B>, the amplitude
of the low energy cut-off is mainly controled by the strength of magnetic
fields in the voids of the large scale structure distribution.
","[{""version"":""v1"",""created"":""Wed, 13 Jun 2007 12:50:45 GMT""},{""version"":""v2"",""created"":""Fri, 4 Jan 2008 16:17:09 GMT""}]","2008-12-18"
"0706.1892","Michal Sedl\'ak","Michal Sedlak, Mario Ziman, Ondrej Pribyla, Vladimir Buzek and Mark
  Hillery","Unambiguous coherent state identification: Searching a quantum database","version accepted for publication, 12 pages, 3 figures","Phys. Rev. A 76, 022326 (2007)","10.1103/PhysRevA.76.022326",,"quant-ph",,"  We consider an unambiguous identification of an unknown coherent state with
one of two unknown coherent reference states. Specifically, we consider two
modes of an electromagnetic field prepared in unknown coherent states alpha_1
and alpha_2, respectively. The third mode is prepared either in the state
alpha_1 or in the state alpha_2. The task is to identify (unambiguously) which
of the two modes are in the same state. We present a scheme consisting of three
beamsplitters capable to perform this task. Although we don't prove the
optimality, we show that the performance of the proposed setup is better than
the generalization of the optimal measurement known for a finite-dimensional
case. We show that a single beamsplitter is capable to perform an unambiguous
quantum state comparison for coherent states optimally. Finally we propose an
experimental setup consisting of 2N-1 beamsplitters for unambiguous
identification among N unknown coherent states. This setup can be considered as
a search in a quantum database. The elements of the database are unknown
coherent states encoded in different modes of an electromagnetic field. The
task is to specify the two modes that are excited in the same, though unknown,
coherent state.
","[{""version"":""v1"",""created"":""Wed, 13 Jun 2007 12:53:53 GMT""},{""version"":""v2"",""created"":""Mon, 23 Jul 2007 17:47:49 GMT""}]","2008-12-11"
"0706.1893","Susha Parameswaran","S.L. Parameswaran, S. Randjbar-Daemi and A. Salvio","Stability and Negative Tensions in 6D Brane Worlds","28 pages, 2 figures","JHEP 0801:051,2008","10.1088/1126-6708/2008/01/051",,"hep-th",,"  We investigate the dynamical stability of warped, axially symmetric
compactifications in anomaly free 6D gauged supergravity. The solutions have
conical defects, which we source by 3-branes placed on orbifold fixed points,
and a smooth limit to the classic sphere-monopole compactification. Like for
the sphere, the extra fields that are generically required by anomaly freedom
are especially relevant for stability. With positive tension branes only, there
is a strict stability criterion (identical to the sphere case) on the charges
present under the monopole background. Thus brane world models with positive
tensions can be embedded into anomaly free theories in only a few ways.
Meanwhile, surprisingly, in the presence of a negative tension brane the
stability criteria can be relaxed. We also describe in detail the geometries
induced by negative tension codimension two branes.
","[{""version"":""v1"",""created"":""Wed, 13 Jun 2007 14:06:10 GMT""}]","2009-11-18"
"0706.1894","Mikhail Shaposhnikov","Mikhail Shaposhnikov","How to find sterile neutrinos ?","16 pages, Talk given at 12th International Workshop on Neutrinos
  Telescopes: Twenty Years after the Supernova 1987A Neutrino Bursts Discovery,
  Venice, Italy, 6-9 Mar 2007",,,,"hep-ph",,"  We describe an extention of the Standard Model (the $\nu$MSM) by three light
singlet Majorana fermions -- sterile neutrinos, which allows to address
simultaneously the problem of neutrino oscillations and the problems of dark
matter and baryon asymmetry of the Universe. We discuss the ways these new
particles can be searched for in astrophysical, laboratory, and accelerator
experiments.
","[{""version"":""v1"",""created"":""Wed, 13 Jun 2007 13:04:23 GMT""}]","2007-06-14"
"0706.1895","Markus Rauscher","R. Fetzer, M. Rauscher, R. Seemann, K. Jacobs, K. Mecke","Thermal noise influences fluid flow in thin films during spinodal
  dewetting","4 pages, 3 figures",,"10.1103/PhysRevLett.99.114503",,"cond-mat.soft cond-mat.stat-mech",,"  Experiments on dewetting thin polymer films confirm the theoretical
prediction that thermal noise can strongly influence characteristic time-scales
of fluid flow and cause coarsening of typical length scales. Comparing the
experiments with deterministic simulations, we show that the Navier-Stokes
equation has to be extended by a conserved bulk noise term to accomplish the
observed spectrum of capillary waves. Due to thermal fluctuations the spectrum
changes from an exponential to a power law decay for large wavevectors. Also
the time evolution of the typical wavevector of unstable perturbations exhibits
noise induced coarsening that is absent in deterministic hydrodynamic flow.
","[{""version"":""v1"",""created"":""Wed, 13 Jun 2007 13:21:13 GMT""}]","2009-11-13"
"0706.1896","Victor Katsnelson","Victor Katsnelson, Alexander Kheifets, Peter Yuditskii","An Abstract Interpolation Problem and the Extension Theory of Hermitian
  Operators",,"Topics in Interpolation Theory. Operator Theory: advances and
  Applications, Vol. 95. Birkhauser, 1997",,,"math.FA",,"  The algebraic structure of V.P. Potapov's Fundamental Matrix Inequality (FMI)
is discussed and its interpolation meaning is analyzed. Functional model spaces
are involved. A general Abstract Interpolation Problem is formulated which
seems to cover all the classical and recent problems in the field and the
solution set of this problem is described using the Arov--Grossman formula. The
extension theory of isometric operators is the proper language for treating
interpolation problems of this type.
","[{""version"":""v1"",""created"":""Wed, 13 Jun 2007 13:27:46 GMT""}]","2007-06-14"
"0706.1897","Jaime Merino","Jaime Merino (Universidad Autonoma de Madrid)","Non-local correlations in metals close to a charge order insulator
  transition","4 pages, 6 Figures, accepted for publication in Physical Review
  Letters","Phys. Rev. Lett. 99, 036404 (2007)","10.1103/PhysRevLett.99.036404",,"cond-mat.str-el",,"  The charge ordering transition induced by the nearest-neighbor Coulomb
repulsion, V, in the 1/4-filled extended Hubbard model is investigated using
Cellular Dynamical Mean-Field Theory. We find a transition to a strongly
renormalized charge ordered Fermi liquid at VCO and a metal-to-insulator
transition at VMI>VCO. Short range antiferromagnetism occurs concomitanly with
the CO transition. Approaching the charge ordered insulator the Fermi surface
deforms and the scattering rate of electrons develops momentum dependence on
the Fermi surface.
","[{""version"":""v1"",""created"":""Wed, 13 Jun 2007 13:27:48 GMT""}]","2009-11-13"
"0706.1898","Efe Yazgan","E. Yazgan, J. Damgov, N. Akchurin, V. Genchev, D. Green, S. Kunori, M.
  Schmitt, W. Wu, M. T. Zeyrek","Search for a Standard Model Higgs Boson in CMS via Vector Boson Fusion
  in the H->WW->l\nu l\nu Channel","26 pages, 22 figures","Eur.Phys.J.C53:329-347,2008","10.1140/epjc/s10052-007-0485-2","CMS NOTE-2007_011","hep-ex",,"  We present the potential for discovering the Standard Model Higgs boson
produced by the vector-boson fusion mechanism. We considered the decay of Higgs
bosons into the W+W- final state, with both W-bosons subsequently decaying
leptonically. The main background is ttbar with one or more jets produced. This
study is based on a full simulation of the CMS detector, and up-to-date
reconstruction codes. The result is that a signal of 5 sigma significance can
be obtained with an integrated luminosity of 12-72 1/fb for Higgs boson masses
between 130-200 GeV. In addition, the major background can be measured directly
to 7% from the data with an integrated luminosity of 30 1/fb. In this study, we
also suggested a method to obtain information in Higgs mass using the
transverse mass distributions.
","[{""version"":""v1"",""created"":""Wed, 13 Jun 2007 13:35:57 GMT""}]","2008-11-26"
"0706.1899","Lorenzo Fatibene","L. Fatibene, M. Francaviglia, C. Rovelli","Spacetime Lagrangian Formulation of Barbero-Immirzi Gravity","12 pages, no figures","Class.Quant.Grav.24:4207-4218,2007","10.1088/0264-9381/24/16/014",,"gr-qc",,"  We shall here discuss a new spacetime gauge-covariant Lagrangian formulation
of General Relativity by means of the Barbero-Immirzi SU(2)-connection on
spacetime. To the best of our knowledge the Lagrangian based on SU(2) spacetime
fields seems to appear here for the first time.
","[{""version"":""v1"",""created"":""Wed, 13 Jun 2007 13:39:53 GMT""}]","2008-11-26"
