"0706.1815","Francesco Buscemi Dr","Francesco Buscemi","Entanglement measures and approximate quantum error correction","7 pages, two-columned revtex4, no figures. v1: Deeply revised and
  extended version: different entanglement measures are separately considered,
  references are added, and some remarks are stressed. v2: Added a sufficient
  condition for distillability in terms of entanglement of formation; published
  version","Phys. Rev. A 77, 012309 (2008)","10.1103/PhysRevA.77.012309",,"quant-ph",,"  It is shown that, if the loss of entanglement along a quantum channel is
sufficiently small, then approximate quantum error correction is possible,
thereby generalizing what happens for coherent information. Explicit bounds are
obtained for the entanglement of formation and the distillable entanglement,
and their validity naturally extends to other bipartite entanglement measures
in between. Robustness of derived criteria is analyzed and their tightness
compared. Finally, as a byproduct, we prove a bound quantifying how large the
gap between entanglement of formation and distillable entanglement can be for
any given finite dimensional bipartite system, thus providing a sufficient
condition for distillability in terms of entanglement of formation.
","[{""version"":""v1"",""created"":""Wed, 13 Jun 2007 03:05:39 GMT""},{""version"":""v2"",""created"":""Tue, 24 Jul 2007 05:32:38 GMT""},{""version"":""v3"",""created"":""Tue, 15 Jan 2008 00:38:39 GMT""}]","2008-01-15"
"0706.1816","Marianna Safronova","U. I. Safronova, W. R. Johnson, and M. S. Safronova","Excitation energies, polarizabilities, multipole transition rates, and
  lifetimes of ions along the francium isoelectronic sequence","13 figures, 11 tables",,"10.1103/PhysRevA.76.042504",,"physics.atom-ph",,"  Relativistic many-body perturbation theory is applied to study properties of
ions of the francium isoelectronic sequence. Specifically, energies of the 7s,
7p, 6d, and 5f states of Fr-like ions with nuclear charges Z = 87 - 100 are
calculated through third order; reduced matrix elements, oscillator strengths,
transition rates, and lifetimes are determined for 7s - 7p, 7p - 6d, and 6d -
5f electric-dipole transitions; and 7s - 6d, 7s - 5f, and 5f_5/2 - 5f_7/2
multipole matrix elements are evaluated to obtain the lifetimes of low-lying
excited states. Moreover, for the ions Z = 87 - 92 calculations are also
carried out using the relativistic all-order single-double method, in which
single and double excitations of Dirac-Fock wave functions are included to all
orders in perturbation theory. With the aid of the SD wave functions, we obtain
accurate values of energies, transition rates, oscillator strengths, and the
lifetimes of these six ions. Ground state scalar polarizabilities in Fr I, Ra
II, Ac III, and Th IV are calculated using relativistic third-order and
all-order methods. Ground state scalar polarizabilities for other Fr-like ions
are calculated using a relativistic second-order method. These calculations
provide a theoretical benchmark for comparison with experiment and theory.
","[{""version"":""v1"",""created"":""Wed, 13 Jun 2007 03:10:54 GMT""}]","2009-11-13"
"0706.1818","Jeremy Goodman","Jeremy Goodman and Andrew I. MacFadyen","Ultra-relativistic geometrical shock dynamics and vorticity","12 pages, 2 figures",,"10.1017/S0022112008001249",,"astro-ph",,"  Geometrical shock dynamics, also called CCW theory, yields approximate
equations for shock propagation in which only the conditions at the shock
appear explicitly; the post-shock flow is presumed approximately uniform and
enters implicitly via a Riemann invariant. The nonrelativistic theory,
formulated by G. B. Whitham and others, matches many experimental results
surprisingly well. Motivated by astrophysical applications, we adapt the theory
to ultra-relativistic shocks advancing into an ideal fluid whose pressure is
negligible ahead of the shock, but one third of its proper energy density
behind the shock. Exact results are recovered for some self-similar cylindrical
and spherical shocks with power-law pre-shock density profiles. Comparison is
made with numerical solutions of the full hydrodynamic equations. We review
relativistic vorticity and circulation. In an ultrarelativistic ideal fluid,
circulation can be defined so that it changes only at shocks, notwithstanding
entropy gradients in smooth parts of the flow.
","[{""version"":""v1"",""created"":""Wed, 13 Jun 2007 03:28:55 GMT""}]","2015-05-13"
"0706.1819","Jeremy Goodman","Lorenzo Sironi and Jeremy Goodman","Production of magnetic energy by macroscopic turbulence in GRB
  afterglows","24 pages, 3 figures",,"10.1086/523636",,"astro-ph",,"  Afterglows of gamma-ray bursts are believed to require magnetic fields much
stronger than that of the compressed pre-shock medium. As an alternative to
microscopic plasma instabilities, we propose amplification of the field by
macroscopic turbulence excited by the interaction of the shock with a clumpy
pre-shock medium, for example a stellar wind. Using a recently developed
formalism for localized perturbations to an ultra-relativistic shock, we derive
constraints on the lengthscale, amplitude, and volume filling factor of density
clumps required to produce a given magnetic energy fraction within the
expansion time of the shock, assuming that the energy in the field achieves
equipartion with the turbulence. Stronger and smaller-scale inhomogeneities are
required for larger shock Lorentz factors. Hence it is likely that the magnetic
energy fraction evolves as the shock slows. This could be detected by
monitoring the synchrotron cooling frequency if the radial density profile
ahead of the shock, smoothed over clumps, is known.
","[{""version"":""v1"",""created"":""Wed, 13 Jun 2007 03:41:43 GMT""}]","2009-11-13"
"0706.1820","Muhammad Sharif","M. Sharif","The Pseudo-Newtonian Force and Potential about a Higher Dimensional
  Rotating Black Hole","11 pages, accepted for publication in Nuovo Cimento B","Nuovo Cim.B122:343-350,2007","10.1393/ncb/i2007-10365-y",,"gr-qc",,"  In this paper, we study the behavior of the pseudo-Newtonian force and
potential about a higher dimensional rotating black hole. We obtain conditions
for the force character from an attractive to repulsive. We also find the
conditions under which force attains a maximum value. The results of this paper
generalizes the already found structure of force and potential about a five
dimensional rotating black hole. It is interesting to note that we recover the
five dimensional results under a special case.
","[{""version"":""v1"",""created"":""Wed, 13 Jun 2007 04:50:01 GMT""}]","2010-11-11"
"0706.1821","Yutaka Yoshikawa","Yutaka Yoshikawa, Kazuyuki Nakayama, Yoshio Torii, and Takahiro Kuga","Holographic storage of multiple coherence gratings in a Bose-Einstein
  condensate","5 pages, 4 figures","Phys. Rev. Lett. 99, 220407 (2007)","10.1103/PhysRevLett.99.220407",,"physics.atom-ph",,"  We demonstrate superradiant conversion between a two-mode collective atomic
state and a single-mode light field in an elongated cloud of Bose-condensed
atoms. Two off-resonant write beams induce superradiant Raman scattering,
producing two independent coherence gratings with a different wave vector in
the cloud. By applying phase-matched read beams after a controllable delay, the
gratings can be selectively converted into the light field also in a
superradiant way. Due to the large cooperativity parameter and the small
velocity width of the condensate, a high conversion efficiency of $> 70$ % and
a long storage time of $> 120$ $\mu$s were achieved.
","[{""version"":""v1"",""created"":""Wed, 13 Jun 2007 05:04:47 GMT""},{""version"":""v2"",""created"":""Sat, 1 Dec 2007 15:12:50 GMT""}]","2009-11-13"
"0706.1823","Hanqing Zheng","Ming-Xian Su, L. Y. Xiao and H. Q. Zheng","On the scalar nonet in the extended Nambu Jona-Lasinio model","23 pages 3 eps figures, To appear in Nucl. Phys. A","Nucl.Phys.A792:288-305,2007","10.1016/j.nuclphysa.2007.06.004",,"hep-ph nucl-th",,"  We discuss the lightest scalar resonances, $f_0(600)$, $\kappa(800)$,
$a_0(980)$ and $f_0(980)$ in the extended Nambu Jona-Lasinio model. We find
that the model parameters can be tuned, but unnaturally, to accommodate for
those scalars except the $f_0(980)$. We also discuss problems encountered in
the K Matrix unitarization approximation by using $N_c$ counting technique.
","[{""version"":""v1"",""created"":""Wed, 13 Jun 2007 05:26:17 GMT""}]","2008-11-26"
"0706.1825","Subir Mukhopadhyay","Alok Kumar, Subir Mukhopadhyay, Koushik Ray","Forbidden territories in the string landscape","18 pages, LaTeX, significantly expanded to incorporate some more
  cases","JHEP 0712:032,2007","10.1088/1126-6708/2007/12/032",,"hep-th",,"  Problems of stabilizing moduli of the type--IIB string theory on toroidal
orientifolds $\T^6/\Z_2$, in presence of worldvolume fluxes on various
D-branes, are considered. For $Z_2$ actions, introducing either O9 or O3
planes, we rule out the possibility of moduli stabilization in a wide class of
models with $\mathcal{N}=1$ supersymmetry, characterized by the type of fluxes
turned on along D-brane worldvolume. Our results, in particular, imply that
Abelian worldvolume fluxes can not by themselves stabilize closed string
moduli, in a consistent supersymmtric model, for above orientifold
compactifications. We also discuss other $Z_2$ orientifolds of $T^6$ and show
that certain other brane wrappings are also ruled out by similar consistency
requirements. In specific setups we consider examples with D9-branes wrapping
on a complex three-torus with its world-volume fluxes taken to be
semi-homogeneous bundles and D7-branes wrapping holomorphic four-cycles of the
complex three-torus carrying world-volume fluxes.
","[{""version"":""v1"",""created"":""Wed, 13 Jun 2007 14:00:36 GMT""},{""version"":""v2"",""created"":""Tue, 19 Jun 2007 12:51:26 GMT""},{""version"":""v3"",""created"":""Mon, 10 Dec 2007 12:17:02 GMT""}]","2009-11-18"
"0706.1826","Farhad  Jafarpour Hamadani","F. H. Jafarpour and P. Khaki","A Family of Exactly-Solvable Driven-Diffusive Systems in One-dimension","8 Pages","J. Phys. A: Math. Theor. 40 No 44 (2 November 2007) 13237-13243","10.1088/1751-8113/40/44/005",,"cond-mat.stat-mech",,"  We introduce an exactly-solvable family of one-dimensional driven-diffusive
systems defined on a discrete lattice. We find the quadratic algebra of this
family which has an infinite-dimensional representation. We discuss the phase
diagram of the system in a couple of special cases.
","[{""version"":""v1"",""created"":""Wed, 13 Jun 2007 05:55:59 GMT""},{""version"":""v2"",""created"":""Wed, 24 Oct 2007 19:19:35 GMT""}]","2009-11-13"
"0706.1827","Alonso Arellano-Baeza A","A. A. Arellano-Baeza, R. V. Garcia, and M. Trejo-Soto","Use of high resolution satellite images for tracking of changes in the
  lineament structure, caused by earthquakes","Submitted to Advances in Space Research",,,,"physics.geo-ph",,"  Over the last decades strong efforts have been made to apply new spaceborn
technologies to the study and possible forecast of strong earthquakes. In this
study we use ASTER/TERRA multispectral satellite images for detection and
analysis of changes in the system of lineaments previous to a strong
earthquake. A lineament is a straight or a somewhat curved feature in an image,
which it is possible to detect by a special processing of images based on
directional filtering and or Hough transform. ""The Lineament Extraction and
Stripes Statistic Analysis"" (LESSA) software package, developed by Zlatopolsy
(1992, 1997). We assume that the lineaments allow to detect, at least
partially, the presence ruptures in the Earths crust, and therefore enable one
to follow the changes in the system of faults and fractures associated with
strong earthquakes. We analysed 6 earthquakes occurred in the Pacific coast of
the South America and XXX with the Richter scale magnitude >4.5. They were
located in the regions with small seasonal variations and limited vegetation to
facilitate the tracking of features associated with the seismic activity only.
It was found that the number and orientation of lineaments changed
significantly about one month before an earthquake approximately, and a few
months later the system returns to its initial state. This effect increases
with the earthquake magnitude, and it is much more easily detectable in case of
convergent plate boundaries (for example, Nasca and South American plates). The
results obtained open a possibility to develop a methodology able to evaluate
the seismic risk in the regions with similar geological conditions.
","[{""version"":""v1"",""created"":""Wed, 13 Jun 2007 06:09:32 GMT""},{""version"":""v2"",""created"":""Thu, 14 Jun 2007 04:42:45 GMT""}]","2007-06-14"
"0706.1828","Jeonghee Rho","J. Rho, T. H. Jarrett, N. N. Chugai, and R. A. Chevalier","Chandra Observations of SN 2004et and the X-ray Emission of Type IIp
  Supernovae","total 19 pages including 7 figures. ApJ, in press. See
  http://spider.ipac.caltech.edu/staff/rho/preprint/SN2004etms.ps for the paper
  including full resolution images","Astrophys.J.666:1108-1115,2007","10.1086/520336",,"astro-ph",,"  We report the X-ray detection of the Type II-plateau supernova SN 2004et in
the spiral galaxy NGC 6946, using the Chandra X-Ray Observatory. The position
of the X-ray source was found to agree with the optical position within ~0.4
arcsec. Chandra also surveyed the region before the 2004 event, finding no
X-ray emission at the location of the progenitor. For the post-explosion
observations, a total of 202, 151, and 158 photons were detected in three
pointings, each ~29 ks in length, on 2004 October 22, November 6, and December
3, respectively. The spectrum of the first observation is best fit by a thermal
model with a temperature of kT=1.3 keV and a line-of-sight absorption of
N_H=1.0 x 10^{22} cm^{-2}. The inferred unabsorbed luminosity (0.4-8 keV) is
~4x10^{38} erg/s, adopting a distance of 5.5 Mpc. A comparison between hard and
soft counts on the first and third epochs indicates a softening over this time,
although there is an insufficient number of photons to constrain the variation
of temperature and absorption by spectral fitting. We model the emission as
arising from the reverse shock region in the interaction between the supernova
ejecta and the progenitor wind. For a Type IIP supernova with an extended
progenitor, the cool shell formed at the time of shock wave breakout from the
star can affect the initial evolution of the interaction shell and the
absorption of radiation from the reverse shock. The observed spectral softening
might be due to decreasing shell absorption. We find a pre-supernova mass loss
rate of (2-2.5)x 10^{-6} M_{\odot} /yr for a wind velocity of 10 kms, which is
in line with expectations for a Type IIP supernova.
","[{""version"":""v1"",""created"":""Wed, 13 Jun 2007 06:56:52 GMT""}]","2009-06-23"
"0706.1829","Kristian McDonald","Robert Foot, Archil Kobakhidze, Kristian. L. McDonald and Raymond. R.
  Volkas","Neutrino mass in radiatively-broken scale-invariant models","About 12 pages with 3 figures. V2 matches PRD version","Phys.Rev.D76:075014,2007","10.1103/PhysRevD.76.075014",,"hep-ph",,"  Scale invariance may be a classical symmetry which is broken radiatively.
This provides a simple way to stabilize the scale of electroweak symmetry
breaking against radiative corrections. The simplest phenomenologically
successful model of this type involves the addition of one real scalar field to
the standard model. In this minimal model the electroweak Higgs can be
interpreted as the pseudo-Goldstone boson of broken scale invariance. We study
the possible origin of neutrino mass in such models, both at tree-level and
radiatively.
","[{""version"":""v1"",""created"":""Wed, 13 Jun 2007 06:10:59 GMT""},{""version"":""v2"",""created"":""Fri, 12 Oct 2007 17:38:37 GMT""}]","2008-11-26"
"0706.1830","Julio Oliva","Gustavo Dotti, Julio Oliva and Ricardo Troncoso","Exact solutions for the Einstein-Gauss-Bonnet theory in five dimensions:
  Black holes, wormholes and spacetime horns","31 pages, 1 figure, minor changes and references added. Final version
  to be published in PRD","Phys.Rev.D76:064038,2007","10.1103/PhysRevD.76.064038","CECS-PHY-07/09","hep-th gr-qc",,"  An exhaustive classification of certain class of static solutions for the
five-dimensional Einstein-Gauss-Bonnet theory in vacuum is presented. The class
of metrics under consideration is such that the spacelike section is a warped
product of the real line with a nontrivial base manifold. It is shown that for
generic values of the coupling constants the base manifold must be necessarily
of constant curvature, and the solution reduces to the topological extension of
the Boulware-Deser metric. It is also shown that the base manifold admits a
wider class of geometries for the special case when the Gauss-Bonnet coupling
is properly tuned in terms of the cosmological and Newton constants. This
freedom in the metric at the boundary, which determines the base manifold,
allows the existence of three main branches of geometries in the bulk. For
negative cosmological constant, if the boundary metric is such that the base
manifold is arbitrary, but fixed, the solution describes black holes whose
horizon geometry inherits the metric of the base manifold. If the base manifold
possesses a negative constant Ricci scalar, two different kinds of wormholes in
vacuum are obtained. For base manifolds with vanishing Ricci scalar, a
different class of solutions appears resembling ""spacetime horns"". There is
also a special case for which, if the base manifold is of constant curvature,
due to certain class of degeneration of the field equations, the metric admits
an arbitrary redshift function. For wormholes and spacetime horns, there are
regions for which the gravitational and centrifugal forces point towards the
same direction. All these solutions have finite Euclidean action, which reduces
to the free energy in the case of black holes, and vanishes in the other cases.
Their mass is also obtained from a surface integral.
","[{""version"":""v1"",""created"":""Wed, 13 Jun 2007 06:17:09 GMT""},{""version"":""v2"",""created"":""Mon, 25 Jun 2007 20:45:46 GMT""},{""version"":""v3"",""created"":""Wed, 26 Sep 2007 05:05:52 GMT""}]","2008-11-26"
"0706.1831","Kartik Srinivasan","Kartik Srinivasan, Andreas Stintz, Sanjay Krishna, and Oskar Painter","Single quantum dot spectroscopy using a fiber taper waveguide near-field
  optic","4 pages, 3 figures","App. Phys. Lett., v90 (9), art. no. 091102, Aug. 27, 2007","10.1063/1.2775811",,"physics.optics cond-mat.mes-hall",,"  Photoluminescence spectroscopy of single InAs quantum dots at cryogenic
temperatures (~14 K) is performed using a micron-scale optical fiber taper
waveguide as a near-field optic. The measured collection efficiency of quantum
dot spontaneous emission into the fundamental guided mode of the fiber taper is
estimated at 0.1%, and spatially-resolved measurements with ~600 nm resolution
are obtained by varying the taper position with respect to the sample and using
the fiber taper for both the pump and collection channels.
","[{""version"":""v1"",""created"":""Wed, 13 Jun 2007 06:18:08 GMT""}]","2009-11-13"
"0706.1832","Tommaso Caneva","Tommaso Caneva, Rosario Fazio, Giuseppe E. Santoro","Adiabatic quantum dynamics of a random Ising chain across its quantum
  critical point","10 pages, 11 figures; v2: added references, published version","Phys. Rev. B 76, 144427 (2007)","10.1103/PhysRevB.76.144427",,"cond-mat.other quant-ph",,"  We present here our study of the adiabatic quantum dynamics of a random Ising
chain across its quantum critical point. The model investigated is an Ising
chain in a transverse field with disorder present both in the exchange coupling
and in the transverse field. The transverse field term is proportional to a
function $\Gamma(t)$ which, as in the Kibble-Zurek mechanism, is linearly
reduced to zero in time with a rate $\tau^{-1}$, $\Gamma(t)=-t/\tau$, starting
at $t=-\infty$ from the quantum disordered phase ($\Gamma=\infty$) and ending
at $t=0$ in the classical ferromagnetic phase ($\Gamma=0$). We first analyze
the distribution of the gaps -- occurring at the critical point $\Gamma_c=1$ --
which are relevant for breaking the adiabaticity of the dynamics. We then
present extensive numerical simulations for the residual energy $E_{\rm res}$
and density of defects $\rho_k$ at the end of the annealing, as a function of
the annealing inverse rate $\tau$. %for different lenghts of the chain. Both
the average $E_{\rm res}(\tau)$ and $\rho_k(\tau)$ are found to behave
logarithmically for large $\tau$, but with different exponents, $[E_{\rm
res}(\tau)/L]_{\rm av}\sim 1/\ln^{\zeta}(\tau)$ with $\zeta\approx 3.4$, and
$[\rho_k(\tau)]_{\rm av}\sim 1/\ln^{2}(\tau)$. We propose a mechanism for
$1/\ln^2{\tau}$-behavior of $[\rho_k]_{\rm av}$ based on the Landau-Zener
tunneling theory and on a Fisher's type real-space renormalization group
analysis of the relevant gaps. The model proposed shows therefore a
paradigmatic example of how an adiabatic quantum computation can become very
slow when disorder is at play, even in absence of any source of frustration.
","[{""version"":""v1"",""created"":""Wed, 13 Jun 2007 14:01:16 GMT""},{""version"":""v2"",""created"":""Mon, 7 Jan 2008 16:00:16 GMT""}]","2009-11-13"
"0706.1833","Hideo Kubo","Soichiro Katayama, Hideo Kubo","An elementary proof of global existence for nonlinear wave equations in
  an exterior domain","(i) To simplify the proof of Theorems 4.1 and 4.2 in the previous
  version, we added Lemma 4.1. (ii) Proof of the theorem for general situation
  of the multiple speeds are given, while it was proved only for the single
  speed case in the previous version. (iii) (3.2) is replaced by its accurate
  form. (iv) Some refernces are added, and many typos are corrected","J. Math. Soc. Japan. 60 (2008) 1135-1170",,,"math.AP",,"  The aim of this article is to present an elementary proof of a global
existence result for nonlinear wave equations satifying the null condition in
an exterior domain. The novelty of our proof is to avoid completely the scaling
operator which would make the argument complicated in the mixed problem, by
using a new weighted pointwise estimates of a tangential derivative to the
light cone.
","[{""version"":""v1"",""created"":""Wed, 13 Jun 2007 06:24:15 GMT""},{""version"":""v2"",""created"":""Wed, 4 Jul 2007 09:19:45 GMT""}]","2009-09-01"
"0706.1834","Kaushar Sanchawala","Kaushar Sanchawala, Wen-Ping Chen, Devendra Ojha, Swarna Kanti Ghosh,
  Yasushi Nakajima, Motohide Tamura, Daisuke Baba, Shuji Sato, and Masahiro
  Tsujimoto","Near-infrared Study of the Carina Nebula","Accepted for publication in ApJ; 45 pages, 18 figures, and 3 tables.
  The manuscript with higher resolution figures can be downloaded from
  http://cepheus.astro.ncu.edu.tw/~kaushar/download/ms.pdf",,"10.1086/521044",,"astro-ph",,"  We have carried out near-infrared (NIR) imaging observations of the Carina
Nebula for an area of ~400 sq. arcmin. including the star clusters Trumpler 14
(Tr 14) and Trumpler 16 (Tr 16). With 10 sigma limiting magnitudes of J ~ 18.5,
H ~ 17.5 and K_s ~ 16.5, we identified 544 Class II and 11 Class I young star
candidates. We find some 40 previously unknown very red sources with H-K_s > 2,
most of which remain undetected at the J band. The red NIR sources are found to
be concentrated to the south-east of Tr 16, along the `V' shaped dust lane,
where the next generation of stars seems to be forming. In addition, we find
indications of ongoing star formation near the three MSX point sources,
G287.51-0.49, G287.47-0.54, and G287.63-0.72. A handful of red NIR sources are
seen to populate around each of these MSX sources. Apart from this, we
identified two hard Chandra X-ray sources near G287.47-0.54, one of which does
not have an NIR counterpart and may be associated with a Class I/Class 0
object. The majority of the Class II candidates, on the other hand, are seen to
be distributed in the directions of the clusters, demarcating different
evolutionary stages in this massive star-forming region. A comparison of the
color-magnitude diagrams of the clusters with pre-main sequence model tracks
shows that the stellar population of these clusters is very young (< 3 Myr).
The K_s band luminosity function (KLF) of Tr 14 shows structure at the faint
end, including a sharp peak due to the onset of deuterium burning, implying an
age of 1-2 Myr for the cluster. The KLF of Tr 16, in contrast, is found to rise
smoothly until it turns over. The slopes of the mass functions derived for the
clusters are found to be in agreement with the canonical value of the field
star initial mass function derived by Salpeter.
","[{""version"":""v1"",""created"":""Wed, 13 Jun 2007 14:54:58 GMT""}]","2009-11-13"
"0706.1835","Sheng Bau","Sheng Bau","General concepts of graphs","20 pages",,,,"math.CT",,"  A little general abstract combinatorial nonsense delivered in this note is a
presentation of some old and basic concepts, central to discrete mathematics,
in terms of new words. The treatment is from a structural and systematic point
of view. This note consists essentially of definitions and summaries.
","[{""version"":""v1"",""created"":""Wed, 13 Jun 2007 06:50:25 GMT""}]","2007-06-14"
