"0706.1775","Fabian Schmidt","Fabian Schmidt, Michele Liguori, Scott Dodelson","Galaxy-CMB Cross-Correlation as a Probe of Alternative Models of Gravity","10 pages, 6 figures, revised version re-submitted to Phys. Rev. D","Phys.Rev.D76:083518,2007","10.1103/PhysRevD.76.083518",,"astro-ph",,"  Bekenstein's alternative to general relativity, TeVeS, reduces to Modified
Newtonian Dynamics (MOND) in the galactic limit. On cosmological scales, the
(potential well <-> overdensity) relationship is quite different than in
standard general relativity. Here we investigate the possibility of
cross-correlating galaxies with the cosmic microwave background (CMB) to probe
this relationship. At redshifts of order 2, the sign of the CMB-galaxy
correlation differs in TeVeS from that in general relativity. We show that this
effect is detectable and hence can serve as a powerful discriminator of these
two models of gravity.
","[{""version"":""v1"",""created"":""Tue, 12 Jun 2007 19:51:49 GMT""},{""version"":""v2"",""created"":""Thu, 30 Aug 2007 22:08:17 GMT""}]","2008-11-26"
"0706.1776","Roberto D. Pascual-Marqui","Roberto D. Pascual-Marqui","Coherence and phase synchronization: generalization to pairs of
  multivariate time series, and removal of zero-lag contributions","Technical report",,,,"stat.ME stat.AP",,"  Coherence and phase synchronization between time series corresponding to
different spatial locations are usually interpreted as indicators of the
connectivity between locations. In neurophysiology, time series of electric
neuronal activity are essential for studying brain interconnectivity. Such
signals can either be invasively measured from depth electrodes, or computed
from very high time resolution, non-invasive, extracranial recordings of scalp
electric potential differences (EEG: electroencephalogram) and magnetic fields
(MEG: magnetoencephalogram) by means of a tomography such as sLORETA
(standardized low resolution brain electromagnetic tomography). There are two
problems in this case. First, in the usual situation of unknown cortical
geometry, the estimated signal at each brain location is a vector with three
components (i.e. a current density vector), which means that coherence and
phase synchronization must be generalized to pairs of multivariate time series.
Second, the inherent low spatial resolution of the EEG/MEG tomography
introduces artificially high zero-lag coherence and phase synchronization. In
this report, solutions to both problems are presented. Two additional
generalizations are briefly mentioned: (1) conditional coherence and phase
synchronization; and (2) non-stationary time-frequency analysis. Finally, a
non-parametric randomization method for connectivity significance testing is
outlined. The new connectivity measures proposed here can be applied to pairs
of univariate EEG/MEG signals, as is traditional in the published literature.
However, these calculations cannot be interpreted as connectivity, since it is
in general incorrect to associate an extracranial electrode or sensor to the
underlying cortex.
","[{""version"":""v1"",""created"":""Tue, 12 Jun 2007 19:48:30 GMT""},{""version"":""v2"",""created"":""Wed, 13 Jun 2007 11:35:14 GMT""},{""version"":""v3"",""created"":""Thu, 12 Jul 2007 12:24:44 GMT""}]","2007-07-12"
"0706.1777","Edward C. Moran","Carolin N. Cardamone (Yale), Edward C. Moran (Wesleyan), Laura E. Kay
  (Barnard)","""Hidden"" Seyfert 2 Galaxies in the Chandra Deep Field North","36 pages, including 10 figures. Accepted for publication in the
  Astronomical Journal","Astron.J.134:1263-1275,2007","10.1086/520801",,"astro-ph",,"  We have compared the X-ray--to--optical flux ratios (F_x/F_opt) of absorbed
active galactic nuclei (AGNs) in the Chandra Deep Field North (CDF-N) with
those of nearby, optically classified Seyfert 2 galaxies. The comparison
provides an opportunity to explore the extent to which the local population of
absorbed AGNs can account for the properties of the distant, spectroscopically
ambiguous sources that produce the hard X-ray background. Our nearby sample
consists of 38 objects that well represent the local Seyfert 2 luminosity
function. Integrated UBVRI photometry and broadband X-ray observations are
presented. Using these data, we have simulated the F_x/F_opt ratios that local
Seyfert 2s would exhibit if they were observed in the redshift range 0.2 < z <
1.3 as part of the CDF-N. In the simulations we account for the effects of
redshift on flux measurements in fixed observed-frame bands, and the way the
luminosity function of a given population is sampled in a flux-limited survey
like the CDF-N. Overall, we find excellent agreement between our simulations
and the observed distribution of F_x/F_opt ratios for absorbed AGNs in the
CDF-N. Our analysis has thus failed to reveal any physical differences between
the local population of Seyfert 2s and CDF-N sources with similar X-ray
properties. These results support the hypothesis that the nuclear emission
lines of many distant hard X-ray galaxies are hidden in ground-based spectra
due to a combination of observational effects: signal-to-noise ratio,
wavelength coverage, and dilution by host-galaxy light.
","[{""version"":""v1"",""created"":""Tue, 12 Jun 2007 20:00:04 GMT""}]","2009-06-23"
"0706.1779","Marcelo J. Reboucas","J. Santos, J. S. Alcaniz, M. J. Reboucas, N. Pires","Lookback time bounds from energy conditions","7 pages, 3 figures. v2: Minor changes, published in Phys.Rev.D in the
  present form","Phys.Rev.D76:043519,2007","10.1103/PhysRevD.76.043519",,"astro-ph gr-qc hep-th",,"  In general relativity, the energy conditions are invoked to restrict general
energy-momentum tensors on physical grounds. We show that in the standard
Friedmann-Lemaitre-Robertson-Walker (FLRW) approach to cosmological modeling,
where the energy and matter components of the cosmic fluid are unknown, the
energy conditions provide model-independent bounds on the behavior of the
lookback time of cosmic sources as a function of the redshift for any value of
the spatial curvature. We also confront such bounds with a lookback time sample
which is built from the age estimates of 32 galaxies lying in the interval
$0.11 \lesssim z \lesssim 1.84$ and by assuming the total expanding age of the
Universe to be $13.7 \pm 0.2$ Gyr, as obtained from current cosmic microwave
background experiments. In agreement with previous results, we show that all
energy conditions seem to have been violated at some point of the recent past
of cosmic evolution.
","[{""version"":""v1"",""created"":""Tue, 12 Jun 2007 20:37:51 GMT""},{""version"":""v2"",""created"":""Thu, 23 Aug 2007 22:21:57 GMT""}]","2008-12-18"
"0706.1780","Marie-France Ango-Obiang","Marie-France Ango-Obiang (SITE, Loria)","Le travail collaboratif dans le cadre d'un projet architectural",,"Dans Innovation et tradition de l'association internationale
  Management Strat\'egique (2007)",,,"cs.HC",,"  The analysis of the practices and the tendencies of the users at the time of
the search for information on Internet makes it possible to highlight several
points. The search for information becomes powerful after knowledge of the
typology of the various systems of research. This typology supports the
adoption of a methodology of research which one can characterize by pull
systems, intelligent agents, etc. In addition, the importance of the structure
of the electronic document, correctly elaborated in advance, will support a
higher relevance ratio to find information. In our article, the problems turn
around the study of the behavior of the users in situation of search for
information, as well as the constitution of a pole of documentary resources
within a framework of an architectural project. It is noted that the evolution
of the documentary resources is related to information technologies.
","[{""version"":""v1"",""created"":""Tue, 12 Jun 2007 20:06:38 GMT""}]","2007-06-14"
"0706.1781","Marco Ruggieri","R. Anglani, R. Gatto, N. D. Ippolito, G. Nardulli and M. Ruggieri","Superfluid and Pseudo-Goldstone Modes in Three Flavor Crystalline Color
  Superconductivity","10 pages, RevTeX4 class. Section IIIA enlarged, to appear on Phys.
  Rev. D","Phys.Rev.D76:054007,2007","10.1103/PhysRevD.76.054007","BARI-TH 567/07","hep-ph",,"  We study the bosonic excitations in the favorite cubic three flavor
crystalline LOFF phases of QCD. We calculate in the Ginzburg-Landau
approximation the masses of the eight pseudo Nambu-Goldstone Bosons (NGB)
present in the low energy theory. We also compute the decay constants of the
massless NGB Goldstones associated to superfluidity as well as those of the
eight pseudo NGB. Differently from the corresponding situation in the
Color-Flavor-Locking phase, we find that meson condensation phases are not
expected in the present scenario.
","[{""version"":""v1"",""created"":""Wed, 13 Jun 2007 14:42:47 GMT""},{""version"":""v2"",""created"":""Thu, 16 Aug 2007 07:20:21 GMT""}]","2008-11-26"
"0706.1782","Seth Hornstein","S. D. Hornstein, K. Matthews, A. M. Ghez, J. R. Lu, M. Morris, E. E.
  Becklin, M. Rafelski, F. K. Baganoff","A Constant Spectral Index for Sagittarius A* During Infrared/X-ray
  Intensity Variations","11 pages, 7 figures (color), Accepted for publication in ApJ.
  Resolution (Fig 1&2) downgraded for astro-ph. For full resolution, see
  http://casa.colorado.edu/~hornstei/sgracolor.pdf","Astrophys.J.667:900-910,2007","10.1086/520762",,"astro-ph",,"  We report the first time-series of broadband infrared (IR) color measurements
of Sgr A*, the variable emission source associated with the supermassive black
hole at the Galactic Center. Using the laser and natural guide star AO systems
on the Keck II telescope, we imaged Sgr A* in multiple near-infrared broadband
filters with a typical cycle time of ~3 min during 4 observing runs
(2005-2006), two of which were simultaneous with Chandra X-ray measurements. In
spite of the large range of dereddened flux densities for Sgr A* (2-30 mJy),
all of our near-IR measurements are consistent with a constant spectral index
of alpha = -0.6+-0.2. Furthermore, this value is consistent with the spectral
indices observed at X-ray wavelengths during nearly all outbursts; which is
consistent with the synchrotron self-Compton model for the production of the
X-ray emission. During the coordinated observations, one IR outburst occurs <36
min after a possibly associated X-ray outburst, while several similar IR
outbursts show no elevated X-ray emission. A variable X-ray to IR ratio and
constant infrared spectral index challenge the notion that the IR and X-ray
emission are connected to the same electrons. We, therefore, posit that the
population of electrons responsible for both the IR and X-ray emission are
generated by an acceleration mechanism that leaves the bulk of the electron
energy distribution responsible for the IR emission unchanged, but has a
variable high-energy cutoff. Occasionally a tail of electrons >1 GeV is
generated, and it is this high-energy tail that gives rise to the X-ray
outbursts. One possible explanation for this type of variation is from the
turbulence induced by a magnetorotational instability, in which the outer scale
length of the turbulence varies and changes the high-energy cutoff.
","[{""version"":""v1"",""created"":""Tue, 12 Jun 2007 22:02:35 GMT""}]","2009-06-23"
"0706.1783","Stefan Kirchner","Stefan Kirchner and Qimiao Si","Scaling and Enhanced Symmetry at the Quantum Critical Point of the
  Sub-Ohmic Bose-Fermi Kondo Model","4 pages, 3 embedded eps figures; published version","Physical Review Letters 100, 026403 (2008)","10.1103/PhysRevLett.100.026403",,"cond-mat.str-el",,"  We consider the finite temperature scaling properties of a Kondo-destroying
quantum critical point in the Ising-anisotropic Bose-Fermi Kondo model (BFKM).
A cluster-updating Monte Carlo approach is used, in order to reliably access a
wide temperature range. The scaling function for the two-point spin correlator
is found to have the form dictated by a boundary conformal field theory, even
though the underlying Hamiltonian lacks conformal invariance. Similar
conclusions are reached for all multi-point correlators of the spin-isotropic
BFKM in a dynamical large-N limit. Our results suggest that the quantum
critical local properties of the sub-ohmic BFKM are those of an underlying
boundary conformal field theory.
","[{""version"":""v1"",""created"":""Tue, 12 Jun 2007 20:17:23 GMT""},{""version"":""v2"",""created"":""Wed, 16 Jan 2008 17:46:49 GMT""}]","2009-09-29"
"0706.1784","Rita Pardini","Ciro Ciliberto, Margarida Mendes Lopes and Rita Pardini","Surfaces with K^2<3\chi and finite fundamental group","18 pages. To appear in Math. Res. Lett",,,,"math.AG",,"  In this paper we continue the study of algebraic fundamentale group of
minimal surfaces of general type S satisfying K_S^2<3\chi(S). We show that, if
K_S^2= 3\chi(S)-1 and the algebraic fundamental group of S has order 8, then S
is a Campedelli surface.
  In view of the results of math.AG/0512483 and math.AG/0605733, this implies
that the fundamental group of a surface with K^2<3\chi that has no irregular
etale cover has order at most 9, and if it has order 8 or 9, then S is a
Campedelli surface.
  To obtain this result we establish some classification results for minimal
surfaces of general type such that K^2=3p_g-5 and such that the canonical map
is a birational morphism. We also study rational surfaces with a Z_2^3-action.
","[{""version"":""v1"",""created"":""Tue, 12 Jun 2007 20:27:50 GMT""}]","2007-06-14"
"0706.1785","Scott N. Walck","Scott N. Walck, David W. Lyons","Maximum stabilizer dimension for nonproduct states","6 pages","Phys. Rev. A 76, 022303 (2007)","10.1103/PhysRevA.76.022303",,"quant-ph",,"  Composite quantum states can be classified by how they behave under local
unitary transformations. Each quantum state has a stabilizer subgroup and a
corresponding Lie algebra, the structure of which is a local unitary invariant.
In this paper, we study the structure of the stabilizer subalgebra for n-qubit
pure states, and find its maximum dimension to be n-1 for nonproduct states of
three qubits and higher. The n-qubit Greenberger-Horne-Zeilinger state has a
stabilizer subalgebra that achieves the maximum possible dimension for pure
nonproduct states. The converse, however, is not true: we show examples of pure
4-qubit states that achieve the maximum nonproduct stabilizer dimension, but
have stabilizer subalgebra structures different from that of the n-qubit GHZ
state.
","[{""version"":""v1"",""created"":""Tue, 12 Jun 2007 20:23:31 GMT""},{""version"":""v2"",""created"":""Fri, 3 Aug 2007 20:57:11 GMT""}]","2008-10-12"
"0706.1786","Manfred Salmhofer","Joel Feldman (University of British Columbia) and Manfred Salmhofer
  (Universitaet Leipzig)","Singular Fermi Surfaces I. General Power Counting and Higher Dimensional
  Cases","48 pages LaTeX with figures",,"10.1142/S0129055X08003274",,"math-ph cond-mat.str-el math.MP",,"  We prove regularity properties of the self-energy, to all orders in
perturbation theory, for systems with singular Fermi surfaces which contain Van
Hove points where the gradient of the dispersion relation vanishes. In this
paper, we show for spatial dimensions $d \ge 3$ that despite the Van Hove
singularity, the overlapping loop bounds we proved together with E. Trubowitz
for regular non--nested Fermi surfaces [J. Stat. Phys. 84 (1996) 1209] still
hold, provided that the Fermi surface satisfies a no-nesting condition. This
implies that for a fixed interacting Fermi surface, the self-energy is a
continuously differentiable function of frequency and momentum, so that the
quasiparticle weight and the Fermi velocity remain close to their values in the
noninteracting system to all orders in perturbation theory. In a companion
paper, we treat the more singular two-dimensional case.
","[{""version"":""v1"",""created"":""Tue, 12 Jun 2007 20:24:08 GMT""}]","2009-11-13"
"0706.1787","Joel N. Bregman","Joel N. Bregman (University of Michigan)","The Search for the Missing Baryons at Low Redshift","To appear in Annual Review of Astronomy and Astrophysics, Vol 45
  (Sept 2007) 44 pages, including 11 figures","Ann.Rev.Astron.Astrophys.45:221-259,2007","10.1146/annurev.astro.45.051806.110619",,"astro-ph",,"  At low redshift, only about one-tenth of the known baryons lie in galaxies or
the hot gas seen in galaxy clusters and groups. Models posit that these
""missing baryons"" are in gaseous form in overdense filaments that connect the
much denser virialized groups and clusters. About 30% are cool (<1E5 K) and are
detected in Ly alpha absorption studies, but about half is predicted to lie in
the 1E5-1E7 K regime. Gas is detected in the 2-5E5 K range through OVI
absorption studies (7% of the baryons) and possibly near 1E5 K from broad Ly
absorption (20% of the baryons). Hotter gas (0.5-2E6 K) is detected at zero
redshift by OVII and OVIII K X-ray absorption, and the OVII line strengths seem
to correlate with the Galactic soft X-ray background, so it is probably
produced by Galactic Halo gas, rather than a Local Group medium. There are no
compelling detections of the intergalactic hot gas (0.5-10E6 K) either in
absorption or emission and these upper limits are consistent with theoretical
models. Claimed X-ray absorption lines are not confirmed, while most of the
claims of soft emission are attributable to artifacts of background subtraction
and field-flattening. The missing baryons should become detectable with
moderate improvements in instrumental sensitivity.
","[{""version"":""v1"",""created"":""Tue, 12 Jun 2007 20:51:13 GMT""}]","2009-06-23"
"0706.1788","Manfred Salmhofer","Joel Feldman (University of British Columbia) and Manfred Salmhofer
  (Universitaet Leipzig)","Singular Fermi Surfaces II. The Two--Dimensional Case","68 pages LaTeX with figures",,"10.1142/S0129055X08003304",,"math-ph cond-mat.str-el math.MP",,"  We consider many--fermion systems with singular Fermi surfaces, which contain
Van Hove points where the gradient of the band function $k \mapsto e(k)$
vanishes. In a previous paper, we have treated the case of spatial dimension $d
\ge 3$. In this paper, we focus on the more singular case $d=2$ and establish
properties of the fermionic self--energy to all orders in perturbation theory.
We show that there is an asymmetry between the spatial and frequency
derivatives of the self--energy. The derivative with respect to the Matsubara
frequency diverges at the Van Hove points, but, surprisingly, the self--energy
is $C^1$ in the spatial momentum to all orders in perturbation theory, provided
the Fermi surface is curved away from the Van Hove points. In a prototypical
example, the second spatial derivative behaves similarly to the first frequency
derivative. We discuss the physical significance of these findings.
","[{""version"":""v1"",""created"":""Tue, 12 Jun 2007 20:30:06 GMT""}]","2009-11-13"
"0706.1789","Valeri Andreev P.","Valery P. Andreev","B production at the LHC / QCD aspects","Moriond QCD 2007 conference proceedings",,,,"hep-ex",,"  The LHC provides new opportunities to improve our understanding of the b
quark using high statistics data samples and the 14 TeV center-of-mass energy.
The prospects to measure the cross section for inclusive b production in events
containing jets and at least one muon are presented. Studies of detector
systematic effects and theoretical uncertainties are included. QCD aspects of
the beauty production are discussed.
","[{""version"":""v1"",""created"":""Tue, 12 Jun 2007 20:51:40 GMT""}]","2007-06-14"
"0706.1791","Andrew Ptak","A. Ptak (1), B.Mobasher (2), A. Hornschemeier (1,3), F. Bauer (4) and
  C. Norman (1,2) ((1) Johns Hopkins University, (2) Space Telescope Institute,
  (3) NASA/GSFC, (4) Columbia University)","X-ray Luminosity Functions of Normal Galaxies in the GOODS","36 pages, 36 figures, formatted with emulateapj. Accepted for
  publication in ApJ. Higher resolution version available at
  http://xassist.pha.jhu.edu/ptak/goods_xlf_emulateapj.pdf",,,,"astro-ph",,"  We present soft (0.5-2 keV) X-ray luminosity functions (XLFs) in the Great
Observatories Origins Deep Survey (GOODS) fields, derived for galaxies at
z~0.25 and 0.75. SED fitting was used to estimate photometric redshifts and
separate galaxy types, resulting in a sample of 40 early-type galaxies and 46
late-type galaxies. We estimate k-corrections for both the X-ray/optical and
X-ray/NIR flux ratios, which facilitates the separation of AGN from the
normal/starburst galaxies. We fit the XLFs with a power-law model using both
traditional and Markov-Chain Monte Carlo (MCMC) procedures. The XLFs differ
between z<0.5 and z>0.5, at >99% significance levels for early-type, late-type
and all (early and late-type) galaxies.We also fit Schechter and log-normal
models to the XLFs, fitting the low and high redshift XLFs for a given sample
simultaneously assuming only pure luminosity evolution. In the case of
log-normal fits, the results of MCMC fitting of the local FIR luminosity
function were used as priors for the faint and bright-end slopes (similar to
``fixing'' these parameters at the FIR values except here the FIR uncertainty
is included). The best-fit values of the change in log L* with redshift were
dlogL* = 0.23 +/- 0.16 dex (for early-type galaxies) and 0.34 +/- 0.12 dex (for
late-type galaxies), corresponding to (1+z)^1.6 and (1+z)^2.3. These results
were insensitive to whether the Schechter or log-normal function was adopted.
","[{""version"":""v1"",""created"":""Tue, 12 Jun 2007 20:37:45 GMT""}]","2007-06-14"
"0706.1792","Caucher Birkar","Caucher Birkar","On existence of log minimal models",,"Compositio Math. 146 (2010) 919-928","10.1112/S0010437X09004564",,"math.AG","http://arxiv.org/licenses/nonexclusive-distrib/1.0/","  In this paper, we prove that the log minimal model program in dimension $d-1$
implies the existence of log minimal models for effective lc pairs (eg of
nonnegative Kodaira dimension) in dimension $d$. In fact, we prove that the
same conclusion follows from a weaker assumption, namely, the log minimal model
program with scaling in dimension $d-1$. This enables us to prove that
effective lc pairs in dimension five have log minimal models. We also give new
proofs of the existence of log minimal models for effective lc pairs in
dimension four and the Shokurov reduction theorem. Other applications appear in
a paper of Birkar-Paun.
","[{""version"":""v1"",""created"":""Tue, 12 Jun 2007 21:36:47 GMT""},{""version"":""v2"",""created"":""Thu, 3 Jul 2008 00:45:11 GMT""},{""version"":""v3"",""created"":""Thu, 23 Jul 2009 20:53:01 GMT""}]","2019-02-20"
"0706.1793","C\'esar Seijas","Cesar Seijas","The beta function of gauge theories at two loops in differential
  renormalization","PhD Thesis, 137 pages, 20 figures, LaTeX. v2 references added",,,,"hep-th",,"  This PhD thesis is devoted to show that differential renormalization is a
simple and useful renormalization method that we can use when dealing with
gauge theories. In this work, it is shown how the one-loop results of
Constraint Differential Renormalization can be fruitfully applied when
renormalizing two-loop amplitudes. As an example of this procedure, the
two-loop beta functions of various relevant gauge theories are obtained (QED,
SuperQED, Yang-Mills and N=1 SuperYM) without making use of the Ward
identities, which are mandatory in the standard differential renormalization
procedure. Also, we study how to deal with expressions that have IR and UV
divergences, showing that both are renormalized with independent scales. This
result allow us to give new insight on the origin of the higher order
corrections to the beta function of the N=1 SuperYM theory, as in this case we
have both divergences due to the form of the gauge propagator. This is an
advantage over usual dimensional regularization methods, where both divergences
become mixed.
","[{""version"":""v1"",""created"":""Tue, 12 Jun 2007 22:24:35 GMT""},{""version"":""v2"",""created"":""Tue, 26 Jun 2007 21:03:33 GMT""}]","2007-06-27"
"0706.1794","Caucher Birkar","Caucher Birkar","Birational geometry","35 pages",,,,"math.AG",,"  This article contains the notes of a graduate course on birational geometry
focusing on the minimal model program. Topics covered include singularities,
vanishing, nonvanishing, cone and contraction, base point freeness, finite
generation, flips, termination, minimal models and Mori fibre spaces.
","[{""version"":""v1"",""created"":""Wed, 13 Jun 2007 14:16:48 GMT""}]","2007-06-14"
