"0706.1615","Taras Lakoba","T.I. Lakoba and J. Yang","A mode elimination technique to improve convergence of iteration methods
  for finding solitary waves","to appear in J. Comp. Phys.; 24 pages",,"10.1016/j.jcp.2007.06.010",,"nlin.PS",,"  We extend the key idea behind the generalized Petviashvili method of Ref.
\cite{gP} by proposing a novel technique based on a similar idea. This
technique systematically eliminates from the iteratively obtained solution a
mode that is ""responsible"" either for the divergence or the slow convergence of
the iterations. We demonstrate, theoretically and with examples, that this mode
elimination technique can be used both to obtain some nonfundamental solitary
waves and to considerably accelerate convergence of various iteration methods.
As a collateral result, we compare the linearized iteration operators for the
generalized Petviashvili method and the well-known imaginary-time evolution
method and explain how their different structures account for the differences
in the convergence rates of these two methods.
","[{""version"":""v1"",""created"":""Tue, 12 Jun 2007 19:07:51 GMT""}]","2009-11-13"
"0706.1625","Mikhail G. Katz","Alexander N. Dranishnikov, Mikhail G. Katz, Yuli B. Rudyak","Small values of Lusternik-Schnirelmann and systolic categories for
  manifolds","22 pages; new section added",,,,"math.AT math.DG",,"  We prove that manifolds of Lusternik-Schnirelmann category 2 necessarily have
free fundamental group. We thus settle a 1992 conjecture of Gomez-Larranaga and
Gonzalez-Acuna, by generalizing their result in dimension 3, to all higher
dimensions. We examine its ramifications in systolic topology, and provide a
sufficient condition for ensuring a lower bound of 3 for systolic category.
","[{""version"":""v1"",""created"":""Tue, 12 Jun 2007 16:28:20 GMT""},{""version"":""v2"",""created"":""Thu, 14 Jun 2007 14:10:26 GMT""},{""version"":""v3"",""created"":""Mon, 23 Jul 2007 09:24:08 GMT""}]","2007-07-23"
"0706.1681","Lo\""ic Bervas","D. Lebeugle, D. Colson, A. Forget, M. Viret","Very large spontaneous electric polarization in BiFeO3 single crystals
  at room temperature and its evolution under cycling fields","8 pages, 3 figures",,"10.1063/1.2753390","SPEC-S07/048","cond-mat.mtrl-sci",,"  Electric polarization loops are measured at room temperature on highly pure
BiFeO3 single crystals synthesized by a flux growth method. Because the
crystals have a high electrical resistivity, the resulting low leakage currents
allow us to measure a large spontaneous polarization reaching 100
microC.cm^{-2}, a value never reported in the bulk. During electric cycling,
the slow degradation of the material leads to an evolution of the hysteresis
curves eventually preventing full saturation of the crystals.
","[{""version"":""v1"",""created"":""Tue, 12 Jun 2007 17:25:54 GMT""}]","2009-11-13"
"0706.1686","Matatyahu Rubin","Robert Bonnet, Matatyahu Rubin","A classification of CO spaces which are continuous images of compact
  ordered spaces",,,,,"math.GN",,"  A compact Hausdorff space X is called a CO space, if every closed subset of X
is homeomorphic to an open subset of X. Every successor ordinal with its order
topology is a CO space. We find an explicit characterization of the class K of
CO spaces which are a continuous image of a Dedkind complete totally ordered
set. (The topology of a totally ordered set is taken to be its order topology).
We show that every member of K can be described as a finite disjoint sum of
very simple spaces. Every summand has either form: (1) mu + 1 + nu^*, where mu
and nu are cardinals, and nu^* is the reverse order of nu; or (2) the summand
is the 1-point-compactification of a discrete space with cardinality aleph_1.
","[{""version"":""v1"",""created"":""Tue, 12 Jun 2007 18:54:44 GMT""}]","2007-06-13"
"0706.1689","A. V. Balatsky","Hari P. Dahal, Tim O. Wehling, Kevin S. Bedell, Jian-Xin Zhu, A. V.
  Balatsky","Wigner crystallization in a single and bilayer graphene","5 pages, latex file, 4 ps figure files",,,,"cond-mat.str-el cond-mat.mes-hall",,"  We study the possibility of Wigner crystallization in both single- and and
bi-layer graphene using a real space tight binding model. In addition to
verifying our earlier prediction for single layer graphene, we predict that the
bilayer graphene can undergo a Wigner crystal transition at low enough carrier
density thus offering a possibility of tunable and bipolar Wigner crystal. We
find that aside from the Coulomb interaction of the carriers of two layers that
stabilizes the charge ordered state, so does the inter layer coupling.
","[{""version"":""v1"",""created"":""Tue, 12 Jun 2007 18:51:40 GMT""}]","2007-06-13"
"0706.1690","Eduard De La Cruz Burelo","D0 Collaboration, V. Abazov, et al","Direct observation of the strange b baryon Xi_b^{-}","Version published in Phys. Rev. Lett","Phys.Rev.Lett.99:052001,2007","10.1103/PhysRevLett.99.052001","Fermilab-Pub-07/196-E","hep-ex",,"  We report the first direct observation of the strange b baryon Xi_b^{-}. We
reconstruct the decay Xi_b^{-} to J/psi Xi^{-}, with J/psi to dimuons and
Xi^{-} to Lambda pion, in ppbar collisions at sqrt(s) = 1.96 TeV. Using 1.3
fb^{-1} of data collected by the D0 detector, we observe 15.2 +/- 4.4(stat.)+
1.9/-0.4(syst.) Xi_b^{-} candidates at a mass of 5.774 +/- 0.011(stat.) +/-
0.015 (syst.) GeV. The significance of the observed signal is 5.5 sigmas,
equivalent to a probability of 3.3 X 10^{-8} of it arising from a background
fluctuation. Normalizing to the decay Lambda_b to J/psi Lambda, we measure the
relative rate to be 0.28 +/- 0.09(stat.)+ 0.09/-0.08 (syst.).
","[{""version"":""v1"",""created"":""Tue, 12 Jun 2007 19:54:21 GMT""},{""version"":""v2"",""created"":""Wed, 13 Jun 2007 01:05:40 GMT""},{""version"":""v3"",""created"":""Fri, 31 Aug 2007 12:31:57 GMT""}]","2008-11-26"
"0706.1698","Wing Yan Yip","Wing Yan Yip, David Stephens, Sofia Olhede","The Explicit Chaotic Representation of the powers of increments of Levy
  Processes","41 pages",,,"TR-07-04","math.PR math.ST stat.TH",,"  An explicit formula for the chaotic representation of the powers of
increments, (X_{t+t_0}-X_{t_0})^n, of a Levy process is presented. There are
two different chaos expansions of a square integrable functional of a Levy
process: one with respect to the compensated Poisson random measure and the
other with respect to the orthogonal compensated powers of the jumps of the
Levy process. Computationally explicit formulae for both of these chaos
expansions of (X_{t+t_0}-X_{t_0})^n are given in this paper. Simulation results
verify that the representation is satisfactory. The CRP of a number of
financial derivatives can be found by expressing them in terms of
(X_{t+t_0}-X_{t_0})^n using Taylor's expansion.
","[{""version"":""v1"",""created"":""Tue, 12 Jun 2007 19:20:33 GMT""},{""version"":""v2"",""created"":""Tue, 12 Jun 2007 22:32:48 GMT""}]","2007-06-13"
"0706.1703","Kate Land","Kate Land and Anze Slosar","Correlation between galactic HI and the Cosmic Microwave Background","4 pages, 4 figures, accepted in PRD brief report","Phys.Rev.D76:087301,2007","10.1103/PhysRevD.76.087301",,"astro-ph",,"  We revisit the issue of a correlation between the atomic hydrogen gas in our
local Galaxy and the Cosmic Microwave Background (CMB), a detection of which
has been claimed in some literature. We cross-correlate the 21-cm emission of
Galactic atomic hydrogen as traced by the Leiden/Argentine/Bonn Galactic HI
survey with the 3-year CMB data from the Wilkinson Microwave Anisotropy Probe.
We consider a number of angular scales, masks, and HI velocity slices and find
no statistically significant correlation.
","[{""version"":""v1"",""created"":""Tue, 12 Jun 2007 18:50:11 GMT""},{""version"":""v2"",""created"":""Fri, 31 Aug 2007 12:36:24 GMT""}]","2008-12-18"
"0706.1724","Jennifer Hatchell","J. Hatchell, G. A. Fuller, J. S. Richer","Star formation in Perseus: III. Outflows","26 pages, 21 figures. Version with full colour figures from
  http://www.astro.ex.ac.uk/people/hatchell/RecentPapers/hatchell07_outflows.pdf",,"10.1051/0004-6361:20066467",,"astro-ph",,"  We present a search for outflows towards 51 submillimetre cores in Perseus.
With consistently derived outflow properties from a large homogeneous dataset
within one molecular cloud we can investigate further the mass dependence and
time evolution of protostellar mass loss. Of the 51 cores, 37 show broad
linewings indicative of molecular outflows. In 13 cases, the linewings could be
due to confusion with neighbouring flows but 9 of those sources also have
near-infrared detections confirming their protostellar nature. The total
fraction of protostars in our sample is 65%. All but four outflow detections
are confirmed as protostellar by Spitzer IR detections and only one Spitzer
source has no outflow, showing that outflow maps at this sensitivity are
equally good at identifying protostars as Spitzer. Outflow momentum flux
correlates both with source luminosity and with core mass but there is
considerable scatter even within this one cloud despite the homogeneous
dataset. We fail to confirm the result of Bontemps et al. (1996) that Class I
sources show lower momentum fluxes on average than Class 0 sources, with a KS
test showing a significant probability that the momentum fluxes for both Class
0s and Class Is are drawn from the same distribution. We find that outflow
power may not show a simple decline between the Class 0 to Class I stages. Our
sample includes low momentum flux, low-luminosity Class 0 sources, possibly at
a very early evolutionary stage. If the only mass loss from the core were due
to outflows, cores would last for 10^5-10^8 years, longer than current
estimates of 1.5-4 x 10^5 years for the mean lifetime for the embedded phase.
Additional mechanisms for removing mass from protostellar cores may be
necessary.
","[{""version"":""v1"",""created"":""Tue, 12 Jun 2007 16:09:50 GMT""}]","2009-11-13"
"0706.1738","Guo-Niu Han","Guo-Niu Han, Guoce Xin","Permutations with Extremal number of Fixed Points","minor change about corollary 3",,,,"math.CO",,"  We extend Stanley's work on alternating permutations with extremal number of
fixed points in two directions: first, alternating permutations are replaced by
permutations with a prescribed descent set; second, instead of simply counting
permutations we study their generating polynomials by number of excedances.
Several techniques are used: Desarmenien's desarrangement combinatorics,
Gessel's hook-factorization and the analytical properties of two new
permutation statistics ""DEZ"" and ""lec"". Explicit formulas for the maximal case
are derived by using symmetric function tools.
","[{""version"":""v1"",""created"":""Tue, 12 Jun 2007 16:06:58 GMT""},{""version"":""v2"",""created"":""Fri, 22 Jun 2007 20:09:33 GMT""}]","2007-06-22"
"0706.1739","Remi Soummer","R\'emi Soummer, Andr\'e Ferrari, Claude Aime, Laurent Jolissaint","Speckle noise and dynamic range in coronagraphic images","31 pages, 18 figures",,"10.1086/520913",,"astro-ph",,"  This paper is concerned with the theoretical properties of high contrast
coronagraphic images in the context of exoplanet searches. We derive and
analyze the statistical properties of the residual starlight in coronagraphic
images, and describe the effect of a coronagraph on the speckle and photon
noise. Current observations with coronagraphic instruments have shown that the
main limitations to high contrast imaging are due to residual quasi-static
speckles. We tackle this problem in this paper, and propose a generalization of
our statistical model to include the description of static, quasi-static and
fast residual atmospheric speckles. The results provide insight into the
effects on the dynamic range of wavefront control, coronagraphy, active speckle
reduction, and differential speckle calibration. The study is focused on
ground-based imaging with extreme adaptive optics, but the approach is general
enough to be applicable to space, with different parameters.
","[{""version"":""v1"",""created"":""Tue, 12 Jun 2007 16:11:17 GMT""}]","2009-11-13"
"0706.1740","Carl Johan Casselgren","Armen S. Asratian, Carl Johan Casselgren","On path factors of (3,4)-biregular bigraphs","7 pages",,,,"math.CO",,"  A (3,4)-biregular bigraph G is a bipartite graph where all vertices in one
part have degree 3 and all vertices in the other part have degree 4. A path
factor of G is a spanning subgraph whose components are nontrivial paths. We
prove that a simple (3,4)-biregular bigraph always has a path factor such that
the endpoints of each path have degree three. Moreover we suggest a polynomial
algorithm for the construction of such a path factor.
","[{""version"":""v1"",""created"":""Tue, 12 Jun 2007 16:11:17 GMT""}]","2007-06-13"
"0706.1741","Rajdeep Sensarma","Rajdeep Sensarma, William Schneider, Roberto B. Diener and Mohit
  Randeria","Breakdown of the Thomas Fermi approximation for polarized Fermi gases","4 pages 3 figures",,,,"cond-mat.supr-con cond-mat.str-el",,"  We use Bogoliubov de-Gennes theory to show that the commonly used
Thomas-Fermi approximation (TFA) can fail in describing polarized unitary gases
in anisotropic harmonic traps. We find a magnetized superfluid region inside
the trap, with order parameter oscillations, even though there is no such
stable bulk phase. This leads to magnetization profiles that deviate from
contours of constant potential energy. We determine how this violation scales
with trap anisotropy and number of particles, and show that we are able to
account for important differences between the MIT and Rice experiments.
","[{""version"":""v1"",""created"":""Tue, 12 Jun 2007 16:32:39 GMT""}]","2007-06-13"
"0706.1742","Misha Katsnelson","I. K. Razumov, Yu. N. Gornostyrev, and M. I. Katsnelson","Intrinsic nanoscale inhomogeneity in ordering systems due to
  elastic-mediated interactions","final version, Europhys. Lett., accepted","Europhys. Lett. 80, 66001 (2007)","10.1209/0295-5075/80/66001",,"cond-mat.stat-mech cond-mat.mtrl-sci",,"  Phase diagram and pattern formation in two-dimensional Ising model with
coupling between order parameter and lattice vibrations is investigated by
Monte-Carlo simulations. It is shown that if the coupling is strong enough (or
phonons are soft enough) a short-range order exists in disordered phase for a
broader temperature interval. Different types of this short-range order
(stripe-like, checkboard-like, etc.) depending on the temperature and model
parameters are investigated. With further increase of the coupling, a
reconstruction of the ground state happens and new ordered phases appear at low
enough temperatures.
","[{""version"":""v1"",""created"":""Tue, 12 Jun 2007 16:34:34 GMT""},{""version"":""v2"",""created"":""Mon, 17 Sep 2007 12:04:28 GMT""},{""version"":""v3"",""created"":""Fri, 26 Oct 2007 14:28:29 GMT""}]","2011-11-10"
"0706.1743","Reinhold A. Bertlmann","Reinhold A. Bertlmann and Philipp Krammer","Bloch vectors for qudits and geometry of entanglement","30 pages, 4 figures",,,,"quant-ph",,"  We present three different matrix bases that can be used to decompose density
matrices of d--dimensional quantum systems, so-called qudits: the generalized
Gell-Mann matrix basis, the polarization operator basis, and the Weyl operator
basis. Such a decomposition can be identified with a vector --the Bloch vector,
i.e. a generalization of the well known qubit case-- and is a convenient
expression for comparison with measurable quantities and for explicit
calculations avoiding the handling of large matrices. We consider the important
case of an isotropic two--qudit state and decompose it according to each basis.
Investigating the geometry of entanglement of special parameterized two--qubit
and two--qutrit states, in particular we calculate the Hilbert--Schmidt measure
of entanglement, we find that the Weyl operator basis is the optimal choice
since it is closely connected to the entanglement of the considered states.
","[{""version"":""v1"",""created"":""Tue, 12 Jun 2007 16:45:41 GMT""}]","2007-06-13"
"0706.1744","Vladislav V. Kravchenko","Kira V. Khmelnytskaya and Vladislav V. Kravchenko","On a complex differential Riccati equation",,"J. of Phys. A, 2008, v. 41, issue 8, 085205.","10.1088/1751-8113/41/8/085205",,"math.AP math.CA math.CV",,"  We consider a nonlinear partial differential equation for complex-valued
functions which is related to the two-dimensional stationary Schrodinger
equation and enjoys many properties similar to those of the ordinary
differential Riccati equation as, e.g., the famous Euler theorems, the Picard
theorem and others. Besides these generalizations of the classical
""one-dimensional"" results we discuss new features of the considered equation
like, e.g., an analogue of the Cauchy integral theorem.
","[{""version"":""v1"",""created"":""Tue, 12 Jun 2007 16:51:18 GMT""},{""version"":""v2"",""created"":""Fri, 28 Sep 2007 19:15:08 GMT""}]","2009-11-13"
"0706.1745","Igor Freire","Igor Leite Freire","Noether Symmetries and Conservations Laws For Non-critical Kohn-Laplace
  Equations on Three-Dimensional Heisenberg Group","This article was accept for publication in Algebras, Groups and
  Geometries. Unfortunately, it was published without my consent in Hadronic
  Journal, vol. 30, 299-314, (2007)",,,,"math.AP",,"  We show which Lie point symmetries of non-critical semilinear Kohn-Laplace
equations on the Heisenberg group $H^1$ are Noether symmetries and we establish
their respectives conservations laws.
","[{""version"":""v1"",""created"":""Tue, 12 Jun 2007 16:51:55 GMT""},{""version"":""v2"",""created"":""Wed, 13 Feb 2008 23:09:07 GMT""}]","2008-02-14"
"0706.1746","Vitaly Braude","V. Braude and Ya. M. Blanter","Triplet Josephson effect with magnetic feedback","4 pages, 3 figures",,"10.1103/PhysRevLett.100.207001",,"cond-mat.supr-con",,"  We study AC Josephson effect in a superconductor-ferromagnet heterostructure
with a variable magnetic configuration. The system supports triplet proximity
correlations whose dynamics is coupled to the magnetic dynamics. This feedback
dramatically modifies the behavior of the junction. The current-phase relation
becomes double-periodic at both very low and high Josephson frequencies
$\omega_J$. At intermediate frequencies, the periodicity in $\omega_J t$ may be
lost.
","[{""version"":""v1"",""created"":""Tue, 12 Jun 2007 16:59:51 GMT""},{""version"":""v2"",""created"":""Wed, 13 Jun 2007 08:25:10 GMT""}]","2013-05-29"
"0706.1747","Elisabetta Paladino","E. Paladino, M. Sassetti, G. Falci, U. Weiss","Characterization of coherent impurity effects in solid state qubits","4 pages, 5 figures. Replaced with published version, minor changes","Phys. Rev. B 77, 041303(R), 2008","10.1103/PhysRevB.77.041303",,"cond-mat.stat-mech cond-mat.mes-hall",,"  We propose a characterisation of the effects of bistable coherent impurities
in solid state qubits. We introduce an effective impurity description in terms
of a tunable spin-boson environment and solve the dynamics for the qubit
coherences. The dominant rate characterizing the asymptotic time limit is
identified and signatures of non-Gaussian behavior of the quantum impurity at
intermediate times are pointed out. An alternative perspective considering the
qubit as a measurement device for the spin-boson impurity is proposed.
","[{""version"":""v1"",""created"":""Tue, 12 Jun 2007 17:07:01 GMT""},{""version"":""v2"",""created"":""Mon, 28 Jan 2008 15:19:16 GMT""}]","2008-01-28"
"0706.1748","George Bass Ph.D.","George E. Bass","Crystal Irradiation Stimulation of Enzyme Reactivity: An Explanation","41 pages, 4 figures, 9 tables",,,,"q-bio.SC q-bio.BM",,"  In 1968, Sorin Comorosan first reported a phenomenon wherein irradiation of
the substrate of an enzyme reaction, in the crystalline state, for a specific
number of seconds could lead to an enhanced aqueous solution reaction rate for
the enzyme(up to 30%). Dependence on crystal irradiation time was found to be
oscillatory with a fixed period. The basis for this unusual phenomenon has
remained a mystery. Previously unreported experimental results are presented
which demonstrate, for the LDH / pyruvate reaction, that the identity of the
crystalline material irradiated is, largely, inconsequential. It is proposed
here that the irradiation procedure drives oscillatory reactions involving
atmospheric gases adsorbed on the crystals and that these photoproducts, or
related dark-reaction species, when dissolved, function as enzyme cofactors.
","[{""version"":""v1"",""created"":""Tue, 12 Jun 2007 17:22:29 GMT""}]","2007-06-13"
"0706.1749","Silvia Mollerach","Silvia Mollerach (for the Pierre Auger Collaboration)","Studies of clustering in the arrival directions of cosmic rays detected
  at the Pierre Auger Observatory above 10 EeV","Contribution to the 30th International Cosmic Ray Conference, Merida,
  Mexico, July 2007",,,,"astro-ph",,"  If clustering of the arrival directions of ultra high energy cosmic rays is
discovered, this would provide important information about their origin,
composition, and the galactic and extragalactic magnetic fields. We present
here the analysis of the autocorrelation function of the data from the Pierre
Auger Observatory as a function of the angular scale and the energy threshold.
We compare our results with the signals found by previous experiments.
","[{""version"":""v1"",""created"":""Tue, 12 Jun 2007 17:19:55 GMT""}]","2019-08-13"
"0706.1750","Alexander Kitaev","N. Joshi, A. V. Kitaev, and P. A. Treharne","On the Linearization of the Painleve' III-VI Equations and Reductions of
  the Three-Wave Resonant System","Typos are corrected, journal and DOI references are added","J. Math. Phys. 48, 103512 (2007) (42 pages)","10.1063/1.2794560",,"math.CA",,"  We extend similarity reductions of the coupled (2+1)-dimensional three-wave
resonant interaction system to its Lax pair. Thus we obtain new 3x3 matrix
Fuchs--Garnier pairs for the third and fifth Painleve' equations, together with
the previously known Fuchs--Garnier pair for the fourth and sixth Painleve'
equations. These Fuchs--Garnier pairs have an important feature: they are
linear with respect to the spectral parameter. Therefore we can apply the
Laplace transform to study these pairs. In this way we found reductions of all
pairs to the standard 2x2 matrix Fuchs--Garnier pairs obtained by M. Jimbo and
T. Miwa. As an application of the 3x3 matrix pairs, we found an integral
auto-transformation for the standard Fuchs--Garnier pair for the fifth
Painleve' equation. It generates an Okamoto-like B\""acklund transformation for
the fifth Painleve' equation. Another application is an integral transformation
relating two different 2x2 matrix Fuchs--Garnier pairs for the third Painleve'
equation.
","[{""version"":""v1"",""created"":""Tue, 12 Jun 2007 17:36:45 GMT""},{""version"":""v2"",""created"":""Thu, 13 Sep 2007 18:52:03 GMT""},{""version"":""v3"",""created"":""Thu, 15 Nov 2007 14:33:33 GMT""}]","2007-11-15"
"0706.1751","Maximilien Gadouleau","Maximilien Gadouleau and Zhiyuan Yan","MacWilliams Identity for Codes with the Rank Metric","25 pages, submitted to EURASIP Journal on Wireless Communications",,,,"cs.IT math.IT",,"  The MacWilliams identity, which relates the weight distribution of a code to
the weight distribution of its dual code, is useful in determining the weight
distribution of codes. In this paper, we derive the MacWilliams identity for
linear codes with the rank metric, and our identity has a different form than
that by Delsarte. Using our MacWilliams identity, we also derive related
identities for rank metric codes. These identities parallel the binomial and
power moment identities derived for codes with the Hamming metric.
","[{""version"":""v1"",""created"":""Tue, 12 Jun 2007 17:38:47 GMT""},{""version"":""v2"",""created"":""Mon, 23 Jul 2007 17:56:07 GMT""},{""version"":""v3"",""created"":""Wed, 28 Nov 2007 03:36:59 GMT""}]","2007-11-28"
"0706.1752","Alexander  Rezounenko V","Alexander V. Rezounenko","Partial Inertial Manifolds for infinite-dimensional dynamical systems:
  Example for P.D.E.s with a state-dependent delay","13 pages",,,,"math.DS math.AP",,"  We propose a new notion of Partial Inertial Manifold to study the long-time
asymptotic behavior of dissipative differential equations. As shown on an
example, such manifolds may exist in the cases when the classical Inertial
manifold does not exist (or not known to exist).
","[{""version"":""v1"",""created"":""Tue, 12 Jun 2007 17:41:12 GMT""}]","2007-06-13"
"0706.1753","Christian Houdre","Christian Houdr\'e, Hua Xu","Concentration of the Spectral Measure for Large Random Matrices with
  Stable Entries","35 pages",,,,"math.PR math.ST stat.TH",,"  We derive concentration inequalities for functions of the empirical measure
of large random matrices with infinitely divisible entries and, in particular,
stable ones. We also give concentration results for some other functionals of
these random matrices, such as the largest eigenvalue or the largest singular
value.
","[{""version"":""v1"",""created"":""Tue, 12 Jun 2007 18:01:23 GMT""}]","2007-06-13"
