"0706.2476","Pierpaolo Vivo","Pierpaolo Vivo, Satya N. Majumdar","On invariant 2x2 \beta-ensembles of random matrices","Minor modifications. Published version","Physica A 387 (2008) 4839-4855","10.1016/j.physa.2008.03.009",,"math-ph cond-mat.stat-mech math.MP","http://arxiv.org/licenses/nonexclusive-distrib/1.0/","  We introduce and solve exactly a family of invariant 2x2 random matrices,
depending on one parameter \eta, and we show that rotational invariance and
real Dyson index \beta are not incompatible properties. The probability density
for the entries contains a weight function and a multiple trace-trace
interaction term, which corresponds to the representation of the
Vandermonde-squared coupling on the basis of power sums. As a result, the
effective Dyson index \beta_{eff} of the ensemble can take any real value in an
interval. Two weight functions (Gaussian and non-Gaussian) are explored in
detail and the connections with \beta-ensembles of Dumitriu-Edelman and the
so-called Poisson-Wigner crossover for the level spacing are respectively
highlighted. A curious spectral twinning between ensembles of different
symmetry classes is unveiled. The proposed technical tool more generically
allows for designing actual matrix models which i) are rotationally invariant;
ii) have a real Dyson index \beta_{eff}; iii) have a pre-assigned confining
potential or alternatively level-spacing profile. The analytical results have
been checked through numerical simulations with an excellent agreement.
Eventually, we discuss possible generalizations and further directions of
research.
","[{""version"":""v1"",""created"":""Sun, 17 Jun 2007 13:59:27 GMT""},{""version"":""v2"",""created"":""Mon, 15 Oct 2007 19:49:37 GMT""},{""version"":""v3"",""created"":""Wed, 11 Jun 2008 14:31:35 GMT""}]","2009-11-13"
"0706.2477","Andrzej M. Oles","Andrzej M. Oles, Peter Horsch, and Giniyat Khaliullin","Spin-orbital entanglement near quantum phase transitions","5 pages, 4 figures","Phys. Status Solidi B 244, 2378 (2007)","10.1002/pssb.200674619",,"cond-mat.str-el",,"  Spin-orbital entanglement in the ground state of a one-dimensional
SU(2)$\otimes$SU(2) spin-orbital model is analyzed using exact diagonalization
of finite chains. For $S=1/2$ spins and $T=1/2$ pseudospins one finds that the
quantum entanglement is similar at the SU(4) symmetry point and in the
spin-orbital valence bond state. We also show that quantum transitions in
spin-orbital models turn out to be continuous under certain circumstances, in
constrast to the discontinuous transitions in spin models with SU(2) symmetry.
","[{""version"":""v1"",""created"":""Sun, 17 Jun 2007 14:00:12 GMT""}]","2007-06-19"
"0706.2478","Johannes Bluemlein","J. Bl\""umlein, B. Geyer, and D. Robaschik","Target Mass Corrections in Diffractive Scattering","1 latex file + 1 style file,Proceedings of 15th International
  Workshop on Deep-Inelastic Scattering and Related Subjects (DIS2007), Munich,
  Germany, 16-20 Apr, 2007",,,"DESY 07/084, SFB/CPP-07-29","hep-ph hep-ex",,"  We describe the twist-2 contributions to inclusive unpolarized and polarized
deep-inelastic diffractive scattering in an operator approach. The
representation refers to the observed large rapidity gap but does not require
reference to a pomeron picture. We discuss both the case of vanishing target
mass $M$ and momentum transfer $t$ as well as the effects at finite $t$ and
$M$, which lead to modifications at large $\beta$ and low values of $Q^2$.
","[{""version"":""v1"",""created"":""Sun, 17 Jun 2007 14:10:06 GMT""}]","2007-06-19"
"0706.2479","Nicolas Schabanel","Damien Regnault and Nicolas Schabanel and \'Eric Thierry","Progresses in the Analysis of Stochastic 2D Cellular Automata: a Study
  of Asynchronous 2D Minority",,,,,"cs.DM",,"  Cellular automata are often used to model systems in physics, social
sciences, biology that are inherently asynchronous. Over the past 20 years,
studies have demonstrated that the behavior of cellular automata drastically
changed under asynchronous updates. Still, the few mathematical analyses of
asynchronism focus on one-dimensional probabilistic cellular automata, either
on single examples or on specific classes. As for other classic dynamical
systems in physics, extending known methods from one- to two-dimensional
systems is a long lasting challenging problem.
  In this paper, we address the problem of analysing an apparently simple 2D
asynchronous cellular automaton: 2D Minority where each cell, when fired,
updates to the minority state of its neighborhood. Our experiments reveal that
in spite of its simplicity, the minority rule exhibits a quite complex response
to asynchronism. By focusing on the fully asynchronous regime, we are however
able to describe completely the asymptotic behavior of this dynamics as long as
the initial configuration satisfies some natural constraints. Besides these
technical results, we have strong reasons to believe that our techniques
relying on defining an energy function from the transition table of the
automaton may be extended to the wider class of threshold automata.
","[{""version"":""v1"",""created"":""Sun, 17 Jun 2007 14:12:31 GMT""}]","2007-06-19"
"0706.2481","Piotr Garbaczewski","Piotr Garbaczewski","Information functionals and the notion of (un)certainty: RMT - inspired
  case","Presented at the 3rd Workshop on Quantum Chaos and Localization
  Phenomena, Warsaw May 25-27,2007","Acta Phys. Pol. A 112, (2007), 619-634",,,"quant-ph cond-mat.stat-mech math-ph math.MP nlin.CD physics.data-an",,"  Information functionals allow to quantify the degree of randomness of a given
probability distribution, either absolutely (through min/max entropy
principles) or relative to a prescribed reference one. Our primary aim is to
analyze the ""minimum information"" assumption, which is a classic concept (R.
Balian, 1968) in the random matrix theory. We put special emphasis on generic
level (eigenvalue) spacing distributions and the degree of their randomness, or
alternatively - information/organization deficit.
","[{""version"":""v1"",""created"":""Sun, 17 Jun 2007 14:35:39 GMT""}]","2007-11-22"
"0706.2482","Oleg Raichev E","O. E. Raichev","Intrinsic Spin Hall Effect: Topological Transitions in Two-Dimensional
  Systems","4 pages, 3 figures, submitted to Physical Review Letters on 14 March
  2007, revised 21 May 2007",,"10.1103/PhysRevLett.99.236804",,"cond-mat.mes-hall",,"  The spin-Hall conductivity in spatially-homogeneous two-dimensional electron
systems described by the spin-orbit Hamiltonian \hbar \Omega_p \sigma is
presented as a sum of the universal part Me/8 \pi \hbar determined by the Berry
phase \Phi=M \pi (M is an odd integer, the winding number of the vector
\Omega_p) and a non-universal part which vanishes under certain conditions
determined by the analytical properties of \Omega_p. The analysis reveals a
rich and complicated behavior of the spin-Hall conductivity which is relevant
to both electron and hole states in quantum wells and can be detected in
experiments.
","[{""version"":""v1"",""created"":""Sun, 17 Jun 2007 14:32:05 GMT""}]","2009-11-13"
"0706.2484","Bau-Sen Du","Bau-Sen Du","Congruence Identities Arising From Dynamical Systems","5 pages","Appl. Math. Letters, 12(1999), 115-119",,,"math.NT math.DS",,"  By counting the numbers of periodic points of all periods for some interval
maps, we obtain infinitely many new congruence identities in number theory.
","[{""version"":""v1"",""created"":""Sun, 17 Jun 2007 14:57:50 GMT""}]","2007-06-19"
"0706.2485","Roberto de Toledo Assumpcao","R Assumpcao","Time and Entropy in the Foundations of Mechanics","6 pages, 3 figures; to appear in ICEE 2007, Coimbra, Portugal",,,,"physics.gen-ph",,"  This contribution analyses the classical laws of motion by means of an
approach relating time and entropy. We argue that adopting the notion of change
of states as opposed to the usual derivation of Newton's laws in terms of
fields a broader picture is obtained, suggesting that diverse branches of
physics- classical, quantum, relativistic and statistical mechanics - turn out
to be related by a common foundation.
","[{""version"":""v1"",""created"":""Sun, 17 Jun 2007 15:08:44 GMT""}]","2007-06-19"
"0706.2486","Yury Bliokh P","K. Yu. Bliokh, Yu. P. Bliokh, S. Savel'ev, and F. Nori","Semiclassical Dynamics of Electron Wave Packet States with Phase
  Vortices","5 pages, 2 figures, revised version, to appear in Phys. Rev. Lett","Phys.Rev.Lett.99:190404,2007","10.1103/PhysRevLett.99.190404",,"quant-ph cond-mat.mes-hall cond-mat.other physics.optics",,"  We consider semiclassical higher-order wave packet solutions of the
Schrodinger equation with phase vortices. The vortex line is aligned with the
propagation direction, and the wave packet carries a well-defined orbital
angular momentum (OAM) $\hbar l$ ($l$ is the vortex strength) along its main
linear momentum. The probability current coils around momentum in such OAM
states of electrons. In an electric field, these states evolve like massless
particles with spin $l$. The magnetic-monopole Berry curvature appears in
momentum space, which results in a spin-orbit-type interaction and a
Berry/Magnus transverse force acting on the wave packet. This brings about the
OAM Hall effect. In a magnetic field, there is a Zeeman interaction, which, can
lead to more complicated dynamics.
","[{""version"":""v1"",""created"":""Sun, 17 Jun 2007 15:09:28 GMT""},{""version"":""v2"",""created"":""Thu, 5 Jul 2007 13:41:53 GMT""},{""version"":""v3"",""created"":""Wed, 12 Sep 2007 13:42:54 GMT""}]","2008-11-26"
