"0706.2363","Miranda C.N. Cheng","Miranda C.N. Cheng, Erik Verlinde","Dying Dyons Don't Count","27 pages, 2 figures; one minus sign corrected","JHEP 0709:070,2007","10.1088/1126-6708/2007/09/070","ITFA-07-22","hep-th","http://arxiv.org/licenses/nonexclusive-distrib/1.0/","  The dyonic 1/4-BPS states in 4D string theory with N=4 spacetime
supersymmetry are counted by a Siegel modular form. The pole structure of the
modular form leads to a contour dependence in the counting formula obscuring
its duality invariance. We exhibit the relation between this ambiguity and the
(dis-)appearance of bound states of 1/2-BPS configurations. Using this insight
we propose a precise moduli-dependent contour prescription for the counting
formula. We then show that the degeneracies are duality-invariant and are
correctly adjusted at the walls of marginal stability to account for the
(dis-)appearance of the two-centered bound states. Especially, for large black
holes none of these bound states exists at the attractor point and none of
these ambiguous poles contributes to the counting formula. Using this fact we
also propose a second, moduli-independent contour which counts the ""immortal
dyons"" that are stable everywhere.
","[{""version"":""v1"",""created"":""Sun, 17 Jun 2007 08:01:57 GMT""},{""version"":""v2"",""created"":""Fri, 31 Oct 2008 20:27:43 GMT""}]","2009-11-18"
"0706.2399","Yong-Seon Song","Yong-Seon Song, Hiranya Peiris, Wayne Hu (KICP, UChicago)","Cosmological Constraints on f(R) Acceleration Models","8 pages, 7 figures","Phys.Rev.D76:063517,2007","10.1103/PhysRevD.76.063517",,"astro-ph gr-qc",,"  Models which accelerate the expansion of the universe through the addition of
a function of the Ricci scalar f(R) leave a characteristic signature in the
large-scale structure of the universe at the Compton wavelength scale of the
extra scalar degree of freedom. We search for such a signature in current
cosmological data sets: the WMAP cosmic microwave background (CMB) power
spectrum, SNLS supernovae distance measures, the SDSS luminous red galaxy power
spectrum, and galaxy-CMB angular correlations. Due to theoretical uncertainties
in the nonlinear evolution of f(R) models, the galaxy power spectrum
conservatively yields only weak constraints on the models despite the strong
predicted signature in the linear matter power spectrum. Currently the tightest
constraints involve the modification to the integrated Sachs-Wolfe effect from
growth of gravitational potentials during the acceleration epoch. This effect
is manifest for large Compton wavelengths in enhanced low multipole power in
the CMB and anti-correlation between the CMB and tracers of the potential. They
place a bound on the Compton wavelength of the field be less than of order the
Hubble scale.
","[{""version"":""v1"",""created"":""Sat, 16 Jun 2007 23:09:11 GMT""}]","2008-11-26"
"0706.2423","Helmut Katzgraber","Helmut G. Katzgraber, D. Herisson, M. Oesth, Per Nordblad, Atsuko Ito,
  Hiroko Aruga Katori","Finite versus zero-temperature hysteretic behavior of spin glasses:
  Experiment and theory","5 pages, 5 figures (FORC diagrams in low quality due to arXiv
  file-size limits)","Phys. Rev. B 76, 092408 (2007)","10.1103/PhysRevB.76.092408",,"cond-mat.dis-nn",,"  We present experimental results attempting to fingerprint nonanalyticities in
the magnetization curves of spin glasses found by Katzgraber et al. [Phys. Rev.
Lett. 89, 257202 (2002)] via zero-temperature Monte Carlo simulations of the
Edwards-Anderson Ising spin glass. Our results show that the singularities at
zero temperature due to the reversal-field memory effect are washed out by the
finite temperatures of the experiments. The data are analyzed via the first
order reversal curve (FORC) magnetic fingerprinting method. The experimental
results are supported by Monte Carlo simulations of the Edwards-Anderson Ising
spin glass at finite temperatures which agree qualitatively very well with the
experimental results. This suggests that the hysteretic behavior of real Ising
spin-glass materials is well described by the Edwards-Anderson Ising spin
glass. Furthermore, reversal-field memory is a purely zero-temperature effect.
","[{""version"":""v1"",""created"":""Sat, 16 Jun 2007 16:12:30 GMT""},{""version"":""v2"",""created"":""Sun, 30 Sep 2007 10:25:06 GMT""}]","2007-09-30"
"0706.2425","Fernando Donado","F. Donado and J.L. Carrillo","Long time viscosity of dilute magnetorheological dispersions under
  periodic magnetic perturbations","9 pages, 11 figures",,,,"cond-mat.soft",,"  The effect of periodic magnetic perturbations on the rheological properties
of a low concentration magnetorheological dispersion is studied experimentally.
It is found that an important increment in the measured viscosity occurs when
in addition to a static field a magnetic periodic perturbation is applied. The
magnitude of these changes depend on the amplitude and frequency of the
perturbation as well as on the simultaneity of the application of the static
field and the perturbation. These findings are discussed in terms of the
observed rearrangement of the cluster structure in the dispersion.
","[{""version"":""v1"",""created"":""Sat, 16 Jun 2007 16:30:44 GMT""}]","2007-06-19"
"0706.2426","Johannes Bluemlein","Johannes Bl\""umlein and Sebastian Klein","Structural Relations between Harmonic Sums up to w=6","1 latex + 1 style file, to appear in the proceedings of 15th
  International Workshop on Deep-Inelastic Scattering and Related Subjects
  (DIS2007), Munich, Germany, 16-20 Apr 2007","PoSACAT:084,2007","10.3360/dis.2007.209","DESY 07/082, SFB/CPP-07-27","hep-ph math-ph math.MP",,"  Multiply nested finite harmonic sums $S_{a_1 ... a_n}(N)$ occur in many
single scale higher order calculations in Quantum Field Theory. We discuss
their algebraic and structural relations to weight {\sf w=6}. As an example, we
consider the application of these relations to the soft and virtual corrections
for Bhabha-scattering to $O(\alpha^2)$.
","[{""version"":""v1"",""created"":""Sat, 16 Jun 2007 16:33:16 GMT""}]","2008-11-26"
"0706.2427","Li-Gang Wang","Li-Gang Wang, and Cheng-Liang Zhao","Dynamic radiation force of a pulsed Gaussian beam acting on a Rayleigh
  dielectric sphere","6 pages,5 figures,","publised in Optics Express, vol. 15, 10615 (2007)","10.1364/OE.15.010615",,"physics.optics",,"  We investigate the dynamic evolution of the radiation forces produced by the
pulsed Gaussian beams acting on a Rayleigh dielectric sphere. We derive the
analytical expressions for the scattering force and all components of the
ponderomotive force induced by the pulsed Gaussian beams. Our analysis shows
that the radiation force, for both the transverse and longitudinal components,
can be greatly enhanced as the pulse duration decreases. It is further found
that for the pulse with long pulse duration, it can be used for the stable
trapping and manipulating the particle, while for the pulse with short pulse
duration it may be used for guiding and moving the small dielectric particle.
Finally we discuss the stability conditions of the effective manipulating the
particle by the pulsed beam.
","[{""version"":""v1"",""created"":""Sat, 16 Jun 2007 16:47:41 GMT""},{""version"":""v2"",""created"":""Tue, 15 Jan 2008 09:08:04 GMT""}]","2009-11-13"
"0706.2428","Irina Nenciu","Michael Gekhtman, Irina Nenciu","Multi-Hamiltonian structure for the finite defocusing Ablowitz-Ladik
  equation",,,,,"nlin.SI math-ph math.MP",,"  We study the Poisson structure associated to the defocusing Ablowitz-Ladik
equation from a functional-analytical point of view, by reexpressing the
Poisson bracket in terms of the associated Caratheodory function. Using this
expression, we are able to introduce a family of compatible Poisson brackets
which form a multi-Hamiltonian structure for the Ablowitz-Ladik equation.
Furthermore, we show using some of these new Poisson brackets that the
Geronimus relations between orthogonal polynomials on the unit circle and those
on the interval define an algebraic and symplectic mapping between the
Ablowitz-Ladik and Toda hierarchies.
","[{""version"":""v1"",""created"":""Sat, 16 Jun 2007 16:50:25 GMT""}]","2011-03-25"
"0706.2429","Bing He","Bing He, Janos A. Bergou and Yuhang Ren","Universal discriminator for completely unknown optical qubits","accepted publication version in PRA","Phys. Rev. A 76, 032301 (2007)","10.1103/PhysRevA.76.032301",,"quant-ph",,"  We propose an experimental setup that is capable of unambiguously
discriminating any pair of linearly independent single photon polarization
qubits, about which we don't have any knowledge except that an extra pair of
these unknown states are provided as the reference. This setup, which is
constructed with optical CNOT gates, weak cross Kerr non-linearities, Bell
state analysers and other linear optical elements, transforms the unknown
triple photon input states to the corresponding single photon states to be
deterministically processed by linear optics circuit. The optimal
discrimination of the unknown states is achieved by this setup.
","[{""version"":""v1"",""created"":""Sat, 16 Jun 2007 17:00:42 GMT""},{""version"":""v2"",""created"":""Tue, 14 Aug 2007 02:08:45 GMT""}]","2007-09-05"
"0706.2430","Johannes Bluemlein","Johannes Bl\""umlein","$\Lambda_{\rm QCD}$ and $\alpha_s(M_Z^2)$ from DIS Structure Functions","1 latex file + 1 style file, Proceedings of 15th International
  Workshop on Deep-Inelastic Scattering and Related Subjects (DIS2007), Munich,
  Germany, 16-20 Apr 2007",,,"DESY 07-083, SFB-CPP/07-28","hep-ph hep-ex",,"  A brief summary is given on recent determinations of $\Lambda_{\rm QCD}$ and
$\alpha_s(M_Z^2)$ from deeply inelastic structure functions.
","[{""version"":""v1"",""created"":""Sun, 17 Jun 2007 12:44:47 GMT""}]","2007-06-19"
"0706.2431","Adrian Riskin","Adrian Riskin","On the Cordial Deficiency of Complete Multipartite Graphs","8 pages",,,,"math.CO",,"  We calculate the cordial edge deficiencies of the complete multipartite
graphs and find an upper bound for their cordial vertex deficiencies. We also
give conditions under which the tensor product of two cordial graphs is
cordial.
","[{""version"":""v1"",""created"":""Sat, 16 Jun 2007 17:12:00 GMT""}]","2007-06-19"
"0706.2433","Adrian Riskin","Adrian Riskin","A system for constructing relatively small polyhedra from Sonob\'e
  modules","4 pages. Mathematical origami methods","British Origami Issue 245 August 2007",,,"math.GM",,"  We develop a quite elementary graph theoretic system for designing small-size
augmented origami polyhedra out of Sonob\'e modules beginning with a (convex or
not) deltahedron.
","[{""version"":""v1"",""created"":""Sat, 16 Jun 2007 17:19:05 GMT""}]","2007-08-25"
"0706.2434","RadhaKrishna Ganti","RadhaKrishna Ganti and Martin Haenggi","Interference and Outage in Clustered Wireless Ad Hoc Networks","Submitted to IEEE Transactions on Information Theory",,"10.1109/TIT.2009.2025543",,"cs.IT math.IT",,"  In the analysis of large random wireless networks, the underlying node
distribution is almost ubiquitously assumed to be the homogeneous Poisson point
process. In this paper, the node locations are assumed to form a Poisson
clustered process on the plane. We derive the distributional properties of the
interference and provide upper and lower bounds for its CCDF. We consider the
probability of successful transmission in an interference limited channel when
fading is modeled as Rayleigh. We provide a numerically integrable expression
for the outage probability and closed-form upper and lower bounds.We show that
when the transmitter-receiver distance is large, the success probability is
greater than that of a Poisson arrangement. These results characterize the
performance of the system under geographical or MAC-induced clustering. We
obtain the maximum intensity of transmitting nodes for a given outage
constraint, i.e., the transmission capacity (of this spatial arrangement) and
show that it is equal to that of a Poisson arrangement of nodes. For the
analysis, techniques from stochastic geometry are used, in particular the
probability generating functional of Poisson cluster processes, the Palm
characterization of Poisson cluster processes and the Campbell-Mecke theorem.
","[{""version"":""v1"",""created"":""Sat, 16 Jun 2007 17:23:43 GMT""}]","2010-10-11"
"0706.2435","Carlos Palenzuela","C. Palenzuela, L. Lehner and S.L. Liebling","Orbital Dynamics of Binary Boson Star Systems","10 pages, 14 figures","Phys.Rev.D77:044036,2008","10.1103/PhysRevD.77.044036",,"gr-qc astro-ph math-ph math.MP",,"  We extend our previous studies of head-on collisions of boson stars by
considering orbiting binary boson stars. We concentrate on equal mass binaries
and study the dynamical behavior of boson/boson and boson/antiboson pairs. We
examine the gravitational wave output of these binaries and compare with other
compact binaries. Such a comparison lets us probe the apparent simplicity
observed in gravitational waves produced by black hole binary systems. In our
system of interest however, there is an additional internal freedom which plays
a significant role in the system's dynamics, namely the phase of each star. Our
evolutions show rather simple behavior at early times, but large differences
occur at late times for the various initial configurations.
","[{""version"":""v1"",""created"":""Sat, 16 Jun 2007 17:29:13 GMT""}]","2008-11-26"
"0706.2436","Li-Gang Wang","Li-Gang Wang","Hollow Gaussian Schell-model beam and its propagation","13pages, 2 figures",,"10.1016/j.optcom.2007.11.018",,"physics.optics",,"  In this paper, we present a new model, hollow Gaussian-Schell model beams
(HGSMBs), to describe the practical dark hollow beams. An analytical
propagation formula for HGSMBs passing through a paraxial first-order optical
system is derived based on the theory of coherence. Based on the derived
formula, an application example showing the influence of spatial coherence on
the propagation of beams is illustrated. It is found that the beam propagating
properties of HGSMBs will be greatly affected by their spatial coherence. Our
model provides a very convenient way for analyzing the propagation properties
of partially coherent dark hollow beams.
","[{""version"":""v1"",""created"":""Sat, 16 Jun 2007 17:34:03 GMT""}]","2009-11-13"
"0706.2437","Take Nakama","James Allen Fill, Take Nakama","Analysis of the expected number of bit comparisons required by
  Quickselect","32 pages, 1 figure",,,,"math.PR",,"  When algorithms for sorting and searching are applied to keys that are
represented as bit strings, we can quantify the performance of the algorithms
not only in terms of the number of key comparisons required by the algorithms
but also in terms of the number of bit comparisons. Some of the standard
sorting and searching algorithms have been analyzed with respect to key
comparisons but not with respect to bit comparisons. In this paper, we
investigate the expected number of bit comparisons required by Quickselect
(also known as Find). We develop exact and asymptotic formulae for the expected
number of bit comparisons required to find the smallest or largest key by
Quickselect and show that the expectation is asymptotically linear with respect
to the number of keys. Similar results are obtained for the average case. For
finding keys of arbitrary rank, we derive an exact formula for the expected
number of bit comparisons that (using rational arithmetic) requires only finite
summation (rather than such operations as numerical integration) and use it to
compute the expectation for each target rank.
","[{""version"":""v1"",""created"":""Sat, 16 Jun 2007 18:41:24 GMT""}]","2009-04-16"
"0706.2438","Sam Payne","Sam Payne","Adelic amoebas disjoint from open halfspaces","8 pages. v2: minor typographic changes, updated references. To appear
  in Crelle's Journal","J. reine angew. Math. 625 (2008), 115--123.",,,"math.AG math.DS","http://arxiv.org/licenses/nonexclusive-distrib/1.0/","  We show that a conjecture of Einsiedler, Kapranov, and Lind on adelic amoebas
of subvarieties of tori and their intersections with open halfspaces of
complementary dimension is false for subvarieties of codimension greater than
one that have degenerate projections to smaller dimensional tori. We prove a
suitably modified version of the conjecture using algebraic methods,
functoriality of tropicalization, and a theorem of Zhang on torsion points in
subvarieties of tori.
","[{""version"":""v1"",""created"":""Sat, 16 Jun 2007 18:21:20 GMT""},{""version"":""v2"",""created"":""Wed, 23 Jul 2008 19:11:11 GMT""}]","2008-12-07"
"0706.2439","Moira Chas","Moira Chas","Minimal intersection of curves on surfaces","49 pages, 9 figures",,,,"math.GT math.GR",,"  In the eighties Goldman discovered a Lie algebra structure on the vector
space generated by the free homotopy classes of oriented curves on an oriented
surface. The Lie bracket [a,b] is defined as the signed sum over the
intersection points of a and b of the loop product of at the intersection
points.
  If one of the classes has a simple representative we give a combinatorial
group theory description of the terms of the Lie bracket and prove that this
bracket has as many terms, counted with multiplicity, as the minimal number of
intersection points of a and b. In other words the bracket with a simple
element has no cancellation and determines minimal intersection numbers. We
show that analogous results hold for the Lie bracket (also discovered by
Goldman) of unoriented curves. We give three applications: a factorization of
Thurston's map defining the boundary of Teichmuller space, various
decompositions of the underlying vector space of conjugacy classes into ad
invariant subspaces and a connection between bijections of the set of conjugacy
classes of curves on a surface preserving the Goldman bracket and the mapping
class group.
","[{""version"":""v1"",""created"":""Sat, 16 Jun 2007 18:17:27 GMT""},{""version"":""v2"",""created"":""Tue, 6 May 2008 14:05:24 GMT""}]","2008-05-06"
"0706.2440","Thomas Markwig","Thomas Keilen","Reducible Families of Curves with Ordinary Multiple Points on Surfaces
  in Projective Three-Space","5 pages","Comm. in Algebra 34,5 (2006), 1921-1926",,"MR2229499","math.AG",,"  In math.AG/0108089, math.AG/0212090 and math.AG/0308247 we gave numerical
conditions which ensure that an equisingular family is irreducible respectively
T-smooth. Combining results by Greuel, Lossen and Shustin and an idea from
math.AG/9802009 we give in the present paper series of examples of families of
irreducible curves on surfaces in projective three-space with only ordinary
multiple points which are reducible and where at least one component does not
have the expected dimension. The examples show that for families of curves with
ordinary multiple points the conditions for T-smoothness in math.AG/0308247
have the right asymptotics.
","[{""version"":""v1"",""created"":""Sat, 16 Jun 2007 18:45:09 GMT""}]","2009-07-28"
"0706.2441","Thomas Markwig","Thomas Markwig","Some obstructed equisingular families of curves on surfaces in
  projective three-space","8 pages","Singularity theory, 715--723, World Sci. Publ., Hackensack, NJ,
  2007",,"MR2342936","math.AG",,"  Very few examples of obstructed equsingular families of curves on surfaces
other than the projective plane are known. Combining results from Westenberger
and Hirano with an idea from math.AG/9802009 we give in the present paper
series of examples of families of irreducible curves with simple singularities
on surfaces in projective three-space which are not T--smooth, i.e. do not have
the expected dimension, and we compare this with conditions (showing the same
asymptotics) which ensure the existence of a T--smooth component.
","[{""version"":""v1"",""created"":""Sat, 16 Jun 2007 18:53:15 GMT""}]","2009-07-28"
"0706.2442","Pablo D. Esquinazi","J. Barzola-Quiquia, P. Esquinazi, M. Rothermel, D. Spemann, T. Butz,
  and N. Garc\'ia","Experimental Evidence for Two-Dimensional Magnetic Order in Proton
  Bombarded Graphite","4 pages, 3 figures",,"10.1103/PhysRevB.76.161403",,"cond-mat.str-el cond-mat.mtrl-sci",,"  We have prepared magnetic graphite samples bombarded by protons at low
temperatures and low fluences to attenuate the large thermal annealing produced
during irradiation. An overall optimization of sample handling allowed us to
find Curie temperatures $ T_c \gtrsim 350$ K at the used fluences. The
magnetization versus temperature shows unequivocally a linear dependence, which
can be interpreted as due to excitations of spin waves in a two dimensional
Heisenberg model with a weak uniaxial anisotropy.
","[{""version"":""v1"",""created"":""Sat, 16 Jun 2007 19:33:16 GMT""}]","2009-11-13"
"0706.2444","Hyung Won Lee","Kyoung Yee Kim, Hyung Won Lee and Yun Soo Myung","Holographic interacting dark energy in the braneworld cosmology","17 pages, 4 figures","Mod.Phys.Lett.A22:2631-2645,2007","10.1142/S0217732307025765","INJE-TP-07-04","gr-qc astro-ph hep-th",,"  We investigate a model of brane cosmology to find a unified description of
the radiation-matter-dark energy universe. It is of the interacting holographic
dark energy with a bulk-holographic matter $\chi$. This is a five-dimensional
cold dark matter, which plays a role of radiation on the brane. Using the
effective equations of state $\omega^{\rm eff}_{\rm \Lambda}$ instead of the
native equations of state $\omega_{\rm \Lambda}$, we show that this model
cannot accommodate any transition from the dark energy with $\omega^{\rm
eff}_{\rm \Lambda}\ge-1$ to the phantom regime $\omega^{\rm eff}_{\rm
\Lambda}<-1$. Furthermore, the case of interaction between cold dark matter and
five dimensional cold dark matter is considered for completeness. Here we find
that the redshift of matter-radiation equality $z_{\rm eq}$ is the same order
as $z^{\rm ob}_{\rm eq}=2.4\times10^{4} \Omega_{\rm m}h^2$. Finally, we obtain
a general decay rate $\Gamma$ which is suitable for describing all interactions
including the interaction between holographic dark energy and cold dark matter.
","[{""version"":""v1"",""created"":""Sat, 16 Jun 2007 21:12:38 GMT""}]","2008-11-26"
"0706.2446","Mathis Stephane","S. Mathis, J.-P. Zahn","Transport and mixing by internal waves in stellar interiors: effect of
  the Coriolis force","4 pages, SF2A-2005: Semaine de l'Astrophysique Francaise, meeting
  held in Strasbourg, France, June 27 - July 1, 2005, Edited by F. Casoli, T.
  Contini, J.M. Hameury and L. Pagani. Published by EdP-Sciences, Conference
  Series, 2005, p. 319",,,,"astro-ph",,"  We briefly recall the physical background of the transport of angular
momentum and the mixing of chemicals inside stellar radiation zones and its
importance for stellar evolution. Then, we describe its present modeling, its
successes and its weaknesses. Next, we introduce the new theoretical
developments that allow us to treat in a self-consistent way the effect of the
Coriolis force on the low-frequencies internal waves and its consequences for
the transport processes. This research is aimed at improving the modeling of
stellar interiors in the perspective of future astero and helioseismology
missions such as COROT and GOLF-NG.
","[{""version"":""v1"",""created"":""Sat, 16 Jun 2007 22:05:02 GMT""}]","2007-06-19"
"0706.2447","Laurent Marcoux","K. R. Davidson, R. Levene, L. W. Marcoux and H. Radjavi","On the topological stable rank of non-selfadjoint operator algebras","14 pages",,,,"math.OA",,"  We provide a negative solution to a question of M. Rieffel who asked if the
right and left topological stable ranks of a Banach algebra must always agree.
Our example is found amongst a class of nest algebras. We show that for many
other nest algebras, both the left and right topological stable ranks are
infinite. We extend this latter result to Popescu's non-commutative disc
algebras and to free semigroup algebras as well.
","[{""version"":""v1"",""created"":""Sat, 16 Jun 2007 22:15:02 GMT""}]","2007-06-19"
"0706.2448","Roberto M. Serra","E. I. Duzzioni, R. M. Serra, and M. H. Y. Moussa","A general treatment of geometric phases and dynamical invariants",,"Europhys. Lett. 82, 20007 (2008)","10.1209/0295-5075/82/20007",,"quant-ph",,"  Based only on the parallel transport condition, we present a general method
to compute Abelian or non-Abelian geometric phases acquired by the basis states
of pure or mixed density operators, which also holds for nonadiabatic and
noncyclic evolution. Two interesting features of the non-Abelian geometric
phase obtained by our method stand out: i) it is a generalization of Wilczek
and Zee's non-Abelian holonomy, in that it describes nonadiabatic evolution
where the basis states are parallelly transported between distinct degenerate
subspaces, and ii) the non-Abelian character of our geometric phase relies on
the transitional evolution of the basis states, even in the nondegenerate case.
We apply our formalism to a two-level system evolving nonadiabatically under
spontaneous decay to emphasize the non-Abelian nature of the geometric phase
induced by the reservoir. We also show, through the generalized invariant
theory, that our general approach encompasses previous results in the
literature.
","[{""version"":""v1"",""created"":""Sat, 16 Jun 2007 22:15:10 GMT""},{""version"":""v2"",""created"":""Mon, 17 Sep 2007 21:22:07 GMT""},{""version"":""v3"",""created"":""Thu, 28 Feb 2008 18:03:04 GMT""}]","2008-04-17"
