"0706.3403","Luciano da Fontoura Costa","Paulino R. Villas Boas, Francisco A. Rodrigues, Gonzalo Travieso and
  Luciano da F. Costa","Border trees of complex networks","5 pages, 1 figure, 2 tables. A working manuscript, comments and
  suggestions welcomed",,"10.1088/1751-8113/41/22/224005",,"physics.comp-ph",,"  The comprehensive characterization of the structure of complex networks is
essential to understand the dynamical processes which guide their evolution.
The discovery of the scale-free distribution and the small world property of
real networks were fundamental to stimulate more realistic models and to
understand some dynamical processes such as network growth. However, properties
related to the network borders (nodes with degree equal to one), one of its
most fragile parts, remain little investigated and understood. The border nodes
may be involved in the evolution of structures such as geographical networks.
Here we analyze complex networks by looking for border trees, which are defined
as the subgraphs without cycles connected to the remainder of the network
(containing cycles) and terminating into border nodes. In addition to
describing an algorithm for identification of such tree subgraphs, we also
consider a series of their measurements, including their number of vertices,
number of leaves, and depth. We investigate the properties of border trees for
several theoretical models as well as real-world networks.
","[{""version"":""v1"",""created"":""Fri, 22 Jun 2007 20:20:25 GMT""}]","2009-11-13"
"0706.3404","Shangli Ou","Shangli Ou, Jianghui Ji, Lin Liu, Xiaomeng Peng","Disk-Planet Interaction Simulations: (I) Baroclinic Generation of
  Vortensity and Non-Axisymmetric Rossby-Wave-Instability","~ 30 pages, Ap. J. in press",,"10.1086/521012",,"astro-ph",,"  We use a multi-dimensional hydrodynamics code to study the gravitational
interaction between an embedded planet and a protoplanetary disk with emphasis
on the generation of vortensity (potential vorticity) through a Baroclinic
Instability and subsequent development of Rossby-Wave-Instability (RWI). It is
found that the generation of potential vorticity is very common and effective
in non-barotropic disks through the Baroclinic Instability, especially within
the coorbital region. Our results also complement previous studies by
\citet{KLL03} that non-axisymmetric RWIs are likely to develop at local minima
of potential vorticity distribution that are generated by the interaction
between a planet and a inviscid barotropic disk. This second instability
appears to be very common and robust, regardless of the equation of state,
initial density distribution, and rotational law of the disk. The development
of RWIs results in non-axisymmetric density blobs, which exert stronger torques
onto the planet when they travel in the vicinity of the planet. As a result of
that, large amplitude oscillations are introduced to the time behavior of the
total torque acted on the planet by the disk. In our current simulations, RWIs
do not change the overall picture of inward orbital migration but bring in a
non-monotonic behavior to the migration speed. As a side effect, RWIs also
introduce interesting structures into the disk. These structures may help the
formation of Earth-like planets in the Habitable Zone or Hot Earths interior to
a close-in giant planet.
","[{""version"":""v1"",""created"":""Fri, 22 Jun 2007 20:20:49 GMT""}]","2009-11-13"
"0706.3406","Ganpathy Murthy","Ganpathy Murthy","A Universal Interacting Crossover Regime in Two-Dimensional Quantum Dots","4 pages, 1 figure",,"10.1103/PhysRevB.77.073309",,"cond-mat.mes-hall",,"  Interacting electrons in quantum dots with large Thouless number $g$ in the
three classical random matrix symmetry classes are well-understood. When a
specific type of spin-orbit coupling known to be dominant in two dimensional
semiconductor quantum dots is introduced, we show that a new interacting
quantum critical crossover energy scale emerges and low-energy quasiparticles
generically have a decay width proportional to their energy. The low-energy
physics of this system is an example of a universal interacting crossover
regime.
","[{""version"":""v1"",""created"":""Fri, 22 Jun 2007 20:34:03 GMT""}]","2009-11-13"
"0706.3407","Jeronimo Bernard-Salas","S.R. Pottasch, J. Bernard-Salas, T.L. Roellig","Abundances of Planetary Nebula M1-42","9 pages, 8 tables, 1 figure. Accepted for publication in A&A",,"10.1051/0004-6361:20077381",,"astro-ph",,"  The spectra of the planetary nebula M1-42 is reanalysed using spectral
measurements made in the mid-infrared with the Spitzer Space Telescope. The aim
is to determine the chemical composition of this object. We also make use of
ISO, IUE and ground based spectra. Abundances determined from the mid- and
far-infrared lines, which are insensitive to electron temperature, are used as
the basis for the determination of the composition, which are found to
substantially differ from earlier results. High values of neon, argon and
sulfur are found. They are higher than in other PN, with the exception of
NGC6153, a nebula of very similar abundances. The high values of helium and
nitrogen found indicate that the second dredge-up and hot bottom burning has
occurred in the course of evolution and that the central star was originally
more massive than 4Msun. The present temperature and luminosity of the central
star is determined and at first sight may be inconsistent with such a high
mass.
","[{""version"":""v1"",""created"":""Fri, 22 Jun 2007 20:40:00 GMT""}]","2009-11-13"
"0706.3408","Brian C. Tiburzi","Jie Hu, Fu-Jiun Jiang, Brian C. Tiburzi","Current Renormalization in Finite Volume","15pp., 4 figs, wording and discussion improved","Phys.Lett.B653:350-357,2007","10.1016/j.physletb.2007.07.060",,"hep-lat hep-ph nucl-th",,"  For finite volume field theories with discrete translational invariance,
conserved currents can be additively renormalized by infrared effects. We
demonstrate this for pions using chiral perturbation theory coupled to
electromagnetism in a periodic box. Gauge invariant single particle effective
theories are constructed to explain these results. In such theories, current
renormalization arises from operators involving the zero mode of the gauge
field. No contradictions with Ward identities, or low-energy theorems are
encountered.
","[{""version"":""v1"",""created"":""Fri, 22 Jun 2007 20:51:07 GMT""},{""version"":""v2"",""created"":""Tue, 10 Jul 2007 17:50:18 GMT""},{""version"":""v3"",""created"":""Tue, 24 Jul 2007 17:49:36 GMT""}]","2008-11-26"
"0706.3410","Gregory Moore","Alexei Kitaev, Gregory W. Moore, Kevin Walker","Noncommuting Flux Sectors in a Tabletop Experiment","17 pp. harvmac b-mode; 10 figures",,,,"hep-th",,"  We show how one can use superconductors and Josephson junctions to create a
laboratory system which can explore the groundstates of the free
electromagnetic field in a 3-manifold with torsion in its cohomology.
","[{""version"":""v1"",""created"":""Fri, 22 Jun 2007 21:14:20 GMT""}]","2007-06-26"
"0706.3411","Stephan Ritter","Ferdinand Brennecke, Tobias Donner, Stephan Ritter, Thomas Bourdel,
  Michael K\""ohl and Tilman Esslinger","Cavity QED with a Bose-Einstein condensate","6 pages, 4 figures; version accepted for publication in Nature;
  updated Fig. 4; changed atom numbers due to new calibration","Nature 450, 268-271 (2007)","10.1038/nature06120",,"quant-ph cond-mat.other",,"  Cavity quantum electrodynamics (cavity QED) describes the coherent
interaction between matter and an electromagnetic field confined within a
resonator structure, and is providing a useful platform for developing concepts
in quantum information processing. By using high-quality resonators, a strong
coupling regime can be reached experimentally in which atoms coherently
exchange a photon with a single light-field mode many times before dissipation
sets in. This has led to fundamental studies with both microwave and optical
resonators. To meet the challenges posed by quantum state engineering and
quantum information processing, recent experiments have focused on laser
cooling and trapping of atoms inside an optical cavity. However, the tremendous
degree of control over atomic gases achieved with Bose-Einstein condensation
has so far not been used for cavity QED. Here we achieve the strong coupling of
a Bose-Einstein condensate to the quantized field of an ultrahigh-finesse
optical cavity and present a measurement of its eigenenergy spectrum. This is a
conceptually new regime of cavity QED, in which all atoms occupy a single mode
of a matter-wave field and couple identically to the light field, sharing a
single excitation. This opens possibilities ranging from quantum communication
to a wealth of new phenomena that can be expected in the many-body physics of
quantum gases with cavity-mediated interactions.
","[{""version"":""v1"",""created"":""Fri, 22 Jun 2007 21:13:30 GMT""},{""version"":""v2"",""created"":""Tue, 6 Nov 2007 14:00:38 GMT""}]","2007-11-08"
"0706.3412","Blai Bonet","Nerio Borges, Blai Bonet","On Canonical Forms of Complete Problems via First-order Projections","9 pages",,,,"cs.CC",,"  The class of problems complete for NP via first-order reductions is known to
be characterized by existential second-order sentences of a fixed form. All
such sentences are built around the so-called generalized IS-form of the
sentence that defines Independent-Set. This result can also be understood as
that every sentence that defines a NP-complete problem P can be decomposed in
two disjuncts such that the first one characterizes a fragment of P as hard as
Independent-Set and the second the rest of P. That is, a decomposition that
divides every such sentence into a quotient and residue modulo Independent-Set.
  In this paper, we show that this result can be generalized over a wide
collection of complexity classes, including the so-called nice classes.
Moreover, we show that such decomposition can be done for any complete problem
with respect to the given class, and that two such decompositions are
non-equivalent in general. Interestingly, our results are based on simple and
well-known properties of first-order reductions.ow that this result can be
generalized over a wide collection of complexity classes, including the
so-called nice classes. Moreover, we show that such decomposition can be done
for any complete problem with respect to the given class, and that two such
decompositions are non-equivalent in general. Interestingly, our results are
based on simple and well-known properties of first-order reductions.
","[{""version"":""v1"",""created"":""Fri, 22 Jun 2007 21:27:06 GMT""}]","2007-06-26"
"0706.3413","Hua Wu","Hua Wu and D. I. Khomskii","Orbital ordering in the ferromagnetic insulator Cs$_2$AgF$_4$ from first
  principles","5 pages, 4 figures, 1 table; a few energy/moment entries in Table I
  are corrected due to a proper treatment of the Ag 4s semicore state","Phys. Rev. B 76, 155115 (2007)","10.1103/PhysRevB.76.155115",,"cond-mat.mtrl-sci cond-mat.str-el",,"  We found, using density-functional theory calculations within the generalized
gradient approximation, that Cs$_2$AgF$_4$ is stabilized in the insulating
orthorhombic phase rather than in the metallic tetragonal phase. The lattice
distortion present in the orthorhombic phase corresponds to the
$x^2-z^2$/$y^2-z^2$ hole-orbital ordering of the Ag$^{2+}$ $4d^9$ ions, and
this orbital ordering leads to the observed ferromagnetism, as confirmed by the
present total-energy calculations. This picture holds in the presence of
moderate 4d-electron correlation. The results are compared with the picture of
ferromagnetism based on the metallic tetragonal phase.
","[{""version"":""v1"",""created"":""Fri, 22 Jun 2007 21:30:39 GMT""},{""version"":""v2"",""created"":""Tue, 28 Aug 2007 07:34:34 GMT""}]","2007-10-23"
"0706.3415","Jeffrey Humpherys","Nicola Costanzino, Jeffrey Humpherys, Toan Nguyen, Kevin Zumbrun","Spectral stability of noncharacteristic isentropic Navier-Stokes
  boundary layers",,,"10.1007/s00205-008-0153-1",,"math.AP",,"  Building on work of Barker, Humpherys, Lafitte, Rudd, and Zumbrun in the
shock wave case, we study stability of compressive, or ""shock-like"", boundary
layers of the isentropic compressible Navier-Stokes equations with gamma-law
pressure by a combination of asymptotic ODE estimates and numerical Evans
function computations. Our results indicate stability for gamma in the interval
[1, 3] for all compressive boundary-layers, independent of amplitude, save for
inflow layers in the characteristic limit (not treated). Expansive inflow
boundary-layers have been shown to be stable for all amplitudes by Matsumura
and Nishihara using energy estimates. Besides the parameter of amplitude
appearing in the shock case, the boundary-layer case features an additional
parameter measuring displacement of the background profile, which greatly
complicates the resulting case structure. Moreover, inflow boundary layers turn
out to have quite delicate stability in both large-displacement and
large-amplitude limits, necessitating the additional use of a mod-two stability
index studied earlier by Serre and Zumbrun in order to decide stability.
","[{""version"":""v1"",""created"":""Fri, 22 Jun 2007 22:45:05 GMT""}]","2017-06-12"
"0706.3416","Jeffrey H. Shapiro","Saikat Guha, Jeffrey H. Shapiro, and Baris I. Erkmen","Classical capacity of bosonic broadcast communication and a new minimum
  output entropy conjecture","13 pages, 7 figures","Phys. Rev. A 76, 032303 (2007)","10.1103/PhysRevA.76.032303",,"quant-ph",,"  Previous work on the classical information capacities of bosonic channels has
established the capacity of the single-user pure-loss channel, bounded the
capacity of the single-user thermal-noise channel, and bounded the capacity
region of the multiple-access channel. The latter is a multi-user scenario in
which several transmitters seek to simultaneously and independently communicate
to a single receiver. We study the capacity region of the bosonic broadcast
channel, in which a single transmitter seeks to simultaneously and
independently communicate to two different receivers. It is known that the
tightest available lower bound on the capacity of the single-user thermal-noise
channel is that channel's capacity if, as conjectured, the minimum von Neumann
entropy at the output of a bosonic channel with additive thermal noise occurs
for coherent-state inputs. Evidence in support of this minimum output entropy
conjecture has been accumulated, but a rigorous proof has not been obtained. In
this paper, we propose a new minimum output entropy conjecture that, if proved
to be correct, will establish that the capacity region of the bosonic broadcast
channel equals the inner bound achieved using a coherent-state encoding and
optimum detection. We provide some evidence that supports this new conjecture,
but again a full proof is not available.
","[{""version"":""v1"",""created"":""Fri, 22 Jun 2007 23:41:42 GMT""}]","2009-11-13"
"0706.3417","Chih-Chun Chien","Chih-Chun Chien, Yan He, Qijin Chen and K. Levin","Superfuid-insulator transitions at non-integer filling in optical
  lattices of fermionic atoms","4 pages, 3 figures, submitted to Phys. Rev. A","Phys. Rev. A 77, 011601(R) (2008)","10.1103/PhysRevA.77.011601",,"cond-mat.other cond-mat.quant-gas cond-mat.str-el cond-mat.supr-con",,"  We determine the superfluid transition temperatures $T_c$ and the ground
states of the attractive Hubbard model and find new insulating phases
associated with non-integer filling at sufficiently strong pairing attraction
$|U|$. These states, distinct from band and Mott insulating phases, derive from
pair localization; pair hopping at large $|U|$ and high densities is impeded by
inter-site, inter-pair repulsive interactions. The best way to detect the
breakdown of superfluidity is using fermionic optical lattices which should
reveal new forms of ``bosonic'' order, reflecting ground state pairing without
condensation.
","[{""version"":""v1"",""created"":""Fri, 22 Jun 2007 22:54:40 GMT""},{""version"":""v2"",""created"":""Thu, 13 Sep 2007 18:10:31 GMT""}]","2011-09-13"
"0706.3419","Giovanni Cantatore","E. Zavattini (Deceased January 9, 2007), G. Zavattini, G. Raiteri, G.
  Ruoso, E. Polacco, E. Milotti, V. Lozza, M. Karuza, U. Gastaldi, G. Di
  Domenico, F. Della Valle, R. Cimino, S. Carusotto, G. Cantatore, M. Bregant
  (PVLAS Collaboration)","New PVLAS results and limits on magnetically induced optical rotation
  and ellipticity in vacuum","25 pages, 7 figures Main changes rel. to v.2: minor changes to
  abstract, replaced Figures 4,5,6, corrected typographical errors. Paper
  submitted to Physical Review D","Phys.Rev.D77:032006,2008","10.1103/PhysRevD.77.032006",,"hep-ex",,"  IIn 2006 the PVLAS collaboration reported the observation of an optical
rotation generated in vacuum by a magnetic field. To further check against
possible instrumental artifacts several upgrades to the PVLAS apparatus have
been made during the last year. Two data taking runs, at the wavelength of 1064
nm, have been performed in the new configuration with magnetic field strengths
of 2.3 T and 5 T. The 2.3 T field value was chosen in order to avoid stray
fields. The new observations do not show the presence of a rotation signal down
to the levels of $1.2\cdot 10^{-8}$ rad at 5 T and $1.0\cdot 10^{-8}$ rad at
2.3 T (at 95% c.l.) with 45000 passes in the magnetic field zone. In the same
conditions no ellipticity signal was detected down to $1.4\cdot 10^{-8}$ at 2.3
T (at 95% c.l.), whereas at 5 T a signal is still present. The physical nature
of this ellipticity as due to an effect depending on $B^2$ can be excluded by
the measurement at 2.3 T. These new results completely exclude the previously
published magnetically induced vacuum dichroism results, indicating that they
were instrumental artifacts. These new results therefore also exclude the
particle interpretation of the previous PVLAS results as due to a spin zero
boson. The background ellipticity at 2.3 T can be used to determine a new limit
on the total photon-photon scattering cross section of $\sigma_{\gamma\gamma} <
4.5 \cdot10^{-34}$ barn at 95% c.l..
","[{""version"":""v1"",""created"":""Sat, 23 Jun 2007 07:51:58 GMT""},{""version"":""v2"",""created"":""Tue, 25 Sep 2007 22:25:59 GMT""},{""version"":""v3"",""created"":""Thu, 22 Nov 2007 12:27:48 GMT""}]","2008-11-26"
"0706.3420","Marcelo Grynberg","M. D. Grynberg","Non-universal dynamics of dimer growing interfaces","11 pages, 7 figures. v2 with some slight corrections","Phys. Rev. E 76, 031605 (2007)","10.1103/PhysRevE.76.031605",,"cond-mat.stat-mech cond-mat.soft",,"  A finite temperature version of body-centered solid-on-solid growth models
involving attachment and detachment of dimers is discussed in 1+1 dimensions.
The dynamic exponent of the growing interface is studied numerically via the
spectrum gap of the underlying evolution operator. The finite size scaling of
the latter is found to be affected by a standard surface tension term on which
the growth rates depend. This non-universal aspect is also corroborated by the
growth behavior observed in large scale simulations. By contrast, the
roughening exponent remains robust over wide temperature ranges.
","[{""version"":""v1"",""created"":""Sat, 23 Jun 2007 00:02:58 GMT""},{""version"":""v2"",""created"":""Thu, 27 Sep 2007 03:31:08 GMT""}]","2007-09-27"
"0706.3421","Peter Jonker","Peter G. Jonker, Daniel Steeghs, Deepto Chakrabarty, Adrienne M. Juett","The cold neutron star in the soft X-ray transient 1H 1905+000","5 pages, 3 figures, accepted for publication in ApJ Letters",,"10.1086/521079",,"astro-ph",,"  We report on our analysis of 300 ks of Chandra observations of the neutron
star soft X-ray transient 1H1905+000 in quiescence. We do not detect the source
down to a 95% confidence unabsorbed flux upper limit of 2E-16 erg cm-2 s-1 in
the 0.5-10 keV energy range for an assumed Gamma=2 power law spectral model. A
limit of 1.4E-16 erg cm-2 s-1 is derived if we assume that the spectrum of
1H1905+000 in quiescence is described well with a black body of temperature of
0.2 keV. For the upper limit to the source distance of 10 kpc this yields a
0.5-10 keV luminosity limit of 2.4E30 / 1.7E30 erg/s for the abovementioned
power law or black body spectrum, respectively. This luminosity limit is lower
than the luminosity of A0620-00, the weakest black hole soft X-ray transient in
quiescence reported so far. Together with the uncertainties in relating the
mass transfer and mass accretion rates we come to the conclusion that the claim
that there is evidence for the presence of a black hole event horizon on the
basis of a lower quiescent luminosity for black holes than for neutron stars is
unproven. We also briefly discuss the implications of the low quiescent
luminosity of 1H1905+000 for the neutron star equation of state. Using deep
Magellan images of the field of 1H1905+000 obtained at excellent observing
conditions we do not detect the quiescent counterpart at the position of the
outburst optical counterpart down to a magnitude limit of i'>25.3. This can be
converted to a limit on the absolute magnitude of the counterpart of I>9.6
which implies that the counterpart can only be a brown or a white dwarf.
","[{""version"":""v1"",""created"":""Sat, 23 Jun 2007 01:15:43 GMT""}]","2009-11-13"
"0706.3423","Florian Conrady","Florian Conrady (Penn State U.) and Igor Khavkine (Western Ontario U.)","An exact string representation of 3d SU(2) lattice Yang--Mills theory","12 pages, 7 figures",,,"IGPG-07/6-8","hep-th hep-lat",,"  We show that 3d SU(2) lattice Yang--Mills theory can be cast in the form of
an exact string representation. The derivation starts from the exact dual (or
spin foam) representation of the lattice gauge theory. We prove that every dual
configuration (or spin foam) can be equivalently described as a self--avoiding
worldsheet of strings on a framing of the lattice. Using this correspondence,
we translate the partition function into a sum over closed worldsheets that are
weighted with explicit amplitudes. The expectation value of two Polyakov loops
with spin j becomes a sum over worldsheets that are bounded by 2j strings along
a framing of the loops.
","[{""version"":""v1"",""created"":""Sat, 23 Jun 2007 14:24:49 GMT""}]","2007-07-03"
"0706.3424","Ryan Mallery","Ryan P. Mallery, R. Michael Rich, Samir Salim, Todd Small, Stephane
  Charlot, Mark Seibert, Ted Wyder, Tom A. Barlow, Karl Forster, Peter G.
  Friedman, D. Christopher Martin, Patrick Morissey, Susan G. Neff, David
  Schiminovivich, Luciana Bianchi, Jose Donas, Timothy M. Heckman, Young-Wook
  Lee, Barry F. Madore, Bruno Milliard, Alex S. Szalay, Barry Y. Welsh, Suk
  Young Yi","Keck/Deimos Spectroscopy of a GALEX UV Selecte Sample from the Medium
  Imaging Survey","19 pages 11 figures, 2 tables, Accepted ot ApJ GALEX Special Issue",,"10.1086/516638",,"astro-ph",,"  We report results from a pilot program to obtain spectroscopy for objects
detected in the Galaxy Evolution Explorer (GALEX) Medium Imaging Survey (MIS).
Our study examines the properties of galaxies detected by GALEX fainter than
the Sloan Digital Sky Survey (SDSS) spectroscopic survey. This is the first
study to extend the techinques of Salim et al. 2005 to estimate stellar masses,
star formation rates (SFR) and the b (star formation history) parameter for
star-forming galaxies out to z~0.7. We obtain redshifts for 50 GALEX MIS
sources reaching NUV=23.9 (AB mag), having counterparts in the SDSS Data
Release 4 (DR4). Of our sample, 43 are starforming galaxies with z<0.7, 3 have
emission line ratios indicative of AGN with z<0.7, and 4 objects with z~1 are
QSOs, 3 of which are not previously cataloged. We compare our sample to a much
larger sample of ~50,000 matched GALEX/SDSS galaxies with SDSS spectroscopy;
while our survey is shallow, the optical counterparts to our sources reach ~3
magnitudes fainter in SDSS r magnitude than the SDSS spectroscopic sample. We
use emission line diagnostics for the galaxies to determine that the sample
contains mostly star-forming galaxies. The galaxies in the sample populate the
blue sequence in the NUV-r vs M_r color-magnitude diagram. Our sample has SFRs,
luminosities, and velocity dispersions that are similar to the samples of faint
compact blue galaxies studied previously in the same redshift range by Koo et.
al 1995, Guzman et. al 1996 & Phillips et. al 1997. However, our sample is ~2
mag fainter in surface brightness than the compact blue galaxies. We find that
the star-formation histories for a majority of the galaxies are consistent with
a recent starburst within the last 100 Myr.
","[{""version"":""v1"",""created"":""Sat, 23 Jun 2007 02:01:25 GMT""}]","2009-11-13"
