"0706.3379","Dirk Vertigan","Dirk Vertigan (Department of Mathematics, Louisiana State University)","Self-Replicating Space-Cells and the Cosmological Constant","15 pages, no figures, LaTeX",,,,"gr-qc nlin.AO",,"  We consider what the implications would be if there were a discrete
fundamental model of physics based on locally-finite self-interacting
information, in which there is no presumption of the familiar space and laws of
physics, but from which such space and laws can nevertheless be shown to be
able to emerge stably from such a fundamental model. We argue that if there is
such a model, then the familiar laws of physics, including Standard Model
constants, etc., must be encodable by a finite quantity C, called the
complexity, of self-interacting information I, called a Space-Cell. Copies of
Space-Cell I must be distributed throughout space, at a roughly constant and
near-Planck density, and copies must be created or destroyed as space expands
or contracts. We then argue that each Space-Cell is a self-replicator that can
duplicate in times ranging from as fast as near-Planck-times to as slow as
Cosmological-Constant-time which is 10^{61} Planck-times. From standard
considerations of computation, we argue this slowest duplication rate just
requires that 10^{61} is less than about 2^C, the number of length-C binary
strings, hence requiring only the modest complexity C at least 203, and at most
a few thousand. We claim this provides a reasonable explanation for a
dimensionless constant being as large as 10^{61}, and hence for the
Cosmological Constant being a tiny positive 10^{-122}. We also discuss a
separate conjecture on entropy flow in Hole-Bang Transitions. We then present
Cosmological Natural Selection II.
","[{""version"":""v1"",""created"":""Fri, 22 Jun 2007 17:22:23 GMT""}]","2011-11-10"
"0706.3380","Lucas Wagner","Lucas K. Wagner","Transition metal oxides using quantum Monte Carlo","20 pages, 4 figures, to appear as a topical review in J. Physics:
  Condensed Matter",,"10.1088/0953-8984/19/34/343201",,"cond-mat.str-el cond-mat.mtrl-sci",,"  The transition metal-oxygen bond appears prominently throughout chemistry and
solid-state physics. Many materials, from biomolecules to ferroelectrics to the
components of supernova remnants contain this bond in some form. Many of these
materials' properties strongly depend on fine details of the TM-O bond and
intricate correlation effects, which make accurate calculations of their
properties very challenging. We present quantum Monte Carlo, an explicitly
correlated class of methods, to improve the accuracy of electronic structure
calculations over more traditional methods like density functional theory. We
find that unlike s-p type bonding, the amount of hybridization of the d-p bond
in TM-O materials is strongly dependant on electronic correlation.
","[{""version"":""v1"",""created"":""Fri, 22 Jun 2007 17:42:06 GMT""}]","2009-11-13"
"0706.3381","Francesc Planas-Vilanova","Jos\'e M. Giral, Francesc Planas-Vilanova","Integral degree of a ring and reduction numbers","18 pages",,,,"math.AC",,"  The supremum of reduction numbers of ideals having principal reductions is
expressed in terms of the integral degree, a new invariant of the ring, which
is finite provided the ring has finite integral closure. As a consequence, one
obtains bounds for the Castelnuovo-Mumford regularity of the Rees algebra and
for the Artin-Rees numbers.
","[{""version"":""v1"",""created"":""Fri, 22 Jun 2007 17:39:15 GMT""}]","2007-06-25"
"0706.3382","Richard Szabo","Henry C.D. Cove, Zoltan Kadar and Richard J. Szabo","DLCQ Strings, Twist Fields and One-Loop Correlators on a Permutation
  Orbifold","48 pages, 1 figure; v2: typos corrected","Nucl.Phys.B793:260-306,2008","10.1016/j.nuclphysb.2007.10.014","HWM-07-17, EMPG-07-13","hep-th",,"  We investigate some aspects of the relationship between matrix string theory
and light-cone string field theory by analysing the correspondence between the
two-loop thermal partition function of DLCQ strings in flat space and the
integrated two-point correlator of twist fields in a symmetric product orbifold
conformal field theory at one-loop order. This is carried out by deriving
combinatorial expressions for generic twist field correlation functions in
permutation orbifolds using the covering surface method, by deriving the
one-loop modification of the twist field interaction vertex, and by relating
the two-loop finite temperature DLCQ string theory to the theory of Prym
varieties for genus two covers of an elliptic curve. The case of bosonic Z(2)
orbifolds is worked out explicitly and precise agreement between both
amplitudes is found. We use these techniques to derive explicit expressions for
Z(2) orbifold spin twist field correlation functions in the Type II and
heterotic string theories.
","[{""version"":""v1"",""created"":""Fri, 22 Jun 2007 17:47:19 GMT""},{""version"":""v2"",""created"":""Tue, 17 Jul 2007 08:33:22 GMT""}]","2008-11-26"
"0706.3383","Leticia Cunqueiro","L.Cunqueiro, J.Dias de Deus, E.G.Ferreiro and C.Pajares","Universal behavior of baryons and mesons' transverse momentum
  distributions in the framework of percolation of strings","Presented at ""Heavy Ion Collisions at the LHC: last call for
  predictions"", Geneva Switzerland, May 14th-June 8th",,,,"hep-ph",,"  In the framework of percolation of strings, we present predictions for the
$R_{AA}$ and $R_{CP}$ for mesons and baryons and for $\bar{p}/\pi^{0}$ ratios
at LHC energies.
","[{""version"":""v1"",""created"":""Fri, 22 Jun 2007 17:52:50 GMT""}]","2007-06-25"
"0706.3384","Olalla Castro Alvaredo","J.L. Cardy, O.A. Castro-Alvaredo and B. Doyon","Form factors of branch-point twist fields in quantum integrable models
  and entanglement entropy","40 pages, 10 eps figures","J. Stat. Phys.130:129-168, 2008","10.1007/s10955-007-9422-x",,"hep-th quant-ph",,"  In this paper we compute the leading correction to the bipartite entanglement
entropy at large sub-system size, in integrable quantum field theories with
diagonal scattering matrices. We find a remarkably universal result, depending
only on the particle spectrum of the theory and not on the details of the
scattering matrix. We employ the ""replica trick"" whereby the entropy is
obtained as the derivative with respect to n of the trace of the n-th power of
the reduced density matrix of the sub-system, evaluated at n=1. The main
novelty of our work is the introduction of a particular type of twist fields in
quantum field theory that are naturally related to branch points in an
n-sheeted Riemann surface. Their two-point function directly gives the scaling
limit of the trace of the n-th power of the reduced density matrix. Taking
advantage of integrability, we use the expansion of this two-point function in
terms of form factors of the twist fields, in order to evaluate it at large
distances in the two-particle approximation. Although this is a well-known
technique, the new geometry of the problem implies a modification of the form
factor equations satisfied by standard local fields of integrable quantum field
theory. We derive the new form factor equations and provide solutions, which we
specialize both to the Ising and sinh-Gordon models.
","[{""version"":""v1"",""created"":""Fri, 22 Jun 2007 18:30:38 GMT""},{""version"":""v2"",""created"":""Tue, 16 Oct 2007 17:55:34 GMT""}]","2011-01-27"
"0706.3385","Mario Centelles","S.K. Samaddar, J.N. De, X. Vinas, M. Centelles","Excitation energy dependence of symmetry energy of finite nuclei","11 pages, 3 figures, revtex4; minor changes in text, axis label in
  figure 1 corrected","Phys.Rev.C76:041602,2007","10.1103/PhysRevC.76.041602",,"nucl-th",,"  A finite range density and momentum dependent effective interaction is used
to calculate the density and temperature dependence of the symmetry energy
coefficient Csym(rho,T) of infinite nuclear matter. This symmetry energy is
then used in the local density approximation to evaluate the excitation energy
dependence of the symmetry energy coefficient of finite nuclei in a
microcanonical formulation that accounts for thermal and expansion effects. The
results are in good harmony with the recently reported experimental data from
energetic nucleus-nucleus collisions.
","[{""version"":""v1"",""created"":""Fri, 22 Jun 2007 18:16:01 GMT""},{""version"":""v2"",""created"":""Thu, 11 Oct 2007 17:23:51 GMT""}]","2008-11-26"
"0706.3386","Eric Hilton","Eric J. Hilton, Paula Szkody, Anjum Mukadam (University of
  Washington), Koji Mukai (NASA GSFC), Coel Hellier, Liza van Zyl (Keele
  University), Lee Homer (Liverpool CC)","XMM-Newton Observations of the Cataclysmic Variable GW Lib","16 pages, 4 figures; accepted for publication in AJ","Astron.J.134:1503-1507,2007","10.1086/521343",,"astro-ph",,"  XMM-Newton observations of the accreting, pulsating white dwarf in the
quiescent dwarf nova GW Librae were conducted to determine if the non-radial
pulsations present in previous UV and optical data affect the X-ray emission.
The non-radial pulsations are evident in the simultaneous Optical Monitor data
but are not detected in X-ray with an upper limit on the pulsation amplitude of
0.092 mags. The best fits to the X-ray spectrum are with a low temperature
diffuse gas model or a multi-temperature cooling flow model, with a strong
OVIII line, similar to other short period dwarf novae, but with a lower
temperature range than evident in normal short period dwarf novae. The lack of
pulsations and the spectrum likely indicate that the boundary layer does not
extend to the surface of the white dwarf.
","[{""version"":""v1"",""created"":""Fri, 22 Jun 2007 18:22:09 GMT""}]","2008-11-26"
"0706.3387","Igor Komarov","Igor Komarov","Vadim Kuznetsov. Informal Biography by Eyes of His First Adviser","This is a contribution to the Vadim Kuznetsov Memorial Issue on
  Integrable Systems and Related Topics, published in SIGMA (Symmetry,
  Integrability and Geometry: Methods and Applications) at
  http://www.emis.de/journals/SIGMA/","SIGMA 3 (2007), 074, 6 pages","10.3842/SIGMA.2007.074",,"nlin.SI math-ph math.CA math.MP",,"  The paper is dedicated to the memory of prominent theoretical physicist and
mathematician Dr. Vadim Kuznetsov who worked, in particular, in the fields of
the nonlinear dynamics, separation of variables, integrability theory, special
functions. It includes his short research biography, an account of the start of
his research career and the list of publications.
","[{""version"":""v1"",""created"":""Fri, 22 Jun 2007 18:24:16 GMT""}]","2008-04-24"
"0706.3388","Mariano Quiros","Germano Nardini, Mariano Quiros, Andrea Wulzer","A Confining Strong First-Order Electroweak Phase Transition","34 pages, 7 figures; v2: Reference added; v3: Version to appear in
  JHEP","JHEP0709:077,2007","10.1088/1126-6708/2007/09/077","UAB-FT-632","hep-ph hep-th",,"  In the Randall-Sundrum model where the radion is stabilized by a
Goldberger-Wise (GW) potential there is a supercooled transition from a
deconfined to a confined phase at temperatures orders of magnitude below the
typical Standard Model critical temperature. When the Higgs is localized at the
IR brane the electroweak phase transition is delayed and becomes a strong
first-order one where the Universe expands by a few e-folds. This generates the
possibility of having the out-of-equilibrium condition required by electroweak
baryogenesis in the electroweak phase transition. We have studied numerically
the region of the GW parameter space where the theory is consistent and the
latter possibility is realized. We have found that in most of the parameter
space the nucleation temperature is so low that sphalerons are totally inactive
inside the bubbles. The condition for sphalerons to be inactive after reheating
imposes an upper bound on the reheating temperature that is weaker for heavy
Higgs bosons so that the out-of-equilibrium condition seems to favor heavy over
light Higgses. The condition for sphalerons to be active outside the bubbles
puts an upper bound on the number of e-folds at the phase transition, roughly
consistent with the critical value required by low-scale inflation to solve the
cosmological horizon problem.
","[{""version"":""v1"",""created"":""Fri, 22 Jun 2007 18:44:16 GMT""},{""version"":""v2"",""created"":""Mon, 9 Jul 2007 12:40:00 GMT""},{""version"":""v3"",""created"":""Thu, 20 Sep 2007 16:33:56 GMT""}]","2008-11-26"
"0706.3389","Bruce Kleiner","Jeff Cheeger and Bruce Kleiner","Characterization of the Radon-Nikodym Property in terms of inverse
  limits",,,,,"math.FA math.MG",,"  We clarify the relation between inverse systems, the Radon-Nikodym property,
the Asymptotic Norming Property of James-Ho, and the GFDA spaces introduced in
our earlier paper on differentiability of Lipschitz maps into Banach spaces.
","[{""version"":""v1"",""created"":""Fri, 22 Jun 2007 18:50:33 GMT""},{""version"":""v2"",""created"":""Mon, 25 Jun 2007 22:09:08 GMT""},{""version"":""v3"",""created"":""Fri, 11 Jan 2008 21:30:11 GMT""}]","2011-11-10"
"0706.3390","Stephan Ulrich","Stephan Ulrich, Matthias Schr\""oter and Harry L. Swinney","Influence of friction on granular segregation","3 pages, 2 figures","Phys. Rev. E 76, 042301 (2007)","10.1103/PhysRevE.76.042301",,"cond-mat.dis-nn cond-mat.soft",,"  Vertical shaking of a mixture of small and large beads can lead to
segregation where the large beads either accumulate at the top of the sample,
the so called Brazil Nut effect (BNE), or at the bottom, the Reverse Brazil Nut
effect (RBNE). Here we demonstrate experimentally a sharp transition from the
RBNE to the BNE when the particle coefficient of friction increases due to
aging of the particles. This result can be explained by the two competing
mechanisms of buoyancy and sidewall-driven convection, where the latter is
assumed to grow in strength with increasing friction.
","[{""version"":""v1"",""created"":""Fri, 22 Jun 2007 18:51:42 GMT""},{""version"":""v2"",""created"":""Sun, 13 Jan 2008 20:40:24 GMT""}]","2008-01-13"
"0706.3391","Brian Yanny","Heidi Jo Newberg, Brian Yanny, Nate Cole, Timothy C. Beers, Paola Re
  Fiorentin, Donald P. Schneider, Ron Wilhelm","The Overdensity in Virgo, Sagittarius Debris, and the Asymmetric
  Spheroid","10 figures, ApJ in press","Astrophys.J.668:221-235,2007","10.1086/521068",,"astro-ph",,"  We investigate the relationship between several previously identified
Galactic halo stellar structures in the direction of Virgo using imaging and
spectroscopic observations of F turnoff stars and blue horizontal branch stars
from the Sloan Digital Sky Survey (SDSS) and the Sloan Extension for Galactic
Understanding and Exploration (SEGUE). We show that the Sagittarius dwarf
leading tidal tail does not pass through the solar neighborhood; it misses the
Sun by more than 15 kpc, passing through the Galactic plane outside the Solar
Circle. It also is not spatially coincident with the large stellar overdensity
S297+63-20.5 in the Virgo constellation. S297+63-20.5 has a distinct turnoff
color and kinematics. Faint (g ~ 20.3) turnoff stars in S297+63-20.5 have
line-of-sight, Galactic standard of rest velocities V(GSR)= 130 +/- 10 km/s,
opposite in sign to infalling Sgr tail stars. The path of the Sgr leading tidal
tail is also inconsistent with the positions of some of the nearer stars with
which it has been associated, and whose velocities have favored models with
prolate Milky Way potentials. We additionally show that the number densities of
brighter (g ~ 19.8) F turnoff stars are not symmetric about the Galactic
center, and that this discrepancy is not primarily due to the S297+63-20.5
moving group. Either the spheroid is asymmetric about the Galactic center, or
there are additional substructures that conspire to be on the same side of the
Galaxy as S297+63-20.5. The S297+63-20.5 overdensity in Virgo is likely
associated with two other previously identified Virgo substructures: the Virgo
Stellar Stream (VSS) and the Virgo Overdensity (VOD). However, the velocity
difference between the VSS and S297+63-20.5 and the difference in distance
estimates between the VOD and S297+63-20.5 must be reconciled.
","[{""version"":""v1"",""created"":""Fri, 22 Jun 2007 19:06:23 GMT""}]","2008-11-26"
"0706.3392","Sergey V. Lototsky","S. V. Lototsky and K. Stemmann","Solving SPDEs driven by colored noise: a chaos approach",,,,,"math.PR math.AP",,"  An Ito-Skorokhod bi-linear equation driven by infinitely many independent
colored noises is considered in a normal triple of Hilbert spaces. The special
feature of the equation is the appearance of the Wick product in the definition
of the Ito-Skorokhod integral, requiring innovative approaches to computing the
solution. A chaos expansion of the solution is derived and several truncations
of this expansion are studied. A recursive approximation of the solution is
suggested and the corresponding approximation error bound is computed.
","[{""version"":""v1"",""created"":""Fri, 22 Jun 2007 19:13:02 GMT""}]","2007-06-25"
"0706.3393","Alexey Koshelev","Alexey S. Koshelev and Theodore N. Tomaras","Towards a covariant model for cosmic self-acceleration","10 pages, no figures; v2: version published in JHEP","JHEP0710:012,2007","10.1088/1126-6708/2007/10/012",,"hep-th astro-ph hep-ph",,"  An explicitly covariant formulation is presented of a modified DGP scenario
proposed recently [1], to avoid the instability of the self-accelerating
branch. It is based on the introduction of a bulk scalar field with appropriate
non-minimal coupling to the bulk Einstein-Hilbert term. The method is general
and may be applied to other models as well.
","[{""version"":""v1"",""created"":""Fri, 22 Jun 2007 19:33:34 GMT""},{""version"":""v2"",""created"":""Tue, 9 Oct 2007 09:34:54 GMT""}]","2008-11-26"
"0706.3394","Eric Gimon","Eric G. Gimon and Thomas S. Levi","Black Ring Deconstruction","10 pages, 2 figures","JHEP0804:098,2008","10.1088/1126-6708/2008/04/098",,"hep-th",,"  We present a sample microstate for a black ring in four and five dimensional
language. The microstate consists of a black string microstate with an
additional D6-brane. We show that with an appropriate choice of parameters the
piece involving the black string microstate falls down a long AdS throat, whose
M-theory lift is AdS_3 X S^2. We wrap a spinning dipole M2-brane on the S^2 in
the probe approximation. In IIA, this corresponds to a dielectric D2-brane
carrying only D0-charge. We conjecture this is the first approximation to a
cloud of D0-branes blowing up due to their non-abelian degrees of freedom and
the Myers effect.
","[{""version"":""v1"",""created"":""Fri, 22 Jun 2007 19:23:20 GMT""}]","2008-11-26"
"0706.3395","Martin Laming","Cara E. Rakowski, J. Martin Laming and Susan T. Lepri","Ion Charge States in Halo CMEs: What can we Learn about the Explosion?","20 pages, accepted by ApJ","Astrophys.J.667:602-609,2007","10.1086/520914",,"astro-ph",,"  We describe a new modeling approach to develop a more quantitative
understanding of the charge state distributions of the ions of various elements
detected in situ during halo Coronal Mass Ejection (CME) events by the Advanced
Composition Explorer (ACE) satellite. Using a model CME hydrodynamic evolution
based on observations of CMEs propagating in the plane of the sky and on
theoretical models, we integrate time dependent equations for the ionization
balance of various elements to compare with ACE data. We find that plasma in
the CME ``core'' typically requires further heating following filament
eruption, with thermal energy input similar to the kinetic energy input. This
extra heating is presumably the result of post eruptive reconnection. Plasma
corresponding to the CME ``cavity'' is usually not further ionized, since
whether heated or not, the low density gives freeze-in close the the Sun. The
current analysis is limited by ambiguities in the underlying model CME
evolution. Such methods are likely to reach their full potential when applied
to data to be acquired by STEREO when at optimum separation. CME evolution
observed with one spacecraft may be used to interpret CME charge states
detected by the other.
","[{""version"":""v1"",""created"":""Fri, 22 Jun 2007 19:36:21 GMT""}]","2019-08-19"
"0706.3396","Oleg Lunin","Oleg Lunin","Strings ending on branes from supergravity","81 pages, added refs","JHEP0709:093,2007","10.1088/1126-6708/2007/09/093","EFI-07-17","hep-th",,"  We study geometries produced by brane intersections preserving eight
supercharges. Typical examples of such configurations are given by fundamental
strings ending on Dp branes and we construct gravity solutions describing such
intersections. The geometry is specified in terms of two functions obeying
coupled differential equations and the boundary conditions are determined by
distributions of D branes. We show that a consistency of type IIB supergravity
constrains the allowed positions of the branes. The shapes of branes derived
from gravity are found to be in a perfect agreement with profiles predicted by
the DBI analysis. We also discuss related 1/4-BPS systems in M theory.
","[{""version"":""v1"",""created"":""Fri, 22 Jun 2007 19:47:32 GMT""},{""version"":""v2"",""created"":""Sun, 29 Jul 2007 00:25:33 GMT""}]","2008-11-26"
"0706.3397","Andreas Boukas","Luigi Accardi and Andreas Boukas","Fock representation of the renormalized higher powers of white noise and
  the Virasoro--Zamolodchikov--$w_{\infty} *$--Lie algebra",,,"10.1088/1751-8113/41/30/304001",,"math-ph math.MP",,"  The identification of the $*$--Lie algebra of the renormalized higher powers
of white noise (RHPWN) and the analytic continuation of the second quantized
Virasoro--Zamolodchikov--$w_{\infty} *$--Lie algebra of conformal field theory
and high-energy physics, was recently established in \cite{id} based on results
obtained in [1] and [2]. In the present paper we show how the RHPWN Fock
kernels must be truncated in order to be positive definite and we obtain a Fock
representation of the two algebras. We show that the truncated renormalized
higher powers of white noise (TRHPWN) Fock spaces of order $\geq 2$ host the
continuous binomial and beta processes.
","[{""version"":""v1"",""created"":""Fri, 22 Jun 2007 19:46:23 GMT""},{""version"":""v2"",""created"":""Tue, 26 Jun 2007 06:30:47 GMT""}]","2009-11-13"
"0706.3400","Andrew Fletcher","Andrew S. Fletcher","Channel-Adapted Quantum Error Correction","Ph.D. dissertation, 163 pages, 38 figures",,,,"quant-ph",,"  Quantum error correction (QEC) is an essential concept for any quantum
information processing device. Typically, QEC is designed with minimal
assumptions about the noise process; this generic assumption exacts a high cost
in efficiency and performance. In physical systems, errors are not likely to be
arbitrary; rather we will have reasonable models for the structure of quantum
decoherence. We may choose quantum error correcting codes and recovery
operations that specifically target the most likely errors.
  We present a convex optimization method to determine the optimal (in terms of
average entanglement fidelity) recovery operation for a given channel,
encoding, and information source. This is solvable via a semidefinite program
(SDP). We present computational algorithms to generate near-optimal recovery
operations structured to begin with a projective syndrome measurement. These
structured operations are more computationally scalable than the SDP required
for computing the optimal; we can thus numerically analyze longer codes. Using
Lagrange duality, we bound the performance of the structured recovery
operations and show that they are nearly optimal in many relevant cases.
  We present two classes of channel-adapted quantum error correcting codes
specifically designed for the amplitude damping channel. These have
significantly higher rates with shorter block lengths than corresponding
generic quantum error correcting codes. Both classes are stabilizer codes, and
have good fidelity performance with stabilizer recovery operations. The
encoding, syndrome measurement, and syndrome recovery operations can all be
implemented with Clifford group operations.
","[{""version"":""v1"",""created"":""Fri, 22 Jun 2007 19:54:10 GMT""}]","2007-06-26"
"0706.3402","Ricardo Avila","Ricardo E. Avila","Diffusion kinetic parameters from bulk diffusion limited gas release
  processes","Reduced version published as: R. E. Avila Jap. J. Appl. Phys. 43,
  pp.7205-7206 (2004). (4 pages, 2 Figs.)",,"10.1143/JJAP.43.7205",,"cond-mat.mtrl-sci cond-mat.other",,"  The diffusion of a bulk absorbed gas species out of spherical pebbles is
studied analytically, stressing the usefulness of the time integral of the
diffusion coefficient for analysis of arbitrary temperature schedule
experiments. Highly accurate approximations are introduced where the numeric
evaluation of the analytic expressions takes considerable time. A method is
proposed to extract the diffusion kinetic parameters from a single linear
heating ramp, namely, the activation energy of the diffusion coefficient and
the ratio of the corresponding preexponential factor to the radius of spherical
pebbles.
","[{""version"":""v1"",""created"":""Fri, 22 Jun 2007 21:47:49 GMT""}]","2009-11-13"
