"0706.3425","Peter Wong","Daciberg Gon\c{c}alves and Peter Wong","Twisted conjugacy classes in nilpotent groups","22 pages; section 6 has been moved to section 2 and minor
  modification has been made on exposition; to be published in Crelle J","J. Reine Angew. Math. 633 (2009), 11--27",,,"math.GR math.AT",,"  A group is said to have the $R_\infty$ property if every automorphism has an
infinite number of twisted conjugacy classes. We study the question whether $G$
has the $R_\infty$ property when $G$ is a finitely generated torsion-free
nilpotent group. As a consequence, we show that for every positive integer
$n\ge 5$, there is a compact nilmanifold of dimension $n$ on which every
homeomorphism is isotopic to a fixed point free homeomorphism. As a by-product,
we give a purely group theoretic proof that the free group on two generators
has the $R_\infty$ property. The $R_{\infty}$ property for virtually abelian
and for $\mathcal C$-nilpotent groups are also discussed.
","[{""version"":""v1"",""created"":""Sat, 23 Jun 2007 01:56:53 GMT""},{""version"":""v2"",""created"":""Mon, 24 Mar 2008 16:18:43 GMT""}]","2011-05-11"
"0706.3426","Bo Wang","Bo Wang, Xiangcun Meng, Xiaofeng Wang, Zhanwen Han","Distribution of $^{56}$Ni Yields of Type Ia Supernovae and its
  Implication for Progenitors","11 pages, 7 figures","Chin.J.Astron.Astrophys.8:71-80,2008","10.1088/1009-9271/8/1/07",,"astro-ph",,"  The amount of $^{56}$Ni produced in type Ia supernova (SN Ia) explosion is
probably the most important physical parameter underlying the observed
correlation of SN Ia luminosities with their light curves. Based on an
empirical relation between the $^{56}$Ni mass and the light curve parameter
$\triangle m_{15}$, we obtained rough estimates of the $^{56}$Ni mass for a
large sample of nearby SNe Ia with the aim of exploring the diversity in SN Ia.
We found that the derived $^{56}$Ni masses for different SNe Ia could vary by a
factor of ten (e.g., $M_{\rm Ni}=0.1 - 1.3$ $M_{\odot}$), which cannot be
explained in terms of the standard Chandrasekhar-mass model (with a $^{56}$Ni
mass production of 0.4 -- 0.8 $M_{\odot}$). Different explosion and/or
progenitor models are clearly required for various SNe Ia, in particular, for
those extremely nickel-poor and nickel-rich producers. The nickel-rich (with
$M_{\rm Ni}$ $>$ 0.8 $M_{\odot}$) SNe Ia are very luminous and may have massive
progenitors exceeding the Chandrasekhar-mass limit since extra progenitor fuel
is required to produce more $^{56}$Ni to power the light curve. This is also
consistent with the finding that the intrinsically bright SNe Ia prefer to
occur in stellar environments of young and massive stars. For example, 75% SNe
Ia in spirals have $\Delta m_{15} < 1.2$ while this ratio is only 18% in E/S0
galaxies. On the other hand, the nickel-poor SNe Ia (with $M_{\rm Ni}$ $<$ 0.2
$M_{\odot}$) may invoke the sub-Chandrasekhar model, as most of them were found
in early-type E/S0 galaxies dominated by the older and low-mass stellar
populations. This indicates that SNe Ia in spiral and E/S0 galaxies have
progenitors of different properties.
","[{""version"":""v1"",""created"":""Sat, 23 Jun 2007 03:28:06 GMT""},{""version"":""v2"",""created"":""Wed, 27 Feb 2008 12:05:03 GMT""}]","2009-11-13"
"0706.3427","Dmitri Starodub","D. Starodub (1), P. Rez (1), G. Hembree (1), M. Howells (2), D.
  Shapiro (2), H. N. Chapman (3), P. Fromme (1), K. Schmidt (1), U. Weierstall
  (1), R. B. Doak (1) and J. C. H. Spence (1) ((1) Arizona State University,
  (2) Lawrence Berkeley National Laboratory, (3) Lawrence Livermore National
  Laboratory)","Dose, exposure time, and resolution in Serial X-ray Crystallography","19 pages, 7 figures, 1 table",,,,"physics.optics physics.bio-ph",,"  The resolution of X-ray diffraction microscopy is limited by the maximum dose
that can be delivered prior to sample damage. In the proposed Serial
Crystallography method, the damage problem is addressed by distributing the
total dose over many identical hydrated macromolecules running continuously in
a single-file train across a continuous X-ray beam, and resolution is then
limited only by the available molecular and X-ray fluxes and molecular
alignment. Orientation of the diffracting molecules is achieved by laser
alignment. We evaluate the incident X-ray fluence (energy/area) required to
obtain a given resolution from (1) an analytical model, giving the count rate
at the maximum scattering angle for a model protein, (2) explicit simulation of
diffraction patterns for a GroEL-GroES protein complex, and (3) the frequency
cut off of the transfer function following iterative solution of the phase
problem, and reconstruction of an electron density map in the projection
approximation. These calculations include counting shot noise and multiple
starts of the phasing algorithm. The results indicate counting time and the
number of proteins needed within the beam at any instant for a given resolution
and X-ray flux. We confirm an inverse fourth power dependence of exposure time
on resolution, with important implications for all coherent X-ray imaging. We
find that multiple single-file protein beams will be needed for sub-nanometer
resolution on current third generation synchrotrons, but not on fourth
generation designs, where reconstruction of secondary protein structure at a
resolution of 0.7 nm should be possible with short exposures.
","[{""version"":""v1"",""created"":""Sat, 23 Jun 2007 03:40:13 GMT""}]","2007-06-26"
"0706.3428","Sourendu Gupta","R. S. Bhalerao and Sourendu Gupta","Aspects of causal viscous hydrodynamics","27 pages, 17 figures, references added, minor changes, version to
  appear in Phys. Rev. (C)","Phys.Rev.C77:014902,2008","10.1103/PhysRevC.77.014902","TIFR/TH/07-11","nucl-th hep-ph nucl-ex",,"  We investigate the phenomenology of freely expanding fluids, with different
material properties, evolving through the Israel-Stewart (IS) causal viscous
hydrodynamics, and compare our results with those obtained in the relativistic
Eckart-Landau-Navier-Stokes (ELNS) acausal viscous hydrodynamics. Through the
analysis of scaling invariants we give a definition of thermalization time
which can be self-consistently determined in viscous hydrodynamics. Next we
construct the solutions for one-dimensional boost-invariant flows. Expansion of
viscous fluids is slower than that of one-dimensional ideal fluids, resulting
in entropy production. At late times, these flows are reasonably well
approximated by solutions obtained in ELNS hydrodynamics. Estimates of initial
energy densities from observed final values are strongly dependent on the
dynamics one chooses. For the same material, and the same final state, IS
hydrodynamics gives the smallest initial energy density. We also study
fluctuations about these one-dimensional boost-invariant backgrounds; they are
damped in ELNS hydrodynamics but can become sound waves in IS hydrodynamics.
The difference is obvious in power spectra due to clear signals of
wave-interference in IS hydrodynamics, which is completely absent in ELNS
dynamics.
","[{""version"":""v1"",""created"":""Sat, 23 Jun 2007 05:25:57 GMT""},{""version"":""v2"",""created"":""Sun, 1 Jul 2007 06:36:18 GMT""},{""version"":""v3"",""created"":""Wed, 12 Dec 2007 14:18:18 GMT""}]","2008-11-26"
"0706.3429","Roland M. Crocker","Roland M. Crocker, David Jones, David R. Ballantyne, and Fulvio Melia","Radio Synchrotron Emission from Secondary Leptons in the Vicinity of Sgr
  A*","11 pages, 2 figures. Two references missing from published version
  added and acknowledgements extended","ApJ Letters 664, 95 (2007)","10.1086/520931",,"astro-ph",,"  A point-like source of ~TeV gamma-rays has recently been seen towards the
Galactic center by HESS and other air Cerenkov telescopes. In recent work
(Ballantyne et al. 2007), we demonstrated that these gamma-rays can be
attributed to high-energy protons that (i) are accelerated close to the event
horizon of the central black hole, Sgr A*, (ii) diffuse out to ~pc scales, and
(iii) finally interact to produce gamma-rays. The same hadronic collision
processes will necessarily lead to the creation of electrons and positrons.
Here we calculate the synchrotron emissivity of these secondary leptons in the
same magnetic field configuration through which the initiating protons have
been propagated in our model. We compare this emission with the observed ~GHz
radio spectrum of the inner few pc region which we have assembled from archival
data and new measurements we have made with the Australia Telescope Compact
Array. We find that our model predicts secondary synchrotron emission with a
steep slope consistent with the observations but with an overall normalization
that is too large by a factor of ~ 2. If we further constrain our theoretical
gamma-ray curve to obey the implicit EGRET upper limit on emission from this
region we predict radio emission that is consistent with observations, i.e.,
the hadronic model of gamma ray emission can, simultaneously and without
fine-tuning, also explain essentially all the diffuse radio emission detected
from the inner few pc of the Galaxy.
","[{""version"":""v1"",""created"":""Sat, 23 Jun 2007 05:57:29 GMT""},{""version"":""v2"",""created"":""Tue, 7 Aug 2007 06:25:47 GMT""}]","2009-11-13"
"0706.3430","Caleb Lo","Caleb K. Lo, Robert W. Heath Jr. and Sriram Vishwanath","The Impact of Channel Feedback on Opportunistic Relay Selection for
  Hybrid-ARQ in Wireless Networks","30 pages, 9 figures, submitted to the IEEE Transactions on Vehicular
  Technology, revised March 2008",,"10.1109/TVT.2008.928896",,"cs.IT math.IT",,"  This paper presents a decentralized relay selection protocol for a dense
wireless network and describes channel feedback strategies that improve its
performance. The proposed selection protocol supports hybrid
automatic-repeat-request transmission where relays forward parity information
to the destination in the event of a decoding error. Channel feedback is
employed for refining the relay selection process and for selecting an
appropriate transmission mode in a proposed adaptive modulation transmission
framework. An approximation of the throughput of the proposed adaptive
modulation strategy is presented, and the dependence of the throughput on
system parameters such as the relay contention probability and the adaptive
modulation switching point is illustrated via maximization of this
approximation. Simulations show that the throughput of the proposed selection
strategy is comparable to that yielded by a centralized selection approach that
relies on geographic information.
","[{""version"":""v1"",""created"":""Sat, 23 Jun 2007 06:19:41 GMT""},{""version"":""v2"",""created"":""Tue, 15 Jan 2008 21:15:03 GMT""},{""version"":""v3"",""created"":""Tue, 1 Apr 2008 00:02:32 GMT""}]","2016-11-15"
"0706.3431","Amin Rezaeezadeh","Amin Rezaeezadeh","Motion of Hexagonal Pencil on an Inclined Plane","2 pages",,,,"physics.class-ph","http://arxiv.org/licenses/nonexclusive-distrib/1.0/","  This paper has been withdrawn by the author(s), due a crucial sign error in
Eqn. 1.
","[{""version"":""v1"",""created"":""Sat, 23 Jun 2007 07:08:00 GMT""},{""version"":""v2"",""created"":""Wed, 28 May 2008 15:34:25 GMT""},{""version"":""v3"",""created"":""Mon, 23 Feb 2009 20:29:16 GMT""}]","2009-02-23"
"0706.3432","Chiyori Urabe","Chiyori Urabe","Fluctuation of the Top Location and Avalanches in the Formation Process
  of a Sandpile","15 pages, 13 figures",,"10.1143/JPSJ.76.094401",,"cond-mat.soft",,"  We investigate the formation processes of a sandpile using numerical
simulation. We find a new relation between the fluctuation of the motion of the
top and the surface state of a sandpile. The top moves frequently as particles
are fed one by one every time interval T. The time series of the top location
has the power spectrum which obeys a power law, S(f)~f^{\alpha}, and its
exponent \alpha depends on T and the system size w. The surface state is
characterized by two time scales; the lifetime of an avalanche, T_{a}, and the
time required to cause an avalanche, T_{s}. The surface state is fluid-like
when T_{a}~T_{s}, and it is solid-like when T_{a}<<T_{s}. Our numerical results
show that \alpha is a function of T_{s}/T_{a}.
","[{""version"":""v1"",""created"":""Sat, 23 Jun 2007 07:18:15 GMT""}]","2009-11-13"
"0706.3433","Mesfin Asfaw","Mesfin Asfaw","Unbinding transitions of multicomponent membranes and strings","11 figures, 10 pages",,,,"cond-mat.soft",,"  We present a theory of unbinding transitions for membranes that interact via
short and long receptor/ligand bonds. The detail of unbinding behavior of the
membranes is governed by the binding energies and concentrations of receptors
and ligands. We investigate the unbinding behavior of these membranes with
Monte Carlo simulations and via a comparison with strings. We derive the
scaling laws for strings analytically. The exact analytic results provide
scaling estimate for membranes in the vicinity of the critical point.
","[{""version"":""v1"",""created"":""Sat, 23 Jun 2007 07:52:44 GMT""},{""version"":""v2"",""created"":""Wed, 2 Apr 2008 02:50:32 GMT""}]","2008-04-02"
"0706.3435","Zoltan Szabo","Zoltan Szabo, Barnabas Poczos, Andras Lorincz","Undercomplete Blind Subspace Deconvolution via Linear Prediction","12 pages","European Conference on Machine Learning (ECML), pages 740-747,
  2007",,,"stat.ME",,"  We present a novel solution technique for the blind subspace deconvolution
(BSSD) problem, where temporal convolution of multidimensional hidden
independent components is observed and the task is to uncover the hidden
components using the observation only. We carry out this task for the
undercomplete case (uBSSD): we reduce the original uBSSD task via linear
prediction to independent subspace analysis (ISA), which we can solve. As it
has been shown recently, applying temporal concatenation can also reduce uBSSD
to ISA, but the associated ISA problem can easily become `high dimensional'
[1]. The new reduction method circumvents this dimensionality problem. We
perform detailed studies on the efficiency of the proposed technique by means
of numerical simulations. We have found several advantages: our method can
achieve high quality estimations for smaller number of samples and it can cope
with deeper temporal convolutions.
","[{""version"":""v1"",""created"":""Sat, 23 Jun 2007 10:15:39 GMT""}]","2012-01-04"
"0706.3437","Andrei V. Lebedev","A. V. Lebedev and G. Blatter","Bell's inequality test with time-delayed two-particle correlations","8 pages, 4 figures","Phys. Rev. B 77, 035301 (2008)","10.1103/PhysRevB.77.035301",,"cond-mat.mes-hall cond-mat.str-el quant-ph",,"  Adopting the frame of mesoscopic physics, we describe a Bell type experiment
involving time-delayed two-particle correlation measurements. The
indistinguishability of quantum particles results in a specific interference
between different trajectories. We show how the non-locality in the
time-delayed correlations due to the indistinguishability of the quantum
particles manifests itself in the violation of a Bell inequality, where the
degree of violation is related to the accuracy of the measurement. We
demonstrate how the interrelation between the orbital- and the spin exchange
symmetry can by exploited to infer knowledge on spin-entanglement from a
measurement of orbital entanglement.
","[{""version"":""v1"",""created"":""Sat, 23 Jun 2007 09:18:26 GMT""},{""version"":""v2"",""created"":""Thu, 10 Jan 2008 16:04:39 GMT""}]","2009-11-13"
"0706.3438","Antoni Szczurek","A. Szczurek, A. Rybarska, G. Slipek","Dijet correlations in $pp$ collisions at RHIC","11 pages, 23 figures, a talk presented at International Workshop on
  High-pT physics at LHC, Jyvaskyla, Finland, March 23-27 2007",,,,"hep-ph",,"  We compare results of $k_t$-factorization approach and next-to-leading order
collinear-factorization approach for dijet correlations in proton-proton
collisions at RHIC energies. We discuss correlations in azimuthal angle as well
as correlations in two-dimensional space of transverse momenta of two jets.
Some $k_t$-factorization subprocesses are included for the first time in the
literature. Different unintegrated gluon/parton distributions are used in the
$k_t$-factorization approach. The results depend on UGDF/UPDF used. Limitations
due to leading jet condition are discussed.
","[{""version"":""v1"",""created"":""Sat, 23 Jun 2007 09:44:36 GMT""}]","2009-04-16"
"0706.3439","Antoni Szczurek","M. Luszczak, A. Szczurek","Heavy quark correlations in hadronic collisions","8 pages, 20 figures, a talk presented at International Workshop on
  High-pT physics at LHC, Jyvaskyla, Finland, March 23-27 2007","PoS LHC07:024,2007",,,"hep-ph",,"  We discuss results of the $k_t$ - factorization approach for heavy
quark-heavy antiquark correlations in proton-proton and proton-antiproton
collisions for RHIC, Tevatron and LHC. We consider correlations in the
azimuthal angle as well as in the two-dimensional space of transverse momentum
of heavy quark and heavy antiquark. We compare results obtained with the help
of different unintegrated parton distributions (UPDF) from the literature.
","[{""version"":""v1"",""created"":""Sat, 23 Jun 2007 09:40:22 GMT""}]","2011-07-19"
"0706.3440","Liffman Kurt","Kurt Liffman","The Stellar-Disk Electric (Short) Circuit: Observational Predictions for
  a YSO Jet Flow","6 pages, 8 figures, Accepted for publication in Astrophysics & Space
  Science","Astrophys.SpaceSci.311:69-74,2007","10.1007/s10509-007-9562-0",,"astro-ph",,"  We discuss the star-disk electric circuit for a young stellar object (YSO)
and calculate the expected torques on the star and the disk. We obtain the same
disk magnetic field and star-disk torques as given by standard
magnetohydrodynamic (MHD) analysis. We show how a short circuit in the
star-disk electric circuit may produce a magnetically-driven jet flow from the
inner edge of a disk surrounding a young star.
  An unsteady bipolar jet flow is produced that flows perpendicular to the disk
plane. Jet speeds of order hundreds of kilometres per second are possible,
while the outflow mass loss rate is proportional to the mass accretion rate and
is a function of the disk inner radius relative to the disk co-rotation radius.
","[{""version"":""v1"",""created"":""Sat, 23 Jun 2007 09:30:28 GMT""}]","2008-11-26"
"0706.3442","Antoni Szczurek","T. Pietrycki, A. Szczurek","Photon-jet correlations in hadronic collisions","7 pages, 12 figures, a talk presented at International Workshop on
  High-pT physics at LHC, Jyvaskyla, Finland, March 23-27 2007","PoSLHC07:029,2007",,,"hep-ph",,"  We compare results of $k_t$-factorization approach and next-to-leading order
collinear-factorization approach for photon-jet correlations in $pp$ and $p
\bar p$ collisions at RHIC, Tevatron and LHC energies. We discuss correlations
in azimuthal angle as well as in two-dimensional space of transverse momenta of
photon and jet. Different unintegrated parton distributions (UPDF) are included
in the $k_t$-factorization approach. The results depend on UPDFs used. The
results of NLO collinear-factorization are shown for comparison.
","[{""version"":""v1"",""created"":""Sat, 23 Jun 2007 09:35:27 GMT""}]","2009-04-16"
"0706.3443","John Aston","Jyh-Ying Peng, John A. D. Aston","The SSM Toolbox for Matlab","Software available from authors",,,"C-2007-02","stat.CO stat.AP",,"  State Space Models (SSM) is a MATLAB 7.0 software toolbox for doing time
series analysis by state space methods. The software features fully interactive
construction and combination of models, with support for univariate and
multivariate models, complex time-varying (dynamic) models, non-Gaussian
models, and various standard models such as ARIMA and structural time-series
models. The software includes standard functions for Kalman filtering and
smoothing, simulation smoothing, likelihood evaluation, parameter estimation,
signal extraction and forecasting, with incorporation of exact initialization
for filters and smoothers, and support for missing observations and multiple
time series input with common analysis structure. The software also includes
implementations of TRAMO model selection and Hillmer-Tiao decomposition for
ARIMA models. The software will provide a general toolbox for doing time series
analysis on the MATLAB platform, allowing users to take advantage of its
readily available graph plotting and general matrix computation capabilities.
","[{""version"":""v1"",""created"":""Sat, 23 Jun 2007 09:45:48 GMT""}]","2007-06-26"
"0706.3444","Ulrich Haisch","Ulrich Haisch","How To Kill a Penguin","5 pages, 4 figures, 1 table, uses pdflatex, talk given at DIS 2007,
  Muenchen, Germany, April 15--20, 2007",,,"ZU-TH 10/07","hep-ph",,"  Within constrained minimal-flavor-violation the large destructive
flavor-changing Z-penguin managed to survive eradication so far. We give a
incisive description of how to kill it using the precision measurements of the
Z -> b anti-b pseudo observables. The derived stringent range for the
non-standard contribution to the universal Inami-Lim function C leads to tight
two-sided limits for the branching ratios of all Z-penguin dominated
flavor-changing K- and B-decays.
","[{""version"":""v1"",""created"":""Sat, 23 Jun 2007 10:07:15 GMT""}]","2007-06-26"
"0706.3445","Emilio Santos Corchero","Emilio Santos","Analysis of a recent experimental test of Bell inequalities violating
  quantum predictions","10 pages, no figures","Eur. Phyis. J. D 46. 531 (2008)","10.1140/epjd/e2007-00322-3",,"quant-ph",,"  A recent experiment by Brida et al. (arXiv:0705.0439 [quant-ph]) is analyzed
with the conclusion that is shows a violation of standard quantum predictions.
A simple local hidden variables model is studied which is compatible with the
empirical results and fits fairly well the deviation from the quantum
predictions.
","[{""version"":""v1"",""created"":""Sat, 23 Jun 2007 10:09:28 GMT""}]","2021-06-23"
"0706.3446","Rostyslav Vlokh O","R. Vlokh, M. Kostyrko","Estimation of the Birefringence Change in Crystals Induced by
  Gravitation Field","3 pages","Ukr.J.Phys.Opt. 2005 6: 125-127","10.3116/16091833/6/4/125/2005",,"physics.optics physics.space-ph",,"  The effect of gravitation field of spherically symmetric mass on the
birefringent properties of crystals has been analysed. It has been shown that
the gravitation field with spherical symmetry can lead to a change of
birefringence in anisotropic media.
","[{""version"":""v1"",""created"":""Sat, 23 Jun 2007 10:14:30 GMT""}]","2007-06-26"
"0706.3447","Amit Hogadi","Amit Hogadi","Products of Brauer Severi surfaces","7 pages",,,,"math.AG",,"  Let $\{P_i\}_{1 \leq i \leq r}$ and $\{Q_i\}_{1 \leq i \leq r}$ be two
collections of Brauer Severi surfaces (resp. conics) over a field $k$. We show
that the subgroup generated by the $P_i's$ in $Br(k)$ is the same as the
subgroup generated by the $Q_i's$ \iff $\Pi P_i $ is birational to $\Pi Q_i$.
Moreover in this case $\Pi P_i$ and $\Pi Q_i$ represent the same class in
$M(k)$, the Grothendieck ring of $k$-varieties. The converse holds if
$char(k)=0$. Some of the above implications also hold over a general noetherian
base scheme.
","[{""version"":""v1"",""created"":""Sat, 23 Jun 2007 10:19:43 GMT""}]","2007-06-26"
"0706.3448","Zhen Yan","N. Wang, Z. Yan, R. N. Manchester, and H. X. Wang","Daily Observations of Interstellar Scintillation in PSR B0329+54","10 pages, 5 figures, Accepted by MNRAS",,"10.1111/j.1365-2966.2008.12864.x",,"astro-ph",,"  Quasi-continuous observations of PSR B03239+54 over 20 days using the Nanshan
25-m telescope at 1540 MHz have been used to study the effects of refractive
scintillation on the pulsar flux density and diffractive scintillation
properties. Dynamic spectra were obtained from datasets of 90 min duration and
diffractive parameters derived from a two-dimensional auto-correlation
analysis. Secondary spectra were also computed but these showed no significant
evidence for arc structure. Cross correlations between variations in the
derived parameters were much lower than predicted by thin screen models and in
one case was of opposite sign to the prediction. Observed modulation indices
were larger than predicted by thin screen models with a Kolmogorov fluctuation
spectrum. Structure functions were computed for the flux density, diffractive
timescale and decorrelation bandwidth. These indicated a refractive timescale
of $8\pm 2$ h, much shorter than predicted by the thin screen model. The
measured structure-function slope of $0.4\pm 0.2$ is also inconsistent with
scattering by a single thin screen for which a slope of 2.0 is expected. All
observations are consistent with scattering by an extended medium having a
Kolmogorov fluctuation spectrum which is concentrated towards the pulsar. This
interpretation is also consistent with recent observations of multiple diffuse
scintillation arcs for this pulsar.
","[{""version"":""v1"",""created"":""Sat, 23 Jun 2007 11:20:40 GMT""},{""version"":""v2"",""created"":""Tue, 18 Dec 2007 13:05:09 GMT""},{""version"":""v3"",""created"":""Tue, 19 Feb 2008 14:10:11 GMT""}]","2009-11-13"
