"cond-mat/0701186","A Bratkovsky","E.V. Ponizovskaya and A.M. Bratkovsky","Ensembles of plasmonic nanospheres at optical frequencies and a problem
  of negative index behavior","6 pages, 4 figures",,,,"cond-mat.mes-hall",,"  Arrays of metallic nanoparticles support individual and collective plasmonic
excitations that contribute to unusual phenomena like surface enhanced Raman
scattering, anomalous transparency, negative index, and subwavelength
resolution in various metamaterials. We have examined the electromagnetic
response of dual Kron's lattice and films containing up to three monolayers of
metallic nanospheres. It appears that open cubic Kron's lattice exhibits `soft'
electromagnetic response but no negative index behavior. The close-packed
arrays behave similarly: there are plasmon resonances and very high
transmission at certain wavelengths that are much larger than the separation
between the particles, and a `soft' magnetic response, with small but positive
effective index of refraction. It would be interesting to check those
predictions experimentally.
","[{""version"":""v1"",""created"":""Tue, 9 Jan 2007 21:05:14 GMT""}]","2007-05-23"
"cond-mat/0701187","Takashi Uneyama","Takashi Uneyama","Density Functional Simulation of Spontaneous Formation of Vesicle in
  Block Copolymer Solutions","29 pages, 11 figures, to appear in J. Chem. Phys","J. Chem. Phys. 126, 114902 (2007)","10.1063/1.2463426",,"cond-mat.soft",,"  We carry out numerical simulations of vesicle formation based on the density
functional theory for block copolymer solutions. It is shown by solving the
time evolution equations for concentrations that a polymer vesicle is
spontaneously formed from the homogeneous state. The vesicle formation
mechanism obtained by our simulation agree with the results of other
simulations based on the particle models as well as experiments. By changing
parameters such as the volume fraction of polymers or the Flory-Huggins
interaction parameter between the hydrophobic subchains and solvents, we can
obtain the spherical micelles, cylindrical micelles or bilayer structures, too.
We also show that the morphological transition dynamics of the micellar
structures can be reproduced by controlling the Flory-Huggins interaction
parameter.
","[{""version"":""v1"",""created"":""Wed, 10 Jan 2007 00:03:14 GMT""}]","2007-05-23"
"cond-mat/0701189","Ning Yang","Ning Yang, Jia-Lin Zhu, Zhengsheng Dai, and Yuquan Wang","Correlations and entanglements in a few-electron quantum dot without
  Zeeman splitting",,,,,"cond-mat.str-el cond-mat.mes-hall",,"  We explore the correlations and entanglements of exact-diagonalized
few-electron wave functions in a quantum dot in magnetic fields without the
Zeeman splitting. With the increase of the field, the lowest states with
different spins gradually form a narrow band and the electronic states undergo
a transition from liquids to rotating Wigner molecules which are accompanied by
different characters of charge correlations. For both the liquid and crystal
states, the spin conditional probability densities show magnetic couplings
between the particles which depend on the particle numbers, the total spins and
the angular momenta of the states. The von Neumann entropies show the
spin-dependent entanglements between electrons. The regular magnetic-coupling
oscillations and converging entanglement entropies emerge in the rotating
Wigner molecular states.
","[{""version"":""v1"",""created"":""Wed, 10 Jan 2007 03:09:04 GMT""}]","2007-05-23"
"cond-mat/0701190","Masahiro Kanai","Masahiro Kanai","Exact solution of the zero-range process: fundamental diagram of the
  corresponding exclusion process","12 pages, 2 figures","J. Phys. A: Math. Theor. 40 (2007) 7127-7138","10.1088/1751-8113/40/26/001",,"cond-mat.stat-mech","http://arxiv.org/licenses/nonexclusive-distrib/1.0/","  In this paper, we propose a general way of computing expectation values in
the zero-range process, using an exact form of the partition function. As an
example, we provide the fundamental diagram (the flux-density plot) of the
asymmetric exclusion process corresponding to the zero-range process.We express
the partition function for the steady state by the Lauricella hypergeometric
function, and thereby have two exact fundamental diagrams each for the parallel
and random sequential update rules. Meanwhile, from the viewpoint of
equilibrium statistical mechanics, we work within the canonical ensemble but
the result obtained is certainly in agreement with previous works done in the
grand canonical ensemble.
","[{""version"":""v1"",""created"":""Wed, 10 Jan 2007 07:43:59 GMT""},{""version"":""v2"",""created"":""Mon, 16 Feb 2009 08:06:31 GMT""}]","2009-02-16"
"cond-mat/0701191","Roland Mathieu","R. Mathieu, J. P. He, X. Z. Yu, Y. Kaneko, M. Uchida, Y. S. lee, T.
  Arima, A. Asamitsu, and Y. Tokura","Coexistence of long-ranged charge and orbital order and spin-glass state
  in single-layered manganites with weak quenched disorder","EPL style; 6 pages, 5 figures","Europhys. Lett. 80, 37001 (2007).","10.1209/0295-5075/80/37001",,"cond-mat.mtrl-sci",,"  The relationship between orbital and spin degrees of freedom in the
single-crystals of the hole-doped Pr$_{1-x}$Ca$_{1+x}$MnO$_4$, 0.3 $\leq$ $x$
$\leq$ 0.7, has been investigated by means of ac-magnetometry and charge
transport. Even though there is no cation ordering on the $A$-site, the
quenched disorder is extremely weak in this system due to the very similar
ionic size of Pr$^{3+}$ and Ca$^{2+}$. A clear asymmetric response of the
system to the under- (respective over-) hole doping was observed. The
long-ranged charge-orbital order established for half doping ($x$=0.5) subsists
in the over-doping case ($x$ $>$ 0.5), albeit rearranged to accommodate the
extra holes introduced in the structure. The charge-orbital order is however
destabilized by the presence of extra localized electrons (under-doping, $x$
$<$ 0.5), leading to its disappearance below $x$=0.35. We show that in an
intermediate under-doped region, with 0.35 $\leq$ $x$ $<$ 0.5, the
``orbital-master spin-slave'' relationship commonly observed in half-doped
manganites does not take place. The long-ranged charge-orbital order is not
accompanied by an antiferromagnetic transition at low temperatures, but by a
frustrated short-ranged magnetic state bringing forth a spin-glass phase. We
discuss in detail the nature and origin of this spin-glass state, which, as in
the half-doped manganites with large quenched disorder, is not related to the
macroscopic phase separation observed in crystals with minor defects or
impurities.
","[{""version"":""v1"",""created"":""Wed, 10 Jan 2007 08:29:27 GMT""},{""version"":""v2"",""created"":""Tue, 21 Aug 2007 07:57:22 GMT""},{""version"":""v3"",""created"":""Mon, 10 Sep 2007 08:08:54 GMT""}]","2007-10-09"
"cond-mat/0701192","Raymond Fresard","Vincent Hardy, Delphine Flahaut, Raymond Fresard and Antoine Maignan","Anisotropic susceptibility of the geometrically frustrated spin-chain
  compound Ca3Co2O6","10 pages, 5 figures","J. Phys.: Condens. Matter 19, 145229 (2007).","10.1088/0953-8984/19/14/145229",,"cond-mat.str-el cond-mat.mtrl-sci",,"  Ca3Co2O6 is a system exhibiting a series of fascinating properties, including
magnetization plateaus and remarkably slow dynamics at low-T. These properties
are intimately related to the geometrical frustration, which results from a
particular combination of features: (i) the chains are arranged on a triangular
lattice; (ii) there is a large uniaxial anisotropy; (iii) the intrachain and
interchain couplings are ferromagnetic and antiferromagnetic, respectively.
  The uniaxial anisotropy is thus an issue of crucial importance for the
analysis of the physical properties of Ca3Co2O6. However, it turns out that no
precise investigation of this magnetic anisotropy has been performed so far. On
the basis of susceptibility data directly recorded on single crystals, the
present study reports on quantitative information about the anisotropy of
Ca3Co2O6.
","[{""version"":""v1"",""created"":""Wed, 10 Jan 2007 09:44:55 GMT""}]","2007-05-23"
"cond-mat/0701193","Satya N. Majumdar","Satya N. Majumdar","Random Matrices, the Ulam Problem, Directed Polymers & Growth Models,
  and Sequence Matching","Les Houches lecture notes for the summer school on ""Complex Systems""
  (Les Houches, July, 2006); 39 pages, 11 .eps figures included",,,,"cond-mat.stat-mech cond-mat.dis-nn math-ph math.MP math.PR",,"  In these lecture notes I will give a pedagogical introduction to some common
aspects of 4 different problems: (i) random matrices (ii) the longest
increasing subsequence problem (also known as the Ulam problem) (iii) directed
polymers in random medium and growth models in (1+1) dimensions and (iv) a
problem on the alignment of a pair of random sequences. Each of these problems
is almost entirely a sub-field by itself and here I will discuss only some
specific aspects of each of them. These 4 problems have been studied almost
independently for the past few decades, but only over the last few years a
common thread was found to link all of them. In particular all of them share
one common limiting probability distribution known as the Tracy-Widom
distribution that describes the asymptotic probability distribution of the
largest eigenvalue of a random matrix. I will mention here, without
mathematical derivation, some of the beautiful results discovered in the past
few years. Then, I will consider two specific models (a) a ballistic deposition
growth model and (b) a model of sequence alignment known as the Bernoulli
matching model and discuss, in some detail, how one derives exactly the
Tracy-Widom law in these models. The emphasis of these lectures would be on how
to map one model to another. Some open problems are discussed at the end.
","[{""version"":""v1"",""created"":""Wed, 10 Jan 2007 09:17:10 GMT""}]","2007-05-23"
"cond-mat/0701194","Xavier Blase","E. Bourgeois (LPMCN), X. Blase (LPMCN)","Superconductivity in doped cubic silicon: an ab initio study",,,,,"cond-mat.supr-con",,"  We study within a first-principle approach the band structure, vibrational
modes and electron-phonon coupling in boron, aluminum and phosphorus doped
silicon in the diamond phase. Our results provide evidences that the recently
discovered superconducting transition in boron doped cubic silicon can be
explained within a standard phonon-mediated mechanism. The importance of
lattice compression and dopant related stretching modes are emphasized. We find
that T$_C$ can be increased by one order of magnitude by adopting aluminum
doping instead of boron.
","[{""version"":""v1"",""created"":""Wed, 10 Jan 2007 09:27:24 GMT""}]","2007-05-23"
"cond-mat/0701195","Baoli Liu","Baoli Liu, Hongming Zhao, Jia Wang, Linsheng Liu, Wenxin Wang, Haijun
  Zhu, and Dongmin Chen","Electron Density Dependence of in-plane Spin Relaxation Anisotropy in
  GaAs/AlGaAs Two-Dimensional Electron Gas","3 pages, 2 figures","Appl. Phys. Lett. 90, 112111 (2007)","10.1063/1.2713353",,"cond-mat.mes-hall","http://arxiv.org/licenses/nonexclusive-distrib/1.0/","  We investigated the spin dynamics of two-dimensional electrons in (001)
GaAs/AlGaAs heterostructure using the time resolved Kerr rotation technique
under a transverse magnetic field. The in-plane spin lifetime is found to be
anisotropic below 150k due to the interference of Rashba and Dresselhaus
spin-orbit coupling and D'yakonov-Perel' spin relaxation. The ratio of in-plane
spin lifetimes is measured directly as a function of temperature and pump
power, showing that the electron density in 2DEG channel strongly affects the
Rashba spin-orbit coupling.
","[{""version"":""v1"",""created"":""Wed, 10 Jan 2007 09:42:32 GMT""},{""version"":""v2"",""created"":""Thu, 29 Mar 2012 07:00:34 GMT""}]","2012-03-30"
"cond-mat/0701196","Katsura Hosho","Hosho Katsura","Nonequilibrium Kondo problem with spin-dependent chemical potentials:
  Exact results","13 pages, 2 figures","J. Phys. Soc. Jpn. Vol. 76 (2007) 054710","10.1143/JPSJ.76.054710",,"cond-mat.str-el cond-mat.mes-hall",,"  We give a brief review of the Kondo effect and exactly solve the
nonequilibrium Kondo problem at the special point in the parameter space of the
model with spin-dependent chemical potentials. Using the obtained solution, we
compute several experimentally observable quantities: charge current, spin
current and magnetic properties. Applications to the physically important cases
such as the case where the impurity spin is placed in between two
ferromagnetically polarized leads are discussed.
","[{""version"":""v1"",""created"":""Wed, 10 Jan 2007 10:36:18 GMT""}]","2010-10-07"
"cond-mat/0701197","Andreas Engel","A. Engel","Replica mean-field theory for Levy spin-glasses","5 pages, 1 figure",,,,"cond-mat.dis-nn",,"  Infinite-range spin-glass models with Levy-distributed interactions show a
freezing transition similar to disordered spin systems on finite connectivity
random graphs. It is shown that despite diverging moments of the local field
distribution this transition can be analyzed within the replica approach by
working at imaginary temperature and using a variant of the replica method
developed for diluted systems and optimization problems. The replica-symmetric
self-consistent equation for the distribution of local fields illustrates how
the long tail in the distribution of coupling strengths gives rise to a
significant fraction of strong bonds per spin which form a percolating backbone
at the transition temperature.
","[{""version"":""v1"",""created"":""Wed, 10 Jan 2007 10:53:28 GMT""}]","2007-05-23"
"cond-mat/0701198","Sebastian Diehl","S. Diehl, H. Gies, J. M. Pawlowski, C. Wetterich","Flow Equations for the BCS-BEC Crossover","4 pages, 4 figures","Phys.Rev.A76:021602,2007","10.1103/PhysRevA.76.021602","HD-THEP-07-02","cond-mat.supr-con cond-mat.stat-mech hep-ph quant-ph",,"  The functional renormalisation group is used for the BCS-BEC crossover in
gases of ultracold fermionic atoms. In a simple truncation, we see how
universality and an effective theory with composite bosonic di-atom states
emerge. We obtain a unified picture of the whole phase diagram. The flow
reflects different effective physics at different scales. In the BEC limit as
well as near the critical temperature, it describes an interacting bosonic
theory.
","[{""version"":""v1"",""created"":""Wed, 10 Jan 2007 11:56:00 GMT""},{""version"":""v2"",""created"":""Tue, 30 Oct 2007 12:25:23 GMT""}]","2009-11-13"
"cond-mat/0701199","Matteo Calandra","Matteo Calandra, Aleksey N. Kolmogorov and Stefano Curtarolo","Quest for high Tc in layered structures: the case of LiB","8 pages, 6 figures",,,,"cond-mat.supr-con cond-mat.mtrl-sci",,"  Using electronic structure calculation we study the superconducting
properties of the theoretically-devised superconductor MS1-LiB (LiB). We
calculate the electron-phonon coupling ($\lambda=0.62$) and the phonon
frequency logarithmic average ($<\omega >_{log}=54.6$ meV) and show that the
LiB critical temperature is in the range of 10-15 K, despite the frozen-phonon
deformation potential being of the same order of MgB$_2$. As a consequence, LiB
captures some of the essential physics of MgB$_2$ but (i) the electron-phonon
coupling due to $\sigma$ states is smaller and (ii) the precious contribution
of the $\pi$ carriers to the critical temperature is lacking. We investigate
the possible change in $T_c$ that can be induced by doping and pressure and
find that these conditions cannot easily increase $T_c$ in LiB.
","[{""version"":""v1"",""created"":""Wed, 10 Jan 2007 12:22:19 GMT""}]","2007-05-23"
"cond-mat/0701200","Hossein Fazli","H. Fazli, R. Golestanian, P.L. Hansen, and M.R. Kolahchi","Rod-like Polyelectrolyte Brushes with Mono- and Multivalent Counterions","7 pages, 6 figures","Europhys. Lett, 73, 429 (2006)","10.1209/epl/i2005-10396-3",,"cond-mat.soft",,"  A model of rod-like polyelectrolyte brushes in the presence of monovalent and
multivalent counterions but with no added-salt is studied using Monte Carlo
simulation. The average height of the brush, the histogram of rod
conformations, and the counterion density profile are obtained for different
values of the grafting density of the charge-neutral wall. For a domain of
grafting densities, the brush height is found to be relatively insensitive to
the density due to a competition between counterion condensation and inter-rod
repulsion. In this regime, multivalent counterions collapse the brush in the
form of linked clusters. Nematic order emerges at high grafting densities,
resulting is an abrupt increase of the brush height.
","[{""version"":""v1"",""created"":""Wed, 10 Jan 2007 12:56:30 GMT""}]","2007-05-23"
"cond-mat/0701201","Ramesh Chandra Nath","R. Nath, B. Geil, and R. Bohmer","2H-NMR studies of supercooled and glassy aspirin","14 pages, 6 figures","Journal of Non-Crystalline Solids, 353, 3788 (2007)","10.1016/j.jnoncrysol.2007.05.180",,"cond-mat.soft",,"  Acetyl salicylic acid, deuterated at the methyl group, was investigated using
2H-NMR in its supercooled and glassy states. Just above the glass transition
temperature the molecular reorientations were studied using stimulated-echo
spectroscopy and demonstrated a large degree of similarity with other glass
formers. Deep in the glassy phase the NMR spectra look similar to those
reported for the crystal [A. Detken, P. Focke, H. Zimmermann, U. Haeberlen, Z.
Olejniczak, Z. T. Lalowicz, Z. Naturforsch. A 50 (1995) 95] and below 20 K they
are indicative for rotational tunneling with a relatively large tunneling
frequency. Measurements of the spin-lattice relaxation times for temperatures
below 150 K reveal a broad distribution of correlation times in the glass. The
dominant energy barrier characterizing the slow-down of the methyl group is
significantly smaller than the well defined barrier in the crystal.
","[{""version"":""v1"",""created"":""Wed, 10 Jan 2007 13:06:05 GMT""}]","2009-11-13"
"cond-mat/0701202","Victor Malyshev","F. A. B. F. de Moura, M. L. Lyra, F. Dominguez-Adame, V. A. Malyshev","Coherent electron dynamics in a two-dimensional random system with
  mobility edges","8 pages, 4 figures, to appear in J. Phys.: Condens. Matter","J. Phys.: Condens. Matter 19, 056204 (2007)","10.1088/0953-8984/19/5/056204",,"cond-mat.dis-nn",,"  We study numerically the dynamics of a one-electron wave packet in a
two-dimensional random lattice with long-range correlated diagonal disorder in
the presence of a uniform electric field. The time-dependent Schr\""{o}dinger
equation is used for this purpose. We find that the wave packet displays
Bloch-like oscillations associated with the appearance of a phase of
delocalized states in the strong correlation regime. The amplitude of
oscillations directly reflects the bandwidth of the phase and allows to measure
it. The oscillations reveal two main frequencies whose values are determined by
the structure of the underlying potential in the vicinity of the wave packet
maximum.
","[{""version"":""v1"",""created"":""Wed, 10 Jan 2007 13:50:33 GMT""}]","2007-05-23"
"cond-mat/0701203","Christopher Eames","C. Eames, C. Bonet, E. W. Perkins, M. I. J. Probert and S. P. Tear","STM and ab initio study of holmium nanowires on a Ge(111) Surface","4 pages, 12 figures (inc. subfigures). Presented at the the APS March
  meeting, Baltimore MD, 2006","Phys. Rev. B 74, 193318 (2006)","10.1103/PhysRevB.74.193318",,"cond-mat.mtrl-sci cond-mat.other",,"  A nanorod structure has been observed on the Ho/Ge(111) surface using
scanning tunneling microscopy (STM). The rods do not require patterning of the
surface or defects such as step edges in order to grow as is the case for
nanorods on Si(111). At low holmium coverage the nanorods exist as isolated
nanostructures while at high coverage they form a periodic 5x1 structure. We
propose a structural model for the 5x1 unit cell and show using an ab initio
calculation that the STM profile of our model structure compares favorably to
that obtained experimentally for both filled and empty states sampling. The
calculated local density of states shows that the nanorod is metallic in
character.
","[{""version"":""v1"",""created"":""Wed, 10 Jan 2007 14:23:58 GMT""}]","2007-05-23"
"cond-mat/0701204","Srutarshi Pradhan","Srutarshi Pradhan","Physics Models of Earthquake","9 pages, 19 figures To be appeared in the special issue of ""Science
  and Culture"", Kolkata, India","Science and Culture, Vol 73 Nos. 3-4 (2007)",,,"cond-mat.stat-mech cond-mat.mtrl-sci",,"  Since long back, scientists have been putting enormous effort to understand
earthquake dynamics -the goal is to develop a successful prediction scheme
which can provide reliable alarm that an earthquake is imminent. Model studies
sometimes help to understand in some extend the basic dynamics of the real
systems and therefore is an important part of earthquake research. In this
report, we review several physics models which capture some essential features
of earthquake phenomenon and also suggest methods to predict catastrophic
events being within the range of model parameters.
","[{""version"":""v1"",""created"":""Wed, 10 Jan 2007 14:36:32 GMT""}]","2009-08-03"
"cs/0701065","Ioannis Chatzigeorgiou","I. Chatzigeorgiou, M. R. D. Rodrigues, I. J. Wassell, R. Carrasco","Can Punctured Rate-1/2 Turbo Codes Achieve a Lower Error Floor than
  their Rate-1/3 Parent Codes?","5 pages, 7 figures, Proceedings of the 2006 IEEE Information Theory
  Workshop, Chengdu, China, October 22-26, 2006",,"10.1109/ITW2.2006.323763",,"cs.IT math.IT",,"  In this paper we concentrate on rate-1/3 systematic parallel concatenated
convolutional codes and their rate-1/2 punctured child codes. Assuming
maximum-likelihood decoding over an additive white Gaussian channel, we
demonstrate that a rate-1/2 non-systematic child code can exhibit a lower error
floor than that of its rate-1/3 parent code, if a particular condition is met.
However, assuming iterative decoding, convergence of the non-systematic code
towards low bit-error rates is problematic. To alleviate this problem, we
propose rate-1/2 partially-systematic codes that can still achieve a lower
error floor than that of their rate-1/3 parent codes. Results obtained from
extrinsic information transfer charts and simulations support our conclusion.
","[{""version"":""v1"",""created"":""Tue, 9 Jan 2007 16:32:59 GMT""}]","2016-11-17"
"cs/0701066","Lucile Sassatelli","Lucile Sassatelli and David Declercq","Non-binary Hybrid LDPC Codes: Structure, Decoding and Optimization",,"IEEE 2006 Information Theory Workshop, Chengdu, China, Oct.2006,
  in proceedings",,,"cs.IT math.IT",,"  In this paper, we propose to study and optimize a very general class of LDPC
codes whose variable nodes belong to finite sets with different orders. We
named this class of codes Hybrid LDPC codes. Although efficient optimization
techniques exist for binary LDPC codes and more recently for non-binary LDPC
codes, they both exhibit drawbacks due to different reasons. Our goal is to
capitalize on the advantages of both families by building codes with binary (or
small finite set order) and non-binary parts in their factor graph
representation. The class of Hybrid LDPC codes is obviously larger than
existing types of codes, which gives more degrees of freedom to find good codes
where the existing codes show their limits. We give two examples where hybrid
LDPC codes show their interest.
","[{""version"":""v1"",""created"":""Tue, 9 Jan 2007 17:50:57 GMT""}]","2007-07-16"
"cs/0701067","G.Susinder Rajan","G. Susinder Rajan, Anshoo Tandon and B. Sundar Rajan","On Four-group ML Decodable Distributed Space Time Codes for Cooperative
  Communication","To appear in Proceedings of WCNC 2007, Hong Kong, March 11-15, 2007.
  5 pages, 1 Figure",,,,"cs.IT math.IT",,"  A construction of a new family of distributed space time codes (DSTCs) having
full diversity and low Maximum Likelihood (ML) decoding complexity is provided
for the two phase based cooperative diversity protocols of Jing-Hassibi and the
recently proposed Generalized Non-orthogonal Amplify and Forward (GNAF)
protocol of Rajan et al. The salient feature of the proposed DSTCs is that they
satisfy the extra constraints imposed by the protocols and are also four-group
ML decodable which leads to significant reduction in ML decoding complexity
compared to all existing DSTC constructions. Moreover these codes have uniform
distribution of power among the relays as well as in time. Also, simulations
results indicate that these codes perform better in comparison with the only
known DSTC with the same rate and decoding complexity, namely the Coordinate
Interleaved Orthogonal Design (CIOD). Furthermore, they perform very close to
DSTCs from field extensions which have same rate but higher decoding
complexity.
","[{""version"":""v1"",""created"":""Tue, 9 Jan 2007 21:12:53 GMT""}]","2007-07-13"
