"math/0701255","Yi Hu","Yi Hu, Jiayuan Lin and Yijun Shao","A Compactification of the Space of Algebraic Maps from P^1 to P^n","Final version to appear in ""Communications in Analysis and Geometry"".
  22 pages. This paper supersedes math.AG/0505482",,,,"math.AG","http://arxiv.org/licenses/nonexclusive-distrib/1.0/","  We provide a natural smooth projective compactification of the space of
algebraic maps from the projective line to the projective space of dimension n
by adding a divisor with simple normal crossings.
","[{""version"":""v1"",""created"":""Tue, 9 Jan 2007 16:29:38 GMT""},{""version"":""v2"",""created"":""Wed, 17 Jan 2007 16:15:06 GMT""},{""version"":""v3"",""created"":""Sun, 11 Oct 2009 19:25:59 GMT""},{""version"":""v4"",""created"":""Mon, 28 Mar 2011 21:38:34 GMT""}]","2011-03-30"
"math/0701256","Volker Mayer","Volker Mayer","The size of the Julia set of meromorphic functions",,,,,"math.DS",,"  We give a lower bound of the hyperbolic and the Hausdorff dimension of the
Julia set of meromorphic functions of finite order under very general
conditions.
","[{""version"":""v1"",""created"":""Tue, 9 Jan 2007 16:50:20 GMT""}]","2007-05-23"
"math/0701257","Bernhard Koeck","Helena B. Fischbacher-Weitz and Bernhard K\""ock","Equivariant Riemann-Roch theorems for curves over perfect fields","20 pages",,,,"math.AG math.NT math.RT",,"  We prove an equivariant Riemann-Roch formula for divisors on algebraic curves
over perfect fields. By reduction to the known case of curves over
algebraically closed fields, we first show a preliminary formula with
coefficients in Q. We then prove and shed some further light on a divisibility
result that yields a formula with integral coefficients. Moreover, we give
variants of the main theorem for equivariant locally free sheaves of higher
rank.
","[{""version"":""v1"",""created"":""Tue, 9 Jan 2007 17:09:16 GMT""},{""version"":""v2"",""created"":""Fri, 11 Apr 2008 14:09:15 GMT""}]","2008-04-11"
"math/0701258","Nicholas Gill","Alan R. Camina, Nick Gill, A.E. Zalesski","Large dimensional classical groups and linear spaces","32 pages. Version 2 has a new format that includes less repetition.
  It also proves a slightly stronger result; with the addition of our
  ""Concluding Remarks"" section the result holds for dimension at least 21",,,,"math.GR math.CO",,"  Suppose that a group $G$ has socle $L$ a simple large-rank classical group.
Suppose furthermore that $G$ acts transitively on the set of lines of a linear
space $\mathcal{S}$. We prove that, provided $L$ has dimension at least 25,
then $G$ acts transitively on the set of flags of $\mathcal{S}$ and hence the
action is known. For particular families of classical groups our results hold
for dimension smaller than 25.
  The group theoretic methods used to prove the result (described in Section 3)
are robust and general and are likely to have wider application in the study of
almost simple groups acting on finite linear spaces.
","[{""version"":""v1"",""created"":""Tue, 9 Jan 2007 17:16:59 GMT""},{""version"":""v2"",""created"":""Tue, 3 Apr 2007 18:03:49 GMT""}]","2007-05-23"
"math/0701259","Svante Janson","James Allen Fill, Svante Janson","Precise logarithmic asymptotics for the right tails of some limit random
  variables for random trees","15 pages",,,,"math.PR",,"  For certain random variables that arise as limits of functionals of random
finite trees, we obtain precise asymptotics for the logarithm of the right-hand
tail. Our results are based on the facts (i) that the random variables we study
can be represented as functionals of a Brownian excursion and (ii) that a large
deviation principle with good rate function is known explicitly for Brownian
excursion. Examples include limit distributions of the total path length and of
the Wiener index in conditioned Galton-Watson trees (also known as simply
generated trees). In the case of Wiener index (where we recover results proved
by Svante Janson and Philippe Chassaing by a different method) and for some
other examples, a key constant is expressed as the solution to a certain
optimization problem, but the constant's precise value remains unknown.
","[{""version"":""v1"",""created"":""Tue, 9 Jan 2007 17:37:56 GMT""}]","2007-05-23"
"math/0701260","Yi-Zhi Huang","Lin Zhang","Vertex tensor category structure on a category of Kazhdan--Lusztig","20 pages",,,,"math.QA hep-th math.RT",,"  We incorporate a category of certain modules for an affine Lie algebra, of a
certain fixed non-positive-integral level, considered by Kazhdan and Lusztig,
into the representation theory of vertex operator algebras, by using the
logarithmic tensor product theory for generalized modules for a vertex operator
algebra developed by Huang, Lepowsky and the author. We do this by proving that
the conditions for applying this general logarithmic tensor product theory
hold. As a consequence, we prove that this category has a natural vertex tensor
category structure, and in particular we obtain a new, vertex-algebraic,
construction of the natural associativity isomorphisms and proof of their
properties.
","[{""version"":""v1"",""created"":""Tue, 9 Jan 2007 17:39:03 GMT""}]","2007-05-23"
"math/0701261","Urs Niesen","Urs Niesen, Aslan Tchamkerten","Tracking Stopping Times Through Noisy Observations","19 pages, 4 figures, to appear in IEEE Transactions on Information
  Theory","IEEE Transactions on Information Theory, vol. 55, pp. 422-432,
  January 2009","10.1109/TIT.2008.2008115",,"math.ST cs.IT math.IT stat.TH","http://arxiv.org/licenses/nonexclusive-distrib/1.0/","  A novel quickest detection setting is proposed which is a generalization of
the well-known Bayesian change-point detection model. Suppose
\{(X_i,Y_i)\}_{i\geq 1} is a sequence of pairs of random variables, and that S
is a stopping time with respect to \{X_i\}_{i\geq 1}. The problem is to find a
stopping time T with respect to \{Y_i\}_{i\geq 1} that optimally tracks S, in
the sense that T minimizes the expected reaction delay E(T-S)^+, while keeping
the false-alarm probability P(T<S) below a given threshold \alpha \in [0,1].
This problem formulation applies in several areas, such as in communication,
detection, forecasting, and quality control.
  Our results relate to the situation where the X_i's and Y_i's take values in
finite alphabets and where S is bounded by some positive integer \kappa. By
using elementary methods based on the analysis of the tree structure of
stopping times, we exhibit an algorithm that computes the optimal average
reaction delays for all \alpha \in [0,1], and constructs the associated optimal
stopping times T. Under certain conditions on \{(X_i,Y_i)\}_{i\geq 1} and S,
the algorithm running time is polynomial in \kappa.
","[{""version"":""v1"",""created"":""Tue, 9 Jan 2007 18:10:42 GMT""},{""version"":""v2"",""created"":""Sun, 28 Jan 2007 19:58:47 GMT""},{""version"":""v3"",""created"":""Fri, 8 Jun 2007 16:00:33 GMT""},{""version"":""v4"",""created"":""Sun, 31 Aug 2008 21:23:01 GMT""}]","2016-11-17"
"math/0701262","Glen D. Anderson","G. D. Anderson, M. K. Vamanamurthy, and M. Vuorinen","Generalized Convexity and Inequalities","17 pages","J. Math. Anal. Appl. 335 (2007), 1294-1308","10.1016/j.jmaa.2007.02.016",,"math.CA",,"  Let R+ = (0,infinity) and let M be the family of all mean values of two
numbers in R+ (some examples are the arithmetic, geometric, and harmonic
means). Given m1, m2 in M, we say that a function f : R+ to R+ is
(m1,m2)-convex if f(m1(x,y)) < or = m2(f(x),f(y)) for all x, y in R+ . The
usual convexity is the special case when both mean values are arithmetic means.
We study the dependence of (m1,m2)-convexity on m1 and m2 and give sufficient
conditions for (m1,m2)-convexity of functions defined by Maclaurin series. The
criteria involve the Maclaurin coefficients. Our results yield a class of new
inequalities for several special functions such as the Gaussian hypergeometric
function and a generalized Bessel function.
","[{""version"":""v1"",""created"":""Tue, 9 Jan 2007 18:26:36 GMT""}]","2008-05-11"
"math/0701263","Maria Joita M.","Maria Joita","A Radon-Nikodym theorem for completely n-positive linear maps on
  pro-C*-algebras and its applications","14 pages",,,,"math.OA math.FA",,"  The order relation on the set of completely n-positive linear maps from a
pro-C*-algebra A to L(H), the C*-algebra of bounded linear operators on a
Hilbert space H, is characterized in terms of the representation associated
with each completely n-positive linear map. Also, the pure elements in the set
of all completely n-positive linear maps from A to L(H) and the extreme points
in the set of unital completely n-positive linear maps from A to L(H) are
characterized in terms of the representation induced by each completely
n-positive linear map.
","[{""version"":""v1"",""created"":""Tue, 9 Jan 2007 18:32:02 GMT""}]","2007-05-23"
"math/0701264","Jean-Camille Birget","Jean-Camille Birget, Stuart W. Margolis","Two-letter group codes that preserve aperiodicity of inverse finite
  automata","10 pages",,,,"math.GR",,"  We construct group codes over two letters (i.e., bases of subgroups of a
two-generated free group) with special properties. Such group codes can be used
for reducing algorithmic problems over large alphabets to algorithmic problems
over a two-letter alphabet. Our group codes preserve aperiodicity of inverse
finite automata. As an application we show that the following problems are
PSpace-complete for two-letter alphabets (this was previously known for large
enough finite alphabets): The intersection-emptiness problem for inverse finite
automata, the aperiodicity problem for inverse finite automata, and the
closure-under-radical problem for finitely generated subgroups of a free group.
The membership problem for 3-generated inverse monoids is PSpace-complete.
","[{""version"":""v1"",""created"":""Tue, 9 Jan 2007 18:35:14 GMT""}]","2007-05-23"
"math/0701265","Miko{\l}aj Zalewski","Mikolaj Zalewski","Computer-assisteed proof of a periodic solution in a non-linear feedback
  DDE","19 pages, 1 figure",,,,"math.DS",,"  In this paper we rigorously prove the existance of a non-trivial periodic
orbit for the non-linear delay differential equation: $x'(t) = K \sin(x(t-1))$
for $K=1.6$. We show that the equations on the Fourier equations have a
solution by computing the local Brower degree. This degree can be computed by
using a homotopy which validity can be checked by checking a finite number of
inequalities. Checking these inequalities is done by a computer program.
","[{""version"":""v1"",""created"":""Tue, 9 Jan 2007 18:48:12 GMT""}]","2007-05-23"
"math/0701266","Ivan Marin","Ivan Marin (IMJ), Jean Michel (IMJ)","Automorphisms of complex reflection groups",,,,,"math.RT math.GR","http://arxiv.org/licenses/nonexclusive-distrib/1.0/","  Let $G\subset\GL(\BC^r)$ be a finite complex reflection group. We show that
when $G$ is irreducible, apart from the exception $G=\Sgot_6$, as well as for a
large class of non-irreducible groups, any automorphism of $G$ is the product
of a central automorphism and of an automorphism which preserves the
reflections. We show further that an automorphism which preserves the
reflections is the product of an element of $N_{\GL(\BC^r)}(G)$ and of a
""Galois"" automorphism: we show that $\Gal(K/\BQ)$, where $K$ is the field of
definition of $G$, injects into the group of outer automorphisms of $G$, and
that this injection can be chosen such that it induces the usual Galois action
on characters of $G$, apart from a few exceptional characters; further,
replacing if needed $K$ by an extension of degree 2, the injection can be
lifted to $\Aut(G)$, and every irreducible representation admits a model which
is equivariant with respect to this lifting. Along the way we show that the
fundamental invariants of $G$ can be chosen rational.
","[{""version"":""v1"",""created"":""Tue, 9 Jan 2007 18:49:26 GMT""},{""version"":""v2"",""created"":""Wed, 13 Jun 2007 15:50:37 GMT""},{""version"":""v3"",""created"":""Thu, 12 Mar 2009 14:38:20 GMT""}]","2009-03-12"
"math/0701267","Emanuela Petracci","Michel Duflo, Emanuela Petracci","Symmetric pairs and Gorelik elements","Accepted for publication in Journal of Algebra, special volume in
  honour of E.B. Vinberg (32 pages)",,,,"math.RT math.RA",,"  The second author gave a formula for the elements of the enveloping algebra
of a Lie superalgebra defined by Gorelik under an appropriate unimodularity
assumption. We show that this formula is a particular case of a formula for the
Jacobian of the exponential map of a symmetric superspace.
","[{""version"":""v1"",""created"":""Tue, 9 Jan 2007 20:36:56 GMT""}]","2011-02-19"
"math/0701268","James Robinson","J C Robinson & W Sadowski","Numerical verification of regularity in the three-dimensional
  Navier-Stokes equations",,"Asymptotic Analysis 59 (2008) 39-50",,,"math.AP",,"  Current theoretical results for the three-dimensional Navier--Stokes
equations only guarantee that solutions remain regular for all time when the
initial enstrophy ($\|Du_0\|^2:=\int|{\rm curl} u_0|^2$) is sufficiently small,
  $\|Du_0\|^2\le\chi_0$. In fact, this smallness condition is such that the
enstrophy is always non-increasing. In this paper we provide a numerical
procedure that will verify regularity of solutions for any bounded set of
initial conditions,
  $\|Du_0\|^2\le\chi_1$. Under the assumption that the equations are in fact
regular we show that this procedure can be guaranteed to terminate after a
finite time.
","[{""version"":""v1"",""created"":""Tue, 9 Jan 2007 20:43:30 GMT""}]","2010-07-28"
"math/0701269","Dave Auckly","Dave Auckly","The number of smooth 4-manifolds with a fixed complexity","Schematics of Kirby diagrams for the knot surgery manifolds were
  replaced with actual Kirby diagrams, and minor errors were fixed",,,,"math.GT",,"  One can define the complexity of a smooth 4-manifold as the minimal sum of
the number of disks, strands and crossings in a Kirby diagram. Martelli proved
that the number of homeomorphism classes of complexity less than n grows as
$n^2$. In this paper we prove that the number of diffeomorphism classes grows
at least as fast as $n^{c\sqrt[3]{n}}$. Along the way we construct complete
kirby diagrams for a large family of knot surgery manifolds.
","[{""version"":""v1"",""created"":""Tue, 9 Jan 2007 21:07:12 GMT""},{""version"":""v2"",""created"":""Mon, 18 Jun 2007 19:46:58 GMT""}]","2007-06-18"
"math/0701270","Simon King","Simon A. King","Fast Computation of Secondary Invariants","13 pages. v4: Typos corrected v3: Acknowledgement added. Reference to
  more recent benchmarks added",,,,"math.AC",,"  A very classical subject in Commutative Algebra is the Invariant Theory of
finite groups. In our work on 3-dimensional topology (S. King, Ideal
Turaev-Viro invariants. To appear in Top. Appl.), we found certain examples of
group actions on polynomial rings. When we tried to compute the invariant ring
using Singular or Magma, it turned out that the existing algorithms did not
suffice.
  We present here a new algorithm for the computation of secondary invariants,
if primary invariants are given. Our benchmarks show that the implementation of
our algorithm in the library ""finvar"" of Singular marks a dramatic improvement
in the manageable problem size.
  A particular benefit of our algorithm is that the computation of irreducible
secondary invariants does not involve the explicit computation of reducible
secondary invariants, which may save resources.
  The implementation of our algorithm in Singular is for the non-modular case;
however, the key theorem of our algorithm holds in the modular case as well and
might be useful also there.
","[{""version"":""v1"",""created"":""Tue, 9 Jan 2007 22:41:04 GMT""},{""version"":""v2"",""created"":""Tue, 23 Jan 2007 16:24:34 GMT""},{""version"":""v3"",""created"":""Mon, 5 Mar 2007 15:51:45 GMT""},{""version"":""v4"",""created"":""Thu, 29 Mar 2007 18:56:17 GMT""}]","2007-05-23"
"math/0701271","Sonia Fourati","Sonia Fourati","Fluctuations of Levy processes and scattering theory",,,,,"math.PR math.CV",,"  We establish a connection between the scattering inverse problem and the
determination of the distribution of the position of the Levy process at the
exit time of a bounded interval in term of its Levy exponent.
","[{""version"":""v1"",""created"":""Wed, 10 Jan 2007 00:41:37 GMT""}]","2007-05-23"
"math/0701272","Alexander Vasil'ev","Manuel D. Contreras, Santiago D\'iaz-Madrigal, and Alexander Vasil'ev","Digons and angular derivatives of analytic self-maps of the unit disk","7 pages",,,,"math.CV math.DS",,"  We present a geometric approach to a well-known sharp inequality, due to
Cowen and Pommerenke, about angular derivatives of general univalent self-maps
of the unit disk.
","[{""version"":""v1"",""created"":""Wed, 10 Jan 2007 04:54:09 GMT""}]","2016-08-14"
"math/0701273","Kang-Hai Tan","Kang-Hai Tan","Convex Functions on Sub-Riemannian Manifolds. I","19 pages",,,,"math.DG",,"  We find a different approach to define convex functions in the sub-Riemannian
setting. A function on a sub-Riemannian manifold is nonholonomically geodesic
convex if its restriction to any nonholonomic (straightest) geodesic is convex.
In the case of Carnot groups, this definition coincides with that by
Danniell-Garofalo-Nieuhn (equivalent to that by Lu-Manfredi-Stroffolini).
Nonholonomic geodesics are defined using the horizontal connection. A new
distance corresponding to the horizontal connection has been introduced and
near regular points proven to be equivalent to the Carnot-Carath\`{e}odory
distance. Some basic properties of convex functions are studied. In particular
we prove that any nonholonomically geodesic convex function locally bounded
from above is locally Lipschitzian with respect to the Carnot-Carath\`{e}odory
distance.
","[{""version"":""v1"",""created"":""Wed, 10 Jan 2007 05:36:13 GMT""}]","2007-05-23"
"math/0701274","Kang-Hai Tan","Kang-Hai Tan","On sublaplacians of sub-Riemannian manifolds","14 pages",,,,"math.DG",,"  In this note we address a notion of sublaplacians of sub-Riemannian
manifolds. In particular for fat sub-Riemannian manifolds we answered the
sublaplacian question proposed by R. Montgomery.
","[{""version"":""v1"",""created"":""Wed, 10 Jan 2007 06:26:22 GMT""}]","2007-05-23"
"math/0701275","Volker Mayer","Volker Mayer and Mariusz Urbanski","Thermodynamical Formalism and Multifractal Analysis for Meromorphic
  Functions of finite order","119 pages",,,,"math.DS","http://arxiv.org/licenses/nonexclusive-distrib/1.0/","  We first use Nevanlinna theory to provide full thermodynamical formalism for
a very general class of meromorphic functions of finite order. Finer stochastic
properties of the Perron-Frobenius operator are given and finally we provide
the multifractal analysis of Gibbs states.
","[{""version"":""v1"",""created"":""Wed, 10 Jan 2007 07:04:33 GMT""},{""version"":""v2"",""created"":""Sat, 31 Jan 2009 10:35:47 GMT""}]","2009-01-31"
"math/0701276","Nadia S. Larsen","Nadia S. Larsen and Iain Raeburn","Projective multi-resolution analyses arising from direct limits of
  Hilbert modules",,,,,"math.OA",,"  The authors have recently shown how direct limits of Hilbert spaces can be
used to construct multi-resolution analyses and wavelets in $L^2(\R)$. Here
they investigate similar constructions in the context of Hilbert modules over
$C^*$-algebras. For modules over $C(\T^n)$, the results shed light on work of
Packer and Rieffel on projective multi-resolution analyses for specific Hilbert
$C(\T^n)$-modules of functions on $\R^n$. There are also new applications to
modules over $C(C)$ when $C$ is the infinite path space of a directed graph.
","[{""version"":""v1"",""created"":""Wed, 10 Jan 2007 08:59:37 GMT""}]","2007-05-23"
"math/0701277","Gwenael Massuyeau","Dorin Cheptea, Kazuo Habiro, Gwenael Massuyeau","A functorial LMO invariant for Lagrangian cobordisms","59 pages with many figures. Some minor changes in the writing, and a
  few precisions added","Geom. Topol. 12 (2008) 1091-1170","10.2140/gt.2008.12.1091",,"math.GT math.QA",,"  Lagrangian cobordisms are three-dimensional compact oriented cobordisms
between once-punctured surfaces, subject to some homological conditions. We
extend the Le-Murakami-Ohtsuki invariant of homology three-spheres to a functor
from the category of Lagrangian cobordisms to a certain category of Jacobi
diagrams. We prove some properties of this functorial LMO invariant, including
its universality among rational finite-type invariants of Lagrangian
cobordisms. Finally, we apply the LMO functor to the study of homology
cylinders from the point of view of their finite-type invariants.
","[{""version"":""v1"",""created"":""Wed, 10 Jan 2007 10:25:17 GMT""},{""version"":""v2"",""created"":""Thu, 22 Mar 2007 08:51:37 GMT""}]","2014-11-11"
"math/0701278","Nobuhiro Honda","Nobuhiro Honda","Explicit construction of new Moishezon twistor spaces","26 pages, 6 figures; V2 English slightly improved",,,,"math.DG math.AG",,"  In this paper we explicitly construct Moishezon twistor spaces on nCP^2 for
arbitrary n>1 which admit a holomorphic C*-action. When n=2, they coincide with
Y. Poon's twistor spaces. When n=3, they coincide with the one studied by the
author in math.DG/0403528. When n>3, they are new twistor spaces, to the best
of the author's knowledge. By investigating the anticanonical system, we show
that our twistor spaces are bimeromorphic to conic bundles over certain
rational surfaces. The latter surfaces can be regarded as orbit spaces of the
C*-action on the twistor spaces. Namely they are minitwistor spaces. We
explicitly determine their defining equations in CP^4. It turns out that the
structure of the minitwistor space is independent of n. Further we concrelely
construct a CP^2-bundle over the resolution of this surface, and provide an
explicit defining equation of the conic bundles. It shows that the number of
irreducible components of the discriminant locus for the conic bundles
increases as n does. Thus our twistor spaces have a lot of similarities with
the famous LeBrun twistor spaces, where the minitwistor space CP^1 x CP^1 in
LeBrun's case is replaced by our minitwistor spaces found in math.DG/0508088.
","[{""version"":""v1"",""created"":""Wed, 10 Jan 2007 11:12:12 GMT""},{""version"":""v2"",""created"":""Fri, 19 Jan 2007 01:20:54 GMT""}]","2007-05-23"
"math/0701279","Jonathan Breuer","Jonathan Breuer, Yoram Last","Stability of Spectral Types for Jacobi Matrices Under Decaying Random
  Perturbations",,,,,"math.SP",,"  We study stability of spectral types for semi-infinite self-adjoint
tridiagonal matrices under random decaying perturbations. We show that
absolutely continuous spectrum associated with bounded eigenfunctions is stable
under Hilbert-Schmidt random perturbations. We also obtain some results for
singular spectral types.
","[{""version"":""v1"",""created"":""Wed, 10 Jan 2007 11:10:32 GMT""}]","2007-05-23"
"math/0701280","Kang-Hai Tan","Kang-Hai Tan","Sobolev classes and horizontal energy minimizers between
  Carnot-Carath\'{e}odory spaces","29 pages","Commun. Contemp. Math. Vol.6,No.2,315-347 (2004)",,,"math.AP",,"  The notion of horizontal energy minimizers between C-C spaces is introduced.
We prove existence of such energy minimizers when the domain is a $C^{2}$,
noncharacteristic bounded open set in a C-C space and the target is a C-C space
of Carnot type.
","[{""version"":""v1"",""created"":""Wed, 10 Jan 2007 11:53:29 GMT""}]","2007-05-23"
"math/0701281","Evelina Shamarova","Evelina Shamarova and Alexandre B. Simas","Uniform approximation of the heat kernel on a manifold","Minor corrections",,,,"math.PR math.DG","http://arxiv.org/licenses/nonexclusive-distrib/1.0/","  We approximate the heat kernel $h(x,y,t)$ on a compact connected Riemannian
manifold $M$ without boundary uniformly in $(x,y,t)\in M\times M\times [a,b]$,
$a>0$, by $n$-fold integrals over $M^n$ of the densities of Brownian bridges.
Moreover, we provide an estimate for the uniform convergence rate. As an
immediate corollary, we get a uniform approximation of solutions of the Cauchy
problem for the heat equation on $M$.
","[{""version"":""v1"",""created"":""Wed, 10 Jan 2007 12:47:29 GMT""},{""version"":""v2"",""created"":""Tue, 19 Apr 2016 19:50:59 GMT""},{""version"":""v3"",""created"":""Fri, 29 Apr 2016 19:18:09 GMT""},{""version"":""v4"",""created"":""Sun, 29 Jan 2017 21:34:40 GMT""}]","2020-03-03"
"math/0701282","Patrick Le Meur","Patrick Le Meur (CMLA)","The universal cover of a monomial triangular algebra without multiple
  arrows","Revised version: the introduction was entirely modified. To appear in
  Journal of Algebra and its Applications","Journal of Algebra and Its Applications 7, 4 (2008) 443--469","10.1142/S0219498808002850",,"math.RT",,"  Let A be a basic connected finite dimensional algebra over an algebraically
closed field k. Assuming that A is monomial and that the ordinary quiver Q of A
has no oriented cycle and no multiple arrows, we prove that A admits a
universal cover with group the fundamental group of the underlying space of Q.
","[{""version"":""v1"",""created"":""Wed, 10 Jan 2007 12:52:51 GMT""},{""version"":""v2"",""created"":""Thu, 6 Mar 2008 10:29:07 GMT""}]","2008-09-29"
