"0710.2979","Guofa Xu","BES Collaboration","Search for the decays $J/\psi\to\gamma \rho \phi$ and $J/\psi\to\gamma
  \rho \omega$","6 pages, 6 figures","Phys.Rev.D77:012001,2008","10.1103/PhysRevD.77.012001",,"hep-ex",,"  Using 58 million $J/\psi$ events collected with the Beijing Spectrometer
(BESII) at the Beijing Electron-Positron Collider, the decays $J/\psi\to
\gamma\phi\rho$ and $J/\psi\to \gamma\omega\rho$ are searched for, and upper
limits on their branching fractions are reported at the 90% C. L. No clear
structures are observed in the $\gamma \rho$, $\gamma \phi$, or $\rho \phi $
mass spectra for $J/\psi\to \gamma\phi\rho$ nor in the $\gamma \rho$, $\gamma
\omega$, or $\rho \omega$ mass spectra for $J/\psi\to \gamma\omega\rho$.
","[{""version"":""v1"",""created"":""Tue, 16 Oct 2007 08:38:59 GMT""},{""version"":""v2"",""created"":""Thu, 18 Oct 2007 05:27:13 GMT""},{""version"":""v3"",""created"":""Tue, 6 Nov 2007 04:52:32 GMT""}]","2012-08-27"
"0710.2980","Olivier Acher","Olivier Acher (CEA Le Ripault), S\'ebastien Dubourg (CEA Le Ripault)","A generalization of Snoek's law to ferromagnetic films and composites",,"Physical Review B 77 (2008) 104440","10.1103/PhysRevB.77.104440",,"physics.optics",,"  The present paper establishes characteristics of the relative magnetic
permeability spectrum $\mu$(f) of magnetic materials at microwave frequencies.
The integral of the imaginary part of $\mu$(f) multiplied with the frequency f
gives remarkable properties. A generalisation of Snoek's law consists in this
quantity being bounded by the square of the saturation magnetization multiplied
with a constant. While previous results have been obtained in the case of
non-conductive materials, this work is a generalization to ferromagnetic
materials and ferromagnetic-based composites with significant skin effect. The
influence of truncating the summation to finite upper frequencies is
investigated, and estimates associated to the finite summation are provided. It
is established that, in practice, the integral does not depend on the damping
model under consideration. Numerical experiments are performed in the exactly
solvable case of ferromagnetic thin films with uniform magnetization, and these
numerical experiments are found to confirm our theoretical results. Microwave
permeability measurements on soft amorphous films are reported. The relation
between the integral and the saturation magnetization is verified
experimentally, and some practical applications of the theoretical results are
introduced. The integral can be used to determine the average magnetization
orientation in materials with complex configurations of the magnetization, and
furthermore to demonstrate the accuracy of microwave measurement systems. For
certain applications, such as electromagnetic compatibility or radar absorbing
materials, the relations established herein provide useful indications for the
design of efficient materials, and simple figures of merit to compare the
properties measured on various materials.
","[{""version"":""v1"",""created"":""Tue, 16 Oct 2007 08:44:26 GMT""},{""version"":""v2"",""created"":""Wed, 28 Nov 2007 20:07:20 GMT""}]","2008-05-13"
"0710.2981","Stefan Popescu","Bernhard Rothenstein and Stefan Popescu","Relativistic electrodynamics as an extrapolation of relativistic
  kinematics","Version Oct.2007, 7 pages and 3 figures",,,,"physics.gen-ph",,"  After having identified all the possible relationships between the electric
field and the magnetic field in a given inertial reference frame we derive the
transformation equations for the components of these fields. Special relativity
is involved via the addition law of parallel speeds or via the Lorentz
transformations for the space-time coordinates of the same event. Electricity
and magnetism are involved via Gauss's and Ampere's laws. In this way we avoid
the transformation equations for the Lorenz force components which are used in
most derivations of the transformation equations for E and B fields.
","[{""version"":""v1"",""created"":""Tue, 16 Oct 2007 08:48:05 GMT""}]","2007-10-17"
"0710.2982","Arne Matthias Weber","S. Heinemeyer, W. Hollik, A.M. Weber, G. Weiglein","MSSM precision physics at the Z resonance","Submitted for the SUSY07 proceedings, 4 pages, 2 figures",,,"IPPP/07/58, DCPT/07/116, MPP-2007-148","hep-ph",,"  LEP and SLC provide accurate data on the process (e^+e^- -> f bar f) at the Z
resonance. The GigaZ option at a future linear e^+e^- collider (ILC) will
further improve these measurements. As a consequence, theory predictions with
sufficiently smaller errors are necessary in order to fully exploit the
experimental accuracies and to derive indirect bounds on the scales of new
physics. Here we review the currently most accurate predictions of the Z pole
observables (e.g. sin^2 theta_eff, Gamma_Z, sigma^0_had) in the context of the
Minimal Supersymmetric Standard Model (MSSM). These predictions contain the
complete one-loop results including the full complex phase dependence, all
available MSSM two-loop corrections, as well as all relevant Standard Model
contributions.
","[{""version"":""v1"",""created"":""Tue, 16 Oct 2007 08:58:03 GMT""}]","2007-10-17"
"0710.2983","Eryk Czerwinski","H. Stockhorst, R. Stassen, R. Maier, D. Prasuhn, T. Katayama and L.
  Thorndahl","Experimental Test of Momentum Cooling Model Predictions at COSY and
  Conclusions for WASA and HESR","17 pages, 11 figures, Talk given at Symposium on Meson Physics at
  COSY-11 and WASA-at-COSY, Cracow, Poland, 17-22 Jun 2007","AIPConf.Proc.950:239-255,2007","10.1063/1.2819042",,"nucl-ex",,"  The High-Energy Storage Ring (HESR) of the future International Facility for
Antiproton and Ion Research (FAIR) at GSI in Darmstadt is planned as an
anti-proton cooler ring in the momentum range from 1.5 to 15 GeV/c. An
important and challenging feature of the new facility is the combination of
highly dense phase space cooled beams with internal targets. A detailed
numerical and analytical approach to the Fokker-Planck equation for
longitudinal filter cooling including the beam - target interaction has been
carried out to demonstrate the stochastic cooling capability. To gain
confidence in the model predictions a series of experimental stochastic cooling
studies with the internal target ANKE at COSY have been carried out. A
remarkable agreement between model and experiment was achieved. On this basis
longitudinal stochastic cooling simulations were performed to predict the
possibilities and limits of cooling when the newly installed WASA Pellet-target
is operated.
","[{""version"":""v1"",""created"":""Tue, 16 Oct 2007 08:58:06 GMT""}]","2008-11-26"
"0710.2984","Daniel Ballester","D. Ballester, A. M. Fuentes, I. M. Tkachenko","Polarizational stopping power of heavy-ion diclusters in two-dimensional
  electron liquids","9 pages, 5 figures. Published in Physical Review B
  http://link.aps.org/abstract/PRB/v75/e115109","Phys. Rev. B 75, 115109 (2007)","10.1103/PhysRevB.75.115109",,"cond-mat.str-el",,"  The in-plane polarizational stopping power of heavy-ion diclusters in a
two-dimensional strongly coupled electron liquid is studied. Analytical
expressions for the stopping power of both fast and slow projectiles are
derived. To go beyond the random-phase approximation we make use of the inverse
dielectric function obtained by means of the method of moments and some recent
analytical expressions for the static local-field correction factor.
","[{""version"":""v1"",""created"":""Tue, 16 Oct 2007 08:59:13 GMT""}]","2007-10-17"
"0710.2985","Thomas Schwetz","Thomas Schwetz","LSND versus MiniBooNE: Sterile neutrinos with energy dependent masses
  and mixing?","18 pages, 3 figures, discussion extended, version to appear in JHEP","JHEP 0802:011,2008","10.1088/1126-6708/2008/02/011","CERN-PH-TH/2007-195","hep-ph",,"  Standard active--sterile neutrino oscillations do not provide a satisfactory
description of the LSND evidence for neutrino oscillations together with the
constraints from MiniBooNE and other null-result short-baseline oscillation
experiments. However, if the mass or the mixing of the sterile neutrino depends
in an exotic way on its energy all data become consistent. I explore the
phenomenological consequences of the assumption that either the mass or the
mixing scales with the neutrino energy as $1/E_\nu^r (r > 0)$. Since the
neutrino energy in LSND is about 40 MeV, whereas MiniBooNE operates at around 1
GeV, oscillations get suppressed in MiniBooNE and the two results become fully
compatible for $r\gtrsim 0.2$. Furthermore, also the global fit of all relevant
data improves significantly by exploring the different energy regimes of the
various experiments. The best fit $\chi^2$ decreases by 12.7 (14.1) units with
respect to standard sterile neutrino oscillations if the mass (mixing) scales
with energy.
","[{""version"":""v1"",""created"":""Tue, 16 Oct 2007 09:00:47 GMT""},{""version"":""v2"",""created"":""Fri, 25 Jan 2008 12:34:15 GMT""}]","2010-02-03"
"0710.2986","Khangulyan Dmitry","Sergey V. Bogovalov, Stanislav R. Kelner","Dissipationless Disk Accretion","17 pages, 6 figures, published in Astronomy Reports, Vol.49, No.1,
  2005, p.57 (submitted September 13, 2003). Unfortunately, we did not upload
  the paper to astro-ph before, but since the topic is now of interest we feel
  that the paper would benefit the community","Astron.Rep.49:57,2005","10.1134/1.1850206",,"astro-ph",,"  We consider disk accretion resulting purely from the loss of angular momentum
due to the outflow of plasma from a magnetized disk. In this limiting case, the
dissipation due to the viscosity and finite electrical conductivity of the
plasma can be neglected. We have obtained self-consistent, self-similar
solutions for dissipationless disk accretion. Such accretion may result in the
formation of objects whose bolometric luminosities are lower than the flux of
kinetic energy in the ejected material.
","[{""version"":""v1"",""created"":""Tue, 16 Oct 2007 09:01:38 GMT""}]","2009-11-13"
"0710.2987","Raphaele Herbin","Thierry Gallou\""et (LATP), Laura Gastaldo (LATP, IRSN), Jean-Claude
  Latch\'e (IRSN), Raphaele Herbin (LATP)","An unconditionnally stable pressure correction scheme for compressible
  barotropic Navier-Stokes equations",,"M2AN Math. Model. Numer. Anal. 44, 2 (2010) 251--287","10.1051/m2an/2010002",,"math.NA",,"  We present in this paper a pressure correction scheme for barotropic
compressible Navier-Stokes equations, which enjoys an unconditional stability
property, in the sense that the energy and maximum-principle-based a priori
estimates of the continuous problem also hold for the discrete solution. The
stability proof is based on two independent results for general finite volume
discretizations, both interesting for their own sake: the $L^2$-stability of
the discrete advection operator provided it is consistent, in some sense, with
the mass balance and the estimate of the pressure work by means of the time
derivative of the elastic potential. The proposed scheme is built in order to
match these theoretical results, and combines a fractional-step time
discretization of pressure-correction type to a space discretization
associating low order non-conforming mixed finite elements and finite volumes.
Numerical tests with an exact smooth solution show the convergence of the
scheme.
","[{""version"":""v1"",""created"":""Tue, 16 Oct 2007 09:05:25 GMT""}]","2010-11-01"
"0710.2988","Paul Bedaride","Paul Bedaride (INRIA Lorraine - Loria)","Using Description Logics for Recognising Textual Entailment",,"Dans 19th European Summer School in Logic, Language and
  Information (2007) 11-21",,,"cs.CL",,"  The aim of this paper is to show how we can handle the Recognising Textual
Entailment (RTE) task by using Description Logics (DLs). To do this, we propose
a representation of natural language semantics in DLs inspired by existing
representations in first-order logic. But our most significant contribution is
the definition of two novel inference tasks: A-Box saturation and subgraph
detection which are crucial for our approach to RTE.
","[{""version"":""v1"",""created"":""Tue, 16 Oct 2007 09:16:24 GMT""}]","2007-10-17"
"0710.2989","Takahiro Hayakawa","Yasuo Fukui","CO, HI, recent Spitzer SAGE results in the Large Magellanic Cloud",,,"10.1017/S1743921307001184",,"astro-ph",,"  Formation of GMCs is one of the most crucial issues in galaxy evolution. I
will compare CO and HI in the LMC in 3 dimensional space for the first time
aiming at revealing the physical connection between GMCs and associated HI gas
at a ~40 pc scale. The present major findings are 1) [total CO intensity]
[total HI intensity]0.8 for the 110 GMCs, and 2) the HI intensity tends to
increase with the evolution of GMCs. I argue that these findings are consistent
with the growth of GMCs via HI accretion over a time scale of a few x 10 Myrs.
I will also discuss the role of the background stellar gravity and the
dynamical compression by supershells in formation of GMCs.
","[{""version"":""v1"",""created"":""Tue, 16 Oct 2007 09:17:30 GMT""}]","2007-10-17"
"0710.2990","Alexey Golovnev","Alexey V. Golovnev, Alexander S. Ushakov","Invariant variational principle for Hamiltonian mechanics","final version; to appear in J.Phys.A; 17 pages, 2 figures","J.Phys.A41:235210,2008","10.1088/1751-8113/41/23/235210",,"math-ph math.DS math.MP",,"  It is shown that the action for Hamiltonian equations of motion can be
brought into invariant symplectic form. In other words, it can be formulated
directly in terms of the symplectic structure $\omega$ without any need to
choose some 1-form $\gamma$, such that $\omega= d \gamma$, which is not unique
and does not even generally exist in a global sense.
","[{""version"":""v1"",""created"":""Tue, 16 Oct 2007 09:18:08 GMT""},{""version"":""v2"",""created"":""Mon, 22 Oct 2007 08:49:36 GMT""},{""version"":""v3"",""created"":""Wed, 9 Jan 2008 19:24:33 GMT""},{""version"":""v4"",""created"":""Thu, 3 Apr 2008 10:24:50 GMT""},{""version"":""v5"",""created"":""Wed, 30 Apr 2008 08:02:22 GMT""}]","2009-07-22"
"0710.2991","Claudio Albanese","Claudio Albanese and Adel Osseiran","Moment Methods for Exotic Volatility Derivatives",,,,,"q-fin.ST math.GN math.PR",,"  The latest generation of volatility derivatives goes beyond variance and
volatility swaps and probes our ability to price realized variance and sojourn
times along bridges for the underlying stock price process. In this paper, we
give an operator algebraic treatment of this problem based on Dyson expansions
and moment methods and discuss applications to exotic volatility derivatives.
The methods are quite flexible and allow for a specification of the underlying
process which is semi-parametric or even non-parametric, including
state-dependent local volatility, jumps, stochastic volatility and regime
switching. We find that volatility derivatives are particularly well suited to
be treated with moment methods, whereby one extrapolates the distribution of
the relevant path functionals on the basis of a few moments. We consider a
number of exotics such as variance knockouts, conditional corridor variance
swaps, gamma swaps and variance swaptions and give valuation formulas in
detail.
","[{""version"":""v1"",""created"":""Tue, 16 Oct 2007 09:25:12 GMT""}]","2008-12-02"
"0710.2992","Mao-Bin Hu","Mao-Bin Hu, Rui Jiang, Yong-Hong Wu, Wen-Xu Wang, Qing-Song Wu","Urban traffic from the perspective of dual graph","7 pages, 10 figures",,"10.1140/epjb/e2008-00219-5",,"physics.soc-ph physics.data-an",,"  In this paper, urban traffic is modeled using dual graph representation of
urban transportation network where roads are mapped to nodes and intersections
are mapped to links. The proposed model considers both the navigation of
vehicles on the network and the motion of vehicles along roads. The road's
capacity and the vehicle-turning ability at intersections are naturally
incorporated in the model. The overall capacity of the system can be quantified
by a phase transition from free flow to congestion. Simulation results show
that the system's capacity depends greatly on the topology of transportation
networks. In general, a well-planned grid can hold more vehicles and its
overall capacity is much larger than that of a growing scale-free network.
","[{""version"":""v1"",""created"":""Tue, 16 Oct 2007 09:29:01 GMT""}]","2009-11-13"
"0710.2993","Leonardo Campanelli","L. Campanelli, P. Cea, G.L. Fogli, and L. Tedesco","Inflation-Produced Magnetic Fields in Nonlinear Electrodynamics","6 pages","Phys.Rev.D77:043001,2008","10.1103/PhysRevD.77.043001",,"astro-ph",,"  We study the generation of primeval magnetic fields during inflation era in
nonlinear theories of electrodynamics. Although the intensity of the produced
fields strongly depends on characteristics of inflation and on the form of
electromagnetic Lagrangian, our results do not exclude the possibility that
these fields could be astrophysically interesting.
","[{""version"":""v1"",""created"":""Tue, 16 Oct 2007 09:36:27 GMT""}]","2008-11-26"
"0710.2994","Gunther Cornelissen","Gunther Cornelissen and Oliver Lorscheid","Toroidal automorphic forms for some function fields","7 pages, 2 figures; v2: minor corrections",,,,"math.NT math.AG",,"  Zagier introduced toroidal automorphic forms to study the zeros of zeta
functions: an automorphic form on GL_2 is toroidal if all its right translates
integrate to zero over all nonsplit tori in GL_2, and an Eisenstein series is
toroidal if its weight is a zero of the zeta function of the corresponding
field. We compute the space of such forms for the global function fields of
class number one and genus g zero or one, and with a rational place. The space
has dimension g and is spanned by the expected Eisenstein series. We deduce an
""automorphic"" proof for the Riemann hypothesis for the zeta function of those
curves.
","[{""version"":""v1"",""created"":""Tue, 16 Oct 2007 09:42:38 GMT""},{""version"":""v2"",""created"":""Thu, 27 Mar 2008 14:20:13 GMT""}]","2008-03-27"
"0710.2995","Olivier Bernardi","Olivier Bernardi (LM-Orsay), Marc Noy (UPC), Dominic Welsh","On the growth rate of minor-closed classes of graphs",,,,,"math.CO",,"  A minor-closed class of graphs is a set of labelled graphs which is closed
under isomorphism and under taking minors. For a minor-closed class $C$, we let
$c_n$ be the number of graphs in $C$ which have $n$ vertices. A recent result
of Norine et al. shows that for all minor-closed class $C$, there is a constant
$r$ such that $c_n < r^n n!$. Our main results show that the growth rate of
$c_n$ is far from arbitrary. For example, no minor-closed class $C$ has $c_n=
r^{n+o(n)} n!$ with $0 < r < 1$ or $1 < r < \xi \approx 1.76$.
","[{""version"":""v1"",""created"":""Tue, 16 Oct 2007 09:39:11 GMT""}]","2007-10-17"
"0710.2996","Daniel Ballester","Yu. V. Arkhipov, A. Askaruly, D. Ballester, A. E. Davletov, G. M.
  Meirkanova, I. M. Tkachenko","Collective and static properties of model two-component plasmas","25 pages, 6 figures, 5 tables. Published in Physical Review E
  http://link.aps.org/abstract/PRE/v76/e026403","Phys. Rev. E 76, 026403 (2007)","10.1103/PhysRevE.76.026403",,"physics.plasm-ph",,"  Classical MD data on the charge-charge dynamic structure factor of
two-component plasmas (TCP) modeled in Phys. Rev. A 23, 2041 (1981) are
analyzed using the sum rules and other exact relations. The convergent power
moments of the imaginary part of the model system dielectric function are
expressed in terms of its partial static structure factors, which are computed
by the method of hypernetted chains using the Deutsch effective potential.
High-frequency asymptotic behavior of the dielectric function is specified to
include the effects of inverse bremsstrahlung. The agreement with the MD data
is improved, and important statistical characteristics of the model TCP, such
as the probability to find both electron and ion at one point, are determined.
","[{""version"":""v1"",""created"":""Tue, 16 Oct 2007 09:40:08 GMT""}]","2007-10-17"
"0710.2997","Simone Recchi","S. Recchi (1, 2), G. Hensler (1) ((1) Institute of Astronomy, Vienna
  University, (2) INAF - Trieste Observatory)","The effect of clouds in a galactic wind on the evolution of gas-rich
  dwarf galaxies","13 pages, 11 figures, A&A accepted",,"10.1051/0004-6361:20078211",,"astro-ph",,"  (Abridged)
  We study the effects of interstellar clouds on the dynamical and chemical
evolution of gas-rich dwarf galaxies. In particular, we focus on two model
galaxies similar to IZw18 and NGC1569 in comparison to models in which a smooth
initial distribution of gas is assumed. We use a 2-D hydrodynamical code
coupled with a series of routines able to trace the chemical products of SNeII,
SNeIa and intermediate-mass stars. Clouds are simulated by adding overdense
regions in the computational grid, whose locations are chosen randomly and
whose density profiles match observed ones. The clouds are inherently
dynamically coupled to the diffuse gas, and they experience heat conduction
from a hot surrounding gas. Due to dynamical processes and thermal evaporation,
the clouds survive only a few tens of Myr. Due to the additional cooling agent,
the internal energy of cloudy models is typically reduced by 20 - 40% compared
with models of diffuse gas alone. The clouds delay the development of
large-scale outflows by mass loading, therefore helping to retain a larger
amount of gas inside the galaxy. However, their bullet effect can pierce the
expanding supershell and create holes through which the superbubble can vent
freshly produced metals. Moreover, assuming a pristine chemical composition for
the clouds, their interaction with the superbubble dilutes the gas, reducing
the metallicity. The resulting final metallicity is therefore generally lower
(by ~ 0.2 - 0.4 dex) than the one attained by diffuse models.
","[{""version"":""v1"",""created"":""Tue, 16 Oct 2007 09:42:57 GMT""}]","2009-11-13"
"0710.2998","Mark Holmes","Mark Holmes, Edwin Perkins","Weak convergence of measure-valued processes and $r$-point functions","Published in at http://dx.doi.org/10.1214/009117906000001088 the
  Annals of Probability (http://www.imstat.org/aop/) by the Institute of
  Mathematical Statistics (http://www.imstat.org)","Annals of Probability 2007, Vol. 35, No. 5, 1769-1782","10.1214/009117906000001088","IMS-AOP-AOP305","math.PR",,"  We prove a sufficient set of conditions for a sequence of finite measures on
the space of cadlag measure-valued paths to converge to the canonical measure
of super-Brownian motion in the sense of convergence of finite-dimensional
distributions. The conditions are convergence of the Fourier transform of the
$r$-point functions and perhaps convergence of the ``survival probabilities.''
These conditions have recently been shown to hold for a variety of statistical
mechanical models, including critical oriented percolation, the critical
contact process and lattice trees at criticality, all above their respective
critical dimensions.
","[{""version"":""v1"",""created"":""Tue, 16 Oct 2007 09:53:58 GMT""}]","2011-11-10"
"0710.2999","Krzysztof Pachucki","Krzysztof Pachucki and Jacek Komasa","Nonadiabatic corrections to the wave function and energy","8 pages, to be published in J. Chem. Phys",,"10.1063/1.2952517",,"physics.chem-ph physics.gen-ph","http://arxiv.org/licenses/nonexclusive-distrib/1.0/","  Nonadiabatic corrections in molecules composed of a few atoms are considered.
It is demonstrated that a systematic perturbative expansion around the
adiabatic solution is possible, with the expansion parameter being the
electron-nucleus mass ratio to the power 3/4. Closed form formulae for the
leading corrections to the wave function and to the energy are derived. Their
applicability is demonstrated by a comparison of numerical results for the
hydrogen molecule with the former nonadiabatic calculations and the
experimental values. Good agreement with the recent experiment is achieved for
the ground state dissociation energy of both H$_2$ and D$_2$.
","[{""version"":""v1"",""created"":""Tue, 16 Oct 2007 09:54:21 GMT""},{""version"":""v2"",""created"":""Mon, 14 Jan 2008 12:18:25 GMT""},{""version"":""v3"",""created"":""Thu, 17 Apr 2008 13:23:32 GMT""},{""version"":""v4"",""created"":""Fri, 30 May 2008 08:38:18 GMT""},{""version"":""v5"",""created"":""Wed, 16 Jul 2008 09:34:52 GMT""}]","2009-11-13"
"0710.3000","Debashis Gangopadhyay","Debashis Gangopadhyay, R.Bhattacharyya and L. P. Singh","Spacetime Dependent Lagrangians and Electrogravity Duality","4 pages, latex","Grav.Cosmol.13:285-289,2007",,,"gr-qc astro-ph hep-th",,"  We apply the spacetime dependent lagrangian formalism [1] to the action in
general relativity. We obtain a Barriola-Vilenkin type monopole solution by
exploiting theelectrogravity duality of the vacuum Einstein equations and using
a modified definition of empty space. An {\it upper bound} is obtained on the
monopole mass ${\tt M}$, ${\tt M}\leq e^{(1-\alpha)/\alpha}/(1-\alpha)^{2}{\tt
G}$ where $\alpha = 2k $ is the global monopole charge.
  Keywords: global monopole, electrogravity duality, holographic principle.
  PACS: 11.15.-q, 11.27.+d, 14.80.Hv, 04.
","[{""version"":""v1"",""created"":""Tue, 16 Oct 2007 11:37:42 GMT""}]","2008-11-26"
"0710.3001","Vilmos Komornik","Claudio Baiocchi, Vilmos Komornik","Greedy and quasi-greedy expansions in non-integer bases","10 pages",,,,"math.NT math.GM",,"  We generalize several theorems of R\'enyi, Parry, Dar\'oczy and K\'atai by
characterizing the greedy and quasi-greedy expansions in non-integer bases.
","[{""version"":""v1"",""created"":""Tue, 16 Oct 2007 10:13:43 GMT""}]","2007-10-17"
