"0710.2907","Oskar Vafek","Oskar Vafek and Matthew J. Case","Renormalization group approach to 2D Coulomb interacting Dirac fermions
  with random gauge potential","4 pages, 4 figures","Phys. Rev. B 77, 033410 (2008)","10.1103/PhysRevB.77.033410",,"cond-mat.mes-hall cond-mat.dis-nn",,"  We argue that massless Dirac particles in two spatial dimensions with $1/r$
Coulomb repulsion and quenched random gauge field are described by a manifold
of fixed points which can be accessed perturbatively in disorder and
interaction strength, thereby confirming and extending the results of
arXiv:0707.4171. At small interaction and small randomness, there is an
infra-red stable fixed curve which merges with the strongly interacting
infra-red unstable line at a critical endpoint, along which the dynamical
critical exponent $z=1$.
","[{""version"":""v1"",""created"":""Mon, 15 Oct 2007 20:21:21 GMT""}]","2008-02-01"
"0710.2909","Forrest Bradbury","G. Sabouret, F. R. Bradbury, S. Shankar, and S. A. Lyon","Signal and Charge Transfer Efficiency of Few Electrons Clocked on
  Microscopic Superfluid Helium Channels","13 pages including 3 figures",,"10.1063/1.2884693",,"cond-mat.other",,"  Electrons floating on the surface of liquid helium are possible spin-qubits
for quantum information processing. Varying electric potentials are not
expected to modify spin states, which allows their transport on helium using a
charge-coupled device (CCD)-like array of underlying gates. This approach
depends upon efficient inter-gate transfer of individual electrons.
Measurements are presented here of the charge transfer efficiency (CTE) of few
electrons clocked back and forth above a short microscopic CCD-like structure.
A charge transfer efficiency of 0.99999992 is obtained for a clocking frequency
of 800 kHz.
","[{""version"":""v1"",""created"":""Mon, 15 Oct 2007 20:27:06 GMT""}]","2009-11-13"
"0710.2910","Kamenev Alex","M. Khodas, A. Kamenev, and L. I. Glazman","Generating dark solitons by single photons","4 pages, 3 figures",,,,"cond-mat.other cond-mat.stat-mech",,"  We show that dark solitons in 1D bose systems may be excited by resonant
absorption of single quanta of an external ac field. The energy of the quantum
$\hbar\omega$ should be slightly blue-detuned from the energy of a soliton with
momentum $\hbar q$, where $q$ is the external field wavenumber $q$. We
calculate the absorption cross-section and show that it has power-law
dependence on the frequency detuning. This reflects the quantum nature of the
absorption process and the orthogonality catastrophe phenomenon associated with
it.
","[{""version"":""v1"",""created"":""Mon, 15 Oct 2007 20:46:33 GMT""}]","2007-10-17"
"0710.2911","Craig J. Sutton","Carolyn S. Gordon, Dorothee Schueth and Craig J. Sutton","Spectral isolation of bi-invariant metrics on compact Lie groups","10 pages, new title, revised abstract and introduction, minor typos
  corrected, to appear in Ann. Inst. Fourier (Grenoble)","Ann. Inst. Fourier 60 (2010), no. 5, 1617-1628",,,"math.DG","http://arxiv.org/licenses/nonexclusive-distrib/1.0/","  We show that a bi-invariant metric on a compact connected Lie group $G$ is
spectrally isolated within the class of left-invariant metrics. In fact, we
prove that given a bi-invariant metric $g_0$ on $G$ there is a positive integer
$N$ such that, within a neighborhood of $g_0$ in the class of left-invariant
metrics of at most the same volume, $g_0$ is uniquely determined by the first
$N$ distinct non-zero eigenvalues of its Laplacian (ignoring multiplicities).
In the case where $G$ is simple, $N$ can be chosen to be two.
","[{""version"":""v1"",""created"":""Mon, 15 Oct 2007 20:59:48 GMT""},{""version"":""v2"",""created"":""Wed, 7 Nov 2007 21:32:42 GMT""},{""version"":""v3"",""created"":""Mon, 28 Jun 2010 19:34:33 GMT""}]","2011-08-29"
"0710.2912","Adom Giffin","Adom Giffin","Updating Probabilities: An Econometric Example","Presented at the 3rd Econophysics Colloquium, Ancona, Italy, Sept
  27-29, 2007. 12 pages, 1 figure",,,,"stat.ME stat.CO",,"  We demonstrate how information in the form of observable data and moment
constraints are introduced into the method of Maximum relative Entropy (ME). A
general example of updating with data and moments is shown. A specific
econometric example is solved in detail which can then be used as a template
for real world problems. A numerical example is compared to a large deviation
solution which illustrates some of the advantages of the ME method.
","[{""version"":""v1"",""created"":""Mon, 15 Oct 2007 20:59:55 GMT""}]","2007-10-17"
"0710.2913","Holger Brenner","Holger Brenner, Paul Monsky","Tight closure does not commute with localization","final version",,,,"math.AC math.AG","http://arxiv.org/licenses/nonexclusive-distrib/1.0/","  We give an example showing that tight closure does not commute with
localization.
","[{""version"":""v1"",""created"":""Mon, 15 Oct 2007 21:00:41 GMT""},{""version"":""v2"",""created"":""Mon, 29 Oct 2007 11:14:48 GMT""},{""version"":""v3"",""created"":""Thu, 28 May 2009 13:34:32 GMT""}]","2009-05-28"
"0710.2914","Andrew John Daley","A. J. Daley, P. Zoller, and B. Trauzettel","Andreev-like reflections with cold atoms","5 pages, 4 figures, RevTeX 4","Phys. Rev. Lett. 100, 110404 (2008)","10.1103/PhysRevLett.100.110404",,"cond-mat.other",,"  We propose a setup in which Andreev-like reflections predicted for 1D
transport systems could be observed time-dependently using cold atoms in a 1D
optical lattice. Using time-dependent Density Matrix Renormalisation Group
methods we analyse the wavepacket dynamics as a density excitation propagates
across a boundary in the interaction strength. These phenomena exhibit good
correspondence with predictions from Luttinger liquid models and could be
observed in current experiments in the context of the Bose-Hubbard model.
","[{""version"":""v1"",""created"":""Mon, 15 Oct 2007 21:00:59 GMT""}]","2008-08-29"
"0710.2915","Lior M. Burko","Carl J. Blaksley and Lior M. Burko","The late-time tails in the Reissner-Nordstr\""{o}m spacetime revisited","11 pages, 13 figues, 1 table. Submitted to Phys. Rev. D","Phys.Rev.D76:104035,2007","10.1103/PhysRevD.76.104035",,"gr-qc",,"  We propose that the late-time tail problem in the Reissner-Nordstr\""{o}m (RN)
spacetime is dual to a tail problem in the Schwarzschild spacetime with a
different initial data set: at a fixed observation point the asymptotic decay
rate of the fields are equal. This duality is used to find the decay rate for
tails in RN. This decay rate is exactly as in Schwarzschild, including the case
of the extremely-charged RN spacetime (ERN). The only case where any deviation
from the Schwarzschild decay rate is found is the case of the tails along the
event horizon of an ERN spacetime, where the decay rate is the same as at
future null infinity. As observed at a fixed location, the decay rate in ERN is
the same as in Schwarzschild. We verify these expectations with numerical
simulations.
","[{""version"":""v1"",""created"":""Mon, 15 Oct 2007 21:11:54 GMT""}]","2014-01-14"
"0710.2916","Kenfack Anatole","Anatole Kenfack, Jan M. Rost, and Frank Grossmann","Dissociation and ionization of small molecules steered by external noise","13 pages, 6 figures",,"10.1088/1367-2630/10/1/013020",,"quant-ph",,"  We show that ionization and dissociation can be influenced separately in a
molecule with appropriate external noise. Specifically we investigate the
hydrogen molecular ion under a stochastic force quantum mechanically beyond the
Born-Oppenheimer approximation. We find that up to 30% of dissociation without
ionization can be achieved by suitably tuning the forcing parameters.
","[{""version"":""v1"",""created"":""Mon, 15 Oct 2007 21:15:26 GMT""}]","2009-11-13"
"0710.2917","Markus Michael Muller","Manfred Lindner and Markus Michael Muller (Heidelberg, Max Planck
  Inst.)","Comparison of Boltzmann Kinetics with Quantum Dynamics for a Chiral
  Yukawa Model Far From Equilibrium","17 pages, 8 figures, REVTeX 4","Phys.Rev.D77:025027,2008","10.1103/PhysRevD.77.025027",,"hep-ph",,"  Boltzmann equations are often used to describe the non-equilibrium
time-evolution of many-body systems in particle physics. Prominent examples are
the computation of the baryon asymmetry of the universe and the evolution of
the quark-gluon plasma after a relativistic heavy ion collision. However,
Boltzmann equations are only a classical approximation of the quantum
thermalization process, which is described by so-called Kadanoff-Baym
equations. This raises the question how reliable Boltzmann equations are as
approximations to the complete Kadanoff-Baym equations. Therefore, we present
in this article a detailed comparison of Boltzmann and Kadanoff-Baym equations
in the framework of a chirally invariant Yukawa-type quantum field theory
including fermions and scalars. The obtained numerical results reveal
significant differences between both types of equations. Apart from
quantitative differences, on a qualitative level the late-time universality
respected by Kadanoff-Baym equations is severely restricted in the case of
Boltzmann equations. Furthermore, Kadanoff-Baym equations strongly separate the
time scales between kinetic and chemical equilibration. In contrast to this
standard Boltzmann equations cannot describe the process of quantum-chemical
equilibration, and consequently also cannot feature the above separation of
time scales.
","[{""version"":""v1"",""created"":""Tue, 16 Oct 2007 13:15:19 GMT""}]","2008-11-26"
"0710.2918","Jonathan Brown","Jonathan Brown","Twisted Yangians and finite W-algebras","Final version to appear in Transformation Groups",,,,"math.QA math.RA math.RT","http://arxiv.org/licenses/nonexclusive-distrib/1.0/","  We construct an explicit set of generators for the finite W-algebras
associated to nilpotent matrices in the symplectic or orthogonal Lie algebras
whose Jordan blocks are all of the same size. We use these generators to show
that such finite W-algebras are quotients of twisted Yangians.
","[{""version"":""v1"",""created"":""Mon, 15 Oct 2007 21:18:51 GMT""},{""version"":""v2"",""created"":""Mon, 8 Sep 2008 22:54:06 GMT""}]","2008-09-09"
"0710.2919","Tomomi Ishikawa","Tomomi Ishikawa, Tatsuo Azeyanagi, Masanori Hanada and Tomoyoshi
  Hirata","Phase structure of twisted Eguchi-Kawai model","7 pages, 4 figures, talk presented at the XXV International Symposium
  on Lattice Field Theory, July 30 - August 4, 2007, Regensburg, Germany","PoSLAT2007:054,2007",,"RBRC-697, RIKEN-TH-119","hep-lat hep-th",,"  We study the phase structure of the four-dimensional twisted Eguchi-Kawai
model using numerical simulations. This model is an effective tool for studying
SU(N) gauge theory in the large-N limit and provides a nonperturbative
formulation of the gauge theory on noncommutative spaces. Recently it was found
that its Z_N^4 symmetry, which is crucial for the validity of this model, can
break spontaneously in the intermediate coupling region. We investigate in
detail the symmetry breaking point from the weak coupling side. Our simulation
results show that the continuum limit of this model cannot be taken.
","[{""version"":""v1"",""created"":""Mon, 15 Oct 2007 21:19:19 GMT""}]","2008-11-26"
"0710.2920","Paul Michalski","P. J. Michalski and E. J. Mele","Continuum theory for the piezoelectric response of chiral nanotubes
  under uniaxial and torsional stresses","8 pages, 4 figures. Submitted to Physical Review B",,"10.1103/PhysRevB.76.205419",,"cond-mat.mtrl-sci cond-mat.mes-hall",,"  We develop and solve a continuum theory for the piezoelectric response of
nanotubes under applied uniaxial and torsional stresses. We find that the
piezoelectric response is controlled by the chiral angle, the aspect ratio, and
two dimensionless parameters specifying the ratio of the strengths of the
electrostatic and elastic energies. The model is solved in two limiting cases
and the solutions are discussed. These systems are found to have several
unexpected physical effects not seen in conventional bulk systems, including a
strong stretch-twist coupling and the development of a significant bound charge
density in addition to a surface charge density. The model is applied to
estimate the piezoelectric response of a boron-nitride nanotube under uniform
tensile stress.
","[{""version"":""v1"",""created"":""Mon, 15 Oct 2007 21:36:52 GMT""}]","2009-11-13"
"0710.2921","Yuri Shtemler","Yuri M. Shtemler, Isaac R. Shreiber, Alex Britan","Shock-Induced Flows through Packed Beds: Transient Regimes",,"Acta Acustica United with Acustica, Vol.92 (2006) 612-617",,,"physics.class-ph physics.gen-ph",,"  The early stage of the transient regimes in the shock-induced flows within
solid-packed beds are investigated in the linear longwave and high-frequency
approximation. The transient resistance law is refined as the Duhameltime
integral that follows from the general concept of dynamic tortuosity and
compressibility of the packed beds. A closed-form solution is expected to
describe accurately the early stage of the transient regime flow and is in
qualitative agreement with available experimental data.
","[{""version"":""v1"",""created"":""Mon, 15 Oct 2007 21:48:57 GMT""}]","2007-10-17"
"0710.2922","Sun Fangwen","F. W. Sun, B. H. Liu, Y. X. Gong, Y. F. Huang, Z.Y. Ou, G. C. Guo","Experimental demonstration of phase measurement precision beating
  standard quantum limit by projection measurement","5 figures","EPL, 82 (2008) 24001","10.1209/0295-5075/82/24001",,"quant-ph",,"  We propose and demonstrate experimentally a projection scheme to measure the
quantum phase with a precision beating the standard quantum limit. The initial
input state is a twin Fock state $|N,N>$ proposed by Holland and Burnett [Phys.
Rev. Lett. {\bf 71}, 1355 (1993)] but the phase information is extracted by a
quantum state projection measurement. The phase precision is about $1.4/N$ for
large photon number $N$, which approaches the Heisenberg limit of 1/N.
Experimentally, we employ a four-photon state from type-II parametric
down-conversion and achieve a phase uncertainty of $0.291\pm 0.001$ beating the
standard quantum limit of $1/\sqrt{N} = 1/2$ for four photons.
","[{""version"":""v1"",""created"":""Mon, 15 Oct 2007 21:55:02 GMT""}]","2008-03-27"
"0710.2924","Harald W. Griesshammer","Harald W. Griesshammer (George Washington U.)","Neutron Polarisabilities from Deuteron Compton Scattering in \chiEFT","10 pages LaTeX2e, including 7 figures in 16 .eps files embedded with
  includegraphicx. Uses MENU07macros (provided). Invited contribution to the
  11th International Conference on Neson-Nucleon Physics and the Structure of
  the Nucleon MENU 2007, Juelich (Germany), 10th -- 14th September 2007. To be
  published in the electronic proceedings","ECONFC070910:141,2007",,,"nucl-th",,"  Chiral Effective Field Theory is for photon energies up to 200 MeV the tool
to accurately determine the polarisabilities of the neutron from deuteron
Compton scattering. A multipole analysis reveals that dispersive effects from
an explicit Delta(1232) prove in particular indispensable to understand the
data at 95 MeV measured at SAL. Simple power-counting arguments derived from
nuclear phenomenology lead to the correct Thomson limit and gauge invariance.
At next-to-leading order, the static scalar dipole polarisabilities are
extracted as identical for proton and neutron within the error-bar of available
data: \alpha^n=11.6\pm1.5_stat\pm0.6_Baldin,
\beta^n=3.6\mp1.5_stat\pm0.6_Baldin for the neutron, in units of 10^-4 fm^3,
compared to \alpha^p=11.0\pm1.4_stat\pm0.4_Baldin,
\beta}^p=2.8\mp1.4_stat\pm0.4_Baldin for the proton in the same framework. New
experiments e.g. at MAXlab (Lund) will improve the statistical error-bar.
","[{""version"":""v1"",""created"":""Mon, 15 Oct 2007 22:28:07 GMT""}]","2008-11-26"
"0710.2925","Satoshi Nakamura","Satoshi. X. Nakamura (TRIUMF)","Bridging over p-wave pi-production and weak processes in few-nucleon
  systems with chiral perturbation theory","5 pages, 2 figures, Contribution to proceedings of MENU2007 (11th
  International Conference on Meson-Nucleon Physics and the Structure of the
  Nucleon), September 10-14, 2007, IKP, Forschungzentrum Juelich, Germany","ECONFC070910:264,2007",,"TRI-PP-07-27","nucl-th hep-ph",,"  We focus on a powerful aspect of chiral perturbation theory (chi PT) which
provides us with a ``bridge'' over different reactions. For this purpose, we
study a contact operator which contributes p-wave pi-production and several
weak processes. We fix the unknown coupling of the contact operator using a
matrix element of a low-energy weak process (pp\to de^+\nu_e), and then
calculate the partial wave amplitude (a_0) for the p-wave pi-production (pp\to
pn\pi^+). We find that the chiral operator including the contact term does not
reproduce a_0 extracted from data, showing that the bridging over reactions
with significantly different kinematics is not necessarily successful. We argue
the importance of a specific higher order calculation. In order to gain an
insight into a higher order calculation, we consider a higher order counter
term, and find that the energy dependence of a_0 is then consistent with the
data.
","[{""version"":""v1"",""created"":""Mon, 15 Oct 2007 22:25:50 GMT""}]","2008-11-26"
"0710.2926","Hisakazu Minakata","Hisakazu Minakata","Long Baseline Neutrino Experiments with Two-Detector Setup","6 pages, 3 figures, Invited talk at Fourth International Conference
  on Flavor Physics (ICFP2007), Beijing, China, September 24-28, 2007","Int.J.Mod.Phys.A23:3388-3394,2008","10.1142/S0217751X08042171",,"hep-ph hep-ex",,"  I discuss why and how powerful is the two-detector setting in neutrino
oscillation experiments. I cover three concrete examples: (1) reactor
\theta_{13} experiments, (2) T2KK, Tokai-to-Kamioka-Korea two-detector complex
for measuring CP violation, determining the neutrino mass hierarchy, and
resolving the eight-fold parameter degeneracy, (3) two-detector setting in a
neutrino factory at baselines 3000 km and 7000 km for detecting effects of
non-standard interactions (NSI) of neutrinos.
","[{""version"":""v1"",""created"":""Mon, 15 Oct 2007 22:31:53 GMT""}]","2008-11-26"
"0710.2927","Satoshi Nakamura","Satoshi X. Nakamura (TRIUMF), Anders Gardestig (University of South
  Carolina)","Renormalization group analysis of the chiral pion production operator
  for NN\to d\pi","5 pages, 2 figures, Contribution to proceedings of MENU2007 (11th
  International Conference on Meson-Nucleon Physics and the Structure of the
  Nucleon), September 10-14, 2007, IKP, Forschungzentrum Juelich, Germany","ECONFC070910:265,2007",,"TRI-PP-07-28","nucl-th hep-ph",,"  We are interested in the consistency between the cutoff, chiral symmetry, and
the power counting. For this purpose, we apply the Wilsonian renormalization
group (RG) to an operator and then decrease the Wilsonian cutoff. As an
example, we study the s-wave pion production operator for NN\to d\pi, derived
in chiral perturbation theory. We find that the renormalized part of the RG
effective operator is accurately absorbed by chiral counter terms of higher
order with natural coefficients. Thus, the use of the (sharp) cutoff
regularization does not require us to introduce chiral-symmetry-breaking
counter terms, at least in the case of the NN\to d\pi reaction.
","[{""version"":""v1"",""created"":""Mon, 15 Oct 2007 22:32:29 GMT""}]","2008-11-26"
"0710.2929","Sergiy Koshkin","Sergiy Koshkin","Quantum Barnes function as the partition function of the resolved
  conifold","47 pages, 7 figures","International Journal of Mathematics and Mathematical Sciences
  Volume 2008 (2008), Article ID 438648","10.1155/2008/438648",,"math.AG hep-th math.QA",,"  We suggest a new strategy for proving large $N$ duality by interpreting
Gromov-Witten, Donaldson-Thomas and Chern-Simons invariants of a Calabi-Yau
threefold as different characterizations of the same holomorphic function. For
the resolved conifold this function turns out to be the quantum Barnes
function, a natural $q$-deformation of the classical one that in its turn
generalizes Euler's gamma function. Our reasoning is based on a new formula for
this function that expresses it as a graded product of $q$-shifted
multifactorials.
","[{""version"":""v1"",""created"":""Mon, 15 Oct 2007 23:05:07 GMT""}]","2012-11-26"
"0710.2930","Adam Showman","Adam P. Showman, Kristen Menou, and James Y-K. Cho","Atmospheric Circulation of Hot Jupiters: A Review of Current
  Understanding","21 pages, 4 figures. To be published in proceedings of the Conference
  on Extreme Solar Systems held in Santorini, Greece, June 25-29 2007",,,,"astro-ph",,"  Hot Jupiters are new laboratories for the physics of giant planet
atmospheres. Subject to unusual forcing conditions, the circulation regime on
these planets may be unlike anything known in the Solar System. Characterizing
the atmospheric circulation of hot Jupiters is necessary for reliable
interpretation of the multifaceted data currently being collected on these
planets. We discuss several fundamental concepts of atmospheric dynamics that
are likely central to obtaining a solid understanding of these fascinating
atmospheres. A particular effort is made to compare the various modeling
approaches employed so far to address this challenging problem.
","[{""version"":""v1"",""created"":""Mon, 15 Oct 2007 23:40:01 GMT""}]","2007-10-17"
"0710.2931","Ram Seshadri","Daniel P. Shoemaker, Madeleine Grossman, Ram Seshadri","Exchange biasing of single-domain Ni nanoparticles spontaneously grown
  in an antiferromagnetic MnO matrix","6 pages PDFLaTeX with 9 figures","J. Phys.: Condens. Matter 20 (2008) 195219 (9pp)","10.1088/0953-8984/20/19/195219",,"cond-mat.mtrl-sci",,"  Exchange biased composites of ferromagnetic single-domain Ni nanoparticles
embedded within large grains of MnO have been prepared by reduction of
Ni$_x$Mn$_{1-x}$O$_4$ phases in flowing hydrogen. The Ni precipitates are 15-30
nm in extent, and the majority are completely encased within the MnO matrix.
The manner in which the Ni nanoparticles are spontaneously formed imparts a
high ferromagnetic- antiferromagnetic interface/volume ratio, which results in
substantial exchange bias effects. Exchange bias fields of up to 100 Oe are
observed, in cases where the starting Ni content $x$ in the precursor
Ni$_x$Mn$_{1-x}$O$_4$ phase is small. For particles of approximately the same
size, the exchange bias leads to significant hardening of the magnetization,
with the coercive field scaling nearly linearly with the exchange bias field.
","[{""version"":""v1"",""created"":""Mon, 15 Oct 2007 23:59:12 GMT""}]","2008-04-17"
"0710.2933","Arthur D. Yaghjian","Arthur D. Yaghjian and Stefano Maci","Alternative Derivation of Electromagnetic Cloaks and Concentrators","30 pages, 1 figure, Revised for New Journal of Physics","Published in New Journal of Physics, 10 (2008) 115022","10.1088/1367-2630/10/11/115022",,"physics.class-ph physics.optics","http://arxiv.org/licenses/nonexclusive-distrib/1.0/","  Beginning with a straightforward formulation of electromagnetic cloaking that
reduces to a boundary value problem involving a single Maxwell first-order
differential equation, explicit formulae for the relative
permittivity-permeability dyadic and fields of spherical and circular
cylindrical annular cloaks are derived in terms of general compressed radial
coordinate functions. The general formulation is based on the requirements that
the cloaking occurs for all possible incident fields and that the cloaks with
frequency w > 0 have continuous tangential E and H fields across their outer
surfaces, and zero normal D and B fields at their inner material surfaces. The
tangential-field boundary conditions at the outer surface of the cloak ensure
zero scattered fields, and the normal-field boundary conditions at the inner
surface of the cloak are compatible with zero total fields inside the interior
cavity of the cloak. For spherical cloaks, unlike cylindrical cloaks, these
boundary conditions lead to all the tangential components of the E and H fields
being continuously zero across their inner surfaces -- cylindrical cloaks
having delta functions in polarization densities at their inner surfaces. For
bodies with no interior free-space cavities, the formulation is used to derive
nonscattering spherical and cylindrical concentrators that magnify the incident
fields near their centers. For static fields (w = 0), the boundary value
formulation is appropriately modified to obtain a permeability dyadic that will
cloak magnetostatic fields. Causality conditions imply that, unlike
magnetostatic cloaking, electrostatic cloaking as well as low-frequency
cloaking for w > 0 is not realizable.
","[{""version"":""v1"",""created"":""Tue, 16 Oct 2007 00:05:41 GMT""},{""version"":""v2"",""created"":""Wed, 17 Oct 2007 18:47:29 GMT""},{""version"":""v3"",""created"":""Wed, 17 Oct 2007 21:30:09 GMT""},{""version"":""v4"",""created"":""Wed, 24 Oct 2007 16:29:34 GMT""},{""version"":""v5"",""created"":""Tue, 16 Sep 2008 01:45:43 GMT""}]","2009-01-28"
