"0710.3025","Virginie Simonet","Julien Robert (NEEL), Virginie Simonet (NEEL), Benjamin Canals (NEEL),
  Rafik Ballou (NEEL), Elsa Lhotel (NEEL), C\'eline Darie (NEEL), Pierre Bordet
  (NEEL), Bachir Ouladdiaf (ILL), Marc Johnson (ILL), Jacques Ollivier (ILL),
  Daniel Braithwaite (IMAPEC), Harison Rakoto (LNCMP), Sophie De Brion (LCMI)","Formation of collective spins in frustrated clusters","10 pages","Physical Review B 77 (2008) 054421","10.1103/PhysRevB.77.054421",,"cond-mat.str-el","http://arxiv.org/licenses/nonexclusive-distrib/1.0/","  Using magnetization, specific heat and neutron scattering measurements, as
well as exact calculations on realistic models, the magnetic properties of the
\lacuvo compound are characterized on a wide temperature range. At high
temperature, this oxide is well described by strongly correlated atomic $S$=1/2
spins while decreasing the temperature it switches to a set of weakly
interacting and randomly distributed entangled pseudo spins $\tilde S=1/2$ and
$\tilde S=0$. These pseudo-spins are built over frustrated clusters, similar to
the kagom\'e building block, at the vertices of a triangular superlattice, the
geometrical frustration intervening then at different scales.
","[{""version"":""v1"",""created"":""Tue, 16 Oct 2007 11:52:52 GMT""},{""version"":""v2"",""created"":""Wed, 13 Aug 2008 15:23:04 GMT""}]","2008-08-13"
"0710.3026","Takashi Inoue","Takashi Inoue","Pion-nucleon P_33 and P_11 scatterings in the Lippmann-Schwinger
  approach","4 pages, 3 figures, to appear in the proceedings of the 11th
  International Conference on Meson-Nucleon Physics and the Structure of the
  Nucleon, Sept. 10th-14th 2007 (MENU 2007), Juelich, Germany","ECONFC070910:240,2007",,,"nucl-th",,"  We study the pion-nucleon P_33 and P_11 scattering, where the Delta and the
Roper resonances are seen, respectively. We use the Lippmann-Schwinger equation
extended to couple to a one-body state, and investigate nature of these
resonances by taking and omitting a one-baryon state into account. We see
validity and puzzle of the standard quark model interpretation, for the Delta
and the Roper resonances, respectively.
","[{""version"":""v1"",""created"":""Tue, 16 Oct 2007 11:53:20 GMT""}]","2008-11-26"
"0710.3027","Igor Bjelakovic","Igor Bjelakovic and Holger Boche","Classical Capacities of Averaged and Compound Quantum Channels","15 pages, no figures. Typos corrected. Remarks and suggestions of the
  referees incorporated. Submitted to IEEE Transactions on Information Theory",,,,"quant-ph cs.IT math-ph math.IT math.MP","http://arxiv.org/licenses/nonexclusive-distrib/1.0/","  We determine the capacity of compound classical-quantum channels. As a
consequence we obtain the capacity formula for the averaged classical-quantum
channels. The capacity result for compound channels demonstrates, as in the
classical setting, the existence of reliable universal classical-quantum codes
in scenarios where the only a priori information about the channel used for the
transmission of information is that it belongs to a given set of memoryless
classical-quantum channels. Our approach is based on the universal classical
approximation of the quantum relative entropy which in turn relies on the
universal hypothesis testing results.
","[{""version"":""v1"",""created"":""Tue, 16 Oct 2007 11:56:29 GMT""},{""version"":""v2"",""created"":""Mon, 16 Feb 2009 11:35:26 GMT""}]","2009-02-16"
"0710.3028","Nicolai Vorobjov","Andrei Gabrielov, Nicolai Vorobjov","Approximation of definable sets by compact families, and upper bounds on
  homotopy and homology","20 pages, 2 figures",,"10.1112/jlms/jdp006",,"math.AG math.LO",,"  We prove new upper bounds on homotopy and homology groups of o-minimal sets
in terms of their approximations by compact o-minimal sets. In particular, we
improve the known upper bounds on Betti numbers of semialgebraic sets defined
by quantifier-free formulae, and obtain for the first time a singly exponential
bound on Betti numbers of sub-Pfaffian sets.
","[{""version"":""v1"",""created"":""Tue, 16 Oct 2007 12:01:22 GMT""}]","2014-02-26"
"0710.3029","Ziv Rader","Ziv Rader and Moshe Schwartz","Glassiness in Simple Liquids","8 pages, 4 figures",,"10.1016/j.physa.2007.11.032",,"cond-mat.stat-mech",,"  In previous work the parameter of glassiness was introduced to distinguish
between a liquid and a glass, using a formal analogy with the quantum Bose
system. The glassiness is defined in such a way that it is unity in a frozen
system and less than one in a liquid. In the present letter we revise first the
results obtained for the glassiness in a hard sphere liquid as a function of
the density. Then we investigate the influence of an attractive potential by
obtaining the glassiness as a function of the density, temperature and the
attractive tail when a square well potential is added to the hard core.
","[{""version"":""v1"",""created"":""Tue, 16 Oct 2007 12:07:12 GMT""}]","2009-11-13"
"0710.3030","Paolo Soleri","Paolo Soleri (Univ. Amsterdam), Tomaso Belloni (INAF-OABrera),
  Piergiorgio Casella (Univ. Amsterdam)","A transient low-frequency QPO from the black hole binary GRS 1915+105","13 pages, 9 figures, accepted for publication on MNRAS",,"10.1111/j.1365-2966.2007.12596.x",,"astro-ph",,"  We present the results of the timing analysis of five Rossi X-ray Timing
Explorer observations of the Black Hole Candidate GRS 1915+105 between 1996
September and 1997 December. The aim was to investigate the possible presence
of a type-B quasi-periodic oscillation (QPO). Since in other systems this QPO
is found to appear during spectral transitions from Hard to Soft states, we
analyzed observations characterized by a fast and strong variability, in order
to have a large number of transitions. In GRS 1915+105, transitions occur on
very short time scales (~ sec): to single them out we averaged Power Density
Spectra following the regular path covered by the source on a 3D
Hardness-Hardness-Intensity Diagram. We identified both the type-C and the
type-B quasi-periodic oscillations (QPOs): this is the first detection of a
type-B QPO in GRS 1915+105. As the spectral transitions have been associated to
the emission and collimation of relativistic radio-jets, their presence in the
prototypical galactic jet source strengthens this connection.
","[{""version"":""v1"",""created"":""Tue, 16 Oct 2007 12:10:30 GMT""}]","2009-11-13"
"0710.3031","Ricardo Gallego","Ricardo Gallego Torrome and Fernando Etayo","On a rigidity condition for Berwald Spaces","19 pages; version acepted for publication in RACSAM",,"10.5052/RACSAM.2010.07",,"math.DG","http://arxiv.org/licenses/nonexclusive-distrib/1.0/","  We show that which that for a Berwald structure, any Riemannian structure
that is preserved by the Berwald connection leaves the indicatrix invariant
under horizontal parallel transport. We also obtain the converse result: if
$({\bf M},F)$ is a Finsler structure such that there exists a Riemannian
structure that leaves invariant the indicatrix under parallel transport of the
associated Levi-Civita connection, then the structure $({\bf M},F)$ is Berwald.
As application, a necessary condition for pure Landsberg spaces is formulated.
Using this criterion we provide an strategy to solve the existence or not of
pure Landsberg surfaces
","[{""version"":""v1"",""created"":""Tue, 16 Oct 2007 12:11:26 GMT""},{""version"":""v2"",""created"":""Wed, 1 Jul 2009 09:09:12 GMT""}]","2020-03-13"
"0710.3032","Timothy Gowers","W. T. Gowers","Hypergraph regularity and the multidimensional Szemer\'edi theorem","53 pages",,,,"math.CO",,"  We prove analogues for hypergraphs of Szemer\'edi's regularity lemma and the
associated counting lemma for graphs. As an application, we give the first
combinatorial proof of the multidimensional Szemer\'edi theorem of Furstenberg
and Katznelson, and the first proof that provides an explicit bound. Similar
results with the same consequences have been obtained independently by Nagle,
R\""odl, Schacht and Skokan.
","[{""version"":""v1"",""created"":""Tue, 16 Oct 2007 12:14:55 GMT""}]","2007-10-17"
"0710.3033","Eulogio Oset","E.Oset, M. Kaskulov, H. Nagahiro, E. Hernandez and S. Hirenzaki","Photoproduction of $\omega$ and $\omega$ in the Nuclear Medium","Talk at the MENU2007 Conference",,,"FTUV-07-1016, IFIC-07-1016","nucl-th",,"  We reanalyze data from ELSA on $\omega$ production in nuclei, from where
claims of a large shift of the mass were made earlier, which are tied to a
certain election of the background in nuclei, very different in shape to the
one on the proton. The reanalysis shows that the data demand a very large width
of the $\omega$ in the medium, with no need for a shift of the mass, for which
the experiment is quite insensitive. We study possible $\omega$ bound states in
the nucleus and find that, even assuming a small width, they could not be
observed with the present ELSA resolution. Finally we show that, due to the
interplay of background and $\omega$ signal, a two bump structure appears with
the ELSA set up for the $(\gamma,p)$ reaction that should not be misidentified
with a signal of a possible $\omega$ bound state in the nucleus.
","[{""version"":""v1"",""created"":""Tue, 16 Oct 2007 12:16:42 GMT""}]","2007-10-17"
"0710.3034","Rafael Roldan","R. Roldan, M.P. Lopez-Sancho and F. Guinea","Effect of electron-electron interaction on the Fermi surface topology of
  doped graphene","10 pages, 6 figures","Phys. Rev. B 77, 115410 (2008)","10.1103/PhysRevB.77.115410",,"cond-mat.str-el cond-mat.mes-hall",,"  The electron-electron interactions effects on the shape of the Fermi surface
of doped graphene are investigated. The actual discrete nature of the lattice
is fully taken into account. A $\pi$-band tight-binding model, with
nearest-neighbor hopping integrals, is considered. We calculate the self-energy
corrections at zero temperature. Long and short range Coulomb interactions are
included. The exchange self-energy corrections for graphene preserve the
trigonal warping of the Fermi surface topology, although rounding the
triangular shape. The band velocity is renormalized to higher value.
Corrections induced by a local Coulomb interaction, calculated by second order
perturbation theory, do deform anisotropically the Fermi surface shape. Results
are compared to experimental observations and to other theoretical results.
","[{""version"":""v1"",""created"":""Tue, 16 Oct 2007 12:23:09 GMT""},{""version"":""v2"",""created"":""Fri, 14 Mar 2008 09:39:40 GMT""}]","2008-03-14"
"0710.3036","Volker Kaibel","Volker Kaibel and Ruediger Stephan","On cardinality constrained cycle and path polytopes","24 pages",,,,"math.CO math.OC",,"  Given a directed graph D = (N, A) and a sequence of positive integers 1 <=
c_1 < c_2 < ... < c_m <= |N|, we consider those path and cycle polytopes that
are defined as the convex hulls of simple paths and cycles of D of cardinality
c_p for some p, respectively. We present integer characterizations of these
polytopes by facet defining linear inequalities for which the separation
problem can be solved in polynomial time. These inequalities can simply be
transformed into inequalities that characterize the integer points of the
undirected counterparts of cardinality constrained path and cycle polytopes.
Beyond we investigate some further inequalities, in particular inequalities
that are specific to odd/even paths and cycles.
","[{""version"":""v1"",""created"":""Tue, 16 Oct 2007 12:43:22 GMT""}]","2007-10-17"
"0710.3037","Kevin Luhman","K. L. Luhman (Penn State)","The Stellar Population of the Chamaeleon I Star-Forming Region",,"Astrophys.J.Suppl.173:104-136,2007","10.1086/520114",,"astro-ph",,"  I present a new census of the stellar population in the Chamaeleon I
star-forming region. Using optical and near-IR photometry and followup
spectroscopy, I have discovered 50 new members of Chamaeleon I, expanding the
census of known members to 226 objects. Fourteen of these new members have
spectral types later than M6, which doubles the number of known members that
are likely to be substellar. I have estimated extinctions, luminosities, and
effective temperatures for the known members, used these data to construct an
H-R diagram for the cluster, and inferred individual masses and ages with the
theoretical evolutionary models of Baraffe and Chabrier. The distribution of
isochronal ages indicates that star formation began 3-4 and 5-6 Myr ago in the
southern and northern subclusters, respectively, and has continued to the
present time at a declining rate. The IMF in Chamaeleon I reaches a maximum at
a mass of 0.1-0.15 M_sun, and thus closely resembles the IMFs in IC 348 and the
Orion Nebula Cluster. In logarithmic units where the Salpeter slope is 1.35,
the IMF is roughly flat in the substellar regime and shows no indication of
reaching a minimum down to a completeness limit of 0.01 M_sun. The low-mass
stars are more widely distributed than members at other masses in the northern
subcluster, but this is not the case in the southern subcluster. Meanwhile, the
brown dwarfs have the same spatial distribution as the stars out to a radius of
3 deg (8.5 pc) from the center of Chamaeleon I.
","[{""version"":""v1"",""created"":""Tue, 16 Oct 2007 12:44:04 GMT""}]","2008-11-26"
"0710.3038","Shao-Jing Dong","S. J. Dong and K. F. Liu","Finite ma Errors of the Overlap Fermion","7 pages, 3 figures Lattice 2007 Conference","PoSLAT2007:093,2007",,,"hep-lat",,"  In this talk, we shall assess the finite ma errors from the overlap fermion.
We shall present results on the speed of light from the dispersion relation and
hyperfine splitting between the vector and pseudoscalar mesons as a function to
ma to reveal the m\Lambda_{QCD}a^2 and m^2a^2 errors. We conclude from this
study that one should be limited to using ma less than 0.5 in order to keep the
systematic ma errors below a few percent level.
","[{""version"":""v1"",""created"":""Tue, 16 Oct 2007 12:45:52 GMT""}]","2009-04-14"
"0710.3039","Antonio Alfonso-Faus","Antonio Alfonso-Faus","The Speed of Light and the Hubble Parameter: The Mass-Boom Effect","15 pages, presented at the 9th Symposium on ""Frontiers of Fundamental
  Physics"", 7-9 Jan. 2008, University of Udine, Italy. Changed contents","AIP Conf.Proc.1018:86-93,2008; Astrophys.Space Sci.315:25-29,2008","10.1063/1.2947715 10.1007/s10509-008-9787-6",,"physics.gen-ph","http://arxiv.org/licenses/nonexclusive-distrib/1.0/","  We prove here that Newtons universal gravitation and momentum conservation
laws together reproduce Weinbergs relation. It is shown that the Hubble
parameter H must be built in this relation, or equivalently the age of the
Universe t. Using a wave-to-particle interaction technique we then prove that
the speed of light c decreases with cosmological time, and that c is
proportional to the Hubble parameter H. We see the expansion of the Universe as
a local effect due to the LAB value of the speed of light co taken as constant.
We present a generalized red shift law and find a predicted acceleration for
photons that agrees well with the result from Pioneer 10/11 anomalous
acceleration. We finally present a cosmological model coherent with the above
results that we call the Mass-Boom. It has a linear increase of mass m with
time as a result of the speed of light c linear decrease with time, and the
conservation of momentum mc. We obtain the baryonic mass parameter equal to the
curvature parameter, omega m = omega k, so that the model is of the type of the
Einstein static, closed, finite, spherical, unlimited, with zero cosmological
constant. This model is the cosmological view as seen by photons, neutrinos,
tachyons etc. in contrast with the local view, the LAB reference. Neither dark
matter nor dark energy is required by this model. With an initial constant
speed of light during a short time we get inflation (an exponential expansion).
This converts, during the inflation time, the Plancks fluctuation length of
10-33 cm to the present size of the Universe (about 1028 cm, constant from then
on). Thereafter the Mass-Boom takes care to bring the initial values of the
Universe (about 1015 gr) to the value at the present time of about 1055 gr.
","[{""version"":""v1"",""created"":""Tue, 16 Oct 2007 14:22:03 GMT""},{""version"":""v2"",""created"":""Sun, 20 Jan 2008 19:24:47 GMT""},{""version"":""v3"",""created"":""Fri, 21 Nov 2008 11:24:04 GMT""}]","2011-04-11"
"0710.3040","Christian Brouder","Christian Brouder and Michael Duetsch","Relating on-shell and off-shell formalism in perturbative quantum field
  theory","The case of gauge fields was added. 16 pages","J.Math.Phys.49:052303,2008","10.1063/1.2918137",,"hep-th",,"  In the on-shell formalism (mostly used in perturbative quantum field theory)
the entries of the time ordered product T are on-shell fields (i.e. the basic
fields satisfy the free field equations). With that, (multi)linearity of T is
incompatible with the Action Ward identity. This can be circumvented by using
the off-shell formalism in which the entries of T are off-shell fields. To
relate on- and off-shell formalism correctly, a map sigma from on-shell fields
to off-shell fields was introduced axiomatically by Duetsch and Fredenhagen. In
that paper it was shown that, in the case of one real scalar field in N=4
dimensional Minkowski space, these axioms have a unique solution. However, this
solution was given there only recursively. We solve this recurrence relation
and give a fully explicit expression for sigma in the cases of the scalar,
Dirac and gauge fields for arbitrary values of the dimension N.
","[{""version"":""v1"",""created"":""Tue, 16 Oct 2007 13:00:56 GMT""},{""version"":""v2"",""created"":""Fri, 22 Feb 2008 10:40:42 GMT""}]","2008-11-26"
"0710.3041","Tatsuya Yamasaki","Tatsuya Yamasaki and Thierry Foglizzo","Effect of Rotation on the Stability of a Stalled Cylindrical Shock and
  its Consequences for Core-Collapse Supernovae","ApJ in press",,"10.1086/587732",,"astro-ph",,"  A perturbative analysis is used to investigate the effect of rotation on the
instability of a steady accretion shock (SASI) in a simple toy-model, in view
of better understanding supernova explosions in which the collapsing core
contains angular momentum. A cylindrical geometry is chosen for the sake of
simplicity. Even when the centrifugal force is very small, rotation can have a
strong effect on the non axisymmetric modes of SASI by increasing the growth
rate of the spiral modes rotating in the same direction as the steady flow.
Counter-rotating spiral modes are significantly damped, while axisymmetric
modes are hardly affected by rotation. The growth rates of spiral modes have a
nearly linear dependence on the specific angular momentum of the flow. The
fundamental one-armed spiral mode (m=1) is favoured for small rotation rates,
whereas stronger rotation rates favour the mode m=2. A WKB analysis of higher
harmonics indicates that the efficiency of the advective-acoustic cycles
associated to spiral modes is strongly affected by rotation in the same manner
as low frequency modes, whereas the purely acoustic cycles are stable. These
results suggest that the linear phase of SASI in rotating core-collapse
supernovae naturally selects a spiral mode rotating in the same direction of
the flow, as observed in the 3D numerical simulations of Blondin & Mezzacappa
(2007). This emphasizes the need for a 3D approach of rotating core-collapse,
before conclusions on the explosion mechanisms and pulsar kicks can be drawn.
","[{""version"":""v1"",""created"":""Tue, 16 Oct 2007 13:01:33 GMT""},{""version"":""v2"",""created"":""Wed, 20 Feb 2008 15:32:35 GMT""}]","2009-11-13"
"0710.3042","Glennys R. Farrar","Andreas A. Berlind and Glennys R. Farrar","Large-Angular-Scale Clustering as a Clue to the Source of UHECRs","ICRC07",,,,"astro-ph",,"  We show that future Ultra-High Energy Cosmic Ray samples should be able to
distinguish whether the sources of UHECRs are hosted by galaxy clusters or
ordinary galaxies, or whether the sources are uncorrelated with the large-scale
structure of the universe. Moreover, this is true independently of arrival
direction uncertainty due to magnetic deflection or measurement error. The
reason for this is the simple property that the strength of large-scale
clustering for extragalactic sources depends on their mass, with more massive
objects, such as galaxy clusters, clustering more strongly than lower mass
objects, such as ordinary galaxies.
","[{""version"":""v1"",""created"":""Tue, 16 Oct 2007 13:02:51 GMT""}]","2007-10-17"
"0710.3043","Shahriar Salimi","S. Salimi","Quantum central limit theorem for continuous-time quantum walks on odd
  graphs in quantum probability theory","19 page, 1 figures","Int J Theor Phys (2008) 47: 3298--3309","10.1007/s10773-008-9765-3",,"quant-ph","http://arxiv.org/licenses/nonexclusive-distrib/1.0/","  The method of the quantum probability theory only requires simple structural
data of graph and allows us to avoid a heavy combinational argument often
necessary to obtain full description of spectrum of the adjacency matrix. In
the present paper, by using the idea of calculation of the probability
amplitudes for continuous-time quantum walk in terms of the quantum probability
theory, we investigate quantum central limit theorem for continuous-time
quantum walks on odd graphs.
","[{""version"":""v1"",""created"":""Tue, 16 Oct 2007 13:06:55 GMT""},{""version"":""v2"",""created"":""Tue, 5 Aug 2008 05:36:40 GMT""}]","2009-11-13"
"0710.3044","Volker Kaibel","Fabrizio Grandoni, Volker Kaibel, Gianpaolo Oriolo, and Martin
  Skutella","A Short Proof of the VPN Tree Routing Conjecture on Ring Networks","Accepted for publication in Oper. Res. Lett.; referee's comments
  incorporated",,,,"math.CO math.OC",,"  The VPN Tree Routing Conjecture states that there always exists an optimal
solution to the symmetric Virtual Private Network Design (sVPND) problem where
the paths between all terminals form a tree. Only recently, Hurkens, Keijsper,
and Stougie gave a proof of this conjecture for the special case of ring
networks. Their proof is based on a dual pair of linear programs and is
somewhat in- volved. We present a short proof of a slightly stronger conjecture
which might also turn out to be useful for proving the VPN Tree Routing
Conjecture for general networks.
","[{""version"":""v1"",""created"":""Tue, 16 Oct 2007 13:08:15 GMT""},{""version"":""v2"",""created"":""Fri, 26 Oct 2007 14:50:38 GMT""}]","2011-11-10"
"0710.3045","Woo-Ram Lee","W.-R. Lee, Jaeuk U. Kim and H.-S. Sim","Fano resonance in a two-level quantum dot side-coupled to leads","4 pages, 4 figures","Physical Review B 77, 033305 (2008)","10.1103/PhysRevB.77.033305",,"cond-mat.mes-hall cond-mat.str-el",,"  We theoretically study Fano resonance in a two-level quantum dot side-coupled
to two leads, which are connected by a direct channel. The resonance lineshape
is found to be deformed, from the conventional Fano form, by interlevel Coulomb
interaction and interlevel interference. We derive the connection between the
lineshape deformation and the interaction-induced nonmonotonicity of level
occupation, which may be useful for experimental study. The dependence of the
lineshape on the transmission of the direct channel and on the dot-lead
coupling matrix elements is discussed.
","[{""version"":""v1"",""created"":""Tue, 16 Oct 2007 13:17:23 GMT""}]","2009-11-13"
"0710.3046","Gad Frenkel","Gad Frenkel, Rafi Blumenfeld, Peter R. King, Martin Blunt","Topological Analysis of Foams and tetrahedral structures",,,,,"cond-mat.mtrl-sci",,"  In this paper we characterize foams and tetrahedral structures in a unified
way, by a simplified representation of both that conserves the system topology.
The paper presents a workflow for an automated characterization of the topology
of the void space, using a partition of the void space into polyhedral cells
connected by windows. This characterization serves as the basic input for the
Edwards entropic formalism that deals with the statistical characterization of
configurational disorder in granular aggregates and argued to work for foams.
The Edwards formalism is introduced and simplified expectation values are
calculated.
","[{""version"":""v1"",""created"":""Tue, 16 Oct 2007 13:17:39 GMT""}]","2007-10-17"
