"0710.2538","Laura Marian","Laura Marian and Gary M. Bernstein","Detectability of CMB tensor B modes via delensing with weak lensing
  galaxy surveys","10 pages, 5 figures; accepted for publication in Physical Review D","Phys.Rev.D76:123009,2007","10.1103/PhysRevD.76.123009",,"astro-ph",,"  We analyze the possibility of delensing CMB polarization maps using
foreground weak lensing (WL) information. We build an estimator of the CMB
lensing potential out of optimally combined projected potential estimators to
different source redshift bins. Our estimator is most sensitive to the redshift
depth of the WL survey, less so to the shape noise level. Estimators built
using galaxy surveys like LSST and SNAP yield a 30-50% reduction in the lensing
B-mode power. We illustrate the potential advantages of a 21-cm survey by
considering a fiducial WL survey for which we take the redshift depth zmax and
the effective angular concentration of sources n as free parameters. For a
noise level of 1 muK arcmin in the polarization map itself, as projected for a
CMBPol experiment, and a beam with FWHM=10 arcmin, we find that going to
zmax=20 at n=100 gal/sqarcmin yields a delensing performance similar to that of
a quadratic lensing potential estimator applied to small-scale CMB maps: the
lensing B-mode contamination is reduced by almost an order of magnitude. In
this case, there is also a reduction by a factor of ~4 in the detectability
threshold of the tensor B-mode power. At this CMB noise level, there is little
gain from sources with zmax>20. The delensing gains are lost if the CMB beam
exceeds ~20 arcmin. The delensing efficiency and useful zmax depend acutely on
the CMB map noise level, but beam sizes below 10 arcmin do not help. Delensing
via foreground sources does not require arcminute-resolution CMB observations,
a substantial practical advantage over the use of CMB observables for
delensing.
","[{""version"":""v1"",""created"":""Mon, 15 Oct 2007 18:12:22 GMT""}]","2008-11-26"
"0710.2560","Bryan Eastin","Bryan Eastin","Error Channels and the Threshold for Fault-tolerant Quantum Computation","Dissertation, as submitted in July 2007, 190 pages, 37 figures, 7
  tables",,,,"quant-ph",,"  This dissertation treats the topics of threshold calculation, ancilla
construction, and non-standard error models. Chapter 2 introduces background
material ranging from quantum mechanics to classical coding to thresholds for
quantum computation. In Chapter 3 numerical and analytical means are used to
generate estimates of and bounds on the threshold given an error model
described by a restricted stochastic Pauli channel. Chapter 4 develops a
simple, flexible means of estimating the threshold and applies it to some cases
of interest. Finally, a novel method of ancilla construction is proposed in
Chapter 5, and the difficulties associated with implementing it are discussed.
","[{""version"":""v1"",""created"":""Mon, 15 Oct 2007 19:29:02 GMT""}]","2007-10-16"
"0710.2617","Huirong Yan","Huirong Yan, A. Lazarian","Cosmic Ray Propagation: Nonlinear Diffusion Parallel and Perpendicular
  to Mean Magnetic Field","minor changes, accepted to ApJ",,"10.1086/524771",,"astro-ph",,"  We consider the propagation of cosmic rays in turbulent magnetic fields. We
use the models of magnetohydrodynamic turbulence that were tested in numerical
simulations, in which the turbulence is injected on large scale and cascades to
small scales. Our attention is focused on the models of the strong turbulence,
but we also briefly discuss the effects that the weak turbulence and the slab
Alfv\'enic perturbations can have. The latter are likely to emerge as a result
of instabilities with in the cosmic ray fluid itself, e.g., beaming and
gyroresonance instabilities of cosmic rays. To describe the interaction of
cosmic rays with magnetic perturbations we develop a non-linear formalism that
extends the ordinary Quasi-Linear Theory (QLT) that is routinely used for the
purpose. This allows us to avoid the usual problem of 90 degree scattering and
enable our computation of the mean free path of cosmic rays. We apply the
formalism to the cosmic ray propagation in the galactic halo and in the Warm
Ionized medium (WIM). In addition, we address the issue of the transport of
cosmic rays perpendicular to the mean magnetic field and show that the issue of
cosmic ray subdiffusion (i.e., propagation with retracing the trajectories
backwards, which slows down the diffusion) is only important for restricted
cases when the ambient turbulence is far from what numerical simulations
suggest to us. As a result, this work provides formalism that can be applied
for calculating cosmic ray propagation in a wide variety of circumstances.
","[{""version"":""v1"",""created"":""Mon, 15 Oct 2007 18:54:40 GMT""},{""version"":""v2"",""created"":""Tue, 23 Oct 2007 01:58:05 GMT""}]","2009-11-13"
"0710.2632","Virgil Pierce","Yuji Kodama, V. U. Pierce, and Fei-Ran Tian","On the Whitham Equations for the Defocusing Complex Modified KdV
  Equation","27 pages, 9 figures",,,,"nlin.SI math-ph math.MP",,"  We study the Whitham equations for the defocusing complex modified KdV (mKdV)
equation. These Whitham equations are quasilinear hyperbolic equations and they
describe the averaged dynamics of the rapid oscillations which appear in the
solution of the mKdV equation when the dispersive parameter is small. The
oscillations are referred to as dispersive shocks. The Whitham equations for
the mKdV equation are neither strictly hyperbolic nor genuinely nonlinear. We
are interested in the solutions of the Whitham equations when the initial
values are given by a step function. We also compare the results with those of
the defocusing nonlinear Schrodinger (NLS) equation. For the NLS equation, the
Whitham equations are strictly hyperbolic and genuinely nonlinear. We show that
the weak hyperbolicity of the mKdV-Whitham equations is responsible for an
additional structure in the dispersive shocks which has not been found in the
NLS case.
","[{""version"":""v1"",""created"":""Mon, 15 Oct 2007 17:20:51 GMT""}]","2007-10-18"
"0710.2640","Pei-Ming Ho","Chong-Sun Chu, Pei-Ming Ho","Time-dependent AdS/CFT Duality II: Holographic Reconstruction of Bulk
  Metric and Possible Resolution of Singularity","26 pages, 2 figures","JHEP 0802:058,2008","10.1088/1126-6708/2008/02/058",,"hep-th",,"  We continue the studies of our earlier proposal for an AdS/CFT correspondence
for time-dependent supergravity backgrounds. We note that by performing a
suitable change of variables, the dual super Yang-Mills theory lives on a flat
base space, and the time-dependence of the supergravity background is entirely
encoded in the time-dependent couplings (gauge and axionic) and their
supersymmetric completion. This form of the SYM allows a detailed perturbative
analysis to be performed. In particular the one-loop Wilsonian effective action
of the boundary SYM theory is computed. By using the holographic UV/IR
relation, we propose a way to extract the bulk metric from the Wilsonian
effective action; and we find that the bulk metric of our supergravity
solutions can be reproduced precisely. While the bulk geometry can have various
singularities such as geodesic incompleteness, gauge theory quantum effects can
introduce higher derivative corrections in the effective action which can serve
as a way to resolve the singularities.
","[{""version"":""v1"",""created"":""Mon, 15 Oct 2007 19:20:10 GMT""},{""version"":""v2"",""created"":""Mon, 29 Oct 2007 23:29:32 GMT""}]","2009-05-20"
"0710.2696","Aref'eva Irina","I.Ya. Aref'eva and I.V. Volovich","Time Machine at the LHC","12 pages, LATEX, comments and references added","Int.J.Geom.Meth.Mod.Phys.05:641-651,2008","10.1142/S0219887808002977",,"hep-ph gr-qc hep-th",,"  Recently, black hole and brane production at CERN's Large Hadron Collider
(LHC) has been widely discussed. We suggest that there is a possibility to test
causality at the LHC. We argue that if the scale of quantum gravity is of the
order of few TeVs, proton-proton collisions at the LHC could lead to the
formation of time machines (spacetime regions with closed timelike curves)
which violate causality. One model for the time machine is a traversable
wormhole. We argue that the traversable wormhole production cross section at
the LHC is of the same order as the cross section for the black hole
production. Traversable wormholes assume violation of the null energy condition
(NEC) and an exotic matter similar to the dark energy is required. Decay of the
wormholes/time machines and signatures of time machine events at the LHC are
discussed.
","[{""version"":""v1"",""created"":""Mon, 15 Oct 2007 16:38:54 GMT""},{""version"":""v2"",""created"":""Thu, 25 Oct 2007 19:21:50 GMT""}]","2008-11-26"
"0710.2707","Wolfgang S\""oldner","Wolfgang S\""oldner","The Polyakov Loop and the Eigenvalues of the Dirac Operator","7 pages, 4 figures. Talk presented at 25th International Symposium on
  Lattice Field Theory, Regensburg, Germany, 30 Jul - 4 Aug 2007","PoSLAT2007:222,2007",,,"hep-lat",,"  Aiming at the link between confinement and chiral symmetry the Polyakov loop
represented as a spectral sum of eigenvalues of the Dirac operator was subject
of recent studies. We analyze the volume dependence as well as the continuum
behavior of this quantity for quenched QCD using staggered fermions.
Furthermore, we present first results using dynamical configurations.
","[{""version"":""v1"",""created"":""Mon, 15 Oct 2007 17:16:04 GMT""}]","2009-04-14"
"0710.2787","Dorothea Bahns","Dorothea Bahns","The shuffle Hopf algebra and quasiplanar Wick products","16 pages, prepared for the conference proceedings ""Non commutative
  Geometry and Physics"", Laboratoire de physique th\'eorique d'Orsay, April
  23-27, 2007","J. Phys.: Conf. Ser. 103 012014 (13pp) 2008","10.1088/1742-6596/103/1/012014",,"math.QA hep-th",,"  The operator valued distributions which arise in quantum field theory on the
noncommutative Minkowski space can be symbolized by a generalization of chord
diagrams, the dotted chord diagrams. In this framework, the combinatorial
aspects of quasiplanar Wick products are understood in terms of the shuffle
Hopf algebra of dotted chord diagrams, leading to an algebraic characterization
of quasiplanar Wick products as a convolution. Moreover, it is shown that the
distributions do not provide a weight system for universal knot invariants.
","[{""version"":""v1"",""created"":""Mon, 15 Oct 2007 17:29:34 GMT""}]","2008-11-20"
"0710.2823","Lars Hesselholt","Lars Hesselholt","On the Whitehead spectrum of the circle","52 pages","Algebraic Topology. The Abel Symposium 2007. Proceedings of the
  Forth Abel Symposium, Oslo, Norway, August 5-10, 2007, pp. 131-184, Abel
  Symposia 4, Springer-Verlag, Berlin, 2009","10.1007/978-3-642-01200-6_7",,"math.AT math.KT",,"  The seminal work of Waldhausen, Farrell and Jones, Igusa, and Weiss and
Williams shows that the homotopy groups in low degrees of the space of
homeomorphisms of a closed Riemannian manifold of negative sectional curvature
can be expressed as a functor of the fundamental group of the manifold. To
determine this functor, however, it remains to determine the homotopy groups of
the topological Whitehead spectrum of the circle. The cyclotomic trace of B
okstedt, Hsiang, and Madsen and a theorem of Dundas, in turn, lead to an
expression for these homotopy groups in terms of the equivariant homotopy
groups of the homotopy fiber of the map from the topological Hochschild
T-spectrum of the sphere spectrum to that of the ring of integers induced by
the Hurewicz map. We evaluate the latter homotopy groups, and hence, the
homotopy groups of the topological Whitehead spectrum of the circle in low
degrees. The result extends earlier work by Anderson and Hsiang and by Igusa
and complements recent work by Grunewald, Klein, and Macko.
","[{""version"":""v1"",""created"":""Mon, 15 Oct 2007 19:13:24 GMT""},{""version"":""v2"",""created"":""Tue, 16 Oct 2007 12:22:58 GMT""},{""version"":""v3"",""created"":""Fri, 18 Apr 2008 12:25:48 GMT""},{""version"":""v4"",""created"":""Thu, 22 May 2008 12:52:55 GMT""}]","2019-08-12"
"0710.2835","Andrea Capocci","Andrea Capocci and Guido Caldarelli","Folksonomies and clustering in the collaborative system CiteULike","9 pages, 5 figures, iop style; corrected typos",,"10.1088/1751-8113/41/22/224016",,"physics.soc-ph physics.data-an",,"  We analyze CiteULike, an online collaborative tagging system where users
bookmark and annotate scientific papers. Such a system can be naturally
represented as a tripartite graph whose nodes represent papers, users and tags
connected by individual tag assignments. The semantics of tags is studied here,
in order to uncover the hidden relationships between tags. We find that the
clustering coefficient reflects the semantical patterns among tags, providing
useful ideas for the designing of more efficient methods of data classification
and spam detection.
","[{""version"":""v1"",""created"":""Mon, 15 Oct 2007 16:13:01 GMT""},{""version"":""v2"",""created"":""Tue, 16 Oct 2007 13:17:52 GMT""}]","2009-11-13"
"0710.2836","Todd Young","Wenxiang Sun (Peking University), Todd Young (Ohio University), Yunhua
  Zhou (Peking University)","Topological entropies of equivalent smooth flows",,"Trans. A.M.S. 361 (2009), 3071-3082",,,"math.DS",,"  Two flows defined on a smooth manifold are equivalent if there exists a
homeomorphism of the manifold that sends each orbit of one flow onto an orbit
of the other flow while preserving the time orientation. The topological
entropy of a flow is defined as the entropy of its time-1 map. While
topological entropy is an invariant for equivalent homeomorphisms, finite
non-zero topological entropy for a flow cannot be an invariant because its
value is affected by time reparameterization. However, 0 and $\infty$
topological entropy are invariants for equivalent flows without fixed points.
  In equivalent flows with fixed points there exists a counterexample,
constructed by Ohno, showing that neither 0 nor $\infty$ topological entropy is
preserved by equivalence. The two flows constructed by Ohno are suspensions of
a transitive subshift and thus are not differentiable. Note that a
differentiable flow on a compact manifold cannot have $\infty$ entropy. These
facts led Ohno in 1980 to ask the following: ""Is 0 topological entropy an
invariant for equivalent differentiable flows?""
  In this paper, we construct two equivalent $C^\infty$ smooth flows with a
singularity, one of which has positive topological entropy while the other has
zero topological entropy. This gives a negative answer to Ohno's question in
the class $C^\infty$.
","[{""version"":""v1"",""created"":""Mon, 15 Oct 2007 18:14:35 GMT""}]","2011-12-02"
"0710.2856","Erwin Mi\~na-D\'iaz","Erwin Mi\~na-D\'iaz","An asymptotic integral representation for Carleman orthogonal
  polynomials","24 pages, 2 figures","International Mathematics Research Notices (2008) Vol. 2008 :
  article ID rnn065, 38 pages","10.1093/imrn/rnn065",,"math.CA math.CV",,"  In this paper we investigate the asymptotic behavior of polynomials that are
orthonormal over the interior domain of an analytic Jordan curve L with respect
to area measure. We prove that, inside L, these polynomials behave
asymptotically like a sequence of certain integrals involving the canonical
conformal map of the exterior of L onto the exterior of the unit circle and
certain meromorphic kernel function defined in terms of a conformal map of the
interior of L onto the unit disk. The error term in the integral representation
is proven to decay geometrically and sufficiently fast, allowing us to obtain
more precise asymptotic formulas for the polynomials under certain additional
geometric considerations. These formulas yield, in turn, fine results on the
location, limiting distribution and accumulation points of the zeros of the
polynomials.
","[{""version"":""v1"",""created"":""Mon, 15 Oct 2007 16:15:28 GMT""},{""version"":""v2"",""created"":""Sat, 20 Oct 2007 01:39:28 GMT""}]","2008-06-20"
"0710.2857","Walter Grimus","W. Grimus, H. Kuhbock","Renormalisable SO(10) models and neutrino masses and mixing","7 pages, 1 figure, contribution to XXXI International Conference of
  Theoretical Physics, Matter to the Deepest: Recent Developments in Physics of
  Fundamental Interactions, Ustron, 5-11 September 2007, Poland","ActaPhys.Polon.B38:3373-3380,2007",,,"hep-ph",,"  We discuss some recent developments in SUSY Grand Unified Theories based on
the gauge group SO(10). Considering renormalisable Yukawa couplings, we present
ways to accommodate quark and lepton masses and and mixings.
","[{""version"":""v1"",""created"":""Mon, 15 Oct 2007 16:15:34 GMT""}]","2008-11-26"
"0710.2858","Claudia Wigger","C. Wigger, O. Wigger, E. Bellm, W. Hajdas","Observation of an unexpected hardening in the spectrum of GRB 021206","41 pages, 13 figures; submitted to ApJ","The Astrophysical Journal, 675:553-565, 2008 March 1","10.1086/526410",,"astro-ph",,"  GRB 021206 is one of the brightest GRBs ever observed. Its prompt emission,
as measured by RHESSI, shows an unexpected spectral feature. The spectrum has a
peak energy of about 700 keV and can be described by a Band function up to 4.5
MeV. Above 4.5 MeV, the spectrum hardens again, so that the Band function fails
to fit the whole RHESSI energy range up to 17 MeV. Nor does the sum of a
blackbody function plus a power law, even though such a function can describe a
spectral hardening. The cannonball model on the other hand predicts such a
hardening, and we found that it fits the spectrum of GRB 021206 perfectly. We
also analysed other strong GRBs observed by RHESSI, namely GRBs 020715, 021008,
030329, 030406, 030519B, 031027, 031111. We found that all their spectra can be
fit by the cannonball model as well as by a Band function.
","[{""version"":""v1"",""created"":""Mon, 15 Oct 2007 16:25:09 GMT""}]","2008-04-22"
"0710.2859","Adam Rycerz","Adam Rycerz","Nonequilibrium valley polarization in graphene nanoconstrictions","10 pages, 7+1 figures, presented on the conference TNT2007 ""Trends in
  Nanotechnology"", San Sebastian (Spain), September 3-7, 2007. Submitted to
  special edition of phys. stat. sol. (a)","phys. stat. sol. (a) 205, 1281-1289 (2008)","10.1002/pssa.200778166",,"cond-mat.mes-hall",,"  We recently shown, using tight-binding calculations, that nonequilibrium
valley polarization can be realized in graphene, when the current is injected
through ""valley filter"": a ballistic point contact with zigzag edges. Here we
demonstrate, that the effect is surprisingly robust against changing the
crystallographic orientation of the filter axis. Namely, the output current
remains polarized unless a point contact has perfect armchair edges, at which
two subblattices are equally represented. The polarization is inverted when the
filter orientation crosses the amchair line and, subsequently, dominating
subblattice index of terminal atoms changes. In a bended graphene strip, the
valley-polarized current can be directed towards one edge providing a
theoretical possibility to observe a zero-magnetic-field analogue of the
well-known Hall effect. For the valley valve, build of two valley filters in
series and controlled elecrostatically by a gate voltage, the
conductance-to-gate characteristic is inverted when $\pi/3$ vertex is placed
between two filters.
","[{""version"":""v1"",""created"":""Mon, 15 Oct 2007 16:51:40 GMT""},{""version"":""v2"",""created"":""Tue, 16 Oct 2007 14:44:07 GMT""}]","2008-05-23"
"0710.2860","Sefi Ladkani","Sefi Ladkani","Universal derived equivalences of posets of cluster tilting objects","11 pages",,,,"math.RT math.CO",,"  We show that for two quivers without oriented cycles related by a BGP
reflection, the posets of their cluster tilting objects are related by a simple
combinatorial construction, which we call a flip-flop.
  We deduce that the posets of cluster tilting objects of derived equivalent
path algebras of quivers without oriented cycles are universally derived
equivalent. In particular, all Cambrian lattices corresponding to the various
orientations of the same Dynkin diagram are universally derived equivalent.
","[{""version"":""v1"",""created"":""Mon, 15 Oct 2007 16:34:17 GMT""}]","2007-10-16"
"0710.2861","Carl Mueller","Robert C. Dalang, Carl Mueller, and Roger Tribe","A Feynman-Kac-type formula for the deterministic and stochastic wave
  equations","To appear in TAMS","Trans. Amer. Math. Soc. 360, 4681-4703, (2008)",,,"math.PR",,"  We establish a probabilistic representation for a wide class of linear
deterministic p.d.e.s with potential term, including the wave equation in
spatial dimensions 1 to 3. Our representation applies to the heat equation,
where it is related to the classical Feynman-Kac formula, as well as to the
telegraph and beam equations. If the potential is a (random) spatially
homogeneous Gaussian noise, then this formula leads to an expression for the
moments of the solution.
","[{""version"":""v1"",""created"":""Mon, 15 Oct 2007 16:34:26 GMT""}]","2011-02-18"
"0710.2862","Carlos Roberto Pena Ruano","P. Dimopoulos, G. Herdoiza, F. Palombi, M. Papinutto, C. Pena, A.
  Vladikas, H. Wittig","Non-perturbative renormalisation of four-fermion operators in N_f=2 QCD","7 pages, 2 figures, Proceedings from the XXV International Symposium
  on Lattice Field Theory, Regensburg, Germany Typos corrected + typographic
  adjustments","PoSLAT2007:368,2007",,"CERN-PH-TH/2007-178, FTUAM-07-14, IFT-UAM-CSIC-07-45","hep-lat",,"  We present results for the non-perturbative renormalisation of four-fermion
operators with two flavours of dynamical quarks. We consider both fully
relativistic left current-left current operators, and a full basis for $\Delta
B=2$ operators with static heavy quarks. The renormalisation group running of
the operators to high energy scales is computed in the continuum limit for a
family of Schroedinger Functional renormalisation schemes, via standard finite
size scaling techniques. The total renormalisation factors relating
renormalisation group invariant to bare operators are computed for a choice of
lattice regularisations.
","[{""version"":""v1"",""created"":""Mon, 15 Oct 2007 16:45:44 GMT""},{""version"":""v2"",""created"":""Wed, 24 Oct 2007 15:00:06 GMT""}]","2008-11-26"
"0710.2863","Filippo Palombi","F.Palombi, M.Papinutto, C.Pena, H.Wittig","First quenched results for the matrix elements of the B_{B_s} mixing
  parameter in the static limit from tmQCD","14 pages, 5 figures, Proceedings of the 25th International Symposium
  on Lattice Field Theory, Regensburg, Germany, 30 Jul - 4 Aug 2007","PoSLAT2007:366,2007",,,"hep-lat",,"  We report on a non-perturbative study of the scale-dependent renormalization
factors of a multiplicatively renormalizable basis of Delta B=2 parity-odd
four-fermion operators in quenched lattice QCD. We also present some
preliminary results of the matrix elements related to the mixing parameter of
the B_s-meson. In our lattice formulation, the heavy quark is treated in the
static approximation, while the strange one belongs to a doublet of twisted
mass fermions at full twist, i.e. with twist angle alpha=pi/2. In this
framework, the parity-even Delta B=2 four-fermion operators responsible for the
mixing are rotated onto a linear combination of parity-odd operators in the
above-mentioned basis. Their physical matrix elements between static B_s-mesons
are extracted from lattice correlators with Schroedinger functional boundary
conditions. We observe a suppression of excited state contributions to the
B_{B_s} mixing parameter and speculate about possible explanations.
","[{""version"":""v1"",""created"":""Mon, 15 Oct 2007 16:51:30 GMT""}]","2008-11-26"
"0710.2864","Daniel Apai Dr","D. Apai, M. R. Meyer, P. Hinz, M. Kasper","The Outer Cut-Off of the Giant Planet Population and the 6pc-Survey","To appear in the Conference Proceedings ""Extreme Solar Systems""; 3
  pages, 1 figure",,,,"astro-ph",,"  We present results from two high-contrast imaging surveys that exploit a
novel technique, L-band angular differential imaging. Our first survey targeted
21 young stars in the Beta Pic and Tuc-Hor moving groups with VLT/NACO reaching
typical sensitivities of <1 MJup at r > 20 AU. The statistical analysis of the
null result demonstrates that the giant planet population is truncated at 30 AU
or less (90% confidence level). Our second, on-going MMT/Clio survey utilizes
the unique sensitivity achieved in the L-band for old planets to probe all
M-dwarf stars within 6 pc. The proximity of these targets enables direct
imaging of planets in orbits like Jupiter for the first time - a key step for
directly imaging giant planets.
","[{""version"":""v1"",""created"":""Mon, 15 Oct 2007 16:50:59 GMT""}]","2007-10-16"
"0710.2865","Tilo Wettig","G. Akemann, J. Bloch, L. Shifrin, and T. Wettig","Individual complex Dirac eigenvalue distributions from random matrix
  theory and comparison to quenched lattice QCD with a quark chemical potential","4 pages, 4 figures, minor changes, as published in Phys. Rev. Lett","Phys.Rev.Lett.100:032002,2008","10.1103/PhysRevLett.100.032002",,"hep-lat",,"  We analyze how individual eigenvalues of the QCD Dirac operator at nonzero
quark chemical potential are distributed in the complex plane. Exact and
approximate analytical results for both quenched and unquenched distributions
are derived from non-Hermitian random matrix theory. When comparing these to
quenched lattice QCD spectra close to the origin, excellent agreement is found
for zero and nonzero topology at several values of the quark chemical
potential. Our analytical results are also applicable to other physical systems
in the same symmetry class.
","[{""version"":""v1"",""created"":""Mon, 15 Oct 2007 19:28:40 GMT""},{""version"":""v2"",""created"":""Tue, 19 Feb 2008 16:07:58 GMT""}]","2008-11-26"
