"0708.0126","Mohammed Allalen Dr","Mohammed Allalen, Tarik Mehaddene, and Hamid Bouzar","Monte Carlo simulations of the L10 long-range order relaxation in
  dimensionally reduced systems","10 pages, and 7 figures","J. Phys: Condens. Matter 19 No3 (2007) 036218","10.1088/0953-8984/19/3/036218",,"cond-mat.soft cond-mat.mtrl-sci",,"  Monte Carlo simulations have been performed to investigate the relaxation of
the L10 long-range order in dimensionally reduced systems. The effect of the
number of (001)-type monatomic layers and of the pair interaction energies on
these kinetics has been examined. The vacancy migration energies have been
deduced from the Arrhenius plots of the relaxation times. A substantial
increase in the migration energy for small film thickness is observed. The
results agree with previous Monte Carlo simulations and with recent
experimental results in L1_0 thin films and multilayers.
","[{""version"":""v1"",""created"":""Wed, 1 Aug 2007 11:12:03 GMT""}]","2009-11-13"
"0708.0127","Takeo Hoshi","Takeo Hoshi","Accuracy control in ultra-large-scale electronic structure calculation","8 pages, 3 figures. To appear in J.Phys. Condens. Matter. A preprint
  PDF file in better graphics is available at
  http://fujimac.t.u-tokyo.ac.jp/lses/index_e.html","J. Phys.: Condens. Matter 19, 365243, 7pp (2007)","10.1088/0953-8984/19/36/365243",,"cond-mat.mtrl-sci",,"  Numerical aspects are investigated in ultra-large-scale electronic structure
calculation. Accuracy control methods in process (molecular-dynamics)
calculation are focused. Flexible control methods are proposed so as to control
variational freedoms, automatically at each time step, within the framework of
generalized Wannier state theory. The method is demonstrated in silicon
cleavage simulation with 10^2-10^5 atoms. The idea is of general importance
among process calculations and is also used in Krylov subspace theory, another
large-scale-calculation theory.
","[{""version"":""v1"",""created"":""Wed, 1 Aug 2007 11:14:30 GMT""}]","2011-11-10"
"0708.0128","Alessandra Faggionato","A. Faggionato","The alternating marked point process of h-slopes of the drifted Brownian
  motion","28 pages, 4 figures",,,,"math.PR math-ph math.MP",,"  We show that the slopes between h-extrema of the drifted 1D Brownian motion
form a stationary alternating marked point process, extending the result of J.
Neveu and J. Pitman for the non drifted case. Our analysis covers the results
on the statistics of h-extrema obtained by P. Le Doussal, C. Monthus and D.
Fisher via a Renormalization Group analysis and gives a complete description of
the slope between h-extrema covering the origin by means of the Palm--Khinchin
theory. Moreover, we analyze the behavior of the Brownian motion near its
h-extrema.
","[{""version"":""v1"",""created"":""Wed, 1 Aug 2007 11:15:39 GMT""}]","2007-08-02"
"0708.0129","Shigeru Kasahara","S. Kasahara, H. Fujii, T. Mochiku, H. Takeya, K. Hirata","Low temperature specific heat of La_{3}Pd_{4}Ge_{4} with
  U_{3}Ni_{4}Si_{4}-type structure",,"J. Phys.: Condens. Matter 20, 385204 (2008)","10.1088/0953-8984/20/38/385204",,"cond-mat.supr-con",,"  Low temperature specific heat has been investigated in a novel ternary
superconductor La_{3}Pd_{4}Ge_{4} with an U_{3}Ni_{4}Si_{4}-type structure
consisting of the alternating BaAl_{4} (ThCr_{2}Si_{2})- and AlB$_{2}$-type
layers. A comparative study with the related ThCr_{2}Si_{2}-type superconductor
LaPd_{2}Ge_{2}, one of the layers in La_{3}Pd_{4}Ge_{4}, is also presented.
  From the normal state specific heat, the Sommerfeld coefficient $\gamma_{n} =
27.0$ mJ/mol K^2 and the Debye temperature $\Theta_{\rm D}$ = 256 K are derived
for the La_{3}Pd_{4}Ge_{4}, while those for the LaPd_{2}Ge_{2} are $\gamma_{n}
=8.26$ mJ/mol K^2 and $\Theta_{\rm D}$ = 291 K. The La_{3}Pd_{4}Ge_{4} has
moderately high electronic density of state at the Fermi level. Electronic
contribution on the specific heat, $C_{\rm el}$, in each compound is well
described by the BCS behavior, suggesting that both of the La_{3}Pd_{4}Ge_{4}
and the LaPd_{2}Ge_{2} have fully opened isotropic gap in the superconducting
state.
","[{""version"":""v1"",""created"":""Wed, 1 Aug 2007 11:21:31 GMT""}]","2014-11-13"
"0708.0130","Chris Peters","Chris Peters","Lowest Weights in Cohomology of Variations of Hodge Structure","9 pages",,,,"math.AG math.CV",,"  Let X be a smooth complex projective variety, let $j:U\into X$ an immersion
of a Zariski open subset, and let V be a variation of Hodge structure of weight
n over U. Then IH^k(X, j_*V) is known to carry a pure Hodge structure of weight
k+n, while H^k(U,V) carries a mixed Hodge structure of weight $\ge k+n$. In
this note it is shown that the image of the natural map $IH^k(X,j_*V) \to
H^k(U,V)$ is the lowest weight part of this mixed Hodge structure. The proof
uses Saito's theory of mixed Hodge modules.
","[{""version"":""v1"",""created"":""Wed, 1 Aug 2007 14:17:09 GMT""},{""version"":""v2"",""created"":""Thu, 2 Aug 2007 18:29:44 GMT""}]","2007-08-02"
"0708.0131","Veronica Dexheimer","V.A. Dexheimer, C.A.Z. Vasconcellos, B.E.J. Bodmann","On the Density Dependent Nuclear Matter Compressibility",,"Phys.Rev.C77:065803,2008","10.1103/PhysRevC.77.065803",,"astro-ph nucl-th","http://arxiv.org/licenses/nonexclusive-distrib/1.0/","  In the present work we apply a quantum hadrodynamic effective model in the
mean-field approximation to the description of neutron stars. We consider an
adjustable derivative-coupling model and study the parameter influence on the
dynamics of the system by analyzing the full range of values they can take. We
establish a set of parameters which define a specific model that is able to
describe phenomenological properties such as the effective nucleon mass at
saturation as well as global static properties of neutron stars (mass and
radius). If one uses observational data to fix the maximum mass for neutron
stars by a specific model, we are able to predict the compression modulus of
nuclear matter K = 257,2MeV.
","[{""version"":""v1"",""created"":""Wed, 1 Aug 2007 11:25:54 GMT""},{""version"":""v2"",""created"":""Wed, 16 Jul 2008 12:15:36 GMT""}]","2009-02-17"
"0708.0132","Sara van de Geer","Sara van de Geer","Discussion of ``2004 IMS Medallion Lecture: Local Rademacher
  complexities and oracle inequalities in risk minimization'' by V.
  Koltchinskii","Published at http://dx.doi.org/10.1214/009053606000001073 in the
  Annals of Statistics (http://www.imstat.org/aos/) by the Institute of
  Mathematical Statistics (http://www.imstat.org)","Annals of Statistics 2006, Vol. 34, No. 6, 2688-2696","10.1214/009053606000001073","IMS-AOS-AOS0195F","q-fin.RM math.ST stat.TH",,"  Discussion of ``2004 IMS Medallion Lecture: Local Rademacher complexities and
oracle inequalities in risk minimization'' by V. Koltchinskii [arXiv:0708.0083]
","[{""version"":""v1"",""created"":""Wed, 1 Aug 2007 11:28:07 GMT""}]","2009-09-29"
"0708.0133","Milena Benedettini","Milena Benedettini, Serena Viti, Claudio Codella, Rafael Bachiller,
  Frederic Gueth, Maria T. Beltr\`an, Anne Dutrey, Stephane Guilloteau","The clumpy structure of the chemically active L1157 outflow","11 pages, 8 figures, accepted for publication in the MNRAS",,"10.1111/j.1365-2966.2007.12300.x",,"astro-ph",,"  We present high spatial resolution maps, obtained with the Plateau de Bure
Interferometer, of the blue lobe of the L1157 outflow. We observed four lines
at 3 mm, namely CH3OH (2_K-1_K), HC3N (11-10), HCN (1-0) and OCS (7-6).
Moreover, the bright B1 clump has also been observed at better spatial
resolution in CS (2-1), CH3OH (2_1-1_1)A-, and 34SO (3_2-2_1). These high
spatial resolution observations show a very rich structure in all the tracers,
revealing a clumpy structure of the gas superimposed to an extended emission.
In fact, the three clumps detected by previous IRAM-30m single dish
observations have been resolved into several sub-clumps and new clumps have
been detected in the outflow. The clumps are associated with the two cavities
created by two shock episodes driven by the precessing jet. In particular, the
clumps nearest the protostar are located at the walls of the younger cavity
with a clear arch-shape form while the farthest clumps have slightly different
observational characteristics indicating that they are associated to the older
shock episode. The emission of the observed species peaks in different part of
the lobe: the east clumps are brighter in HC3N (11-10), HCN (1-0) and CS (2-1)
while the west clumps are brighter in CH3OH(2_K-1_K), OCS (7-6) and 34SO
(3_2-2_1). This peak displacement in the line emission suggests a variation of
the physical conditions and/or the chemical composition along the lobe of the
outflow at small scale, likely related to the shock activity and the precession
of the outflow. In particular, we observe the decoupling of the silicon
monoxide and methanol emission, common shock tracers, in the B1 clump located
at the apex of the bow shock produced by the second shock episode.
","[{""version"":""v1"",""created"":""Wed, 1 Aug 2007 12:06:10 GMT""}]","2009-11-13"
"0708.0134","Nikolaos Mavromatos","Nikolaos E. Mavromatos (King's College London)","LHC Physics and Cosmology","49 pages Latex, 25 EPS figures incorporated, uses special macros.
  Lectures presented at the Lake Louise Winter Institute 2007 (Lake Louise
  (Canada), February 19-24 2007)",,"10.1142/9789812776105_0004",,"hep-ph astro-ph hep-th",,"  In these Lectures I review possible constraints on particle physics models,
obtained by means of combining the results of collider measurements with
astrophysical data. I emphasize the theoretical-model dependence of these
results. I discuss supersymmetric dark matter constraints at colliders (mainly
LHC) in various theoretical contexts: the standard
Cosmological-Constant-Cold-Dark-Matter (Lambda-CDM) model,
(super)string-inspired ones and non-equilibrium relaxation dark energy models.
I then investigate the capability of LHC measurements in asserting whether
supersymmetric matter (if discovered) constitutes part, or all, of the
astrophysical dark matter. I also discuss prospects for improving the
constraints in future precision facilities, such as the International Linear
Collider.
","[{""version"":""v1"",""created"":""Wed, 1 Aug 2007 12:09:49 GMT""}]","2017-08-23"
"0708.0135","Vladimir Koltchinskii","Vladimir Koltchinskii","Rejoinder: 2004 IMS Medallion Lecture: Local Rademacher complexities and
  oracle inequalities in risk minimization","Published at http://dx.doi.org/10.1214/009053606000001082 in the
  Annals of Statistics (http://www.imstat.org/aos/) by the Institute of
  Mathematical Statistics (http://www.imstat.org)","Annals of Statistics 2006, Vol. 34, No. 6, 2697-2706","10.1214/009053606000001082","IMS-AOS-AOS0195REJ","math.ST stat.TH",,"  Rejoinder: 2004 IMS Medallion Lecture: Local Rademacher complexities and
oracle inequalities in risk minimization [arXiv:0708.0083]
","[{""version"":""v1"",""created"":""Wed, 1 Aug 2007 12:10:53 GMT""}]","2009-09-29"
"0708.0136","Martin Svensson Dr","Sigmundur Gudmundsson, Martin Svensson","Harmonic morphisms from solvable Lie groups",,,,,"math.DG",,"  In this paper we introduce two new methods for constructing harmonic
morphisms from solvable Lie groups. The first method yields global solutions
from any simply connected nilpotent Lie group and from any Riemannian symmetric
space of non-compact type and rank $r\ge 3$. The second method provides us with
global solutions from any Damek-Ricci space and many non-compact Riemannian
symmetric spaces. We then give a continuous family of 3-dimensional solvable
Lie groups not admitting any complex valued harmonic morphisms, not even
locally.
","[{""version"":""v1"",""created"":""Wed, 1 Aug 2007 12:13:42 GMT""},{""version"":""v2"",""created"":""Mon, 3 Sep 2007 16:20:32 GMT""}]","2007-09-05"
"0708.0137","Michael Hauer","M.I. Gorenstein, M. Hauer, O.N. Moroz","Viscosity in the excluded volume hadron gas model","12 pages, 3 figures","Phys.Rev.C77:024911,2008","10.1103/PhysRevC.77.024911",,"nucl-th hep-ph",,"  The shear viscosity $\eta$ in the van der Waals excluded volume
hadron-resonance gas model is considered. For the shear viscosity the result of
the non-relativistic gas of hard-core particles is extended to the mixture of
particles with different masses, but equal values of hard-core radius r. The
relativistic corrections to hadron average momenta in thermal equilibrium are
also taken into account. The ratio of the viscosity $\eta$ to the entropy
density s is studied. It monotonously decreases along the chemical freeze-out
line in nucleus-nucleus collisions with increasing collision energy. As a
function of hard-core radius r, a broad minimum of the ratio $\eta/s\approx
0.3$ near $r \approx 0.5$ fm is found at high collision energies. For the
charge-neutral system at $T=T_c=180$ MeV, a minimum of the ratio $\eta/s\cong
0.24$ is reached for $r\cong 0.53$ fm. To justify a hydrodynamic approach to
nucleus-nucleus collisions within the hadron phase the restriction from below,
$r~ \ge ~0.2$ fm, on the hard-core hadron radius should be fulfilled in the
excluded volume hadron-resonance gas.
","[{""version"":""v1"",""created"":""Wed, 1 Aug 2007 12:14:02 GMT""}]","2011-12-06"
"0708.0138","Nathalie Krell","Nathalie Krell (PMA)","Self-similar branching Markov chains",,,,,"math.PR",,"  The main purpose of this work is to study self-similar branching Markov
chains. First we will construct such a process. Then we will establish certain
Limit Theorems using the theory of self-similar Markov processes.
","[{""version"":""v1"",""created"":""Wed, 1 Aug 2007 12:19:03 GMT""},{""version"":""v2"",""created"":""Thu, 24 Jan 2008 15:52:41 GMT""}]","2008-01-24"
"0708.0139","Pamela Morehouse","G. S. Adams, et al (for the CLEO Collaboration)","Suppressed Decays of D_s^+ Mesons to Two Pseudoscalar Mesons","9 pages postscript,also available through
  http://www.lns.cornell.edu/public/CLNS/2007/, Submitted to PRL","Phys.Rev.Lett.99:191805,2007","10.1103/PhysRevLett.99.191805","CLNS 07/2004, CLEO 07-8","hep-ex",,"  Using data collected near the Ds*+ Ds- peak production energy Ecm = 4170 MeV
by the CLEO-c detector, we study the decays of Ds+ mesons to two pseudoscalar
mesons. We report on searches for the singly-Cabibbo-suppressed Ds+ decay modes
K+ eta, K+ eta', pi+ K0S, K+ pi0, and the isospin-forbidden decay mode Ds+ to
pi+ pi0. We normalize with respect to the Cabibbo-favored Ds+ modes pi+ eta,
pi+ eta', and K+ K0S, and obtain ratios of branching fractions: Ds+ to K+ eta /
Ds+ to pi+ eta = (8.9 +- 1.5 +- 0.4)%, Ds+ to K+ eta' / Ds+ to pi+ eta' = (4.2
+- 1.3 +- 0.3)%, Ds+ to pi+ K0S / Ds+ to K+ K0S = (8.2 +- 0.9 +- 0.2)%, Ds+ to
K+ pi0 / Ds+ to K+ K0S = (5.0 +- 1.2 +- 0.6)%, and Ds+ to pi+ pi0 / Ds+ to K+
K0S < 4.1% at 90% CL, where the uncertainties are statistical and systematic,
respectively.
","[{""version"":""v1"",""created"":""Wed, 1 Aug 2007 12:29:55 GMT""}]","2019-08-13"
"0708.0140","Xiaofeng Wang Dr.","Xiaofeng Wang (1,2), Weidong Li (1), Alexei V. Filippenko (1), Kevin
  Krisciunas (3), Nicholas B. Suntzeff (3), Junzheng Li (2), Tianmeng Zhang
  (4), Jingsong Deng (4), Ryan J. Foley (1), Mohan Ganeshalingam (1), Tipei Li
  (2), YuQing Lou (2), Yulei Qiu (4), Rencheng Shang (2), Jeffrey M. Silverman
  (1), Shuangnan Zhang (2), and Youhong Zhang (2) ((1) UC Berkeley (2) Tsinghua
  University (3) Texas A&M University (4) National Astronomical Observatory of
  China)","Optical and Near-Infrared Observations of the Highly Reddened, Rapidly
  Expanding Type Ia Supernova 2006X in M100","48 pages, 20 figures and 11 tables. Accepted Version (ApJ, 2008,
  March issue)","Astrophys.J.675:626-643, 2008","10.1086/526413",,"astro-ph",,"  We present extensive optical (UBVRI), near-infrared (JK) light curves and
optical spectroscopy of the Type Ia supernova (SN) 2006X in the nearby galaxy
NGC 4321 (M100). Our observations suggest that either SN 2006X has an
intrinsically peculiar color evolution, or it is highly reddened [E(B -
V)_{host} = 1.42+/-0.04 mag] with R_V = 1.48+/-0.06, much lower than the
canonical value of 3.1 for the average Galactic dust. SN 2006X also has one of
the highest expansion velocities ever published for a SN Ia. Compared with the
other SNe Ia we analyzed, SN 2006X has a broader light curve in the U band, a
more prominent bump/shoulder feature in the V and R bands, a more pronounced
secondary maximum in the I and near-infrared bands, and a remarkably smaller
late-time decline rate in the B band. The B - V color evolution shows an
obvious deviation from the Lira-Phillips relation at 1 to 3 months after
maximum brightness. At early times, optical spectra of SN 2006X displayed
strong, high-velocity features of both intermediate-mass elements (Si, Ca, and
S) and iron-peak elements, while at late times they showed a relatively blue
continuum, consistent with the blue U-B and B-V colors at similar epochs. A
light echo and/or the interaction of the SN ejecta and its circumstellar
material may provide a plausible explanation for its late-time photometric and
spectroscopic behavior. Using the Cepheid distance of M100, we derive a Hubble
constant of 72.7+/-8.2 km s^{-1} Mpc^{-1}(statistical) from the normalized
dereddened luminosity of SN 2006X. We briefly discuss whether abnormal dust is
a universal signature for all SNe Ia, and whether the most rapidly expanding
objects form a subclass with distinct photometric and spectroscopic properties.
","[{""version"":""v1"",""created"":""Wed, 1 Aug 2007 12:36:42 GMT""},{""version"":""v2"",""created"":""Thu, 2 Aug 2007 06:01:07 GMT""},{""version"":""v3"",""created"":""Fri, 3 Aug 2007 07:33:58 GMT""},{""version"":""v4"",""created"":""Fri, 16 Nov 2007 10:20:19 GMT""}]","2009-11-13"
"0708.0141","Chris Lee","Chris J. Lee, Peter J. M. van der Slot, and Klaus. -J. Boller","Using ultra-short pulses to determine particle size and density
  distributions","15 pages, 29 figures, accepted for publication in Optics Express will
  update with full reference when it is available",,"10.1364/OE.15.012483",,"physics.optics",,"  We analyze the time dependent response of strongly scattering media (SSM) to
ultra-short pulses of light. A random walk technique is used to model the
optical scattering of ultra-short pulses of light propagating through media
with random shapes and various packing densities. The pulse spreading was found
to be strongly dependent on the average particle size, particle size
distribution, and the packing fraction. We also show that the intensity as a
function of time-delay can be used to analyze the particle size distribution
and packing fraction of an optically thick sample independently of the presence
of absorption features. Finally, we propose an all new way to measure the shape
of ultra-short pulses that have propagated through a SSM.
","[{""version"":""v1"",""created"":""Wed, 1 Aug 2007 13:06:07 GMT""}]","2009-11-13"
"0708.0142","John Hauptman","Sung Keun Park, Franco Grancagnolo, John Hauptman, Alexander
  Mikhailichenko, and Nural Akchurin","The 4th Concept Detector for the International Linear Collider","9 pages, 7 figures, for Session 14 of Lepton-Photon at Daegu",,,,"hep-ex",,"  The 4th Concept detector presently being designed for the International
Linear Collider introduces several innovations in order to achieve the
necessary experimental goal of a detecter that is 2-to-10 times better than the
already excellent SLC and LEP detectors. We introduce a dual-readout
calorimeter system, a cluster counting drift chamber, and a second solenoid to
return the magnetic flux without iron. We discuss particle identification,
momentum and energy resolutions, and the machine-detector interface that
together offer the possibility of a very high-performance detector for
e^+e^-physics up to $\sqrt{s} = 1$ TeV.
","[{""version"":""v1"",""created"":""Wed, 1 Aug 2007 03:41:03 GMT""},{""version"":""v2"",""created"":""Mon, 6 Aug 2007 18:42:32 GMT""}]","2007-08-06"
"0708.0143","Rainer Dahlhaus","Rainer Dahlhaus, Wolfgang Polonik","Nonparametric quasi-maximum likelihood estimation for Gaussian locally
  stationary processes","Published at http://dx.doi.org/10.1214/009053606000000867 in the
  Annals of Statistics (http://www.imstat.org/aos/) by the Institute of
  Mathematical Statistics (http://www.imstat.org)","Annals of Statistics 2006, Vol. 34, No. 6, 2790-2824","10.1214/009053606000000867","IMS-AOS-AOS0138","math.ST stat.TH",,"  This paper deals with nonparametric maximum likelihood estimation for
Gaussian locally stationary processes. Our nonparametric MLE is constructed by
minimizing a frequency domain likelihood over a class of functions. The
asymptotic behavior of the resulting estimator is studied. The results depend
on the richness of the class of functions. Both sieve estimation and global
estimation are considered. Our results apply, in particular, to estimation
under shape constraints. As an example, autoregressive model fitting with a
monotonic variance function is discussed in detail, including algorithmic
considerations. A key technical tool is the time-varying empirical spectral
process indexed by functions. For this process, a Bernstein-type exponential
inequality and a central limit theorem are derived. These results for empirical
spectral processes are of independent interest.
","[{""version"":""v1"",""created"":""Wed, 1 Aug 2007 12:50:32 GMT""}]","2011-11-10"
"0708.0144","Tuomas Savolainen","T. Savolainen (1,2), K. Wiik (2), E. Valtaoja (2), M. Tornikoski (3)
  ((1) MPIfR - Germany, (2) Tuorla Observatory, University of Turku - Finland,
  (3) Mets\""ahovi Radio Observatory, Helsinki University of Technology -
  Finland)","Magnetic Field Structure in the Parsec Scale Jet of 3C273 from
  Multifrequency VLBA Observations","7 pages, to appear in ""Extragalactic Jets: Theory and Observation
  from Radio to Gamma Ray"", eds. T. A. Rector and D. S. De Young, ASP
  conference series",,,,"astro-ph",,"  We present first results from a multifrequency VLBA observations of 3C273 in
2003. The source was observed simultaneously at 5.0, 8.4, 15.3, 22.2, 43.2 and
86.2 GHz, and from this multifrequency data set, spectra of 16 emission
features in the parsec scale jet were carefully constructed by using a new
model-fitting based method. The measured spectra and sizes of the emission
features were used to calculate the magnetic field density and the energy
density of the relativistic electrons in the different parts of the parsec
scale jet, independent of any equipartition assumption. We measure magnetic
field density of an order of 1 Gauss in the core. The magnetic energy density
in the core dominates over that of the relativistic electrons, while in the
downstream region our data are roughly consistent with an equipartition. A
strong gradient in the magnetic field density across the jet width, coincident
with a transverse velocity structure at about 1.5 mas from the core, was found:
the slower superluminal component B2 on the northern side of the jet has a
magnetic field density two orders of magnitude lower than the faster southern
components B3 and B4.
","[{""version"":""v1"",""created"":""Wed, 1 Aug 2007 12:56:57 GMT""}]","2007-08-02"
"0708.0145","Alexander Yu. Vlasov","Alexander Yu. Vlasov (FRC/IRH)","Programmable Quantum State Transfer","4+ pages, 2 columns, revtex4; v2 some clarification, couple new
  examples and references",,,,"quant-ph",,"  A programmable quantum networks model is used in this paper for development
of methods of control of a quantum state transport. These methods may be
applied for a wide variety of patterns of controlled state transmission and
spreading in quantum systems. The programmable perfect state transfer and
quantum walk, mobile quantum (ro)bots and lattice gas automata may be described
by unified way with such approach.
","[{""version"":""v1"",""created"":""Wed, 1 Aug 2007 12:57:27 GMT""},{""version"":""v2"",""created"":""Wed, 12 Sep 2007 12:37:56 GMT""}]","2007-09-12"
"0708.0146","Gerald Cecil","Gerald Cecil and Dmitry Rashkeev (University of North Carolina at
  Chapel Hill)","A Side of Mercury Not Seen By Mariner 10","7 pages, 4 PDF figures, pdfLaTeX, typos corrected, Fig. 2 modified
  slightly to add crater diameters not given in published version","Astron.J.134:1468-1474,2007","10.1086/521703",,"astro-ph",,"  More than 60,000 images of Mercury were taken at ~29 deg elevation during two
sunrises, at 820 nm, and through a 1.35 m diameter off-axis aperture on the
SOAR telescope. The sharpest resolve 0.2"" (140 km) and cover 190-300 deg
longitude -- a swath unseen by the Mariner 10 spacecraft -- at complementary
phase angles to previous ground-based optical imagery. Our view is comparable
to that of the Moon through weak binoculars. Evident are the large crater
Mozart shadowed on the terminator, fresh rayed craters, and other albedo
features keyed to topography and radar reflectivity, including the putative
huge ``Basin S'' on the limb. Classical bright feature Liguria resolves across
the northwest boundary of the Caloris basin into a bright splotch centered on a
sharp, 20 km diameter radar crater, and is the brightest feature within a
prominent darker ``cap'' (Hermean feature Solitudo Phoenicis) that covers the
northern hemisphere between longitudes 140-250 deg. The cap may result from
space weathering that darkens via a magnetically enhanced flux of the solar
wind, or that reddens low latitudes via high solar insolation.
","[{""version"":""v1"",""created"":""Wed, 1 Aug 2007 13:13:48 GMT""},{""version"":""v2"",""created"":""Mon, 29 Oct 2007 19:10:59 GMT""}]","2009-06-23"
