"0708.0059","Sergio Rojas","S. Rojas","On the need to enhance physical insight via mathematical skills",,,,,"physics.ed-ph",,"  It is becoming common to hear teaching advice about spending more time on the
""physics of the problem"" so that students will get more physical insight and
develop a stronger intuition that can be very helpful when thinking about
physics problems. Based on this type of justification, mathematical skills such
as the ability to compute moments of inertia, center of mass, or gravitational
fields from mass distributions, and electrical fields from charge distributions
are considered ""distracting mathematics"" and therefore receive less attention.
We argue a) that this approach can have a negative influence on student
reasoning when dealing with questions of rotational dynamics, a highly
non-intuitive subject where even instructors may fail to provide correct
answers, and b) that exposure of students to mathematical reasoning and to a
wide range of computational techniques to obtain the moment of inertia of
different mass distributions will make students more comfortable with the
subject of rotational dynamics, thus improving their physical insight on the
topic.
","[{""version"":""v1"",""created"":""Wed, 1 Aug 2007 02:49:27 GMT""}]","2007-08-02"
"0708.0060","Xiang-Dong Li","Xiang-Dong Li","The Nature of the Compact X-ray Source in Supernova Remnant RCW 103","12 pages, 1 figure, accepted to ApJL",,"10.1086/521791",,"astro-ph",,"  The discovery of the 6.67 hr periodicity in the X-ray source 1E 161348-5055
associated with the supernova remnant RCW 103 has raised interesting
suggestions about the nature of the X-ray source. Here we argue that in either
accreting neutron star or magnetar model, a supernova fallback disk may be a
critical ingredient in theoretical interpretations of 1E 161348-5055. We
further emphasize the effect of fallback disks on the evolution of young
compact objects in various ways, and suggest that even SS 433 could also be
powered by fallback disk accretion process.
","[{""version"":""v1"",""created"":""Wed, 1 Aug 2007 03:04:51 GMT""}]","2009-11-13"
"0708.0061","Heng Lian","Heng Lian","Cross Validation for Comparing Multiple Density Estimation Procedures",,"Statistics & Probability Letters 79(1):112-115:2009",,,"math.ST stat.TH",,"  We demonstrate the consistency of cross validation for comparing multiple
density estimators using simple inequalities on the likelihood ratio. In
nonparametric problems, the splitting of data does not require the domination
of test data over the training/estimation data, contrary to Shao (1993). The
result is complementary to that of Yang (2005) and Yang (2006).
","[{""version"":""v1"",""created"":""Wed, 1 Aug 2007 03:26:20 GMT""}]","2008-12-17"
"0708.0062","Achim Kempf","Achim Kempf, Robert Martin","On Information Theory, Spectral Geometry and Quantum Gravity","4 pages","Phys.Rev.Lett.100:021304,2008","10.1103/PhysRevLett.100.021304",,"gr-qc",,"  We show that there exists a deep link between the two disciplines of
information theory and spectral geometry. This allows us to obtain new results
on a well known quantum gravity motivated natural ultraviolet cutoff which
describes an upper bound on the spatial density of information. Concretely, we
show that, together with an infrared cutoff, this natural ultraviolet cutoff
beautifully reduces the path integral of quantum field theory on curved space
to a finite number of ordinary integrations. We then show, in particular, that
the subsequent removal of the infrared cutoff is safe.
","[{""version"":""v1"",""created"":""Wed, 1 Aug 2007 04:24:08 GMT""}]","2008-11-26"
"0708.0063","Jae-Suk Yang","Okyu Kwon, Jae-Suk Yang","Information flow between composite stock index and individual stocks","8 pages, 4 figures",,"10.1016/j.physa.2008.01.007",,"q-fin.ST physics.soc-ph",,"  We investigate the strength and the direction of information transfer in the
U.S. stock market between the composite stock price index of stock market and
prices of individual stocks using the transfer entropy. Through the
directionality of the information transfer, we find that individual stocks are
influenced by the index of the market.
","[{""version"":""v1"",""created"":""Wed, 1 Aug 2007 03:43:27 GMT""}]","2008-12-02"
"0708.0064","Brian Wilhite","B. C. Wilhite, R. J. Brunner, D. P. Schneider, D. E. Vanden Berk","The Effect of Variability on the Estimation of Quasar Black Hole Masses","76 pages, 15 figures, 2 (long) tables; Accepted for publication in
  ApJ (November 10, 2007)","Astrophys.J.669:791-800,2007","10.1086/521713",,"astro-ph",,"  We investigate the time-dependent variations of ultraviolet (UV) black hole
mass estimates of quasars in the Sloan Digital Sky Survey (SDSS). From SDSS
spectra of 615 high-redshift (1.69 < z < 4.75) quasars with spectra from two
epochs, we estimate black hole masses, using a single-epoch technique which
employs an additional, automated night-sky-line removal, and relies on UV
continuum luminosity and CIV (1549A) emission line dispersion. Mass estimates
show variations between epochs at about the 30% level for the sample as a
whole. We determine that, for our full sample, measurement error in the line
dispersion likely plays a larger role than the inherent variability, in terms
of contributing to variations in mass estimates between epochs. However, we use
the variations in quasars with r-band spectral signal-to-noise ratio greater
than 15 to estimate that the contribution to these variations from inherent
variability is roughly 20%. We conclude that these differences in black hole
mass estimates between epochs indicate variability is not a large contributer
to the current factor of two scatter between mass estimates derived from low-
and high-ionization emission lines.
","[{""version"":""v1"",""created"":""Wed, 1 Aug 2007 03:55:18 GMT""}]","2009-06-23"
"0708.0065","Yu-Xiao Liu","Yu-Xiao Liu, Xin-Hui Zhang, Li-Da Zhang, Yi-Shi Duan","Localization of Matters on Pure Geometrical Thick Branes","17 pages, 5 figures, accepted by JHEP","JHEP 0802:067,2008","10.1088/1126-6708/2008/02/067",,"hep-th",,"  In the literatures, several types of thick smooth brane configurations in a
pure geometric Weyl integrable 5-dimensional space time have been presented.
The Weyl geometry is a non-Riemannian modification of 5-dimensional
Kaluza--Klein (KK) theory. All these thick brane solutions preserve
4-dimensional Poincar\'e invariance, and some of them break $Z_2$--symmetry
along the extra dimension. In this paper, we study localization of various
matter fields on these pure geometrical thick branes, which also localize the
graviton. We present the shape of the potential of the corresponding
Schr$\mathrm{\ddot{o}}$dinger problem and obtain the lowest KK mode. It is
showed that, for both spin 0 scalars and spin 1 vectors, there exists a
continuum gapless spectrum of KK states with $m^2>0$. But only the massless
mode of scalars is found to be normalizable on the brane. However, for the
massless left or right chiral fermion localization, there must be some kind of
Yukawa coupling. For a special coupling, there exist a series of discrete
massive KK modes with $m^2 >0$. It is also showed that for a given coupling
constant only one of the massless chiral modes is localized on the branes.
","[{""version"":""v1"",""created"":""Wed, 1 Aug 2007 04:27:59 GMT""},{""version"":""v2"",""created"":""Sun, 5 Aug 2007 04:24:59 GMT""},{""version"":""v3"",""created"":""Sun, 14 Oct 2007 14:13:41 GMT""},{""version"":""v4"",""created"":""Tue, 4 Dec 2007 06:33:21 GMT""},{""version"":""v5"",""created"":""Sat, 15 Dec 2007 11:55:50 GMT""},{""version"":""v6"",""created"":""Mon, 21 Jan 2008 08:49:41 GMT""}]","2009-11-18"
"0708.0066","Ryo Nikkuni","Ryo Nikkuni, Kouki Taniyama","Symmetries of spatial graphs and Simon invariants","16 pages, 14 figures","Fund. Math. 205 (2009), 219--236","10.4064/fm205-3-2",,"math.GT","http://arxiv.org/licenses/nonexclusive-distrib/1.0/","  An ordered and oriented 2-component link L in the 3-sphere is said to be
achiral if it is ambient isotopic to its mirror image ignoring the orientation
and ordering of the components. Kirk-Livingston showed that if L is achiral
then the linking number of L is not congruent to 2 modulo 4. In this paper we
study orientation-preserving or reversing symmetries of 2-component links,
spatial complete graphs on 5 vertices and spatial complete bipartite graphs on
3+3 vertices in detail, and determine the necessary conditions on linking
numbers and Simon invariants for such links and spatial graphs to be symmetric.
","[{""version"":""v1"",""created"":""Wed, 1 Aug 2007 04:44:09 GMT""},{""version"":""v2"",""created"":""Fri, 18 Sep 2009 14:35:12 GMT""},{""version"":""v3"",""created"":""Wed, 14 Oct 2009 14:16:42 GMT""}]","2020-05-19"
"0708.0067","Utkir Rozikov A","N. N. Ganikhodjaev, U. A. Rozikov","Pirogov-Sinai Theory With New Contours for Symmetric Models","9 pages",,,,"math-ph math.MP",,"  The contour argument was introduced by Peierls for two dimensional Ising
model. Peierls benefited from the particular symmetries of the Ising model. For
non-symmetric models the argument was developed by Pirogov and Sinai. It is
very general and rather difficult. Intuitively clear that the Peierls argument
does work for any symmetric model. But contours defined in Pirogov-Sinai theory
do not work if one wants to use Peierls argument for more general symmetric
models. We give a new definition of contour which allows relatively easier
prove the main result of the Pirogov-Sinai theory for symmetric models. Namely,
our contours allow us to apply the classical Peierls argument (with contour
removal operation).
","[{""version"":""v1"",""created"":""Wed, 1 Aug 2007 04:53:48 GMT""},{""version"":""v2"",""created"":""Thu, 1 Nov 2007 10:06:39 GMT""}]","2007-11-01"
"0708.0068","Fu-Guo Deng","Xi-Han Li, Fu-Guo Deng, and Hong-Yu Zhou","Faithful qubit transmission against collective noise without ancillary
  qubits","3 pages, 1 figure","Appl. Phys. Lett. 91, 144101 (2007)","10.1063/1.2794433",,"quant-ph",,"  We present a faithful qubit transmission scheme with linear optics against
collective noise, not resorting to ancillary qubits. Its set-up is composed of
three unbalanced polarization interferometers, based on a polarizing beam
splitter, a beam splitter and a half-wave plate, which makes this scheme more
feasible than others with present technology. The fidelity of successful
transmission is 1, independent of the parameters of the collective noise, and
the success probability for obtaining an uncorrupted state can be improved to
100% with some time delayers. Moreover, this scheme has some good applications
in one-way quantum communication for rejecting the errors caused by the
collective noise in quantum channel.
","[{""version"":""v1"",""created"":""Wed, 1 Aug 2007 05:08:55 GMT""},{""version"":""v2"",""created"":""Wed, 3 Oct 2007 03:04:47 GMT""}]","2007-10-03"
"0708.0069","Sachindeo Vaidya","A. P. Balachandran, A. Pinzul, B. A. Qureshi and S. Vaidya","Twisted Gauge and Gravity Theories on the Groenewold-Moyal Plane","17 pages, LaTeX, 1 figure","Phys.Rev.D76:105025,2007","10.1103/PhysRevD.76.105025","SU-4252-859, IISc/CHEP/11/07","hep-th gr-qc hep-ph math-ph math.MP math.QA",,"  Recent work [hep-th/0504183,hep-th/0508002] indicates an approach to the
formulation of diffeomorphism invariant quantum field theories (qft's) on the
Groenewold-Moyal (GM) plane. In this approach to the qft's, statistics gets
twisted and the S-matrix in the non-gauge qft's becomes independent of the
noncommutativity parameter theta^{\mu\nu}. Here we show that the noncommutative
algebra has a commutative spacetime algebra as a substructure: the Poincare,
diffeomorphism and gauge groups are based on this algebra in the twisted
approach as is known already from the earlier work of [hep-th/0510059]. It is
natural to base covariant derivatives for gauge and gravity fields as well on
this algebra. Such an approach will in particular introduce no additional gauge
fields as compared to the commutative case and also enable us to treat any
gauge group (and not just U(N)). Then classical gravity and gauge sectors are
the same as those for \theta^{\mu \nu}=0, but their interactions with matter
fields are sensitive to theta^{\mu \nu}. We construct quantum noncommutative
gauge theories (for arbitrary gauge groups) by requiring consistency of twisted
statistics and gauge invariance. In a subsequent paper (whose results are
summarized here), the locality and Lorentz invariance properties of the
S-matrices of these theories will be analyzed, and new non-trivial effects
coming from noncommutativity will be elaborated.
  This paper contains further developments of [hep-th/0608138] and a new
formulation based on its approach.
","[{""version"":""v1"",""created"":""Wed, 1 Aug 2007 05:22:55 GMT""},{""version"":""v2"",""created"":""Thu, 16 Aug 2007 04:15:21 GMT""}]","2008-11-26"
"0708.0070","Roderich Tumulka","Roderich Tumulka","Bohmian Mechanics at Space-Time Singularities. I. Timelike Singularities","26 pages LaTeX, 2 figures (no separate figure files); v2 major
  revision","Journal of Geometry and Physics 145: 103478 (2019)","10.1016/j.geomphys.2019.103478",,"quant-ph","http://arxiv.org/licenses/nonexclusive-distrib/1.0/","  We develop an extension of Bohmian mechanics to a curved background
space-time containing a singularity. The present paper focuses on timelike
singularities. We use the naked timelike singularity of the super-critical
Reissner-Nordstrom geometry as an example. While one could impose boundary
conditions at the singularity that would prevent the particles from falling
into the singularity, we are interested here in the case in which particles
have positive probability to hit the singularity and get annihilated. The wish
for reversibility, equivariance, and the Markov property then dictates that
particles must also be created by the singularity, and indeed dictates the rate
at which this must occur. That is, a stochastic law prescribes what comes out
of the singularity. We specify explicit equations of a non-rigorous model
involving an interior-boundary condition on the wave function at the
singularity, which can be used also in other versions of quantum theory besides
Bohmian mechanics. As the resulting theory involves particle creation and
annihilation, it can be regarded as a quantum field theory, and the stochastic
process for the Bohmian particles is analogous to Bell-type quantum field
theories.
","[{""version"":""v1"",""created"":""Wed, 1 Aug 2007 05:24:55 GMT""},{""version"":""v2"",""created"":""Wed, 19 Dec 2018 14:56:34 GMT""}]","2019-08-01"
"0708.0071","Fu-Guo Deng","Yu-Jie Liang, Yan-Song Li, Fu-Guo Deng, Xi-Han Li, Bao-An Bian,
  Feng-Shou Zhang, Zu-Hua Liu, and Hong-Yu Zhou","Coulomb effects on the formation of proton halo nuclei","9 pages, 6 figures. One column","Chin.Phys.B18:5267-5271,2009","10.1088/1674-1056/18/12/025",,"nucl-th",,"  The exotic structures in the 2s_{1/2} states of five pairs of mirror nuclei
^{17}O-^{17}F, ^{26}Na-^{26}P, ^{27}Mg-^{27}P, ^{28}Al-^{28}P and
^{29}Si-^{29}P are investigated with the relativistic mean-field (RMF) theory
and the single-particle model (SPM) to explore the role of the Coulomb effects
on the proton halo formation. The present RMF calculations show that the exotic
structure of the valence proton is more obvious than that of the valence
neutron of its mirror nucleus, the difference of exotic size between each
mirror nuclei becomes smaller with the increase of mass number A of the mirror
nuclei and the ratios of the valence proton and valence neutron
root-mean-square (RMS) radius to the matter radius in each pair of mirror
nuclei all decrease linearly with the increase of A. In order to interpret
these results, we analyze two opposite effects of Coulomb interaction on the
exotic structure formation with SPM and find that the contribution of the
energy level shift is more important than that of the Coulomb barrier for light
nuclei. However, the hindrance of the Coulomb barrier becomes more obvious with
the increase of A. When A is larger than 34, Coulomb effects on the exotic
structure formation will almost become zero because its two effects counteract
with each other.
","[{""version"":""v1"",""created"":""Wed, 1 Aug 2007 05:27:17 GMT""}]","2010-01-15"
"0708.0072","Masanori Ichioka","Masanori Ichioka, Kazushige Machida","Vortex states in superconductors with strong Pauli-paramagnetic effect","7 pages, 5 figures","Phys. Rev. B 76, 064502 (2007)","10.1103/PhysRevB.76.064502",,"cond-mat.supr-con",,"  Using the quasiclassical theory, we analyze the vortex structure of
strong-paramagnetic superconductors.There, induced paramagnetic moments are
accumulated exclusively around the vortex core. We quantitatively evaluate the
significant paramagnetic effect in the H-dependence of various quantities, such
as low temperature specific heat, Knight shift, magnetization and the flux line
lattice (FLL) form factor. The anomalous H-dependence of the FLL form factor
observed by the small angle neutron scattering in CeCoIn_5 is attributable to
the large paramagnetic contribution.
","[{""version"":""v1"",""created"":""Wed, 1 Aug 2007 05:27:36 GMT""}]","2013-01-07"
"0708.0073","Aya Bamba","Aya Bamba (1), Yasushi Fukazawa (2), Junko S. Hiraga (3), John P.
  Hughes (4), Hideaki Katagiri (2), Motohide Kokubun (1), Katsuji Koyama (5),
  Emi Miyata (6), Tsunefumi Mizuno (2), Koji Mori (7), Hiroshi Nakajima (6),
  Masanobu Ozaki (1), Rob Petre (8), Hiromitsu Takahashi (2), Tadayuki
  Takahashi (1), Takaaki Tanaka (9), Yukikatsu Terada (3), Yasunobu Uchiyama
  (1), Shin Watanabe (1), Hiroya Yamaguchi (5) ((1) ISAS/JAXA, (2) Hiroshima
  U., (3) RIKEN, (4) Rutgers U., (5) Kyoto U., (6) Osaka U., (7) Miyazaki U.,
  (8) NASA/GSFC. (9) SLAC)","Suzaku wide-band observations of SN 1006","16 pages, 8 figures, PASJ, in press",,"10.1093/pasj/60.sp1.S153",,"astro-ph",,"  We report on the wide band spectra of SN 1006 as observed by Suzaku. Thermal
and nonthermal emission are successfully resolved thanks to the excellent
spectral response of Suzaku's X-ray CCD XIS. The nonthermal emission cannot be
reproduced by a simple power-law model but needs a roll-off at 5.7$\times
10^{16}$ Hz = 0.23 keV. The roll-off frequency is significantly higher in the
northeastern rim than in the southwestern rim. We also have placed the most
stringent upper limit of the flux above 10 keV using the Hard X-ray Detector.
","[{""version"":""v1"",""created"":""Wed, 1 Aug 2007 05:31:46 GMT""}]","2017-01-18"
"0708.0074","Kazuhide Matsuda","Kazuhide Matsuda","Rational solutions of the Noumi and Yamada system of type $A_4^{(1)}$","46 pages, 2 tables;
  http://projecteuclid.org/DPubS?service=UI&version=1.0&verb=Display&handle=euclid.pja/1117805147","J. Math. Phys. 53, 023504 (2012) (35 pages)","10.1063/1.3681867",,"math.CA","http://arxiv.org/licenses/nonexclusive-distrib/1.0/","  In this paper, we completely classify the raional solutions of the Noumi and
Yamada system of type A_4^{(1)}, which is a generalization of the forth
Painlev\'e equation. The rational solutions are classified to three types by
the B\""acklund transformation group.
","[{""version"":""v1"",""created"":""Wed, 1 Aug 2007 05:45:30 GMT""},{""version"":""v2"",""created"":""Sun, 28 Jun 2009 01:45:33 GMT""},{""version"":""v3"",""created"":""Mon, 31 Oct 2011 06:02:42 GMT""},{""version"":""v4"",""created"":""Wed, 9 Nov 2011 06:16:57 GMT""}]","2012-02-10"
"0708.0075","Seong-Gon Kim","J. Houze, Sungho Kim, Amitava Moitra, B. Jelinek, Sebastien Groh, M.
  F. Horstemeyer, Erdem Acar, Masoud Rais-Rohani, and Seong-Gon Kim","A multi-objective optimization procedure to develop
  modified-embedded-atom-method potentials: an application to magnesium","8 pages, 2 figures",,,,"cond-mat.mtrl-sci",,"  We have developed a multi-objective optimization (MOO) procedure to construct
modified-embedded-atom-method (MEAM) potentials with minimal manual fitting.
This procedure has been applied successfully to develop a new MEAM potential
for magnesium. The MOO procedure is designed to optimally reproduce multiple
target values that consist of important materials properties obtained from
experiments and first-principles calculations based on density-functional
theory (DFT). The optimized target quantities include elastic constants,
cohesive energies, surface energies, vacancy formation energies, and the forces
on atoms in a variety of structures. The accuracy of the new potential is
assessed by computing several material properties of Mg and comparing them with
those obtained from other potentials previously published. We found that the
present MEAM potential yields a significantly better overall agreement with DFT
calculations and experiments.
","[{""version"":""v1"",""created"":""Wed, 1 Aug 2007 06:22:28 GMT""}]","2007-08-02"
"0708.0076","Emanuela Pompei Dr.","E. Pompei, M. Dahlem, and A. Iovino","Optical and radio survey of Southern Compact Groups of galaxies. I.
  Pilot study of six groups","accepted on A&A on July 19, 2007. Figures 1 and 3-12 will be
  available only in electronic form",,"10.1051/0004-6361:20077140",,"astro-ph",,"  Multi-wavelength observations of Hickson's Compact Groups (HCGs) have shown
that many of these groups are physical bound structures and are in different
stage of evolution, from spiral-dominated systems to almost merged objects.
Very few studies have analysed the Southern Compact Groups (SCGs) sample, which
is though to be younger that HCGs, due to an on average higher number of spiral
galaxies. We present here the first results from optical and radio observations
on a pilot sample of SCGs.
","[{""version"":""v1"",""created"":""Wed, 1 Aug 2007 06:22:42 GMT""}]","2009-11-13"
"0708.0077","Zhe-Yu Jeff Ou","Z. Y. Ou","Multi-Photon Interference and Temporal Distinguishability of Photons","fixed figures 4,5,7",,"10.1142/S0217979207038186",,"quant-ph",,"  A number of recent interference experiments involving multiple photons are
reviewed. These experiments include generalized photon bunching effects,
generalized Hong-Ou-Mandel interference effects and multi-photon interferometry
for demonstrations of multi-photon de Broglie wavelength. The multi-photon
states used in these experiments are from two pairs of photons in parametric
down-conversion. We find that the size of the interference effect in these
experiments, characterized by the visibility of interference pattern, is
governed by the degree of distinguishability among different pairs of photons.
Based on this discovery, we generalize the concept of multi-photon temporal
distinguishability and relate it to a number of multi-photon interference
effects. Finally, we make an attempt to interpret the coherence theory by the
multi-photon interference via the concept of temporal distinguishability of
photons.
","[{""version"":""v1"",""created"":""Wed, 1 Aug 2007 06:27:23 GMT""},{""version"":""v2"",""created"":""Fri, 24 Aug 2007 17:58:27 GMT""}]","2009-11-13"
"0708.0078","Jurgen Knodlseder","J\""urgen Kn\""odlseder (CESR), Vincent Lonjou (CESR, CENBG), Georg
  Weidenspointner (CESR), Pierre Jean (CESR), Andy Strong (MPE), Roland Diehl
  (MPE), Bertrand Cordier (DAPNIA), St\'ephane Schanne (DAPNIA), Christoph
  Winkler (ESTEC)","Soft gamma-ray galactic ridge emission as unveiled by SPI aboard
  INTEGRAL",,"Dans THE FIRST GLAST SYMPOSIUM - THE FIRST GLAST SYMPOSIUM,
  Stanford : \'Etats-Unis d'Am\'erique (2007)","10.1063/1.2757284",,"astro-ph",,"  The origin of the soft gamma-ray (200 keV - 1 MeV) galactic ridge emission is
one of the long-standing mysteries in the field of high-energy astrophysics.
Population studies at lower energies have shown that emission from accreting
compact objects gradually recedes in this domain, leaving place to another
source of gamma-ray emission that is characterised by a hard power-law spectrum
extending from 100 keV up to 100 MeV The nature of this hard component has
remained so far elusive, partly due to the lack of sufficiently sensitive
imaging telescopes that would be able to unveil the spatial distribution of the
emission. The SPI telescope aboard INTEGRAL allows now for the first time the
simultaneous imaging of diffuse and point-like emission in the soft gamma-ray
regime. We present here all-sky images of the soft gamma-ray continuum emission
that clearly reveal the morphology of the different emission components. We
discuss the implications of our results on the nature of underlying emission
processes and we put our results in perspective of GLAST studies of diffuse
galactic continuum emission.
","[{""version"":""v1"",""created"":""Wed, 1 Aug 2007 06:35:42 GMT""}]","2007-08-02"
