"0708.1512","Mihai Oltean","Mihai Oltean","Solving the Hamiltonian path problem with a light-based computer","17 pages, Natural Computing journal","Natural Computing, Springer, Vol 6, 2007","10.1007/s11047-007-9042-z",,"cs.AR cs.DC",,"  In this paper we propose a special computational device which uses light rays
for solving the Hamiltonian path problem on a directed graph. The device has a
graph-like representation and the light is traversing it by following the
routes given by the connections between nodes. In each node the rays are
uniquely marked so that they can be easily identified. At the destination node
we will search only for particular rays that have passed only once through each
node. We show that the proposed device can solve small and medium instances of
the problem in reasonable time.
","[{""version"":""v1"",""created"":""Fri, 10 Aug 2007 20:01:24 GMT""}]","2007-08-14"
"0708.1513","Roberto Assef","R.J. Assef, C.S. Kochanek, M. Brodwin, M.J.I. Brown, N. Caldwell, R.J.
  Cool, P. Eisenhardt, D. Eisenstein, A.H. Gonzalez, B.T. Jannuzi, C. Jones, E.
  McKenzie, S.S. Murray, D. Stern","Low Resolution Spectral Templates For Galaxies From 0.2 -- 10 microns","Accepted for publication in The Astrophysical Journal. 22 text pages
  + 6 tables + 15 figures. Minor modifications from the original version.
  Fortran codes, templates and electronic tables available at
  http://www.astronomy.ohio-state.edu/~rjassef/lrt/","Astrophys.J. 676 (2008) 286","10.1086/527533",,"astro-ph",,"  We built an optimal basis of low resolution templates for galaxies over the
wavelength range from 0.2 to 10 $\mu$m using a variant of the algorithm
presented by Budavari et al. (2000). We derived them using eleven bands of
photometry from the NDWFS, FLAMEX, zBo\""otes and IRAC Shallow surveys for 16033
galaxies in the NDWFS Bo\""otes field with spectroscopic redshifts measured by
the AGN and Galaxy Evolution Survey. We also developed algorithms to accurately
determine photometric redshifts, K corrections and bolometric luminosities
using these templates. Our photometric redshifts have an accuracy of
$\sigma_z/(1+z) = 0.04$ when clipped to the best 95%. We used these templates
to study the spectral type distribution in the field and to estimate luminosity
functions of galaxies as a function of redshift and spectral type. In
particular, we note that the 5-8$\mu$m color distribution of galaxies is
bimodal, much like the optical g--r colors.
","[{""version"":""v1"",""created"":""Fri, 10 Aug 2007 20:02:07 GMT""},{""version"":""v2"",""created"":""Wed, 9 Jan 2008 01:09:30 GMT""}]","2009-11-13"
"0708.1514","Elizabeth Wehner","Elizabeth Wehner and William Harris","UCD Candidates in the Hydra Cluster","5 pages, 3 figures. Accepted for publication in ApJ Letters",,"10.1086/522305",,"astro-ph",,"  NGC 3311, the giant cD galaxy in the Hydra cluster (A1060), has one of the
largest globular cluster systems known. We describe new Gemini GMOS (g',i')
photometry of the NGC 3311 field which reveals that the red, metal-rich side of
its globular cluster population extends smoothly upward into the mass range
associated with the new class of Ultra-Compact Dwarfs (UCDs). We identify 29
UCD candidates with estimated masses > 6x10^6 solar masses and discuss their
characteristics. This UCD-like sequence is the most well defined one yet seen,
and reinforces current ideas that the high-mass end of the globular cluster
sequence merges continuously into the UCD sequence, which connects in turn to
the E galaxy structural sequence.
","[{""version"":""v1"",""created"":""Fri, 10 Aug 2007 20:06:39 GMT""}]","2009-11-13"
"0708.1515","Jana Bilikova","J. Bilikova, R. N. M. Williams, Y.-H. Chu, R. A. Gruendl and B. F.
  Lundgren","Supernova Remnants in the Large Magellanic Clouds IX: Multiwavelength
  Analysis of the Physical Structure of N49","25 pages, 9 figures, accepted by the Astronomical Journal, November
  2007 Issue","Astron.J.134:2308-2317,2007","10.1086/522302",,"astro-ph",,"  We present a multiwavelength analysis of the supernova remnant N49 in the
Large Magellanic Cloud. Using high-resolution Hubble Space Telescope WFPC2
images of H-alpha, [S II] and [O III] emission, we study the morphology of the
remnant and calculate the rms electron densities in different regions. We
detect an offset of [O III] and H-alpha emission of about 0.5 arcsec, and
discuss possible scenarios that could give rise to such high values. The
kinematics of the remnant is analyzed by matching individual filaments to the
echelle spectra obtained at CTIO. We detect narrow H-alpha emission component
which we identify as the diffuse post-shock recombination radiation, and
discrete broad emission features that correspond to the shocked gas in
filaments. The overall expansion of the remnant is about 250 km/s. The dense
clouds are shocked up to line-of-sight velocities of 250 km/s and the less
dense gas up to 300 km/s. A few cloudlets have even higher radial velocities,
reaching up to 350 km/s. We confirm the presence of the cavity in the remnant,
and identify the center of explosion. Using archival Chandra and XMM-Newton
data, we observe the same trends in surface brightness distribution for the
optical and X-ray images. We carry out the spectral analysis of three regions
that represent the most significant optical features.
","[{""version"":""v1"",""created"":""Fri, 10 Aug 2007 20:16:43 GMT""}]","2009-06-23"
"0708.1518","Tesla E. Jeltema","Tesla E. Jeltema, Eric J. Hallman, Jack O. Burns, and Patrick M. Motl","Cluster Structure in Cosmological Simulations I: Correlation to
  Observables, Mass Estimates, and Evolution","57 pages, 18 figures, accepted to ApJ, updated definition of T_X and
  M_gas but results unchanged, for version with full resolution figures, see
  http://www.ociw.edu/~tesla/sims.ps.gz","Astrophys.J.681:167-186,2008","10.1086/587502",,"astro-ph",,"  We use Enzo, a hybrid Eulerian AMR/N-body code including non-gravitational
heating and cooling, to explore the morphology of the X-ray gas in clusters of
galaxies and its evolution in current generation cosmological simulations. We
employ and compare two observationally motivated structure measures: power
ratios and centroid shift. Overall, the structure of our simulated clusters
compares remarkably well to low-redshift observations, although some
differences remain that may point to incomplete gas physics. We find no
dependence on cluster structure in the mass-observable scaling relations, T_X-M
and Y_X-M, when using the true cluster masses. However, estimates of the total
mass based on the assumption of hydrostatic equilibrium, as assumed in
observational studies, are systematically low. We show that the hydrostatic
mass bias strongly correlates with cluster structure and, more weakly, with
cluster mass. When the hydrostatic masses are used, the mass-observable scaling
relations and gas mass fractions depend significantly on cluster morphology,
and the true relations are not recovered even if the most relaxed clusters are
used. We show that cluster structure, via the power ratios, can be used to
effectively correct the hydrostatic mass estimates and mass-scaling relations,
suggesting that we can calibrate for this systematic effect in cosmological
studies. Similar to observational studies, we find that cluster structure,
particularly centroid shift, evolves with redshift. This evolution is mild but
will lead to additional errors at high redshift. Projection along the line of
sight leads to significant uncertainty in the structure of individual clusters:
less than 50% of clusters which appear relaxed in projection based on our
structure measures are truly relaxed.
","[{""version"":""v1"",""created"":""Fri, 10 Aug 2007 23:43:42 GMT""},{""version"":""v2"",""created"":""Thu, 24 Jan 2008 02:32:24 GMT""}]","2010-11-11"
"0708.1519","Vadim Markel","George Y. Panasyuk, John C. Schotland and Vadim A. Markel","Classical Theory of Optical Nonlinearity in Conducting Nanoparticles","Page margins have been adjusted; otherwise, identical to the previous
  version","Phys. Rev. Lett. 100, 047402 (2008)","10.1103/PhysRevLett.100.047402",,"physics.optics physics.class-ph",,"  We develop a classical theory of electron confinement in conducting
nanoparticles. The theory is used to compute the nonlinear optical response of
the nanoparticle to a harmonic external field.
","[{""version"":""v1"",""created"":""Fri, 10 Aug 2007 20:34:04 GMT""},{""version"":""v2"",""created"":""Mon, 27 Aug 2007 16:09:25 GMT""}]","2008-01-31"
"0708.1521","Christian Moni Bidin","C. Moni Bidin, S. Moehler, G. Piotto, Y. Momany, A. Recio-Blanco","Spectroscopy of horizontal branch stars in NGC6752 - Anomalous results
  on atmospheric parameters and masses","12 pages, 10 figures, accepted for pubblication in A&A. Replaced for
  typos and better LaTeX output",,"10.1051/0004-6361:20078184",,"astro-ph",,"  We used the ESO VLT-FORS2 facility to collect low-resolution spectra of 51
targets distributed along the Horizontal Branch. We determined atmospheric
parameters by comparison with theoretical models through standard fitting
routines, and masses by basic equations. Results are in general in good
agreement with previous works, although not always with theoretical
expectations for cooler stars (Teff<15000 K). The calculated color excess is
systematically lower than literature values, pointing towards a possible
underestimation of effective temperatures. Moreover, we find two groups of
stars at Teff=14000 K and at Teff=27000$ K that present anomalies with respect
to the general trend and expectations. We suppose that the three peculiar
bright stars at Teff=14000 K are probably affected by an enhanced stellar wind.
For the eight Extreme Horizontal Branch stars at Teff=27000 K which show
unusually high masses we find no plausible explanation. While most of our
results agree well with the predictions of standard horizontal branch
evolution, we still have problems with the low masses we derive in certain
temperature ranges. We believe that Kurucz ATLAS9 LTE model atmospheres with
solar-scaled abundances are probably inadequate for these temperature ranges.
Concerning the group of anomalous stars at Teff=27000 K, a Kolmogorov-Smirnov
test indicates that there is only an 8.4% probability that these stars are
randomly drawn from the general distribution in the color-magnitude diagram.
This is not conclusive but points out that these stars could be both (and
independently) spectroscopically and photometrically peculiar with respect to
the general Extreme Horizontal Branch population.
","[{""version"":""v1"",""created"":""Fri, 10 Aug 2007 21:05:25 GMT""},{""version"":""v2"",""created"":""Thu, 23 Aug 2007 21:07:20 GMT""}]","2009-11-13"
"0708.1522","Todd Brintlinger","Todd Brintlinger, Yi Qi, Kamal H. Baloch, David Goldhaber-Gordon and
  John Cumings","Electron Thermal Microscopy","1 PDF file, incl. 17 pages manuscript plus 6 pages Supplementary
  Discussion v2: Add corresponding author asterisk and acknowledgement",,"10.1021/nl0729375",,"cond-mat.mtrl-sci",,"  The progress of semiconductor electronics toward ever-smaller length scales
and associated higher power densities brings a need for new high-resolution
thermal microscopy techniques. Traditional thermal microscopy is performed by
detecting infrared radiation with far-field optics, where the resolution is
limited by the wavelength of the light. By adopting a serial, local-probe
approach, near-field and scanned-probe microscopies can surpass this limit but
sacrifice imaging speed. In the same way that electron microscopy was invented
to overcome the resolution limits of light microscopy, we here demonstrate a
thermal imaging technique that uses an electron microscope to overcome the
limits of infrared thermal microscopy, without compromising imaging speed. With
this new technique, which we call electron thermal microscopy, temperature is
resolved by detecting the liquid-solid transition of arrays of nanoscale
islands, producing thermal maps in real-time (30 thermal images per second over
a 16um^2 field-of-view). The experimental demonstration is supported by
combined electrical and thermal modeling.
","[{""version"":""v1"",""created"":""Fri, 10 Aug 2007 21:06:45 GMT""},{""version"":""v2"",""created"":""Mon, 20 Aug 2007 17:52:17 GMT""}]","2015-05-13"
"0708.1523","Jean Turner","Jean L. Turner (UCLA), David S. Meier (NRAO)","Chemical Complexity in Galaxies","to appear in Astrophysics and Space Science, proceedings of the
  international conference Science with ALMA: a new era for Astrophysics 2006","Astrophys.Space Sci.313:267-272,2008","10.1007/s10509-007-9633-2",,"astro-ph",,"  ALMA will be able to detect a broad spectrum of molecular lines in galaxies.
Current aperture synthesis observations indicate that the molecular line
emission from galaxies is remarkably variable, even on kpc scales. Imaging
spectroscopy at resolutions of an arcsecond or better will reduce the chemical
complexity by allowing regions of physical conditions to be defined and
classified.
","[{""version"":""v1"",""created"":""Fri, 10 Aug 2007 21:33:50 GMT""}]","2009-06-23"
"0708.1524","Leonardo Ubeda","Leonardo Ubeda and Anne Pellerin","Discovery of Two Dust Pillars near the Galactic Plane","5 pages, 2 figures, 1 table",,,,"astro-ph",,"  We report the discovery of two dust pillars using GLIMPSE archival images
obtained with the Infrared Array Camera on board the Spitzer Space Telescope.
They are located close to the Galactic molecular cloud GRSMC45.453+0.060 and
they appear to be aligned with the ionizing region associated with
GRSMC45.478+0.131. Our three colour mosaics show that these stellar incubators
present different morphologies as seen from planet Earth. One of them shows the
unquestionable existence of young stellar objects in its head, whose influence
on the original cocoon is evident, while the other presents a well defined
bright-rimmed ionizing front. We argue that second-generation star formation
has been triggered in these protuberances by the action of massive stars
present in the nearby H II regions.
","[{""version"":""v1"",""created"":""Fri, 10 Aug 2007 22:04:21 GMT""}]","2007-08-14"
"0708.1525","Anabella Araudo","G. E. Romero, S. P. Owocki, A.T. Araudo, R. Townsend, P. Benaglia","Using gamma-rays to probe the clumped structure of stellar winds","3 pages, 2 figures, to appear in the workshop proceedings ""Clumping
  in Hot Star Winds""",,,,"astro-ph",,"  Gamma-rays can be produced by the interaction of a relativistic jet and the
matter of the stellar wind in the subclass of massive X-ray binaries known as
""microquasars"". The relativistic jet is ejected from the surroundings of the
compact object and interacts with cold protons from the stellar wind, producing
pions that then quickly decay into gamma-rays. Since the resulting gamma-ray
emissivity depends on the target density, the detection of rapid variability in
microquasars with GLAST and the new generation of Cherenkov imaging arrays
could be used to probe the clumped structure of the stellar wind. In
particular, we show here that the relative fluctuation in gamma rays may scale
with the square root of the ratio of porosity length to binary separation,
\sqrt{h/a}, implying for example a ca. 10 % variation in gamma ray emission for
a quite moderate porosity, h/a ~ 0.01.
","[{""version"":""v1"",""created"":""Fri, 10 Aug 2007 22:17:38 GMT""}]","2007-08-14"
"0708.1526","Frank Bridges","F. Bridges, C. Downs, T. O'Brien, Il-K Jeong, T. Kimura","Limitations on the extent of off-center displacements in TbMnO3 from
  EXAFS measurements","submitted to PRB; 11 pages (preprint form) 7 figures","Phys. Rev. B 76, 092109/1-4 2007","10.1103/PhysRevB.76.092109",,"cond-mat.str-el cond-mat.mtrl-sci",,"  We present EXAFS data at the Mn K and Tb L3 edges that provide upper limits
on the possible displacements of any atoms in TbMnO3. The displacements must be
less than 0.005-0.01A for all atoms which eliminates the possibility of
moderate distortions (0.02A) with a small c-axis component, but for which the
displacements in the ab plane average to zero. Assuming the polarization arises
from a displacement of the O2 atoms along the c-axis, the measured polarization
then leads to an O2 displacement that is at least 6X10^{-4}A, well below our
experimental limit. Thus a combination of the EXAFS and the measured electrical
polarization indicate that the atomic displacements likely lie in the range
6X10^{-4} - 5X10^{-3}A.
","[{""version"":""v1"",""created"":""Fri, 10 Aug 2007 22:33:41 GMT""}]","2009-11-13"
"0708.1527","Stasinos Konstantopoulos","Stasinos Konstantopoulos","A Data-Parallel Version of Aleph","Proceedings of Parallel and Distributed Computing for Machine
  Learning workshop, held in conjunction with the 14th European Conference on
  Machine Learning. Cavtat, Croatia, 2003",,,,"cs.AI cs.DC",,"  This is to present work on modifying the Aleph ILP system so that it
evaluates the hypothesised clauses in parallel by distributing the data-set
among the nodes of a parallel or distributed machine. The paper briefly
discusses MPI, the interface used to access message- passing libraries for
parallel computers and clusters. It then proceeds to describe an extension of
YAP Prolog with an MPI interface and an implementation of data-parallel clause
evaluation for Aleph through this interface. The paper concludes by testing the
data-parallel Aleph on artificially constructed data-sets.
","[{""version"":""v1"",""created"":""Fri, 10 Aug 2007 23:32:16 GMT""}]","2007-08-14"
"0708.1528","Yi-Jun Yao","Yi-Jun Yao","Rankin-Cohen Deformations and Representation Theory",,,,,"math.QA math.CO",,"  In this paper, we use the unitary representation theory of $SL_2(\mathbb R)$
to understand the Rankin-Cohen brackets for modular forms. Then we use this
interpretation to study the corresponding deformation problems that Paula
Cohen, Yuri Manin and Don Zagier initiated. Two uniqueness results are
established.
","[{""version"":""v1"",""created"":""Fri, 10 Aug 2007 23:19:40 GMT""}]","2007-08-14"
"0708.1529","Iddo Tzameret","Ran Raz, Iddo Tzameret","Resolution over Linear Equations and Multilinear Proofs","44 pages","Annals of Pure and Applied Logic , 155(3):194-224, 2008;","10.1016/j.apal.2008.04.001",,"cs.CC cs.LO",,"  We develop and study the complexity of propositional proof systems of varying
strength extending resolution by allowing it to operate with disjunctions of
linear equations instead of clauses. We demonstrate polynomial-size refutations
for hard tautologies like the pigeonhole principle, Tseitin graph tautologies
and the clique-coloring tautologies in these proof systems. Using the
(monotone) interpolation by a communication game technique we establish an
exponential-size lower bound on refutations in a certain, considerably strong,
fragment of resolution over linear equations, as well as a general polynomial
upper bound on (non-monotone) interpolants in this fragment.
  We then apply these results to extend and improve previous results on
multilinear proofs (over fields of characteristic 0), as studied in
[RazTzameret06]. Specifically, we show the following:
  1. Proofs operating with depth-3 multilinear formulas polynomially simulate a
certain, considerably strong, fragment of resolution over linear equations.
  2. Proofs operating with depth-3 multilinear formulas admit polynomial-size
refutations of the pigeonhole principle and Tseitin graph tautologies. The
former improve over a previous result that established small multilinear proofs
only for the \emph{functional} pigeonhole principle. The latter are different
than previous proofs, and apply to multilinear proofs of Tseitin mod p graph
tautologies over any field of characteristic 0.
  We conclude by connecting resolution over linear equations with extensions of
the cutting planes proof system.
","[{""version"":""v1"",""created"":""Fri, 10 Aug 2007 23:23:10 GMT""}]","2010-04-19"
"0708.1530","Isao Maruyama","Isao Maruyama and Yasuhiro Hatsugai","Nontrivial quantized Berry phases for itinerant spin liquids","8 pages, 4 figures",,"10.1143/JPSJ.76.113601",,"cond-mat.str-el",,"  Quantized Berry phases as local order parameters in t-J models are studied. A
texture pattern of the local order parameters is topologically stable due to
the quantization of non-Abelian Berry phases defined by low-energy states below
a spin gap, which exists in the large J/t case with a few electrons. We have
confirmed that itinerant singlets in the wide class of t-J models carry the
nontrivial Berry phase pi. In the large J/t case for the one-dimensional t-J
model, Berry phases are uniformly pi when the number of electrons is N =4n +2,
($n=0,1,2,...$).
","[{""version"":""v1"",""created"":""Fri, 10 Aug 2007 23:34:22 GMT""}]","2009-11-13"
"0708.1531","Ernst Helmut Brandt","E. H. Brandt and G. P. Mikitik","""Unusual"" critical states in type-II superconductors","15 pages including 11 figures",,"10.1103/PhysRevB.76.064526",,"cond-mat.supr-con",,"  We give a theoretical description of the general critical states in which the
critical currents in type-II superconductors are not perpendicular to the local
magnetic induction. Such states frequently occur in real situations, e.g., when
the sample shape is not sufficiently symmetric or the direction of the external
magnetic field changes in some complex way. Our study is restricted to the
states in which flux-line cutting does not occur. The properties of such
general critical states can essentially differ from the well-known properties
of the usual Bean critical states. To illustrate our approach, we analyze
several examples. In particular, we consider the critical states in a slab
placed in a uniform perpendicular magnetic field and to which two components of
the in-plane magnetic field are then applied successively. We also analyze the
critical states in a long thin strip placed in a perpendicular magnetic field
which then is tilted towards the axis of the strip.
","[{""version"":""v1"",""created"":""Fri, 10 Aug 2007 23:57:26 GMT""}]","2009-11-13"
"0708.1532","Xianggang Qiu","Xu Fang, Zhiyuan Li, Yongbing Long, Hongxiang Wei, Rongjuan Liu, Jiyun
  Ma, M. Kamran, Huaying Zhao, Xiufeng Han, Bairu Zhao, and Xianggang Qiu","Surface plasmon polaritons assisted diffraction in periodic
  subwavelength holes of metal films with reduced interplane coupling","4 pages, 5 figures, 26 references","Phys. Rev. Lett. 99, 066805(2007)","10.1103/PhysRevLett.99.066805",,"cond-mat.mes-hall cond-mat.mtrl-sci",,"  Metal films grown on Si wafer perforated with a periodic array of
subwavelength holes have been fabricated and anomalous enhanced transmission in
the mid-infrared regime has been observed. High order transmission peaks up to
Si(2,2) are clearly revealed due to the large dielectric constant contrast of
the dielectrics at the opposite interfaces. Si(1,1) peak splits at oblique
incidence both in TE and TM polarization, which confirms that anomalous
enhanced transmission is a surface plasmon polaritons (SPPs) assisted
diffraction phenomenon. Theoretical transmission spectra agree excellently with
the experimental results and confirm the role of SPPs diffraction by the
lattice.
","[{""version"":""v1"",""created"":""Sat, 11 Aug 2007 00:13:22 GMT""}]","2009-11-13"
"0708.1533","Krzysztof T. Chyzy","K.T. Chyzy, M. Ehle, R. Beck","Magnetic fields and gas in the cluster influenced spiral galaxy NGC4254
  - I. Radio and X-rays observations","17 pages, 15 figures, accepted for publication in A&A",,"10.1051/0004-6361:20077497",,"astro-ph",,"  Radio observations can show how cluster galaxies are affected by various
environmental factors. We made three frequency radio-polarimetric VLA
observations and performed sensitive XMM-Newton observations in X-rays and UV
light of NGC4254. The distribution of total radio intensity at 8.46 4.86 GHz
reveals a global asymmetry with a more diffuse and almost two times larger
extension to the north than to the south. The radio polarized intensity is even
more asymmetric, showing a strange bright ridge in the southern disk edge,
displaced to the downstream side of the local density wave. Magnetic arms can
be also seen in other disk portions, mostly avoiding nearby optical spiral
arms. Spatially resolved emission of hot X-ray gas from the whole galactic
disk, with its soft component closely tracing star-forming regions, is
detected. The slope of the local radio nonthermal-infrared relation is <1, thus
smaller than for the radio thermal-infrared one (>1). Using the radio thermal
emission-based star formation rate (SFR) we find higher extinction in more
Halpha luminous star-forming regions with a power-law slope of 0.83. The
galaxy's estimated mean SFR of 0.026 M_sun/yr/kpc^2 is three times larger than
in other spirals of similar Hubble type. NGC4254 seems to belong to the class
of `young' Virgo cluster members, which recently experienced a gravitational
encounter at the cluster's periphery, which perturbed its spiral arms by tidal
forces and triggered a burst of star-formation which still maintains strong
radio and infrared emissions. Tidal forces could also sheared the magnetic
field in the southern disk portion and led to the observed polarized ridge,
though, magnetic field compression by weak ram pressure forces of the cluster
gas cannot be excluded.
","[{""version"":""v1"",""created"":""Sat, 11 Aug 2007 00:58:14 GMT""}]","2009-11-13"
