"0708.1492","Rosemary Wyse","Rosemary F.G. Wyse and Gerard Gilmore","Observed Properties of Dark Matter on Small Spatial Scales","To appear in proceedings of IAU Symposium 244, `Dark Galaxies & Lost
  Baryons', eds J. Davies & M. Disney. Eight pages",,"10.1017/S1743921307013828",,"astro-ph",,"  The nature of dark matter is one of the outstanding questions of
astrophysics. The internal motions of member stars reveal that the lowest
luminosity galaxies in the Local Group are the most dark-matter dominated. New
large datasets allow one to go further, and determine systematic properties of
their dark matter haloes. We summarise recent results, emphasising the critical
role of the dwarf spheroidal galaxies in understanding both dark matter and
baryonic processes that shape galaxy evolution.
","[{""version"":""v1"",""created"":""Fri, 10 Aug 2007 17:47:31 GMT""}]","2009-11-13"
"0708.1493","Umesh Garg","S. Mukhopadhyay, D. Almehed, U. Garg, S. Frauendorf, T. Li, P. V.
  Madhusudhana Rao, X. Wang, S. S. Ghugre, M. P. Carpenter, S. Gros, A. Hecht,
  R. V. F. Janssens, F. G. Kondev, T. Lauritsen, D. Seweryniak, and S. Zhu","From chiral vibration to static chirality in ^{135}Nd","Accepted for publication in the Physical Review Letters. Small
  modifications to fit the length limits of the journal. 10 pages, 4 figures","Phys.Rev.Lett.99:172501,2007","10.1103/PhysRevLett.99.172501",,"nucl-ex nucl-th",,"  Electromagnetic transition probabilities have been measured for the intra-
and inter-band transitions in the two sequences in the nucleus ^{135}Nd that
were previously identified as a composite chiral pair of rotational bands. The
measurements are in good agreement with results of a new combination of TAC and
RPA calculations. The chiral character of the bands is affirmed and it is shown
that their behavior is associated with a transition from a vibrational into a
static chiral regime.
","[{""version"":""v1"",""created"":""Fri, 10 Aug 2007 17:58:16 GMT""},{""version"":""v2"",""created"":""Fri, 14 Sep 2007 20:26:11 GMT""}]","2008-11-26"
"0708.1494","Jean Alexandre","Jean Alexandre","A new non-perturbative time-dependent string configuration","Talk given at PASCOS-07","AIPConf.Proc.957:289-292,2007","10.1063/1.2823783",,"hep-th gr-qc hep-ph",,"  A time-dependent bosonic string configuration is discussed, in graviton and
dilaton backgrounds, leading to Weyl-symmetry beta-functions which are
homogeneous in X^0, to any order in alpha'. As a consequence, a string
reparametrization can always be implemented, such that beta functions can be
cancelled, to any order in alpha'. This non-perturbative conformal invariance
is valid for any target space dimension, and leads to a power law expanding
Universe, for which the power vanishes if a specific relation between the
dimension and dilaton amplitude holds. Finally, D=4 is the minimum dimension
(in the case of a spherical world sheet) for which this configuration is
consistent with a Wick rotation in a Minkowski target space.
","[{""version"":""v1"",""created"":""Fri, 10 Aug 2007 17:49:19 GMT""}]","2008-11-26"
"0708.1495","Jon Urheim","MINOS Collaboration","Preliminary Results from MINOS on Muon Neutrino Disappearance Based on
  an Exposure of 2.5x10^20 120 GeV Protons on the NuMI Target","13 pages, including 10 figures (20 figure files), submitted to the
  XXIII International Symposium on Lepton and Photon Interactions at High
  Energy, Daegu Korea, August 13-18, 2007. v2 fix typo in number of expected
  events",,,"Fermilab-pub-07-413","hep-ex hep-ph",,"  Updating our previous measurements with new data and analysis modifications,
we report preliminary results on the energy-dependent deficit of muon neutrinos
from the Fermilab NuMI beam as observed with the MINOS Far Detector located 735
km away in the Soudan Underground Laboratory. From an exposure of 2.50x10^20
protons on target, we observe 563 charged-current nu_mu interaction candidates
in the Far Detector, where 738+/-30 events are expected in the absence of
neutrino oscillations. We have analyzed these data assuming two-flavor nu_mu to
nu_tau oscillations. From a simultaneous fit to the reconstructed nu_mu energy
spectra obtained during two running periods we obtain the neutrino squared-mass
difference Delta m_{32}^2 = (2.38 +0.20/-0.16) x 10^-3 eV^2/c^4 with errors at
68% confidence level (CL), and mixing angle sin^2(2 theta_23) > 0.84 at 90% CL.
The uncertainties and confidence intervals include both statistical and
systematic errors. All results and plots presented here are preliminary.
","[{""version"":""v1"",""created"":""Fri, 10 Aug 2007 18:12:56 GMT""},{""version"":""v2"",""created"":""Tue, 14 Aug 2007 15:44:30 GMT""}]","2012-08-27"
"0708.1496","Mihai Oltean","Mihai Oltean","A Light-Based Device for Solving the Hamiltonian Path Problem","11 pages, Unconventional Computation conference, 2006","LNCS 4135, Unconventional Computation conference, pp. 217-227,
  2006","10.1007/11839132",,"cs.AR cs.DC",,"  In this paper we suggest the use of light for performing useful computations.
Namely, we propose a special device which uses light rays for solving the
Hamiltonian path problem on a directed graph. The device has a graph-like
representation and the light is traversing it following the routes given by the
connections between nodes. In each node the rays are uniquely marked so that
they can be easily identified. At the destination node we will search only for
particular rays that have passed only once through each node. We show that the
proposed device can solve small and medium instances of the problem in
reasonable time.
","[{""version"":""v1"",""created"":""Fri, 10 Aug 2007 18:12:52 GMT""}]","2007-08-13"
"0708.1497","Alfonso Martinez","Alfonso Martinez","Information Rate Loss due to Radiation Decoherence","6 pages",,,,"quant-ph",,"  The information rates achievable by using electromagnetic radiation affected
by thermal noise and signal decoherence are studied. The standard coherent
Gaussian model is compared with an alternative photon gas model which
represents lack of a shared phase reference between transmitter and receiver.
At any frequency, information rates over the photon gas model essentially
coincide with those over the Gaussian model when the signal-to-noise ratio is
below a threshold. Only above the threshold does decoherence cause a loss in
information rates; the loss can amount to half of the capacity. The threshold
exceeds 40 dB for radio frequencies and vanishes at optical frequencies.
","[{""version"":""v1"",""created"":""Fri, 10 Aug 2007 18:18:28 GMT""}]","2007-08-13"
"0708.1498","Sean Huver","Zhanghan Wu, Sean D. Huver, Dmitry Uskov, Hwang Lee, and Jonathan P.
  Dowling","Optimizing Optical Quantum Logic Gates using Genetic Algorithms","4 pages, 3 figures",,,,"quant-ph",,"  We introduce the method of using an annealing genetic algorithm to the
numerically complex problem of looking for quantum logic gates which
simultaneously have highest fidelity and highest success probability. We first
use the linear optical quantum nonlinear sign (NS) gate as an example to
illustrate the efficiency of this method. We show that by appropriately
choosing the annealing parameters, we can reach the theoretical maximum success
probability (1/4 for NS) for each attempt. We then examine the controlled-z
(CZ) gate as the first new problem to be solved. We show results that agree
with the highest known maximum success probability for a CZ gate (2/27) while
maintaining a fidelity of 0.9997. Since the purpose of our algorithm is to
optimize a unitary matrix for quantum transformations, it could easily be
applied to other areas of interest such as quantum optics and quantum sensors.
","[{""version"":""v1"",""created"":""Fri, 10 Aug 2007 19:39:16 GMT""},{""version"":""v2"",""created"":""Tue, 4 Sep 2007 22:02:51 GMT""}]","2007-09-05"
"0708.1499","Suzanne Talon","Suzanne Talon","Transport processes in stars: diffusion, rotation, magnetic fields and
  internal waves","50 pages, proceedings of the Aussois school ""Stellar Nucleosynthesis:
  50 years after B2FH""",,"10.1051/eas:0832003",,"astro-ph",,"  In this paper, I explore various transport processes that have a large impact
of the distribution of elements inside stars and thus, on stellar evolution. A
heuristic description of the physics behind equations is provided, and key
references are given. Finally, for each process, I will briefly review (some)
important results as well as discuss directions for future work.
","[{""version"":""v1"",""created"":""Fri, 10 Aug 2007 18:32:36 GMT""}]","2009-11-13"
"0708.1500","Maria A. Avino-Diaz","Maria A. Avino-Diaz","The reverse engineering problem with probabilities and sequential
  behavior: Probabilistic Sequential Networks","Key words: simulation, homomorphism, dynamical system, sequential
  network, reverse engineering problem. Submitted to Elsevier",,,,"math.DS math.CT",,"  The reverse engineering problem with probabilities and sequential behavior is
introducing here, using the expression of an algorithm. The solution is
partially founded, because we solve the problem only if we have a Probabilistic
Sequential Network. Therefore the probabilistic structure on sequential
dynamical systems is introduced here, the new model will be called
Probabilistic Sequential Network, PSN. The morphisms of Probabilistic
Sequential Networks are defined using two algebraic conditions, whose imply
that the distribution of probabilities in the systems are close. It is proved
here that two homomorphic Probabilistic Sequential Networks have the same
equilibrium or steady state probabilities. Additionally, the proof of the set
of PSN with its morphisms form the category PSN, having the category of
sequential dynamical systems SDS, as a full subcategory is given. Several
examples of morphisms, subsystems and simulations are given.
","[{""version"":""v1"",""created"":""Fri, 10 Aug 2007 18:35:38 GMT""}]","2007-08-13"
"0708.1501","Daniel H. Lenz","Anne Boutet de Monvel, Daniel Lenz, Peter Stollmann","Sch'nol's Theorem For Strongly Local Forms","18 pages",,,,"math.SP math.AP",,"  We prove a variant of Sch'nol's theorem in a general setting: for generators
of strongly local Dirichlet forms perturbed by measures. As an application, we
discuss quantum graphs with $\delta$- or Kirchhoff boundary conditions.
","[{""version"":""v1"",""created"":""Fri, 10 Aug 2007 18:36:30 GMT""}]","2007-08-13"
"0708.1502","Kasper Peeters","Kasper Peeters and Marija Zamaklar","The string/gauge theory correspondence in QCD","Lectures presented by KP at the 45th Winter School on Theoretical
  Physics, February 2007, Schladming, Austria; v3: minor corrections, typos
  fixed, references added","Eur.Phys.J.ST152:113-138,2007","10.1140/epjst/e2007-00379-0","SPIN-07/23, ITP-UU-07/34, DCPT-07/39","hep-ph hep-lat hep-th",,"  Ideas about a duality between gauge fields and strings have been around for
many decades. During the last ten years, these ideas have taken a much more
concrete mathematical form. String descriptions of the strongly coupled
dynamics of semi-realistic gauge theories, exhibiting confinement and chiral
symmetry breaking, are now available. These provide remarkably simple ways to
compute properties of the strongly coupled quark-gluon fluid phase, and also
shed new light on various phenomenological models of hadron fragmentation. We
present a review and highlight some exciting recent developments.
","[{""version"":""v1"",""created"":""Fri, 10 Aug 2007 18:54:15 GMT""},{""version"":""v2"",""created"":""Sun, 12 Aug 2007 16:57:26 GMT""},{""version"":""v3"",""created"":""Tue, 19 Feb 2008 11:41:35 GMT""}]","2008-11-26"
"0708.1503","Vladimir Vovk","Vladimir Vovk","Defensive forecasting for optimal prediction with expert advice","14 pages",,,,"cs.LG",,"  The method of defensive forecasting is applied to the problem of prediction
with expert advice for binary outcomes. It turns out that defensive forecasting
is not only competitive with the Aggregating Algorithm but also handles the
case of ""second-guessing"" experts, whose advice depends on the learner's
prediction; this paper assumes that the dependence on the learner's prediction
is continuous.
","[{""version"":""v1"",""created"":""Fri, 10 Aug 2007 19:19:54 GMT""}]","2007-08-13"
"0708.1504","Satoshi Kokado","Satoshi Kokado, Kazumasa Ueda, Kikuo Harigaya, Akimasa Sakuma","Theoretical study of a localized quantum spin reversal by the sequential
  injection of spins in a spin quantum dot","12 pages, 12 figures, to be published in Phys. Rev. B, typos
  corrected","Phys. Rev. B 76 (2007), 054451-1 - 054451-11","10.1103/PhysRevB.76.054451",,"cond-mat.mes-hall cond-mat.mtrl-sci quant-ph",,"  This is a theoretical study of the reversal of a localized quantum spin
induced by sequential injection of spins for a spin quantum dot that has a
quantum spin. The system consists of ``electrode/quantum
well(QW)/dot/QW/electrode"" junctions, in which the left QW has an energy level
of conduction electrons with only up-spin. We consider a situation in which
up-spin electrons are sequentially injected from the left electrode into the
dot through the QW and an exchange interaction acts between the electrons and
the localized spin. To describe the sequentially injected electrons, we propose
a simple method based on approximate solutions from the time-dependent
Schr$\ddot{\rm o}$dinger equation. Using this method, it is shown that the spin
reversal occurs when the right QW has energy levels of conduction electrons
with only down-spin. In particular, the expression of the reversal time of a
localized spin is derived and the upper and lower limits of the time are
clearly expressed. This expression is expected to be useful for a rough
estimation of the minimum relaxation time of the localized spin to achieve the
reversal. We also obtain analytic expressions for the expectation value of the
localized spin and the electrical current as a function of time. In addition,
we found that a system with the non-magnetic right QW exhibits spin reversal or
non-reversal depending on the exchange interaction.
","[{""version"":""v1"",""created"":""Fri, 10 Aug 2007 19:23:31 GMT""},{""version"":""v2"",""created"":""Fri, 31 Aug 2007 03:51:03 GMT""}]","2009-01-11"
"0708.1505","Dominik Janzing","Dominik Janzing and Thomas Decker","How much is a quantum controller controlled by the controlled system?","17 pages, references added, results slightly improved",,,,"quant-ph",,"  We consider unitary transformations on a bipartite system A x B. To what
extent entails the ability to transmit information from A to B the ability to
transfer information in the converse direction? We prove a dimension-dependent
lower bound on the classical channel capacity C(A<--B) in terms of the capacity
C(A-->B) for the case that the bipartite unitary operation consists of
controlled local unitaries on B conditioned on basis states on A. This can be
interpreted as a statement on the strength of the inevitable backaction of a
quantum system on its controller.
  If the local operations are given by the regular representation of a finite
group G we have C(A-->B)=log |G| and C(A<--B)=log N where N is the sum over the
degrees of all inequivalent representations. Hence the information deficit
C(A-->B)-C(A<--B) between the forward and the backward capacity depends on the
""non-abelianness"" of the control group. For regular representations, the ratio
between backward and forward capacities cannot be smaller than 1/2. The
symmetric group S_n reaches this bound asymptotically. However, for the general
case (without group structure) all bounds must depend on the dimensions since
it is known that the ratio can tend to zero.
","[{""version"":""v1"",""created"":""Fri, 10 Aug 2007 19:40:16 GMT""},{""version"":""v2"",""created"":""Tue, 21 Aug 2007 00:07:40 GMT""}]","2007-08-21"
"0708.1506","Eugene Levin","E. Gotsman, E. Levin and U. Maor (Tel Aviv Univ.)","A Soft Interaction Model at Ultra High Energies: Amplitudes, Cross
  Sections and Survival Probabilities","22 pages, 15 figures",,,"TAUP -2560-07","hep-ph",,"  In this paper we present a two channel model with the goal of reproducing the
soft scattering data available in the ISR-Tevatron energy range, and extend the
model results to LHC and Cosmic Rays energies. A characteristic feature of the
model is that we represent the sum of all diffractive final states at a vertex,
by a single diffractive state. Our two main results are: (i) The approach of
the elastic scattering amplitude to the black disc bound is very slow, reaching
it at energies far higher than the GZK ankle cutoff. (ii) Our predicted
survival probability for Higgs exclusive central diffractive production at the
LHC is 0.7%, which is considerably smaller than our previous estimate. The
above features are compatible with a parton-like model in which the traditional
soft Pomeron is replaced by an amplitude describing the partonic system, which
issaturated in the soft (long distance) limit.
","[{""version"":""v1"",""created"":""Fri, 10 Aug 2007 19:32:19 GMT""},{""version"":""v2"",""created"":""Sun, 4 Nov 2007 07:20:53 GMT""}]","2007-11-05"
"0708.1507","Bernd Schroers","Catherine Meusburger, Bernd Schroers","Quaternionic and Poisson-Lie structures in 3d gravity: the cosmological
  constant as deformation parameter","34 pages, minor corrections, references added","J.Math.Phys.49:083510,2008","10.1063/1.2973040","EMPG-07-15, pi-qg-55","gr-qc hep-th math-ph math.MP",,"  Each of the local isometry groups arising in 3d gravity can be viewed as the
group of unit (split) quaternions over a ring which depends on the cosmological
constant. In this paper we explain and prove this statement, and use it as a
unifying framework for studying Poisson structures associated with the local
isometry groups. We show that, in all cases except for Euclidean signature with
positive cosmological constant, the local isometry groups are equipped with the
Poisson-Lie structure of a classical double. We calculate the dressing action
of the factor groups on each other and find, amongst others, a simple and
unified description of the symplectic leaves of SU(2) and SL(2,R). We also
compute the Poisson structure on the dual Poisson-Lie groups of the local
isometry groups and on their Heisenberg doubles; together, they determine the
Poisson structure of the phase space of 3d gravity in the so-called
combinatorial description.
","[{""version"":""v1"",""created"":""Fri, 10 Aug 2007 19:39:19 GMT""},{""version"":""v2"",""created"":""Wed, 22 Aug 2007 09:16:56 GMT""}]","2008-11-26"
"0708.1508","Rudolph C. Hwa","Rudolph C. Hwa","Elliptic Flow arising from Ridges due to Semi-hard Scattering","revised version with new title and expanded discussion, to be
  published in Phys. Lett. B",,"10.1016/j.physletb.2008.06.075",,"nucl-th","http://arxiv.org/licenses/nonexclusive-distrib/1.0/","  Azimuthal anisotropy in heavy-ion collisions is studied by taking into
account the ridges generated by semi-hard scattering of intermediate-momentum
partons, which can be sensitive to the initial spatial configuration of the
medium in non-central collisions. In a simple treatment of the problem where
the recombination of only thermal partons is considered, analytical formulas
can be derived that yield results in accord with the data on v_2 for p_T <1-2
GeV/c. Centrality dependence is described by a geometrical factor. Ridge
phenomenology is used to determine the initial slopes of v_2 at low p_T for
both pion and proton. For higher p_T, shower partons from high-p_T jets must be
included, but they are not considered here.
","[{""version"":""v1"",""created"":""Fri, 10 Aug 2007 19:40:14 GMT""},{""version"":""v2"",""created"":""Tue, 20 Nov 2007 23:16:53 GMT""},{""version"":""v3"",""created"":""Wed, 2 Jul 2008 17:26:56 GMT""}]","2009-11-13"
"0708.1509","Alin Panaitescu","A. Panaitescu","X-ray flares, plateaus, and chromatic breaks of GRB afterglows from
  up-scattered forward-shock emission","to appear in MNRAS, 12 pages, 7 figures","Mon.Not.Roy.Astron.Soc. 383 (2008) 1143-1153","10.1111/j.1365-2966.2007.12607.x",,"astro-ph",,"  Scattering of the forward-shock synchrotron emission by a relativistic
outflow located behind the leading blast-wave may produce an X-ray emission
brighter than that coming directly from the forward-shock and may explain four
features displayed by Swift X-ray afterglows: flares, plateaus (slow decays),
chromatic light-curve breaks, and fast post-plateau decays. For a cold
scattering outflow, the reflected flux overshines the primary one if the
scattering outflow is nearly baryon-free and highly relativistic. These two
requirements can be relaxed if the scattering outflow is energized by weak
internal shocks, so that the incident forward-shock photons are also
inverse-Compton scattered, in addition to bulk-scattering. Sweeping-up of the
photons left behind by the forward shock naturally yields short X-ray flares.
Owing to the boost in photon energy produced by bulk-scattering scattering, the
reflected emission is more likely to overshine that coming directly from the
forward shock at higher photon energies, yielding light-curve plateaus and
breaks that appear only in the X-ray. The brightness, shape, and decay of the
X-ray light-curve plateau depend on the radial distribution of the scatterer's
Lorentz factor and mass-flux. Chromatic X-ray light-curve breaks and sharp
post-plateau decays cannot be accommodated by the direct forward-shock emission
and argue in favour of the scattering-outflow model proposed here. On the other
hand, the X-ray afterglows without plateaus, those with achromatic breaks, and
those with very long-lived power-law decays are more naturally accommodated by
the standard forward-shock model. Thus the diversity of X-ray light-curves
arises from the interplay of the scattered and direct forward-shock emissions.
","[{""version"":""v1"",""created"":""Fri, 10 Aug 2007 19:51:59 GMT""},{""version"":""v2"",""created"":""Wed, 17 Oct 2007 19:21:58 GMT""}]","2009-11-13"
"0708.1510","Bethany Cobb","Bethany E. Cobb and Charles D. Bailyn","Connecting GRBs and galaxies: the probability of chance coincidence","edited, accepted by ApJ","Astrophys.J.677:1157-1167,2008","10.1086/533427",,"astro-ph","http://arxiv.org/licenses/nonexclusive-distrib/1.0/","  Studies of GRB host galaxies are crucial to understanding GRBs. However,
since they are identified by the superposition in the plane of the sky of a GRB
afterglow and a galaxy there is always a possibility that an association
represents a chance alignment, rather than a physical connection. We examine a
uniform sample of 72 GRB fields to explore the probability of chance
superpositions. There is typically a ~1% chance that an optical afterglow will
coincide with a galaxy by chance. While spurious host galaxy detections will,
therefore, be rare, the possibility must be considered when examining
individual GRB/host galaxy examples. It is also tempting to use the large and
uniform collection of X-ray afterglow positions to search for GRB-associated
galaxies. However, we find that approximately half of the 14 superpositions in
our sample are likely to occur by chance, so in the case of GRBs localized only
by an X-ray afterglow, even statistical studies are suspect.
","[{""version"":""v1"",""created"":""Fri, 10 Aug 2007 20:09:00 GMT""},{""version"":""v2"",""created"":""Mon, 4 Oct 2010 22:35:35 GMT""}]","2014-11-18"
"0708.1511","Edo Berger","E. Berger, J.E. Gizis, M.S. Giampapa, R.E. Rutledge, J. Liebert, E.
  Martin, G. Basri, T.A. Fleming, C.M. Johns-Krull, N. Phan-Bao, W.H. Sherry","Simultaneous Multi-Wavelength Observations of Magnetic Activity in
  Ultracool Dwarfs. I. The Complex Behavior of the M8.5 Dwarf TVLM513-46546","13 pages, 4 figures",,"10.1086/524769",,"astro-ph",,"  [Abridged] We present the first simultaneous radio, X-ray, ultraviolet, and
optical spectroscopic observations of the M8.5 dwarf TVLM513-46546, with a
duration of 9 hours. These observations are part of a program to study the
origin of magnetic activity in ultracool dwarfs, and its impact on
chromospheric and coronal emission. Here we detect steady quiescent radio
emission superposed with multiple short-duration, highly polarized flares;
there is no evidence for periodic bursts previously reported for this object,
indicating their transient nature. We also detect soft X-ray emission, with
L_X/L_bol~10^-4.9, the faintest to date for any object later than M5, and a
possible weak X-ray flare. TVLM513-46546 continues the trend of severe
violation of the radio/X-ray correlation in ultracool dwarfs, by nearly 4
orders of magnitude. From the optical spectroscopy we find that the Balmer line
luminosity exceeds the X-ray luminosity by a factor of a few, suggesting that,
unlike in early M dwarfs, chromospheric heating may not be due to coronal X-ray
emission. More importantly, we detect a sinusoidal H-alpha light curve with a
period of 2 hr, matching the rotation period of TVLM513-46546. This is the
first known example of such Balmer line behavior, which points to a co-rotating
chromospheric hot spot or an extended magnetic structure, with a covering
fraction of about 50%. This feature may be transitory based on the apparent
decline in light curve peak during the four observed maxima. From the radio
data we infer a large scale steady magnetic field of ~100 G, in good agreement
with the value required for confinement of the X-ray emitting plasma. The radio
flares, on the other hand, are produced in a component of the field with a
strength of ~3 kG and a likely multi-polar configuration.
","[{""version"":""v1"",""created"":""Fri, 10 Aug 2007 20:00:12 GMT""}]","2009-11-13"
