"0708.1534","Moritz Karbach","The BABAR Collaboration: B. Aubert, et al","Measurement of branching fraction and CP asymmetries in B->D0(cp)K
  decays","17 pages, 15 postscript figures, contributed to Lepton Photon 2007",,,"BABAR-CONF-07/006, SLAC-PUB-12696","hep-ex",,"  We present a preliminary study of $B^- \to D^0_{CP} \pi^-$ and $B^- \to
D^0_{CP} K^-$ decays, with the $D^0_{CP}$ reconstructed in the CP-odd
eigenstates $K_s \pi^0$, $K_s \omega$, in the CP-even eigenstates $K^+ K^-$,
$\pi^+ \pi^-$, and in the (non-CP) flavor eigenstate $K^\mp \pi^\pm$. Using a
sample of about 382 million Y(4S) decays into BBbar pairs, collected with the
BABAR detector operating at the PEP-II asymmetric-energy B Factory at SLAC, we
measure the ratios of the branching fractions R_CP+- and the direct CP
asymmetries A_CP+-. The results are:
  R_CP- = 0.81 \pm 0.10 (stat) \pm 0.05 (syst)
  R_CP+ = 1.07 \pm 0.10 (stat) \pm 0.04 (syst)
  A_CP- = -0.19 \pm 0.12 (stat) \pm 0.02 (syst)
  A_CP+ = 0.35 \pm 0.09 (stat) \pm 0.05 (syst)
","[{""version"":""v1"",""created"":""Sat, 11 Aug 2007 00:46:23 GMT""}]","2007-08-14"
"0708.1535","Imam Fachruddin","I. Fachruddin, Ch. Elster and W. Gloeckle","Three-Nucleon Scattering at Intermediate Energies","5 pages, 5 figures, Proceeding of the Third Asia-Pacific Conference
  on Few-Body Problem in Physics, Nakhon Ratchasima, Thailand, July 26-30 2005",,"10.1142/9789812706881_0016",,"nucl-th",,"  By means of a technique, which does not employ partial wave (PW)
decompositions, the nucleon-deuteron break-up process is evaluated in the
Faddeev scheme, where only the leading order term of the amplitude is
considered. This technique is then applied to calculate the semi-exclusive
proton-deuteron break-up reaction d(p,n)pp for proton laboratory energies Elab
of a few hundred MeV. A comparison with PW calculations is performed at 197 MeV
projectile energy. At the same energy rescattering processes, which are not
included in the 3D calculations yet, are shown to be still important in the
full Faddeev PW calculations, especially for the cross section and the
analyzing power Ay. Next, kinematical relativistic effects are investigated for
projectile energies up to about 500 MeV. At the higher energies, those
relativistic effects start not to be negligible, especially in the peak of the
cross section.
","[{""version"":""v1"",""created"":""Sat, 11 Aug 2007 00:59:58 GMT""}]","2017-08-23"
"0708.1537","Tiberiu Harko","Christian G. Boehmer, Tiberiu Harko, Francisco S. N. Lobo","Conformally symmetric traversable wormholes","8 pages, 1 figure, references added; minor changes, accepted for
  publication in PRD","Phys.Rev.D76:084014,2007","10.1103/PhysRevD.76.084014",,"gr-qc astro-ph hep-th",,"  Exact solutions of traversable wormholes are found under the assumption of
spherical symmetry and the existence of a {\it non-static} conformal symmetry,
which presents a more systematic approach in searching for exact wormhole
solutions. In this work, a wide variety of solutions are deduced by considering
choices for the form function, a specific linear equation of state relating the
energy density and the pressure anisotropy, and various phantom wormhole
geometries are explored. A large class of solutions impose that the spatial
distribution of the exotic matter is restricted to the throat neighborhood,
with a cut-off of the stress-energy tensor at a finite junction interface,
although asymptotically flat exact solutions are also found. Using the ``volume
integral quantifier,'' it is found that the conformally symmetric phantom
wormhole geometries may, in principle, be constructed by infinitesimally small
amounts of averaged null energy condition violating matter. Considering the
tidal acceleration traversability conditions for the phantom wormhole geometry,
specific wormhole dimensions and the traversal velocity are also deduced.
","[{""version"":""v1"",""created"":""Sat, 11 Aug 2007 09:20:53 GMT""},{""version"":""v2"",""created"":""Fri, 17 Aug 2007 02:36:03 GMT""},{""version"":""v3"",""created"":""Tue, 28 Aug 2007 03:13:44 GMT""}]","2008-11-26"
"0708.1538","Peter Krawitz","P. Krawitz, I. Shmulevich","Entropy of complex relevant components of Boolean networks","8 pages, 6 figures",,"10.1103/PhysRevE.76.036115",,"cond-mat.dis-nn",,"  Boolean network models of strongly connected modules are capable of capturing
the high regulatory complexity of many biological gene regulatory circuits. We
study numerically the previously introduced basin entropy, a parameter for the
dynamical uncertainty or information storage capacity of a network as well as
the average transient time in random relevant components as a function of their
connectivity. We also demonstrate that basin entropy can be estimated from
time-series data and is therefore also applicable to non-deterministic networks
models.
","[{""version"":""v1"",""created"":""Sat, 11 Aug 2007 03:07:51 GMT""}]","2009-11-13"
"0708.1539","Paul Busch","Werner Stulpe and Paul Busch","The Structure of Classical Extensions of Quantum Probability Theory",,"J. Math. Phys. 49 (2008) 032104/1-22","10.1063/1.2884581",,"quant-ph",,"  On the basis of a suggestive definition of a classical extension of quantum
mechanics in terms of statistical models, we prove that every such classical
extension is essentially given by the so-called Misra-Bugajski reduction map.
We consider how this map enables one to understand quantum mechanics as a
reduced classical statistical theory on the projective Hilbert space as phase
space and discuss features of the induced hidden-variables model. Moreover,
some relevant technical results on the topology and Borel structure of the
projective Hilbert space are reviewed.
","[{""version"":""v1"",""created"":""Sat, 11 Aug 2007 03:37:30 GMT""}]","2008-04-04"
"0708.1541","Shosuke Sasaki","Shosuke Sasaki","Energy Spectra for Fractional Quantum Hall States","5 pages, 3 figures",,"10.1088/1742-6596/100/4/042021",,"cond-mat.mes-hall cond-mat.str-el",,"  Fractional quantum Hall states (FQHS) with the filling factor nu = p/q of q <
21 are examined and their energies are calculated. The classical Coulomb energy
is evaluated among many electrons; that energy is linearly dependent on 1/nu.
The residual binding energies are also evaluated. The electron pair in nearest
Landau-orbitals is more affected via Coulomb transition than an electron pair
in non-nearest orbitals. Each nearest electron pair can transfer to some empty
orbital pair, but it cannot transfer to the other empty orbital pair because of
conservation of momentum. Counting the numbers of the allowed and forbidden
transitions, the binding energies are evaluated for filling factors of 126
fraction numbers. Gathering the classical Coulomb energy and the pair
transition energy, we obtain the spectrum of energy versus nu. This energy
spectrum elucidates the precise confinement of Hall resistance at specific
fractional filling factors.
","[{""version"":""v1"",""created"":""Sat, 11 Aug 2007 04:44:09 GMT""}]","2009-11-13"
"0708.1542","Ilya Zaliapin","Andrei Gabrielov, Vladimir Keilis-Borok, Ilya Zaliapin","Predictability of extreme events in a branching diffusion model","4 pages, 2 figures",,,,"nlin.AO",,"  We propose a framework for studying predictability of extreme events in
complex systems. Major conceptual elements -- direct cascading or
fragmentation, spatial dynamics, and external driving -- are combined in a
classical age-dependent multi-type branching diffusion process with
immigration. A complete analytic description of the size- and space-dependent
distributions of particles is derived. We then formulate an extreme event
prediction problem and determine characteristic patterns of the system behavior
as an extreme event approaches. In particlular, our results imply specific
premonitory deviations from self-similarity, which have been heuristically
observed in real-world and modeled complex systems. Our results suggest a
simple universal mechanism of such premonitory patterns and natural framework
for their analytic study.
","[{""version"":""v1"",""created"":""Sat, 11 Aug 2007 05:11:50 GMT""}]","2007-08-14"
"0708.1543","Kouichi Hagino","K. Hagino and H. Sagawa","Dipole excitation and geometry of borromean nuclei","4 pages, 4 eps figures","Phys.Rev.C76:047302,2007","10.1103/PhysRevC.76.047302",,"nucl-th",,"  We analyze the Coulomb breakup cross sections of $^{11}$Li and $^6$He nuclei
using a three-body model with a density-dependent contact interaction. We show
that the concentration of the B(E1) strength near the threshold can be well
reproduced with this model. With the help of the calculated B(E1) value, we
extract the root-mean-square (rms) distance between the core nucleus and the
center of mass of two valence neutrons without resorting to the sum rule, which
may suffer from unphysical Pauli forbidden transitions. Together with the
empirical rms distance between the neutrons obtained from the matter radius
study and also from the three-body correlation study in the break-up reaction,
we convert these rms distances to the mean opening angle between the valence
neutrons from the core nucleus. We find that the obtained mean opening angles
in $^{11}$Li and $^6$He agree with the three-body model predictions.
","[{""version"":""v1"",""created"":""Sat, 11 Aug 2007 05:46:34 GMT""}]","2008-11-26"
"0708.1544","Chih-Hsiang Cheng","The BABAR Collaboration: B. Aubert, et al","Measurement of cos2beta in B0->D(*)h0 Decays with a Time-Dependent
  Dalitz Plot Analysis of D->KSpi+pi-","7 pages, 3 figures, submitted to Physical Review Letters","Phys.Rev.Lett.99:231802,2007","10.1103/PhysRevLett.99.231802","BABAR-PUB-07/047, SLAC-PUB-12727","hep-ex",,"  We study the time-dependent Dalitz plot of D->KSpi+pi- in B0->D(*)h0 decays,
where h0 is a pi0, eta, eta', or omega meson and D*->Dpi0 using a data sample
of 383 X 10^6 Upsilon(4S)->BBbar decays collected with the BABAR detector. We
determine cos2beta = 0.42+-0.49+-0.09+-0.13, sin2beta = 0.29+-0.34+-0.03+-0.05,
and |lambda| = 1.01+-0.08+-0.02, where the first error is statistical, the
second is the experimental systematic uncertainty, and the third, where given,
is the Dalitz model uncertainty. Assuming the world average value for sin2beta
and |lambda|=1, cos2beta>0 is preferred over cos2beta<0 at 86% confidence
level.
","[{""version"":""v1"",""created"":""Sat, 11 Aug 2007 05:55:35 GMT""}]","2010-04-12"
"0708.1545","Charles Liu","Charles T. Liu (1), Peter Capak (2), Bahram Mobasher (3), Timothy A.
  D. Paglione (4), R. Michael Rich (5), Nicholas Z. Scoville (2), Shana M.
  Tribiano (6), and Neil D. Tyson (7) ((1) CUNY College of Staten Island, (2)
  Caltech, (3) STScI, (4) CUNY York College, (5) UCLA, (6) CUNY BMCC, (7) AMNH)","The Faint End Slopes Of Galaxy Luminosity Functions In The COSMOS
  2-Square Degree Field","24 pages including 5 figures, accepted to ApJS",,"10.1086/522361",,"astro-ph",,"  We examine the faint-end slope of the rest-frame V-band luminosity function
(LF), with respect to galaxy spectral type, of field galaxies with redshift
z<0.5, using a sample of 80,820 galaxies with photometric redshifts in the
Cosmic Evolution Survey (COSMOS) field. For all galaxy spectral types combined,
the LF slope, alpha, ranges from -1.24 to -1.12, from the lowest redshift bin
to the highest. In the lowest redshift bin (0.02<z<0.1), where the magnitude
limit is M(V) ~ -13, the slope ranges from ~ -1.1 for galaxies with early-type
spectral energy distributions (SEDs), to ~ -1.9 for galaxies with
low-extinction starburst SEDs. In each galaxy SED category (Ell, Sbc, Scd/Irr,
and starburst), the faint-end slopes grow shallower with increasing redshift;
in the highest redshift bin (0.4<z<0.5), the slope is ~ -0.5 and ~ -1.3 for
early-types and starbursts respectively. The steepness of alpha at lower
redshift could be qualitatively explained by large numbers of faint dwarf
galaxies, perhaps of low surface brightness, which are not detected at higher
redshifts.
","[{""version"":""v1"",""created"":""Sat, 11 Aug 2007 14:29:22 GMT""}]","2009-11-13"
"0708.1546","Frank Bridges","Y. Jiang, F. Bridges, L. Downward, J. J. Neumeier","Relationship between macroscopic physical properties and local
  distortions of low doping La{1-x}Ca{x}MnO3: an EXAFS study","27 pages, 8 figures, to be submitted to Phys. Rev. B",,"10.1103/PhysRevB.76.224428",,"cond-mat.str-el",,"  A temperature-dependent EXAFS investigation of La{1-x}Ca{x}MnO3 is presented
for the concentration range that spans the ferromagnetic-insulator (FMI) to
ferromagnetic-metal (FMM) transition region, x = 0.16-0.22. The samples are
insulating for x = 0.16-0.2 and show a metal/insulator transition for x = 0.22.
All samples are ferromagnetic although the saturation magnetization for the 16%
Ca sample is only ~ 70% of the expected value at 0.4T. We find that the FMI
samples have similar correlations between changes in the local Mn-O distortions
and the magnetization as observed previously for the colossal magnetoresistance
(CMR) samples (0.2 < x < 0.5) - except that the FMI samples never become fully
magnetized. The data show that there are at least two distinct types of
distortions. The initial distortions removed as the insulating sample becomes
magnetized are small and provides direct evidence that roughly 50% of the Mn
sites have a small distortion/site and are magnetized first. The large
remaining Mn-O distortions at low T are attributed to a small fraction of
Jahn-Teller-distorted Mn sites that are either antiferromagnetically ordered or
unmagnetized. Thus the insulating samples are very similar to the behavior of
the CMR samples up to the point at which the M/I transition occurs for the CMR
materials. The lack of metallic conductivity for x <= 0.2, when 50% or more of
the sample is magnetic, implies that there must be preferred magnetized Mn
sites and that such sites do not percolate at these concentrations.
","[{""version"":""v1"",""created"":""Sat, 11 Aug 2007 07:10:53 GMT""}]","2009-11-13"
"0708.1548","Galina L. Klimchitskaya","B. Geyer, G. L. Klimchitskaya, U. Mohideen and V. M. Mostepanenko","Comment on ``Precision measurement of the Casimir-Lifshitz force in a
  fluid''","5 pages, 1 figure, submitted to Physical Review A; corrections are
  made in accordance to referee's suggestions","Phys. Rev. A, v.77, N3, p.036102-(1-3) (2008).","10.1103/PhysRevA.77.036102",,"physics.atom-ph cond-mat.stat-mech physics.gen-ph quant-ph",,"  Recently J.N. Munday and F. Capasso [Phys. Rev. A {\bf 75}, 060102(R) (2007);
arXiv:0705.3793] claimed that they have performed a precision measurement of
the Casimir force between a sphere and a plate coated with Au, both immersed in
ethanol. The measurement results were claimed to be consistent with the
Lifshitz theory. We demonstrate that the calculation of the Casimir force
between the smooth bodies following the authors prescription has a discrepancy
up to 25% with respect to authors result. We show also that the attractive
electrostatic force only due to the surface potential differences was
underestimated by a factor of 590 and the charge double layer interaction was
not taken into account. All this leads to the conclusion that the results of
this experiment are in fact uncertain.
","[{""version"":""v1"",""created"":""Sat, 11 Aug 2007 07:50:59 GMT""},{""version"":""v2"",""created"":""Fri, 16 Nov 2007 12:50:39 GMT""}]","2009-11-13"
"0708.1549","Chunhui Chen","BaBar Collaboration: B. Aubert, et al","Improved Measurement of Time-Dependent CP Asymmetries and the CP-Odd
  Fraction in the Decay B0->D*+D*-","Minor changes of the text and reference for the publication","Phys.Rev.D76:111102,2007","10.1103/PhysRevD.76.111102","SLAC-PUB-12725","hep-ex",,"  We present an updated measurement of the CP-odd fraction and the
time-dependent CP asymmetries in the decay B0->D*+D*-using (383 +/- 4) \times
10^{6} BB pairs collected with the Babar detector. We determine the CP-odd
fraction to be $0.143\pm0.034\stat\pm0.008\syst$. The time-dependent CP
asymmetry parameters are determined to be $C_+ = -0.05\pm 0.14\stat \pm
0.02\syst$ and $S_+ = -0.72 \pm 0.19\stat \pm 0.05\syst$. The non-zero value of
the measured $S_+$ indicates the evidence of CP violation at the $3.7 \sigma$
confidence level.
","[{""version"":""v1"",""created"":""Sat, 11 Aug 2007 08:07:03 GMT""},{""version"":""v2"",""created"":""Wed, 2 Jan 2008 21:04:57 GMT""}]","2010-04-12"
"0708.1550","Giuseppe Della Sala","Giuseppe Della Sala","Liouville-type theorems for foliations with complex leaves","31 pages, no figures",,,,"math.CV",,"  We discuss various problems regarding the structure of the foliation of some
foliated submanifolds S of C^n, in particular Levi flat ones. As a general
scheme, we suppose that S is bounded along a coordinate (or a subset of
coordinates), and prove that the leaves of its foliation are complex planes.
","[{""version"":""v1"",""created"":""Sat, 11 Aug 2007 08:34:58 GMT""}]","2007-08-14"
"0708.1551","Chengming Bai","Chengming Bai","Left-symmetric Bialgebras and An Analogue of the Classical Yang-Baxter
  Equation","44 pages","Communications in Contemporary Mathematics 10 (2008) 221-260","10.1142/S0219199708002752",,"math.QA math-ph math.MP",,"  We introduce a notion of left-symmetric bialgebra which is an analogue of the
notion of Lie bialgebra. We prove that a left-symmetric bialgebra is equivalent
to a symplectic Lie algebra with a decomposition into a direct sum of the
underlying vector spaces of two Lagrangian subalgebras. The latter is called a
parak\""ahler Lie algebra or a phase space of a Lie algebra in mathematical
physics. We introduce and study coboundary left-symmetric bialgebras and our
study leads to what we call ""$S$-equation"", which is an analogue of the
classical Yang-Baxter equation. In a certain sense, the $S$-equation associated
to a left-symmetric algebra reveals the left-symmetry of the products. We show
that a symmetric solution of the $S$-equation gives a parak\""ahler Lie algebra.
We also show that such a solution corresponds to the symmetric part of a
certain operator called ""${\cal O}$-operator"", whereas a skew-symmetric
solution of the classical Yang-Baxter equation corresponds to the
skew-symmetric part of an ${\cal O}$-operator. Thus a method to construct
symmetric solutions of the $S$-equation (hence parak\""ahler Lie algebras) from
${\cal O}$-operators is provided. Moreover, by comparing left-symmetric
bialgebras and Lie bialgebras, we observe that there is a clear analogue
between them and, in particular, parak\""ahler Lie groups correspond to
Poisson-Lie groups in this sense.
","[{""version"":""v1"",""created"":""Sat, 11 Aug 2007 08:49:50 GMT""}]","2008-04-24"
"0708.1552","Varun Raghunathan","Varun Raghunathan, David Borlaug, Robert Rice, and Bahram Jalali","Demonstration of a mid infrared silicon Raman amplifier","8 pages, 5 figures",,"10.1364/OE.15.014355",,"physics.optics",,"  We demonstrate for the first time a mid infrared silicon Raman amplifier.
Amplification of 12 dB is reported for a signal at 3.39 micron wavelength. The
active medium was a 2.5 cm long silicon sample that was pumped with 5ns pulses
at 2.88 micron. The absence of the nonlinear losses which severely limit the
performance of silicon Raman devices in the near infrared combined with
unsurpassed crystal quality, high thermal conductivity render silicon a very
attractive Raman medium. Such a technology can potentially extend silicon
photonics application beyond data communication in the near infrared and into
the mid infrared world of remote sensing, biochemical detection and laser
medicine.
","[{""version"":""v1"",""created"":""Sat, 11 Aug 2007 09:14:24 GMT""}]","2009-11-13"
"0708.1553","Huanjun Zhang","Guoli Liu, Huanjun Zhang","Single top production associated with a neutral scalar at LHC in
  topcolor-assisted technicolor","7 pages, 3 figs",,"10.1088/1674-1137/32/9/004",,"hep-ph",,"  The topcolor-assisted technicolor (TC2) model predicts a number of neutral
scalars like the top-pion ($\pi^0_t$) and the top-Higgs ($h^0_t$). These
scalars have flavor-changing neutral-current (FCNC) top quark couplings, among
which the top-charm transition couplings may be sizable. Such FCNC couplings
induce single top productions associated with a neutral scalar at the CERN
Large Hadron Collider (LHC) through the parton processes $cg \to t \pi_t^0$ and
$cg \to t h_t^0$. In this note we examine these productions and find their
production rates can exceed the $3\sigma$ sensitivity of the LHC in a large
part of parameter space. Since in the Standard Model and the minimal
supersymmetric model such rare productions have unobservably small production
rates at the LHC, these rare processes will serve as a good probe for the TC2
model.
","[{""version"":""v1"",""created"":""Sat, 11 Aug 2007 09:14:31 GMT""}]","2015-05-13"
"0708.1554","Hai-Long Her","Hai-Long Her","Floer Homology for Symplectomorphism","41 pages",,,,"math.SG",,"  Let (M,\omega) be a compact symplectic manifold, and \phi be a symplectic
diffeomorphism on M, we define a Floer-type homology FH_*(\phi) which is a gen-
eralization of Floer homology for symplectic fixed points defined by Dostoglou
and Salamon for monotone symplectic manifolds. These homology groups are
modules over a suitable Novikov ring and depend only on \phi up to a
Hamiltonian isotopy.
","[{""version"":""v1"",""created"":""Sat, 11 Aug 2007 09:50:37 GMT""}]","2007-08-14"
"0708.1555","Vadim Varlamov","V. V. Varlamov","Functions of representations of the class 1 on the homogeneous spaces of
  the de Sitter group","2 pages","Differential Equations, Theory of Functions, and Applications.
  International Conference Dedicated to the Centennial of Academician I. N.
  Vekua (May 28 - June 2, 2007, Novosibirsk, Russia). Abstracts, P. 410-411",,,"math-ph math.MP",,"  Matrix elements and spherical functions of irreducible representations of the
de Sitter group are studied on the various homogeneous spaces of this group.
","[{""version"":""v1"",""created"":""Sat, 11 Aug 2007 09:53:13 GMT""}]","2007-08-14"
"0708.1557","Andrzej Frydryszak","A. M. Frydryszak","Nilpotent Fuzz","10 pages, no figures, talk given at the XVIth International
  Colloquium on Integrable Systems and Quantum symmetries (ISQS-16), Prague
  2007. New references added. Properties of the first order nilpotent curves
  given","Rept.Math.Phys.61:229-237,2008","10.1016/S0034-4877(08)80011-0",,"hep-th",,"  We present a construction of the formalism where fundamental variables are
nilpotent, but in contrast to the supermathematics, commutative. This gives
another possibility to realize classically the Pauli exclusion principle. We
sketch the relevant formalism and discuss simple model of the nilpotent
oscillator to illustrate the generalized nilpotent mechanics.
","[{""version"":""v1"",""created"":""Sat, 11 Aug 2007 09:55:08 GMT""},{""version"":""v2"",""created"":""Sat, 8 Dec 2007 17:57:10 GMT""}]","2008-11-26"
"0708.1558","Luca Giuzzi","A. Aguglia, L. Giuzzi","Construction of a 3-Dimensional MDS code","8 Pages Minor typesetting changes; dedication","Contributions to Discrete Mathematics 3 no. 1: 39-46 (2007)",,,"cs.IT math.IT",,"  In this paper, we describe a procedure for constructing $q$--ary
$[N,3,N-2]$--MDS codes, of length $N\leq q+1$ (for $q$ odd) or $N\leq q+2$ (for
$q$ even), using a set of non--degenerate Hermitian forms in $PG(2,q^2)$.
","[{""version"":""v1"",""created"":""Sat, 11 Aug 2007 10:26:31 GMT""},{""version"":""v2"",""created"":""Tue, 18 Sep 2007 13:45:26 GMT""}]","2009-07-19"
"0708.1559","Zhi-Yong Wang","Zhi-Yong Wang, Cai-Dong Xiong","Investigation on the superluminality of evanescent modes via quantum
  Lorentz transformation","15 pages, no figure",,,,"quant-ph",,"  Applying the fact that guided photons inside a waveguide can be treated as
massive particles, one can study the superluminality of evanescent modes via
showing that a massive particle can propagate over a spacelike interval, which
corresponds to quantum tunneling effects. For this purpose, we treat the
particle as a quantum reference frame, while attach an inertia observer to a
classical reference frame, and then quantize the formulae for the Lorentz
transformation between the quantum and classical reference frames, from which
we obtain the conclusion that, owing to the Heisenberg's uncertainty relation,
the particle can propagate over a spacelike interval.
","[{""version"":""v1"",""created"":""Sat, 11 Aug 2007 10:26:53 GMT""},{""version"":""v2"",""created"":""Fri, 24 Aug 2007 15:15:36 GMT""},{""version"":""v3"",""created"":""Mon, 7 Apr 2008 02:27:32 GMT""},{""version"":""v4"",""created"":""Mon, 12 May 2008 00:35:42 GMT""}]","2008-05-12"
"0708.1560","Ralf Gramlich","Ralf K\""ohl","Defining amalgams of compact Lie groups",,"J. Lie Theory 16 (2006), 1-18",,,"math.GR",,"  For $n \geq 2$ let $\Delta$ be a Dynkin diagram of rank $n$ and let $I = {1,
>..., n}$ be the set of labels of $\Delta$. A group $G$ admits a weak Phan
system of type $\Delta$ over $\mathbb{C}$ if $G$ is generated by subgroups
$U_i$, $i \in I$, which are central quotients of simply connected compact
semisimple Lie groups of rank one, and contains subgroups $U_{i,j} = \gen{U_i
,U_j}$, $i \neq j \in I$, which are central quotients of simply connected
compact semisimple Lie groups of rank two such that $U_i$ and $U_j$ are rank
one subgroups of $U_{i,j}$ corresponding to a choice of a maximal torus and a
fundamental system of roots for $U_{i,j}$. It is shown in this article that $G$
then is a central quotient of the simply connected compact semisimple Lie group
whose complexification is the simply connected complex semisimple Lie group of
type $\Delta$.
","[{""version"":""v1"",""created"":""Sat, 11 Aug 2007 11:50:37 GMT""}]","2011-08-18"
