"0708.1601","Aleksandar Ivic","Aleksandar Ivi\'c","On the mean square of the divisor function in short intervals","11 pages","J. Th\'eorie des Nombres Bordeaux 21(2009), 195-205",,,"math.NT","http://arxiv.org/licenses/nonexclusive-distrib/1.0/","  We provide upper bounds for the mean square integral $$
\int_X^{2X}(\Delta_k(x+h) - \Delta_k(x))^2 dx \qquad(h = h(X)\gg1, h = o(x)
{\roman{as}} X\to\infty) $$ where $h$ lies in a suitable range. For $k\ge2$ a
fixed integer, $\Delta_k(x)$ is the error term in the asymptotic formula for
the summatory function of the divisor function $d_k(n)$, generated by
$\zeta^k(s)$.
","[{""version"":""v1"",""created"":""Sun, 12 Aug 2007 08:50:48 GMT""},{""version"":""v2"",""created"":""Mon, 19 Jan 2009 08:05:51 GMT""}]","2010-01-23"
"0708.1602","Richard J. Furnstahl","S.K. Bogner, R.J. Furnstahl, R.J. Perry","Three-Body Forces Produced by a Similarity Renormalization Group
  Transformation in a Simple Model","25 pages, 18 figures, minor typos corrected and references updated","AnnalsPhys.323:1478-1501,2008","10.1016/j.aop.2007.09.001",,"nucl-th cond-mat.str-el hep-ph",,"  A simple class of unitary renormalization group transformations that force
hamiltonians towards a band-diagonal form produce few-body interactions in
which low- and high-energy states are decoupled, which can greatly simplify
many-body calculations. One such transformation has been applied to
phenomenological and effective field theory nucleon-nucleon interactions with
success, but further progress requires consistent treatment of at least the
three-nucleon interaction. In this paper we demonstrate in an extremely simple
model how these renormalization group transformations consistently evolve two-
and three-body interactions towards band-diagonal form, and introduce a
diagrammatic approach that generalizes to the realistic nuclear problem.
","[{""version"":""v1"",""created"":""Sun, 12 Aug 2007 13:12:28 GMT""},{""version"":""v2"",""created"":""Thu, 25 Oct 2007 21:42:16 GMT""}]","2008-11-26"
"0708.1603","Daniel Whalen","Daniel Whalen, Brian W. O'Shea, Joseph Smidt, Michael L. Norman","How the First Stars Regulated Local Star Formation I: Radiative Feedback","20 pages, 19 figures, accepted by ApJ, title and abstract changed","Astrophys.J.579:925-941,2008","10.1086/587731","LA-UR 07-4743","astro-ph",,"  We present numerical simulations of how a 120 M$_\odot$ primordial star
regulates star formation in nearby cosmological halos at $z \sim$ 20 by
photoevaporation. Our models include nine-species primordial chemistry and
self-consistent multifrequency conservative transfer of UV photons with all
relevant radiative processes. Whether or not new stars form in halos clustered
around a Population III star ultimately depends on their core densities and
proximity to the star. Diffuse halos with central densities below 2 - 3
cm$^{-3}$ are completely ionized and evaporated anywhere in the cluster.
Evolved halos with core densities above 2000 cm$^{-3}$ are impervious to both
ionizing and Lyman-Werner flux at most distances from the star and collapse as
quickly as they would in its absence. Star formation in halos of intermediate
density can be either promoted or suppressed depending on how the I-front
remnant shock compresses, deforms and enriches the core with H$_2$. We find
that the 120 M$_\odot$ star photodissociates H$_2$ in most halos in the cluster
but that catalysis by H- restores it a few hundred kyr after the death of the
star, with little effect on star formation. Our models exhibit significant
departures from previous one-dimensional spherically-symmetric simulations,
which are prone to serious errors due to unphysical geometric focusing effects.
","[{""version"":""v1"",""created"":""Sun, 12 Aug 2007 11:24:48 GMT""},{""version"":""v2"",""created"":""Thu, 6 Dec 2007 07:44:47 GMT""},{""version"":""v3"",""created"":""Thu, 14 Feb 2008 15:29:06 GMT""}]","2008-12-18"
"0708.1604","Oleg Karpenkov","O. Karpenkov","On determination of periods of geometric continued fractions for
  two-dimensional algebraic hyperbolic operators",,,,,"math.NT",,"  For a given sequence of positive integers we make an explicit construction of
a reduced hyperbolic operator in SL(2,z) with the sequence as a period of a
geometric continued fraction in the sense of Klein. Further we experimentally
study an algorithm to construct a period for an arbitrary operator of SL(2,z)
(the Gauss Reduction Theory).
","[{""version"":""v1"",""created"":""Sun, 12 Aug 2007 11:34:17 GMT""}]","2007-08-14"
"0708.1605","Nikolay Tyurin","Nik. Tyurin","On families of $BS_{can}$ lagrangian tori in projective spaces","4 pages without figas",,,,"math.SG",,"  This small note contains two simple remarks about Bohr - Sommerfeld with
respect to the anticanonical class lagrangian tori in the projective spaces,
which are the most popular examples of monotone symplectic manifolds.
","[{""version"":""v1"",""created"":""Sun, 12 Aug 2007 11:42:23 GMT""}]","2007-08-14"
"0708.1606","Mika Juvela","M. Juvela (1), V.-M.Pelkonen (1), P. Padoan (2), K. Mattila (1) ((1)
  Helsinki University Observatory, (2) Department of Physics, UCSD)","A Corona Australis cloud filament seen in NIR scattered light I.
  Comparison with extinction of background stars","14 pages, 15 figures, accepted to A&A, the version includes small
  changes in the text and an added appendix",,"10.1051/0004-6361:20078470",,"astro-ph",,"  With current near-infrared (NIR) instruments the near-infrared light
scattered from interstellar clouds can be mapped over large areas. The surface
brightness carries information on the line-of-sight dust column density.
Therefore, scattered light could provide an important tool to study mass
distribution in quiescent interstellar clouds at a high, even sub-arcsecond
resolution. We wish to confirm the assumption that light scattering dominates
the surface brightness in all NIR bands. Furthermore, we want to show that
scattered light can be used for an accurate estimation of dust column densities
in clouds with Av in the range 1-15mag. We have obtained NIR images of a
quiescent filament in the Corona Australis molecular cloud. The observations
provide maps of diffuse surface brightness in J, H, and Ks bands. Using the
assumption that signal is caused by scattered light we convert surface
brightness data into a map of dust column density. The same observations
provide colour excesses for a large number of background stars. These data are
used to derive an extinction map of the cloud. The two, largely independent
tracers of the cloud structure are compared. Results. In regions below Av=15m
both diffuse surface brightness and background stars lead to similar column
density estimates. The existing differences can be explained as a result of
normal observational errors and bias in the sampling of extinctions provided by
the background stars. There is no indication that thermal dust emission would
have a significant contribution even in the Ks band. The results show that,
below Av=15mag, scattered light does provide a reliable way to map cloud
structure. Compared with the use of background stars it can also in practice
provide a significantly higher spatial resolution.
","[{""version"":""v1"",""created"":""Sun, 12 Aug 2007 12:01:37 GMT""},{""version"":""v2"",""created"":""Wed, 9 Jan 2008 07:27:55 GMT""}]","2009-11-13"
"0708.1607","Elisabetta Caffau","Elisabetta Caffau (GEPI), Matthias Steffen (AIP), Luca Sbordone (GEPI,
  CIFIST), Hans-G. Ludwig (GEPI, CIFIST), Piercarlo Bonifacio (GEPI, CIFIST,
  INAF-OAT)","The solar photospheric abundance of phosphorus: results from co5bold 3D
  model atmospheres",,,"10.1051/0004-6361:20078370",,"astro-ph",,"  aims: We determine the solar abundance of phosphorus using co5bold 3D
hydrodynamic model atmospheres. method: High resolution, high signal-to-noise
solar spectra of the PI lines of Multiplet 1 at 1051-1068 nm are compared to
line formation computations performed on a co5bold solar model atmosphere.
results: We find A(P)=5.46+- 0.04, in good agreement with previous analysis
based on 1D model atmospheres, due to the fact that the PI lines of Mult. 1 are
little affected by 3D effects. We cannot confirm an earlier claim by other
authors of a downward revision of the solar P abundance by 0.1 dex employing a
3D model atmosphere. Concerning other stars, we found modest (<0.1 dex) 3D
abundance corrections for P among four F dwarf model atmospheres of different
metallicity, being largest at lowest metallicity. conclusions: We conclude that
3D abundance corrections are generally rather small for the PI lines studied in
this work. They are marginally relevant for metal-poor stars, but may be
neglected in the Sun.
","[{""version"":""v1"",""created"":""Sun, 12 Aug 2007 12:24:11 GMT""}]","2009-11-13"
"0708.1608","Uri Onn","Nir Avni, Uri Onn, Amritanshu Prasad and Leonid Vaserstein","Similarity classes of 3x3 matrices over a local principal ideal ring","14 pages, final version, to appear in Communications in Algebra","Communications in Algebra, volume 37, no. 8, pages 2601-2615,
  August 2009","10.1080/00927870902747266",,"math.GR math.RA",,"  In this paper similarity classes of three by three matrices over a local
principal ideal commutative ring are analyzed. When the residue field is
finite, a generating function for the number of similarity classes for all
finite quotients of the ring is computed explicitly.
","[{""version"":""v1"",""created"":""Sun, 12 Aug 2007 12:40:54 GMT""},{""version"":""v2"",""created"":""Mon, 5 May 2008 11:28:20 GMT""}]","2010-06-15"
"0708.1609","Grzegorz Wilk","Z. Wlodarczyk and G. Wilk","Cosmic rays from thermal sources","Enlarged version combining material presented by Z.Wlodarczyk at the
  XXX ICRC, 3-11 July 2007, Merida, Yucatan, Mexico, and by G.Wilk at the VIth
  Int. Workshop ""New Worlds in Astrop. Physics, 6-8 September 2007, Faro,
  Portugal; new material added",,,"XXX ICRC, 3-11 July 2007, Merida, Yucatan, Mexico","astro-ph hep-ph","http://arxiv.org/licenses/nonexclusive-distrib/1.0/","  Energy spectrum of cosmic rays (CR) exhibits power-like behavior with very
characteristic ""knee"" structure. We consider a generalized statistical model
for the production process of cosmic rays which accounts for such behavior in a
natural way either by assuming existence of temperature fluctuations in the
source of CR, or by assuming specific temperature distribution of CR sources.
Both possibilities yield the so called Tsallis statistics and lead to the
power-like distribution. We argue that the ""knee"" structure arises as result of
abrupt change of fluctuations in the source of CR. Its possible origin is
briefly discussed.
","[{""version"":""v1"",""created"":""Sun, 12 Aug 2007 13:32:31 GMT""},{""version"":""v2"",""created"":""Wed, 10 Oct 2007 14:47:00 GMT""},{""version"":""v3"",""created"":""Wed, 29 Oct 2008 12:46:52 GMT""}]","2011-11-28"
"0708.1610","Moty Schultz","Moty Schultz and Lior Klein","Relaxation of transport properties in electron doped SrTiO3",,,"10.1063/1.2795336",,"cond-mat.other",,"  We electron-dope single crystal samples of SrTiO_3 by exposing them to Ar^+
irradiation and observe carrier mobility similar in its magnitude and
temperature dependence to the carrier mobility in other electron-doped SrTiO3
systems. We find that some transport properties are time-dependent. In
particular, the sheet resistance increases with time at a temperature-dependent
rate, suggesting an activation barrier on the order of 1 eV. We attribute the
relaxation effects to diffusion of oxygen vacancies - a process with energy
barrier similar to the observed activation energy.
","[{""version"":""v1"",""created"":""Sun, 12 Aug 2007 13:55:32 GMT""}]","2009-11-13"
"0708.1611","Kourosh Nozari","Kourosh Nozari","DGP Cosmology with a Non-Minimally Coupled Scalar Field on the Brane","26 pages, 3 eps figures","JCAP 0709:003,2007","10.1088/1475-7516/2007/09/003",,"hep-th",,"  We construct a DGP inspired braneworld scenario where a scalar field
non-minimally coupled to the induced Ricci curvature is present on the brane.
First we investigate the status of gravitational potential with non-minimal
coupling and observational constraints on this non-minimal model. Then we
further deepen the idea of embedding of FRW cosmology in this non-minimal
setup. Cosmological implications of this scenario are examined with details and
the quintessence and late-time expansion of the universe within this framework
are examined. Some observational constraints imposed on this non-minimal
scenario are studied and relation of this model with dark radiation formalism
is determined with details.
","[{""version"":""v1"",""created"":""Sun, 12 Aug 2007 13:56:25 GMT""}]","2009-06-11"
"0708.1612","Yu Feng Zhou","Cheng-Wei Chiang and Yu-Feng Zhou","Flavor SU(3) analysis of charmless B->PP decays","3 pages, 2 figs. Talk given at EPS-HEP07 To appear in the
  proceedings, Reference added","J.Phys.Conf.Ser.110:052056,2008","10.1088/1742-6596/110/5/052056",,"hep-ph",,"  We perform a global fits to charmless $B \to PP$ decays which independently
constrain the $(\bar\rho,\bar\eta)$ vertex of the unitarity triangle. The
fitted amplitudes and phase are used to predict the branching ratios and CP
asymmetries of all decay modes, including those of the $B_s$ system. Different
schemes of SU(3) breaking in decay amplitude sizes are analyzed. The
possibility of having a new physics contribution to $K \pi$ decays is also
discussed.
","[{""version"":""v1"",""created"":""Sun, 12 Aug 2007 14:02:05 GMT""},{""version"":""v2"",""created"":""Tue, 21 Aug 2007 10:24:17 GMT""}]","2008-11-26"
