"0708.2323","Mohamad Ali Jafarizadeh","M. A. Jafarizadeh, M. Rezaei, N. Karimi, A. R. Amiri","Optimal Unambiguous Discrimination of Quantum States","33 pages, 4 figures",,"10.1103/PhysRevA.77.042314",,"quant-ph",,"  Unambiguously distinguishing between nonorthogonal but linearly independent
quantum states is a challenging problem in quantum information processing. In
this work, an exact analytic solution to an optimum measurement problem
involving an arbitrary number of pure linearly independent quantum states is
presented. To this end, the relevant semi-definite programming task is reduced
to a linear programming one with a feasible region of polygon type which can be
solved via simplex method. The strength of the method is illustrated through
some explicit examples. Also using the close connection between the
Lewenstein-Sanpera decomposition(LSD) and semi-definite programming approach,
the optimal positive operator valued measure for some of the well-known
examples is obtain via Lewenstein-Sanpera decomposition method. {\bf Keywords:}
Optimal Unambiguous State Discrimination, Linear Programming,
Lewenstein-Sanpera decomposition. {\bf PACs Index: 03.67.Hk, 03.65.Ta, 42.50.-p
","[{""version"":""v1"",""created"":""Fri, 17 Aug 2007 07:18:38 GMT""}]","2009-11-13"
"0708.2324","Christian Wuthrich","Hajnal Andreka (1), Istvan Nemeti (1) and Christian Wuthrich (2) ((1)
  Renyi Institute of Mathematics, Budapest, (2) University of California, San
  Diego)","A twist in the geometry of rotating black holes: seeking the cause of
  acausality","21 pages, 5 figures; replaced to match published version forthcoming
  in General Relativity and Gravitation","Gen.Rel.Grav.40:1809-1823,2008","10.1007/s10714-007-0577-1",,"gr-qc physics.hist-ph",,"  We investigate Kerr-Newman black holes in which a rotating charged
ring-shaped singularity induces a region which contains closed timelike curves
(CTCs). Contrary to popular belief, it turns out that the time orientation of
the CTC is opposite to the direction in which the singularity or the ergosphere
rotates. In this sense, CTCs ""counter-rotate"" against the rotating black hole.
We have similar results for all spacetimes sufficiently familiar to us in which
rotation induces CTCs. This motivates our conjecture that perhaps this
counter-rotation is not an accidental oddity particular to Kerr-Newman
spacetimes, but instead there may be a general and intuitively comprehensible
reason for this.
","[{""version"":""v1"",""created"":""Fri, 17 Aug 2007 07:46:42 GMT""},{""version"":""v2"",""created"":""Mon, 14 Jan 2008 17:16:00 GMT""}]","2012-07-04"
"0708.2325","Victor Barsan","Victor Barsan","A two-parameter generalization of the complete elliptic integral of
  second kind",,,,,"math-ph math.MP",,"  A two-parameter generalization of the complete elliptic integral of second
kind is expressed in terms of the Appell function $F_{4}$. This function is
further reduced to a quite simple bilinear form in the complete elliptic
integrals $K$ and $E$. The physical applications are briefly mentioned.
","[{""version"":""v1"",""created"":""Fri, 17 Aug 2007 07:37:54 GMT""}]","2007-08-20"
"0708.2326","Stephen Wilson","Stephen D. Wilson, Shiliang Li, Jun Zhao, Gang Mu, Hai-hu Wen, Jeffrey
  W. Lynn, Paul G. Freeman, Louis-Pierre Regnault, Klaus Habicht, Pengcheng Dai","Quantum spin correlations through the superconducting-normal phase
  transition in electron-doped superconducting Pr0.88LaCe0.12CuO4-d","PDF Format: 35 pages, 4 main text figures, 6 supplemental figures;
  Accepted for publication in PNAS",,"10.1073/pnas.0704822104",,"cond-mat.supr-con cond-mat.str-el",,"  The quantum spin fluctuations of the S = 1/2 Cu ions are important in
determining the physical properties of the high-transition temperature
(high-Tc) copper oxide superconductors, but their possible role in the electron
pairing for superconductivity remains an open question. The principal feature
of the spin fluctuations in optimally doped high-Tc superconductors is a well
defined magnetic resonance whose energy (Er) tracks Tc (as the composition is
varied) and whose intensity develops like an order parameter in the
superconducting state. We show that the suppression of superconductivity and
its associated condensation energy by a magnetic field in the electron-doped
high-Tc superconductor, Pr0.88LaCe0.12CuO4-d (Tc = 24 K), is accompanied by the
complete suppression of the resonance and the concomitant emergence of static
antiferromagnetic (AF) order. Our results demonstrate that the resonance is
intimately related to the superconducting condensation energy, and thus suggest
that it plays a role in the electron pairing and superconductivity.
","[{""version"":""v1"",""created"":""Fri, 17 Aug 2007 07:45:09 GMT""}]","2009-11-13"
"0708.2327","Alireza Abdollahi","Alireza Abdollahi and A. Mohammadi Hassanabadi","Non-cyclic graph of a group",,,,,"math.GR math.CO",,"  We associate a graph $\Gamma_G$ to a non locally cyclic group $G$ (called the
non-cyclic graph of $G$) as follows: take $G\backslash Cyc(G)$ as vertex set,
where $Cyc(G)=\{x\in G | \left<x,y\right> \text{is cyclic for all} y\in G\}$,
and join two vertices if they do not generate a cyclic subgroup. We study the
properties of this graph and we establish some graph theoretical properties
(such as regularity) of this graph in terms of the group ones. We prove that
the clique number of $\Gamma_G$ is finite if and only if $\Gamma_G$ has no
infinite clique. We prove that if $G$ is a finite nilpotent group and $H$ is a
group with $\Gamma_G\cong\Gamma_H$ and $|Cyc(G)|=|Cyc(H)|=1$, then $H$ is a
finite nilpotent group.
  We give some examples of groups $G$ whose non-cyclic graphs are ``unique'',
i.e., if $\Gamma_G\cong \Gamma_H$ for some group $H$, then $G\cong H$. In view
of these examples, we conjecture that every finite non-abelian simple group has
a unique non-cyclic graph. Also we give some examples of finite non-cyclic
groups $G$ with the property that if $\Gamma_G \cong \Gamma_H$ for some group
$H$, then $|G|=|H|$. These suggest the question whether the latter property
holds for all finite non-cyclic groups.
","[{""version"":""v1"",""created"":""Fri, 17 Aug 2007 07:57:49 GMT""}]","2007-08-20"
"0708.2328","Maxim Dvornikov","Maxim Dvornikov (University of Jyv\""askyl\""a and IZMIRAN)","Neutrino oscillations in matter and in twisting magnetic fields","13 pages, 1 eps figure, RevTeX4. The paper was significantly revised.
  Title was changed, two new sections (Secs. IV and V), devoted to quantum
  mechanical treatment of neutrino oscillations and possible applications, were
  added. Many examples were included throughout the text. Final version to be
  published in J. Phys. G","J.Phys.G35:025003,2008","10.1088/0954-3899/35/2/025003",,"hep-ph hep-th",,"  We find the solution to the Dirac equation for a massive neutrino with a
magnetic moment propagating in background matter and interacting with the
twisting magnetic field. In frames of the relativistic quantum mechanics
approach to the description of neutrino evolution we use the obtained solution
to derive neutrino wave functions satisfying the given initial condition. We
apply the results to the analysis of neutrino spin oscillations in matter under
the influence of the twisting magnetic field. Then on the basis of the yielded
results we describe spin-flavor oscillations of Dirac neutrinos that mix and
have non-vanishing matrix of magnetic moments. We again formulate the initial
condition problem, derive neutrinos wave functions and calculate the transition
probabilities for different magnetic moments matrices. The consistency of the
obtained results with the quantum mechanical treatment of spin-flavor
oscillations is discussed. We also consider several applications to
astrophysical and cosmological neutrinos.
","[{""version"":""v1"",""created"":""Fri, 17 Aug 2007 08:00:05 GMT""},{""version"":""v2"",""created"":""Fri, 30 Nov 2007 13:08:23 GMT""}]","2008-11-26"
"0708.2329","Nicolai Nygaard","N. Nygaard, R. Piil and K. Molmer","Feshbach Molecules in a One-dimensional Optical Lattice","4 pages, 3 figures","Phys. Rev. A 77, 021601(R) (2008)","10.1103/PhysRevA.77.021601",,"cond-mat.other quant-ph",,"  We present the theory of a pair of atoms in a one-dimensional optical lattice
interacting via a narrow Feshbach resonance. Using a two-channel description of
the resonance, we derive analytic results for the scattering states inside the
continuum band and the discrete bound states outside the band. We identify a
Fano resonance profile, and the survival probability of a molecule when swept
through the Bloch band of scattering states by varying an applied magnetic
field. We discuss how these results may be used to investigate the importance
of the structured nature of the continuum in experiments.
","[{""version"":""v1"",""created"":""Fri, 17 Aug 2007 08:00:10 GMT""},{""version"":""v2"",""created"":""Tue, 5 Feb 2008 07:45:13 GMT""}]","2008-02-05"
"0708.2330","Jean Berney","Jean Berney, Marcia T. Portella-Oberli and Benoit Deveaud","Light dressed-excitons in an incoherent-electron sea: Evidence for
  Mollow-triplet and Autler-Townes doublet",,,"10.1103/PhysRevB.77.121301",,"cond-mat.mtrl-sci",,"  We demonstrate that the interaction between excitons and a sea of incoherent
electrons does not preclude excitons dressing by light. We investigate the role
of exciton-electron scattering in the light dressing by measuring the dynamical
absorption spectrum of a modulation-doped CdTe quantum well, which shows a
clear evidence for significant electron scattering of the excitonic states. We
show the occurrence of dressed and correlated excitons by detecting quantum
coherent interferences through excitonic Autler-Townes doublet and ac Stark
splitting, which evolves to Mollow triplet with gain. We also evidence the
partial inhibition of the electron-exciton scattering by exciton-light
coupling.
","[{""version"":""v1"",""created"":""Fri, 17 Aug 2007 08:28:57 GMT""}]","2009-11-13"
"0708.2331","Gopakumar Gopinadhanpillai","G. Gopakumar, Minh Tho Nguyen and Arnout Ceulemans","The Boron Buckyball has an Unexpected Th Symmetry","10 pages, 1 Table, 2 Figures",,"10.1016/j.cplett.2007.11.030",,"cond-mat.other",,"  The boron buckyball avoids the high symmetry icosahedral cage structure. The
previously reported Ih symmetric structure is not an energy minimum in the
potential energy surface and exhibits a spontaneous symmetry breaking to yield
a puckered cage with a rare Th symmetry. The HOMO-LUMO gap is twice as large as
the reported value and amounts to 1.94 eV at B3LYP/6-31G(d) level. The valence
orbital structure of boron buckyball is identical to the one in the carbon
analogue.
","[{""version"":""v1"",""created"":""Fri, 17 Aug 2007 08:49:53 GMT""},{""version"":""v2"",""created"":""Tue, 11 Dec 2007 08:43:01 GMT""}]","2007-12-11"
"0708.2332","TianXin Li","TianXin Li, PingPing Chen, DaYuan Xiong, ZhaoLin Liu, XuMing Zhang,
  ChangSheng Xia, ZhiFeng Li, XiaoShuang Chen and Wei Lu","Metastable state involved resonant tunneling through single InAs/GaAs
  quantum dot","12 pages, 6 figures",,,,"quant-ph",,"  A scheme of resonant tunneling through the metastable state of semiconductor
quantum dot is presented and implemented in the transport study of freestanding
InAs quantum dots grown on GaAs(001) under illumination using conductive atomic
force microscopy. The metastable state is achieved by capturing one
photoexcited Fermi hole in the valence energy level of InAs quantum dot.
Resonant tunneling through single quantum dot can be observed at room
temperature due to the existence of metastable state. The amplitude of
tunneling current depends on the barrier arrangement and the concentration of
photoexcited holes around the quantum dot, but is found steady when the height
of dot varies from 1.8 to 9.9 nm, which are in good agreement with the proposed
model. The experiment demonstrates a solution of room temperature operated
single electron device to amplify the photocurrent by the singularity of
resonant tunneling in epitaxial quantum dot.
","[{""version"":""v1"",""created"":""Fri, 17 Aug 2007 09:01:49 GMT""}]","2007-08-20"
"0708.2333","Ming Shi","M. Shi, J. Chang, S. Pailh\'es, M. R. Norman, J. C. Campuzano, M.
  Mansson, T. Claesson, O. Tjernberg, A. Bendounan, L. Patthey, N. Momono, M.
  Oda, M. Ido, C. Mudry and J. Mesot","The coherent {\it d}-wave superconducting gap in underdoped
  La$_{2-x}$Sr$_{x}$CuO$_4$ as studied by angle-resolved photoemission","Accepted by Phys. Rev. Lett","Phys. Rev. Lett 101, 047002 (2008)","10.1103/PhysRevLett.101.047002",,"cond-mat.supr-con cond-mat.str-el","http://arxiv.org/licenses/nonexclusive-distrib/1.0/","  We present angle-resolved photoemission spectroscopy (ARPES) data on
moderately underdoped La$_{1.855}$Sr$_{0.145}$CuO$_4$ at temperatures below and
above the superconducting transition temperature. Unlike previous studies of
this material, we observe sharp spectral peaks along the entire underlying
Fermi surface in the superconducting state. These peaks trace out an energy gap
that follows a simple {\it d}-wave form, with a maximum superconducting gap of
14 meV. Our results are consistent with a single gap picture for the cuprates.
Furthermore our data on the even more underdoped sample
La$_{1.895}$Sr$_{0.105}$CuO$_4$ also show sharp spectral peaks, even at the
antinode, with a maximum superconducting gap of 26 meV.
","[{""version"":""v1"",""created"":""Fri, 17 Aug 2007 09:57:29 GMT""},{""version"":""v2"",""created"":""Sun, 27 Jul 2008 08:43:57 GMT""}]","2009-11-13"
"0708.2334","Mikhail V. Fistul","M. V. Fistul, V. M. Vinokur, T. I. Baturina","Collective transport in the insulating state of Josephson junction
  arrays","4 pages, 2 figures; typos corrected, new figures, an improved fit to
  experimental data",,"10.1103/PhysRevLett.100.086805",,"cond-mat.supr-con cond-mat.mes-hall",,"  We investigate collective Cooper-pair transport of one- and two-dimensional
Josephson junction arrays in the insulating state. We derive an analytical
expression for the current-voltage characteristic revealing thermally activated
conductivity at small voltages and threshold voltage depinning. The activation
energy and the related depinning voltage represent a dynamic Coulomb barrier
for collective charge transfer over the whole system and scale with the system
size. We show that both quantities are non-monotonic functions of magnetic
field. We propose that formation of the dynamic Coulomb barrier as well as the
size scaling of the activation energy and the depinning threshold voltage, are
consequences of the mutual phase synchronization. We apply the results for
interpretation of experimental data in disordered films near the
superconductor-insulator transition.
","[{""version"":""v1"",""created"":""Fri, 17 Aug 2007 10:46:46 GMT""},{""version"":""v2"",""created"":""Mon, 22 Oct 2007 13:42:35 GMT""}]","2009-11-13"
"0708.2335","Vladimir Fedoseyev","V. G. Fedoseyev","2D shift of the centre of gravity of the light beam carrying orbital
  angular momentum, which accompanies reflection from a lossy medium","16 pages, 10 figures",,,,"physics.optics",,"  It is shown that after reflection from a lossy medium the $s$- or
$p$-polarized paraxial light beam carrying the orbital angular momentum suffers
the 2D shift of the beam's centre of gravity relative the geometric optic axis.
The mutually orthogonal components of this shift are expressed through the real
and imaginary parts of the common complex quantity. The features of the 2D
vector, which describes the shift, are analyzed.
","[{""version"":""v1"",""created"":""Fri, 17 Aug 2007 09:31:38 GMT""}]","2007-08-20"
"0708.2336","Dominik Scheder","Dominik Scheder","Unsatisfiable Linear k-CNFs Exist, for every k","11 pages",,,,"cs.DM cs.CC cs.LO",,"  We call a CNF formula linear if any two clauses have at most one variable in
common. Let Linear k-SAT be the problem of deciding whether a given linear
k-CNF formula is satisfiable. Here, a k-CNF formula is a CNF formula in which
every clause has size exactly k. It was known that for k >= 3, Linear k-SAT is
NP-complete if and only if an unsatisfiable linear k-CNF formula exists, and
that they do exist for k >= 4. We prove that unsatisfiable linear k-CNF
formulas exist for every k. Let f(k) be the minimum number of clauses in an
unsatisfiable linear k-CNF formula. We show that f(k) is Omega(k2^k) and
O(4^k*k^4), i.e., minimum size unsatisfiable linear k-CNF formulas are
significantly larger than minimum size unsatisfiable k-CNF formulas. Finally,
we prove that, surprisingly, linear k-CNF formulas do not allow for a larger
fraction of clauses to be satisfied than general k-CNF formulas.
","[{""version"":""v1"",""created"":""Fri, 17 Aug 2007 09:44:21 GMT""}]","2007-08-20"
"0708.2337","Yuri Levin","R. G. Berkhout (Leiden Observatory) and Yuri Levin (Leiden Observatory
  and Lorentz Institute)","Evolution of the bursting-layer wave during a Type 1 X-ray burst","8 pages, submitted to MNRAS",,"10.1111/j.1365-2966.2008.12897.x",,"astro-ph",,"  In a popular scenario due to Heyl, quasi periodic oscillations (QPOs) which
are seen during type 1 X-ray bursts are produced by giant travelling waves in
neutron-star oceans. Piro and Bildsten have proposed that during the burst
cooling the wave in the bursting layer may convert into a deep crustal
interface wave, which would cut off the visible QPOs. This cut-off would help
explain the magnitude of the QPO frequency drift, which is otherwise
overpredicted by a factor of several in Heyl's scenario. In this paper, we
study the coupling between the bursting layer and the deep ocean. The coupling
turns out to be weak and only a small fraction of the surface-wave energy gets
transferred to that of the crustal-interface wave during the burst. Thus the
crustal-interface wave plays no dynamical role during the burst, and no early
QPO cut-off should occur.
","[{""version"":""v1"",""created"":""Fri, 17 Aug 2007 10:10:07 GMT""}]","2009-11-13"
"0708.2338","Toshiya Hikihara","Toshiya Hikihara, Shoji Yamamoto","Magnetic Phase Diagram of Spin-1/2 Two-Leg Ladder with Four-Spin Ring
  Exchange","18pages, 7 figures","J. Phys. Soc. Jpn. 77, 014709 (2008).","10.1143/JPSJ.77.014709",,"cond-mat.str-el",,"  We study the spin-1/2 two-leg Heisenberg ladder with four-spin ring exchanges
under a magnetic field. We introduce an exact duality transformation which is
an extension of the spin-chirality duality developed previously and yields a
new self-dual surface in the parameter space. We then determine the magnetic
phase diagram using the numerical approaches of the density-matrix
renormalization-group and exact diagonalization methods. We demonstrate the
appearance of a magnetization plateau and the Tomonaga-Luttinger liquid with
dominant vector-chirality quasi-long-range order for a wide parameter regime of
strong ring exchange. A ""nematic"" phase, in which magnons form bound pairs and
the magnon-pairing correlation functions dominate, is also identified.
","[{""version"":""v1"",""created"":""Fri, 17 Aug 2007 10:14:47 GMT""}]","2009-11-13"
"0708.2339","Takashi Inoue","Takashi Inoue","A pentaquark picture of Lambda(1405)","3 pages, 1 figure, to appear in the proceedings of the International
  Nuclear Physics Conference(INPC) 2007, June 3-8, Tokyo, Japan",,,,"hep-ph",,"  We test a pentaquark model of the negative parity hyperon Lambda(1405). We
use a model where valence four quarks and one antiquark move in a potential
relativistically and interact with each other and themselves through gluon and
NG boson. Fall-apart decay rate of the system is studied and strong model
dependence is pointed out.
","[{""version"":""v1"",""created"":""Fri, 17 Aug 2007 10:19:09 GMT""}]","2007-08-20"
"0708.2340","Lance Miller","L. Miller, T. D. Kitching, C. Heymans, A. F. Heavens, L. Van Waerbeke","Bayesian Galaxy Shape Measurement for Weak Lensing Surveys -I.
  Methodology and a Fast Fitting Algorithm","11 pages, 4 figures, accepted for publication in MNRAS",,"10.1111/j.1365-2966.2007.12363.x",,"astro-ph",,"  The principles of measuring the shapes of galaxies by a model-fitting
approach are discussed in the context of shape-measurement for surveys of weak
gravitational lensing. It is argued that such an approach should be optimal,
allowing measurement with maximal signal-to-noise, coupled with estimation of
measurement errors. The distinction between likelihood-based and Bayesian
methods is discussed. Systematic biases in the Bayesian method may be evaluated
as part of the fitting process, and overall such an approach should yield
unbiased shear estimation without requiring external calibration from
simulations. The principal disadvantage of model-fitting for large surveys is
the computational time required, but here an algorithm is presented that
enables large surveys to be analysed in feasible computation times. The method
and algorithm is tested on simulated galaxies from the Shear TEsting Program
(STEP).
","[{""version"":""v1"",""created"":""Fri, 17 Aug 2007 14:23:16 GMT""}]","2009-11-13"
"0708.2341","Hacene Belbachir","Hacene Belbachir (USTHB)","Unimodality of ordinary multinomials and maximal probabilities of
  convolution powers of discrete uniform distribution","8 pages",,,,"math.PR math.CO",,"  We establish the unimodality and the asymptotic strong unimodality of the
ordinary multinomials and give their smallest mode leading to the expression of
the maximal probability of convolution powers of the discrete uniform
distribution. We conclude giving the generating functions of the sequence of
generalized ordinary multinomials and for an extension of the sequence of
maximal probabilities for convolution power of discrete uniform distribution.
","[{""version"":""v1"",""created"":""Fri, 17 Aug 2007 10:57:06 GMT""}]","2007-08-20"
"0708.2342","Chiara Zanini","Chiara Zanini and Fabio Zanolin","Complex dynamics in a nerve fiber model with periodic coefficients","29 pages, 5 figures",,,,"math.DS",,"  We deal with the periodic boundary value problem for a second-order nonlinear
ODE which includes the case of the Nagumo type equation $v_{xx} - g v + n(x)
F(v) = 0,$ previously considered by Grindrod and Sleeman and by Chen and Bell
in the study of nerve fiber models. In some recent works we discussed the case
of nonexistence of nontrivial solutions as well as the case in which many
positive periodic solutions may arise, the different situations depending by
threshold parameters related to the weight function $n(x).$ Here we show that
for a step function $n(x)$ (or for small perturbations of it) it is possible to
obtain infinitely many periodic solutions and chaotic dynamics, due to the
presence of a topological horseshoe (according to Kennedy and Yorke).
","[{""version"":""v1"",""created"":""Fri, 17 Aug 2007 10:57:55 GMT""}]","2007-08-20"
"0708.2343","Ramon Munoz-Tapia","J. Calsamiglia, R. Munoz-Tapia, Ll. Masanes, A. Acin, E. Bagan","The quantum Chernoff bound as a measure of distinguishability between
  density matrices: application to qubit and Gaussian states","16 pages","Phys. Rev. A 77, 032311 (2008)","10.1103/PhysRevA.77.032311",,"quant-ph",,"  Hypothesis testing is a fundamental issue in statistical inference and has
been a crucial element in the development of information sciences. The Chernoff
bound gives the minimal Bayesian error probability when discriminating two
hypotheses given a large number of observations. Recently the combined work of
Audenaert et al. [Phys. Rev. Lett. 98, 160501] and Nussbaum and Szkola
  [quant-ph/0607216] has proved the quantum analog of this bound, which applies
when the hypotheses correspond to two quantum states. Based on the quantum
Chernoff bound, we define a physically meaningful distinguishability measure
and its corresponding metric in the space of states; the latter is shown to
coincide with the Wigner-Yanase metric. Along the same lines, we define a
second, more easily implementable, distinguishability measure based on the
error probability of discrimination when the same local measurement is
performed on every copy. We study some general properties of these measures,
including the probability distribution of density matrices, defined via the
volume element induced by the metric, and illustrate their use in the
paradigmatic cases of qubits and Gaussian infinite-dimensional states.
","[{""version"":""v1"",""created"":""Fri, 17 Aug 2007 11:02:40 GMT""},{""version"":""v2"",""created"":""Mon, 17 Dec 2007 18:53:30 GMT""}]","2009-11-13"
