"0708.2462","Deepak Sridhara","Christine A. Kelley and Deepak Sridhara","Eigenvalue bounds on the pseudocodeword weight of expander codes","Journal on Advances of Mathematics of Communications, vol. 1, no. 3,
  pp. 287 -- 307, Aug. 2007","Journal on Advances of Mathematics of Communications, vol. 1, no.
  3, pp. 287 -- 307, Aug. 2007",,,"cs.IT math.IT",,"  Four different ways of obtaining low-density parity-check codes from expander
graphs are considered. For each case, lower bounds on the minimum stopping set
size and the minimum pseudocodeword weight of expander (LDPC) codes are
derived. These bounds are compared with the known eigenvalue-based lower bounds
on the minimum distance of expander codes. Furthermore, Tanner's
parity-oriented eigenvalue lower bound on the minimum distance is generalized
to yield a new lower bound on the minimum pseudocodeword weight. These bounds
are useful in predicting the performance of LDPC codes under graph-based
iterative decoding and linear programming decoding.
","[{""version"":""v1"",""created"":""Sat, 18 Aug 2007 19:01:38 GMT""}]","2009-09-29"
"0708.2485","Peter Bozsoki","P. Bozsoki, W. Hoyer, M. Kira, I. Varga, P. Thomas, S. W. Koch and H.
  Schomerus","Analytical Analysis of Single-Photon Correlations Emitted by Disordered
  Semiconductor Heterostructures","6 pages, 2 figures, submitted to the special issue of the Journal of
  Materials Science: Materials in Electronics (JMSE), presented at the ICOOPMA
  2007 conference","J Mater Sci: Mater Electron 20, S23 (2009)","10.1007/s10854-007-9424-0",,"cond-mat.dis-nn cond-mat.str-el",,"  In a recent publication [Phys. Rev. Lett. 97, 227402 (2006),
cond-mat/0611411], it has been demonstrated numerically that a long-range
disorder potential in semiconductor quantum wells can be reconstructed reliably
via single-photon interferometry of spontaneously emitted light.
  In the present paper, a simplified analytical model of independent two-level
systems is presented in order to study the reconstruction procedure in more
detail. With the help of this model, the measured photon correlations can be
calculated analytically and the influence of parameters such as the disorder
length scale, the wavelength of the used light, or the spotsize can be
investigated systematically. Furthermore, the relation between the proposed
angle-resolved single-photon correlations and the disorder potential can be
understood and the measured signal is expected to be closely related to the
characteristic strength and length scale of the disorder.
","[{""version"":""v1"",""created"":""Sat, 18 Aug 2007 17:26:11 GMT""}]","2009-05-13"
"0708.2493","Rickard Jonsson","Rickard Jonsson","Inertial forces and the foundations of optical geometry","42 pages, 7 figures","Class.Quant.Grav.23:1-36,2006","10.1088/0264-9381/23/1/001",,"gr-qc",,"  Assuming a general timelike congruence of worldlines as a reference frame, we
derive a covariant general formalism of inertial forces in General Relativity.
Inspired by the works of Abramowicz et. al. (see e.g. Abramowicz and Lasota,
Class. Quantum Grav. 14 (1997) A23), we also study conformal rescalings of
spacetime and investigate how these affect the inertial force formalism. While
many ways of describing spatial curvature of a trajectory has been discussed in
papers prior to this, one particular prescription (which differs from the
standard projected curvature when the reference is shearing) appears novel. For
the particular case of a hypersurface-forming congruence, using a suitable
rescaling of spacetime, we show that a geodesic photon is always following a
line that is spatially straight with respect to the new curvature measure. This
fact is intimately connected to Fermat's principle, and allows for a certain
generalization of the optical geometry as will be further pursued in a
companion paper (Jonsson and Westman, Class. Quantum Grav. 23 (2006) 61). For
the particular case when the shear-tensor vanishes, we present the inertial
force equation in three-dimensional form (using the bold face vector notation),
and note how similar it is to its Newtonian counterpart. From the spatial
curvature measures that we introduce, we derive corresponding covariant
differentiations of a vector defined along a spacetime trajectory. This allows
us to connect the formalism of this paper to that of Jantzen et. al. (see e.g.
Bini et. al., Int. J. Mod. Phys. D 6 (1997) 143).
","[{""version"":""v1"",""created"":""Sun, 19 Aug 2007 10:22:23 GMT""}]","2008-11-26"
"0708.2494","Jack Button","J. O. Button","A formula for the normal subgroup growth of Baumslag-Solitar groups",,,,,"math.GR",,"  We give an exact formula for the number of normal subgroups of each finite
index in the Baumslag-Solitar group BS(p,q) when p and q are coprime. Unlike
the formula for all finite index subgroups, this one distinguishes different
Baumslag-Solitar groups and is not multiplicative. This allows us to give an
example of a finitely generated profinite group which is not virtually
pronilpotent but whose zeta function has an Euler product.
","[{""version"":""v1"",""created"":""Sat, 18 Aug 2007 16:09:37 GMT""}]","2007-08-21"
"0708.2495","Nikolai Zak","Nikolay Zak","On Unirationality of Quartics over non Algebraically Closed Fields",,,,,"math.AG",,"  We give examples of smooth $\k$-unirational line-free quartic hypersurfaces
over a non algebraically closed field $\k$. Unlike other methods of proving
unirationality, our method does not rely on existence of linear spaces on
quartics.
","[{""version"":""v1"",""created"":""Sat, 18 Aug 2007 16:14:35 GMT""}]","2007-08-21"
"0708.2496","Ian Beatty","William J. Gerace","Contributions from cognitive research to mathematics and science
  education","An invited talk given at the Workshop on Research in Science and
  Mathematics Education, January 20-24 1992, Winterton, South Africa","Gerace, William J. (1992). In D. Grayson (Ed.), Proceedings of the
  Workshop on Research in Science and Mathematics Education. Pietermaritzburg,
  South Africa: Teeanem Printers (Pty) Ltd. Pages 25-44",,"Gerace-1992ccr","physics.ed-ph",,"  An invited plenary given at the founding meeting of the Southern African
Association for Research in Mathematics and Science Education in 1992.
","[{""version"":""v1"",""created"":""Sat, 18 Aug 2007 16:22:04 GMT""}]","2007-08-21"
"0708.2497","Nikolai Dokuchaev","Nikolai Dokuchaev","Duality and semi-group property for backward parabolic Ito equations",,"Random Operators and Stochastic Equations, 2010, V, 18, 51-72",,,"math.PR math.AP","http://arxiv.org/licenses/nonexclusive-distrib/1.0/","  We study existence, uniqueness, semi-group property, and a priori estimates
for solutions for backward parabolic Ito equations in domains with boundary. We
study also duality between forward and backward equations. The semi-group for
backward equations is established in the form of some anti-causality. The
novelty is that the semi-group property involves the diffusion term that is a
part of the solution.
","[{""version"":""v1"",""created"":""Sat, 18 Aug 2007 17:10:08 GMT""},{""version"":""v2"",""created"":""Mon, 1 Mar 2010 04:33:41 GMT""}]","2010-03-01"
"0708.2498","Todd K. Timberlake","Todd Timberlake and Javier E. Hasbun","Computation in Classical Mechanics","6 pages, 3 figures, submitted to American Journal of Physics",,"10.1119/1.2870575",,"physics.ed-ph physics.class-ph physics.comp-ph",,"  There is a growing consensus that physics majors need to learn computational
skills, but many departments are still devoid of computation in their physics
curriculum. Some departments may lack the resources or commitment to create a
dedicated course or program in computational physics. One way around this
difficulty is to include computation in a standard upper-level physics course.
An intermediate classical mechanics course is particularly well suited for
including computation. We discuss the ways we have used computation in our
classical mechanics courses, focusing on how computational work can improve
students' understanding of physics as well as their computational skills. We
present examples of computational problems that serve these two purposes. In
addition, we provide information about resources for instructors who would like
to include computation in their courses.
","[{""version"":""v1"",""created"":""Sat, 18 Aug 2007 17:44:41 GMT""}]","2009-11-13"
"0708.2499","Sonjoy Majumder","Subhasish Mandal, Gopal Dixit, B. K. Sahoo, R. K. Chaudhuri, Sonjoy
  Majumder","Theoretical spectroscopic studies of the atomic transitions and
  lifetimes of low-lying states in Ti IV","15 pages submitted to J. Phys. B",,,,"physics.atom-ph physics.comp-ph",,"  The astrophysically important electric quadrupole (E2) and magnetic dipole
(M1) transitions for the low-lying states of triply ionized titanium (Ti IV)
are calculated very accurately using a state-of-art all-order many-body theory
called Coupled Cluster (CC) theory in the relativistic frame-work. Different
many-body correlations of the CC theory has been estimated by studying the core
and valence electron excitations to the unoccupied states. The calculated
excitation energies of different states are in very good agreement with the
measurements. Also we compare our calculated electric dipole (E1) transition
amplitudes of few transitions with recent many-body calculations by different
groups. We have also carried out the calculations for the lifetimes of the
low-lying states of Ti IV. A long lifetime is found for the first excited
3d$^{2}D_{5/2}$ state, which suggested that Ti IV may be one of the useful
candidates for many important studies. Most of the results reported here are
not available in the literature, to the best of our knowledge.
","[{""version"":""v1"",""created"":""Sat, 18 Aug 2007 18:22:42 GMT""},{""version"":""v2"",""created"":""Wed, 22 Aug 2007 18:20:47 GMT""}]","2007-08-22"
"0708.2500","Jeng-Daw Yu","Jeng-Daw Yu","Variation of the unit roots along the Dwork family of Calabi-Yau
  varieties","24 pages",,,,"math.AG math.NT",,"  We study the variation of unit roots of the Dwork families of Calabi-Yau
varieties over a finite field by the method of Dwork-Katz and also from the
point of view of formal group laws. A p-adic analytic formula for the unit
roots away from the Hasse locus is obtained.
","[{""version"":""v1"",""created"":""Sat, 18 Aug 2007 18:24:49 GMT""}]","2007-08-21"
"0708.2502","Vladimir Vovk","Vladimir Vovk","Hoeffding's inequality in game-theoretic probability","5 pages",,,,"math.PR",,"  This note makes the obvious observation that Hoeffding's original proof of
his inequality remains valid in the game-theoretic framework. All details are
spelled out for the convenience of future reference.
","[{""version"":""v1"",""created"":""Sat, 18 Aug 2007 18:50:06 GMT""}]","2007-08-21"
"0708.2503","Ilia Gogoladze","Ilia Gogoladze, Nobuchika Okada, Qaisar Shafi","Window For Higgs Boson Mass From Gauge-Higgs Unification","15 pages, 7 figures","Phys.Lett.B659:316-322,2008","10.1016/j.physletb.2007.11.059",,"hep-ph hep-th",,"  We consider six dimensional gauge models compactified on the orbifold T^2/Z_N
(N=2,3,4,6) such that the Standard Model (SM) Higgs doublet arises from the
extra-dimensional components of the gauge field. For \Lambda \leq 10^{19} GeV,
where \Lambda denotes the compactification scale, we obtain 114.4 GeV \leq m_H
\leq 164 GeV for the SM Higgs boson mass. We also consider gauge-Higgs-top and
gauge-Higgs-bottom Yukawa unification which respectively yield m_H =
131^{+4}_{-5} GeV and m_H = 150^{+2}_{-2} GeV for a top quark pole mass M_t
=170.9^{+1.8}_{-1.8} GeV. As a special case we recover the result m_H \leq 132
GeV previously obtained for five dimensional models.
","[{""version"":""v1"",""created"":""Sat, 18 Aug 2007 19:13:21 GMT""}]","2008-11-26"
"0708.2504","Radostin Georgiev Kurtev","R. Kurtev (1), J. Borissova (1), L. Georgiev (2), S. Ortolani (3) and
  V.D. Ivanov (4) (1. Department of Physics and Astronomy, Univ. of Valparaiso,
  Chile; 2. Department of Astronomy, UNAM, Mexico; 3. Department of Astronomy,
  Univ of Padova, Italy; 4. ESO, Chile)","Obscured clusters.I. GLIMPSE30 - Young Milky Way Star Cluster Hosting
  Wolf-Rayet Stars","11 pages, 9 figures, accepted for publication in Astronomy &
  Astrophysics",,"10.1051/0004-6361:20066706",,"astro-ph",,"  Young massive clusters are perfect astrophysical laboratories for study of
massive stars. Clusters with Wolf-Rayet (WR) stars are of special importance,
since this enables us to study a coeval WR population at a uniform metallicity
and known age. GLIMPSE30 (G30) is one of them. The cluster is situated near the
Galactic plane (l=298.756deg, b=-0.408deg) and we aimed to determine its
physical parameters and to investigate its high-mass stellar content and
especially WR stars. Our analysis is based on SOFI/NTT JsHKs imaging and low
resolution (R~2000) spectroscopy of the brightest cluster members in the K
atmospheric window. For the age determination we applied isochrone fits for MS
and Pre-MS stars. We derived stellar parameters of the WR stars candidates
using a full nonLTE modeling of the observed spectra. Using a variety of
techniques we found that G30 is very young cluster, with age t~4Myr. The
cluster is located in Carina spiral arm, it is deeply embedded in dust and
suffers reddening of Av~10.5+-1.1mag. The distance to the object is
d=7.2+-0.9kpc. The mass of the cluster members down to 2.35Msol is ~1600Msol.
Cluster's MF for the mass range of 5.6 to 31.6Msol shows a slope of
Gamma=-1.01+-0.03. The total mass of the cluster obtained by this MF down to
1Msol is about 3x10^3Msol. The spectral analysis and the models allow us to
conclude that in G30 are at least one Ofpe/WN and two WR stars. The WR stars
are of WN6-7 hydrogen rich type with progenitor masses more than 60Msol. G30 is
a new member of the exquisite family of young Galactic clusters, hosting WR
stars. It is a factor of two to three less massive than some of the youngest
super-massive star clusters like Arches, Quintuplet and Central cluster and is
their smaller analog.
","[{""version"":""v1"",""created"":""Sat, 18 Aug 2007 19:31:47 GMT""}]","2009-11-13"
"0708.2505","Jean Eilek","T. H. Hankins, J. A. Eilek","Radio Emission Signatures in the Crab Pulsar","26 pages, 10 figures, to appear in ApJ",,"10.1086/522362",,"astro-ph",,"  Our high time resolution observations of individual pulses from the Crab
pulsar show that both the time and frequency signatures of the interpulse are
distinctly different from those of the main pulse. Main pulses can occasionally
be resolved into short-lived, relatively narrow-band nanoshots. We believe
these nanoshots are produced by soliton collapse in strong plasma turbulence.
Interpulses at centimeter wavelengths are very different. Their dynamic
spectrum contains regular, microsecond-long emission bands. We have detected
these bands, proportionately spaced in frequency, from 4.5 to 10.5 GHz. The
bands cannot easily be explained by any current theory of pulsar radio
emission; we speculate on possible new models.
","[{""version"":""v1"",""created"":""Sat, 18 Aug 2007 20:05:36 GMT""}]","2009-11-13"
"0708.2506","Ethan Bloch","Ethan D. Bloch","A Characterization of the Angle Defect and the Euler Characteristic in
  Dimension 2 -- Preliminary Draft","21 pages, 1 figure",,,,"math.GT math.CO",,"  The angle defect, which is the standard way to measure curvature at the
vertices of polyhedral surfaces, goes back at least as far as Descartes.
Although the angle defect has been widely studied, there does not appear to be
in the literature an axiomatic characterization of the angle defect. We give a
characterization of the angle defect for simplicial surfaces, and we show that
variants of the same characterization work for two known approaches to
generalizing the angle defect to arbitrary 2-dimensional simplicial complexes.
Simultaneously, we give a characterization of the Euler characteristic on
2-dimensional simplicial complexes in terms of being geometrically locally
determined.
","[{""version"":""v1"",""created"":""Sat, 18 Aug 2007 20:57:03 GMT""}]","2007-08-21"
"0708.2507","Bruce Mellado","B. Mellado, W. Quayle and Sau Lan Wu","Feasibility of Searches for a Higgs Boson using H->WW->ll+MET and High
  PT Jets at the Tevatron",,"Phys.Rev.D76:093007,2007","10.1103/PhysRevD.76.093007","MADPH-07-1495","hep-ph",,"  The sensitivity of Standard Model Higgs boson searches at the Tevatron
experiments with a mass 135<MH<190 GeV using the channel H->WW->ll+MET (l=e,mu)
is discussed. Three new event selections involving Higgs in association with
one or two high PT hadronic jets are discussed. Using Leading Order Matrix
Elements and a conservative cut-based analysis a 95% confidence level exclusion
on sigmaxBR(H->WW), 1.6 times larger than that predicted by the Standard Model
for MH=165 GeV, may be achieved with 5fb-1 of integrated luminosity. By
combining these three event selections with the existing analysis, the
sensitivity of CDF and D0 could improve significantly.
","[{""version"":""v1"",""created"":""Sat, 18 Aug 2007 21:16:22 GMT""}]","2008-11-26"
"0708.2509","Joel Hass","Joel Hass and Tahl Nowik","Invariants of Knot Diagrams",,,,,"math.GT",,"  We construct a new order 1 invariant for knot diagrams. We use it to
determine the minimal number of Reidemeister moves needed to pass between
certain pairs of knot diagrams.
","[{""version"":""v1"",""created"":""Sat, 18 Aug 2007 23:02:31 GMT""}]","2007-08-21"
"0708.2510","Illya Karabash Mihailovich","I. M. Karabash (the University of Calgary, Canada)","Abstract kinetic equations with positive collision operators","20 pages, LaTeX2e, version 2, references have been added, changes in
  the introduction","Operator Theory: Advances and Applications, 2009, Volume 188, pp.
  175-195","10.1007/978-3-7643-8911-6_9",,"math.SP math-ph math.MP",,"  We consider ""forward-backward"" parabolic equations in the abstract form $Jd
\psi / d x + L \psi = 0$, $ 0< x < \tau \leq \infty$, where $J$ and $L$ are
operators in a Hilbert space $H$ such that $J=J^*=J^{-1}$, $L=L^* \geq 0$, and
$\ker L = 0$. The following theorem is proved: if the operator $B=JL$ is
similar to a self-adjoint operator, then associated half-range boundary
problems have unique solutions. We apply this theorem to corresponding
nonhomogeneous equations, to the time-independent Fokker-Plank equation $ \mu
\frac {\partial \psi}{\partial x} (x,\mu) = b(\mu) \frac {\partial^2
\psi}{\partial \mu^2} (x, \mu)$, $ 0<x<\tau$, $ \mu \in \R$, as well as to
other parabolic equations of the ""forward-backward"" type. The abstract kinetic
equation $ T d \psi/dx = - A \psi (x) + f(x)$, where $T=T^*$ is injective and
$A$ satisfies a certain positivity assumption, is considered also.
","[{""version"":""v1"",""created"":""Sat, 18 Aug 2007 23:14:45 GMT""},{""version"":""v2"",""created"":""Tue, 2 Oct 2007 22:54:41 GMT""}]","2011-01-27"
"0708.2511","Bryan W. Miller","Bryan W. Miller (1) and Jennifer M. Lotz (2) ((1) Gemini Observatory,
  (2) NOAO)","The Globular Cluster Luminosity Function and Specific Frequency in Dwarf
  Elliptical Galaxies","53 pages, 13 figures, 12 tables, accepted by the Astrophysical
  Journal",,"10.1086/522323",,"astro-ph",,"  The globular cluster luminosity function, specific globular cluster
frequency, S_N, specific globular cluster mass, T_MP, and globular cluster mass
fraction in dwarf elliptical galaxies are explored using the full 69 galaxy
sample of the HST WFPC2 Dwarf Elliptical Galaxy Snapshot Survey. The GCLFs of
the dEs are well-represented with a t_5 function with a peak at
M_{V,Z}^0(dE,HST) = -7.3 +/- 0.1. This is ~0.3 magnitudes fainter than the GCLF
peaks in giant spiral and elliptical galaxies, but the results are consistent
within the uncertainties. The bright-end slope of the luminosity distribution
has a power-law form with slope alpha = -1.9 +/- 0.1. The trend of increasing
S_N or T_MP with decreasing host galaxy luminosity is confirmed. The mean value
for T_MP in dE,N galaxies is about a factor of two higher than the mean value
for non-nucleated galaxies and the distributions of T_MP in dE,N and dE,noN
galaxies are statistically different. These data are combined with results from
the literature for a wide range of galaxy types and environments. At low host
galaxy masses the distribution of T_MP for dE,noN and dI galaxies are similar.
This supports the idea that one pathway for forming dE,noN galaxies is by the
stripping of dIs. The formation of nuclei and the larger values of T_MP in dE,N
galaxies may be due to higher star formation rates and star cluster formation
efficiencies due to interactions in galaxy cluster environments.
","[{""version"":""v1"",""created"":""Sat, 18 Aug 2007 23:19:07 GMT""}]","2009-11-13"
"0708.2513","Bo'az Klartag","Ronen Eldan, Bo'az Klartag","Pointwise Estimates for Marginals of Convex Bodies","17 pages",,,,"math.MG math.FA",,"  We prove a pointwise version of the multi-dimensional central limit theorem
for convex bodies. Namely, let X be an isotropic random vector in R^n with a
log-concave density. For a typical subspace E in R^n of dimension n^c, consider
the probability density of the projection of X onto E. We show that the ratio
between this probability density and the standard gaussian density in E is very
close to 1 in large parts of E. Here c > 0 is a universal constant. This
complements a recent result by the second named author, where the
total-variation metric between the densities was considered.
","[{""version"":""v1"",""created"":""Sat, 18 Aug 2007 23:27:48 GMT""}]","2007-08-21"
"0708.2514","Arash Rafiey","Arvind Gupta, Pavol Hell, Mehdi Karimi, Arash Rafiey","Minimum Cost Homomorphisms to Reflexive Digraphs",,,,,"cs.DM cs.CC",,"  For digraphs $G$ and $H$, a homomorphism of $G$ to $H$ is a mapping $f:\
V(G)\dom V(H)$ such that $uv\in A(G)$ implies $f(u)f(v)\in A(H)$. If moreover
each vertex $u \in V(G)$ is associated with costs $c_i(u), i \in V(H)$, then
the cost of a homomorphism $f$ is $\sum_{u\in V(G)}c_{f(u)}(u)$. For each fixed
digraph $H$, the {\em minimum cost homomorphism problem} for $H$, denoted
MinHOM($H$), is the following problem. Given an input digraph $G$, together
with costs $c_i(u)$, $u\in V(G)$, $i\in V(H)$, and an integer $k$, decide if
$G$ admits a homomorphism to $H$ of cost not exceeding $k$. We focus on the
minimum cost homomorphism problem for {\em reflexive} digraphs $H$ (every
vertex of $H$ has a loop). It is known that the problem MinHOM($H$) is
polynomial time solvable if the digraph $H$ has a {\em Min-Max ordering}, i.e.,
if its vertices can be linearly ordered by $<$ so that $i<j, s<r$ and $ir, js
\in A(H)$ imply that $is \in A(H)$ and $jr \in A(H)$. We give a forbidden
induced subgraph characterization of reflexive digraphs with a Min-Max
ordering; our characterization implies a polynomial time test for the existence
of a Min-Max ordering. Using this characterization, we show that for a
reflexive digraph $H$ which does not admit a Min-Max ordering, the minimum cost
homomorphism problem is NP-complete. Thus we obtain a full dichotomy
classification of the complexity of minimum cost homomorphism problems for
reflexive digraphs.
","[{""version"":""v1"",""created"":""Sat, 18 Aug 2007 23:34:45 GMT""},{""version"":""v2"",""created"":""Tue, 16 Oct 2007 13:31:36 GMT""}]","2007-10-16"
"0708.2515","M. Hossein Partovi","M. Hossein Partovi","Verschraenkung versus Stosszahlansatz: Disappearance of the
  Thermodynamic Arrow in a High-Correlation Environment","4 pages, REVTeX 4","Phys. Rev. E 77, 021110 (2008).","10.1103/PhysRevE.77.021110",,"quant-ph cond-mat.stat-mech",,"  The crucial role of ambient correlations in determining thermodynamic
behavior is established. A class of entangled states of two macroscopic systems
is constructed such that each component is in a state of thermal equilibrium at
a given temperature, and when the two are allowed to interact heat can flow
from the colder to the hotter system. A dilute gas model exhibiting this
behavior is presented. This reversal of the thermodynamic arrow is a
consequence of the entanglement between the two systems, a condition that is
opposite to molecular chaos and shown to be unlikely in a low-entropy
environment. By contrast, the second law is established by proving Clausius'
inequality in a low-entropy environment. These general results strongly support
the expectation, first expressed by Boltzmann and subsequently elaborated by
others, that the second law is an emergent phenomenon that requires a
low-entropy cosmological environment, one that can effectively function as an
ideal information sink.
","[{""version"":""v1"",""created"":""Sun, 19 Aug 2007 01:23:51 GMT""}]","2008-02-12"
"0708.2516","Boris Shklovskii","B. I. Shklovskii","Superconductor-insulator transition in Coulomb disorder","4.5 pages, introduction rewritten, a dozen of references added, 2D
  case added",,"10.1103/PhysRevB.76.224511",,"cond-mat.supr-con cond-mat.dis-nn",,"  Superconductor-insulator transition driven by the decreasing concentration of
electrons $n$ is studied in the case of the disorder potential created by
randomly positioned charged impurities. Electrons and Cooper pairs (formed by
an non-Coulomb attraction) nonlinearly screen the random potential of
impurities. Both electrons and Cooper pairs can be delocalized or localized in
the resulting self-consistent potential. The border separating the
superconductor and insulator phases in the plane of the concentration of
electrons and the length of the Cooper pair is found. For a strong disorder the
central segment of this border follows the BEC-BCS crossover line defined for a
clean sample.
","[{""version"":""v1"",""created"":""Sun, 19 Aug 2007 00:56:06 GMT""},{""version"":""v2"",""created"":""Wed, 12 Sep 2007 18:44:05 GMT""},{""version"":""v3"",""created"":""Mon, 5 Nov 2007 17:39:43 GMT""}]","2009-11-13"
