"0708.2517","Yin-Zhong Wu","Yin-Zhong Wu, Wei-Min Zhang","Implementing controlled-NOT gate based on free spin qubits with
  semiconductor quantum-dot array","4 pages","EuroPhys. Lett.71(4),524-529(2005)","10.1209/epl/i2005-10117-0",,"quant-ph",,"  Based on electron spins in semiconductor quantum dots as qubits, a new
quantum controlled-NOT(CNOT) gate is constructed in solid nanostructure without
resorting to spin-spin interactions. Single electron tunneling technology and
coherent quantum-dot cellular automata architecture are used to generate an
ancillary charge entangled state. Using the ancillary charge entangled state as
an intermediate state, we obtain a spin entangled state and design a CNOT gate
by using only single spin rotations.
","[{""version"":""v1"",""created"":""Sun, 19 Aug 2007 01:03:58 GMT""}]","2009-11-13"
"0708.2518","Yi Zhou","Tai-Kai Ng and Yi Zhou","Comment to ""Multipolar expansion of the electrostatic interaction
  between charged colloids at interfaces""",,,,,"cond-mat.soft",,"  We present a comment to a recent paper by Dominguez et. al. They claimed that
the electrostatic interaction between charged colloids trapped at an interface
formed by a dielectric and a screening phase is always isotropic to order
$d^-3$. Base on this result, they claimed that in-plane dipolar attraction of
order $d^-3$ between colloids cannot exist, in contrast to previous proposals.
We point out that their analysis is not completed and anisotropic (dipolar)
interaction between colloids can exist up to order $d^-3$.
","[{""version"":""v1"",""created"":""Sun, 19 Aug 2007 01:08:48 GMT""}]","2007-08-21"
"0708.2519","Yang Zhao","S. R. Dunsiger, Y. Zhao, Z. Yamani, W. J. L. Buyers, H. Dabkowska and
  B. D. Gaulin","Incommensurate Spin Ordering and Fluctuations in underdoped
  La_{2-x}Ba_{x}CuO_{4}","9 pages, 7 figures, submitted to PRB, figures updated",,"10.1103/PhysRevB.77.224410",,"cond-mat.supr-con cond-mat.str-el",,"  Using neutron scattering techniques, we have studied incommensurate spin
ordering as well as low energy spin dynamics in single crystal underdoped \LBCO
with x$\sim$0.095 and 0.08; high temperature superconductors with T$_C \sim$ 27
K and 29 K respectively. Static two dimensional incommensurate magnetic order
appears below T$_N$=39.5 $\pm$ 0.3 K in \LBCO (x=0.095) and a similar
temperature for x=0.08 within the low temperature tetragonal phase. The spin
order is unaffected by either the onset of superconductivity or the application
of magnetic fields of up to 7 Tesla applied along the c-axis in the x=0.095
sample. Such magnetic field {\it independent} behaviour is in marked contrast
with the field induced enhancement of the staggered magnetisation observed in
the related \LSCO system, indicating this phenomenon is not a universal
property of cuprate superconductors. Surprisingly, we find that
incommensurability $\delta $ is only weakly dependent on doping relative to
\LSCO. Dispersive excitations in \LBCO (x=0.095) at the same incommensurate
wavevector persist up to at least 60 K. The dynamical spin susceptibility of
the low energy spin excitations saturates below \tc, in a similar manner to
that seen in the superconducting state of La$_2$CuO$_{4+y}$.
","[{""version"":""v1"",""created"":""Sun, 19 Aug 2007 02:28:59 GMT""},{""version"":""v2"",""created"":""Tue, 21 Aug 2007 16:57:59 GMT""},{""version"":""v3"",""created"":""Thu, 20 Mar 2008 20:26:14 GMT""}]","2009-11-13"
"0708.2520","Weiyi Zhang","Tian-Jun Li, Weiyi Zhang","Comparing tamed and compatible symplectic cones and cohomological
  properties of almost complex manifolds","v3 substantially revised and title changed, v4 One main result
  (Theorem 1.3) substantially improved",,,,"math.SG math.AG math.DG","http://arxiv.org/licenses/nonexclusive-distrib/1.0/","  We introduce certain homology and cohomology subgroups for any almost complex
structure and study their pureness, fullness and duality properties. Motivated
by a question of Donaldson, we use these groups to relate J-tamed symplectic
cones and J-compatible symplectic cones over a large class of almost complex
manifolds, including all Kahler manifolds, almost Kahler 4-manifolds and
complex surfaces.
","[{""version"":""v1"",""created"":""Sun, 19 Aug 2007 02:59:54 GMT""},{""version"":""v2"",""created"":""Sat, 29 Sep 2007 04:11:02 GMT""},{""version"":""v3"",""created"":""Wed, 28 Jan 2009 19:44:11 GMT""},{""version"":""v4"",""created"":""Tue, 15 Sep 2009 17:29:13 GMT""}]","2009-09-15"
"0708.2523","Takashi Abe","T. Abe and R. Seki","Lattice Calculation of Thermal Properties of Low-Density Neutron Matter
  with Pionless NN Effective Field Theory","50 pages, 23 figures, to appear in Physical Review C","Phys.Rev.C79:054002,2009","10.1103/PhysRevC.79.054002","MAP-334","nucl-th","http://arxiv.org/licenses/nonexclusive-distrib/1.0/","  Thermal properties of low-density neutron matter are investigated by
determinantal quantum Monte Carlo lattice calculations on 3+1 dimensional cubic
lattices. Nuclear effective field theory (EFT) is applied using the pionless
single- and two-parameter neutron-neutron interactions, determined from the
$^1S_0$ scattering length and effective range. The determination of the
interactions and the calculations of neutron matter are carried out
consistently by applying EFT power counting rules. The thermodynamic limit is
taken by the method of finite-size scaling, and the continuum limit is examined
in the vanishing lattice filling limit. The $^1S_0$ pairing gap at $T \approx
0$ is computed directly from the off-diagonal long-range order of the spin
pair-pair correlation function, and is found to be approximately 30% smaller
than BCS calculations with the conventional nucleon-nucleon potentials. The
critical temperature $T_c$ of the normal-to-superfluid phase transition and the
pairing temperature scale $T^\ast$ are determined, and the temperature-density
phase diagram is constructed. The physics of low-density neutron matter is
clearly identified as being a BCS-Bose-Einstein condensation crossover.
","[{""version"":""v1"",""created"":""Sun, 19 Aug 2007 04:39:03 GMT""},{""version"":""v2"",""created"":""Thu, 11 Dec 2008 18:37:15 GMT""},{""version"":""v3"",""created"":""Tue, 12 May 2009 06:22:54 GMT""}]","2009-11-25"
"0708.2524","Takashi Abe","T. Abe and R. Seki","From Low-Density Neutron Matter to the Unitary Limit","18 pages, 7 figures, to appear in Physical Review C","Phys.Rev.C79:054003,2009","10.1103/PhysRevC.79.054003","MAP-335","nucl-th","http://arxiv.org/licenses/nonexclusive-distrib/1.0/","  Various quantities of an attractively interacting fermion system at the
unitary limit are determined by extrapolating Monte Carlo results of
low-density neutron matter. Smooth extrapolation in terms of $1/(k_F a_0)$
($k_F$ is the Fermi momentum, and $a_0$ is the ${}^1S_0$ scattering length) is
found with the quantities examined: the ground-state energy, the pairing gap at
$T \approx 0$, and the critical temperature of the normal-to-superfluid phase
transition. We emphasize proximity of the physics of low-density neutron matter
to that at the unitary limit. The extrapolated quantities are in a reasonable
agreement with those in the literature.
","[{""version"":""v1"",""created"":""Sun, 19 Aug 2007 04:45:43 GMT""},{""version"":""v2"",""created"":""Thu, 11 Dec 2008 18:42:13 GMT""},{""version"":""v3"",""created"":""Tue, 12 May 2009 06:37:17 GMT""}]","2009-11-25"
"0708.2525","Qiang Fu","Jie Du and Qiang Fu","Quantum $\frak {gl}_\infty$, infinite $q$-Schur algebras and their
  representations",,"Journal of Algebra, 2009",,,"math.QA math.RT","http://arxiv.org/licenses/nonexclusive-distrib/1.0/","  In this paper, we investigate the structure and representations of the
quantum group ${\mathbf{U}(\infty)}=\mathbf U_\upsilon(\frak{gl}_\infty)$. We
will present a realization for $\mathbf{U}(\infty)$, following
Beilinson--Lusztig--MacPherson (BLM) \cite{BLM}, and show that the natural
algebra homomorphism $\zeta_r$ from $\mathbf{U}(\infty)$ to the infinite
$q$-Schur algebra ${\boldsymbol{\mathcal S}}(\infty,r)$ is not surjective for
any $r\geq 1$. We will give a BLM type realization for the image
$\mathbf{U}(\infty,r):=\zeta_r(\mathbf{U}(\infty))$ and discuss its
presentation in terms of generators and relations. We further construct a
certain completion algebra $\hat{\boldsymbol{\mathcal K}}^\dagger(\infty)$ so
that $\zeta_r$ can be extended to an algebra epimorphism
$\tilde\zeta_r:\hat{\boldsymbol{\mathcal
K}}^\dagger(\infty)\to{\boldsymbol{\mathcal S}}(\infty,r)$. Finally we will
investigate the representation theory of ${\bf U}(\infty)$, especially the
polynomial representations of ${\bf U}(\infty)$.
","[{""version"":""v1"",""created"":""Sun, 19 Aug 2007 05:24:47 GMT""},{""version"":""v2"",""created"":""Thu, 23 Jun 2011 08:01:46 GMT""}]","2011-06-24"
"0708.2526","Mitsusada M. Sano","Mitsusada M. Sano","Kinetic theory of point vortex systems from the
  Bogoliubov-Born-Green-Kirkwood-Yvon hierarchy","10 pages, No figures. To be published in Physical Review E, 76-3",,"10.1103/PhysRevE.76.046312",,"cond-mat.stat-mech",,"  Kinetic equations are derived from the Bogoliubov-Born-Green-Kirkwood-Yvon
(BBGKY) hierarchy for point vortex systems in an infinite plane. As the level
of approximation for the Landau equation, the collision term of the kinetic
equation derived coincides with that by Chavanis ({\it Phys. Rev. E} {\bf 64},
026309 (2001)). Furthermore, we derive a kinetic equation corresponding to the
Balescu-Lenard equation for plasmas, using the theory of the Fredholm integral
equation. For large $N$, this kinetic equation is reduced to the Landau
equation above.
","[{""version"":""v1"",""created"":""Sun, 19 Aug 2007 11:59:08 GMT""}]","2009-11-13"
"0708.2527","Ping Xie","Ping Xie","Model for processive nucleotide and repeat additions by the telomerase","28 pages, 5 figures",,,,"q-bio.BM",,"  A model is presented to describe the nucleotide and repeat addition
processivity by the telomerase. In the model, the processive nucleotide
addition is implemented on the basis of two requirements: One is that stem IV
loop stimulates the chemical reaction of nucleotide incorporation, and the
other one is the existence of an ssRNA-binding site adjacent to the polymerase
site that has a high affinity for the unpaired base of the template. The
unpairing of DNA:RNA hybrid after the incorporation of the nucleotide paired
with the last base on the template, which is the prerequisite for repeat
addition processivity, is caused by a force acting on the primer. The force is
resulted from the unfolding of stem III pseudoknot that is induced by the
swinging of stem IV loop towards the nucleotide-bound polymerase site. Based on
the model, the dynamics of processive nucleotide and repeat additions by
Tetrahymena telomerase are quantitatively studied, which give good explanations
to the previous experimental results. Moreover, some predictions are presented.
In particular, it is predicted that the repeat addition processivity is mainly
determined by the difference between the free energy required to disrupt the
DNA:RNA hybrid and that required to unfold the stem III pseudoknot, with the
large difference corresponding to a low repeat addition processivity while the
small one corresponding to a high repeat addition processivity.
","[{""version"":""v1"",""created"":""Sun, 19 Aug 2007 07:36:15 GMT""}]","2007-08-21"
"0708.2528","Teruki Motohashi","T. Motohashi, Y. Katsumata, T. Ono, R. Kanno, M. Karppinen and H.
  Yamauchi","Synthesis and properties of CoO2, the x = 0 end member of the LixCoO2
  and NaxCoO2 systems","18 pages, 5 figures","Chemistry of Materials 19, 5063-5066 (2007)","10.1021/cm0702464",,"cond-mat.str-el cond-mat.mtrl-sci",,"  We report here the synthesis of single-phase bulk samples of CoO2, the x = 0
end member of the AxCoO2 systems (A = Li, Na), from a pristine LiCoO2 sample
using an electrochemical technique to completely de-intercalate lithium. Thus,
synthesized CoO2 samples were found to be oxygen-stoichiometric and possess a
crystal structure consisting of stacked triangular-lattice CoO2 layers only.
The magnetic susceptibility of the CoO2 sample was revealed to be relatively
large in its initial value and then level off as the temperature increases,
suggesting that CoO2 is a Pauli-paramagnetic metal with itinerant electrons.
","[{""version"":""v1"",""created"":""Sun, 19 Aug 2007 08:38:06 GMT""}]","2007-10-10"
"0708.2529","Samantha Jenkins","S. Jenkins, S. R. Kirk, M. Persson, J. Carlen, Z. Abbas","Molecular dynamics simulation of nanocolloidal amorphous silica
  particles: Part I","v1. 37 pages, 9 figures (screen-quality PDF), submitted to J. Chem.
  Phys v2. 13 pages, 3 tables, 9 figures. Content and author list changed,
  single-spaced v3. References dislocation fixed",,"10.1063/1.2803897",,"physics.chem-ph",,"  Explicit molecular dynamics simulations were applied to a pair of amorphous
silica nanoparticles in aqueous solution, of diameter 4.4 nm with four
different background electrolyte concentrations, to extract the mean force
acting between the pair of silica nanoparticles. Dependences of the
interparticle forces with separation and the background electrolyte
concentration were demonstrated. The nature of the interaction of the
counter-ions with charged silica surface sites (deprotonated silanols) was
investigated. A 'patchy' double layer of adsorbed sodium counter-ions. was
observed. Dependences of the interparticle potential of mean force with
separation and the background electrolyte concentration were demonstrated.
Direct evidence of the solvation forces is presented in terms of changes of the
water ordering at the surfaces of the isolated and double nanoparticles. The
nature of the interaction of the counter-ions with charged silica surface sites
(deprotonated silanols) was investigated in terms of quantifying the effects of
the number of water molecules separately inside each of the pair of
nanoparticles by defining an impermeability measure. A direct correlation was
found between impermeability (related to the silica surface 'hairiness') and
the disruption of water ordering. Differences in the impermeability between the
two nanoparticles are attributed to differences in the calculated electric
dipole moment.
","[{""version"":""v1"",""created"":""Sun, 19 Aug 2007 09:12:27 GMT""},{""version"":""v2"",""created"":""Tue, 11 Sep 2007 17:33:16 GMT""},{""version"":""v3"",""created"":""Sun, 16 Sep 2007 07:44:35 GMT""}]","2009-11-13"
"0708.2530","Takehiko Wada","Takehiko Wada, Shinki Oyabu, Yoshifusa Ita, Hideo Matsuhara, Chris P.
  Pearson, Takashi Onaka, Youichi Ohyama, Fumihiko Usui, Naofumi Fujishiro,
  Daisuke Ishihara, Hirokazu Kataza, Woojung Kim, Toshio Matsumoto, Hiroshi
  Murakami, Itsuki Sakon, Toshihiko Tanabe, Toshinobu Takagi, Kazunori Uemizu,
  Munetaka Ueno and Hidenori Watarai","The Infrared Camera (IRC) deep survey in the performance verification
  phase","15 pages, 13 figures, and 5 tables. Accepted for publication in the
  AKARI special issue of the Publications of the Astronomical Society of Japan",,"10.1093/pasj/59.sp2.S515",,"astro-ph",,"  We report the first results of a near- and mid- infrared deep survey with the
Infrared Camera (IRC) onboard AKARI in the performance verification phase.
Simultaneous observations by the NIR, MIR-S and MIR-L channels of the IRC with
effective integration times of 4529, 4908, and 4417 seconds at 3, 7, and 15
micron, covering 86.0, 70.3, and 77.3 arcmin^2 area, detected 955, 298 and 277
sources, respectively. The 5 sigma detection limits of the survey are 6.0, 31.5
and 71.2 micro Jy and the 50% completeness limit are 24.0, 47.5, and 88.1 micro
Jy at 3, 7, and 15 micron, respectively. The observation is limited by source
confusion at 3 micron. We have confirmed the turnover in the 15 micron
differential source counts around 400 micro Jy, previously detected by surveys
with the Infrared Space Observatory. The faint end of 15 micron raw source
counts agree with the results from the deep surveys in the GOODS fields carried
out with the Spitzer IRS peak up imager and the predictions of current galaxy
evolution models. These results indicate that deep surveys with comprehensive
wavelength coverage at mid-infrared wavelength are very important to
investigate the evolution of infrared galaxies at high redshifts.
","[{""version"":""v1"",""created"":""Sun, 19 Aug 2007 09:15:32 GMT""}]","2015-05-13"
"0708.2531","Samantha Jenkins","S. Jenkins, S.R. Kirk, M. Persson, J. Carlen and Z. Abbas","Molecular dynamics simulation of nanocolloidal amorphous silica
  particles: Part II","v1. 33 pages, 7 figures (screen-quality PDF), submitted to J. Chem.
  Phys v2. 15 pages, 4 tables, 6 figures. Content, author list and title
  changed; single spaced",,,,"physics.chem-ph",,"  Explicit molecular dynamics simulations were applied to a pair of amorphous
silica nanoparticles of diameter 3.2 nm immersed in a background electrolyte.
Mean forces acting between the pair of silica nanoparticles were extracted at
four different background electrolyte concentrations. Dependence of the
inter-particle potential of mean force on the separation and the silicon to
sodium ratio, as well as on the background electrolyte concentration, are
demonstrated. The pH was indirectly accounted for via the ratio of silicon to
sodium used in the simulations. The nature of the interaction of the
counter-ions with charged silica surface sites (deprotonated silanols) was also
investigated. The effect of the sodium double layer on the water ordering was
investigated for three Si:Na+ ratios. The number of water molecules trapped
inside the nanoparticles was investigated as the Si:Na+ ratio was varied.
Differences in this number between the two nanoparticles in the simulations are
attributed to differences in the calculated electric dipole moment. The
implications of the form of the potentials for aggregation are also discussed.
","[{""version"":""v1"",""created"":""Sun, 19 Aug 2007 10:51:07 GMT""},{""version"":""v2"",""created"":""Tue, 11 Sep 2007 17:44:54 GMT""}]","2007-09-11"
"0708.2532","Faisal El-Orany Dr.","Faisal Aly Aly El-Orany","Relationship between the atomic inversion and Wigner function for
  multiphoton multimode Jaynes-Cummings model","19 pages, 4 figures","J. Phys. A: Math. Gen. 37 (2004) 6157-6171","10.1088/0305-4470/37/23/013",,"quant-ph",,"  In this paper we consider multimode multiphoton Jaynes-Cummings model, which
consists of a two-level atom, initially prepared in an excited atomic state,
interacting with $N$ modes of electromagnetic field prepared in general pure
quantum states. For this system we show that under certain conditions the
evolution of the Wigner function at the phase space origin provides direct
information on the corresponding atomic inversion. This relation is also valid
even if the system includes Kerr-like nonlinearity, Stark shift effect,
different types of the initial atomic state as well as moving atom.
Furthermore, based on this fact we discuss for the single-mode case the
possibility of detecting the atomic inversion by means of techniques similar to
those used for Wigner function.
","[{""version"":""v1"",""created"":""Sun, 19 Aug 2007 09:29:16 GMT""}]","2009-11-13"
"0708.2533","Rickard Jonsson","Rickard Jonsson","A covariant formalism of spin precession with respect to a reference
  congruence","27 pages, 8 figures","Class.Quant.Grav.23:37-59,2006","10.1088/0264-9381/23/1/002",,"gr-qc",,"  We derive an effectively three-dimensional relativistic spin precession
formalism. The formalism is applicable to any spacetime where an arbitrary
timelike reference congruence of worldlines is specified. We employ what we
call a stopped spin vector which is the spin vector that we would get if we
momentarily make a pure boost of the spin vector to stop it relative to the
congruence. Starting from the Fermi transport equation for the standard spin
vector we derive a corresponding transport equation for the stopped spin
vector. Employing a spacetime transport equation for a vector along a
worldline, corresponding to spatial parallel transport with respect to the
congruence, we can write down a precession formula for a gyroscope relative to
the local spatial geometry defined by the congruence. This general approach has
already been pursued by Jantzen et. al. (see e.g. Jantzen, Carini and Bini,
Ann. Phys. 215 (1997) 1), but the algebraic form of our respective expressions
differ. We are also applying the formalism to a novel type of spatial parallel
transport introduced in Jonsson (Class. Quantum Grav. 23 (2006) 1), as well as
verifying the validity of the intuitive approach of a forthcoming paper
(Jonsson, Am. Journ. Phys. 75 (2007) 463) where gyroscope precession is
explained entirely as a double Thomas type of effect. We also present the
resulting formalism in explicit three-dimensional form (using the boldface
vector notation), and give examples of applications.
","[{""version"":""v1"",""created"":""Sun, 19 Aug 2007 10:40:34 GMT""}]","2008-11-26"
"0708.2534","Tetsuya Shiromizu","Shunsuke Fujii, Tsutomu Kobayashi, Tetsuya Shiromizu","Low energy effective theory on a regularized brane in six-dimensional
  flux compactifications","11 pages, minor corrections, accepted for publication in Physical
  Review D","Phys.Rev.D76:104052,2007","10.1103/PhysRevD.76.104052","WU-AP/272/07","hep-th astro-ph gr-qc hep-ph",,"  Conical brane singularities in six-dimensional flux compactification models
can be resolved by introducing cylindrical codimension-one branes with regular
caps instead of 3-branes (a la Kaluza-Klein braneworlds with fluxes). In this
paper, we consider such a regularized braneworld with axial symmetry in
six-dimensional Einstein-Maxwell theory. We derive a low energy effective
theory on the regularized brane by employing the gradient expansion approach,
and show that standard four-dimensional Einstein gravity is recovered at low
energies. Our effective equations extend to the nonlinear gravity regime,
implying that conventional cosmology can be reproduced in the regularized
braneworld.
","[{""version"":""v1"",""created"":""Sun, 19 Aug 2007 10:50:56 GMT""},{""version"":""v2"",""created"":""Thu, 4 Oct 2007 15:02:29 GMT""}]","2008-11-26"
"0708.2535","Stephan Baier","Stephan Baier","A Remark on the Conjectures of Lang-Trotter and Sato-Tate on Average","8 pages",,,,"math.NT",,"  We obtain new average results on the conjectures of Lang-Trotter and
Sato-Tate about elliptic curves.
","[{""version"":""v1"",""created"":""Sun, 19 Aug 2007 10:54:14 GMT""},{""version"":""v2"",""created"":""Tue, 21 Aug 2007 19:59:39 GMT""},{""version"":""v3"",""created"":""Tue, 21 Aug 2007 20:04:09 GMT""}]","2007-08-21"
"0708.2536","Zhang Zhanjun Dr.","Zhan-jun Zhang","Classical communication and entanglement cost in preparing a class of
  multi-qubit states",,,,,"quant-ph",,"  Recently, several similar protocols[J. Opt. B 4 (2002) 380; Phys. Lett. A 316
(2003) 159; Phys. Lett. A 355 (2006) 285; Phys. Lett. A 336 (2005) 317] for
remotely preparing a class of multi-qubit states (i.e, $\alpha|0 ...
0>+\beta|1... 1>$) are proposed, respectively. In this paper, by applying the
controlled-not (CNOT) gate, a new simple protocol is proposed for remotely
preparing such class of states. Compared to the previous protocols, both
classical communication cost and required quantum entanglement in our protocol
are remarkably reduced. Moreover, the difficulty of identifying some quantum
states in our protocol is also degraded. Hence our protocol is more economical
and feasible.
","[{""version"":""v1"",""created"":""Sun, 19 Aug 2007 10:59:39 GMT""}]","2007-08-21"
"0708.2537","Rickard Jonsson","Rickard Jonsson","Optical geometry across the horizon","15 pages, 10 figures","Class.Quant.Grav.23:77-89,2006","10.1088/0264-9381/23/1/004",,"gr-qc",,"  In a companion paper (Jonsson and Westman, Class. Quantum Grav. 23 (2006)
61), a generalization of optical geometry, assuming a non-shearing reference
congruence, is discussed. Here we illustrate that this formalism can be applied
to a finite four-volume of any spherically symmetric spacetime. In particular
we apply the formalism, using a non-static reference congruence, to do optical
geometry across the horizon of a static black hole. While the resulting
geometry in principle is time dependent, we can choose the reference congruence
in such a manner that an embedding of the geometry always looks the same.
Relative to the embedded geometry the reference points are then moving. We
discuss the motion of photons, inertial forces and gyroscope precession in this
framework.
","[{""version"":""v1"",""created"":""Sun, 19 Aug 2007 11:13:28 GMT""}]","2008-11-26"
"0708.2538","Alexander Sidorov Viktorovich","A. V. Sidorov (JINR, BLTP, Dubna)","Relation between the x-dependence of Higher Twist Contribution to $F_3$
  and $g_1^p - g_1^n$ in the Light of the Recent Experimental Data","Presented at XIV Inernational Seminar ""Nonlinear Phenomena in Complex
  Systems"" Minsk, Belarus, May 22-25, 2007",,,,"hep-ph",,"  We compare the recent results on the higher twist (HT) contribution to the
nonsinglet combination $g_1^p - g_1^n$ of the polarized proton and neutron
structure functions with that one to the unpolarized structure function $F_3$
using the assumption that the HT contributions to the Gross-Llewellyn Smith and
the Bjorken sum rules are similar. We have found, that the relation
${1/3}h^{F_3}(x) \approx \frac{6}{g_A}h^{g_1^p - g_1^n}(x)$ is valid for $x
\geq 0.2$ in the case of NLO QCD approximation for the leading term parts of
the structure functions.
","[{""version"":""v1"",""created"":""Sun, 19 Aug 2007 11:03:51 GMT""}]","2007-08-21"
