"0708.2539","Hao Pan","Hongze Li and Hao Pan","The Romanov theorem revised","5 pages",,"10.4064/aa135-2-3",,"math.NT",,"  Let P be the set of all primes and P_2=P\cup{p_1p_2: p_1,p_2\in P}$. We prove
that the sumset 2^P+P_2={2^p+q: p\in P, q\in P_2} has a positive lower density.
","[{""version"":""v1"",""created"":""Sun, 19 Aug 2007 11:12:15 GMT""},{""version"":""v2"",""created"":""Sat, 10 Nov 2007 02:31:27 GMT""}]","2015-05-13"
"0708.2540","Gui-Qiang Chen G.","Gui-Qiang Chen (Northwestern University), Mikhail Feldman (University
  of Wisconsin-Madison)","Global Solutions of Shock Reflection by Large-Angle Wedges for Potential
  Flow","108 pages",,,,"math.AP math-ph math.MP",,"  When a plane shock hits a wedge head on, it experiences a
reflection-diffraction process and then a self-similar reflected shock moves
outward as the original shock moves forward in time. Experimental,
computational, and asymptotic analysis has shown that various patterns of shock
reflection may occur, including regular and Mach reflection. However, most of
the fundamental issues for shock reflection have not been understood, including
the global structure, stability, and transition of the different patterns of
shock reflection. Therefore, it is essential to establish the global existence
and structural stability of solutions of shock reflection in order to
understand fully the phenomena of shock reflection. On the other hand, there
has been no rigorous mathematical result on the global existence and structural
stability of shock reflection, including the case of potential flow which is
widely used in aerodynamics. Such problems involve several challenging
difficulties in the analysis of nonlinear partial differential equations such
as mixed equations of elliptic-hyperbolic type, free boundary problems, and
corner singularity where an elliptic degenerate curve meets a free boundary. In
this paper we develop a rigorous mathematical approach to overcome these
difficulties involved and establish a global theory of existence and stability
for shock reflection by large-angle wedges for potential flow. The techniques
and ideas developed here will be useful for other nonlinear problems involving
similar difficulties.
","[{""version"":""v1"",""created"":""Sun, 19 Aug 2007 11:17:56 GMT""}]","2007-08-21"
"0708.2541","Guillaume Pignol","G. Pignol, K. V. Protasov, D. Rebreyend, F. Vezzu, V. V. Nesvizhevsky,
  A. K. Petukhov, H. G. B\""orner, T. Soldner, P. Schmidt-Wellenburg, M. Kreuz,
  D. Forest, P. Ganau, J. M. Mackowski, C. Michel, J. L. Montorio, N. Morgado,
  L. Pinard, A. Remillieux, A. M. Gagarski, G. A. Petrov, A. M. Kusmina, A. V.
  Strelkov, H. Abele, S. Bae{\ss}ler, A. Yu. Voronin","GRANIT project: a trap for gravitational quantum states of UCN","presented in ISINN 15 seminar, Dubna",,,,"quant-ph",,"  Previous studies of gravitationally bound states of ultracold neutrons showed
the quantization of energy levels, and confirmed quantum mechanical predictions
for the average size of the two lowest energy states wave functions.
Improvements in position-like measurements can increase the accuracy by an
order of magnitude only. We therefore develop another approach, consisting in
accurate measurements of the energy levels. The GRANIT experiment is devoted to
the study of resonant transitions between quantum states induced by an
oscillating perturbation.
  According to Heisenberg's uncertainty relations, the accuracy of measurement
of the energy levels is limited by the time available to perform the
transitions. Thus, trapping quantum states will be necessary, and each source
of losses has to be controlled in order to maximize the lifetime of the states.
We discuss the general principles of transitions between quantum states, and
consider the main systematical losses of neutrons in a trap.
","[{""version"":""v1"",""created"":""Sun, 19 Aug 2007 12:19:48 GMT""}]","2007-08-21"
"0708.2542","Dirk Tasche","Dirk Tasche","Capital Allocation to Business Units and Sub-Portfolios: the Euler
  Principle","21 pages, 4 figures",,,,"q-fin.PM stat.AP","http://arxiv.org/licenses/nonexclusive-distrib/1.0/","  Despite the fact that the Euler allocation principle has been adopted by many
financial institutions for their internal capital allocation process, a
comprehensive description of Euler allocation seems still to be missing. We try
to fill this gap by presenting the theoretical background as well as practical
aspects. In particular, we discuss how Euler risk contributions can be
estimated for some important risk measures. We furthermore investigate the
analysis of CDO tranche expected losses by means of Euler's theorem and suggest
an approach to measure the impact of risk factors on non-linear portfolios.
","[{""version"":""v1"",""created"":""Sun, 19 Aug 2007 12:45:18 GMT""},{""version"":""v2"",""created"":""Wed, 9 Apr 2008 12:08:23 GMT""},{""version"":""v3"",""created"":""Sun, 22 Jun 2008 11:04:55 GMT""}]","2008-12-02"
"0708.2543","Emmanuel Olaiya","The BABAR Collaboration: B. Aubert, et al","Measurements of the Branching Fractions of B0 --> K^*0K+K-, B0 -->
  K^*0pi+K-, B0 --> K*0K+pi-, and B0 --> K*0pi+pi-","8 pages, 2 postscript figures, submitted to Lepton Photon 2007","Phys.Rev.D76:071104,2007","10.1103/PhysRevD.76.071104","BABAR-PUB-07/055, SLAC-PUB-12746","hep-ex",,"  Branching fraction and asymmetry measurements of charmless $B^0\to
K^{*0}h^+_1h^-_2$ ($h_{1,2}$ = $K$, $\pi$) decays are presented, using a data
sample of 383 million $\Upsilon(4S) \to$ $B\bar{B$} decays collected with the
BaBar detector at the PEP-II asymmetric-energy $B$-meson factory at SLAC. The
results are: ${\cal B}$($B^0 \to K^{*0}K^+ K^-)$ = (27.5 $\pm$ 1.3 $\pm$ 2.2)
$\times$ 10$^{-6}$, ${\cal B}$($B^0$ $\to$ $K^{*0}\pi^+ K^-$) = (4.6 $\pm$ 1.1
$\pm$ 0.8) $\times$ 10$^{-6}$ and ${\cal B}$($B^0$ $\to$ $K^{*0}\pi^+\pi^-$) =
(54.5 $\pm$ 2.9 $\pm$ 4.3) $\times$ 10$^{-6}$. The first errors quoted are
statistical and the second are systematic. An upper limit is set for ${\cal
B}$($B^0$ $\to$ $K^{*0}K^+ \pi^-$) $<$ 2.2 $\times$ 10$^{-6}$ at 90% confidence
level. We also present measurements of CP-violating asymmetries for the
observed decays.
","[{""version"":""v1"",""created"":""Sun, 19 Aug 2007 12:58:50 GMT""},{""version"":""v2"",""created"":""Mon, 2 Jun 2008 09:12:28 GMT""}]","2010-04-12"
"0708.2544","Gregory Gutin","G. Gutin and E.J. Kim","On the Complexity of the Minimum Cost Homomorphism Problem for Reflexive
  Multipartite Tournaments",,,,,"cs.DM cs.DS",,"  For digraphs $D$ and $H$, a mapping $f: V(D)\dom V(H)$ is a homomorphism of
$D$ to $H$ if $uv\in A(D)$ implies $f(u)f(v)\in A(H).$ For a fixed digraph $H$,
the homomorphism problem is to decide whether an input digraph $D$ admits a
homomorphism to $H$ or not, and is denoted as HOMP($H$). Digraphs are allowed
to have loops, but not allowed to have parallel arcs.
  A natural optimization version of the homomorphism problem is defined as
follows. If each vertex $u \in V(D)$ is associated with costs $c_i(u), i \in
V(H)$, then the cost of the homomorphism $f$ is $\sum_{u\in V(D)}c_{f(u)}(u)$.
For each fixed digraph $H$, we have the {\em minimum cost homomorphism problem
for} $H$ and denote it as MinHOMP($H$). The problem is to decide, for an input
graph $D$ with costs $c_i(u),$ $u \in V(D), i\in V(H)$, whether there exists a
homomorphism of $D$ to $H$ and, if one exists, to find one of minimum cost.
  In a recent paper, we posed a problem of characterizing polynomial time
solvable and NP-hard cases of the minimum cost homomorphism problem for acyclic
multipartite tournaments with possible loops (w.p.l.). In this paper, we solve
the problem for reflexive multipartite tournaments and demonstrate a
considerate difficulty of the problem for the whole class of multipartite
tournaments w.p.l. using, as an example, acyclic 3-partite tournaments of order
4 w.p.l.\footnote{This paper was submitted to Discrete Mathematics on April 6,
2007}
","[{""version"":""v1"",""created"":""Sun, 19 Aug 2007 13:00:59 GMT""}]","2007-08-21"
"0708.2545","Gregory Gutin","E.J. Kim and G. Gutin","Complexity of the Minimum Cost Homomorphism Problem for Semicomplete
  Digraphs with Possible Loops",,,,,"cs.DM cs.DS",,"  For digraphs $D$ and $H$, a mapping $f: V(D)\dom V(H)$ is a homomorphism of
$D$ to $H$ if $uv\in A(D)$ implies $f(u)f(v)\in A(H).$ For a fixed digraph $H$,
the homomorphism problem is to decide whether an input digraph $D$ admits a
homomorphism to $H$ or not, and is denoted as HOM($H$).
  An optimization version of the homomorphism problem was motivated by a
real-world problem in defence logistics and was introduced in
\cite{gutinDAM154a}. If each vertex $u \in V(D)$ is associated with costs
$c_i(u), i \in V(H)$, then the cost of the homomorphism $f$ is $\sum_{u\in
V(D)}c_{f(u)}(u)$. For each fixed digraph $H$, we have the {\em minimum cost
homomorphism problem for} $H$ and denote it as MinHOM($H$). The problem is to
decide, for an input graph $D$ with costs $c_i(u),$ $u \in V(D), i\in V(H)$,
whether there exists a homomorphism of $D$ to $H$ and, if one exists, to find
one of minimum cost.
  Although a complete dichotomy classification of the complexity of MinHOM($H$)
for a digraph $H$ remains an unsolved problem, complete dichotomy
classifications for MinHOM($H$) were proved when $H$ is a semicomplete digraph
\cite{gutinDAM154b}, and a semicomplete multipartite digraph \cite{gutinDAM}.
In these studies, it is assumed that the digraph $H$ is loopless. In this
paper, we present a full dichotomy classification for semicomplete digraphs
with possible loops, which solves a problem in \cite{gutinRMS}.\footnote{This
paper was submitted to SIAM J. Discrete Math. on October 27, 2006}
","[{""version"":""v1"",""created"":""Sun, 19 Aug 2007 13:47:00 GMT""}]","2007-08-21"
"0708.2546","Jonathan Katz","J. I. Katz, G. S. Blanpied, K. N. Borozdin, C. Morris","X-Radiography of Cargo Containers","15 pp., 4 figs","Science and Global Security 15, 49--56 (2007)",,"LA-UR-05-2150","physics.soc-ph physics.ins-det",,"  The problem of detecting a nuclear weapon smuggled in an ocean-going cargo
container has not been solved, and the detonation of such a device in a large
city could produce casualties and property damage exceeding those of September
11, 2001 by orders of magnitude. Any means of detecting such threats must be
fast and cheap enough to screen the millions of containers shipped each year,
and must be capable of distinguishing a threatening quantity of fissionable
material from the complex loading of masses of innocent material found in many
containers. Here we show that radiography with energetic X-rays produced by a
10 MeV electron accelerator, taking advantage of the high density and specific
atomic properties of fissionable material, may be a practical solution.
","[{""version"":""v1"",""created"":""Sun, 19 Aug 2007 14:03:04 GMT""}]","2012-05-22"
"0708.2547","Martha Haynes P","Martha P. Haynes","HI Cosmology in the Local Universe with ALFALFA","To appear in ASP Conference Series as proceedings of NRAO 50th
  Anniversary Symposium, ""Frontiers of Astrophysics"", June 18-21, 2007, A.
  Bridle, J. Condon and G. Hunt eds. 10 pages including 4 figures. Higher
  resolution version available at
  http://egg.astro.cornell.edu/alfalfa/pubs/haynes_nrao50.pdf",,,,"astro-ph",,"  The Arecibo Legacy Fast ALFA (ALFALFA) survey is an on-going second
generation blind extragalactic HI survey exploiting Arecibo's superior
sensitivity, angular resolution and digital technology to conduct a census of
the local HI universe over a cosmologically significant volume. As of mid-2007,
~4500 good quality extragalactic HI line sources have been extracted in ~15% of
the final survey area. ALFALFA is detecting HI masses as low as 10**6 Msun and
as high as 10**10.8 Msun with positional accuracies typically better than 20
arcsec, allowing immediate identification of the most probable optical
counterparts. Only 3% of all extragalactic HI sources and fewer than 1% of
detections with M(HI) > 10**9.5 Msun cannot be identified with a stellar
component. First ALFALFA results already suggest, in agreement with previous
studies, that there does not appear to be a cosmologically significant
population of optically dark but HI rich galaxies. ALFALFA promises a wealthy
dataset for the exploration of many issues in near-field cosmology and galaxy
evolution studies, setting the stage for their extension to higher redshifts
with the Square Kilometer Array (SKA).
","[{""version"":""v1"",""created"":""Sun, 19 Aug 2007 14:26:38 GMT""}]","2007-08-21"
"0708.2548","Jonathan Katz","J. I. Katz","Detection of Neutron Sources in Cargo Containers","10 pp","Science and Global Security 14, 145--149 (2006)",,,"physics.soc-ph physics.ins-det",,"  We investigate the problem of detecting the presence of clandestine neutron
sources, such as would be produced by nuclear weapons containing plutonium,
within cargo containers. Small, simple and economical semiconductor photodiode
detectors affixed to the outsides of containers are capable of producing
statistically robust detections of unshielded sources when their output is
integrated over the durations of ocean voyages. It is possible to shield such
sources with thick layers of neutron-absorbing material, and to minimize the
effects of such absorbers on ambient or artificial external neutron fluxes by
surrounding them with neutron-reflective material.
","[{""version"":""v1"",""created"":""Sun, 19 Aug 2007 14:28:33 GMT""}]","2012-05-22"
"0708.2549","Christian Enz","Christian Enz","The scalar curvature flow in Lorentzian manifolds","Chapter 1 was replaced by reference due to text overlap. arXiv admin
  note: substantial text overlap with arXiv:math/0207054 by other authors",,,,"math.DG","http://arxiv.org/licenses/nonexclusive-distrib/1.0/","  We prove the existence of closed hypersurfaces of prescribed scalar curvature
in globally hyperbolic Lorentzian manifolds provided there are barriers.
","[{""version"":""v1"",""created"":""Sun, 19 Aug 2007 14:57:29 GMT""},{""version"":""v2"",""created"":""Thu, 25 Feb 2016 02:33:17 GMT""}]","2016-02-26"
"0708.2550","Simon Kimber Mr","S. A. J. Kimber, M. A. de Vries, J. Sanchez-Benitez, K. V. Kamenev, J.
  P. Attfield","Triplet Dimerization Crossover Driven by Magnetic Frustration in In2VO5","submitted for publication",,"10.1103/PhysRevB.77.014428",,"cond-mat.str-el",,"  In2VO5, containing magnetically frustrated zig-zag chains, shows a remarkable
magnetic crossover at 120 K between paramagnetic states with positive (17 K)
and negative (-70 K) Weiss temperatures. Magnetic moment and entropy data show
that the V4+ S = 1/2 spins condense into S = 1 triplet dimers below the
crossover. A further freezing of the antiferromagnetically coupled triplet
dimers into a global singlet state is observed at 2.5 K, with no long range
magnetic order down to 0.42 K and in fields up to 9 T. No structural V-V
dimerization is observed by high-resolution X-ray diffraction down to 10 K, but
a subtle lattice anomaly evidences a spin-lattice coupling in the triplet dimer
state. This is assigned to longitudinal oxygen displacement modes that reduce
frustration within the chains and so couple to the spin dimer fluctuations.
","[{""version"":""v1"",""created"":""Sun, 19 Aug 2007 15:25:54 GMT""}]","2009-11-13"
"0708.2653","Yury Bliokh P","Konstantin Y. Bliokh, Yuri P. Bliokh, Valentin Freilikher, Sergey
  Savel'ev, and Franco Nori","Unusual Resonators: Plasmonics, Metamaterials, and Random Media","13 pages, 9 figures","Rev. Mod. Phys. 80, 1201 (2008)","10.1103/RevModPhys.80.1201",,"physics.optics cond-mat.other physics.plasm-ph","http://arxiv.org/licenses/nonexclusive-distrib/1.0/","  Superresolution, extraordinary transmission, total absorption, and
localization of electromagnetic waves are currently attracting growing
attention. These phenomena are related to different physical objects and are
usually studied within the context of different, sometimes rather
sophisticated, physical approaches. Remarkably, all these seemingly unrelated
phenomena owe their origin to the same underlying physical mechanism - wave
interaction with an open resonator. Here we show that it is possible to
describe all of these effects in a unified way, mapping each system onto a
simple resonator model. Such description provides a thorough understanding of
the phenomena, explains all the main features of their complex behaviour, and
enables to control the system via the resonator parameters: eigenfrequencies,
Q-factors, and coupling coefficients.
","[{""version"":""v1"",""created"":""Sun, 19 Aug 2007 12:50:02 GMT""},{""version"":""v2"",""created"":""Thu, 7 Feb 2008 16:56:00 GMT""},{""version"":""v3"",""created"":""Mon, 13 Oct 2008 08:36:54 GMT""}]","2008-10-13"
"0708.2668","Daniel Reem","Daniel Reem, Simeon Reich","Zone and double zone diagrams in abstract spaces","17 pages, 5 figures; slight modifications and additions (including
  thanks); Theorem 5.5 was slightly improved. This version is essentially from
  the beginning of 2009 and it does not take into account several developments
  which have occurred since then","Colloquium Mathematicum 115 (2009), 129-145","10.4064/cm115-1-11",,"math.MG cs.CG math.CO","http://arxiv.org/licenses/nonexclusive-distrib/1.0/","  A zone diagram is a relatively new concept which was first defined and
studied by T. Asano, J. Matousek and T. Tokuyama. It can be interpreted as a
state of equilibrium between several mutually hostile kingdoms. Formally, it is
a fixed point of a certain mapping. These authors considered the Euclidean
plane and proved the existence and uniqueness of zone diagrams there. In the
present paper we generalize this concept in various ways. We consider general
sites in m-spaces (a simple generalization of metric spaces) and prove several
existence and (non)uniqueness results in this setting. In contrast to previous
works, our (rather simple) proofs are based on purely order theoretic
arguments. Many explicit examples are given, and some of them illustrate new
phenomena which occur in the general case. We also re-interpret zone diagrams
as a stable configuration in a certain combinatorial game, and provide an
algorithm for finding this configuration in a particular case.
","[{""version"":""v1"",""created"":""Sun, 19 Aug 2007 15:35:25 GMT""},{""version"":""v2"",""created"":""Mon, 25 Jul 2011 13:30:41 GMT""}]","2017-03-06"
